title,link,published,source,pub_date
From Magma Ocean to Core–Mantle Boundary: The Key Role of Hydrous Ferropericlase in Shaping Deep Earth’s Low-Velocity Anomalies,https://academic.oup.com/nsr/advance-article/doi/10.1093/nsr/nwag258/8666267?rss=1,2026-05-01 00:00:00 UTC,National Science Review Advance Access,2026-05-01 00:00:00+00:00
Breakthrough in 2D ultrahigh-κ dielectrics by paraelectric phase engineering in vdW crystal,https://academic.oup.com/nsr/advance-article/doi/10.1093/nsr/nwag240/8666269?rss=1,2026-05-01 00:00:00 UTC,National Science Review Advance Access,2026-05-01 00:00:00+00:00
Flapping vibrations contributed to heat insulation in Cs2ZnI4,https://academic.oup.com/nsr/advance-article/doi/10.1093/nsr/nwag256/8666273?rss=1,2026-05-01 00:00:00 UTC,National Science Review Advance Access,2026-05-01 00:00:00+00:00
Prestigious European science funder scraps stricter rules after researcher backlash,https://www.nature.com/articles/d41586-026-01435-6,2026-05-01 00:00:00 UTC,Nature,2026-05-01 00:00:00+00:00
This organoid can menstruate — and shows how tissue can repair itself,https://www.nature.com/articles/d41586-026-01428-5,2026-05-01 00:00:00 UTC,Nature,2026-05-01 00:00:00+00:00
European funder must increase capacity to meet the ambition of scientists,https://www.nature.com/articles/d41586-026-01411-0,2026-05-01 00:00:00 UTC,Nature,2026-05-01 00:00:00+00:00
The news is not all bad: five inspiring science stories to lift your mood,https://www.nature.com/articles/d41586-026-01290-5,2026-05-01 00:00:00 UTC,Nature,2026-05-01 00:00:00+00:00
Thin membranes with Cu-ion crosslinking for high temperature polymer electrolyte membrane fuel cells,https://www.nature.com/articles/s41560-026-02049-y,2026-05-01 00:00:00 UTC,Nature Energy,2026-05-01 00:00:00+00:00
"Photoelectrochemical flow conversion of water-insoluble, naturally abundant molecules into valuable chemicals",https://www.cell.com/joule/fulltext/S2542-4351(26)00123-6?rss=yes,2026-05-01 00:00:00 UTC,Joule,2026-05-01 00:00:00+00:00
An analytical model to describe self-discharge rates in solid-state batteries,https://www.nature.com/articles/s41560-026-02047-0,2026-05-01 00:00:00 UTC,Nature Energy,2026-05-01 00:00:00+00:00
The exotic particles that could finally break the Standard Model,https://www.nature.com/articles/d41586-026-01387-x,2026-05-01 00:00:00 UTC,Nature,2026-05-01 00:00:00+00:00
US faculty members report high levels of anxiety,https://www.nature.com/articles/d41586-026-01252-x,2026-05-01 00:00:00 UTC,Nature,2026-05-01 00:00:00+00:00
The imperfect legacy,https://www.nature.com/articles/d41586-026-01075-w,2026-05-01 00:00:00 UTC,Nature,2026-05-01 00:00:00+00:00
Briefing Chat: Stressed mitochondria spawn new 'organelles' in cells,https://www.nature.com/articles/d41586-026-01439-2,2026-05-01 00:00:00 UTC,Nature,2026-05-01 00:00:00+00:00
Author Correction: Titration of RAS alters senescent state and influences tumour initiation,https://www.nature.com/articles/s41586-026-10601-9,2026-05-01 00:00:00 UTC,Nature,2026-05-01 00:00:00+00:00
Field-resolved observation of exciton coherence in a van der Waals magnet,https://www.nature.com/articles/s41563-026-02598-3,2026-05-01 00:00:00 UTC,Nature Materials,2026-05-01 00:00:00+00:00
Interface effects unlock unusual superconductivity in a light-element superconductor,https://www.nature.com/articles/s41563-026-02605-7,2026-05-01 00:00:00 UTC,Nature Materials,2026-05-01 00:00:00+00:00
Pushing tunnel oxide passivating contact technology,https://www.nature.com/articles/s41560-026-02051-4,2026-05-01 00:00:00 UTC,Nature Energy,2026-05-01 00:00:00+00:00
Upcycling plant biomass into photosynthetic microspheres for diabetic wound healing,https://www.nature.com/articles/s41893-026-01810-1,2026-05-01 00:00:00 UTC,Nature Sustainability,2026-05-01 00:00:00+00:00
Newton’s law of gravity passes its biggest test ever,https://www.science.org/content/article/newton-s-law-gravity-passes-its-biggest-test-ever,2026-05-01 01:05:00 UTC,Latest News from Science Magazine,2026-05-01 01:05:00+00:00
Partnership targets ammonia bunker fuel before 2030 in the Port of Singapore,https://ammoniaenergy.org/articles/partnership-targets-ammonia-bunker-fuel-before-2030-in-the-port-of-singapore/,2026-05-01 05:03:44 UTC,Articles – Ammonia Energy Association,2026-05-01 05:03:44+00:00
Nonvolatile photonic field-programmable coupler array,https://www.science.org/doi/abs/10.1126/sciadv.aec7329?af=R,2026-05-01 07:00:00 UTC,AAAS: Science Advances: Table of Contents,2026-05-01 07:00:00+00:00
SkinECG: An orthogonal remote powering wearable skin-like sensor,https://www.science.org/doi/abs/10.1126/sciadv.aec9803?af=R,2026-05-01 07:00:00 UTC,AAAS: Science Advances: Table of Contents,2026-05-01 07:00:00+00:00
Nanopore-based sequencing of active DNA replication reveals key principles of metazoan replication dynamics,https://www.science.org/doi/abs/10.1126/sciadv.aed2806?af=R,2026-05-01 07:00:00 UTC,AAAS: Science Advances: Table of Contents,2026-05-01 07:00:00+00:00
LIPT1 loss confers replication stress and PARP inhibitor sensitivity through PrimPol-mediated ssDNA gaps,https://www.science.org/doi/abs/10.1126/sciadv.aed8013?af=R,2026-05-01 07:00:00 UTC,AAAS: Science Advances: Table of Contents,2026-05-01 07:00:00+00:00
Moonlight drives the energy balance and annual cycle of a nocturnal forager,https://www.science.org/doi/abs/10.1126/sciadv.aed8204?af=R,2026-05-01 07:00:00 UTC,AAAS: Science Advances: Table of Contents,2026-05-01 07:00:00+00:00
Accelerated discovery of highly stable ruthenium-based high-entropy oxides for acidic oxygen evolution,https://www.science.org/doi/abs/10.1126/sciadv.aed8479?af=R,2026-05-01 07:00:00 UTC,AAAS: Science Advances: Table of Contents,2026-05-01 07:00:00+00:00
In vitro liquid-liquid phase separation induced by respiratory syncytial virus proteins and RNA,https://www.science.org/doi/abs/10.1126/sciadv.aee2110?af=R,2026-05-01 07:00:00 UTC,AAAS: Science Advances: Table of Contents,2026-05-01 07:00:00+00:00
IMK2-IMK3 module regulates biogenesis of nascent cell walls and postcytokinetic differentiation in Arabidopsis thaliana,https://www.science.org/doi/abs/10.1126/sciadv.aea8387?af=R,2026-05-01 07:00:00 UTC,AAAS: Science Advances: Table of Contents,2026-05-01 07:00:00+00:00
Ultralong-living magnons in the quantum limit,https://www.science.org/doi/abs/10.1126/sciadv.aee2344?af=R,2026-05-01 07:00:00 UTC,AAAS: Science Advances: Table of Contents,2026-05-01 07:00:00+00:00
Precise borylation of targeted methyl group via an orderly chain-walking strategy,https://www.science.org/doi/abs/10.1126/sciadv.aed6913?af=R,2026-05-01 07:00:00 UTC,AAAS: Science Advances: Table of Contents,2026-05-01 07:00:00+00:00
Conformer-resolved ultrafast chemical dynamics observed at ambient temperature,https://www.science.org/doi/abs/10.1126/sciadv.aed8682?af=R,2026-05-01 07:00:00 UTC,AAAS: Science Advances: Table of Contents,2026-05-01 07:00:00+00:00
"Nanographenic bowls based on contorted hexabenzocoronene: Synthesis, structure, and supramolecular assembly with fullerene C60",https://www.science.org/doi/abs/10.1126/sciadv.aed5921?af=R,2026-05-01 07:00:00 UTC,AAAS: Science Advances: Table of Contents,2026-05-01 07:00:00+00:00
"An AI-driven, wearable, conformal ring system for real-time and user-independent sign language interpretation",https://www.science.org/doi/abs/10.1126/sciadv.aec8995?af=R,2026-05-01 07:00:00 UTC,AAAS: Science Advances: Table of Contents,2026-05-01 07:00:00+00:00
Cerium isotopes unveil hydrogenetic Fe-Mn encrustation occurring throughout from the oxygen minimum zone to the deep pacific,https://www.science.org/doi/abs/10.1126/sciadv.aee2813?af=R,2026-05-01 07:00:00 UTC,AAAS: Science Advances: Table of Contents,2026-05-01 07:00:00+00:00
Chronic stress disrupts hepatic homeostasis and accelerates liver cancer progression through ADRB2 signaling,https://www.science.org/doi/abs/10.1126/sciadv.aec0825?af=R,2026-05-01 07:00:00 UTC,AAAS: Science Advances: Table of Contents,2026-05-01 07:00:00+00:00
Ultra-narrowband perovskite single-crystal photodetector enabled by dynamic space charge region for portable concentration detection,https://www.science.org/doi/abs/10.1126/sciadv.adz9250?af=R,2026-05-01 07:00:00 UTC,AAAS: Science Advances: Table of Contents,2026-05-01 07:00:00+00:00
Aneuploidy confers environmentally robust higher evolvability than euploidy in a synthetic allotetraploid wheat,https://www.science.org/doi/abs/10.1126/sciadv.aec8789?af=R,2026-05-01 07:00:00 UTC,AAAS: Science Advances: Table of Contents,2026-05-01 07:00:00+00:00
Augmenting ultrasound for continuous glucose monitoring via a wearable acoustically readable microneedle patch,https://www.science.org/doi/abs/10.1126/sciadv.aec3209?af=R,2026-05-01 07:00:00 UTC,AAAS: Science Advances: Table of Contents,2026-05-01 07:00:00+00:00
"Ultrafast, nonblinking single-photon sources from perovskite quantum dots in plasmonic nanocavities",https://www.science.org/doi/abs/10.1126/sciadv.aec4380?af=R,2026-05-01 07:00:00 UTC,AAAS: Science Advances: Table of Contents,2026-05-01 07:00:00+00:00
Disparate social structures are underpinned by distinct social rules across a primate radiation,https://www.pnas.org/doi/abs/10.1073/pnas.2520774123?mi=eymic2&af=R&access=on&content=articlesChapters&publication=pnas&sortBy=Earliest&target=default,2026-05-01 07:00:00 UTC,Proceedings of the National Academy of Sciences: Keyword search for query,2026-05-01 07:00:00+00:00
An inverse correlation between structural linguistic and human genetic diversity,https://www.pnas.org/doi/abs/10.1073/pnas.2526762123?mi=eymic2&af=R&access=on&content=articlesChapters&publication=pnas&sortBy=Earliest&target=default,2026-05-01 07:00:00 UTC,Proceedings of the National Academy of Sciences: Keyword search for query,2026-05-01 07:00:00+00:00
Structural basis of iron piracy by human gut Bacteroides,https://www.pnas.org/doi/abs/10.1073/pnas.2528036123?mi=eymic2&af=R&access=on&content=articlesChapters&publication=pnas&sortBy=Earliest&target=default,2026-05-01 07:00:00 UTC,Proceedings of the National Academy of Sciences: Keyword search for query,2026-05-01 07:00:00+00:00
The evolution of trust under institutional moral hazard,https://www.pnas.org/doi/abs/10.1073/pnas.2530718123?mi=eymic2&af=R&access=on&content=articlesChapters&publication=pnas&sortBy=Earliest&target=default,2026-05-01 07:00:00 UTC,Proceedings of the National Academy of Sciences: Keyword search for query,2026-05-01 07:00:00+00:00
"Stable flapping flight in morphological space: Model, simulation, and explicit stability criteria",https://www.pnas.org/doi/abs/10.1073/pnas.2533138123?mi=eymic2&af=R&access=on&content=articlesChapters&publication=pnas&sortBy=Earliest&target=default,2026-05-01 07:00:00 UTC,Proceedings of the National Academy of Sciences: Keyword search for query,2026-05-01 07:00:00+00:00
Piezoelectric neuromodulation of the subthalamic nucleus ameliorates motor and nonmotor symptoms of Parkinson’s disease,https://www.science.org/doi/abs/10.1126/sciadv.aec6955?af=R,2026-05-01 07:00:00 UTC,AAAS: Science Advances: Table of Contents,2026-05-01 07:00:00+00:00
Cellular Feimin promotes cold-induced thermogenesis,https://www.pnas.org/doi/abs/10.1073/pnas.2534599123?mi=eymic2&af=R&access=on&content=articlesChapters&publication=pnas&sortBy=Earliest&target=default,2026-05-01 07:00:00 UTC,Proceedings of the National Academy of Sciences: Keyword search for query,2026-05-01 07:00:00+00:00
AR-targeted therapies sensitize prostate cancer to cuproptosis by transcriptionally activating FDX1,https://www.pnas.org/doi/abs/10.1073/pnas.2534978123?mi=eymic2&af=R&access=on&content=articlesChapters&publication=pnas&sortBy=Earliest&target=default,2026-05-01 07:00:00 UTC,Proceedings of the National Academy of Sciences: Keyword search for query,2026-05-01 07:00:00+00:00
Pervasive enhanced transcription in inflammatory breast cancer tumors and PBMCs impacts RNA splicing and intronic RNAs in plasma,https://www.science.org/doi/abs/10.1126/sciadv.adu0031?af=R,2026-05-01 07:00:00 UTC,AAAS: Science Advances: Table of Contents,2026-05-01 07:00:00+00:00
"Stress-induced CXCL13 regulates pancreatic exocrine homeostasis, age-related chronic inflammation, and cancer progression",https://www.science.org/doi/abs/10.1126/sciadv.adu7865?af=R,2026-05-01 07:00:00 UTC,AAAS: Science Advances: Table of Contents,2026-05-01 07:00:00+00:00
Importin-9 recognizes the winged-helix fold of ETS transcription factors to mediate nuclear import,https://www.pnas.org/doi/abs/10.1073/pnas.2536763123?mi=eymic2&af=R&access=on&content=articlesChapters&publication=pnas&sortBy=Earliest&target=default,2026-05-01 07:00:00 UTC,Proceedings of the National Academy of Sciences: Keyword search for query,2026-05-01 07:00:00+00:00
Spliceosomal mutation drives melanoma tumorigenesis via lineage-specific RAS activation,https://www.science.org/doi/abs/10.1126/sciadv.adz8289?af=R,2026-05-01 07:00:00 UTC,AAAS: Science Advances: Table of Contents,2026-05-01 07:00:00+00:00
HnRNP C binding to inverted Alu elements protects the transcriptome from pre-mRNA circularization,https://www.science.org/doi/abs/10.1126/sciadv.aea2351?af=R,2026-05-01 07:00:00 UTC,AAAS: Science Advances: Table of Contents,2026-05-01 07:00:00+00:00
A dynamic gateway: Uncovering the expanded human TOM complex interactome and its regulatory complexity,https://www.science.org/doi/abs/10.1126/sciadv.aeb2995?af=R,2026-05-01 07:00:00 UTC,AAAS: Science Advances: Table of Contents,2026-05-01 07:00:00+00:00
Attosecond high-harmonic interferometry probes orbital- and band-dependent dipole phase in magnesium oxide,https://www.science.org/doi/abs/10.1126/sciadv.aeb4109?af=R,2026-05-01 07:00:00 UTC,AAAS: Science Advances: Table of Contents,2026-05-01 07:00:00+00:00
Dynamic safe nitrogen boundary for maintaining surface water quality in China,https://www.science.org/doi/abs/10.1126/sciadv.aeb4368?af=R,2026-05-01 07:00:00 UTC,AAAS: Science Advances: Table of Contents,2026-05-01 07:00:00+00:00
Enhanced electrical conductivity at Fe3O4 grain boundaries,https://www.science.org/doi/abs/10.1126/sciadv.aeb8164?af=R,2026-05-01 07:00:00 UTC,AAAS: Science Advances: Table of Contents,2026-05-01 07:00:00+00:00
Wear in multiple network elastomers arises from the continuous accumulation of molecular damage rather than microcrack growth,https://www.science.org/doi/abs/10.1126/sciadv.aeb9858?af=R,2026-05-01 07:00:00 UTC,AAAS: Science Advances: Table of Contents,2026-05-01 07:00:00+00:00
TrkB/mGluR5 cross-talk underlies a synaptic metaplasticity mechanism of ketamine,https://www.science.org/doi/abs/10.1126/sciadv.aec1444?af=R,2026-05-01 07:00:00 UTC,AAAS: Science Advances: Table of Contents,2026-05-01 07:00:00+00:00
Extended nonradiative dipole-dipole energy transfer and spatiotemporal coherence enabled by bound states in the continuum,https://www.science.org/doi/abs/10.1126/sciadv.adx2005?af=R,2026-05-01 07:00:00 UTC,AAAS: Science Advances: Table of Contents,2026-05-01 07:00:00+00:00
Europe’s solar and storage development: Selectivity amid rising global supply and returning energy shocks,https://www.pv-magazine.com/2026/05/01/europes-solar-and-storage-development-selectivity-amid-rising-global-supply-and-returning-energy-shocks/,2026-05-01 07:30:25 UTC,Commercial & Industrial PV – pv magazine International,2026-05-01 07:30:25+00:00
"Electroreductive Radical C–C Acylation Coupling from N,N‐Dimethylamides and Organic Halides via Inert C(O)−N Bond Cleavage: Facile Access to Aryl Ketones",https://onlinelibrary.wiley.com/doi/10.1002/anie.8873247?af=R,2026-05-01 08:02:49 UTC,Wiley: Angewandte Chemie International Edition: Table of Contents,2026-05-01 08:02:49+00:00
Multidentate Chelation Modulates PbI2 Crystallization and Buried‐Interface Formation in Perovskite Solar Cells,https://onlinelibrary.wiley.com/doi/10.1002/anie.3088935?af=R,2026-05-01 08:05:10 UTC,Wiley: Angewandte Chemie International Edition: Table of Contents,2026-05-01 08:05:10+00:00
Radical‐Based On‐Surface Transformation of Nonplanar Aromatics Into Nonbenzenoid Nanographenes,https://onlinelibrary.wiley.com/doi/10.1002/anie.2457794?af=R,2026-05-01 08:08:10 UTC,Wiley: Angewandte Chemie International Edition: Table of Contents,2026-05-01 08:08:10+00:00
Correction to “Charge‐Driven Self‐Assembly of Cholesterol Surfactants into Biofunctional Nanodiscs with Antiviral Activity”,https://onlinelibrary.wiley.com/doi/10.1002/anie.7377549?af=R,2026-05-01 08:11:35 UTC,Wiley: Angewandte Chemie International Edition: Table of Contents,2026-05-01 08:11:35+00:00
β‐Ketoenamine Porous Organic Cage Membranes Through Hydrogel‐Induced Shielding for Efficient Ion Sieving,https://onlinelibrary.wiley.com/doi/10.1002/anie.7051685?af=R,2026-05-01 08:15:07 UTC,Wiley: Angewandte Chemie International Edition: Table of Contents,2026-05-01 08:15:07+00:00
Catalyst‐Controlled Chemodivergent Carbene Transfer Reactions With Bicyclo[1.1.0]butane‐Derived Acceptor Metallocarbenes,https://onlinelibrary.wiley.com/doi/10.1002/anie.9286701?af=R,2026-05-01 08:17:25 UTC,Wiley: Angewandte Chemie International Edition: Table of Contents,2026-05-01 08:17:25+00:00
Hexamethoxy Triazocoronene Based Covalent Organic Frameworks: A Family of Tailored Tools for Efficient Gold Recovery,https://onlinelibrary.wiley.com/doi/10.1002/anie.4681230?af=R,2026-05-01 08:35:32 UTC,Wiley: Angewandte Chemie International Edition: Table of Contents,2026-05-01 08:35:32+00:00
Decoding Carbon Dot Purity by Nuclear Magnetic Resonance,https://onlinelibrary.wiley.com/doi/10.1002/anie.6610061?af=R,2026-05-01 08:45:05 UTC,Wiley: Angewandte Chemie International Edition: Table of Contents,2026-05-01 08:45:05+00:00
A Polyurea‐Crosslinked Gel Polymer Electrolyte for Solvation and Interphase Regulation in Lithium Metal Batteries,https://onlinelibrary.wiley.com/doi/10.1002/anie.8382245?af=R,2026-05-01 08:47:19 UTC,Wiley: Angewandte Chemie International Edition: Table of Contents,2026-05-01 08:47:19+00:00
[ASAP] Size-Driven Kinetic Transitions and Strain Evolution in Bi Anode for K-Ion Batteries,http://dx.doi.org/10.1021/acsenergylett.6c00765,2026-05-01 08:53:13 UTC,ACS Energy Letters: Latest Articles (ACS Publications),2026-05-01 08:53:13+00:00
Structurally Constrained Stibenium: Metallomimetic C−Si Bond Activation,https://onlinelibrary.wiley.com/doi/10.1002/anie.3059944?af=R,2026-05-01 08:55:45 UTC,Wiley: Angewandte Chemie International Edition: Table of Contents,2026-05-01 08:55:45+00:00
Bimetallic Ni3Fe/Ni2Fe2N Catalyst With Optimized d‐Band Center for High‐Efficiency Lithium–Sulfur Batteries,https://onlinelibrary.wiley.com/doi/10.1002/anie.3609197?af=R,2026-05-01 08:59:17 UTC,Wiley: Angewandte Chemie International Edition: Table of Contents,2026-05-01 08:59:17+00:00
Interface‐Engineered Electron‐Deficient Nickel Species for Efficient Depolymerization of Polyethylene Terephthalate,https://onlinelibrary.wiley.com/doi/10.1002/anie.3378545?af=R,2026-05-01 09:03:42 UTC,Wiley: Angewandte Chemie International Edition: Table of Contents,2026-05-01 09:03:42+00:00
Ordered Ba2EuIrO6 Double Perovskite With Active Ir─Obri─Eu Unit for Enhanced Electrocatalytic Oxygen Evolution in PEMWE,https://onlinelibrary.wiley.com/doi/10.1002/anie.8724105?af=R,2026-05-01 09:04:40 UTC,Wiley: Angewandte Chemie International Edition: Table of Contents,2026-05-01 09:04:40+00:00
Breaking the Hypoxia Barrier: Supramolecular Nanoassemblies Empower Photodynamic Therapy of Tumors,https://onlinelibrary.wiley.com/doi/10.1002/anie.202525238?af=R,2026-05-01 09:05:30 UTC,Wiley: Angewandte Chemie International Edition: Table of Contents,2026-05-01 09:05:30+00:00
Modulating Intermediate Adsorption and Interfacial Water Structure to Unlock the Potential of Nickel for Ammonia Electrosynthesis and Zn‐NO3− Battery,https://onlinelibrary.wiley.com/doi/10.1002/anie.1281046?af=R,2026-05-01 09:07:28 UTC,Wiley: Angewandte Chemie International Edition: Table of Contents,2026-05-01 09:07:28+00:00
Controlled Interruption of Electrochemical Nitrite Reduction for Switchable NH2OH and Formamide Synthesis,https://onlinelibrary.wiley.com/doi/10.1002/anie.5328209?af=R,2026-05-01 09:07:31 UTC,Wiley: Angewandte Chemie International Edition: Table of Contents,2026-05-01 09:07:31+00:00
Lead‐Based Metal‐Organic‐Framework Engineering Enables the Efficiency of Pure‐Red Perovskite CsPbI3 Quantum Dot‐Based Light‐Emitting Diodes Exceeding 30%,https://onlinelibrary.wiley.com/doi/10.1002/anie.4373547?af=R,2026-05-01 09:09:08 UTC,Wiley: Angewandte Chemie International Edition: Table of Contents,2026-05-01 09:09:08+00:00
Merging Biocatalysis and Chemocatalysis in Flow: State‐of‐the‐Art and Future Directions for Sustainable Synthesis,https://onlinelibrary.wiley.com/doi/10.1002/anie.202511930?af=R,2026-05-01 09:10:28 UTC,Wiley: Angewandte Chemie International Edition: Table of Contents,2026-05-01 09:10:28+00:00
Probing Steady‐State Carrier Properties and Charge Transport in Covalent Organic Framework by Frequency‐Domain Terahertz Spectroscopy,https://onlinelibrary.wiley.com/doi/10.1002/anie.3669544?af=R,2026-05-01 09:11:51 UTC,Wiley: Angewandte Chemie International Edition: Table of Contents,2026-05-01 09:11:51+00:00
Ring‐Opening Arylation of Cyclic Diaryliodoniums via Cyclic Triaryliodanes as Aryne Precursors and Dynamic Aryl Reservoirs,https://onlinelibrary.wiley.com/doi/10.1002/anie.6935149?af=R,2026-05-01 09:11:55 UTC,Wiley: Angewandte Chemie International Edition: Table of Contents,2026-05-01 09:11:55+00:00
Anomeric‐Effect‐Guided Saturated Weakly Solvating Electrolytes for Ultrastable High‐Voltage Sodium Metal Batteries,https://onlinelibrary.wiley.com/doi/10.1002/anie.9963724?af=R,2026-05-01 09:14:27 UTC,Wiley: Angewandte Chemie International Edition: Table of Contents,2026-05-01 09:14:27+00:00
Electrolyte‐Replacement‐Free Continuous Electrocatalytic Desalination Coupled With CO2 Reduction at Record Throughput and Low Cost,https://onlinelibrary.wiley.com/doi/10.1002/anie.9124699?af=R,2026-05-01 10:08:58 UTC,Wiley: Angewandte Chemie International Edition: Table of Contents,2026-05-01 10:08:58+00:00
Bioinspired Light‐Scattering Structures for Passive Daytime Radiative Cooling,https://advanced.onlinelibrary.wiley.com/doi/10.1002/adma.73202?af=R,2026-05-01 10:10:17 UTC,Wiley: Advanced Materials: Table of Contents,2026-05-01 10:10:17+00:00
Reversible Dopant‐Induced Cross‐Linking of Semiconducting Polymer Films for Sequential Multilayer Deposition,https://advanced.onlinelibrary.wiley.com/doi/10.1002/adma.202520091?af=R,2026-05-01 10:10:21 UTC,Wiley: Advanced Materials: Table of Contents,2026-05-01 10:10:21+00:00
Non‐Engineered Physiologically Modulated Nanovesicles Augment Antitumor Immune Responses via Dual‐Pathway T Cell Activation,https://advanced.onlinelibrary.wiley.com/doi/10.1002/adma.73231?af=R,2026-05-01 10:12:45 UTC,Wiley: Advanced Materials: Table of Contents,2026-05-01 10:12:45+00:00
Pre‐Cluster Controlled Assembly of Oriented Mesopores in MOF Crystals,https://onlinelibrary.wiley.com/doi/10.1002/anie.202523592?af=R,2026-05-01 10:12:49 UTC,Wiley: Angewandte Chemie International Edition: Table of Contents,2026-05-01 10:12:49+00:00
Amorphous MoOx Interfaces Activate Pt Nanoclusters for Ultralow‐Overpotential Chlorine Evolution,https://onlinelibrary.wiley.com/doi/10.1002/anie.7262304?af=R,2026-05-01 10:12:51 UTC,Wiley: Angewandte Chemie International Edition: Table of Contents,2026-05-01 10:12:51+00:00
Deep-Earth map reveals a lost U.S. continent,https://www.science.org/content/article/deep-earth-map-reveals-lost-u-s-continent,2026-05-01 10:14:00 UTC,Latest News from Science Magazine,2026-05-01 10:14:00+00:00
Plasmonic Nanomachines: Creating Local Potential Gradients and Motions,https://advanced.onlinelibrary.wiley.com/doi/10.1002/adma.73247?af=R,2026-05-01 10:14:45 UTC,Wiley: Advanced Materials: Table of Contents,2026-05-01 10:14:45+00:00
Spiro‑Linked Double Tetraphenylethenes: Solid‐State Emission and Circularly Polarized Luminescence Imaging,https://onlinelibrary.wiley.com/doi/10.1002/anie.9945587?af=R,2026-05-01 10:15:40 UTC,Wiley: Angewandte Chemie International Edition: Table of Contents,2026-05-01 10:15:40+00:00
Edge‐Engineered Interfacial Carrier Dynamics for Efficient Photocatalytic Gold Recovery,https://onlinelibrary.wiley.com/doi/10.1002/anie.7275462?af=R,2026-05-01 10:17:10 UTC,Wiley: Angewandte Chemie International Edition: Table of Contents,2026-05-01 10:17:10+00:00
Stepwise Kinetics Promotion for High‐Rate Aqueous Zn Metal Batteries,https://onlinelibrary.wiley.com/doi/10.1002/anie.7507051?af=R,2026-05-01 10:17:52 UTC,Wiley: Angewandte Chemie International Edition: Table of Contents,2026-05-01 10:17:52+00:00
About the Role of Interfacial Lattice Oxygen in Pd─Pt Alloy for C─C Cleavage in Ethanol Electrooxidation,https://onlinelibrary.wiley.com/doi/10.1002/anie.6830451?af=R,2026-05-01 10:19:45 UTC,Wiley: Angewandte Chemie International Edition: Table of Contents,2026-05-01 10:19:45+00:00
Surface Oxide Species on Metal Cocatalysts Mediate Pathways in Water‐Oxidation‐Coupled CO2 Photoreduction: Insights From Pd,https://onlinelibrary.wiley.com/doi/10.1002/anie.1584513?af=R,2026-05-01 10:20:46 UTC,Wiley: Angewandte Chemie International Edition: Table of Contents,2026-05-01 10:20:46+00:00
Three‐Terminal Reconfigurable Volatile/Nonvolatile Light‐Emitting Memristor for Integrated Neuromorphic Display Systems,https://advanced.onlinelibrary.wiley.com/doi/10.1002/adma.73239?af=R,2026-05-01 10:21:30 UTC,Wiley: Advanced Materials: Table of Contents,2026-05-01 10:21:30+00:00
Mechanistic Insights Into Protonation of Imine‐Linked Covalent Organic Frameworks: The Correlations With Photocatalytic Processes and High‐Performance Hydrogen Evolution,https://onlinelibrary.wiley.com/doi/10.1002/anie.2088161?af=R,2026-05-01 10:24:09 UTC,Wiley: Angewandte Chemie International Edition: Table of Contents,2026-05-01 10:24:09+00:00
