title,link,published,source,pub_date
Author Correction: De novo design of quasisymmetric two-component protein cages,https://www.nature.com/articles/s41586-026-10763-6,2026-06-09 00:00:00 UTC,Nature,2026-06-09 00:00:00+00:00
Let’s talk about biomedical research kits,https://www.nature.com/articles/d41586-026-00799-z,2026-06-09 00:00:00 UTC,Nature,2026-06-09 00:00:00+00:00
"Don’t compete, collaborate: why collective funding applications are the future",https://www.nature.com/articles/d41586-026-01815-y,2026-06-09 00:00:00 UTC,Nature,2026-06-09 00:00:00+00:00
The best way to start your day? The science backs naked cartwheels in the sun,https://www.nature.com/articles/d41586-026-01822-z,2026-06-09 00:00:00 UTC,Nature,2026-06-09 00:00:00+00:00
"Scientists have a bad case of AI FOMO, Nature poll reveals",https://www.nature.com/articles/d41586-026-01690-7,2026-06-09 00:00:00 UTC,Nature,2026-06-09 00:00:00+00:00
TB vaccine from the 1920s shows promise in diabetes trial,https://www.nature.com/articles/d41586-026-01825-w,2026-06-09 00:00:00 UTC,Nature,2026-06-09 00:00:00+00:00
My overseas job offer was rescinded. Here’s how I bounced back,https://www.nature.com/articles/d41586-026-01234-z,2026-06-09 00:00:00 UTC,Nature,2026-06-09 00:00:00+00:00
People are turning to AI chatbots to plug gaps in health information,https://www.nature.com/articles/d41586-026-01737-9,2026-06-09 00:00:00 UTC,Nature,2026-06-09 00:00:00+00:00
Seven steps for critically analysing research papers,https://www.nature.com/articles/d41586-026-01209-0,2026-06-09 00:00:00 UTC,Nature,2026-06-09 00:00:00+00:00
Ancient ground squirrels feasted on carcasses like ‘zombies of the Pleistocene’,https://www.nature.com/articles/d41586-026-01840-x,2026-06-09 00:00:00 UTC,Nature,2026-06-09 00:00:00+00:00
How ice forms is a mystery — now scientists are cracking the case,https://www.nature.com/articles/d41586-026-01817-w,2026-06-09 00:00:00 UTC,Nature,2026-06-09 00:00:00+00:00
Self-evolving experimental platform for 3D sand printing,https://academic.oup.com/nsr/advance-article/doi/10.1093/nsr/nwag352/8704708?rss=1,2026-06-09 00:00:00 UTC,National Science Review Advance Access,2026-06-09 00:00:00+00:00
DexAnyTwist: Learning General Dexterous Twisting with Hybrid Manipulation System Identification,https://academic.oup.com/nsr/advance-article/doi/10.1093/nsr/nwag351/8704707?rss=1,2026-06-09 00:00:00 UTC,National Science Review Advance Access,2026-06-09 00:00:00+00:00
Face-on crystallization in ambipolar organic mixed conductors enables homogeneous light-modulated artificial neurons,https://academic.oup.com/nsr/advance-article/doi/10.1093/nsr/nwag341/8704706?rss=1,2026-06-09 00:00:00 UTC,National Science Review Advance Access,2026-06-09 00:00:00+00:00
Interface-induced built-in magnetic field boosted spin exchange interactions to enable high-efficiency oxygen electrocatalysis,https://www.cell.com/chem/fulltext/S2451-9294(26)00163-4?rss=yes,2026-06-09 00:00:00 UTC,Chem,2026-06-09 00:00:00+00:00
Daily briefing: Trial to ‘de-age’ cells treats first person,https://www.nature.com/articles/d41586-026-01861-6,2026-06-09 00:00:00 UTC,Nature,2026-06-09 00:00:00+00:00
World-first: therapy to make cells young again trialled in a person,https://www.nature.com/articles/d41586-026-01836-7,2026-06-09 00:00:00 UTC,Nature,2026-06-09 00:00:00+00:00
Good recycling starts at home — and benefits the world,https://www.nature.com/articles/d41586-026-01823-y,2026-06-09 00:00:00 UTC,Nature,2026-06-09 00:00:00+00:00
Preventing cancer requires more than a list of carcinogens,https://www.nature.com/articles/d41586-026-01847-4,2026-06-09 00:00:00 UTC,Nature,2026-06-09 00:00:00+00:00
Ocean ‘cold blob’ is evidence for a troubling climate trend,https://www.nature.com/articles/d41586-026-01826-9,2026-06-09 00:00:00 UTC,Nature,2026-06-09 00:00:00+00:00
Author Correction: A broadly protective antibody targeting gammaherpesvirus gB,https://www.nature.com/articles/s41586-026-10745-8,2026-06-09 00:00:00 UTC,Nature,2026-06-09 00:00:00+00:00
A unicellular relative links aggregative multicellularity to animal origins,https://www.nature.com/articles/s41586-026-10748-5,2026-06-09 00:00:00 UTC,Nature,2026-06-09 00:00:00+00:00
Direct evidence of metal–ligand redox processes in positive electrodes during lithium-based battery operation,https://www.nature.com/articles/s41565-026-02189-y,2026-06-09 00:00:00 UTC,Nature Nanotechnology,2026-06-09 00:00:00+00:00
Author Correction: PTC-bearing mRNA elicits a genetic compensation response via Upf3a and COMPASS components,https://www.nature.com/articles/s41586-026-10769-0,2026-06-09 00:00:00 UTC,Nature,2026-06-09 00:00:00+00:00
Author Correction: Stable tin–lead perovskite inks for efficient all-perovskite tandems,https://www.nature.com/articles/s41560-026-02097-4,2026-06-09 00:00:00 UTC,Nature Energy,2026-06-09 00:00:00+00:00
"AI technology must serve human cognitive development, not the other way around",https://www.nature.com/articles/d41586-026-01848-3,2026-06-09 00:00:00 UTC,Nature,2026-06-09 00:00:00+00:00
A treasure trove of Neolithic necklace beads,https://www.nature.com/articles/d41586-026-01810-3,2026-06-09 00:00:00 UTC,Nature,2026-06-09 00:00:00+00:00
Arson attacks at Ebola hospitals are a cry for regional development,https://www.nature.com/articles/d41586-026-01846-5,2026-06-09 00:00:00 UTC,Nature,2026-06-09 00:00:00+00:00
"Science must be seen as a viable profession for the many, not the few",https://www.nature.com/articles/d41586-026-01849-2,2026-06-09 00:00:00 UTC,Nature,2026-06-09 00:00:00+00:00
Positive Electrochemical Potentials Induce Enhanced Chemoselectivity and Activity in the Thermocatalytic Hydrogenation of 3‐Nitrostyrene,https://onlinelibrary.wiley.com/doi/10.1002/anie.5569475?af=R,2026-06-09 00:56:40 UTC,Wiley: Angewandte Chemie International Edition: Table of Contents,2026-06-09 00:56:40+00:00
Redirecting Excited‐State Proton Transfer Through Supramolecular Polymerization in Nanoconfinement,https://onlinelibrary.wiley.com/doi/10.1002/anie.7594145?af=R,2026-06-09 00:57:26 UTC,Wiley: Angewandte Chemie International Edition: Table of Contents,2026-06-09 00:57:26+00:00
"Single Crystals of Double‐Stranded, Entwined, Helical Metallopolymers With Hexanuclear Zirconium Knots Achieved by Linker Conformation Engineering",https://onlinelibrary.wiley.com/doi/10.1002/anie.7176356?af=R,2026-06-09 00:59:24 UTC,Wiley: Angewandte Chemie International Edition: Table of Contents,2026-06-09 00:59:24+00:00
Surface Chemical Disorder Engineering Enabled Superior Anion Redox for Li‐Rich Mn‐Based Cathode,https://onlinelibrary.wiley.com/doi/10.1002/anie.5515760?af=R,2026-06-09 01:00:11 UTC,Wiley: Angewandte Chemie International Edition: Table of Contents,2026-06-09 01:00:11+00:00
A Self–Cascade Nanozyme of Metformin–Stabilized Amorphous Iron Oxide With Ultrahigh Fe(II) for Potent Tumor Therapy at Ultralow Dose,https://onlinelibrary.wiley.com/doi/10.1002/anie.7061041?af=R,2026-06-09 01:01:30 UTC,Wiley: Angewandte Chemie International Edition: Table of Contents,2026-06-09 01:01:30+00:00
Fluorine‐Doped RuO2 Anchored on TiO2 via Proton‐Assisted Adsorption Evolution for Efficient and Stable Oxygen Evolution Reaction in Acid,https://onlinelibrary.wiley.com/doi/10.1002/anie.9750153?af=R,2026-06-09 01:02:53 UTC,Wiley: Angewandte Chemie International Edition: Table of Contents,2026-06-09 01:02:53+00:00
Conformationally Adaptive Crown Ether Embedded in a Metal Sulfide for Exceptional Strontium Capture,https://onlinelibrary.wiley.com/doi/10.1002/anie.9159294?af=R,2026-06-09 01:04:08 UTC,Wiley: Angewandte Chemie International Edition: Table of Contents,2026-06-09 01:04:08+00:00
"Modulating Ni‐O‐V Bridges in NiV‐Layered Double Hydroxides Microspheres for Robust Electrocatalytic Coupling of 1,5‐Pentanediol Oxidation and Nitrate Reduction",https://onlinelibrary.wiley.com/doi/10.1002/anie.5292155?af=R,2026-06-09 01:05:34 UTC,Wiley: Angewandte Chemie International Edition: Table of Contents,2026-06-09 01:05:34+00:00
Imine Linkage Isomerism in Layer‐Entangled Three‐Dimensional Covalent Organic Frameworks Modulates Fluorescent Sensing,https://onlinelibrary.wiley.com/doi/10.1002/anie.1228418?af=R,2026-06-09 01:07:05 UTC,Wiley: Angewandte Chemie International Edition: Table of Contents,2026-06-09 01:07:05+00:00
Entropy‐Stabilized Aluminate Catalysts That Break the Activity–Stability Tradeoff in CF4 Hydrolysis,https://onlinelibrary.wiley.com/doi/10.1002/anie.6752036?af=R,2026-06-09 01:08:52 UTC,Wiley: Angewandte Chemie International Edition: Table of Contents,2026-06-09 01:08:52+00:00
Steering Electron Transport in Intrinsically Piezoelectric Covalent Organic Frameworks for Efficient CO2 Reduction,https://onlinelibrary.wiley.com/doi/10.1002/anie.5538657?af=R,2026-06-09 01:08:56 UTC,Wiley: Angewandte Chemie International Edition: Table of Contents,2026-06-09 01:08:56+00:00
Steering CO2 Electroreduction to Methane via Secondary‐Sphere Noncovalent Interactions in NHC‐Protected Copper Clusters,https://onlinelibrary.wiley.com/doi/10.1002/anie.8098750?af=R,2026-06-09 01:09:40 UTC,Wiley: Angewandte Chemie International Edition: Table of Contents,2026-06-09 01:09:40+00:00
Promoting CO2 Conversion With Terminal Alkynes Over ZSM‐5 Zeolite‐Confined Uniform Ag Nanoparticles,https://onlinelibrary.wiley.com/doi/10.1002/anie.1541233?af=R,2026-06-09 01:11:36 UTC,Wiley: Angewandte Chemie International Edition: Table of Contents,2026-06-09 01:11:36+00:00
Post‐Translational Isoaspartate Promotes Amyloid Formation in β2‐Microglobulin,https://onlinelibrary.wiley.com/doi/10.1002/anie.7045464?af=R,2026-06-09 01:12:23 UTC,Wiley: Angewandte Chemie International Edition: Table of Contents,2026-06-09 01:12:23+00:00
"Precise Multi‐Site Borylation Engineering of Indolo[2,3‐c]Carbazole‐Bridged Narrowband MR‐TADF Emitters",https://onlinelibrary.wiley.com/doi/10.1002/anie.8856021?af=R,2026-06-09 01:15:11 UTC,Wiley: Angewandte Chemie International Edition: Table of Contents,2026-06-09 01:15:11+00:00
Canadian biologists decry plans to bypass environmental reviews for infrastructure projects,https://www.science.org/content/article/canadian-biologists-decry-plans-bypass-environmental-reviews-infrastructure-projects,2026-06-09 02:05:00 UTC,Latest News from Science Magazine,2026-06-09 02:05:00+00:00
Overcoming Interphase‐Dependent Li+ Transport via Tridentate Coordination Engineered Solvation Sheath,https://advanced.onlinelibrary.wiley.com/doi/10.1002/aenm.71169?af=R,2026-06-09 04:09:55 UTC,Wiley: Advanced Energy Materials: Table of Contents,2026-06-09 04:09:55+00:00
Regulating Li‐Ions Conduction of Eco‐Friendly Cellulose‐Based Composite Electrolytes via Amino‐Siloxane Functional Grafting for Sustainable Li‐Metal Batteries,https://advanced.onlinelibrary.wiley.com/doi/10.1002/aenm.71171?af=R,2026-06-09 04:11:26 UTC,Wiley: Advanced Energy Materials: Table of Contents,2026-06-09 04:11:26+00:00
Multiscale Active Site Modulation in Organic Heterojunction with Molecular‐Level Interfacial Contact for Efficient Photocatalytic Hydrogen Evolution,https://advanced.onlinelibrary.wiley.com/doi/10.1002/aenm.71172?af=R,2026-06-09 04:12:07 UTC,Wiley: Advanced Energy Materials: Table of Contents,2026-06-09 04:12:07+00:00
‘Working without them is painful’: WHO’s Ebola chief reflects on U.S. colleagues’ absence,https://www.science.org/content/article/working-without-them-painful-who-s-ebola-chief-reflects-u-s-colleagues-absence,2026-06-09 04:25:00 UTC,Latest News from Science Magazine,2026-06-09 04:25:00+00:00
"Recent Advances of Fiber‐Shaped Aqueous Zinc Ion Batteries: From Structure, Principles, Issues to Strategies",https://advanced.onlinelibrary.wiley.com/doi/10.1002/aenm.71175?af=R,2026-06-09 04:46:49 UTC,Wiley: Advanced Energy Materials: Table of Contents,2026-06-09 04:46:49+00:00
Organic Materials of Tomorrow: Horizons of Artificial Intelligence,https://advanced.onlinelibrary.wiley.com/doi/10.1002/adma.202523667?af=R,2026-06-09 06:05:24 UTC,Wiley: Advanced Materials: Table of Contents,2026-06-09 06:05:24+00:00
High‐Energy‐Facet‐Oriented Mesoporous Single‐Crystal Metal Oxides for Selective Oxidation Catalysis,https://advanced.onlinelibrary.wiley.com/doi/10.1002/adma.73641?af=R,2026-06-09 06:07:42 UTC,Wiley: Advanced Materials: Table of Contents,2026-06-09 06:07:42+00:00
Spin-state engineering of cobalt(IV)-oxo enables direct oxygen atom transfer for high-efficiency olefin epoxidation,https://www.pnas.org/doi/abs/10.1073/pnas.2537686123?mi=eymic2&af=R&access=on&content=articlesChapters&publication=pnas&sortBy=Earliest&target=default,2026-06-09 07:00:00 UTC,Proceedings of the National Academy of Sciences: Keyword search for query,2026-06-09 07:00:00+00:00
In This Issue,https://www.pnas.org/doi/abs/10.1073/iti2326123?mi=eymic2&af=R&access=on&content=articlesChapters&publication=pnas&sortBy=Earliest&target=default,2026-06-09 07:00:00 UTC,Proceedings of the National Academy of Sciences: Keyword search for query,2026-06-09 07:00:00+00:00
A GTP synthase ribozyme with increased GTP turnover,https://www.pnas.org/doi/abs/10.1073/pnas.2520997123?mi=eymic2&af=R&access=on&content=articlesChapters&publication=pnas&sortBy=Earliest&target=default,2026-06-09 07:00:00 UTC,Proceedings of the National Academy of Sciences: Keyword search for query,2026-06-09 07:00:00+00:00
G-protein regulatory network governs receptor internalization dynamics,https://www.pnas.org/doi/abs/10.1073/pnas.2524866123?mi=eymic2&af=R&access=on&content=articlesChapters&publication=pnas&sortBy=Earliest&target=default,2026-06-09 07:00:00 UTC,Proceedings of the National Academy of Sciences: Keyword search for query,2026-06-09 07:00:00+00:00
Mechanisms of ubiquitylation of the mitotic regulatory protein Cdc20,https://www.pnas.org/doi/abs/10.1073/pnas.2612003123?mi=eymic2&af=R&access=on&content=articlesChapters&publication=pnas&sortBy=Earliest&target=default,2026-06-09 07:00:00 UTC,Proceedings of the National Academy of Sciences: Keyword search for query,2026-06-09 07:00:00+00:00
Tuning bubble coalescence rates over orders of magnitude in liquid mixtures of simple surface thermodynamics: Experiments and theory,https://www.pnas.org/doi/abs/10.1073/pnas.2535299123?mi=eymic2&af=R&access=on&content=articlesChapters&publication=pnas&sortBy=Earliest&target=default,2026-06-09 07:00:00 UTC,Proceedings of the National Academy of Sciences: Keyword search for query,2026-06-09 07:00:00+00:00
Cognition does not automatically influence perception: Evidence from neural encoding of colors belonging to different categories,https://www.pnas.org/doi/abs/10.1073/pnas.2538139123?mi=eymic2&af=R&access=on&content=articlesChapters&publication=pnas&sortBy=Earliest&target=default,2026-06-09 07:00:00 UTC,Proceedings of the National Academy of Sciences: Keyword search for query,2026-06-09 07:00:00+00:00
Reply to González González et al.: The contribution of bacteria to kidney stone formation,https://www.pnas.org/doi/abs/10.1073/pnas.2609802123?mi=eymic2&af=R&access=on&content=articlesChapters&publication=pnas&sortBy=Earliest&target=default,2026-06-09 07:00:00 UTC,Proceedings of the National Academy of Sciences: Keyword search for query,2026-06-09 07:00:00+00:00
Void-X: A generative void-filling model for predicting atomic packing in proteins,https://www.pnas.org/doi/abs/10.1073/pnas.2607035123?mi=eymic2&af=R&access=on&content=articlesChapters&publication=pnas&sortBy=Earliest&target=default,2026-06-09 07:00:00 UTC,Proceedings of the National Academy of Sciences: Keyword search for query,2026-06-09 07:00:00+00:00
A polymerase ribozyme increases copying fidelity through pyrophosphate-mediated RNA repair,https://www.pnas.org/doi/abs/10.1073/pnas.2606892123?mi=eymic2&af=R&access=on&content=articlesChapters&publication=pnas&sortBy=Earliest&target=default,2026-06-09 07:00:00 UTC,Proceedings of the National Academy of Sciences: Keyword search for query,2026-06-09 07:00:00+00:00
Bacterial biofilms in calcium oxalate kidney stones: Where do we stand?,https://www.pnas.org/doi/abs/10.1073/pnas.2606646123?mi=eymic2&af=R&access=on&content=articlesChapters&publication=pnas&sortBy=Earliest&target=default,2026-06-09 07:00:00 UTC,Proceedings of the National Academy of Sciences: Keyword search for query,2026-06-09 07:00:00+00:00
Consecutive catalytic steps of viral RNA polymerase and exonuclease suggest a way to overcome intrinsic nucleotide analogue resistance,https://www.pnas.org/doi/abs/10.1073/pnas.2605725123?mi=eymic2&af=R&access=on&content=articlesChapters&publication=pnas&sortBy=Earliest&target=default,2026-06-09 07:00:00 UTC,Proceedings of the National Academy of Sciences: Keyword search for query,2026-06-09 07:00:00+00:00
Integrating trophic importance into conservation of terrestrial vertebrates,https://www.pnas.org/doi/abs/10.1073/pnas.2605237123?mi=eymic2&af=R&access=on&content=articlesChapters&publication=pnas&sortBy=Earliest&target=default,2026-06-09 07:00:00 UTC,Proceedings of the National Academy of Sciences: Keyword search for query,2026-06-09 07:00:00+00:00
Oxytocin selectively biases sensory–prefrontal communication through network-level suppression and theta coupling,https://www.pnas.org/doi/abs/10.1073/pnas.2603966123?mi=eymic2&af=R&access=on&content=articlesChapters&publication=pnas&sortBy=Earliest&target=default,2026-06-09 07:00:00 UTC,Proceedings of the National Academy of Sciences: Keyword search for query,2026-06-09 07:00:00+00:00
Full Vectorial Field Sensing Using Liquid Crystal Droplet Arrays,https://advanced.onlinelibrary.wiley.com/doi/10.1002/adma.73661?af=R,2026-06-09 07:00:00 UTC,Wiley: Advanced Materials: Table of Contents,2026-06-09 07:00:00+00:00
"The Campylobacter jejuni flagellar V-ring discerns viscosity levels to alter swimming velocity, metabolic gene expression, and fitness",https://www.pnas.org/doi/abs/10.1073/pnas.2603105123?mi=eymic2&af=R&access=on&content=articlesChapters&publication=pnas&sortBy=Earliest&target=default,2026-06-09 07:00:00 UTC,Proceedings of the National Academy of Sciences: Keyword search for query,2026-06-09 07:00:00+00:00
A fungal natural product that inhibits plant cellulose biosynthesis by disrupting cellulose synthase complexes,https://www.pnas.org/doi/abs/10.1073/pnas.2602575123?mi=eymic2&af=R&access=on&content=articlesChapters&publication=pnas&sortBy=Earliest&target=default,2026-06-09 07:00:00 UTC,Proceedings of the National Academy of Sciences: Keyword search for query,2026-06-09 07:00:00+00:00
Dual enhancement of superconductivity in FeSe/SrTiO3 via orbital and correlation synergy,https://www.pnas.org/doi/abs/10.1073/pnas.2602209123?mi=eymic2&af=R&access=on&content=articlesChapters&publication=pnas&sortBy=Earliest&target=default,2026-06-09 07:00:00 UTC,Proceedings of the National Academy of Sciences: Keyword search for query,2026-06-09 07:00:00+00:00
RNF126 is a peroxisomal fate switch enabling redifferentiation therapy in hepatocellular carcinoma,https://www.pnas.org/doi/abs/10.1073/pnas.2535777123?mi=eymic2&af=R&access=on&content=articlesChapters&publication=pnas&sortBy=Earliest&target=default,2026-06-09 07:00:00 UTC,Proceedings of the National Academy of Sciences: Keyword search for query,2026-06-09 07:00:00+00:00
Cryo-EM reveals a right-handed double-helix dimer architecture of PCDH15,https://www.pnas.org/doi/abs/10.1073/pnas.2607573123?mi=eymic2&af=R&access=on&content=articlesChapters&publication=pnas&sortBy=Earliest&target=default,2026-06-09 07:00:00 UTC,Proceedings of the National Academy of Sciences: Keyword search for query,2026-06-09 07:00:00+00:00
Risk prediction of Helicobacter pylori strains across Correa’s cascade via intelligent analysis of genome-wide SNPs,https://www.pnas.org/doi/abs/10.1073/pnas.2603926123?mi=eymic2&af=R&access=on&content=articlesChapters&publication=pnas&sortBy=Earliest&target=default,2026-06-09 07:00:00 UTC,Proceedings of the National Academy of Sciences: Keyword search for query,2026-06-09 07:00:00+00:00
How can you tell whether your dog is right-pawed or left-pawed?,https://www.science.org/content/article/how-can-you-tell-whether-your-dog-right-pawed-or-left-pawed,2026-06-09 07:01:00 UTC,Latest News from Science Magazine,2026-06-09 07:01:00+00:00
H2sea wins OMG-H2 engineering role,https://hydrogentechworld.com/h2sea-wins-omg-h2-engineering-role,2026-06-09 08:00:39 UTC,Hydrogen Tech World.com,2026-06-09 08:00:39+00:00
Highly Excited Electronic States of the Dicarbon Molecule: From Spectroscopy to Dynamics,https://advanced.onlinelibrary.wiley.com/doi/10.1002/adma.73631?af=R,2026-06-09 08:09:57 UTC,Wiley: Advanced Materials: Table of Contents,2026-06-09 08:09:57+00:00
Quantifying the Electrical Excitation Level of Quantum Dots for Mitigating Electroluminescent Efficiency Roll‐Off,https://advanced.onlinelibrary.wiley.com/doi/10.1002/adma.73638?af=R,2026-06-09 08:11:52 UTC,Wiley: Advanced Materials: Table of Contents,2026-06-09 08:11:52+00:00
Inverse Design of Amorphous Materials With Targeted Properties,https://advanced.onlinelibrary.wiley.com/doi/10.1002/adma.202522493?af=R,2026-06-09 08:13:47 UTC,Wiley: Advanced Materials: Table of Contents,2026-06-09 08:13:47+00:00
Engineering Silk Fibroin‐Based Biomaterials for Neural Repair,https://advanced.onlinelibrary.wiley.com/doi/10.1002/adma.73651?af=R,2026-06-09 08:16:16 UTC,Wiley: Advanced Materials: Table of Contents,2026-06-09 08:16:16+00:00
Correction to “Biomimetic Design of Artificial Hybrid Nanocells for Boosted Vascular Regeneration in Ischemic Tissues”,https://advanced.onlinelibrary.wiley.com/doi/10.1002/adma.73691?af=R,2026-06-09 08:17:25 UTC,Wiley: Advanced Materials: Table of Contents,2026-06-09 08:17:25+00:00
Programmable 3D Photovoltaics via Mechanically Origami‐Coded Interlocked 3D Kirigami and Nano‐Root Anchored AgNWs–In–Ga Multiphasic Alloy Conductor,https://advanced.onlinelibrary.wiley.com/doi/10.1002/adma.202523685?af=R,2026-06-09 08:18:37 UTC,Wiley: Advanced Materials: Table of Contents,2026-06-09 08:18:37+00:00
Step‐Edge Functionalization by N‐Heterocyclic Carbenes Enhances Catalytic Activity in Electrochemical CO2 Reduction,https://advanced.onlinelibrary.wiley.com/doi/10.1002/adma.73621?af=R,2026-06-09 08:19:14 UTC,Wiley: Advanced Materials: Table of Contents,2026-06-09 08:19:14+00:00
Reactivity of Gas‐Phase Metal Clusters: Unlocking Mechanisms of Activation and Conversion of Small Molecules,https://advanced.onlinelibrary.wiley.com/doi/10.1002/adma.73550?af=R,2026-06-09 08:20:37 UTC,Wiley: Advanced Materials: Table of Contents,2026-06-09 08:20:37+00:00
Dual‐Single‐Atom Catalyst with Aptamer‐Engineered Confined Reactive Milieu for Spatiotemporally Controlled Selective Conversion,https://advanced.onlinelibrary.wiley.com/doi/10.1002/adma.73645?af=R,2026-06-09 08:20:40 UTC,Wiley: Advanced Materials: Table of Contents,2026-06-09 08:20:40+00:00
"A Unified Polymer Hydrogel Electrolyte Integrating Robust Adhesion, Self‐Healing, and Oxygen Permeability in Flexible Neutral Zn‐Air Batteries",https://advanced.onlinelibrary.wiley.com/doi/10.1002/adma.73665?af=R,2026-06-09 08:22:22 UTC,Wiley: Advanced Materials: Table of Contents,2026-06-09 08:22:22+00:00
"ENGIE, European Energy sign Denmark hydrogen cooperation",https://hydrogentechworld.com/engie-european-energy-sign-denmark-hydrogen-cooperation,2026-06-09 09:45:49 UTC,Hydrogen Tech World.com,2026-06-09 09:45:49+00:00
Ion‐Selective Transport via Nanoconfined Differential Interfacial Friction in a Dielectric‐Engineered Covalent Organic Framework With Sectionalized Chemical Environments,https://advanced.onlinelibrary.wiley.com/doi/10.1002/adma.73670?af=R,2026-06-09 10:22:22 UTC,Wiley: Advanced Materials: Table of Contents,2026-06-09 10:22:22+00:00
Bubble Formation Control: Fabrication of Centimeter‐Sized Tissue‐Like Constructs by Catalase‐Coated Oxygen‐Releasing Hydrogel,https://advanced.onlinelibrary.wiley.com/doi/10.1002/adma.202523593?af=R,2026-06-09 10:26:55 UTC,Wiley: Advanced Materials: Table of Contents,2026-06-09 10:26:55+00:00
Inside Back Cover: Differential Adsorption of Functional Groups by Ru/Co Driving Tandem Catalysis: Converting Furanic Molecules into Linear Alcohols,https://onlinelibrary.wiley.com/doi/10.1002/anie.2026-m0306040100?af=R,2026-06-09 11:29:44 UTC,Wiley: Angewandte Chemie International Edition: Table of Contents,2026-06-09 11:29:44+00:00
Glutathione‐Induced In Situ Oxygen Vacancies in FeOOH Nanospindles for Boosting Sonocatalytic Tumor Therapy,https://onlinelibrary.wiley.com/doi/10.1002/anie.6524839?af=R,2026-06-09 11:32:06 UTC,Wiley: Angewandte Chemie International Edition: Table of Contents,2026-06-09 11:32:06+00:00
Cosolvent‐Modulated Supramolecular Chirality Unveils Pronounced Piezoelectric Response in Peptide‐Based Nanomaterials,https://onlinelibrary.wiley.com/doi/10.1002/anie.3135255?af=R,2026-06-09 11:34:26 UTC,Wiley: Angewandte Chemie International Edition: Table of Contents,2026-06-09 11:34:26+00:00
Reprogramming NAD(P)+‐Binding Proteins for Iminium Biocatalysis via a Synthetic NAD+‐Type Cofactor,https://onlinelibrary.wiley.com/doi/10.1002/anie.2116720?af=R,2026-06-09 11:35:12 UTC,Wiley: Angewandte Chemie International Edition: Table of Contents,2026-06-09 11:35:12+00:00
Redox Chemistry Enables Excellent Capacity and Ultra Long Life Aqueous Ammonium Ion Batteries,https://onlinelibrary.wiley.com/doi/10.1002/anie.6628239?af=R,2026-06-09 11:37:32 UTC,Wiley: Angewandte Chemie International Edition: Table of Contents,2026-06-09 11:37:32+00:00
Valency‐Controlled Multiphotochromism: Gated Switching and Photoswitchable Lewis Superacidity at Silicon,https://onlinelibrary.wiley.com/doi/10.1002/anie.2997357?af=R,2026-06-09 11:39:10 UTC,Wiley: Angewandte Chemie International Edition: Table of Contents,2026-06-09 11:39:10+00:00
