title,link,published,source,pub_date
USP25 inhibition ameliorates Parkinson’s disease by restoring mitophagy,https://www.pnas.org/doi/abs/10.1073/pnas.2516471123?mi=eymic2&af=R&access=on&content=articlesChapters&publication=pnas&sortBy=Earliest&target=default,2026-01-07 08:00:00 UTC,Proceedings of the National Academy of Sciences: Keyword search for query,2026-01-07 08:00:00+00:00
Gender stereotypes across nations relate to the social position of women and men: Evidence from cross-cultural public opinion polls,https://www.pnas.org/doi/abs/10.1073/pnas.2510180122?mi=eymic2&af=R&access=on&content=articlesChapters&publication=pnas&sortBy=Earliest&target=default,2026-01-07 08:00:00 UTC,Proceedings of the National Academy of Sciences: Keyword search for query,2026-01-07 08:00:00+00:00
Optimizing mRNA delivery with targeted elastin-like polypeptide–based LENN formulations: Insights into the endocytosis mechanism,https://www.pnas.org/doi/abs/10.1073/pnas.2502486122?mi=eymic2&af=R&access=on&content=articlesChapters&publication=pnas&sortBy=Earliest&target=default,2026-01-07 08:00:00 UTC,Proceedings of the National Academy of Sciences: Keyword search for query,2026-01-07 08:00:00+00:00
"Retraction for Mondal et al., IL-12 p40 monomer is different from other IL-12 family members to selectively inhibit IL-12Rβ1 internalization and suppress EAE",https://www.pnas.org/doi/abs/10.1073/pnas.2536022123?mi=eymic2&af=R&access=on&content=articlesChapters&publication=pnas&sortBy=Earliest&target=default,2026-01-07 08:00:00 UTC,Proceedings of the National Academy of Sciences: Keyword search for query,2026-01-07 08:00:00+00:00
"Correction to Supporting Information for Li et al., p53 deficiency induces MTHFD2 transcription to promote cell proliferation and restrain DNA damage",https://www.pnas.org/doi/abs/10.1073/pnas.2536995123?mi=eymic2&af=R&access=on&content=articlesChapters&publication=pnas&sortBy=Earliest&target=default,2026-01-07 08:00:00 UTC,Proceedings of the National Academy of Sciences: Keyword search for query,2026-01-07 08:00:00+00:00
Unintended consequences of well-intended interventions,https://www.pnas.org/doi/abs/10.1073/pnas.2533905122?mi=eymic2&af=R&access=on&content=articlesChapters&publication=pnas&sortBy=Earliest&target=default,2026-01-07 08:00:00 UTC,Proceedings of the National Academy of Sciences: Keyword search for query,2026-01-07 08:00:00+00:00
Forest loss intensifies meteorological drought in more than half of Earth’s climate zones,https://www.science.org/doi/abs/10.1126/sciadv.adv7998?af=R,2026-01-07 08:00:00 UTC,AAAS: Science Advances: Table of Contents,2026-01-07 08:00:00+00:00
ERα activates NAMPT/IL-33 signaling to enhance beige thermogenesis and metabolic fitness,https://www.science.org/doi/abs/10.1126/sciadv.adz1385?af=R,2026-01-07 08:00:00 UTC,AAAS: Science Advances: Table of Contents,2026-01-07 08:00:00+00:00
Control of airway basal stem cell–mediated lung repair by TGF-β signaling,https://www.science.org/doi/abs/10.1126/sciadv.adz1519?af=R,2026-01-07 08:00:00 UTC,AAAS: Science Advances: Table of Contents,2026-01-07 08:00:00+00:00
"Direct evidence for poison use on microlithic arrowheads in Southern Africa at 60,000 years ago",https://www.science.org/doi/abs/10.1126/sciadv.adz3281?af=R,2026-01-07 08:00:00 UTC,AAAS: Science Advances: Table of Contents,2026-01-07 08:00:00+00:00
An epidermal membrane-associated periodic skeleton restricts endocytosis to stabilize neuron-epidermal attachment and preserve axons,https://www.science.org/doi/abs/10.1126/sciadv.adz4762?af=R,2026-01-07 08:00:00 UTC,AAAS: Science Advances: Table of Contents,2026-01-07 08:00:00+00:00
Linear ubiquitination triggers Amph-mediated T-tubule biogenesis,https://www.science.org/doi/abs/10.1126/sciadv.ady4934?af=R,2026-01-07 08:00:00 UTC,AAAS: Science Advances: Table of Contents,2026-01-07 08:00:00+00:00
Abundance of microplastics and nanoplastics in urban atmosphere,https://www.science.org/doi/abs/10.1126/sciadv.adz7779?af=R,2026-01-07 08:00:00 UTC,AAAS: Science Advances: Table of Contents,2026-01-07 08:00:00+00:00
Allospecific splenic Tr1 cells drive effector T cell exhaustion through up-regulated Areg-EGFR signaling to promote transplant tolerance,https://www.science.org/doi/abs/10.1126/sciadv.aea0567?af=R,2026-01-07 08:00:00 UTC,AAAS: Science Advances: Table of Contents,2026-01-07 08:00:00+00:00
Scalable nanoconfined ionic liquid membranes with ultrapermeance and ultraselectivity for efficient CO2 capture,https://www.science.org/doi/abs/10.1126/sciadv.aea1329?af=R,2026-01-07 08:00:00 UTC,AAAS: Science Advances: Table of Contents,2026-01-07 08:00:00+00:00
"A general soft robotic controller inspired by neuronal structural and plastic synapses that adapts to diverse arms, tasks, and perturbations",https://www.science.org/doi/abs/10.1126/sciadv.aea3712?af=R,2026-01-07 08:00:00 UTC,AAAS: Science Advances: Table of Contents,2026-01-07 08:00:00+00:00
Mapping life’s disparity and evolutionary constraints in a geometric complexity space,https://www.science.org/doi/abs/10.1126/sciadv.aea6945?af=R,2026-01-07 08:00:00 UTC,AAAS: Science Advances: Table of Contents,2026-01-07 08:00:00+00:00
Bioinspired cross-medium wall-climbing robot with high-performance adhesion and contact adaptability,https://www.science.org/doi/abs/10.1126/sciadv.aea8014?af=R,2026-01-07 08:00:00 UTC,AAAS: Science Advances: Table of Contents,2026-01-07 08:00:00+00:00
"Arboviruses manipulate rice’s volatile emissions, protecting insect vectors from natural enemies in the field",https://www.science.org/doi/abs/10.1126/sciadv.aeb5215?af=R,2026-01-07 08:00:00 UTC,AAAS: Science Advances: Table of Contents,2026-01-07 08:00:00+00:00
CXCR5 identifies stem-like resident memory CD8⁺ T cells enriched for latent EBV specificity in tonsils,https://www.science.org/doi/abs/10.1126/sciadv.ady8316?af=R,2026-01-07 08:00:00 UTC,AAAS: Science Advances: Table of Contents,2026-01-07 08:00:00+00:00
Neural general circulation models for modeling precipitation,https://www.science.org/doi/abs/10.1126/sciadv.adv6891?af=R,2026-01-07 08:00:00 UTC,AAAS: Science Advances: Table of Contents,2026-01-07 08:00:00+00:00
First submillimeter lights from Dome A: Tracing the carbon cycle in the feedback of massive stars,https://www.science.org/doi/abs/10.1126/sciadv.aea9433?af=R,2026-01-07 08:00:00 UTC,AAAS: Science Advances: Table of Contents,2026-01-07 08:00:00+00:00
Independent origins of spicules reconcile paleontological and molecular evidence of sponge evolutionary history,https://www.science.org/doi/abs/10.1126/sciadv.adx1754?af=R,2026-01-07 08:00:00 UTC,AAAS: Science Advances: Table of Contents,2026-01-07 08:00:00+00:00
A new era of bioclimatic extremes in the terrestrial Arctic,https://www.science.org/doi/abs/10.1126/sciadv.adw5698?af=R,2026-01-07 08:00:00 UTC,AAAS: Science Advances: Table of Contents,2026-01-07 08:00:00+00:00
STING stimulation via supramolecular prodrug hydrogel boosts innate-adaptive immune cross-talk to prevent glioblastoma recurrence,https://www.science.org/doi/abs/10.1126/sciadv.adx9671?af=R,2026-01-07 08:00:00 UTC,AAAS: Science Advances: Table of Contents,2026-01-07 08:00:00+00:00
Nat10-mediated ac4C epitranscriptomics orchestrates hematopoietic stem/progenitor cell fate determination via translation control,https://www.science.org/doi/abs/10.1126/sciadv.ady0301?af=R,2026-01-07 08:00:00 UTC,AAAS: Science Advances: Table of Contents,2026-01-07 08:00:00+00:00
Combined effects of photorespiration and fire strongly regulate atmospheric oxygen levels,https://www.science.org/doi/abs/10.1126/sciadv.ady0542?af=R,2026-01-07 08:00:00 UTC,AAAS: Science Advances: Table of Contents,2026-01-07 08:00:00+00:00
Nectin-4 PET for predicting enfortumab vedotin dose-response in urothelial carcinoma,https://www.science.org/doi/abs/10.1126/sciadv.ady1111?af=R,2026-01-07 08:00:00 UTC,AAAS: Science Advances: Table of Contents,2026-01-07 08:00:00+00:00
Beyond averages: Why Arctic extremes matter,https://www.science.org/doi/abs/10.1126/sciadv.aee7980?af=R,2026-01-07 08:00:00 UTC,AAAS: Science Advances: Table of Contents,2026-01-07 08:00:00+00:00
A distinct subset of stem-cell memory is poised for the cytotoxicity program in CD4+ T cells in humans,https://www.science.org/doi/abs/10.1126/sciadv.ady6423?af=R,2026-01-07 08:00:00 UTC,AAAS: Science Advances: Table of Contents,2026-01-07 08:00:00+00:00
Quantitative modulation of a spatial enhancer through the biophysical properties of a transcription factor binding site,https://www.science.org/doi/abs/10.1126/sciadv.adz5902?af=R,2026-01-07 08:00:00 UTC,AAAS: Science Advances: Table of Contents,2026-01-07 08:00:00+00:00
Friction-driven scission: How nonlocal mechanisms contribute to membrane fission across domains of life,https://www.science.org/doi/abs/10.1126/sciadv.adz7607?af=R,2026-01-07 08:00:00 UTC,AAAS: Science Advances: Table of Contents,2026-01-07 08:00:00+00:00
Ultrapliable bioelectronic interface for mechanosensitive cardiac electrophysiology,https://www.science.org/doi/abs/10.1126/sciadv.adz1253?af=R,2026-01-07 08:00:00 UTC,AAAS: Science Advances: Table of Contents,2026-01-07 08:00:00+00:00
[ASAP] Anion Effect in Electrocatalysts for Oxygen Evolution Reaction and Small Organic Molecule Oxidation,http://dx.doi.org/10.1021/acsenergylett.5c04078,2026-01-07 10:40:21 UTC,ACS Energy Letters: Latest Articles (ACS Publications),2026-01-07 10:40:21+00:00
[ASAP] Click-Enabled Grafting for Adaptive Chiral Recognition in Porous Crystals,http://dx.doi.org/10.1021/jacs.5c17377,2026-01-07 11:11:18 UTC,Journal of the American Chemical Society: Latest Articles (ACS Publications),2026-01-07 11:11:18+00:00
[ASAP] Ultrastable Copper Superatom,http://dx.doi.org/10.1021/jacs.5c17976,2026-01-07 11:12:02 UTC,Journal of the American Chemical Society: Latest Articles (ACS Publications),2026-01-07 11:12:02+00:00
"Fossils point to common ancestor of modern humans, Neanderthals",https://www.science.org/content/article/fossils-point-common-ancestor-modern-humans-neanderthals,2026-01-07 11:25:00 UTC,Latest News from Science Magazine,2026-01-07 11:25:00+00:00
[ASAP] Detection of Epigenetically Important 5-Formylcytosine Modifications Using Novel Photoreactive Oligonucleotides Containing a Trioxsalen-Conjugated Guanosine,http://dx.doi.org/10.1021/jacs.5c11463,2026-01-07 11:48:40 UTC,Journal of the American Chemical Society: Latest Articles (ACS Publications),2026-01-07 11:48:40+00:00
Alzheimer’s drug developers accuse clinical trial sites of faking data,https://www.science.org/content/article/alzheimer-s-drug-developers-accuse-clinical-trial-sites-faking-data,2026-01-07 12:05:00 UTC,Latest News from Science Magazine,2026-01-07 12:05:00+00:00
[ASAP] Theory-Guided Discovery of Ion-Exchanged Poly(heptazine imide) Photocatalysts Using First-Principles Many-Body Perturbation Theory,http://dx.doi.org/10.1021/jacs.5c09930,2026-01-07 13:20:45 UTC,Journal of the American Chemical Society: Latest Articles (ACS Publications),2026-01-07 13:20:45+00:00
