title,link,published,source,pub_date
Bond Softening and Elastic Confinement of Monolithic Dense Binary Alloys for High Volumetric Capacity of K‐Ion Battery Anodes,https://onlinelibrary.wiley.com/doi/10.1002/anie.9686588?af=R,2026-05-01 14:14:48 UTC,Wiley: Angewandte Chemie International Edition: Table of Contents,2026-05-01 14:14:48+00:00
Interfacial Sites Engineering Minimizes Anodic Energy Loss Through Accelerated Deprotonation for High‐Efficiency Solar‐to‐Hydrogen Conversion,https://onlinelibrary.wiley.com/doi/10.1002/anie.9797893?af=R,2026-05-01 14:14:48 UTC,Wiley: Angewandte Chemie International Edition: Table of Contents,2026-05-01 14:14:48+00:00
A Free N‐Heterocyclic Carbene and Its Metal Complex,https://onlinelibrary.wiley.com/doi/10.1002/anie.202524266?af=R,2026-05-01 14:14:48 UTC,Wiley: Angewandte Chemie International Edition: Table of Contents,2026-05-01 14:14:48+00:00
The Isolated Thumb Domain of Acid‐Sensing Ion Channels Forms a Minimal Folding Unit Enabling Ligand Binding Studies,https://onlinelibrary.wiley.com/doi/10.1002/anie.202523977?af=R,2026-05-01 14:14:48 UTC,Wiley: Angewandte Chemie International Edition: Table of Contents,2026-05-01 14:14:48+00:00
Axial Sulfur‐Bridged Mo‐S‐Cu Nanozymes With an Asymmetric Local Electric Field Boosting Multi‐Enzymatic Activities for Ferroptosis‐Pyroptosis Therapy,https://onlinelibrary.wiley.com/doi/10.1002/anie.202523888?af=R,2026-05-01 14:14:48 UTC,Wiley: Angewandte Chemie International Edition: Table of Contents,2026-05-01 14:14:48+00:00
Fluorine Sustained‐Release Gel Polymer Electrolytes for High‐Energy‐Density and Wide‐Temperature Solid‐State Lithium Batteries,https://onlinelibrary.wiley.com/doi/10.1002/anie.202522407?af=R,2026-05-01 14:14:48 UTC,Wiley: Angewandte Chemie International Edition: Table of Contents,2026-05-01 14:14:48+00:00
Chemically Synthesized H3K14Ub Unveils Clr4's IDR‐Mediated Multivalent Nucleosome Recognition in H3K9 Methylation,https://onlinelibrary.wiley.com/doi/10.1002/anie.202520817?af=R,2026-05-01 14:14:48 UTC,Wiley: Angewandte Chemie International Edition: Table of Contents,2026-05-01 14:14:48+00:00
Nickel Single Atoms Reconfigured 3D COFs Boost H2O2 Photosynthesis,https://onlinelibrary.wiley.com/doi/10.1002/anie.202515814?af=R,2026-05-01 14:14:48 UTC,Wiley: Angewandte Chemie International Edition: Table of Contents,2026-05-01 14:14:48+00:00
An Organometallic [2]Catenane With Pt‒(di‐NHC)‒Pt Units: A Topology‐Driven Strategy for Enhanced Phosphorescence in Discrete Aggregates,https://onlinelibrary.wiley.com/doi/10.1002/anie.1981919?af=R,2026-05-01 14:14:48 UTC,Wiley: Angewandte Chemie International Edition: Table of Contents,2026-05-01 14:14:48+00:00
Healing Broken S─S Bonds via d‐p Orbital Coupling for Durable Magnesium Batteries,https://onlinelibrary.wiley.com/doi/10.1002/anie.1371160?af=R,2026-05-01 14:14:48 UTC,Wiley: Angewandte Chemie International Edition: Table of Contents,2026-05-01 14:14:48+00:00
"Synthesis, Functionalization, and Reactivity of Vinyl Sulfondiimidamides",https://onlinelibrary.wiley.com/doi/10.1002/anie.9885717?af=R,2026-05-01 14:14:48 UTC,Wiley: Angewandte Chemie International Edition: Table of Contents,2026-05-01 14:14:48+00:00
Harnessing Support‐Dependent Hydrogen Spillover for Ni‐Based CO2 Hydrogenation,https://onlinelibrary.wiley.com/doi/10.1002/anie.9657522?af=R,2026-05-01 14:14:48 UTC,Wiley: Angewandte Chemie International Edition: Table of Contents,2026-05-01 14:14:48+00:00
Tailoring Metal‐Support Interactions With Single‐Atom Polymer Coatings: A Universal Strategy for High‐Performance Catalysts,https://onlinelibrary.wiley.com/doi/10.1002/anie.9654585?af=R,2026-05-01 14:14:48 UTC,Wiley: Angewandte Chemie International Edition: Table of Contents,2026-05-01 14:14:48+00:00
"Stepwise Molecular Engineering Toward High‐Performance Deep‐Blue Narrowband OLEDs: Rigidity as the Foundation, Symmetry as the Key",https://onlinelibrary.wiley.com/doi/10.1002/anie.8770556?af=R,2026-05-01 14:14:48 UTC,Wiley: Angewandte Chemie International Edition: Table of Contents,2026-05-01 14:14:48+00:00
Ion‐Lock Storage With Multi‐Logic Circuitry Gated by Polar–Dipolar Interactions in Poly(Ionic Liquids),https://onlinelibrary.wiley.com/doi/10.1002/anie.7512063?af=R,2026-05-01 14:14:48 UTC,Wiley: Angewandte Chemie International Edition: Table of Contents,2026-05-01 14:14:48+00:00
Is this actually what Anne Boleyn looked like?,https://www.bbc.com/news/videos/c3d2e581k7do?at_medium=RSS&at_campaign=rss,2026-05-01 14:44:02 UTC,BBC News,2026-05-01 14:44:02+00:00
[ASAP] Enzymatic Access to Norstatines by PLP-Dependent Decarboxylative C–C Bond Formation Involved in Leuhistin Biosynthesis,http://dx.doi.org/10.1021/jacs.6c05214,2026-05-01 15:00:03 UTC,Journal of the American Chemical Society: Latest Articles (ACS Publications),2026-05-01 15:00:03+00:00
[ASAP] NGenE 2025: Electrochemistry for Energy Abundance,http://dx.doi.org/10.1021/acsenergylett.6c01050,2026-05-01 15:19:34 UTC,ACS Energy Letters: Latest Articles (ACS Publications),2026-05-01 15:19:34+00:00
[ASAP] Single-Crystalline 3D Covalent Organic Frameworks for One-Step Propylene Purification from a Propyne/Propylene/Propane Mixture,http://dx.doi.org/10.1021/jacs.6c02509,2026-05-01 16:21:16 UTC,Journal of the American Chemical Society: Latest Articles (ACS Publications),2026-05-01 16:21:16+00:00
[ASAP] Scope and Mechanism of Nickel-Isocyanide-Catalyzed Imine Hydrosilylation for ALD-Relevant Aminosilanes,http://dx.doi.org/10.1021/jacs.5c23403,2026-05-01 17:31:50 UTC,Journal of the American Chemical Society: Latest Articles (ACS Publications),2026-05-01 17:31:50+00:00
[ASAP] Enantioselective Contrathermodynamic Olefin Isomerization,http://dx.doi.org/10.1021/jacs.6c04825,2026-05-01 17:45:24 UTC,Journal of the American Chemical Society: Latest Articles (ACS Publications),2026-05-01 17:45:24+00:00
[ASAP] Temperature- and Pressure-Induced Ligand Anisotropy Drives Structural Reorganization of Dendronized Gold Nanoparticle Monolayers,http://dx.doi.org/10.1021/jacs.5c22437,2026-05-01 17:45:52 UTC,Journal of the American Chemical Society: Latest Articles (ACS Publications),2026-05-01 17:45:52+00:00
[ASAP] Asymmetric Synthesis of Tertiary Alkyl Boronates via Ligand-Controlled Enantioconvergent Homologation,http://dx.doi.org/10.1021/jacs.6c04941,2026-05-01 18:39:02 UTC,Journal of the American Chemical Society: Latest Articles (ACS Publications),2026-05-01 18:39:02+00:00
Is this the real face of Anne Boleyn?,https://www.bbc.com/news/articles/cp9pz53e891o?at_medium=RSS&at_campaign=rss,2026-05-01 23:01:44 UTC,BBC News,2026-05-01 23:01:44+00:00
Reconstructing magmatic histories with 3D diffusion modeling of complex crystals,https://www.nature.com/articles/s41467-026-72563-w,2026-05-02 00:00:00 UTC,Nature Communications,2026-05-02 00:00:00+00:00
Transversely pumped laser driven particle accelerator,https://www.nature.com/articles/s41467-026-72697-x,2026-05-02 00:00:00 UTC,Nature Communications,2026-05-02 00:00:00+00:00
"Synergistic Fe/Ni catalysis for electrochemical 1,1-difunctionalization of alkenes",https://www.nature.com/articles/s41467-026-72546-x,2026-05-02 00:00:00 UTC,Nature Communications,2026-05-02 00:00:00+00:00
A membrane-modulated chemoenzymatic dynamic kinetic resolution for the synthesis of chiral phthalidyl esters,https://www.nature.com/articles/s41467-026-72684-2,2026-05-02 00:00:00 UTC,Nature Communications,2026-05-02 00:00:00+00:00
"Swimming with robots: investigating fish locomotion, sensing, and schooling behavior with robotic swimmers",https://www.nature.com/articles/s41467-026-72478-6,2026-05-02 00:00:00 UTC,Nature Communications,2026-05-02 00:00:00+00:00
How ospreys were 'tricked' into breeding in Dorset,https://www.bbc.com/news/articles/c15d52y4dnwo?at_medium=RSS&at_campaign=rss,2026-05-02 06:21:27 UTC,BBC News,2026-05-02 06:21:27+00:00
Red squirrels 'close to extinction' in England,https://www.bbc.com/news/articles/cjwpd9d399wo?at_medium=RSS&at_campaign=rss,2026-05-02 06:25:56 UTC,BBC News,2026-05-02 06:25:56+00:00
Thousands of trees creating habitat 'powerhouses',https://www.bbc.com/news/articles/cdxprr5p18wo?at_medium=RSS&at_campaign=rss,2026-05-02 07:26:33 UTC,BBC News,2026-05-02 07:26:33+00:00
Sewage and agricultural pollution having 'alarming' impact on UK's underwater forests,https://www.bbc.com/news/articles/cn0pl9j88gno?at_medium=RSS&at_campaign=rss,2026-05-02 10:46:54 UTC,BBC News,2026-05-02 10:46:54+00:00
Dragonflies in distress: Scientists sound alarm in India's ecological hotspot,https://www.bbc.com/news/articles/cx2107kzyreo?at_medium=RSS&at_campaign=rss,2026-05-02 22:13:11 UTC,BBC News,2026-05-02 22:13:11+00:00
'Mournes could take centuries to recover from wildfires',https://www.bbc.com/news/articles/cevpy8r2e22o?at_medium=RSS&at_campaign=rss,2026-05-02 23:01:57 UTC,BBC News,2026-05-02 23:01:57+00:00
