title,link,published,source,pub_date
"Harnessing Photons for Trifold Output: Chromic, Luminescent, and Mechanical Transformations in a Smart Material",https://onlinelibrary.wiley.com/doi/10.1002/anie.3029493?af=R,2026-07-17 07:27:46 UTC,Wiley: Angewandte Chemie International Edition: Table of Contents,2026-07-17 07:27:46+00:00
Interface Local‐Alkalinity Engineering for Enhanced Dehydrogenation Catalysis in Neutral Media,https://onlinelibrary.wiley.com/doi/10.1002/anie.7897749?af=R,2026-07-17 07:29:30 UTC,Wiley: Angewandte Chemie International Edition: Table of Contents,2026-07-17 07:29:30+00:00
Aqueous Cascade Synthesis of Robust Dual‐Linkage Covalent Organic Frameworks for Efficient Hydrogen and Oxygen Evolution at an Industrial‐Level Current Density,https://onlinelibrary.wiley.com/doi/10.1002/anie.8042334?af=R,2026-07-17 07:31:20 UTC,Wiley: Angewandte Chemie International Edition: Table of Contents,2026-07-17 07:31:20+00:00
Glutathione‐Responsive Acyl‐Modifications for Targeted RNA Decaging and Prolonged Protein Synthesis,https://onlinelibrary.wiley.com/doi/10.1002/anie.8835235?af=R,2026-07-17 07:33:36 UTC,Wiley: Angewandte Chemie International Edition: Table of Contents,2026-07-17 07:33:36+00:00
Microenvironment Engineering as a Design Principle for Suppressing Catalyst Metal Loss,https://onlinelibrary.wiley.com/doi/10.1002/anie.3661635?af=R,2026-07-17 07:34:23 UTC,Wiley: Angewandte Chemie International Edition: Table of Contents,2026-07-17 07:34:23+00:00
Endogenous Redox‐Sensitive UV Absorbers Enable Efficient and Stable Full Air‐Processed Perovskite Solar Cells,https://onlinelibrary.wiley.com/doi/10.1002/anie.4177367?af=R,2026-07-17 07:39:58 UTC,Wiley: Angewandte Chemie International Edition: Table of Contents,2026-07-17 07:39:58+00:00
Buckling‐Induced Angular‐Switchable Diffraction Images on Polyurethane Film for Optical Encryption and Anti‐Counterfeiting,https://advanced.onlinelibrary.wiley.com/doi/10.1002/adma.74145?af=R,2026-07-17 08:12:47 UTC,Wiley: Advanced Materials: Table of Contents,2026-07-17 08:12:47+00:00
Unlocking Phthalonitrile‐Based Type I Photosensitizer Through D‐A Modulation to Promote Electron Transfer,https://advanced.onlinelibrary.wiley.com/doi/10.1002/adma.74143?af=R,2026-07-17 08:20:55 UTC,Wiley: Advanced Materials: Table of Contents,2026-07-17 08:20:55+00:00
Macro‐Superlubricity Induced by Synergistic Effect of Molybdenum Carbide/Molybdenum Disulfide Heterojunction and Conformation‐Transformable Ethylene Glycol Molecule,https://advanced.onlinelibrary.wiley.com/doi/10.1002/adma.74061?af=R,2026-07-17 08:24:30 UTC,Wiley: Advanced Materials: Table of Contents,2026-07-17 08:24:30+00:00
Operation Limits of Integrated Photo‐Rechargeable Batteries,https://advanced.onlinelibrary.wiley.com/doi/10.1002/adma.74159?af=R,2026-07-17 08:29:03 UTC,Wiley: Advanced Materials: Table of Contents,2026-07-17 08:29:03+00:00
Emaldo deal lets home batteries tap Sweden’s flexibility markets,https://www.ess-news.com/2026/07/17/__trashed/,2026-07-17 08:30:00 UTC,Latest news about ESS Projects & Applications | ESS News,2026-07-17 08:30:00+00:00
"Solaer plans 197 MW of solar, 500 MWh of battery storage for data center in Chile",https://www.ess-news.com/2026/07/17/solaer-plans-197-mw-of-solar-500-mwh-of-battery-storage-for-data-center-in-chile/,2026-07-17 09:00:00 UTC,Latest news about ESS Projects & Applications | ESS News,2026-07-17 09:00:00+00:00
River work to help critically endangered eels,https://www.bbc.co.uk/news/articles/c0km4p2zx7yo?at_medium=RSS&at_campaign=rss,2026-07-17 09:53:34 UTC,BBC News,2026-07-17 09:53:34+00:00
The Water Behavior Chain: A Unified Framework for Solar Interfacial Evaporation,https://advanced.onlinelibrary.wiley.com/doi/10.1002/adma.74055?af=R,2026-07-17 09:54:24 UTC,Wiley: Advanced Materials: Table of Contents,2026-07-17 09:54:24+00:00
Breaking the Energy Cascades: Stage‐Specific Mitigation of Thermal Runaway Propagation in Lithium‐Ion Battery Systems,https://advanced.onlinelibrary.wiley.com/doi/10.1002/aenm.71302?af=R,2026-07-17 09:56:45 UTC,Wiley: Advanced Energy Materials: Table of Contents,2026-07-17 09:56:45+00:00
A Six‐Layer Cascaded Electrocaloric Cooling Device With Large Temperature Span,https://advanced.onlinelibrary.wiley.com/doi/10.1002/aenm.71318?af=R,2026-07-17 10:01:24 UTC,Wiley: Advanced Energy Materials: Table of Contents,2026-07-17 10:01:24+00:00
Weakening Ion Transport Anisotropy Activates Superionic Conduction in Li2ZrCl6,https://advanced.onlinelibrary.wiley.com/doi/10.1002/aenm.71308?af=R,2026-07-17 10:02:38 UTC,Wiley: Advanced Energy Materials: Table of Contents,2026-07-17 10:02:38+00:00
Synergistic Static and Dynamic Interfacial Regulation Toward Robust Zinc Batteries,https://advanced.onlinelibrary.wiley.com/doi/10.1002/adma.74109?af=R,2026-07-17 10:07:00 UTC,Wiley: Advanced Materials: Table of Contents,2026-07-17 10:07:00+00:00
Electrically Coded Retinomorphic Spectrophotodetector,https://advanced.onlinelibrary.wiley.com/doi/10.1002/adma.74160?af=R,2026-07-17 10:10:00 UTC,Wiley: Advanced Materials: Table of Contents,2026-07-17 10:10:00+00:00
Transparency‐Photothermal Efficiency Coordinated Dual‐Invisible Soft Robots,https://advanced.onlinelibrary.wiley.com/doi/10.1002/adma.74147?af=R,2026-07-17 10:31:25 UTC,Wiley: Advanced Materials: Table of Contents,2026-07-17 10:31:25+00:00
Self‐Limiting Ultrathin Heterocycle‐Bridged Interface Enabling Efficient p–i–n PbS Quantum Dot Solar Cells,https://advanced.onlinelibrary.wiley.com/doi/10.1002/adma.74170?af=R,2026-07-17 10:47:17 UTC,Wiley: Advanced Materials: Table of Contents,2026-07-17 10:47:17+00:00
'Cheeky' pigs restore heathland on island reserve,https://www.bbc.co.uk/news/articles/cly9z8xpj4jo?at_medium=RSS&at_campaign=rss,2026-07-17 10:51:23 UTC,BBC News,2026-07-17 10:51:23+00:00
Orbital and Spin Edelstein Effects in KTaO3(110) Two‐Dimensional Electron Gases,https://advanced.onlinelibrary.wiley.com/doi/10.1002/adma.73899?af=R,2026-07-17 11:09:10 UTC,Wiley: Advanced Materials: Table of Contents,2026-07-17 11:09:10+00:00
Chessboard Microneedle Array for Inflammation Regulation via Spatiotemporally Controlled Drug Delivery,https://advanced.onlinelibrary.wiley.com/doi/10.1002/adma.74168?af=R,2026-07-17 11:10:55 UTC,Wiley: Advanced Materials: Table of Contents,2026-07-17 11:10:55+00:00
Hierarchical Assembly of Multilayer Core–Shell DNA Origami Crystals,https://advanced.onlinelibrary.wiley.com/doi/10.1002/adma.74163?af=R,2026-07-17 11:13:51 UTC,Wiley: Advanced Materials: Table of Contents,2026-07-17 11:13:51+00:00
Upcycling of Silicone Rubber into Value‐Added Polyborosiloxane via Boron‐Assisted Mechanochemistry,https://advanced.onlinelibrary.wiley.com/doi/10.1002/adma.74158?af=R,2026-07-17 11:14:40 UTC,Wiley: Advanced Materials: Table of Contents,2026-07-17 11:14:40+00:00
21.26% Efficiency Organic Solar Cells Enabled by Mixed Self‐Assembled Multilayers,https://advanced.onlinelibrary.wiley.com/doi/10.1002/adma.74193?af=R,2026-07-17 11:26:30 UTC,Wiley: Advanced Materials: Table of Contents,2026-07-17 11:26:30+00:00
Too hot to fly: the airports at risk from climate change,https://www.bbc.co.uk/news/videos/cly5vw5xdz8o?at_medium=RSS&at_campaign=rss,2026-07-17 11:31:17 UTC,BBC News,2026-07-17 11:31:17+00:00
Longest dry spell in 30 years for parts of England as heatwave hits two-week mark,https://www.bbc.co.uk/weather/articles/ckg4gqlye02o?at_medium=RSS&at_campaign=rss,2026-07-17 11:58:03 UTC,BBC News,2026-07-17 11:58:03+00:00
Sonnedix acquires 260 MW battery storage portfolio in Italy,https://www.ess-news.com/2026/07/17/sonnedix-acquires-260-mw-battery-storage-portfolio-in-italy/,2026-07-17 12:00:00 UTC,Latest news about ESS Projects & Applications | ESS News,2026-07-17 12:00:00+00:00
Emissive BN‐Embedded Cumulenes: Synthesis and Bidirectional Photocurrent Modulation,https://onlinelibrary.wiley.com/doi/10.1002/anie.7973657?af=R,2026-07-17 12:12:17 UTC,Wiley: Angewandte Chemie International Edition: Table of Contents,2026-07-17 12:12:17+00:00
Encoding and Encryption via Dual‐Wavelength 3D Digital Light Processing,https://onlinelibrary.wiley.com/doi/10.1002/anie.1978756?af=R,2026-07-17 12:14:46 UTC,Wiley: Angewandte Chemie International Edition: Table of Contents,2026-07-17 12:14:46+00:00
A Chemically Fueled Logic Gate With Temporally Programmable Output Delays by Harnessing Transient States of One Molecule in Two Independent Reaction Pathways,https://onlinelibrary.wiley.com/doi/10.1002/anie.5439859?af=R,2026-07-17 12:15:42 UTC,Wiley: Angewandte Chemie International Edition: Table of Contents,2026-07-17 12:15:42+00:00
Protonation‐Gated Orthogonal Control of Highly Efficient Molecular Motors With Broad Visible‐Light Responsiveness,https://onlinelibrary.wiley.com/doi/10.1002/anie.4214875?af=R,2026-07-17 12:17:33 UTC,Wiley: Angewandte Chemie International Edition: Table of Contents,2026-07-17 12:17:33+00:00
Andrej Emanuel Cotman,https://onlinelibrary.wiley.com/doi/10.1002/anie.6798392?af=R,2026-07-17 12:19:53 UTC,Wiley: Angewandte Chemie International Edition: Table of Contents,2026-07-17 12:19:53+00:00
"Reactant‐Sustained Dynamically Stable Interfacial Hydrogen‐Bond Network for Highly Selective, Ampere‐Level Ethylene Glycol Electrooxidation",https://onlinelibrary.wiley.com/doi/10.1002/anie.7083269?af=R,2026-07-17 12:19:58 UTC,Wiley: Angewandte Chemie International Edition: Table of Contents,2026-07-17 12:19:58+00:00
Theoretical Screening and Structural Optimization of High‐Performing Li2S/Alkaline‐Earth Metal Sulfides Cathodes for Advanced Anode‐Free Li−S Batteries,https://onlinelibrary.wiley.com/doi/10.1002/anie.7062131?af=R,2026-07-17 12:22:11 UTC,Wiley: Angewandte Chemie International Edition: Table of Contents,2026-07-17 12:22:11+00:00
Engineered Substrates for a Sulfurtransferase Enhance Endogenous Hydropersulfides and Inhibit Ferroptosis,https://onlinelibrary.wiley.com/doi/10.1002/anie.4893359?af=R,2026-07-17 12:23:42 UTC,Wiley: Angewandte Chemie International Edition: Table of Contents,2026-07-17 12:23:42+00:00
Work‐Function‐Modulated Ag Single‐Atom Catalysts for Amino Alcohol Oxidation,https://onlinelibrary.wiley.com/doi/10.1002/anie.5510018?af=R,2026-07-17 12:32:59 UTC,Wiley: Angewandte Chemie International Edition: Table of Contents,2026-07-17 12:32:59+00:00
Ultrathin Aluminum–Air Batteries via Hygroscopic Electrolytes for Continuous Operation of Imperceptible On‐Skin Electronics,https://advanced.onlinelibrary.wiley.com/doi/10.1002/aenm.71309?af=R,2026-07-17 12:44:31 UTC,Wiley: Advanced Energy Materials: Table of Contents,2026-07-17 12:44:31+00:00
Spain adds 1.76 GW of battery storage projects in Q2,https://www.ess-news.com/2026/07/17/spain-adds-1-76-gw-of-battery-storage-projects-in-q2/,2026-07-17 12:45:00 UTC,Latest news about ESS Projects & Applications | ESS News,2026-07-17 12:45:00+00:00
A Large Scale Multi‐Modal Workflow for Battery Characterization: From Concept to Implementation,https://advanced.onlinelibrary.wiley.com/doi/10.1002/aenm.71288?af=R,2026-07-17 12:45:27 UTC,Wiley: Advanced Energy Materials: Table of Contents,2026-07-17 12:45:27+00:00
Site‐Specific d‐Band Center Engineering With Gallium Enabling Efficient and Durable Hydrogen Evolution From Seawater,https://advanced.onlinelibrary.wiley.com/doi/10.1002/aenm.71310?af=R,2026-07-17 12:47:36 UTC,Wiley: Advanced Energy Materials: Table of Contents,2026-07-17 12:47:36+00:00
Electrochemically Driven Refrigeration Based on Dissolution–Crystallization Cycle of Redox‐Active Salts,https://advanced.onlinelibrary.wiley.com/doi/10.1002/aenm.71304?af=R,2026-07-17 12:48:10 UTC,Wiley: Advanced Energy Materials: Table of Contents,2026-07-17 12:48:10+00:00
Functional Hydrogel Coatings for Medical Devices: Recent Developments and Biomedical Applications,https://advanced.onlinelibrary.wiley.com/doi/10.1002/adma.74021?af=R,2026-07-17 12:55:36 UTC,Wiley: Advanced Materials: Table of Contents,2026-07-17 12:55:36+00:00
Correction to “Mitochondria‐Targeted Nanomotor: H2S‐Driven Cascade Therapy for Hepatocellular Carcinoma”,https://advanced.onlinelibrary.wiley.com/doi/10.1002/adma.74114?af=R,2026-07-17 12:58:09 UTC,Wiley: Advanced Materials: Table of Contents,2026-07-17 12:58:09+00:00
First atmosphere found on Earth-like planet in habitable zone of distant star,https://www.bbc.co.uk/news/articles/cy4kdd1e0ejo?at_medium=RSS&at_campaign=rss,2026-07-17 12:58:37 UTC,BBC News,2026-07-17 12:58:37+00:00
High Spin Manganese Boosting Photo‐Magnetic Catalytic Hydrogen Evolution Over Covalent Organic Frameworks,https://advanced.onlinelibrary.wiley.com/doi/10.1002/adma.74205?af=R,2026-07-17 13:19:45 UTC,Wiley: Advanced Materials: Table of Contents,2026-07-17 13:19:45+00:00
Reversible Thermoactuation Unlocks Minimally Invasive Implantation and Retrieval of Soft Bioelectronics,https://advanced.onlinelibrary.wiley.com/doi/10.1002/adma.73685?af=R,2026-07-17 13:23:16 UTC,Wiley: Advanced Materials: Table of Contents,2026-07-17 13:23:16+00:00
Molecularly Confined Domains Enable Halide‐Stable Wide‐Bandgap Perovskites,https://advanced.onlinelibrary.wiley.com/doi/10.1002/adma.73713?af=R,2026-07-17 13:23:16 UTC,Wiley: Advanced Materials: Table of Contents,2026-07-17 13:23:16+00:00
Optically Programmable GST Metasurface for Coded Terahertz Wavefront Control,https://advanced.onlinelibrary.wiley.com/doi/10.1002/adma.73683?af=R,2026-07-17 13:23:16 UTC,Wiley: Advanced Materials: Table of Contents,2026-07-17 13:23:16+00:00
Hard Lewis Base‐Driven Crystallization Control for Efficient All‐Perovskite Tandem Solar Cells,https://advanced.onlinelibrary.wiley.com/doi/10.1002/adma.73682?af=R,2026-07-17 13:23:16 UTC,Wiley: Advanced Materials: Table of Contents,2026-07-17 13:23:16+00:00
Lamellar‐Paracrystallinity‐Controlled Thermal Transport in Polymer Semiconductors,https://advanced.onlinelibrary.wiley.com/doi/10.1002/adma.73680?af=R,2026-07-17 13:23:16 UTC,Wiley: Advanced Materials: Table of Contents,2026-07-17 13:23:16+00:00
Quantifying Deep‐Level Defects‐Dominated Degradation for Commercially Viable Perovskite Solar Cells,https://advanced.onlinelibrary.wiley.com/doi/10.1002/adma.73679?af=R,2026-07-17 13:23:16 UTC,Wiley: Advanced Materials: Table of Contents,2026-07-17 13:23:16+00:00
A Multifunctional Electrolyte Additive K3P7 for Simultaneous Capacity Compensation and Interphase Regulation in Lithium‐Ion Batteries,https://advanced.onlinelibrary.wiley.com/doi/10.1002/adma.73676?af=R,2026-07-17 13:23:16 UTC,Wiley: Advanced Materials: Table of Contents,2026-07-17 13:23:16+00:00
Argyrodite Sulfide Electrolytes with Dry Atmospheric Stability for All‐Solid‐State Lithium Batteries,https://advanced.onlinelibrary.wiley.com/doi/10.1002/adma.73671?af=R,2026-07-17 13:23:16 UTC,Wiley: Advanced Materials: Table of Contents,2026-07-17 13:23:16+00:00
A Novel Approach for the Fabrication of Polarization‐Selectivity UV Photosynapse Devices With PdSe2/ a‐plane GaN Heterostructures,https://advanced.onlinelibrary.wiley.com/doi/10.1002/adma.73664?af=R,2026-07-17 13:23:16 UTC,Wiley: Advanced Materials: Table of Contents,2026-07-17 13:23:16+00:00
Regulating Electrostatic Discharge via Quasi‐gate Electrode for High‐Performance Direct‐current Triboelectric Nanogenerators,https://advanced.onlinelibrary.wiley.com/doi/10.1002/adma.73659?af=R,2026-07-17 13:23:16 UTC,Wiley: Advanced Materials: Table of Contents,2026-07-17 13:23:16+00:00
Rational Asymmetric Acceptor Engineering via Unidirectional Terminal π‐Extension and Optimizing Alkyl Branching Sites Affords a Binary Photovoltaic Efficiency of 20.7% by Suppressed Nonradiative Energy Loss,https://advanced.onlinelibrary.wiley.com/doi/10.1002/adma.73646?af=R,2026-07-17 13:23:16 UTC,Wiley: Advanced Materials: Table of Contents,2026-07-17 13:23:16+00:00
Bioinspired Nanofluidic Memristors Based on Polyelectrolyte Conformation for Synaptic Learning and in‐Memory Logic Computing,https://advanced.onlinelibrary.wiley.com/doi/10.1002/adma.73598?af=R,2026-07-17 13:23:16 UTC,Wiley: Advanced Materials: Table of Contents,2026-07-17 13:23:16+00:00
Second‐Harmonic Hyper‐Mie Optical Activity Enables Closed‐Loop Chiral Photochemistry,https://advanced.onlinelibrary.wiley.com/doi/10.1002/adma.73593?af=R,2026-07-17 13:23:16 UTC,Wiley: Advanced Materials: Table of Contents,2026-07-17 13:23:16+00:00
Rolling Up Transition Metal Chalcogenides/Oxide Heterostructures Enables Polarity‐Tunable and High‐Switchable Memristors,https://advanced.onlinelibrary.wiley.com/doi/10.1002/adma.202522853?af=R,2026-07-17 13:23:16 UTC,Wiley: Advanced Materials: Table of Contents,2026-07-17 13:23:16+00:00
Unusual Anti‐Thermoplastics and Low Thermal Expansion in 2D Metal Halide Crystals,https://advanced.onlinelibrary.wiley.com/doi/10.1002/adma.202521667?af=R,2026-07-17 13:23:16 UTC,Wiley: Advanced Materials: Table of Contents,2026-07-17 13:23:16+00:00
Calcium‐Mediated Fe─N Bond Reinforcement for Ultra‐Stable Oxygen Reduction Reaction,https://advanced.onlinelibrary.wiley.com/doi/10.1002/adma.73684?af=R,2026-07-17 13:23:16 UTC,Wiley: Advanced Materials: Table of Contents,2026-07-17 13:23:16+00:00
Tuning the Disordered Structure: Recent Advances in Amorphization Engineering for Enhanced Photocatalysis,https://advanced.onlinelibrary.wiley.com/doi/10.1002/adma.73672?af=R,2026-07-17 13:23:16 UTC,Wiley: Advanced Materials: Table of Contents,2026-07-17 13:23:16+00:00
Steric Coordination Modulated Iodine Chemistry With Four‐Electron Conversion for Zinc‐Iodine Batteries,https://advanced.onlinelibrary.wiley.com/doi/10.1002/adma.73681?af=R,2026-07-17 13:23:16 UTC,Wiley: Advanced Materials: Table of Contents,2026-07-17 13:23:16+00:00
Integrated Local‐Microstructure Engineering Toward Mechanochemically Robust Ultra‐High Nickel Cathodes,https://advanced.onlinelibrary.wiley.com/doi/10.1002/adma.73673?af=R,2026-07-17 13:23:16 UTC,Wiley: Advanced Materials: Table of Contents,2026-07-17 13:23:16+00:00
Viral Infection‐Inspired Autonomous Detection of Fusion‐Competent Viruses for Screening and Environmental Surveillance,https://advanced.onlinelibrary.wiley.com/doi/10.1002/adma.202521241?af=R,2026-07-17 13:23:16 UTC,Wiley: Advanced Materials: Table of Contents,2026-07-17 13:23:16+00:00
Asymmetric Oxygen Bridges: A Unified Design Framework for Enhanced Catalysis,https://advanced.onlinelibrary.wiley.com/doi/10.1002/adma.73596?af=R,2026-07-17 13:23:16 UTC,Wiley: Advanced Materials: Table of Contents,2026-07-17 13:23:16+00:00
Impact of Noncondensable Gases on Solar‐Driven Evaporation,https://advanced.onlinelibrary.wiley.com/doi/10.1002/adma.73586?af=R,2026-07-17 13:23:16 UTC,Wiley: Advanced Materials: Table of Contents,2026-07-17 13:23:16+00:00
Achieving Advanced Performance: Progress and Prospects on Non‐Traditional Rechargeable Zinc–Air Batteries,https://advanced.onlinelibrary.wiley.com/doi/10.1002/adma.73605?af=R,2026-07-17 13:23:16 UTC,Wiley: Advanced Materials: Table of Contents,2026-07-17 13:23:16+00:00
Weaving Intelligence: Thermally Drawn Multimaterial Fibers Toward AI‐Enabled Smart Textiles,https://advanced.onlinelibrary.wiley.com/doi/10.1002/adma.73574?af=R,2026-07-17 13:23:16 UTC,Wiley: Advanced Materials: Table of Contents,2026-07-17 13:23:16+00:00
Viral Infection‐Inspired Autonomous Detection of Fusion‐Competent Viruses for Screening and Environmental Surveillance (Adv. Mater. 40/2026),https://advanced.onlinelibrary.wiley.com/doi/10.1002/adma.74101?af=R,2026-07-17 13:23:16 UTC,Wiley: Advanced Materials: Table of Contents,2026-07-17 13:23:16+00:00
Conductive Hydrogels for Exogenous Sensing and Cell Fate Control (Adv. Mater. 40/2026),https://advanced.onlinelibrary.wiley.com/doi/10.1002/adma.74099?af=R,2026-07-17 13:23:16 UTC,Wiley: Advanced Materials: Table of Contents,2026-07-17 13:23:16+00:00
Super Cost‐Effective and Scalable Imine‐Based Sorbent With Field Attraction and In Situ Fixation for Efficient Capture of Diverse Iodine Species under Industrial Conditions (Adv. Mater. 40/2026),https://advanced.onlinelibrary.wiley.com/doi/10.1002/adma.74098?af=R,2026-07-17 13:23:16 UTC,Wiley: Advanced Materials: Table of Contents,2026-07-17 13:23:16+00:00
Cryopreservative Bioink Enables Direct Bioprinting of Adherent Cells (Adv. Mater. 40/2026),https://advanced.onlinelibrary.wiley.com/doi/10.1002/adma.74097?af=R,2026-07-17 13:23:16 UTC,Wiley: Advanced Materials: Table of Contents,2026-07-17 13:23:16+00:00
Second‐Harmonic Hyper‐Mie Optical Activity Enables Closed‐Loop Chiral Photochemistry (Adv. Mater. 40/2026),https://advanced.onlinelibrary.wiley.com/doi/10.1002/adma.74096?af=R,2026-07-17 13:23:16 UTC,Wiley: Advanced Materials: Table of Contents,2026-07-17 13:23:16+00:00
Issue Information,https://advanced.onlinelibrary.wiley.com/doi/10.1002/adma.74100?af=R,2026-07-17 13:23:16 UTC,Wiley: Advanced Materials: Table of Contents,2026-07-17 13:23:16+00:00
Ferroelectric Dynamic‐Field‐Driven Nucleation and Growth Model for Predictive Materials‐To‐Circuit Co‐Design,https://advanced.onlinelibrary.wiley.com/doi/10.1002/adma.73722?af=R,2026-07-17 13:23:16 UTC,Wiley: Advanced Materials: Table of Contents,2026-07-17 13:23:16+00:00
Dual‐Quenching Charge Transfer Unlocks Record Nitrate‐to‐Ammonia Photocatalytic Conversion in Redox‐Active Eosin Y Polymers,https://advanced.onlinelibrary.wiley.com/doi/10.1002/adma.73686?af=R,2026-07-17 13:23:16 UTC,Wiley: Advanced Materials: Table of Contents,2026-07-17 13:23:16+00:00
Cytoskeleton‐Inspired Mechanically Interlocked Catenane Framework Enabling Robust yet Dynamic Polymer Networks,https://advanced.onlinelibrary.wiley.com/doi/10.1002/adma.73742?af=R,2026-07-17 13:23:16 UTC,Wiley: Advanced Materials: Table of Contents,2026-07-17 13:23:16+00:00
Machine Learning‐Optimized Single‐Atom Catalysts Enable Microenvironment‐Adaptive Chemodynamic‐Bioorthogonal Cancer Therapy,https://advanced.onlinelibrary.wiley.com/doi/10.1002/adma.73689?af=R,2026-07-17 13:23:16 UTC,Wiley: Advanced Materials: Table of Contents,2026-07-17 13:23:16+00:00
Oppositely Charged Single Enzyme Nanogels Form Versatile Coacervates for Efficient Enzyme Cascade Catalysis,https://advanced.onlinelibrary.wiley.com/doi/10.1002/adma.73688?af=R,2026-07-17 13:23:16 UTC,Wiley: Advanced Materials: Table of Contents,2026-07-17 13:23:16+00:00
Cryopreservative Bioink Enables Direct Bioprinting of Adherent Cells,https://advanced.onlinelibrary.wiley.com/doi/10.1002/adma.72714?af=R,2026-07-17 13:23:16 UTC,Wiley: Advanced Materials: Table of Contents,2026-07-17 13:23:16+00:00
Super Cost‐Effective and Scalable Imine‐Based Sorbent With Field Attraction and In Situ Fixation for Efficient Capture of Diverse Iodine Species under Industrial Conditions,https://advanced.onlinelibrary.wiley.com/doi/10.1002/adma.202522566?af=R,2026-07-17 13:23:16 UTC,Wiley: Advanced Materials: Table of Contents,2026-07-17 13:23:16+00:00
Segregation‐Engineered Polarization Synchronizes CO2 and Nitrate Reduction for Bias‐Free Urea Synthesis,https://advanced.onlinelibrary.wiley.com/doi/10.1002/adma.73759?af=R,2026-07-17 13:23:16 UTC,Wiley: Advanced Materials: Table of Contents,2026-07-17 13:23:16+00:00
Dynamic Organic–Inorganic Interpenetrating Nanonetwork for Stiff and Durable Flexible Material,https://advanced.onlinelibrary.wiley.com/doi/10.1002/adma.73753?af=R,2026-07-17 13:23:16 UTC,Wiley: Advanced Materials: Table of Contents,2026-07-17 13:23:16+00:00
Shear‐Stiffening Damping Ionogels Enabled by the Synergy of Dynamic Bonds and Steric Hindrance,https://advanced.onlinelibrary.wiley.com/doi/10.1002/adma.73746?af=R,2026-07-17 13:23:16 UTC,Wiley: Advanced Materials: Table of Contents,2026-07-17 13:23:16+00:00
"Unraveling the Design Principles of Crystallographic Orientation for Ultralong, 8500 Cycled Fe‐Ion Battery",https://advanced.onlinelibrary.wiley.com/doi/10.1002/adma.73744?af=R,2026-07-17 13:23:16 UTC,Wiley: Advanced Materials: Table of Contents,2026-07-17 13:23:16+00:00
Crystal Field Engineering of Bioinspired Dual‐Metal Single‐Atom Catalysts Via Spin‐State Modulation for Efficient Oxygen Electroreduction,https://advanced.onlinelibrary.wiley.com/doi/10.1002/adma.73739?af=R,2026-07-17 13:23:16 UTC,Wiley: Advanced Materials: Table of Contents,2026-07-17 13:23:16+00:00
Light‐Induced Proton Transfer Tautomeric Frustrated Lewis Pairs on Carbon Nitride,https://advanced.onlinelibrary.wiley.com/doi/10.1002/adma.73733?af=R,2026-07-17 13:23:16 UTC,Wiley: Advanced Materials: Table of Contents,2026-07-17 13:23:16+00:00
Harnessing N─H···O═V Bonding Toward Stable Vanadium Cathodes in Ah‐Level Zn‐Ion Batteries,https://advanced.onlinelibrary.wiley.com/doi/10.1002/adma.73731?af=R,2026-07-17 13:23:16 UTC,Wiley: Advanced Materials: Table of Contents,2026-07-17 13:23:16+00:00
Bioelectric Reawakening by a Self‐Powered Thermoelectric Hydrogel Accelerates Diabetic Ulcer Repair,https://advanced.onlinelibrary.wiley.com/doi/10.1002/adma.73728?af=R,2026-07-17 13:23:16 UTC,Wiley: Advanced Materials: Table of Contents,2026-07-17 13:23:16+00:00
Directional Concerted Proton‐Electron Transfer in COFs for Efficient Photocatalytic H2O2 Production,https://advanced.onlinelibrary.wiley.com/doi/10.1002/adma.73727?af=R,2026-07-17 13:23:16 UTC,Wiley: Advanced Materials: Table of Contents,2026-07-17 13:23:16+00:00
Closed‐Loop Chemically Recyclable Separation Membranes With Superior Pervaporation Performance,https://advanced.onlinelibrary.wiley.com/doi/10.1002/adma.73725?af=R,2026-07-17 13:23:16 UTC,Wiley: Advanced Materials: Table of Contents,2026-07-17 13:23:16+00:00
Programming Insulator‐to‐Metallic Transport in Insulating Materials via Surface Single‐Atom Engineering,https://advanced.onlinelibrary.wiley.com/doi/10.1002/adma.73723?af=R,2026-07-17 13:23:16 UTC,Wiley: Advanced Materials: Table of Contents,2026-07-17 13:23:16+00:00
