title,link,published,source,pub_date
High-Frequency Magnetohydrodynamic Waves with Substantial Energy in the Solar Polar Corona,https://academic.oup.com/nsr/advance-article/doi/10.1093/nsr/nwag370/8715831?rss=1,2026-06-24 00:00:00 UTC,National Science Review Advance Access,2026-06-24 00:00:00+00:00
Epiblast diversification and blood formation in a human pregastrula,https://www.nature.com/articles/s41586-026-10698-y,2026-06-24 00:00:00 UTC,Nature,2026-06-24 00:00:00+00:00
An ECG biomarker for sudden cardiac death discovered with deep learning,https://www.nature.com/articles/s41586-026-10674-6,2026-06-24 00:00:00 UTC,Nature,2026-06-24 00:00:00+00:00
Detection of anisotropic cosmic structures on a gigaparsec scale,https://www.nature.com/articles/s41586-026-10702-5,2026-06-24 00:00:00 UTC,Nature,2026-06-24 00:00:00+00:00
Optical cooling by interfacial charge transfer in 2D heterostructures,https://www.nature.com/articles/s41586-026-10662-w,2026-06-24 00:00:00 UTC,Nature,2026-06-24 00:00:00+00:00
Immunological mechanisms of mRNA vaccines for infectious diseases,https://www.nature.com/articles/s41586-026-10599-0,2026-06-24 00:00:00 UTC,Nature,2026-06-24 00:00:00+00:00
Small-molecule modulation of β-arrestins,https://www.nature.com/articles/s41586-026-10683-5,2026-06-24 00:00:00 UTC,Nature,2026-06-24 00:00:00+00:00
Disparate privacy risks from medical AI,https://www.nature.com/articles/s41586-026-10688-0,2026-06-24 00:00:00 UTC,Nature,2026-06-24 00:00:00+00:00
Global high-resolution mapping of seagrass to support conservation,https://www.nature.com/articles/s41586-026-10704-3,2026-06-24 00:00:00 UTC,Nature,2026-06-24 00:00:00+00:00
Dietary cholesterol activates a Ral-dependent pathway driving LDLR turnover,https://www.nature.com/articles/s41586-026-10697-z,2026-06-24 00:00:00 UTC,Nature,2026-06-24 00:00:00+00:00
Fourier pixels for bidirectional light control,https://www.nature.com/articles/s41586-026-10681-7,2026-06-24 00:00:00 UTC,Nature,2026-06-24 00:00:00+00:00
Genetic technologies to enhance crop nutritional value under climate change,https://www.nature.com/articles/s41586-026-10593-6,2026-06-24 00:00:00 UTC,Nature,2026-06-24 00:00:00+00:00
Volcanic magma sculpts eerie domes on the sea floor,https://www.nature.com/articles/d41586-026-01986-8,2026-06-24 00:00:00 UTC,Nature,2026-06-24 00:00:00+00:00
AI tool spots antibiotics that fight drug-resistant gonorrhoea,https://www.nature.com/articles/d41586-026-01987-7,2026-06-24 00:00:00 UTC,Nature,2026-06-24 00:00:00+00:00
Medical records could be revealed by AI training-data vulnerability,https://www.nature.com/articles/d41586-026-02032-3,2026-06-24 00:00:00 UTC,Nature,2026-06-24 00:00:00+00:00
On the robustness of topological gap detection via transport,https://www.nature.com/articles/s41586-026-10567-8,2026-06-24 00:00:00 UTC,Nature,2026-06-24 00:00:00+00:00
Addendum: Transmission of MPXV from fire-footed rope squirrels to sooty mangabeys,https://www.nature.com/articles/s41586-026-10767-2,2026-06-24 00:00:00 UTC,Nature,2026-06-24 00:00:00+00:00
Reply to: On the robustness of topological gap detection via transport,https://www.nature.com/articles/s41586-026-10568-7,2026-06-24 00:00:00 UTC,Nature,2026-06-24 00:00:00+00:00
Author Correction: cBAF complex components and MYC cooperate early in CD8+ T cell fate,https://www.nature.com/articles/s41586-026-10813-z,2026-06-24 00:00:00 UTC,Nature,2026-06-24 00:00:00+00:00
Accelerated aging replicates spatially non-uniform degradation modes observed in outdoor-aged perovskite solar cells,https://www.cell.com/joule/fulltext/S2542-4351(26)00222-9?rss=yes,2026-06-24 00:00:00 UTC,Joule,2026-06-24 00:00:00+00:00
Effect of interstitial alkyl chain engineering of anion exchange membrane for improved CO2 electrolyzer,https://www.cell.com/joule/fulltext/S2542-4351(26)00218-7?rss=yes,2026-06-24 00:00:00 UTC,Joule,2026-06-24 00:00:00+00:00
The mutational landscape of STING-induced immunity,https://www.nature.com/articles/s41586-026-10685-3,2026-06-24 00:00:00 UTC,Nature,2026-06-24 00:00:00+00:00
Genetic diversity of late Neanderthals in northwestern Europe,https://www.nature.com/articles/s41586-026-10625-1,2026-06-24 00:00:00 UTC,Nature,2026-06-24 00:00:00+00:00
Crude oil fractionation by means of mesoporous polyacrylonitrile membranes,https://www.nature.com/articles/s41586-026-10677-3,2026-06-24 00:00:00 UTC,Nature,2026-06-24 00:00:00+00:00
GW250114 reveals signatures of post-merger black-hole horizon,https://www.nature.com/articles/s41586-026-10696-0,2026-06-24 00:00:00 UTC,Nature,2026-06-24 00:00:00+00:00
Transforming optical fibers from passive transmitters to multimodal sensory platforms,https://academic.oup.com/nsr/advance-article/doi/10.1093/nsr/nwag386/8715829?rss=1,2026-06-24 00:00:00 UTC,National Science Review Advance Access,2026-06-24 00:00:00+00:00
Tetraboron MR framework with ortho-B-π-B pattern enables high-efficiency yellow narrowband OLEDs,https://academic.oup.com/nsr/advance-article/doi/10.1093/nsr/nwag389/8715830?rss=1,2026-06-24 00:00:00 UTC,National Science Review Advance Access,2026-06-24 00:00:00+00:00
Environmental Effectiveness of the National Action Plan to Contain Antimicrobial Resistance: Evidence from Chinese Soil,https://academic.oup.com/nsr/advance-article/doi/10.1093/nsr/nwag387/8715832?rss=1,2026-06-24 00:00:00 UTC,National Science Review Advance Access,2026-06-24 00:00:00+00:00
Two-dimensional materials need a shared experimental memory,https://www.nature.com/articles/s41578-026-00938-y,2026-06-24 00:00:00 UTC,Nature Reviews Materials,2026-06-24 00:00:00+00:00
A global map of seagrass ecosystems,https://www.nature.com/articles/d41586-026-01805-0,2026-06-24 00:00:00 UTC,Nature,2026-06-24 00:00:00+00:00
Why science needs the humanities more than ever,https://www.nature.com/articles/d41586-026-01958-y,2026-06-24 00:00:00 UTC,Nature,2026-06-24 00:00:00+00:00
Long-sought chemical inhibitors of β-arrestin proteins,https://www.nature.com/articles/d41586-026-01894-x,2026-06-24 00:00:00 UTC,Nature,2026-06-24 00:00:00+00:00
Crude oil turns cheap porous membrane into a sieve to refine itself without heat,https://www.nature.com/articles/d41586-026-01896-9,2026-06-24 00:00:00 UTC,Nature,2026-06-24 00:00:00+00:00
Antibiotic cocktail made by soil bacteria can kill superbugs,https://www.nature.com/articles/d41586-026-01990-y,2026-06-24 00:00:00 UTC,Nature,2026-06-24 00:00:00+00:00
‘Megacluster’ of genes enables bacteria to make potent antibiotic mixture,https://www.nature.com/articles/d41586-026-01804-1,2026-06-24 00:00:00 UTC,Nature,2026-06-24 00:00:00+00:00
A hidden predictor of sudden cardiac death uncovered by deep learning,https://www.nature.com/articles/d41586-026-01806-z,2026-06-24 00:00:00 UTC,Nature,2026-06-24 00:00:00+00:00
‘Us’ not ‘them’: scientists must use their skills to help stop polarization and division,https://www.nature.com/articles/d41586-026-01952-4,2026-06-24 00:00:00 UTC,Nature,2026-06-24 00:00:00+00:00
Daily briefing: Sperm whales have different dialects,https://www.nature.com/articles/d41586-026-02054-x,2026-06-24 00:00:00 UTC,Nature,2026-06-24 00:00:00+00:00
Genomic insights into the population dynamics and demise of Neanderthals,https://www.nature.com/articles/d41586-026-01704-4,2026-06-24 00:00:00 UTC,Nature,2026-06-24 00:00:00+00:00
Laser light switches on heat flow in ultra-thin structures,https://www.nature.com/articles/d41586-026-01803-2,2026-06-24 00:00:00 UTC,Nature,2026-06-24 00:00:00+00:00
Garbage collection,https://www.nature.com/articles/d41586-026-01720-4,2026-06-24 00:00:00 UTC,Nature,2026-06-24 00:00:00+00:00
A Streptomyces megacluster encodes synergistic biotin-targeting antibiotics,https://www.nature.com/articles/s41586-026-10647-9,2026-06-24 00:00:00 UTC,Nature,2026-06-24 00:00:00+00:00
Alternate RNA decoding results in stable and abundant proteins in mammals,https://www.nature.com/articles/s41586-026-10678-2,2026-06-24 00:00:00 UTC,Nature,2026-06-24 00:00:00+00:00
"Ductile alloys offering 100 MPa tensile strength at 2,400 °C",https://www.nature.com/articles/s41586-026-10708-z,2026-06-24 00:00:00 UTC,Nature,2026-06-24 00:00:00+00:00
Zero-shot design of drug-binding proteins via neural iterative selection−expansion,https://www.nature.com/articles/s41586-026-10670-w,2026-06-24 00:00:00 UTC,Nature,2026-06-24 00:00:00+00:00
Chiral laser gyroscopes breaking the lock-in limit,https://www.nature.com/articles/s41586-026-10684-4,2026-06-24 00:00:00 UTC,Nature,2026-06-24 00:00:00+00:00
Photoreforming of solid waste on 1 m2 scale using single-source precursor-derived co-catalyst films,https://www.nature.com/articles/s44286-026-00406-y,2026-06-24 00:00:00 UTC,Nature Chemical Engineering,2026-06-24 00:00:00+00:00
Giant and broadband circular dichroism from particle–hole symmetry breaking in Weyl semimetals,https://www.nature.com/articles/s41563-026-02630-6,2026-06-24 00:00:00 UTC,Nature Materials,2026-06-24 00:00:00+00:00
Role of methanesulfonic acid in atmospheric particle nucleation and growth,https://www.nature.com/articles/s41586-026-10810-2,2026-06-24 00:00:00 UTC,Nature,2026-06-24 00:00:00+00:00
Interacting causes of mini-grid failure,https://www.nature.com/articles/s41560-026-02100-y,2026-06-24 00:00:00 UTC,Nature Energy,2026-06-24 00:00:00+00:00
Flowing zinc slurry for long-duration energy storage,https://www.nature.com/articles/s41560-026-02091-w,2026-06-24 00:00:00 UTC,Nature Energy,2026-06-24 00:00:00+00:00
Open-air perovskite fabrication,https://www.nature.com/articles/s41560-026-02099-2,2026-06-24 00:00:00 UTC,Nature Energy,2026-06-24 00:00:00+00:00
Lattice distortion activates deformation twinning in ultrastrong steel,https://www.nature.com/articles/s41563-026-02642-2,2026-06-24 00:00:00 UTC,Nature Materials,2026-06-24 00:00:00+00:00
Quantifying X-ray damage,https://www.nature.com/articles/s41560-026-02098-3,2026-06-24 00:00:00 UTC,Nature Energy,2026-06-24 00:00:00+00:00
Coherent 2D/3D van der Waals epitaxy enables single-crystal perovskite heterostructures,https://www.nature.com/articles/s41565-026-02202-4,2026-06-24 00:00:00 UTC,Nature Nanotechnology,2026-06-24 00:00:00+00:00
Resource consumption in global concrete production,https://www.nature.com/articles/s41893-026-01858-z,2026-06-24 00:00:00 UTC,Nature Sustainability,2026-06-24 00:00:00+00:00
"After menopause, ovaries may transform into organs with immune powers",https://www.science.org/content/article/after-menopause-ovaries-may-transform-organs-immune-powers,2026-06-24 01:20:00 UTC,Latest News from Science Magazine,2026-06-24 01:20:00+00:00
Medical students are using a popular research tool to pump out misleading studies,https://www.science.org/content/article/medical-students-are-using-popular-research-tool-pump-out-misleading-studies,2026-06-24 01:30:00 UTC,Latest News from Science Magazine,2026-06-24 01:30:00+00:00
Migrating sea turtles only sort of know where they’re going,https://www.science.org/content/article/migrating-sea-turtles-only-sort-know-where-they-re-going,2026-06-24 02:00:00 UTC,Latest News from Science Magazine,2026-06-24 02:00:00+00:00
Hundreds of schools plan closures ahead of red heat alerts,https://www.bbc.co.uk/news/articles/cwyl940y94xo?at_medium=RSS&at_campaign=rss,2026-06-24 02:26:39 UTC,BBC News,2026-06-24 02:26:39+00:00
BloombergNEF Turkey Transition Factbook 2026: Clean Power Growth Positions Turkey for the Next Phase of Its Energy Transition,https://about.bnef.com/insights/clean-energy/bloombergnef-turkey-transition-factbook-2026-clean-power-growth-positions-turkey-for-the-next-phase-of-its-energy-transition/,2026-06-24 03:01:12 UTC,Press release Archives | BloombergNEF,2026-06-24 03:01:12+00:00
"The universe is unexpectedly stringy, which could unravel the theory of the cosmos",https://www.science.org/content/article/universe-unexpectedly-stringy-which-could-unravel-theory-cosmos,2026-06-24 04:15:00 UTC,Latest News from Science Magazine,2026-06-24 04:15:00+00:00
"Kinetic Analysis of Transmetalation at Prototypical Nickel(II) Catalyst Species: Rates, Mechanisms, and Implications for Catalysis",https://onlinelibrary.wiley.com/doi/10.1002/anie.2885584?af=R,2026-06-24 04:55:38 UTC,Wiley: Angewandte Chemie International Edition: Table of Contents,2026-06-24 04:55:38+00:00
Pulsed Design Enables Ammonia Electrosynthesis From Dilute Nitrate in Real Wastewater,https://onlinelibrary.wiley.com/doi/10.1002/anie.9630862?af=R,2026-06-24 04:56:41 UTC,Wiley: Angewandte Chemie International Edition: Table of Contents,2026-06-24 04:56:41+00:00
"Photo‐Triggered, Fast, and Fluorogenic Thiophene‐Based Cycloalkynes for the Bioorthogonal Fluorescent Labeling of 1,3‐Dipole‐Tagged Molecules in No‐Wash Conditions",https://onlinelibrary.wiley.com/doi/10.1002/anie.1383575?af=R,2026-06-24 05:01:04 UTC,Wiley: Angewandte Chemie International Edition: Table of Contents,2026-06-24 05:01:04+00:00
Correction to “Imaging‐Based High‐Content Screening With Clickable Probes Identifies XPB Inhibitors”,https://onlinelibrary.wiley.com/doi/10.1002/anie.4417946?af=R,2026-06-24 05:04:51 UTC,Wiley: Angewandte Chemie International Edition: Table of Contents,2026-06-24 05:04:51+00:00
Survey finds 'significantly more' ancient woodland,https://www.bbc.co.uk/news/articles/c7vyn013j79o?at_medium=RSS&at_campaign=rss,2026-06-24 05:17:44 UTC,BBC News,2026-06-24 05:17:44+00:00
"Environmental plan is largely off track, warns watchdog",https://www.bbc.co.uk/news/articles/cqj1e0zqvyxo?at_medium=RSS&at_campaign=rss,2026-06-24 05:24:47 UTC,BBC News,2026-06-24 05:24:47+00:00
What triggers seismicity thousands of kilometers away from a mainshock?,https://www.science.org/doi/abs/10.1126/sciadv.aec4754?af=R,2026-06-24 07:00:00 UTC,AAAS: Science Advances: Table of Contents,2026-06-24 07:00:00+00:00
IRE1 regulates the proteostasis of TDP-43/TARDBP in ALS/FTD through ribosome-associated quality control,https://www.pnas.org/doi/abs/10.1073/pnas.2610001123?mi=eymic2&af=R&access=on&content=articlesChapters&publication=pnas&sortBy=Earliest&target=default,2026-06-24 07:00:00 UTC,Proceedings of the National Academy of Sciences: Keyword search for query,2026-06-24 07:00:00+00:00
Resource declines shape phenological and morphological responses to climate change,https://www.pnas.org/doi/abs/10.1073/pnas.2607714123?mi=eymic2&af=R&access=on&content=articlesChapters&publication=pnas&sortBy=Earliest&target=default,2026-06-24 07:00:00 UTC,Proceedings of the National Academy of Sciences: Keyword search for query,2026-06-24 07:00:00+00:00
Adaptive mechanochemical mechanisms of the nucleus during confined cell migration,https://www.pnas.org/doi/abs/10.1073/pnas.2604716123?mi=eymic2&af=R&access=on&content=articlesChapters&publication=pnas&sortBy=Earliest&target=default,2026-06-24 07:00:00 UTC,Proceedings of the National Academy of Sciences: Keyword search for query,2026-06-24 07:00:00+00:00
p53 overrides METTL5 loss–induced tumor suppression via mitochondrial respiration,https://www.pnas.org/doi/abs/10.1073/pnas.2604695123?mi=eymic2&af=R&access=on&content=articlesChapters&publication=pnas&sortBy=Earliest&target=default,2026-06-24 07:00:00 UTC,Proceedings of the National Academy of Sciences: Keyword search for query,2026-06-24 07:00:00+00:00
FOLR1-targeted actinium-225–based alpha-particle therapy eliminates ovarian cancer,https://www.science.org/doi/abs/10.1126/sciadv.aef0121?af=R,2026-06-24 07:00:00 UTC,AAAS: Science Advances: Table of Contents,2026-06-24 07:00:00+00:00
Enhanced rock weathering has greater promise as a sustainable farming practice than a CO2 removal technology,https://www.pnas.org/doi/abs/10.1073/pnas.2602421123?mi=eymic2&af=R&access=on&content=articlesChapters&publication=pnas&sortBy=Earliest&target=default,2026-06-24 07:00:00 UTC,Proceedings of the National Academy of Sciences: Keyword search for query,2026-06-24 07:00:00+00:00
GPAM mediates mitochondrial dysfunction and the progression of alcoholic liver disease through lipid remodeling,https://www.science.org/doi/abs/10.1126/sciadv.aef1896?af=R,2026-06-24 07:00:00 UTC,AAAS: Science Advances: Table of Contents,2026-06-24 07:00:00+00:00
An OsGLK1/2-DGP1/2/3 feedback module regulates rice photosynthesis and yield,https://www.science.org/doi/abs/10.1126/sciadv.aef5234?af=R,2026-06-24 07:00:00 UTC,AAAS: Science Advances: Table of Contents,2026-06-24 07:00:00+00:00
Temperature and developmental stage govern intestinal susceptibility to human coronavirus 229E,https://www.pnas.org/doi/abs/10.1073/pnas.2600632123?mi=eymic2&af=R&access=on&content=articlesChapters&publication=pnas&sortBy=Earliest&target=default,2026-06-24 07:00:00 UTC,Proceedings of the National Academy of Sciences: Keyword search for query,2026-06-24 07:00:00+00:00
Identification of a master regulator Msd1 that governs meiotic entry in a global basidiomycete pathogen,https://www.pnas.org/doi/abs/10.1073/pnas.2536339123?mi=eymic2&af=R&access=on&content=articlesChapters&publication=pnas&sortBy=Earliest&target=default,2026-06-24 07:00:00 UTC,Proceedings of the National Academy of Sciences: Keyword search for query,2026-06-24 07:00:00+00:00
Chemical ecology and convergent evolution of natural hallucinogens: From ecological defense to conserved neural targets,https://www.pnas.org/doi/abs/10.1073/pnas.2535785123?mi=eymic2&af=R&access=on&content=articlesChapters&publication=pnas&sortBy=Earliest&target=default,2026-06-24 07:00:00 UTC,Proceedings of the National Academy of Sciences: Keyword search for query,2026-06-24 07:00:00+00:00
A potential overestimation of CO2 physiological effects on evapotranspiration,https://www.pnas.org/doi/abs/10.1073/pnas.2534643123?mi=eymic2&af=R&access=on&content=articlesChapters&publication=pnas&sortBy=Earliest&target=default,2026-06-24 07:00:00 UTC,Proceedings of the National Academy of Sciences: Keyword search for query,2026-06-24 07:00:00+00:00
Extra gene coding capacity of SARS-CoV-2 provides a virus engineering platform for in vitro and in vivo applications,https://www.pnas.org/doi/abs/10.1073/pnas.2532920123?mi=eymic2&af=R&access=on&content=articlesChapters&publication=pnas&sortBy=Earliest&target=default,2026-06-24 07:00:00 UTC,Proceedings of the National Academy of Sciences: Keyword search for query,2026-06-24 07:00:00+00:00
A receptor-like mechanosensitive protein governs preprophase band positioning for asymmetric cell divisions and SC morphogenesis,https://www.pnas.org/doi/abs/10.1073/pnas.2528001123?mi=eymic2&af=R&access=on&content=articlesChapters&publication=pnas&sortBy=Earliest&target=default,2026-06-24 07:00:00 UTC,Proceedings of the National Academy of Sciences: Keyword search for query,2026-06-24 07:00:00+00:00
Deviance detection via competitive inhibition between local neocortical ensembles,https://www.pnas.org/doi/abs/10.1073/pnas.2527342123?mi=eymic2&af=R&access=on&content=articlesChapters&publication=pnas&sortBy=Earliest&target=default,2026-06-24 07:00:00 UTC,Proceedings of the National Academy of Sciences: Keyword search for query,2026-06-24 07:00:00+00:00
Creating common virtual ground: Protocols to democratize open VR research,https://www.pnas.org/doi/abs/10.1073/pnas.2524991123?mi=eymic2&af=R&access=on&content=articlesChapters&publication=pnas&sortBy=Earliest&target=default,2026-06-24 07:00:00 UTC,Proceedings of the National Academy of Sciences: Keyword search for query,2026-06-24 07:00:00+00:00
Sex differences in Drosophila intestinal metabolism contribute to sexually dimorphic infection outcome and alter gut pathogen virulence,https://www.pnas.org/doi/abs/10.1073/pnas.2514992123?mi=eymic2&af=R&access=on&content=articlesChapters&publication=pnas&sortBy=Earliest&target=default,2026-06-24 07:00:00 UTC,Proceedings of the National Academy of Sciences: Keyword search for query,2026-06-24 07:00:00+00:00
Records of compass heading for long-distance ocean migrators show mid-ocean reorientation,https://www.science.org/doi/abs/10.1126/sciadv.aed8113?af=R,2026-06-24 07:00:00 UTC,AAAS: Science Advances: Table of Contents,2026-06-24 07:00:00+00:00
FUBL-3/FUBP1 mediates mitochondrial stress–induced chromatin remodeling and longevity,https://www.science.org/doi/abs/10.1126/sciadv.aec8143?af=R,2026-06-24 07:00:00 UTC,AAAS: Science Advances: Table of Contents,2026-06-24 07:00:00+00:00
How reactive is water at the nanoscale and how to control it?,https://www.science.org/doi/abs/10.1126/sciadv.aeb5772?af=R,2026-06-24 07:00:00 UTC,AAAS: Science Advances: Table of Contents,2026-06-24 07:00:00+00:00
GAS6 regulates mucosal langerhans cell homeostasis through cell-intrinsic and niche-dependent mechanisms,https://www.pnas.org/doi/abs/10.1073/pnas.2601365123?mi=eymic2&af=R&access=on&content=articlesChapters&publication=pnas&sortBy=Earliest&target=default,2026-06-24 07:00:00 UTC,Proceedings of the National Academy of Sciences: Keyword search for query,2026-06-24 07:00:00+00:00
Reentrant superconductivity at an oxide heterointerface,https://www.science.org/doi/abs/10.1126/sciadv.aeg0460?af=R,2026-06-24 07:00:00 UTC,AAAS: Science Advances: Table of Contents,2026-06-24 07:00:00+00:00
A subnanoscale dynamic-integrated catalytic system for bioinspired photoelectrochemical ammonia synthesis,https://www.science.org/doi/abs/10.1126/sciadv.aee9634?af=R,2026-06-24 07:00:00 UTC,AAAS: Science Advances: Table of Contents,2026-06-24 07:00:00+00:00
Light-based footprinting of a eukaryotic genome,https://www.science.org/doi/abs/10.1126/sciadv.aec0059?af=R,2026-06-24 07:00:00 UTC,AAAS: Science Advances: Table of Contents,2026-06-24 07:00:00+00:00
Common human ALDH1B1 and ALDH2 variants increase neuroinflammatory response to a single ethanol dose in mice,https://www.science.org/doi/abs/10.1126/sciadv.aec6309?af=R,2026-06-24 07:00:00 UTC,AAAS: Science Advances: Table of Contents,2026-06-24 07:00:00+00:00
Harnessing skin-resident γδ T cells for immunotherapy in cutaneous squamous cell carcinoma,https://www.science.org/doi/abs/10.1126/sciadv.aec7215?af=R,2026-06-24 07:00:00 UTC,AAAS: Science Advances: Table of Contents,2026-06-24 07:00:00+00:00
Asymmetric Ru─O sites in self-activated catalysts for efficient electrochemical methanol oxidation and industrial-scale hydrogen generation,https://www.science.org/doi/abs/10.1126/sciadv.aeb1299?af=R,2026-06-24 07:00:00 UTC,AAAS: Science Advances: Table of Contents,2026-06-24 07:00:00+00:00
AI-driven tripartite classification for optimizing wearable bioelectronics in depression management,https://www.science.org/doi/abs/10.1126/sciadv.aec9837?af=R,2026-06-24 07:00:00 UTC,AAAS: Science Advances: Table of Contents,2026-06-24 07:00:00+00:00
Dynamic neutrophil lipidome remodeling during induction of NETosis,https://www.science.org/doi/abs/10.1126/sciadv.aec9891?af=R,2026-06-24 07:00:00 UTC,AAAS: Science Advances: Table of Contents,2026-06-24 07:00:00+00:00
Long-stranded XNA-cssDNA hybrids for robust data storage,https://www.science.org/doi/abs/10.1126/sciadv.aed2917?af=R,2026-06-24 07:00:00 UTC,AAAS: Science Advances: Table of Contents,2026-06-24 07:00:00+00:00
Distinct projections of PVN oxytocin neurons regulate the divergent defensive behaviors in response to social threat,https://www.science.org/doi/abs/10.1126/sciadv.aeb0400?af=R,2026-06-24 07:00:00 UTC,AAAS: Science Advances: Table of Contents,2026-06-24 07:00:00+00:00
Fair Workweek laws in the US: An appraisal of intended and unintended consequences,https://www.science.org/doi/abs/10.1126/sciadv.aea8632?af=R,2026-06-24 07:00:00 UTC,AAAS: Science Advances: Table of Contents,2026-06-24 07:00:00+00:00
"Spatial transcriptomics uncovers the hybrid molecular identity, ciliated phenotype, and immune signature of adenomyosis lesions",https://www.science.org/doi/abs/10.1126/sciadv.aea6379?af=R,2026-06-24 07:00:00 UTC,AAAS: Science Advances: Table of Contents,2026-06-24 07:00:00+00:00
Isoform-specific steric zippers drive aberrant assembly and mislocalization of shortened TDP-43,https://www.science.org/doi/abs/10.1126/sciadv.ady0256?af=R,2026-06-24 07:00:00 UTC,AAAS: Science Advances: Table of Contents,2026-06-24 07:00:00+00:00
"Correction for McWilliams, There is no horizontal gravity force in geopotential coordinates",https://www.pnas.org/doi/abs/10.1073/pnas.2618226123?mi=eymic2&af=R&access=on&content=articlesChapters&publication=pnas&sortBy=Earliest&target=default,2026-06-24 07:00:00 UTC,Proceedings of the National Academy of Sciences: Keyword search for query,2026-06-24 07:00:00+00:00
Brassinosteroid signaling regulates shoot apical meristem homeostasis via orchestrating cytokinin and WUSCHEL activity,https://www.science.org/doi/abs/10.1126/sciadv.aed5120?af=R,2026-06-24 07:00:00 UTC,AAAS: Science Advances: Table of Contents,2026-06-24 07:00:00+00:00
Coordinated hand movement sensation revealed through an implanted magnetic prosthetic kinesthetic interface,https://www.science.org/doi/abs/10.1126/sciadv.adx5046?af=R,2026-06-24 07:00:00 UTC,AAAS: Science Advances: Table of Contents,2026-06-24 07:00:00+00:00
"Spatially distributed complex organic matter detected in an ancient river valley in Jezero crater, Mars",https://www.science.org/doi/abs/10.1126/sciadv.adx0047?af=R,2026-06-24 07:00:00 UTC,AAAS: Science Advances: Table of Contents,2026-06-24 07:00:00+00:00
"Antonio García-Bellido: A brief history of flies, lineages, and a new developmental genetic logic",https://www.pnas.org/doi/abs/10.1073/pnas.2614026123?mi=eymic2&af=R&access=on&content=articlesChapters&publication=pnas&sortBy=Earliest&target=default,2026-06-24 07:00:00 UTC,Proceedings of the National Academy of Sciences: Keyword search for query,2026-06-24 07:00:00+00:00
Pseudomonads associated to salt-stressed plants facilitate stress adaption of soybean through enhanced lignin biosynthesis,https://www.science.org/doi/abs/10.1126/sciadv.aed8447?af=R,2026-06-24 07:00:00 UTC,AAAS: Science Advances: Table of Contents,2026-06-24 07:00:00+00:00
