title,link,published,source,pub_date
Biocompatible ligand balancing in transition metal coordination enables benign in-cell protein arylation,https://www.nature.com/articles/s41557-025-02017-1,2026-01-07 00:00:00 UTC,Nature Chemistry,2026-01-07 00:00:00+00:00
An expanded registry of candidate cis-regulatory elements,https://www.nature.com/articles/s41586-025-09909-9,2026-01-07 00:00:00 UTC,Nature,2026-01-07 00:00:00+00:00
High-voltage anode-free sodium–sulfur batteries,https://www.nature.com/articles/s41586-025-09867-2,2026-01-07 00:00:00 UTC,Nature,2026-01-07 00:00:00+00:00
Climate change shifts the North Pacific storm track polewards,https://www.nature.com/articles/s41586-025-09895-y,2026-01-07 00:00:00 UTC,Nature,2026-01-07 00:00:00+00:00
Prefrontal neural geometry of learned cues guides motivated behaviours,https://www.nature.com/articles/s41586-025-09902-2,2026-01-07 00:00:00 UTC,Nature,2026-01-07 00:00:00+00:00
Bidirectional CRISPR screens decode a GLIS3-dependent fibrotic cell circuit,https://www.nature.com/articles/s41586-025-09907-x,2026-01-07 00:00:00 UTC,Nature,2026-01-07 00:00:00+00:00
Early hominins from Morocco basal to the Homo sapiens lineage,https://www.nature.com/articles/s41586-025-09914-y,2026-01-07 00:00:00 UTC,Nature,2026-01-07 00:00:00+00:00
Plastic landmark anchoring in zebrafish compass neurons,https://www.nature.com/articles/s41586-025-09888-x,2026-01-07 00:00:00 UTC,Nature,2026-01-07 00:00:00+00:00
Monovalent pseudo-natural products supercharge degradation of IDO1 by its native E3 KLHDC3,https://www.nature.com/articles/s41557-025-02021-5,2026-01-07 00:00:00 UTC,Nature Chemistry,2026-01-07 00:00:00+00:00
"Insights into DNA repeat expansions among 900,000 biobank participants",https://www.nature.com/articles/s41586-025-09886-z,2026-01-07 00:00:00 UTC,Nature,2026-01-07 00:00:00+00:00
Pulse heating and slip enhance charging of phase-change thermal batteries,https://www.nature.com/articles/s41586-025-09877-0,2026-01-07 00:00:00 UTC,Nature,2026-01-07 00:00:00+00:00
Neuro-epithelial circuits promote sensory convergence and intestinal immunity,https://www.nature.com/articles/s41586-025-09921-z,2026-01-07 00:00:00 UTC,Nature,2026-01-07 00:00:00+00:00
Nutrient requirements of organ-specific metastasis in breast cancer,https://www.nature.com/articles/s41586-025-09898-9,2026-01-07 00:00:00 UTC,Nature,2026-01-07 00:00:00+00:00
Towards fibre-like loss for photonic integration from violet to near-infrared,https://www.nature.com/articles/s41586-025-09889-w,2026-01-07 00:00:00 UTC,Nature,2026-01-07 00:00:00+00:00
Aharonov–Bohm interference in even-denominator fractional quantum Hall states,https://www.nature.com/articles/s41586-025-09891-2,2026-01-07 00:00:00 UTC,Nature,2026-01-07 00:00:00+00:00
Soft photonic skins with dynamic texture and colour control,https://www.nature.com/articles/s41586-025-09948-2,2026-01-07 00:00:00 UTC,Nature,2026-01-07 00:00:00+00:00
Soft biodegradable implants for long-distance and wide-angle sensing,https://www.nature.com/articles/s41586-025-09874-3,2026-01-07 00:00:00 UTC,Nature,2026-01-07 00:00:00+00:00
RNA-triggered Cas12a3 cleaves tRNA tails to execute bacterial immunity,https://www.nature.com/articles/s41586-025-09852-9,2026-01-07 00:00:00 UTC,Nature,2026-01-07 00:00:00+00:00
A framework for addressing racial and related inequities in conservation,https://www.nature.com/articles/s41586-025-09892-1,2026-01-07 00:00:00 UTC,Nature,2026-01-07 00:00:00+00:00
A young progenitor for the most common planetary systems in the Galaxy,https://www.nature.com/articles/s41586-025-09840-z,2026-01-07 00:00:00 UTC,Nature,2026-01-07 00:00:00+00:00
Selenium hits double digits,https://www.nature.com/articles/s41560-025-01949-9,2026-01-07 00:00:00 UTC,Nature Energy,2026-01-07 00:00:00+00:00
Illumination-assisted annealing enables selenium solar cells with open-circuit voltage over 1 V and efficiency exceeding 10%,https://www.nature.com/articles/s41560-025-01939-x,2026-01-07 00:00:00 UTC,Nature Energy,2026-01-07 00:00:00+00:00
O-GlcNAcylation of AMFR stabilizes TSPAN4 to regulate migrasome formation for viral release,https://www.nature.com/articles/s41467-025-68220-3,2026-01-07 00:00:00 UTC,Nature Communications,2026-01-07 00:00:00+00:00
AKAP95 condensates regulate transcription and can be targeted in MLL-fusion driven oncogenesis,https://www.nature.com/articles/s41467-025-68192-4,2026-01-07 00:00:00 UTC,Nature Communications,2026-01-07 00:00:00+00:00
Boosted catalytic activity by metal-oxide interface in porous single-crystalline niobium oxide monoliths,https://www.nature.com/articles/s41467-025-68117-1,2026-01-07 00:00:00 UTC,Nature Communications,2026-01-07 00:00:00+00:00
Energy-efficient indirect (bi)carbonate electroreduction in a porous solid electrolyte reactor,https://www.nature.com/articles/s41893-025-01755-x,2026-01-07 00:00:00 UTC,Nature Sustainability,2026-01-07 00:00:00+00:00
Fast and selective CO2 capture from outdoor air by covalent organic frameworks,https://www.nature.com/articles/s41893-025-01735-1,2026-01-07 00:00:00 UTC,Nature Sustainability,2026-01-07 00:00:00+00:00
Surface optimization governs the local design of physical networks,https://www.nature.com/articles/s41586-025-09784-4,2026-01-07 00:00:00 UTC,Nature,2026-01-07 00:00:00+00:00
Electrically writing a magnetic heliknoton in a chiral magnet,https://www.nature.com/articles/s41563-025-02450-0,2026-01-07 00:00:00 UTC,Nature Materials,2026-01-07 00:00:00+00:00
Chemical fluorophores for fluorescence lifetime imaging,http://pubs.rsc.org/en/Content/ArticleLanding/2026/CS/D5CS00280J,2026-01-07 00:00:00 UTC,RSC - Chem. Soc. Rev. latest articles,2026-01-07 00:00:00+00:00
"Metal–organic framework-based gas sensors: fabrication, mechanisms, and applications",http://pubs.rsc.org/en/Content/ArticleLanding/2026/CS/D5CS00472A,2026-01-07 00:00:00 UTC,RSC - Chem. Soc. Rev. latest articles,2026-01-07 00:00:00+00:00
Electrochemical defluorinative Matteson-type homologation,https://www.nature.com/articles/s41586-025-10002-4,2026-01-07 00:00:00 UTC,Nature,2026-01-07 00:00:00+00:00
Systematic analyses of lipid mobilization by human lipid transfer proteins,https://www.nature.com/articles/s41586-025-10040-y,2026-01-07 00:00:00 UTC,Nature,2026-01-07 00:00:00+00:00
A mysterious ancient fingerprint and a lemon-shaped planet — the stories you’ve missed,https://www.nature.com/articles/d41586-026-00053-6,2026-01-07 00:00:00 UTC,Nature,2026-01-07 00:00:00+00:00
Mitochondrial transfer from glia to neurons protects against peripheral neuropathy,https://www.nature.com/articles/s41586-025-09896-x,2026-01-07 00:00:00 UTC,Nature,2026-01-07 00:00:00+00:00
A hidden diversity of ceratopsian dinosaurs in Late Cretaceous Europe,https://www.nature.com/articles/s41586-025-09897-w,2026-01-07 00:00:00 UTC,Nature,2026-01-07 00:00:00+00:00
Expression of concern: Experimental and computational advancement of cathode materials for futuristic Sodium Ion Batteries,https://www.sciencedirect.com/science/article/pii/S1369702125004869?dgcid=rss_sd_all,2026-01-07 00:00:00 UTC,ScienceDirect Publication: Materials Today,2026-01-07 00:00:00+00:00
Intratumoural vaccination via checkpoint degradation-coupled antigen presentation,https://www.nature.com/articles/s41586-025-09903-1,2026-01-07 00:00:00 UTC,Nature,2026-01-07 00:00:00+00:00
Genetic switch between unicellularity and multicellularity in marine yeasts,https://www.nature.com/articles/s41586-025-09881-4,2026-01-07 00:00:00 UTC,Nature,2026-01-07 00:00:00+00:00
How viral RNAs escape a host mechanism that controls translation,https://www.nature.com/articles/d41586-025-04001-8,2026-01-07 00:00:00 UTC,Nature,2026-01-07 00:00:00+00:00
Ultra-low-density exoplanets observed around a young star,https://www.nature.com/articles/d41586-025-03983-9,2026-01-07 00:00:00 UTC,Nature,2026-01-07 00:00:00+00:00
Of all the quarries: Casablanca fossils reveal African ancestors of Homo sapiens,https://www.nature.com/articles/d41586-025-03986-6,2026-01-07 00:00:00 UTC,Nature,2026-01-07 00:00:00+00:00
Octopus-inspired ‘synthetic skin’ changes colour and texture on demand,https://www.nature.com/articles/d41586-026-00052-7,2026-01-07 00:00:00 UTC,Nature,2026-01-07 00:00:00+00:00
Oral 4′-fluorouridine rescues nonhuman primates from advanced Lassa fever,https://www.nature.com/articles/s41586-025-09906-y,2026-01-07 00:00:00 UTC,Nature,2026-01-07 00:00:00+00:00
Chronic pain could be eased by uncoupling the sensory and emotional experiences,https://www.nature.com/articles/d41586-025-03987-5,2026-01-07 00:00:00 UTC,Nature,2026-01-07 00:00:00+00:00
Exotic quasiparticles glimpsed in graphene,https://www.nature.com/articles/d41586-025-04016-1,2026-01-07 00:00:00 UTC,Nature,2026-01-07 00:00:00+00:00
Stress controls heterochromatin inheritance via histone H3 ubiquitylation,https://www.nature.com/articles/s41586-025-09899-8,2026-01-07 00:00:00 UTC,Nature,2026-01-07 00:00:00+00:00
Mimicking opioid analgesia in cortical pain circuits,https://www.nature.com/articles/s41586-025-09908-w,2026-01-07 00:00:00 UTC,Nature,2026-01-07 00:00:00+00:00
A way to identify the biological basis of gene–trait associations,https://www.nature.com/articles/d41586-025-04004-5,2026-01-07 00:00:00 UTC,Nature,2026-01-07 00:00:00+00:00
‘I rarely get outside’: scientists ditch fieldwork in the age of AI,https://www.nature.com/articles/d41586-025-04150-w,2026-01-07 00:00:00 UTC,Nature,2026-01-07 00:00:00+00:00
Antisolvent engineering enhanced high-entropy liquid flow thermocells with giant power density for low-grade heat harvesting,http://pubs.rsc.org/en/Content/ArticleLanding/2026/EE/D5EE04880J,2026-01-07 00:00:00 UTC,RSC - Energy Environ. Sci. latest articles,2026-01-07 00:00:00+00:00
Combating Solvent Concentration Polarization for Ultrafast and Highly Stable Lithium Batteries at −60 oC,http://pubs.rsc.org/en/Content/ArticleLanding/2026/EE/D5EE06738C,2026-01-07 00:00:00 UTC,RSC - Energy Environ. Sci. latest articles,2026-01-07 00:00:00+00:00
The complex role of nutrients in cancer spread,https://www.nature.com/articles/d41586-025-03988-4,2026-01-07 00:00:00 UTC,Nature,2026-01-07 00:00:00+00:00
A troubleshooting guide to your flat-pack planet,https://www.nature.com/articles/d41586-025-04028-x,2026-01-07 00:00:00 UTC,Nature,2026-01-07 00:00:00+00:00
Blood protein thwarts deadly fungal disease,https://www.nature.com/articles/d41586-025-03985-7,2026-01-07 00:00:00 UTC,Nature,2026-01-07 00:00:00+00:00
Designing zeolite catalysts for chemical recycling of plastics,https://www.nature.com/articles/s41578-025-00878-z,2026-01-07 00:00:00 UTC,Nature Reviews Materials,2026-01-07 00:00:00+00:00
Rethinking sustainable pathways for PFAS,https://www.nature.com/articles/s41557-025-02044-y,2026-01-07 00:00:00 UTC,Nature Chemistry,2026-01-07 00:00:00+00:00
Homologative alkene difunctionalization,https://www.nature.com/articles/s41557-025-02037-x,2026-01-07 00:00:00 UTC,Nature Chemistry,2026-01-07 00:00:00+00:00
An ancient DNA perspective on the Russian conquest of Yakutia,https://www.nature.com/articles/s41586-025-09856-5,2026-01-07 00:00:00 UTC,Nature,2026-01-07 00:00:00+00:00
Distinct neuronal populations in the human brain combine content and context,https://www.nature.com/articles/s41586-025-09910-2,2026-01-07 00:00:00 UTC,Nature,2026-01-07 00:00:00+00:00
A mechanical ratchet drives unilateral cytokinesis,https://www.nature.com/articles/s41586-025-09915-x,2026-01-07 00:00:00 UTC,Nature,2026-01-07 00:00:00+00:00
Evidence accumulation from experience and observation in the cingulate cortex,https://www.nature.com/articles/s41586-025-09885-0,2026-01-07 00:00:00 UTC,Nature,2026-01-07 00:00:00+00:00
ipRGC properties prevent light from shifting the SCN clock during daytime,https://www.nature.com/articles/s41586-025-09894-z,2026-01-07 00:00:00 UTC,Nature,2026-01-07 00:00:00+00:00
Small persistent humid forest clearings drive tropical forest biomass losses,https://www.nature.com/articles/s41586-025-09870-7,2026-01-07 00:00:00 UTC,Nature,2026-01-07 00:00:00+00:00
Albumin orchestrates a natural host defence mechanism against mucormycosis,https://www.nature.com/articles/s41586-025-09882-3,2026-01-07 00:00:00 UTC,Nature,2026-01-07 00:00:00+00:00
Oldest known poison arrows show Stone Age humans’ technological talents,https://www.nature.com/articles/d41586-026-00051-8,2026-01-07 00:00:00 UTC,Nature,2026-01-07 00:00:00+00:00
Why a fatal ‘black fungus’ struck India during the COVID-19 pandemic,https://www.science.org/content/article/fatal-black-fungus-struck-india-during-covid-19-pandemic-now-researchers-think-they,2026-01-07 05:00:00 UTC,Latest News from Science Magazine,2026-01-07 05:00:00+00:00
Ex–Google CEO funds private space telescope bigger than Hubble,https://www.science.org/content/article/ex-google-ceo-funds-private-space-telescope-bigger-hubble,2026-01-07 05:00:00 UTC,Latest News from Science Magazine,2026-01-07 05:00:00+00:00
Why does Denmark recommend so few childhood vaccines? A Danish scientist explains,https://www.science.org/content/article/why-does-denmark-recommend-so-few-childhood-vaccines-danish-scientist-explains,2026-01-07 05:00:00 UTC,Latest News from Science Magazine,2026-01-07 05:00:00+00:00
Grain‐Optimized Copper Current Collectors for Highly Stable Anode‐Free Sodium Batteries,https://advanced.onlinelibrary.wiley.com/doi/10.1002/adma.202522541?af=R,2026-01-07 05:16:48 UTC,Wiley: Advanced Materials: Table of Contents,2026-01-07 05:16:48+00:00
Customizing Ion Transport by Anionphilic Nanofiber‐Polymer Electrolyte for Stable Zinc Metal Batteries,https://advanced.onlinelibrary.wiley.com/doi/10.1002/adma.202519057?af=R,2026-01-07 05:17:00 UTC,Wiley: Advanced Materials: Table of Contents,2026-01-07 05:17:00+00:00
Molecular Bottom‐Up Design of Single‐Site Copper‐Palladium Catalysts for Selective Glycerol Electro‐Oxidation,https://advanced.onlinelibrary.wiley.com/doi/10.1002/aenm.202504456?af=R,2026-01-07 05:18:48 UTC,Wiley: Advanced Energy Materials: Table of Contents,2026-01-07 05:18:48+00:00
Conformal Vertical Organic Electrochemical Transistors With Ion‐Permeable Electrodes for Electrophysiological Monitoring,https://advanced.onlinelibrary.wiley.com/doi/10.1002/adma.202511945?af=R,2026-01-07 05:18:50 UTC,Wiley: Advanced Materials: Table of Contents,2026-01-07 05:18:50+00:00
Single‐Atomic Fe‐S3‐Mo Sites Triggered Fast Redox Conversion in Li‐S Batteries,https://advanced.onlinelibrary.wiley.com/doi/10.1002/aenm.202506699?af=R,2026-01-07 05:19:44 UTC,Wiley: Advanced Energy Materials: Table of Contents,2026-01-07 05:19:44+00:00
Lewis Acid‐Base Molecular Anchoring Through Oxygen Vacancies Enables Ultrastable and High‐Conductivity Membranes for Alkaline Water Electrolysis,https://advanced.onlinelibrary.wiley.com/doi/10.1002/aenm.202506172?af=R,2026-01-07 05:19:46 UTC,Wiley: Advanced Energy Materials: Table of Contents,2026-01-07 05:19:46+00:00
Resonance‐Hybridized Molecule Driven Perovskite Surface Sulfidation and Electron‐Transport Bridging for Efficient and Stable Inverted Perovskite Solar Cells,https://advanced.onlinelibrary.wiley.com/doi/10.1002/aenm.202505418?af=R,2026-01-07 05:21:00 UTC,Wiley: Advanced Energy Materials: Table of Contents,2026-01-07 05:21:00+00:00
Full‐Textile Electrostimulation Realizing Electrical Waste Reduction,https://advanced.onlinelibrary.wiley.com/doi/10.1002/aenm.202504607?af=R,2026-01-07 05:22:38 UTC,Wiley: Advanced Energy Materials: Table of Contents,2026-01-07 05:22:38+00:00
Outside Back Cover: Rhodopsin‐Mimicking Reversible Photo‐Switchable Chloride Channels Based on Azobenzene‐Appended Semiaza‐Bambusurils for Light‐Controlled Ion Transport and Cancer Cell Apoptosis,https://onlinelibrary.wiley.com/doi/10.1002/anie.2025-m0501054600?af=R,2026-01-07 05:23:27 UTC,Wiley: Angewandte Chemie International Edition: Table of Contents,2026-01-07 05:23:27+00:00
Quantum to Device AI‐Guided Passivation Paradigm for All‐Weather Ultrastable MXene Based Photothermal Converter,https://advanced.onlinelibrary.wiley.com/doi/10.1002/adma.202519482?af=R,2026-01-07 05:25:08 UTC,Wiley: Advanced Materials: Table of Contents,2026-01-07 05:25:08+00:00
Conjugated Polyelectrolytes with Tunable Ionic Side Chains for Iodide‐Mediated Pt Reduction in Photoelectrochemical H2 Generation,https://advanced.onlinelibrary.wiley.com/doi/10.1002/aenm.202505450?af=R,2026-01-07 05:25:40 UTC,Wiley: Advanced Energy Materials: Table of Contents,2026-01-07 05:25:40+00:00
Adaptive O2 Activation on a Molecular Platform: Promoting Spiro‐OMeTAD Doping for High Efficiency Carbon‐Based Perovskite Solar Cells,https://advanced.onlinelibrary.wiley.com/doi/10.1002/aenm.202506649?af=R,2026-01-07 05:27:26 UTC,Wiley: Advanced Energy Materials: Table of Contents,2026-01-07 05:27:26+00:00
"Resistive Switching Oxides: Mechanism, Performance, and Device‐Algorithm Co‐Design for Artificial Intelligence",https://advanced.onlinelibrary.wiley.com/doi/10.1002/adma.202517373?af=R,2026-01-07 05:27:30 UTC,Wiley: Advanced Materials: Table of Contents,2026-01-07 05:27:30+00:00
In Vivo Generation and Manipulation of CAR‐T‐mimicking Cells via Magnetic Bispecific Nano‐antibody for Solid Tumor Therapy,https://advanced.onlinelibrary.wiley.com/doi/10.1002/adma.202520493?af=R,2026-01-07 05:28:16 UTC,Wiley: Advanced Materials: Table of Contents,2026-01-07 05:28:16+00:00
Addressing Electro‐Chemo‐Mechanical Coupling Failure at the Sodium|Na3PS4 Interface towards Durable All‐Solid‐State Sodium Metal Batteries,https://advanced.onlinelibrary.wiley.com/doi/10.1002/aenm.202506260?af=R,2026-01-07 05:30:09 UTC,Wiley: Advanced Energy Materials: Table of Contents,2026-01-07 05:30:09+00:00
Constructing High‐Tg and Ultra‐Strong Multifunctional Thermosets Enabled by Acid‐Base Ion Pairs,https://advanced.onlinelibrary.wiley.com/doi/10.1002/adma.202512584?af=R,2026-01-07 05:36:57 UTC,Wiley: Advanced Materials: Table of Contents,2026-01-07 05:36:57+00:00
A Stable Sodium Metal Battery at −40°C: Multiphase Sodium‐Alloy Skeleton Guided Uniform Deposition and Fast Desolvation,https://advanced.onlinelibrary.wiley.com/doi/10.1002/adma.202521120?af=R,2026-01-07 05:41:04 UTC,Wiley: Advanced Materials: Table of Contents,2026-01-07 05:41:04+00:00
Rare Iron Age war trumpet and boar standard found,https://www.bbc.com/news/articles/cr7jvj8d39eo?at_medium=RSS&at_campaign=rss,2026-01-07 06:02:51 UTC,BBC News,2026-01-07 06:02:51+00:00
Carbon capture company lands nearly £1m in backing,https://www.bbc.com/news/articles/cdex9kd4n06o?at_medium=RSS&at_campaign=rss,2026-01-07 06:10:34 UTC,BBC News,2026-01-07 06:10:34+00:00
"The Yeh pilus adhesin is equipped with an α-helical flap motif, which contributes to pectin adherence",https://www.science.org/doi/abs/10.1126/sciadv.adz1301?af=R,2026-01-07 08:00:00 UTC,AAAS: Science Advances: Table of Contents,2026-01-07 08:00:00+00:00
Can paleontologists pinpoint the dawn of the dinosaurs?,https://www.pnas.org/doi/abs/10.1073/pnas.2535891123?mi=eymic2&af=R&access=on&content=articlesChapters&publication=pnas&sortBy=Earliest&target=default,2026-01-07 08:00:00 UTC,Proceedings of the National Academy of Sciences: Keyword search for query,2026-01-07 08:00:00+00:00
Mouse digit AAV gene delivery into fibroblasts regulates regenerative outcome,https://www.science.org/doi/abs/10.1126/sciadv.adz0229?af=R,2026-01-07 08:00:00 UTC,AAAS: Science Advances: Table of Contents,2026-01-07 08:00:00+00:00
Multimetallic synergies in tandem plasmonic photocatalysis,https://www.pnas.org/doi/abs/10.1073/pnas.2533097122?mi=eymic2&af=R&access=on&content=articlesChapters&publication=pnas&sortBy=Earliest&target=default,2026-01-07 08:00:00 UTC,Proceedings of the National Academy of Sciences: Keyword search for query,2026-01-07 08:00:00+00:00
Reply to Sun: Real-world bulk density changes support high carbon sequestration potential of biochar,https://www.pnas.org/doi/abs/10.1073/pnas.2533070123?mi=eymic2&af=R&access=on&content=articlesChapters&publication=pnas&sortBy=Earliest&target=default,2026-01-07 08:00:00 UTC,Proceedings of the National Academy of Sciences: Keyword search for query,2026-01-07 08:00:00+00:00
The right environment switches the enzymatic character,https://www.pnas.org/doi/abs/10.1073/pnas.2531791123?mi=eymic2&af=R&access=on&content=articlesChapters&publication=pnas&sortBy=Earliest&target=default,2026-01-07 08:00:00 UTC,Proceedings of the National Academy of Sciences: Keyword search for query,2026-01-07 08:00:00+00:00
Effective chilling temperatures for dormancy release in extratropical forest trees increase from cold to warm regions,https://www.pnas.org/doi/abs/10.1073/pnas.2531077123?mi=eymic2&af=R&access=on&content=articlesChapters&publication=pnas&sortBy=Earliest&target=default,2026-01-07 08:00:00 UTC,Proceedings of the National Academy of Sciences: Keyword search for query,2026-01-07 08:00:00+00:00
Reframing the axon initial segment: Giant ankyrin-G as a modulator of excitability and plasticity in neurodevelopment,https://www.pnas.org/doi/abs/10.1073/pnas.2530592122?mi=eymic2&af=R&access=on&content=articlesChapters&publication=pnas&sortBy=Earliest&target=default,2026-01-07 08:00:00 UTC,Proceedings of the National Academy of Sciences: Keyword search for query,2026-01-07 08:00:00+00:00
Museum collections provide a temporal record of past genetic variation,https://www.pnas.org/doi/abs/10.1073/pnas.2530586122?mi=eymic2&af=R&access=on&content=articlesChapters&publication=pnas&sortBy=Earliest&target=default,2026-01-07 08:00:00 UTC,Proceedings of the National Academy of Sciences: Keyword search for query,2026-01-07 08:00:00+00:00
Combination antiviral and anti-inflammatory therapy mitigates persistent neurological deficits in mice post SARS-CoV-2 infection,https://www.pnas.org/doi/abs/10.1073/pnas.2530209123?mi=eymic2&af=R&access=on&content=articlesChapters&publication=pnas&sortBy=Earliest&target=default,2026-01-07 08:00:00 UTC,Proceedings of the National Academy of Sciences: Keyword search for query,2026-01-07 08:00:00+00:00
"Correction for He et al., GATA2 facilitates steroid receptor coactivator recruitment to the androgen receptor complex",https://www.pnas.org/doi/abs/10.1073/pnas.2528643122?mi=eymic2&af=R&access=on&content=articlesChapters&publication=pnas&sortBy=Earliest&target=default,2026-01-07 08:00:00 UTC,Proceedings of the National Academy of Sciences: Keyword search for query,2026-01-07 08:00:00+00:00
Imputing unjustified bulk density values to soils with biochar addition biases soil carbon sequestration estimates,https://www.pnas.org/doi/abs/10.1073/pnas.2528257123?mi=eymic2&af=R&access=on&content=articlesChapters&publication=pnas&sortBy=Earliest&target=default,2026-01-07 08:00:00 UTC,Proceedings of the National Academy of Sciences: Keyword search for query,2026-01-07 08:00:00+00:00
Repeated losses of self-fertility shaped heterozygosity and polyploidy in yeast evolution,https://www.pnas.org/doi/abs/10.1073/pnas.2525679123?mi=eymic2&af=R&access=on&content=articlesChapters&publication=pnas&sortBy=Earliest&target=default,2026-01-07 08:00:00 UTC,Proceedings of the National Academy of Sciences: Keyword search for query,2026-01-07 08:00:00+00:00
O-acyltransferase genes involved in the production of volatile sex pheromones in Caenorhabditis elegans,https://www.pnas.org/doi/abs/10.1073/pnas.2524778123?mi=eymic2&af=R&access=on&content=articlesChapters&publication=pnas&sortBy=Earliest&target=default,2026-01-07 08:00:00 UTC,Proceedings of the National Academy of Sciences: Keyword search for query,2026-01-07 08:00:00+00:00
T-bet-expressing Tr1 cells driven by dietary signals dominate the small intestinal immune landscape,https://www.pnas.org/doi/abs/10.1073/pnas.2520747122?mi=eymic2&af=R&access=on&content=articlesChapters&publication=pnas&sortBy=Earliest&target=default,2026-01-07 08:00:00 UTC,Proceedings of the National Academy of Sciences: Keyword search for query,2026-01-07 08:00:00+00:00
Network structure shapes consensus dynamics through individual decisions,https://www.pnas.org/doi/abs/10.1073/pnas.2520483123?mi=eymic2&af=R&access=on&content=articlesChapters&publication=pnas&sortBy=Earliest&target=default,2026-01-07 08:00:00 UTC,Proceedings of the National Academy of Sciences: Keyword search for query,2026-01-07 08:00:00+00:00
The anticipation of imminent events is time-scale invariant,https://www.pnas.org/doi/abs/10.1073/pnas.2518982123?mi=eymic2&af=R&access=on&content=articlesChapters&publication=pnas&sortBy=Earliest&target=default,2026-01-07 08:00:00 UTC,Proceedings of the National Academy of Sciences: Keyword search for query,2026-01-07 08:00:00+00:00
Unveiling a proton-coupled electron-transfer mechanistic library of nitrate to ammonia via ultramicroelectrode-hyphenated mass spectrometry,https://www.pnas.org/doi/abs/10.1073/pnas.2518909122?mi=eymic2&af=R&access=on&content=articlesChapters&publication=pnas&sortBy=Earliest&target=default,2026-01-07 08:00:00 UTC,Proceedings of the National Academy of Sciences: Keyword search for query,2026-01-07 08:00:00+00:00
Cholesterol-containing lipid crystals can directly stiffen the rat steatotic liver before fibrosis,https://www.pnas.org/doi/abs/10.1073/pnas.2518060123?mi=eymic2&af=R&access=on&content=articlesChapters&publication=pnas&sortBy=Earliest&target=default,2026-01-07 08:00:00 UTC,Proceedings of the National Academy of Sciences: Keyword search for query,2026-01-07 08:00:00+00:00
Adult neural stem cells mediate hippocampal synapse elimination for circuit homeostasis through MERTK,https://www.pnas.org/doi/abs/10.1073/pnas.2517096123?mi=eymic2&af=R&access=on&content=articlesChapters&publication=pnas&sortBy=Earliest&target=default,2026-01-07 08:00:00 UTC,Proceedings of the National Academy of Sciences: Keyword search for query,2026-01-07 08:00:00+00:00
