title,link,source,published_str,pub_date,doi,abstract,abstract_source,must_have_abstract
Phase engineering of relaxor ferroelectricity in van der Waals crystal,https://www.nature.com/articles/s41467-026-69272-9,Nature Communications,2026-02-09 00:00:00 UTC,2026-02-09 00:00:00+00:00,,"Phase engineering of two-dimensional van der Waals materials offer a rich landscape to uncover the potential ferroelectric properties. The precisely controlling phases in these reduced dimensional materials with the unique atomic arrangement are crucial. Herein, through a novel phase engineering approach, we synthesize CuInP2(S1-xSex)6 crystal with controllable coexistence of monoclinic and trigonal phases, and experimentally realize relaxor ferroelectricity in low-dimensional materials. Composition tailoring creates an intermediate phase transition region, which facilitates the evolution of ferroelectricity into relaxor ferroelectricity and eventually superparaelectricity. The relaxor ferroelectric properties are verified by the hysteresis-free polarization switching and diffused phase transition. High-resolution transmission electron microscopy reveals that edge dislocations play a critical role in forming locally disordered polar structures. When integrated it into a memristor device, the relaxor crystal with nanodomains demonstrates an increased number of analog resistance states and lower operating voltages compared to conventional ferroelectric crystals. This work establishes a phase engineering strategy to tailor ferroelectric behavior in low-dimensional materials, offering substantial potential for future electronic applications.",nature_html,0
Atomically precise synthesis and simultaneous heterostructure integration of 2D transition metal dichalcogenides through nano-confinement,https://www.nature.com/articles/s41563-026-02495-9,Nature Materials,2026-02-09 00:00:00 UTC,2026-02-09 00:00:00+00:00,,"Two-dimensional (2D) materials, such as graphene, transition metal dichalcogenides (TMDs) and hexagonal boron nitride, exhibit intriguing properties that are sensitive to their atomic-scale structures and can be further enriched through van der Waals (vdW) integration. However, the precise synthesis and clean integration of 2D materials remain challenging. Here, using graphene or hexagonal boron nitride as a vdW capping layer, we create a nano-confined environment that directs the growth kinetics of 2D TMDs (such as NbSe2 and MoS2), enabling precise formation of TMD monolayers with tailored morphologies, from isolated monolayer domains to large-scale continuous films and intrinsically patterned rings. Moreover, Janus S–Mo–Se monolayers are synthesized with atomic precision via vdW-protected bottom-plane chalcogen substitution. Importantly, our approach simultaneously produces ultraclean vdW interfaces. This in situ encapsulation reliably preserves air-sensitive materials, as evidenced by the enhanced superconductivity of nano-confined NbSe2 monolayers. Altogether, our study establishes a versatile platform for the controlled synthesis and integration of 2D TMDs for advanced applications.",nature_html,0
A dialysate-free wearable artificial kidney prototype driven by a liquid–gas phase transition,https://www.nature.com/articles/s44286-026-00355-6,Nature Chemical Engineering,2026-02-09 00:00:00 UTC,2026-02-09 00:00:00+00:00,,"The wearable artificial kidney has emerged as a promising therapeutic alternative for end-stage renal disease due to its flexibility and portability, effectively clearing water and uremic toxins. However, conventional hemodialysis-based devices rely on liquid–liquid exchange and necessitate large quantities of dialysate to sustain a sufficient concentration gradient across the dialysis membrane, compromising portability and mobility. Here we develop a dialysate-free wearable artificial kidney prototype that uses a blood purifier for water removal, based on a vapor-driven liquid–gas phase transition, and integrates adsorption to remove uremic toxins. The system achieves a high water clearance flux of approximately 7 ml min−1 m−2 and successfully performs renal replacement therapy in rabbits with acute renal injury, efficiently removing water, creatinine and β2-microglobulin. With a current weight of less than 3.8 kg and potential for further engineering optimization, this dialysate-free wearable artificial kidney prototype supports the feasibility of practical portable blood purification, opening avenues for flexible and efficient nephropathy treatment.",nature_html,0
Precisely constructing subsurface electron pump stabilizes Pt catalysts against oxygen-induced degradation in fuel cells,https://www.cell.com/matter/fulltext/S2590-2385(25)00649-6?rss=yes,Matter,2026-02-09 00:00:00 UTC,2026-02-09 00:00:00+00:00,,"Atomic layer deposition enables the precise interstitial doping of boron single atoms into the subsurface of Pt nanoparticles, inducing asymmetric strain and electron pump effect that effectively suppress the electrochemical corrosion of unsaturated Pt sites from the inside-out without sacrificing the electrochemical active surface area, thereby endowing the Pt-based electrocatalyst with long-term fuel cell durability.",rss_cell,0
A dynamic charge-dependent nanofungicide platform for sustainable agrochemical deposition and delivery,https://www.cell.com/chem/fulltext/S2451-9294(25)00476-0?rss=yes,Chem,2026-02-09 00:00:00 UTC,2026-02-09 00:00:00+00:00,,"This work presents a “dynamic” surface-charge nanofungicide platform that leverages environmental temperature as the trigger to overcoming the trade-off between strong surface binding and restricted uptake. Oppositely charged and thermo-responsive polymer nanocarriers engineered via flash nanoprecipitation enable controlled in situ transition from initially high surface positivity that facilitates deposition to a moderate positive charge, which further improves uptake of broad-spectrum fungicides. This simultaneous enhancement of deposition and uptake efficiency provide maximizing utilization efficacy, reducing dosages for sustainable agrochemical application.",rss_cell,0
Daily briefing: The dark side of the battery boom,https://www.nature.com/articles/d41586-026-00436-9,Nature,2026-02-09 00:00:00 UTC,2026-02-09 00:00:00+00:00,,,,0
"Coffee linked to slower brain ageing in study of 130,000 people",https://www.nature.com/articles/d41586-026-00409-y,Nature,2026-02-09 00:00:00 UTC,2026-02-09 00:00:00+00:00,,,,0
Measles is raging worldwide: are you at risk?,https://www.nature.com/articles/d41586-026-00367-5,Nature,2026-02-09 00:00:00 UTC,2026-02-09 00:00:00+00:00,,,,0
TiO2 protective layers shape photocathode performance in photoelectrochemical CO2 reduction,https://academic.oup.com/nsr/advance-article/doi/10.1093/nsr/nwag092/8469401?rss=1,National Science Review Advance Access,2026-02-09 00:00:00 UTC,2026-02-09 00:00:00+00:00,10.1093/nsr/nwag092/8469401,"Photoelectrochemical carbon dioxide reduction (PEC CO2R) enables direct solar-to-chemical conversion. However, few photocathodes are intrinsically stable light absorbers. The application of protective layers remains a critical approach for stabilizing photocathodes in corrosive environments. TiO2 is the most widely adopted stabilizer, yet its influence on catalytic performance remains poorly understood. Here we examine TiO2-protected Cu2O photocathodes integrated with Au, Cu and Bi cocatalysts, combining experiments and simulations to unravel the role of the TiO2 overlayer. We find that TiO2 profoundly alters catalytic selectivity, suppressing CO and multicarbon (C2+) pathways, while its impact on formate production with Bi, In and Sn cocatalysts is comparatively negligible. These results demonstrate that TiO2 is not an inert stabilizer but an active component that reshapes interfacial reaction pathways. This work establishes critical design principles for integrating protective layers with photocathodes to achieve selective and efficient PEC CO2R.",rss_oup,0
Engineered gradient oxygen vacancies by ambient ball-milling boost ampere-level water electrolysis stability,https://academic.oup.com/nsr/advance-article/doi/10.1093/nsr/nwag070/8469398?rss=1,National Science Review Advance Access,2026-02-09 00:00:00 UTC,2026-02-09 00:00:00+00:00,10.1093/nsr/nwag070/8469398,"Balancing the activity and stability of catalysts has become one of the key approaches to breakthrough the bottleneck of ampere-level water electrolysis. Oxygen vacancy is one of the most important active structures in catalysts. The complex structure of oxygen vacancy, such as the spatial distribution, profoundly affects the catalytic activity and mechanism. Here, we present a mechanochemical method that utilizes controlled environment pressure to create oxygen vacancies and modulate its spatial distribution in Pr0.5Ba0.5CoO3 by regulating the surface desorption and lattice diffusion process of lattice oxygen. Combining computational and experimental results, we proposed a detailed synthesis mechanism that outlines the formation and diffusion behavior of vacancies at the atomic scales. Further electrochemical studies developed two OER descriptors, surface and bulk oxygen vacancy concentrations, suitable for different catalytic mechanisms. Also, the above research further proposed an oxygen vacancy distribution control strategy, which can significantly improve the stability of the catalyst at ampere-level current density and under practical working conditions while maintaining their high intrinsic activity through the switching of catalytic mechanisms. This work offers a mechanochemical method for synthesizing oxygen vacancies and paves the new way for the development of ampere-level industrial electrolytic water catalysts.",rss_oup,0
First systematic experimental 2D mapping of linearly polarized γ-ray polarimetric distribution in relativistic Compton scattering,https://academic.oup.com/nsr/advance-article/doi/10.1093/nsr/nwag073/8469397?rss=1,National Science Review Advance Access,2026-02-09 00:00:00 UTC,2026-02-09 00:00:00+00:00,10.1093/nsr/nwag073/8469397,"The interaction of photons with relativistic electrons constitutes a fundamental electromagnetic process whose polarization transfer mechanics remain incompletely characterized. We report the first systematic measurement of spatial polarization distribution for γ rays generated via 45○ slant Inverse Compton Scattering (ICS) between linearly polarized 0.117 eV photons and 3.5 GeV electrons, performing full 2D mapping of intensity, Angle Of Polarization (AOP), and Degree Of Polarization (DOP). Measurements reveal an asymmetric beam profile along the laser’s polarization direction that resembles 180○ backward ICS observations. The central beam region exhibits DOP near 1.0 with AOP rigidly aligned at 45○, while peripheral regions display complex non-uniform polarization distributions. These findings confirm quantum electrodynamics predictions of near-complete polarization transfer along the beam axis in slant geometries, thus establishing slant scattering as a viable alternative to head-on configurations for generating high DOP γ rays.",rss_oup,0
Dynamic observation of reductive and oxidative hydroxylation of CoOx nanostructures in water vapor,https://academic.oup.com/nsr/advance-article/doi/10.1093/nsr/nwag085/8469403?rss=1,National Science Review Advance Access,2026-02-09 00:00:00 UTC,2026-02-09 00:00:00+00:00,10.1093/nsr/nwag085/8469403,"Water plays important roles in many energy chemistry and catalysis processes and yet atomic-scale understanding of water-solid interaction in the water-involved interfacial processes still remains further explored. Here, combining high-pressure scanning tunneling microscopy and theoretical calculation we have visualized and elucidated both oxidation of CoO bilayers and reduction of CoO2 trilayers in water atmospheres. CoO bilayers are readily hydroxylated to Co(OH)2 with slight Co oxidation even at 10−8 mbar H2O. At CoO2−x",rss_oup,0
TaWRKY115 enhances cold tolerance by weakening the expression of TaMYB4 on CBFs in common wheat,https://academic.oup.com/nsr/advance-article/doi/10.1093/nsr/nwag087/8469391?rss=1,National Science Review Advance Access,2026-02-09 00:00:00 UTC,2026-02-09 00:00:00+00:00,10.1093/nsr/nwag087/8469391,Low temperature as one of the most important abiotic stresses has caused serious wheat production loss worldwide. We identified TaWRKY115,rss_oup,0
Electron hopping in conjugated molecular wires with application to solar cells,https://www.nature.com/articles/s41557-025-02034-0,Nature Chemistry,2026-02-09 00:00:00 UTC,2026-02-09 00:00:00+00:00,,"Electron transfer through molecular wires underpins numerous research fields, ranging from single-molecule electronics to fundamental biological processes and their application in (bio)electrocatalysis. Here we report a series of 1–3-nm-long ferrocene-terminated conjugated molecular wires, anchored to indium tin oxide electrodes, that exhibit an electron transfer mechanism dominated by hopping (with a β value of 0.043 Å−1). We show that the nature of the electrode, namely the small energy gap between the electron donor and acceptor, explains the unexpected electron transfer mechanism in these short wires. We demonstrate the applicability of these anchored molecular wires as the hole-extraction layer in a tin perovskite solar cell. We show improved performance in devices employing these molecular wires compared with the more conventional hole-extraction layers typically used in tin perovskite solar cells. This work not only opens avenues for mechanistic investigations of interfacial electron transfer using molecular wires but also showcases their potential impact in applications such as photovoltaics.",nature_html,0
The roles of women in cookstove intervention studies,https://www.nature.com/articles/s41893-026-01769-z,Nature Sustainability,2026-02-09 00:00:00 UTC,2026-02-09 00:00:00+00:00,,"Clean cooking fuel interventions can substantially advance Sustainable Development Goals related to health, poverty, gender equality and (possibly) climate change. Here we systematically review gender roles within cookstove randomized control trials (RCTs) with respect to (1) health and exposure; (2) time, labour, finance and behaviour; (3) climate; and (4) the research activities. We focus on RCTs because public health scholarship considers RCTs, despite limitations, to provide the highest-quality evidence to guide policy and widescale programming. Across our 123 included studies, women are frequently targeted but then not acknowledged in time, labour, finances and even health outcomes. Acknowledgement of gender norms is scarce. Using WHO gender-responsiveness categories, we find that 37% of studies were gender-unequal or gender-unaware. Women are often monitored only as proxies for their unborn children, our category of gender-unaware but sex-aware (26%). Twenty-nine percent are gender-sensitive, with only 6% gender-specific and two gender-transformative studies. We present recommendations for the field to shift to more gender-sensitive research designs, without which the field risks leaning into existing inequalities and basing future interventions on spuriously gender-neutral premises.",nature_html,0
Intelligent fouling monitoring in membrane-based wastewater treatment,https://www.nature.com/articles/s41893-026-01766-2,Nature Sustainability,2026-02-09 00:00:00 UTC,2026-02-09 00:00:00+00:00,,"Membrane bioreactors (MBRs) are widely implemented in many wastewater treatment plants (WWTPs), contributing to a sustainable urban water cycle. However, they are often challenged by the problem of membrane fouling. Developing tools capable of monitoring and providing early warning of fouling events is therefore essential to maintain the operational stability of MBRs. Here we propose a spectral sensing empowered machine learning strategy for prediction and providing early warning of fouling events and validate it in a full-scale MBR during long-term operation. Specifically, integrated with ultraviolet-visible and fluorescence spectral fingerprints that can sensibly profile the key molecular structures responsible for fouling, a data–knowledge codriven machine learning model was established. The model can accurately (R2 > 0.80) predict fouling tendency within the next 5‒7 days, which is superior to purely data-driven learning. Spectral fingerprints contributed 17‒30% of interpretability across models, and process conditions and other membrane/foulant material descriptors explained the rest. By exploring the spectral fingerprints of specific processes, our strategy could also be generalized to various WWTPs, offering an intelligent solution (for example, with the aid of spectral early warning) to achieve stable operation of WWTPs and ultimately contribute to a cleaner environment.",nature_html,0
Efficient Photoreforming of Biomass Derived 5-(Hydroxymethyl)furfural and Simultaneous Green Hydrogen Production by Defective Graphitic Carbon Nitride Photocatalysts,http://pubs.rsc.org/en/Content/ArticleLanding/2026/EE/D5EE02574E,RSC - Energy Environ. Sci. latest articles,2026-02-09 00:00:00 UTC,2026-02-09 00:00:00+00:00,,"Using solar energy and water to convert biomass-derived 5-hydroxymethylfurfural (HMF) into valuable chemicals, while simultaneously producing green hydrogen, offers a promising recycling approach for a significant source of agricultural waste. Here, we report the design of a selective, stable and efficient HMF photocatalyst by the structural engineering of graphitic carbon nitride nanosheets. Our optimal few-layered nanosheet structure loaded with Pt clusters demonstrates high photocatalytic performance, achieving selective photooxidation of HMF to valuable 2,5-diformylfuran and 5-formyl-2-furancarboxylic acid, and the co-production of hydrogen at a high evolution rate of 75.52 ± 0.46 μmol gcat-1 h-1, over 10 days of photoreforming. Density functional theory and comprehensive physicochemical characterisation reveal a synergistic effect of the Pt and carbon nitride surfaces, with the former enhancing water adsorption and dissociation and the latter providing a high density of COOH, -CO, and -COH adsorption sites for HMF. These insights on the optimal structuring of carbon nitride nanosheets provide a promising direction for the design of efficient photocatalysts for photoreforming with impact on various sustainable chemical recycling approaches.",rsc_html,0
Phytic acid (InsP6) activates HDAC3 epigenetic axis to maintain intestinal barrier function,https://www.nature.com/articles/s41467-026-68994-0,Nature Communications,2026-02-09 00:00:00 UTC,2026-02-09 00:00:00+00:00,,"HDAC inhibition shows promise in cancer treatment but pan-HDAC inhibitors cause gastrointestinal issues in 48% of patients. Understanding HDAC activation mechanisms is crucial to treating diverse diseases beyond cancer. Our study reveals that inositol polyphosphate multikinase (IPMK) and inositol hexakisphosphate (InsP6 or phytic acid), enriched in vegan diets, play essential roles in activating the HDAC3 epigenetic axis and maintaining intestinal barrier integrity. IPMK binds to HDAC3 and drives InsP6 synthesis, which selectively activates HDAC3 at a 10 nM concentration by recruiting the DAD domain of its corepressor protein. IPMK deletion diminishes HDAC3 activation, leading to histone hyperacetylation and MMP gene transcription that compromise intestinal barrier integrity. InsP6 treatment is sufficient to rescue these effects. In inflammatory bowel disease, diminished IPMK levels exacerbate intestinal permeability, while oral InsP6 treatment mitigates leaky gut effects by restoring the HDAC3 epigenetic axis, highlighting the clinical significance of the IPMK-HDAC3 pathway and the therapeutic potential of phytic acid.",nature_html,0
CasMiner: a deep learning tool for high-throughput mining and rational design of efficient Cas9,https://academic.oup.com/nsr/advance-article/doi/10.1093/nsr/nwag090/8469394?rss=1,National Science Review Advance Access,2026-02-09 00:00:00 UTC,2026-02-09 00:00:00+00:00,10.1093/nsr/nwag090/8469394,"Since its inception, the CRISPR-Cas system, particularly Cas9, has demonstrated immense potential for life science applications, but expansion of the Cas9 toolkit is constrained by sequence alignment-based strategies for mining and optimization. Here, we developed CasMiner, a deep learning model for discovering and engineering novel Cas9 proteins. CasMiner achieved 99.63% accuracy in predicting Cas9s, and identified VpCas9 from public databases. Experimental validation showed that VpCas9 exhibits robust double-strand cleavage activity. Combining CasMiner and evolutionary analysis, we engineered three mutants with markedly increased structural rigidity and positive charge. In vivo",rss_oup,0
Tailoring sodium and oxygen mixed-ion conduction in the A-site non-stoichiometric NaNbO3-based ceramics,https://www.nature.com/articles/s41467-026-69428-7,Nature Communications,2026-02-09 00:00:00 UTC,2026-02-09 00:00:00+00:00,,"Tailoring the electronic or ionic conduction properties of solid-state electrolytes with precision is essential to fulfilling the functional demands of electrochemical energy storage and conversion technologies. Here, the synergistic regulation of Na+ and O2− ions conduction in the Na0.96xCa0.04Nb0.96Zr0.04O3-δ conductor is achieved by the non-stoichiometric ratio strategy. Crystal structure and electrical property analyses reveal that all samples feature a Pbma orthorhombic structure. With rising Na content, the defect characteristics shift from vacancies to interstitials, the NbO6 octahedra experience a change from being compressed to normal and then to being obliquely flattened, which leads to an expansion of the corresponding interstitials in the Na-O-Na and Na-O-Nb networks. By changing the structures of these three types of polyhedron and networks, the conduction channels of Na+ and O2− ions as well as electrons can be effectively regulated. The O2− ions are the main charge carriers for Na-deficient samples, stoichiometric samples feature the mixed O2− ions and intrinsic electrons, while Na⁺ ions become the dominant carriers for Na-excess samples. This work highlights the important role of lattice defects and oxygen octahedral distortions/twisting on the conductivity, offering insights into the design of and Na+/O2− ions migration pathways in solid-state ion conductors.",nature_html,0
Modulating Electron Delocalization Structure in Covalent Organic Frameworks Through Conjugation and Hybridization to Boost Li‐ion Migration Dynamics,https://onlinelibrary.wiley.com/doi/10.1002/anie.202525864?af=R,Wiley: Angewandte Chemie International Edition: Table of Contents,2026-02-09 05:38:51 UTC,2026-02-09 05:38:51+00:00,10.1002/anie.202525864,"ABSTRACT
                  
                    The inherent factors influencing the growth of lithium (Li) dendrites and the kinetics of Li
                    +
                    migration in polymer electrolytes lie in the electron cloud density distribution in the electrolyte. Localized electrons accumulation can trigger the uneven Li
                    +
                    deposition, ultimately leading to battery failure. To address this critical challenge, the concept of p–π conjugation and B–O sp
                    2
                    hybridization is innovatively incorporated into covalent organic frameworks (COFs) to mitigate local interfacial Li
                    +
                    accumulation and improve Li
                    +
                    migration kinetics in electrolytes by electron delocalization. Furthermore, perfluoroalkyl group with virtues of superior electron regulating capabilities and improved electrochemical‐window, is strategically grafted to better match high‐voltage cathodes. Under the synergistic role of electron regulation, the electrolyte with pπ–sp
                    2
                    ‐COF significantly improves overall electrochemical performance of solid‐state batteries. Thus, regulating electron density via p‐π conjugation and B‐O sp
                    2
                    hybridization promises to open new avenues for the development of COFs‐modified polymer electrolytes in solid‐state batteries.",crossref,0
