title,link,published,source,pub_date
In This Issue,https://www.pnas.org/doi/abs/10.1073/iti1926123?mi=eymic2&af=R&access=on&content=articlesChapters&publication=pnas&sortBy=Earliest&target=default,2026-05-12 07:00:00 UTC,Proceedings of the National Academy of Sciences: Keyword search for query,2026-05-12 07:00:00+00:00
Alleviating administrative burdens in rental assistance promotes access and program efficiency,https://www.pnas.org/doi/abs/10.1073/pnas.2512756123?mi=eymic2&af=R&access=on&content=articlesChapters&publication=pnas&sortBy=Earliest&target=default,2026-05-12 07:00:00 UTC,Proceedings of the National Academy of Sciences: Keyword search for query,2026-05-12 07:00:00+00:00
Ancestral splice variation is a key substrate for rapid diversification in African cichlids,https://www.pnas.org/doi/abs/10.1073/pnas.2516477123?mi=eymic2&af=R&access=on&content=articlesChapters&publication=pnas&sortBy=Earliest&target=default,2026-05-12 07:00:00 UTC,Proceedings of the National Academy of Sciences: Keyword search for query,2026-05-12 07:00:00+00:00
Empirical validation of race-neutral normative brain morphometry models across ethnoracially diverse populations,https://www.pnas.org/doi/abs/10.1073/pnas.2521055123?mi=eymic2&af=R&access=on&content=articlesChapters&publication=pnas&sortBy=Earliest&target=default,2026-05-12 07:00:00 UTC,Proceedings of the National Academy of Sciences: Keyword search for query,2026-05-12 07:00:00+00:00
Correlating surface adsorbate configuration and electrochemical performance of IrO2 during seawater-relevant electrolysis,https://www.pnas.org/doi/abs/10.1073/pnas.2529533123?mi=eymic2&af=R&access=on&content=articlesChapters&publication=pnas&sortBy=Earliest&target=default,2026-05-12 07:00:00 UTC,Proceedings of the National Academy of Sciences: Keyword search for query,2026-05-12 07:00:00+00:00
Selective targeting of kinesin on lipid droplets in the liver reduces plasma lipids,https://www.pnas.org/doi/abs/10.1073/pnas.2528332123?mi=eymic2&af=R&access=on&content=articlesChapters&publication=pnas&sortBy=Earliest&target=default,2026-05-12 07:00:00 UTC,Proceedings of the National Academy of Sciences: Keyword search for query,2026-05-12 07:00:00+00:00
Geometric ordering in bacterial communities,https://www.pnas.org/doi/abs/10.1073/pnas.2526643123?mi=eymic2&af=R&access=on&content=articlesChapters&publication=pnas&sortBy=Earliest&target=default,2026-05-12 07:00:00 UTC,Proceedings of the National Academy of Sciences: Keyword search for query,2026-05-12 07:00:00+00:00
The most efficient origami torus,https://www.pnas.org/doi/abs/10.1073/pnas.2523301123?mi=eymic2&af=R&access=on&content=articlesChapters&publication=pnas&sortBy=Earliest&target=default,2026-05-12 07:00:00 UTC,Proceedings of the National Academy of Sciences: Keyword search for query,2026-05-12 07:00:00+00:00
NEXT-FRET maps nonequilibrium rerouting of Escherichia coli maltose-binding protein folding by its signal peptide and chaperones,https://www.pnas.org/doi/abs/10.1073/pnas.2529979123?mi=eymic2&af=R&access=on&content=articlesChapters&publication=pnas&sortBy=Earliest&target=default,2026-05-12 07:00:00 UTC,Proceedings of the National Academy of Sciences: Keyword search for query,2026-05-12 07:00:00+00:00
Revised Solvent Rule Unlocks Non‐Conventional Solvents for Na+‐Solvent Co‐Intercalation in Graphite,https://advanced.onlinelibrary.wiley.com/doi/10.1002/adma.202521350?af=R,2026-05-12 07:22:48 UTC,Wiley: Advanced Materials: Table of Contents,2026-05-12 07:22:48+00:00
ALP‐Responsive Luminescent Nanosheets Promote Precise Hepatitis Theragnostic by Co‐Targeting NLRP3 and Cholestasis,https://advanced.onlinelibrary.wiley.com/doi/10.1002/adma.73312?af=R,2026-05-12 07:24:41 UTC,Wiley: Advanced Materials: Table of Contents,2026-05-12 07:24:41+00:00
A Panoramic View on Plastic Waste Recycling and Upcycling: Heterogeneous Catalytic Strategies for Diverse Plastics and Multiple Pathways,https://advanced.onlinelibrary.wiley.com/doi/10.1002/adma.202521912?af=R,2026-05-12 07:25:28 UTC,Wiley: Advanced Materials: Table of Contents,2026-05-12 07:25:28+00:00
Conformationally Variable Peptides Trap and Detoxify Ox‐LDL in Plaques for Attenuating Atherosclerosis in Multiple Species,https://advanced.onlinelibrary.wiley.com/doi/10.1002/adma.202521108?af=R,2026-05-12 07:28:16 UTC,Wiley: Advanced Materials: Table of Contents,2026-05-12 07:28:16+00:00
Understanding Trade‐Off Between Zincophilicity and Hydrogen‐Evolution: Toward Ultra‐Stable Aqueous Zinc Metal Batteries,https://advanced.onlinelibrary.wiley.com/doi/10.1002/aenm.71056?af=R,2026-05-12 07:38:43 UTC,Wiley: Advanced Energy Materials: Table of Contents,2026-05-12 07:38:43+00:00
Silicon‐Based Anodes for Sulfide Solid‐State Batteries: Failure Mechanisms and Multiscale Design Strategies,https://advanced.onlinelibrary.wiley.com/doi/10.1002/aenm.71065?af=R,2026-05-12 07:39:39 UTC,Wiley: Advanced Energy Materials: Table of Contents,2026-05-12 07:39:39+00:00
"Machine Learning Interatomic Potentials for Energy Materials: Architectures, Training Strategies, and Applications",https://advanced.onlinelibrary.wiley.com/doi/10.1002/aenm.71046?af=R,2026-05-12 07:42:40 UTC,Wiley: Advanced Energy Materials: Table of Contents,2026-05-12 07:42:40+00:00
Redefining Crystalline Silicon: Unlocking New Horizons in Transparent and Flexible Photovoltaics,https://advanced.onlinelibrary.wiley.com/doi/10.1002/aenm.71067?af=R,2026-05-12 07:43:13 UTC,Wiley: Advanced Energy Materials: Table of Contents,2026-05-12 07:43:13+00:00
Generational highlights importance of battery health check for used PHEVs,https://www.electrive.com/2026/05/12/generational-highlights-importance-of-battery-health-check-for-used-phevs/,2026-05-12 07:58:03 UTC,Battery – electrive.com,2026-05-12 07:58:03+00:00
[ASAP] A Broadly Accessible Approach to Elucidate the Carbon–Carbon Double Bond Position in Unsaturated Lipids by a Post-column In-Line Photochemical Reaction and Mass Spectrometry,http://dx.doi.org/10.1021/jacs.6c01876,2026-05-12 08:58:12 UTC,Journal of the American Chemical Society: Latest Articles (ACS Publications),2026-05-12 08:58:12+00:00
[ASAP] Asymmetric Decarboxylative Protonation and Deuteration of Cyanoacetic Acids Using an Organometallic Proton Shuttle,http://dx.doi.org/10.1021/jacs.6c05281,2026-05-12 08:59:17 UTC,Journal of the American Chemical Society: Latest Articles (ACS Publications),2026-05-12 08:59:17+00:00
Therm Launches Mexico Carbon Credits Targeting Refrigerant Emissions,https://carbonherald.com/therm-launches-mexico-carbon-credits-targeting-refrigerant-emissions/?utm_source=rss&utm_medium=rss&utm_campaign=therm-launches-mexico-carbon-credits-targeting-refrigerant-emissions,2026-05-12 08:59:19 UTC,Carbon Herald,2026-05-12 08:59:19+00:00
[ASAP] Mechanism of Aggregation of the NACore of α-Synuclein: Stable Oligomer Formation Competes with Fibril Formation with Implications for the Etiology of Parkinson’s Disease,http://dx.doi.org/10.1021/jacs.6c01293,2026-05-12 08:59:46 UTC,Journal of the American Chemical Society: Latest Articles (ACS Publications),2026-05-12 08:59:46+00:00
[ASAP] Stabilizing Lattice Oxygen Mechanism on Ru Single Atoms via a High-Entropy Support for Acidic Oxygen Evolution,http://dx.doi.org/10.1021/jacs.6c02539,2026-05-12 10:01:36 UTC,Journal of the American Chemical Society: Latest Articles (ACS Publications),2026-05-12 10:01:36+00:00
[ASAP] Ligand-Triggered Topology Switching Converts Transient Recognition into Durable Nanofibrillar Anchoring,http://dx.doi.org/10.1021/jacs.6c06778,2026-05-12 10:02:42 UTC,Journal of the American Chemical Society: Latest Articles (ACS Publications),2026-05-12 10:02:42+00:00
The impact of fly ash-induced soiling on PV panel performance,https://www.pv-magazine.com/2026/05/12/the-impact-of-fly-ash-induced-soiling-on-pv-panel-performance/,2026-05-12 10:15:49 UTC,Commercial & Industrial PV – pv magazine International,2026-05-12 10:15:49+00:00
[ASAP] Journey toward a Global Understanding of Recombination in Halide Perovskites for Photovoltaic Applications,http://dx.doi.org/10.1021/acsenergylett.6c00457,2026-05-12 10:23:39 UTC,ACS Energy Letters: Latest Articles (ACS Publications),2026-05-12 10:23:39+00:00
New Platform Lets Individuals Buy Verified Carbon Removal With Registry Proof,https://carbonherald.com/platform-individuals-buy-verified-carbon-removal-registry-proof/?utm_source=rss&utm_medium=rss&utm_campaign=platform-individuals-buy-verified-carbon-removal-registry-proof,2026-05-12 10:43:31 UTC,Carbon Herald,2026-05-12 10:43:31+00:00
NGOs Publish New Recommendations For mCDR Field Experiments,https://carbonherald.com/ngos-publish-new-recommendations-for-mcdr-field-experiments/?utm_source=rss&utm_medium=rss&utm_campaign=ngos-publish-new-recommendations-for-mcdr-field-experiments,2026-05-12 10:45:21 UTC,Carbon Herald,2026-05-12 10:45:21+00:00
[ASAP] Identification and Quantification of Reactive Oxygen Species in Photocatalytic Membrane Reactors: Reassessment of the Validity of Methods,http://dx.doi.org/10.1021/acs.chemrev.5c01120,2026-05-12 11:04:43 UTC,Chemical Reviews: Latest Articles (ACS Publications),2026-05-12 11:04:43+00:00
AI method could extend EV battery lifespan by 23%,https://www.electrive.com/2026/05/12/ai-method-could-extend-ev-battery-lifespan-by-23/,2026-05-12 11:30:00 UTC,Battery – electrive.com,2026-05-12 11:30:00+00:00
[ASAP] Breaking the Trade-off: Bulk 2D Ising Superconductivity with High Tc and Giant Interlayer Spacing via a Unique Chain Intercalation in (BaS)1/3TaS2,http://dx.doi.org/10.1021/jacs.6c01737,2026-05-12 11:47:22 UTC,Journal of the American Chemical Society: Latest Articles (ACS Publications),2026-05-12 11:47:22+00:00
[ASAP] Thermodynamic Control of Interface Directs MnO2 Nucleation Chemistry for Dense and Conformal Electrodeposition,http://dx.doi.org/10.1021/jacs.6c03948,2026-05-12 11:48:22 UTC,Journal of the American Chemical Society: Latest Articles (ACS Publications),2026-05-12 11:48:22+00:00
Fluor’s Energise The Future 2026 Brings Together Europe’s CCU And SAF Ecosystem,https://carbonherald.com/fluors-energise-the-future-2026-brings-together-europes-ccu-and-saf-ecosystem/?utm_source=rss&utm_medium=rss&utm_campaign=fluors-energise-the-future-2026-brings-together-europes-ccu-and-saf-ecosystem,2026-05-12 11:48:41 UTC,Carbon Herald,2026-05-12 11:48:41+00:00
Democratic lawmakers demand Trump explain—and reverse—termination of NSF’s governing board,https://www.science.org/content/article/democratic-lawmakers-demand-trump-explain-and-reverse-termination-nsf-s-governing-board,2026-05-12 12:00:00 UTC,Latest News from Science Magazine,2026-05-12 12:00:00+00:00
India powers up one of its largest standalone battery energy storage system,https://www.ess-news.com/2026/05/12/india-powers-up-one-of-its-largest-standalone-battery-energy-storage-system/,2026-05-12 12:02:49 UTC,Latest news about ESS Projects & Applications | ESS News,2026-05-12 12:02:49+00:00
[ASAP] Nickel-Catalyzed Regioselective Dihydrosilylation of Allenes,http://dx.doi.org/10.1021/jacs.6c05077,2026-05-12 12:11:33 UTC,Journal of the American Chemical Society: Latest Articles (ACS Publications),2026-05-12 12:11:33+00:00
[ASAP] Ligand-Modulated Cobalt-Catalyzed Alkene Carbocarbonylation Unlocks Aliphatic Ketone Synthesis,http://dx.doi.org/10.1021/jacs.6c06343,2026-05-12 12:13:48 UTC,Journal of the American Chemical Society: Latest Articles (ACS Publications),2026-05-12 12:13:48+00:00
Caravel Bio Advances Low-Cost Carbon Capture Technology,https://carbonherald.com/caravel-bio-advances-low-cost-carbon-capture-technology/?utm_source=rss&utm_medium=rss&utm_campaign=caravel-bio-advances-low-cost-carbon-capture-technology,2026-05-12 12:27:56 UTC,Carbon Herald,2026-05-12 12:27:56+00:00
Canada Extends Tax Credits For Enhanced Oil Recovery (EOR) Projects,https://carbonherald.com/canada-extends-tax-credits-for-enhanced-oil-recovery-eor-projects/?utm_source=rss&utm_medium=rss&utm_campaign=canada-extends-tax-credits-for-enhanced-oil-recovery-eor-projects,2026-05-12 12:52:09 UTC,Carbon Herald,2026-05-12 12:52:09+00:00
Airlines Get Payment Breathing Room In New Carbon Credit Financing Push,https://carbonherald.com/airlines-get-payment-breathing-room-in-new-carbon-credit-financing-push/?utm_source=rss&utm_medium=rss&utm_campaign=airlines-get-payment-breathing-room-in-new-carbon-credit-financing-push,2026-05-12 16:28:09 UTC,Carbon Herald,2026-05-12 16:28:09+00:00
[ASAP] Defect-Induced Dynamic Reconstruction Boosts Oxygen Evolution Activity of Perovskite Oxides,http://dx.doi.org/10.1021/jacs.6c04404,2026-05-12 19:34:20 UTC,Journal of the American Chemical Society: Latest Articles (ACS Publications),2026-05-12 19:34:20+00:00
