title,link,published,source,pub_date
2025 AAAS Kavli Science Journalism Award winners named,https://www.science.org/doi/abs/10.1126/science.aee7304?af=R,2025-12-18 07:00:11 UTC,AAAS: Science: Table of Contents,2025-12-18 07:00:11+00:00
Here comes the Sun,https://www.science.org/doi/abs/10.1126/science.aee6842?af=R,2025-12-18 07:00:11 UTC,AAAS: Science: Table of Contents,2025-12-18 07:00:11+00:00
"Good morning, sunshine",https://www.science.org/doi/abs/10.1126/science.aee8000?af=R,2025-12-18 07:00:11 UTC,AAAS: Science: Table of Contents,2025-12-18 07:00:11+00:00
Runners-up,https://www.science.org/doi/abs/10.1126/science.aee8002?af=R,2025-12-18 07:00:11 UTC,AAAS: Science: Table of Contents,2025-12-18 07:00:11+00:00
The green giant,https://www.science.org/doi/abs/10.1126/science.aee8001?af=R,2025-12-18 07:00:11 UTC,AAAS: Science: Table of Contents,2025-12-18 07:00:11+00:00
Breakdowns of the year,https://www.science.org/doi/abs/10.1126/science.aee8012?af=R,2025-12-18 07:00:11 UTC,AAAS: Science: Table of Contents,2025-12-18 07:00:11+00:00
New materials could supercharge computer memory chips,https://www.science.org/doi/abs/10.1126/science.aee8380?af=R,2025-12-18 07:00:11 UTC,AAAS: Science: Table of Contents,2025-12-18 07:00:11+00:00
Seafloor telecom cable turned into giant earthquake detector,https://www.science.org/doi/abs/10.1126/science.aee8379?af=R,2025-12-18 07:00:11 UTC,AAAS: Science: Table of Contents,2025-12-18 07:00:11+00:00
NSF pares back grant-review process to ease workload,https://www.science.org/doi/abs/10.1126/science.aee8378?af=R,2025-12-18 07:00:11 UTC,AAAS: Science: Table of Contents,2025-12-18 07:00:11+00:00
Cutting cake into a slice of life,https://www.science.org/doi/abs/10.1126/science.adz2965?af=R,2025-12-18 07:00:11 UTC,AAAS: Science: Table of Contents,2025-12-18 07:00:11+00:00
NIH’s proposed caps on open-access publishing fees roil community,https://www.science.org/doi/abs/10.1126/science.aee8376?af=R,2025-12-18 07:00:11 UTC,AAAS: Science: Table of Contents,2025-12-18 07:00:11+00:00
Listening to the languages of nature,https://www.science.org/doi/abs/10.1126/science.aec6091?af=R,2025-12-18 07:00:11 UTC,AAAS: Science: Table of Contents,2025-12-18 07:00:11+00:00
The internet’s deepest infrastructure,https://www.science.org/doi/abs/10.1126/science.aed4516?af=R,2025-12-18 07:00:11 UTC,AAAS: Science: Table of Contents,2025-12-18 07:00:11+00:00
State-independent ionic conductivity,https://www.science.org/doi/abs/10.1126/science.adk0786?af=R,2025-12-18 07:00:11 UTC,AAAS: Science: Table of Contents,2025-12-18 07:00:11+00:00
Risks of per- and polyfluoroalkyl substance exposure through marine fish consumption,https://www.science.org/doi/abs/10.1126/science.adr0351?af=R,2025-12-18 07:00:11 UTC,AAAS: Science: Table of Contents,2025-12-18 07:00:11+00:00
Extending the temperature range of the Cmcm phase of SnSe for high thermoelectric performance,https://www.science.org/doi/abs/10.1126/science.adt0831?af=R,2025-12-18 07:00:11 UTC,AAAS: Science: Table of Contents,2025-12-18 07:00:11+00:00
All-optical synthesis chip for large-scale intelligent semantic vision generation,https://www.science.org/doi/abs/10.1126/science.adv7434?af=R,2025-12-18 07:00:11 UTC,AAAS: Science: Table of Contents,2025-12-18 07:00:11+00:00
A new preprint server welcomes papers written and reviewed by AI,https://www.science.org/doi/abs/10.1126/science.aee8377?af=R,2025-12-18 07:00:11 UTC,AAAS: Science: Table of Contents,2025-12-18 07:00:11+00:00
A bacterial nutrition strategy for plant disease control,https://www.science.org/doi/abs/10.1126/science.ady8325?af=R,2025-12-18 07:00:11 UTC,AAAS: Science: Table of Contents,2025-12-18 07:00:11+00:00
A cellular basis for heightened gut sensitivity in females,https://www.science.org/doi/abs/10.1126/science.adz1398?af=R,2025-12-18 07:00:11 UTC,AAAS: Science: Table of Contents,2025-12-18 07:00:11+00:00
Xanthomonas coordinates type III–type II effector synergy by activating fruit-ripening pathway,https://www.science.org/doi/abs/10.1126/science.adz9239?af=R,2025-12-18 07:00:11 UTC,AAAS: Science: Table of Contents,2025-12-18 07:00:11+00:00
Electrode strain dynamics in layered intercalation battery cathodes,https://www.science.org/doi/abs/10.1126/science.aea2763?af=R,2025-12-18 07:00:11 UTC,AAAS: Science: Table of Contents,2025-12-18 07:00:11+00:00
Trifluoromethylation of alkyl electrophiles with 11C- or 18F-labeled fluoroform for PET applications,https://www.science.org/doi/abs/10.1126/science.ady2969?af=R,2025-12-18 07:00:11 UTC,AAAS: Science: Table of Contents,2025-12-18 07:00:11+00:00
A century of modern cosmology,https://www.science.org/doi/abs/10.1126/science.aec1402?af=R,2025-12-18 07:00:11 UTC,AAAS: Science: Table of Contents,2025-12-18 07:00:11+00:00
Wildfires mobilize soil pollutants,https://www.science.org/doi/abs/10.1126/science.aed1239?af=R,2025-12-18 07:00:11 UTC,AAAS: Science: Table of Contents,2025-12-18 07:00:11+00:00
The burden of silence,https://www.science.org/doi/abs/10.1126/science.aee7297?af=R,2025-12-18 07:00:11 UTC,AAAS: Science: Table of Contents,2025-12-18 07:00:11+00:00
In Other Journals,https://www.science.org/doi/abs/10.1126/science.aee7988?af=R,2025-12-18 07:00:11 UTC,AAAS: Science: Table of Contents,2025-12-18 07:00:11+00:00
Soil Hg re-emissions erode control efforts,https://www.science.org/doi/abs/10.1126/science.aed0788?af=R,2025-12-18 07:00:11 UTC,AAAS: Science: Table of Contents,2025-12-18 07:00:11+00:00
Tricks for treats,https://www.science.org/doi/abs/10.1126/science.aed2724?af=R,2025-12-18 07:00:11 UTC,AAAS: Science: Table of Contents,2025-12-18 07:00:11+00:00
Pathways of pain,https://www.science.org/doi/abs/10.1126/science.aed4888?af=R,2025-12-18 07:00:11 UTC,AAAS: Science: Table of Contents,2025-12-18 07:00:11+00:00
Reevaluating PFAS exposure risks from marine fish,https://www.science.org/doi/abs/10.1126/science.aed7431?af=R,2025-12-18 07:00:11 UTC,AAAS: Science: Table of Contents,2025-12-18 07:00:11+00:00
Concurrently Achieving 10 mAh cm−2 and Ultralow Binder Content via Active‐Surface‐Guided Fibrillation for Fab‐Scale Dry‐Processed Lithium‐ion Batteries,https://advanced.onlinelibrary.wiley.com/doi/10.1002/aenm.202504005?af=R,2025-12-18 07:24:13 UTC,Wiley: Advanced Energy Materials: Table of Contents,2025-12-18 07:24:13+00:00
A Long‐Life and Safe Ni‐Rich Cathode Material for Lithium Batteries,https://advanced.onlinelibrary.wiley.com/doi/10.1002/aenm.202505925?af=R,2025-12-18 07:25:47 UTC,Wiley: Advanced Energy Materials: Table of Contents,2025-12-18 07:25:47+00:00
Roles of Single‐Atoms and Nanoparticles of Nickel‐Based Catalysts for Oxygen‐Involved Dry Reforming of Methane at Low Temperatures,https://advanced.onlinelibrary.wiley.com/doi/10.1002/aenm.202506066?af=R,2025-12-18 07:26:46 UTC,Wiley: Advanced Energy Materials: Table of Contents,2025-12-18 07:26:46+00:00
Impact of Processing Environment on Anti‐Solvent Free FAPbI3 Films and Solar Cells,https://advanced.onlinelibrary.wiley.com/doi/10.1002/aenm.202503828?af=R,2025-12-18 07:32:32 UTC,Wiley: Advanced Energy Materials: Table of Contents,2025-12-18 07:32:32+00:00
Safeguards for military robotics are impeded by the realities of warfare,https://www.science.org/doi/abs/10.1126/science.aed5178?af=R,2025-12-18 08:00:00 UTC,AAAS: Science: Table of Contents,2025-12-18 08:00:00+00:00
Intracellular competition shapes plasmid population dynamics,https://www.science.org/doi/abs/10.1126/science.adx0665?af=R,2025-12-18 08:00:00 UTC,AAAS: Science: Table of Contents,2025-12-18 08:00:00+00:00
Recent discoveries on the acquisition of the highest levels of human performance,https://www.science.org/doi/abs/10.1126/science.adt7790?af=R,2025-12-18 08:00:00 UTC,AAAS: Science: Table of Contents,2025-12-18 08:00:00+00:00
AQP5: A functional gastric cancer stem cell marker in mouse and human tumors,https://www.science.org/doi/abs/10.1126/science.adr2428?af=R,2025-12-18 08:00:00 UTC,AAAS: Science: Table of Contents,2025-12-18 08:00:00+00:00
Optimal perovskite vapor partitioning on textured silicon for high-stability tandem solar cells,https://www.science.org/doi/abs/10.1126/science.adz3698?af=R,2025-12-18 08:00:00 UTC,AAAS: Science: Table of Contents,2025-12-18 08:00:00+00:00
Ancient genomes illuminate the origins and dynamic history of East Asian cattle,https://www.science.org/doi/abs/10.1126/science.adu9904?af=R,2025-12-18 08:00:00 UTC,AAAS: Science: Table of Contents,2025-12-18 08:00:00+00:00
Erratum for the Report “TFEB links autophagy to lysosomal biogenesis” by C. Settembre et al.,https://www.science.org/doi/abs/10.1126/science.aee5883?af=R,2025-12-18 08:00:00 UTC,AAAS: Science: Table of Contents,2025-12-18 08:00:00+00:00
Erratum for the Research Article “Robust epitaxy of single-crystal transition-metal dichalcogenides on lanthanum-passivated sapphire” by X. Zou et al.,https://www.science.org/doi/abs/10.1126/science.aee7927?af=R,2025-12-18 08:00:00 UTC,AAAS: Science: Table of Contents,2025-12-18 08:00:00+00:00
Conformational landscape adaptations enable processive phosphorylation by Src family kinases,https://www.science.org/doi/abs/10.1126/science.adw8310?af=R,2025-12-18 08:00:00 UTC,AAAS: Science: Table of Contents,2025-12-18 08:00:00+00:00
A human pan-disease blood atlas of the circulating proteome,https://www.science.org/doi/abs/10.1126/science.adx2678?af=R,2025-12-18 08:00:00 UTC,AAAS: Science: Table of Contents,2025-12-18 08:00:00+00:00
[ASAP] Machine-Learning-Guided Insights into Solid-Electrolyte Interphase Conductivity: Are Amorphous Lithium Fluorophosphates the Key?,http://dx.doi.org/10.1021/acsenergylett.5c03526,2025-12-18 09:22:05 UTC,ACS Energy Letters: Latest Articles (ACS Publications),2025-12-18 09:22:05+00:00
[ASAP] Interfacial Cation Arrangement Controls Electrocatalytic Kinetics in CO2 Reduction,http://dx.doi.org/10.1021/jacs.5c18127,2025-12-18 09:49:43 UTC,Journal of the American Chemical Society: Latest Articles (ACS Publications),2025-12-18 09:49:43+00:00
[ASAP] Assembly of Face Decorated Cuboidal Cages into Ultraporous Structures with Hierarchical Porosity: Accessing MOFs with the Awaited red-a Topology,http://dx.doi.org/10.1021/jacs.5c16581,2025-12-18 12:12:43 UTC,Journal of the American Chemical Society: Latest Articles (ACS Publications),2025-12-18 12:12:43+00:00
"Farmers 'bewildered and frightened' over inheritance tax, report finds",https://www.bbc.com/news/articles/c9975z55dr5o?at_medium=RSS&at_campaign=rss,2025-12-18 13:38:39 UTC,BBC News,2025-12-18 13:38:39+00:00
This year’s biggest breakthrough and top news stories,https://www.science.org/doi/10.1126/science.z9i6115,2025-12-18 19:00:00 UTC,Science Magazine Podcast,2025-12-18 19:00:00+00:00
BBC Inside Science,https://www.bbc.co.uk/sounds/play/w3ct8txq?at_medium=RSS&at_campaign=rss,2025-12-18 21:00:00 UTC,BBC News,2025-12-18 21:00:00+00:00
