title,link,source,published_str,pub_date,doi,abstract,abstract_source,must_have_abstract
Activated ATF6α is a hepatic tumour driver restricting immunosurveillance,https://www.nature.com/articles/s41586-025-10036-8,Nature,2026-02-04 00:00:00 UTC,2026-02-04 00:00:00+00:00,,"Hepatocellular carcinoma (HCC) is the fastest growing cause of cancer-related mortality and there are limited therapies1. Although endoplasmic reticulum (ER) stress and the unfolded protein response (UPR) are implicated in HCC, the involvement of the UPR transducer ATF6α remains unclear2. Here we demonstrate the function of ATF6α as an ER-stress-inducing tumour driver and metabolic master regulator restricting cancer immunosurveillance for HCC, in contrast to its well-characterized role as an adaptive response to ER stress3. ATF6α activation in human HCC is significantly correlated with an aggressive tumour phenotype, characterized by reduced patient survival, enhanced tumour progression and local immunosuppression. Hepatocyte-specific ATF6α activation in mice induced progressive hepatitis with ER stress, immunosuppression and hepatocyte proliferation. Concomitantly, activated ATF6α increased glycolysis and directly repressed the gluconeogenic enzyme FBP1 by binding to gene regulatory elements. Restoring FBP1 expression limited ATF6α-activation-related pathologies. Prolonged ATF6α activation in hepatocytes triggered hepatocarcinogenesis, intratumoural T cell infiltration and nutrient-deprived immune exhaustion. Immune checkpoint blockade (ICB)4 restored immunosurveillance and reduced HCC. Consistently, patients with HCC who achieved a complete response to immunotherapy displayed significantly increased ATF6α activation compared with those with a weaker response. Targeting Atf6 through germline ablation, hepatocyte-specific ablation or therapeutic hepatocyte delivery of antisense oligonucleotides dampened HCC in preclinical liver cancer models. Thus, prolonged ATF6α activation drives ER stress, leading to glycolysis-dependent immunosuppression in liver cancer and sensitizing to ICB. Our findings suggest that persistently activated ATF6α is a tumour driver, a potential stratification marker for ICB response and a therapeutic target for HCC.",nature_html,0
Artificial intelligence-powered nanomedicine,http://pubs.rsc.org/en/Content/ArticleLanding/2026/CS/D5CS01406A,RSC - Chem. Soc. Rev. latest articles,2026-02-04 00:00:00 UTC,2026-02-04 00:00:00+00:00,,"The escalating global burden of diseases—including cancer, neurodegenerative, and cardiovascular disorders—poses severe threats to human health and social development. The inherent limitations of conventional diagnostic, imaging, and therapeutic modalities have driven the rapid evolution of nanomedicine, particularly nanotheranostics, which integrates diagnostic and therapeutic functionalities within a single nanoplatform for enhanced precision and safety. Despite remarkable advances in nanotechnology and materials science over recent decades, challenges such as the biological complexity of living systems, incomplete understanding of nano–bio interactions, inefficiencies in nanoparticle synthesis, and limited clinical translation continue to hinder progress. The recent convergence of nanomedicine with artificial intelligence (AI) and computational sciences has opened transformative opportunities to overcome these obstacles. AI-empowered algorithms, including machine learning, deep learning, and generative models, are increasingly being applied to optimize nanoparticle design and synthesis, predict nano–bio interactions, and improve diagnostic and therapeutic efficacy. These approaches not only accelerate materials discovery but also enable data-driven, adaptive nanotheranostic systems capable of autonomous optimization across disease contexts. This review systematically summarizes the current landscape of AI-powered nanomedicine, highlighting advances in nanoparticle design, synthesis, and the development of AI-guided diagnostic and therapeutic nanoplatforms. It further discusses applications in bioimaging, targeted therapy, and clinical translation, while identifying existing challenges and future perspectives in establishing next-generation AI-empowered nanotheranostics. Ultimately, the integration of artificial intelligence and nanotechnology is expected to revolutionize precision medicine by bridging the gap between fundamental nanoscience and clinical implementation, paving the way toward intelligent, personalized healthcare.",rsc_html,0
Enabling grid-interactive data center-desalination coordination through thermo-electric coupling-based waste heat utilization,https://www.sciencedirect.com/science/article/pii/S0306261926000802?dgcid=rss_sd_all,ScienceDirect Publication: Applied Energy,2026-02-04 00:00:00 UTC,2026-02-04 00:00:00+00:00,,,,0
Tandem architectures for electrochemical CO2 reduction: from coupled atomic sites to tandem electrolysers,https://www.nature.com/articles/s41565-025-02117-6,Nature Nanotechnology,2026-02-04 00:00:00 UTC,2026-02-04 00:00:00+00:00,,"This Review provides a perspective on tandem catalysis schemes applied to the electrochemical reduction of carbon dioxide (CO2). We define and classify microscopic and macroscopic site and cell tandem concepts pursued so far and provide a critical assessment and performance comparison against non-tandem systems. Our analysis demonstrates that tandem approaches generally seem to improve the selectivity for oxygenates compared with CO2-fed copper-based or non-tandem systems. However, tandem approaches are typically inferior in terms of ethylene production compared with non-tandem approaches. The tandem electrolyser concept seems to be the most promising tandem concept owing to the reduced materials complexity and possibility of individual tuning of microenvironments for the CO-producing and CO–CO-coupling catalytic phases. We conclude our Review by addressing key remaining challenges and promising future research directions in the field of tandem CO2 electrocatalysis.",nature_html,0
Precise synthesis of non-equilibrium rotaxanes via pumping in water,https://www.cell.com/chem/fulltext/S2451-9294(25)00469-3?rss=yes,Chem,2026-02-04 00:00:00 UTC,2026-02-04 00:00:00+00:00,,"The realization of artificial molecular pumps (AMPs) that function in water remains challenging. The authors report a rationally designed aqueous AMP with brand-new ratchet components. Powered by acid-base pulses, it drives the non-equilibrium synthesis of well-defined interlocked polymers, achieving a local cucurbit[7]uril concentration 350 times higher than in bulk solution.",rss_cell,0
Widespread hypermodified β-helical peptides in common bacteria,https://www.cell.com/chem/fulltext/S2451-9294(25)00468-1?rss=yes,Chem,2026-02-04 00:00:00 UTC,2026-02-04 00:00:00+00:00,,"Vadakumchery, Meier, Forneris, et al. report a family of β6.3-helical ribosomal peptides that occurs in phylogenetically diverse and well-known bacteria. Their study provides insights into the structure and bioactivity of these compounds, revealing potent cytotoxicity against cancer cells.",rss_cell,0
Author Correction: Cotranslational assembly of protein complexes in eukaryotes revealed by ribosome profiling,https://www.nature.com/articles/s41586-026-10200-8,Nature,2026-02-04 00:00:00 UTC,2026-02-04 00:00:00+00:00,,,,0
Nano-aligning composite solid electrolytes,https://www.nature.com/articles/s41565-025-02111-y,Nature Nanotechnology,2026-02-04 00:00:00 UTC,2026-02-04 00:00:00+00:00,,,,0
These mysterious ridges could help skin regenerate,https://www.nature.com/articles/d41586-026-00363-9,Nature,2026-02-04 00:00:00 UTC,2026-02-04 00:00:00+00:00,,,,0
A universal concept for melting in mantle upwellings,https://www.nature.com/articles/s41586-025-10065-3,Nature,2026-02-04 00:00:00 UTC,2026-02-04 00:00:00+00:00,,"Deep mantle melting marks the onset of Earth differentiation1, yet a unifying framework for how buoyancy-driven mantle upwellings initiate melting and how such incipient melts evolve within the asthenosphere has remained elusive. Here we show that the first melts generated in any solid-state mantle upwelling are kimberlitic CO2-rich silicate melts that form at about 250 km depth through oxidation of elemental carbon to CO2 (refs. 2,3). Our experiments force a range of surface melts, derived from mantle plumes4 or broad upwellings5 (kimberlites, ocean island basalts and mid-ocean ridge basalts), into equilibrium with fertile mantle at adiabatic and super-adiabatic conditions at 7 GPa. The results define a framework in which redox melting at depth universally yields kimberlitic melts, which, while ascending through the asthenosphere by reactive porous flow6,7, evolve to higher degrees of melting, lesser volatiles and incompatible elements, but higher SiO2. Channelized flow7 in the lithosphere may then enable direct extraction of these melts, leading to kimberlites, where the lithosphere commences just above the C → CO2 redox front, to alkaline Si-undersaturated intraplate magmas where lithospheric thicknesses are 150–100 km, and to tholeiitic basalts below mid-ocean ridges where voluminous ‘dry’ melting becomes overwhelming. This framework is consistent with the widespread seismic low-velocity zone at about 250 km beneath mid-ocean ridges8,9 and aligns with ocean island and mid-ocean ridge basalts sampling the various geochemical mantle components at different degrees of melting in different proportions10,11.",nature_html,0
Biofluid biomarkers in Alzheimer’s disease and other neurodegenerative dementias,https://www.nature.com/articles/s41586-025-10018-w,Nature,2026-02-04 00:00:00 UTC,2026-02-04 00:00:00+00:00,,"Biofluid-based biomarkers have transformed neurodegenerative disease research and care, providing insights into the molecular underpinnings of Alzheimer’s disease (AD) and other neurodegenerative dementias. This Review provides an update on recent developments in biofluid-based biomarkers for amyloid-β (Aβ) pathology, tau pathology, neurodegeneration, glial reactivity, α-synuclein pathology, TAR DNA-binding protein 43 (TDP-43) pathology, synaptic pathophysiology and cerebrovascular disease—pathologies and processes that are all relevant to neurodegenerative dementias. Complementing longstanding cerebrospinal assays, improved technologies now facilitate the detection of molecules linked to neurodegenerative brain changes at very low concentrations in the blood. This promises to complement the clinical evaluation of suspected neurodegenerative disease in healthcare with molecular phenotyping biomarkers that will help to link the clinical symptoms to ongoing pathophysiological processes in the brain and improve how patients are referred to specialty clinics for initiation and monitoring of molecularly targeted treatments. Clinically relevant breakthroughs such as the use of anti-Aβ monoclonal antibodies to address Aβ pathology in AD serve as important proof-of-concept examples of how the field is advancing toward molecularly informed prevention and treatment. This Review provides an overview of the most established biofluid-based biomarkers currently in use and offers practical guidance on their interpretation and implementation in clinical settings.",nature_html,0
"PtdIns(3,5)P2 is an endogenous ligand of STING in innate immune signalling",https://www.nature.com/articles/s41586-025-10084-0,Nature,2026-02-04 00:00:00 UTC,2026-02-04 00:00:00+00:00,,"Exposure to cytosolic DNA triggers innate immune responses through cyclic GMP–AMP (cGAMP) synthase (cGAS)1,2,3. After binding to DNA, cGAS produces cGAMP as a second messenger that binds to stimulator of interferon genes (STING), a signalling adaptor protein anchored to the endoplasmic reticulum (ER)3,4,5. STING then traffics from the ER through the Golgi to perinuclear vesicle clusters, which leads to activation of the kinases TBK1 and IKK and subsequent induction of interferons and other cytokines6,7,8,9. Here we show that phosphatidylinositol 3,5-bisphosphate (PtdIns(3,5)P2; also known as PI(3,5)P2) is an endogenous ligand of STING that functions together with cGAMP to induce STING activation. Proteomic analyses identified a constitutive interaction between STING and PIKFYVE, an enzyme that produces PtdIns(3,5)P2 in mammalian cells. Deletion of PIKFYVE blocked STING trafficking from the ER and TBK1 activation. In vitro reconstitution uncovered a strong and selective effect of PtdIns(3,5)P2 on STING activation by cGAMP. PtdIns(3,5)P2 bound directly to STING in fluorescence resonance energy transfer assays. Consistently, cryo-electron microscopy revealed that PtdIns(3,5)P2 promotes cGAMP-induced STING oligomerization10, functioning as a molecular glue. Similar to PIKFYVE depletion, mutation of the PtdIns(3,5)P2-binding residues in STING largely blocked its trafficking and downstream signalling. These findings reveal that PtdIns(3,5)P2 is a lipid ligand of STING with essential roles in innate immunity.",nature_html,0
"Removing passivation irregularities for seamless electroplating across lithium, zinc, and magnesium metal batteries",https://www.cell.com/chem/fulltext/S2451-9294(25)00470-X?rss=yes,Chem,2026-02-04 00:00:00 UTC,2026-02-04 00:00:00+00:00,,"Passivation irregularities and nascent solid-electrolyte interphase layers on metal anodes govern nucleation and growth in lithium, zinc, and magnesium batteries. By eliminating native oxides and constructing uniform infant layers, we realize seamless, compact electrodeposition, establishing passivation regularity as a universal design principle for durable metal anodes.",rss_cell,0
Fuel cell energy management strategies (FCEMS): a Word2Vec-driven bibliometric framework for trend mapping and algorithmic advancements,https://www.sciencedirect.com/science/article/pii/S030626192600084X?dgcid=rss_sd_all,ScienceDirect Publication: Applied Energy,2026-02-04 00:00:00 UTC,2026-02-04 00:00:00+00:00,,,,0
An incentivized cooperative scheme for transmission expansion in a 100% renewable Europe,https://www.sciencedirect.com/science/article/pii/S030626192600067X?dgcid=rss_sd_all,ScienceDirect Publication: Applied Energy,2026-02-04 00:00:00 UTC,2026-02-04 00:00:00+00:00,,,,0
NPP-GPT: Forecasting nuclear power plants operating parameters using pre-trained large language model,https://www.sciencedirect.com/science/article/pii/S0306261926000905?dgcid=rss_sd_all,ScienceDirect Publication: Applied Energy,2026-02-04 00:00:00 UTC,2026-02-04 00:00:00+00:00,,,,0
Transient power unit efficiency prediction of a small data center through thermal and energetic analyses,https://www.sciencedirect.com/science/article/pii/S0306261926001005?dgcid=rss_sd_all,ScienceDirect Publication: Applied Energy,2026-02-04 00:00:00 UTC,2026-02-04 00:00:00+00:00,,,,0
Stable redox flow batteries through suppression of side reactions with lawsone anolyte and iodine catholyte,https://www.sciencedirect.com/science/article/pii/S030626192600142X?dgcid=rss_sd_all,ScienceDirect Publication: Applied Energy,2026-02-04 00:00:00 UTC,2026-02-04 00:00:00+00:00,,,,0
Experimental investigation of a solar photovoltaic-thermophotovoltaic cascade system with concentrating spectrum splitting and reshaping,https://www.sciencedirect.com/science/article/pii/S0306261926001169?dgcid=rss_sd_all,ScienceDirect Publication: Applied Energy,2026-02-04 00:00:00 UTC,2026-02-04 00:00:00+00:00,,,,0
A novel nonlinear grey model with parameter estimation optimization and its application in wind power forecasting,https://www.sciencedirect.com/science/article/pii/S0306261926001327?dgcid=rss_sd_all,ScienceDirect Publication: Applied Energy,2026-02-04 00:00:00 UTC,2026-02-04 00:00:00+00:00,,,,0
Demand response event simulator and risk-aware bidding tool for industrial customers,https://www.sciencedirect.com/science/article/pii/S030626192600108X?dgcid=rss_sd_all,ScienceDirect Publication: Applied Energy,2026-02-04 00:00:00 UTC,2026-02-04 00:00:00+00:00,,,,0
Self-assembled molecules with hydrogen-bond networks enable efficient all-perovskite tandem solar cells,https://www.nature.com/articles/s41560-026-01964-4,Nature Energy,2026-02-04 00:00:00 UTC,2026-02-04 00:00:00+00:00,,"Hole-selective self-assembled monolayers have advanced the performance of perovskite solar cells (PSCs), yet their excessive intermolecular interactions result in undesirable self-aggregation and weak interfacial contact. Here we devise a bicarbazole-based dimeric structure incorporating amide units as dual hydrogen-bond donors and acceptors to enable the formation of hydrogen-bonding networks within the molecules and with transparent conductive oxide. This design promotes homogeneous molecular arrangement and well-aligned energy levels, minimizing hole-transport loss and enhancing interfacial stability. We achieve an efficiency of 21.56% in a 1.77 eV PSC, with an open-circuit voltage of 1.35 V and a fill factor of 85.76%. This strategy is also applicable to 1.56 eV PSCs, affording efficiencies of 26.80% (certified 26.57% by current density–voltage (J–V) scan and 25.92% steady-state measured over 300 s). Most notably, the integrated all-perovskite tandem solar cell yields an efficiency of 30.19% (certified 29.38% by J–V scan and 28.40% steady state measured over 120 s).",nature_html,0
Interphase stabilization via carbon hybridization control unlocks stable potassium-ion batteries,https://www.cell.com/matter/fulltext/S2590-2385(25)00619-8?rss=yes,Matter,2026-02-04 00:00:00 UTC,2026-02-04 00:00:00+00:00,,"The performance of potassium-ion batteries (PIBs) has long been limited by the inefficient stability of solid electrolyte interphase (SEI). This study demonstrates that tuning the balance between sp3- and sp2-hybridized carbons enables the formation of a stable SEI and enhances reversible potassium storage. The resulting hard carbon anode achieves high Coulombic efficiency and extended cycle life, offering a generalizable materials design strategy for high-performance PIBs.",rss_cell,0
Figure-of-merit for tribovoltaic nanogenerators,https://www.cell.com/matter/fulltext/S2590-2385(25)00623-X?rss=yes,Matter,2026-02-04 00:00:00 UTC,2026-02-04 00:00:00+00:00,,"A standardized device figure-of-merit is proposed to evaluate the output performance of triboelectric nanogenerators, providing a quantitative metric for comparing the energy conversion efficiency of devices with different architectures. This research advances the fundamental understanding of triboelectric nanogenerator device physics and properties, laying a robust foundation for further performance optimization and expanded applications.",rss_cell,0
Group theory-guided materials design of chiral organic semiconductors for high-performance circularly polarized light detection,https://www.cell.com/matter/fulltext/S2590-2385(26)00030-5?rss=yes,Matter,2026-02-04 00:00:00 UTC,2026-02-04 00:00:00+00:00,,"(Matter 8, 102371; December 3, 2025)",rss_cell,0
Author Correction: Buried deep freshwater reserves beneath salinity-stressed coastal Bangladesh,https://www.nature.com/articles/s41467-026-69228-z,Nature Communications,2026-02-04 00:00:00 UTC,2026-02-04 00:00:00+00:00,,,,0
Author Correction: Metallic charge transport in conjugated molecular bilayers,https://www.nature.com/articles/s41928-026-01578-4,Nature Electronics,2026-02-04 00:00:00 UTC,2026-02-04 00:00:00+00:00,,,,0
"Atmospheric H2 variability over the past 1,100 years",https://www.nature.com/articles/s41586-026-10099-1,Nature,2026-02-04 00:00:00 UTC,2026-02-04 00:00:00+00:00,,"Anthropogenic emissions of hydrogen (H2) are expected to rise if H2 energy technology is widely implemented as part of the green energy transition1,2. Although atmospheric H2 is not radiatively active, it warms the Earth’s climate through chemical effects on methane, ozone and water vapour1,2,3,4,5,6. Predicting the atmospheric response to anthropogenic perturbations is challenging, in part because of the limited duration of the modern instrumental record7. Ice core measurements of H2 can extend the observational record, providing information about anthropogenic and natural perturbations and the biogeochemical controls on H2 levels over long timescales. However, ice core measurements of H2 are challenging because of the high permeability of H2 in ice8,9. Here we present an ice core record of atmospheric H2 recovered from a Greenland ice core, spanning the past millennium. The record shows a 70–111% (2σ) rise in atmospheric H2 from the pre-industrial to the modern era, consistent with increasing direct emissions from fossil fuel burning and increased atmospheric concentrations of H2 precursors. The pre-industrial record also shows a 4–25% (2σ) decrease in H2 levels during the Little Ice Age (LIA), indicating that H2 biogeochemistry may be sensitive to climate change. The findings suggest that the sensitivity of H2 sources and sinks to climate warming should be considered in estimates of the radiative consequences of rising anthropogenic H2 emissions.",nature_html,0
Locational marginal emission rates calculation considering reserve requirements,https://www.sciencedirect.com/science/article/pii/S0306261926000917?dgcid=rss_sd_all,ScienceDirect Publication: Applied Energy,2026-02-04 00:00:00 UTC,2026-02-04 00:00:00+00:00,,,,0
Decarbonization pathways of Hard-to-Abate sectors through hydrogen blending solutions,https://www.sciencedirect.com/science/article/pii/S0306261926000723?dgcid=rss_sd_all,ScienceDirect Publication: Applied Energy,2026-02-04 00:00:00 UTC,2026-02-04 00:00:00+00:00,,,,0
High-resolution dynamic modeling and techno-economic optimization of off-grid PV–electrolysis–BESS systems for green hydrogen production,https://www.sciencedirect.com/science/article/pii/S0306261926001030?dgcid=rss_sd_all,ScienceDirect Publication: Applied Energy,2026-02-04 00:00:00 UTC,2026-02-04 00:00:00+00:00,,,,0
Efficiency-driven tax rebates for low-carbon transition: A translog–evolutionary game approach,https://www.sciencedirect.com/science/article/pii/S0306261926000887?dgcid=rss_sd_all,ScienceDirect Publication: Applied Energy,2026-02-04 00:00:00 UTC,2026-02-04 00:00:00+00:00,,,,0
Performance and feasibility assessment of a wave energy converter with underwater vehicle docking and charging,https://www.sciencedirect.com/science/article/pii/S0306261926001054?dgcid=rss_sd_all,ScienceDirect Publication: Applied Energy,2026-02-04 00:00:00 UTC,2026-02-04 00:00:00+00:00,,,,0
Instantaneous urban facade PV potential assessment: An end-to-end deep learning framework for arbitrary planning horizons,https://www.sciencedirect.com/science/article/pii/S0306261926000097?dgcid=rss_sd_all,ScienceDirect Publication: Applied Energy,2026-02-04 00:00:00 UTC,2026-02-04 00:00:00+00:00,,,,0
Large-scale analogue quantum simulation using atom dot arrays,https://www.nature.com/articles/s41586-025-10053-7,Nature,2026-02-04 00:00:00 UTC,2026-02-04 00:00:00+00:00,,"In pursuit of a practical quantum advantage1, analogue quantum systems provide an invaluable way to simulate the physics of quantum materials2,3,4, quantum systems out of equilibrium5,6 or interaction-induced localization7. Notable recent progress to realize such systems has been achieved in ultracold atoms8,9,10,11,12, superconducting circuits13,14,15 and twisted van der Waals materials16,17,18,19. However, so far, these platforms have struggled to simulate large-scale strongly interacting fermionic systems at low temperatures, at which electronic correlations dominate materials properties and numerical simulations remain restricted in accuracy and scope20,21. Here we demonstrate the realization of a new platform consisting of large-scale 2D arrays of sub-nanometre precision-engineered atom-based quantum dots (15,000 sites) to simulate strongly interacting, low-temperature physics. By observing a metal–insulator (MI) transition on a 2D square lattice of atom-based quantum dots, we demonstrate independent and precise control of the on-site interaction U and tunnelling t. Magneto-transport measurements further indicate the formation of an insulating state driven by Mott–Hubbard/Anderson physics and promising signatures of correlated electron physics. These precision-engineered analogue quantum simulators provide a unique platform to simulate quantum materials on arbitrary 2D lattices and to explore many unanswered questions in the formation of quantum magnetism, interacting topological quantum matter and unconventional superconductivity.",nature_html,0
