title,link,published,source,pub_date
Conductive Hydrogels for Exogenous Sensing and Cell Fate Control,https://advanced.onlinelibrary.wiley.com/doi/10.1002/adma.72866?af=R,2026-07-17 13:23:16 UTC,Wiley: Advanced Materials: Table of Contents,2026-07-17 13:23:16+00:00
Synergistic Dual Modulation of Li2S Redox Kinetics and Anode Stability Enabled by a High‐Efficiency Organodisulfide Mediator in Anode‐Free Lithium–Sulfur Batteries,https://advanced.onlinelibrary.wiley.com/doi/10.1002/adma.73710?af=R,2026-07-17 13:23:16 UTC,Wiley: Advanced Materials: Table of Contents,2026-07-17 13:23:16+00:00
Iron‐Hijacking Trojan Horse Nanoplatform Combats Implant‐Associated Biofilm Infections Through Immuno‐Fibrotic Remodeling,https://advanced.onlinelibrary.wiley.com/doi/10.1002/adma.73711?af=R,2026-07-17 13:23:16 UTC,Wiley: Advanced Materials: Table of Contents,2026-07-17 13:23:16+00:00
Decoupling‐Facilitated Mass‐Charge Transfer via Dual‐Interface Engineering for Efficient CO2 Electrolysis,https://advanced.onlinelibrary.wiley.com/doi/10.1002/adma.73692?af=R,2026-07-17 13:23:16 UTC,Wiley: Advanced Materials: Table of Contents,2026-07-17 13:23:16+00:00
Confinement‐Regulated Crystal Phase Engineering Enables Structured Semiconductor Fiber Systems for Plant Transpiration Dynamics Monitoring,https://advanced.onlinelibrary.wiley.com/doi/10.1002/adma.73693?af=R,2026-07-17 13:23:16 UTC,Wiley: Advanced Materials: Table of Contents,2026-07-17 13:23:16+00:00
Light Intensity‐Driven Bidirectional Photoresponse Vision Sensor for Autonomous Obstacle Avoidance System,https://advanced.onlinelibrary.wiley.com/doi/10.1002/adma.73694?af=R,2026-07-17 13:23:16 UTC,Wiley: Advanced Materials: Table of Contents,2026-07-17 13:23:16+00:00
Balanced Molecular Interactions with Mild Dipole Moment for Intermediate Suppressing in High Performance Antisolvent‐Free Regular α‐FAPbI3 Solar Cells,https://advanced.onlinelibrary.wiley.com/doi/10.1002/adma.73696?af=R,2026-07-17 13:23:16 UTC,Wiley: Advanced Materials: Table of Contents,2026-07-17 13:23:16+00:00
A Paintable Bioinspired Stratified Skin Resolving the Cooling‐Electricity Trade‐Off for All‐Weather Building Retrofits,https://advanced.onlinelibrary.wiley.com/doi/10.1002/adma.73697?af=R,2026-07-17 13:23:16 UTC,Wiley: Advanced Materials: Table of Contents,2026-07-17 13:23:16+00:00
Bio‐Inspired Full‐Spectrum Bidirectional Optoelectronic Synaptic Transistor for In‐Sensor Neuromorphic Vision,https://advanced.onlinelibrary.wiley.com/doi/10.1002/adma.73698?af=R,2026-07-17 13:23:16 UTC,Wiley: Advanced Materials: Table of Contents,2026-07-17 13:23:16+00:00
Programmable Hydrodynamic Invisibility Enabled by Machine‐Learning‐Guided Metamaterials,https://advanced.onlinelibrary.wiley.com/doi/10.1002/adma.73690?af=R,2026-07-17 13:23:16 UTC,Wiley: Advanced Materials: Table of Contents,2026-07-17 13:23:16+00:00
Amphibious Breathable Ionic Skin Enabled by Dynamically Interlocked Star‐Shaped Ionic Liquid Telomers,https://advanced.onlinelibrary.wiley.com/doi/10.1002/adma.73701?af=R,2026-07-17 13:23:16 UTC,Wiley: Advanced Materials: Table of Contents,2026-07-17 13:23:16+00:00
Nanotrap Architectures for Mitigating Interfacial Transport Limitations in Cathode Catalyst Layers of Proton Exchange Membrane Fuel Cells,https://advanced.onlinelibrary.wiley.com/doi/10.1002/adma.73702?af=R,2026-07-17 13:23:16 UTC,Wiley: Advanced Materials: Table of Contents,2026-07-17 13:23:16+00:00
High‐Entropy‐Induced Lattice Distortion Activates Dual‐Cobalt Site Synergy for Boosted Photo(Electro)Catalytic Hydrogen Evolution,https://advanced.onlinelibrary.wiley.com/doi/10.1002/adma.73708?af=R,2026-07-17 13:23:16 UTC,Wiley: Advanced Materials: Table of Contents,2026-07-17 13:23:16+00:00
Strengthened Interfacial Coupling Between Self‐Assembled Monolayers and Bulk Heterojunctions Enables Thermally Stable Organic Solar Cells,https://advanced.onlinelibrary.wiley.com/doi/10.1002/adma.73709?af=R,2026-07-17 13:23:16 UTC,Wiley: Advanced Materials: Table of Contents,2026-07-17 13:23:16+00:00
Lattice‐Engineered Dual‐Electron‐Drive Electrode for Selective Ammonia Production From Nitrate,https://advanced.onlinelibrary.wiley.com/doi/10.1002/adma.73699?af=R,2026-07-17 13:23:16 UTC,Wiley: Advanced Materials: Table of Contents,2026-07-17 13:23:16+00:00
India launches tender for 10 GWh battery cell manufacturing capacity for grid storage,https://www.ess-news.com/2026/07/17/india-launches-tender-for-10-gwh-battery-cell-manufacturing-capacity-for-grid-storage/,2026-07-17 13:35:00 UTC,Latest news about ESS Projects & Applications | ESS News,2026-07-17 13:35:00+00:00
Redox‐Targeting Synergy With Dual Mediators for Prussian Blue Analogue Flow Batteries,https://advanced.onlinelibrary.wiley.com/doi/10.1002/adma.74155?af=R,2026-07-17 14:56:12 UTC,Wiley: Advanced Materials: Table of Contents,2026-07-17 14:56:12+00:00
At least two dead in Texas floods ravaging same area where campers died,https://www.bbc.co.uk/news/articles/c3v0xe5elzyo?at_medium=RSS&at_campaign=rss,2026-07-17 14:56:26 UTC,BBC News,2026-07-17 14:56:26+00:00
Boosting Acidic Overall Water Splitting via Brønsted Acid Site‐Induced Bridging‐Oxygen‐Assisted Deprotonation,https://advanced.onlinelibrary.wiley.com/doi/10.1002/adma.74182?af=R,2026-07-17 14:58:35 UTC,Wiley: Advanced Materials: Table of Contents,2026-07-17 14:58:35+00:00
UK heatwave hits two-week mark,https://www.bbc.co.uk/news/videos/cly9zk1wrw9o?at_medium=RSS&at_campaign=rss,2026-07-17 15:18:17 UTC,BBC News,2026-07-17 15:18:17+00:00
Perseid meteors to light up night sky in one of the year's most active showers,https://www.bbc.co.uk/weather/articles/c7vg667m4y5o?at_medium=RSS&at_campaign=rss,2026-07-17 15:59:21 UTC,BBC News,2026-07-17 15:59:21+00:00
China introduces consumption tax on lithium-ion batteries,https://www.electrive.com/2026/07/17/china-introduces-consumption-tax-on-lithium-ion-batteries/,2026-07-17 16:00:00 UTC,Battery – electrive.com,2026-07-17 16:00:00+00:00
Outside Front Cover: 3D‐Printable Nanoporous Thermosets Via Disulfide‐Based Polymerization‐Induced Microphase Separation,https://onlinelibrary.wiley.com/doi/10.1002/anie.2026-m1507012900?af=R,2026-07-17 16:05:01 UTC,Wiley: Angewandte Chemie International Edition: Table of Contents,2026-07-17 16:05:01+00:00
Inside Back Cover: Structure‐Informed Design of Distinct Parallel G‐Quadruplex Stabilizers for KRAS‐Driven Cancer Therapy,https://onlinelibrary.wiley.com/doi/10.1002/anie.2026-m1507014300?af=R,2026-07-17 16:06:37 UTC,Wiley: Angewandte Chemie International Edition: Table of Contents,2026-07-17 16:06:37+00:00
EU proposes slowing down cuts to carbon emissions for businesses,https://www.bbc.co.uk/news/articles/ckgv0zd497zo?at_medium=RSS&at_campaign=rss,2026-07-17 18:34:04 UTC,BBC News,2026-07-17 18:34:04+00:00
What this desert city can teach the world about tackling heat deaths,https://www.bbc.co.uk/news/articles/cgl3lnpxy6no?at_medium=RSS&at_campaign=rss,2026-07-17 23:56:08 UTC,BBC News,2026-07-17 23:56:08+00:00
Refractory inclusions in Bennu samples indicative of outer Solar System accretion,https://www.nature.com/articles/s41467-026-73868-6,2026-07-18 00:00:00 UTC,Nature Communications,2026-07-18 00:00:00+00:00
Scale-bridging interface design enables high-performance sustainable thermoelectrics,https://www.nature.com/articles/s41467-026-75865-1,2026-07-18 00:00:00 UTC,Nature Communications,2026-07-18 00:00:00+00:00
Wavelength-encoded neuromorphic inference enabled by microcavity MoS2 photodetector arrays,https://www.nature.com/articles/s41467-026-75808-w,2026-07-18 00:00:00 UTC,Nature Communications,2026-07-18 00:00:00+00:00
Convergent genomic trajectories shape adaptation to life on land across animal lineages,https://www.nature.com/articles/s41467-026-75551-2,2026-07-18 00:00:00 UTC,Nature Communications,2026-07-18 00:00:00+00:00
Process-integrated engineered resting cells for biocatalytic production of rare natural sugars from sole methanol molecules,https://www.nature.com/articles/s41467-026-75664-8,2026-07-18 00:00:00 UTC,Nature Communications,2026-07-18 00:00:00+00:00
Learning ordinality-aware multimodal representations for composite materials design,https://www.nature.com/articles/s41467-026-75615-3,2026-07-18 00:00:00 UTC,Nature Communications,2026-07-18 00:00:00+00:00
Raphia hookeri seed-inspired weakly anisotropic nanocomposites,https://www.nature.com/articles/s41467-026-75719-w,2026-07-18 00:00:00 UTC,Nature Communications,2026-07-18 00:00:00+00:00
Coordination electrochemistry taming reversible hypervalent bromine redox for energetic six-electron-transfer lithium-bromine battery,https://www.nature.com/articles/s41467-026-75860-6,2026-07-18 00:00:00 UTC,Nature Communications,2026-07-18 00:00:00+00:00
Second half of summer to bring chances for rain but heatwave threat persists,https://www.bbc.co.uk/weather/articles/c07rex9p7x2o?at_medium=RSS&at_campaign=rss,2026-07-18 01:05:29 UTC,BBC News,2026-07-18 01:05:29+00:00
Diamonds and 'cab to orbit': Rocket aiming to transform India's space ambitions takes off,https://www.bbc.co.uk/news/articles/clyekv7rld3o?at_medium=RSS&at_campaign=rss,2026-07-18 07:05:19 UTC,BBC News,2026-07-18 07:05:19+00:00
"Toronto, New York and Washington top list of most polluted cities as wildfires burn",https://www.bbc.co.uk/news/articles/c5ywdl9ne3yo?at_medium=RSS&at_campaign=rss,2026-07-18 17:18:47 UTC,BBC News,2026-07-18 17:18:47+00:00
Trump threatens new Canada tariffs over fires sending 'filthy' air into US cities,https://www.bbc.co.uk/news/articles/cwyq93j34lgo?at_medium=RSS&at_campaign=rss,2026-07-18 17:29:50 UTC,BBC News,2026-07-18 17:29:50+00:00
