title,link,source,published_str,pub_date,doi,abstract,abstract_source,must_have_abstract
Paclitaxel drives TREM2+ macrophage expansion underlying its inferior therapeutic efficacy compared to Nab-paclitaxel,https://www.nature.com/articles/s41467-026-69060-5,Nature Communications,2026-02-03 00:00:00 UTC,2026-02-03 00:00:00+00:00,,"Paclitaxel and nab-paclitaxel differ in therapeutic efficacy and modulation of the tumor immune microenvironment, yet the molecular basis remains poorly defined. Here, based on a meta-analysis, we first show that treatment with nab-paclitaxel results in a higher overall response rate and pathological complete response compared to paclitaxel in female patients with breast cancer. Notably, TREM2 expression in macrophages is elevated in primary tumors of paclitaxel- but not nab-paclitaxel-treated female patients. In metastatic breast cancer, TREM2+ macrophage infiltration is increased in primary tumors. In breast cancer models in female mice, paclitaxel, but not nab-paclitaxel, promotes lung metastasis by recruiting TREM2+ macrophages to primary tumors. Mechanistically, paclitaxel enhances the ATF3-FGF2 axis in breast cancer cells; secreted FGF2 activates the EGR1-TREM2-EMT cytokine axis in macrophages. Genetic ablation of Trem2 or pharmacologic targeting with antisense oligonucleotides suppress paclitaxel-induced breast cancer lung metastasis in vivo. Collectively, our findings demonstrate that paclitaxel, but not nab-paclitaxel, stimulates TREM2 expression and expands TREM2+ macrophages, suggesting that TREM2 targeting could enhance paclitaxel efficacy while limiting metastasis.",nature_html,0
An orally administrable hydrogen-bonded organic framework (HOF)-based nanoreactor to reprogram metabolism for senescence intervention,https://academic.oup.com/nsr/advance-article/doi/10.1093/nsr/nwag074/8456377?rss=1,National Science Review Advance Access,2026-02-03 00:00:00 UTC,2026-02-03 00:00:00+00:00,10.1093/nsr/nwag074/8456377,"Aging poses significant health challenges due to functional decline and increased disease susceptibility. Modulating age-related metabolic dysregulation offers a promising therapeutic avenue. However, the efficacy of oral therapies is severely hampered by the degradation of active agents in the harsh gastrointestinal (GI) tract. Here, we report an orally administrable hydrogen-bonded organic framework (HOF)-based nanoreactor (MAO@NADH@PB@O-HOF@PEG) designed to intervene in senescence by modulating metabolic pathways. The HOF scaffold exhibits exceptional stability in ultra-acidic conditions and boiling water, providing a robust shield for its encapsulated delicate cargo from GI degradation. This protection enables prolonged in situ",rss_oup,0
Multidentate silane bridging for stable and efficient perovskite–organic tandem solar cells,http://pubs.rsc.org/en/Content/ArticleLanding/2026/EE/D5EE06253E,RSC - Energy Environ. Sci. latest articles,2026-02-03 00:00:00 UTC,2026-02-03 00:00:00+00:00,,"Perovskite–organic tandem solar cells (POTSCs) offer significant advantages over other perovskite-based tandem architectures owing to their straightforward processing and broad tuneability. However, the interfacial energetics disorder and resulting heterogeneous photoactive phase in wide bandgap perovskite subcells significantly undermine their long-term stability. Here, we develop a multidentate anchoring-bridging strategy that establishes a periodic passivating array that coordinates with dangling Pb2+ on the perovskite surface to reduce vacancy-mediated halide migration. The network with fluorinated chains reconfigures the interfacial dielectric landscape, significantly increasing the migration activation barrier for halide vacancies at the perovskite/electron transport layer interface, suppressing ion migration and significantly enchancing longevity. Poly-FPTS-treated tandem devices delivered a power conversion efficiency (PCE) of 26.5%, with a high open-circuit voltage of 2.178 V. A steady-state certified efficiency of 25.1% was achieved in Japan Electrical Safety & Environmental Technology Laboratories (JET), as reported in Solar Cell Efficiency Tables (version 65). Under continuous 1-sun illumination at the maximum power point (ISOS-L-1I protocol), these devices retained 92% of their initial efficiency after 1000 hours, and they exhibited an efficiency loss",rsc_html,0
An estuarine-inspired dual-gradient hydrogel for stable and scalable moisture energy harvesting up to a single-module 100 mA output,http://pubs.rsc.org/en/Content/ArticleLanding/2026/EE/D5EE04508H,RSC - Energy Environ. Sci. latest articles,2026-02-03 00:00:00 UTC,2026-02-03 00:00:00+00:00,,"Moisture energy harvesting holds immense potential for sustained electricity generation, yet its practical deployment is hindered by the inherent instability of water–ion gradients, leading to rapid performance degradation and limited scalability. Here, we present a dual-layer hydrogel platform driven by asymmetric ionic hydration chemistries, creating persistent water–salt gradients for sustained energy harvesting. The system leverages distinct ionic hydration dynamics, where the LiCl layer maximizes ionic dissociation and water adsorption while the Li2CO3 layer stabilizes the water content through moderate ionic binding. This water–salt dual gradient design induces persistent osmotic pressure differentials, enabling synchronized water–ion migration and continuous ionic transport. Our platform shows a significant improvement in current density compared to conventional long-duration moisture energy generators (MEGs), achieving a peak current density of 96.4 µA cm−2 and a power density of 5.06 µW cm−2, while maintaining stable operation for over 500 h. Additionally, we introduce a highly scalable MEG platform, with an active surface area of 1000 cm2, enabling energy harvesting at scales previously unattainable. This work demonstrates a scalable and durable MEG platform capable of sustainable energy generation in diverse environments, paving the way for self-powered wearable electronics, environmental monitoring, and autonomous sensing technologies.",rsc_html,0
Expanding the DNA damaging potential of artificial metallo-nucleases with click chemistry,https://www.nature.com/articles/s41467-026-68911-5,Nature Communications,2026-02-03 00:00:00 UTC,2026-02-03 00:00:00+00:00,,"Recently, copper(I)-catalysed azide-alkyne cycloaddition (CuAAC) click chemistry has emerged as a promising approach for designing new artificial metallo-nucleases (AMNs) with DNA-damaging properties. By functionalising a central organic azide with three alkyne donors, Tri-Click (TC) ligands capable of chelating three copper ions through the donor group and triazole linker can be generated. However, the versatility of this approach along with the influence of specific donors on metal binding, DNA recognition, and cellular DNA damage in an anticancer context remains poorly understood. Here, we prepare a series of Tri-Click ligands incorporating systematic cyclic and acyclic N-, O-, and S-donors and evaluate their AMN activities. Screening experiments pinpoint planar N-donor ligands as high value agents. Among these, the copper complex of Tri-Click-Pyridine (Cu3-TC-Py) displays significant potential. We characterise its activity using single-molecule imaging, microscale thermophoresis, FRET-based binding assays, molecular dynamics, and intracellular DNA interaction studies in human and functional bacterial cells. We report the emergence of Cu3-TC-Py as a lead AMN with high reactivity for DNA damage applications central to anticancer therapy.",nature_html,0
PCET-enabled decarboxylative oxygenation promoted by photoexcited nitroarenes,https://www.cell.com/chem/fulltext/S2451-9294(25)00463-2?rss=yes,Chem,2026-02-03 00:00:00 UTC,2026-02-03 00:00:00+00:00,,"Decarboxylative oxygenation reactions leverage abundant carboxylic acids to synthesize useful oxygenated products. Herein, we present a photoexcited nitroarene-mediated approach for the practical, economical, and anaerobic decarboxylative oxygenation of carboxylic acids. Under visible-light irradiation, the commercially available nitroarene dually enables direct homolysis of strong carboxylic acid O–H bonds and subsequent oxygen atom transfer with the resulting alkyl radicals. Mechanistic experiments, including DFT and carbon-13 isotope studies, elucidate the key PCET process, laying the groundwork for the future utility of this powerful reagent class.",rss_cell,0
Synergistic effects: From the coffee room to coordination cages,https://www.cell.com/chem/fulltext/S2451-9294(26)00016-1?rss=yes,Chem,2026-02-03 00:00:00 UTC,2026-02-03 00:00:00+00:00,,"Sharing and confronting ideas is at the core of scientific progress, making collaboration a design principle that can directly shape molecular architectures. In the same spirit, here multicomponent Pd(II) coordination cages combine chiral ligands with chromophore-based ligands to create synergistic effects. The use of “adjacent backbone interactions” directs integrative self-sorting to form low-symmetry isosceles-triangle or pseudo-tetrahedral cages. These assemblies translate structural complexity into function via ligand-to-ligand chirality transfer, as evidenced by chiroptical spectroscopy, and discrimination of chiral guests.",rss_cell,0
Charging molecular nanographenes with electrons through chemical reduction,http://pubs.rsc.org/en/Content/ArticleLanding/2026/CS/D5CS01377A,RSC - Chem. Soc. Rev. latest articles,2026-02-03 00:00:00 UTC,2026-02-03 00:00:00+00:00,,"Chemical reduction studies of molecular nanographenes with different core dimensions and topologies are used to uncover their electron accepting abilities and original outcomes of the negative charge build-up. A combination of X-ray crystallographic and spectroscopic analysis of the gradually reduced nanographenes reveals their multi-electron accepting properties, coupled with original charge-dependent conformational changes, unique structural transformations, site-specific reactivity, and supramolecular aggregation. By providing an overview of structural and electronic responses to the stepwise reduction, this review aims to promote further studies of supercharged molecular nanographenes and their use as advanced energy-storage materials.",rsc_html,0
Daily briefing: What people with no ‘mind’s eye’ can tell us about consciousness,https://www.nature.com/articles/d41586-026-00361-x,Nature,2026-02-03 00:00:00 UTC,2026-02-03 00:00:00+00:00,,,,0
Electrolyte engineering for hydrogen energy,https://www.cell.com/joule/fulltext/S2542-4351(25)00487-8?rss=yes,Joule,2026-02-03 00:00:00 UTC,2026-02-03 00:00:00+00:00,,"Advances in hydrogen energy research highlight the critical role of solvent effects, but their specific impacts remain highly complex and lack comprehensive understanding. This perspective underscores electrolyte engineering at the electrode-electrolyte interface as a key approach to boost reaction efficiency, enabling sustainable hydrogen production for carbon neutrality.",rss_cell,0
Ontogeny and transcriptional regulation of Thetis cells,https://www.nature.com/articles/s41586-026-10198-z,Nature,2026-02-03 00:00:00 UTC,2026-02-03 00:00:00+00:00,,"Thetis cells (TCs) are a recently identified lineage of RORγt+ antigen-presenting cells comprising four subsets including a tolerogenic subset, TC IV, that instructs tolerance to gut microbiota and food antigens1–6. A developmental wave of TCs during early life creates a critical window of opportunity for establishing intestinal tolerance1,5. Yet the ontogeny of TCs and the cues shaping their abundance and heterogeneity remain unknown, limiting efforts to harness their therapeutic potential. Here we identify a population of RORγt+ progenitors, termed Thetis-Lymphoid Tissue inducer progenitors (TLP), that give rise to the immediate TC progenitor (TCP) and the Lymphoid Tissue inducer progenitor (LTiP), and identify PU.1 as the transcription factor governing TC fate. Despite transcriptional similarity to myeloid-derived conventional dendritic cells (cDCs), we show that TCs descend from the common lymphoid progenitor (CLP). Deletion of the plasmacytoid DC (pDC) lineage-determining transcription factor TCF4 expands TLPs and TCs, suggesting a shared developmental branch with pDCs. TLPs are enriched in fetal liver; however, unlike LTi cells, TCs emerge postnatally, pointing to developmentally-timed environmental cues that promote TCP differentiation. We identify one such cue–RANKL provision by lymphoid tissue organizer cells–which is essential for TC I differentiation. Together, these findings define the ontogeny of TCs and the transcription factors that promote TC differentiation and heterogeneity, facilitating future investigations of these enigmatic cells and their therapeutic potential for tolerance induction in food allergy and autoimmunity.",nature_html,0
An absolute quantification atlas of small non-coding RNAs across diverse mammalian tissues and cell lines,https://www.nature.com/articles/s41467-026-68812-7,Nature Communications,2026-02-03 00:00:00 UTC,2026-02-03 00:00:00+00:00,,"The low quantitative accuracy of conventional small noncoding RNA sequencing (sncRNA-seq) methods due to extensive ligation bias commonly limits functional investigation of microRNAs (miRNAs) and PIWI-interacting RNAs (piRNAs). Here, we develop 4NBoost, a single-tube sncRNA-seq protocol designed to minimize bias in the estimated absolute quantification of miRNA and piRNA transcripts through the incorporation of quantitative exogenous RNA spike-ins. With 4NBoost, we profile sncRNA expression across 20 murine tissues, 18 macaque tissues, and 24 widely used cell lines, as well as 4 Arabidopsis tissues, to establish a comprehensive quantitative reference atlas. Compared with existing small RNA databases, our data reveal substantial biases in miRNA abundance, strand selection, and tissue-specific expression at both individual and family levels. To further extend its utility, we employ machine learning to model and correct biases in conventional datasets, effectively recovering ground truth transcript abundances. All 4NBoost data and the accompanying bias-correction model are freely available via SmRNAQuant (http://wulg-lab.sibcb.ac.cn/SmRNAQuant/), a web-based repository for exploring sncRNA expression. Together, the 4NBoost, bias-correction model, and SmRNAQuant provide powerful resources to advance sncRNA research.",nature_html,0
Anthropogenic climate change drives rising global heat stress and its spatial inequality,https://www.nature.com/articles/s41467-026-69164-y,Nature Communications,2026-02-03 00:00:00 UTC,2026-02-03 00:00:00+00:00,,"Global heat stress is intensifying under climate change, yet the relative roles of natural and anthropogenic forcing remain insufficiently quantified. Here, we show that global heat stress trend, assessed with the Universal Thermal Climate Index, increases markedly over the past four decades, with 52% of land area experiencing rises in mean heat stress intensity and 67% showing increases in extreme heat stress days. We find that anthropogenic climate change overwhelmingly dominates these trends, with the land area it dominates nearly twice as large as that dominated by natural climate change. Anthropogenic climate change also results in pronounced spatial inequality in heat stress trends across different economies, with low-income economies experiencing a growth rate two to three times higher than that of high-income economies. These findings demonstrate that human-induced climate change is amplifying global heat stress while deepening existing spatial inequalities, underscoring the urgency of equitable climate change adaptation.",nature_html,0
Selectivity mechanisms of ion intercalation in Prussian blue analogs,https://www.cell.com/matter/fulltext/S2590-2385(25)00618-6?rss=yes,Matter,2026-02-03 00:00:00 UTC,2026-02-03 00:00:00+00:00,,Sun et al. revealed the mechanistic origins of ion selectivity in Prussian blue analogs (PBAs) using copper hexacyanoferrate as a model. The findings offer deeper understanding for identifying and harnessing chemical “handles” to modulate and enhance ion selectivity for critical element separation.,rss_cell,0
Water-based coupling of amino acids for sustainable solid-phase peptide synthesis,https://www.nature.com/articles/s41893-025-01761-z,Nature Sustainability,2026-02-03 00:00:00 UTC,2026-02-03 00:00:00+00:00,,"Solid-phase peptide synthesis (SPPS) is a primary source of peptides for structure–function studies in development of potential clinical, agricultural, veterinary or cosmetic applications. Despite its efficiency and scalability, SPPS produces unsustainable volumes of toxic waste and non-degradable solid supports. With regulatory changes now in effect to reduce solvent use, there is a pressing need for sustainable, water-based synthesis methods. Due to the aqueous insolubility of the commonly employed Nα-Fmoc-amino acids—the primary building blocks in SPPS—establishing water-based peptide synthesis protocols is extremely challenging. Here we show that amine salts of, for example, N-methylmorpholine or N,N,N-triethanolamine and Nα-Fmoc protected amino acids are water soluble at high concentrations. Activation with a pre-formed water-soluble activating agent enables high quality SPPS on a hydrophilic and biodegradable poly-ε-lysine-based solid support in aqueous solution without characteristic side reactions. The presented methodology provides a simple avenue to sustainable, scalable water-based chemical synthesis of peptides.",nature_html,0
Mechanistic understanding of interphase-driven ageing in silicon anodes,https://www.nature.com/articles/s41560-026-01967-1,Nature Energy,2026-02-03 00:00:00 UTC,2026-02-03 00:00:00+00:00,,"Conventional solid electrolyte interphases (SEIs) strongly adhere to micro-silicon (µ-Si) and crack under volume changes, causing poor cycling performance. Nano-silicon improves cycling performance but remains costly with limited calendar life. Here potentiostatic ageing tests demonstrate that both calendar and cycle ageing are governed by SEI cracking and dissolution with different relative contributions. When the system is not dominated by SEI dissolution, the relative calendar life of Si anodes could correlates positively with their cycle life. LiF-rich SEI that enables long cycle life in µ-Si is therefore expected to enhance calendar life as well. Using this framework, we screened electrolytes, SEIs and electrodes and validated them with full-cell storage. LiF-rich SEI minimizes cracking and dissolution, enabling μ-Si to achieve excellent calendar life, whereas nano-silicon suffers from SEI dissolution and needs reduced electrolyte–electrode contact for better calendar life. This work clarifies calendar-ageing behaviour and accelerates electrolytes and SEI development for long-life Si anodes.",nature_html,0
Aligning sociotechnical systems perspectives and adoption readiness levels to accelerate clean energy adoption,https://www.nature.com/articles/s44359-026-00146-5,Nature Reviews Clean Technology,2026-02-03 00:00:00 UTC,2026-02-03 00:00:00+00:00,,"Accelerating clean energy technology adoption requires a comprehensive understanding of the complex interplay between technological and social factors. In this Perspective, we discuss how the sociotechnical (ST) systems field of research, which is part of the broader field of science and technology studies (STS), aligns to the adoption readiness level (ARL) framework. Unlike the technology readiness levels, which focuses on the technical maturity of technologies, ARL aligns with STS and ST systems thinking through emphasis on the technical, economic, social, political and cultural factors that hinder technology adoption. We map four core risk areas of ARL — value proposition, market acceptance, resource maturity and licence to operate — to ST systems elements. This framework provides academics, policymakers and practitioners with theoretically grounded, context-tailored tools for improved assessment of clean technology adoption readiness.",nature_html,0
Heavy is the Crown: Crown Ether Modulation of Cobalt Porphyrin CO2 Electroreduction in Zero‐Gap Electrolyzers,https://onlinelibrary.wiley.com/doi/10.1002/anie.202525189?af=R,Wiley: Angewandte Chemie International Edition: Table of Contents,2026-02-03 05:10:14 UTC,2026-02-03 05:10:14+00:00,10.1002/anie.202525189,"ABSTRACT
                  
                    Since decades, metalloporphyrins have been studied to catalyze the electrochemical CO
                    2
                    reduction (eCO
                    2
                    R) with the most recent studies focusing on immobilized complexes aiming for heterogeneous, scalable catalysis. However, reports for the application in industrially relevant zero‐gap type electrolyzer cells (ZGEs) are especially rare. Herein we present the synthesis of four novel crown ether (CE) substituted cobalt porphyrins to benefit from an increased local cation concentration. Following their electrochemical characterization all catalysts have been tested in ZGEs. Experiments under laboratory‐scale conditions (≤100 mA/cm
                    2
                    ) revealed that the positioning of the CE influences the catalytic performance in terms of Faradaic Efficiency for CO (FE
                    CO
                    ) as well as cell voltage. A maximum selectivity for CO of 96% at 100 mA/cm
                    2
                    is reached, ranking the
                    ortho
                    substituted complex among the best state of the art systems. Post‐mortem analysis of the prepared electrodes proved that the introduction of CEs enhances the complex stability significantly. At higher current densities (≤500 mA/cm
                    2
                    ) the positioning of the CEs is less impactful. Instead, the type and concentration of cations in the reactor play a dominant role determining reaction performance, achieving up to 43% FE
                    CO
                    at 300 mA/cm
                    2
                    with a high potassium concentration.",crossref,0
Self‐Amplified Nanomedicine Enables Lysosomal Blockade to Potentiate Starvation Therapy of Pancreatic Ductal Adenocarcinoma,https://advanced.onlinelibrary.wiley.com/doi/10.1002/adma.202519523?af=R,Wiley: Advanced Materials: Table of Contents,2026-02-03 05:11:43 UTC,2026-02-03 05:11:43+00:00,10.1002/adma.202519523,"ABSTRACT
                  Starvation therapy targeting the metabolic vulnerability of pancreatic ductal adenocarcinoma (PDAC) holds great potential; however, analyses of clinical samples and orthotopic models reveal that its efficacy is undermined by lysosome‐mediated metabolic compensation. To disrupt this metabolic adaptability, we herein engineer a homotypic membrane‐camouflaged nanomedicine capable of hypoxia‐responsive cascade drug release and enhanced tumor accumulation. The resulting nanomedicine performs a hypoxia‐induced phase transition that first liberates glucose oxidase to intensify oxygen deprivation and subsequently triggers burst release of chloroquine. Such a design of self‐amplified relay drug release ensures effective starvation induction and precise lysosomal alkalization, thereby shutting down lysosome‐mediated nutrient recycling. In a xenograft orthotopic PDAC model, this nanomedicine achieves 9.75‐fold increase in tumor accumulation, robust tumor inhibition of 92.8%, and an elevated survival rate of 80% with favorable biosafety. Collectively, our findings highlight lysosomal disruption as a therapeutic lever to potentiate starvation therapy and provide a clinically actionable nanoplatform to enhance metabolic interventions for other metabolically vulnerable malignancies.",crossref,0
Directional Catalysis of Sulfur at Highly Ordered Triple‐Phase Interfaces in All‐Solid‐State Lithium‐Sulfur Batteries,https://advanced.onlinelibrary.wiley.com/doi/10.1002/adma.202522483?af=R,Wiley: Advanced Materials: Table of Contents,2026-02-03 05:13:38 UTC,2026-02-03 05:13:38+00:00,10.1002/adma.202522483,"ABSTRACT
                  
                    Sluggish sulfur reaction kinetics present a critical barrier to the practical application of sulfide‐electrolyte (SE) based all‐solid‐state lithium‐sulfur batteries (ASSLSBs). Achieving high performance requires both lowering the intrinsic energy barrier for sulfur conversion and engineering efficient transport pathways. Herein, we address these challenges by designing atomically dispersed cobalt sites on carbon nanotubes to directionally catalyze sulfur conversion at the triple phase interface. Strong orbital hybridization between Co 3d and S 3p states strengthens chemical bonding, effectively accelerating both sulfur reduction and lithium sulfide oxidation. The interfaces tailored for directional catalysis maximize highly ordered C/S/SE triple‐phase interfaces and minimize SE/C interfaces, establishing hierarchical ionic/electronic transport networks while mitigating side reactions. Consequently, the engineered cathode delivers a high reversible capacity of 1108 mAh g
                    −
                    1
                    at 0.5 C, retaining 97 % capacity over 500 cycles. The resulting batteries also demonstrate remarkable robustness under demanding conditions. This work offers a powerful catalysis‐driven strategy for high‐performance ASSLSBs.",crossref,0
