title,link,published,source,pub_date
New dinosaur species as long as cricket pitch discovered in Thailand,https://www.bbc.co.uk/news/articles/crely7g8xepo?at_medium=RSS&at_campaign=rss,2026-07-11 08:23:45 UTC,BBC News,2026-07-11 08:23:45+00:00
Heatwave to stretch into second week despite cooler air for some this weekend,https://www.bbc.co.uk/weather/articles/c621kp4y701o?at_medium=RSS&at_campaign=rss,2026-07-11 10:41:15 UTC,BBC News,2026-07-11 10:41:15+00:00
RSPB buys 'magical' 96-hectare landscape to reconnect habitats,https://www.bbc.co.uk/news/articles/cdx78nk7g25o?at_medium=RSS&at_campaign=rss,2026-07-11 12:01:34 UTC,BBC News,2026-07-11 12:01:34+00:00
Wildlife conservation work to get £1m boost,https://www.bbc.co.uk/news/articles/cp3xg2zkkv8o?at_medium=RSS&at_campaign=rss,2026-07-11 14:53:12 UTC,BBC News,2026-07-11 14:53:12+00:00
T. rex could become most expensive fossil ever - but it's a ​problem for scientists,https://www.bbc.co.uk/news/articles/c4gykgyn1r4o?at_medium=RSS&at_campaign=rss,2026-07-11 23:58:40 UTC,BBC News,2026-07-11 23:58:40+00:00
