title,link,published,source,pub_date
In‐Situ Observation of Atom Motion and Manipulation of Structural Transformation,https://advanced.onlinelibrary.wiley.com/doi/10.1002/adma.202520290?af=R,2025-11-17 09:00:37 UTC,Wiley: Advanced Materials: Table of Contents,2025-11-17 09:00:37+00:00
Electrochemical Controllable Divergent Carboxylation and Hydrocarboxylation of Alkynes with CO2,https://onlinelibrary.wiley.com/doi/10.1002/anie.202520335?af=R,2025-11-17 09:00:52 UTC,Wiley: Angewandte Chemie International Edition: Table of Contents,2025-11-17 09:00:52+00:00
Amphiphilic Polymer Conetworks for Non‐Fullerene Organic Solar Cells: Regulated Molecular Stacking Enables Efficient Downconversion,https://advanced.onlinelibrary.wiley.com/doi/10.1002/aenm.202504273?af=R,2025-11-17 09:02:31 UTC,Wiley: Advanced Energy Materials: Table of Contents,2025-11-17 09:02:31+00:00
Interfacial Charge Flow Modulation of CaF2/CaAl12O19:Dy Heterojunctions for Enhanced Mechanoluminescence in Flexible Composites,https://advanced.onlinelibrary.wiley.com/doi/10.1002/adma.202515048?af=R,2025-11-17 09:03:06 UTC,Wiley: Advanced Materials: Table of Contents,2025-11-17 09:03:06+00:00
Decoupling the Interfacial Failure Mechanisms of Zn Anodes via Functional Zoning Strategy,https://advanced.onlinelibrary.wiley.com/doi/10.1002/aenm.202505264?af=R,2025-11-17 09:03:23 UTC,Wiley: Advanced Energy Materials: Table of Contents,2025-11-17 09:03:23+00:00
Thermal Property Engineering in Mn‐Based Hybrid Halides via Structural Tailoring of Phosphonium Cations,https://onlinelibrary.wiley.com/doi/10.1002/anie.202521897?af=R,2025-11-17 09:04:16 UTC,Wiley: Angewandte Chemie International Edition: Table of Contents,2025-11-17 09:04:16+00:00
Metamaterials Break the Constraints of Traditional Civil Infrastructure,https://advanced.onlinelibrary.wiley.com/doi/10.1002/adma.202518198?af=R,2025-11-17 09:05:19 UTC,Wiley: Advanced Materials: Table of Contents,2025-11-17 09:05:19+00:00
Unlocking Hydrogen‐Bond Network‐Mediated Directional Spillover Mechanism in Electrocatalytic Hydrogen Evolution,https://onlinelibrary.wiley.com/doi/10.1002/anie.202517583?af=R,2025-11-17 09:06:38 UTC,Wiley: Angewandte Chemie International Edition: Table of Contents,2025-11-17 09:06:38+00:00
Development of Materials for All Solid‐State Sodium‐Sulfur Batteries: Review and Prospects,https://advanced.onlinelibrary.wiley.com/doi/10.1002/aenm.202505400?af=R,2025-11-17 09:06:47 UTC,Wiley: Advanced Energy Materials: Table of Contents,2025-11-17 09:06:47+00:00
Anti‐Creep Adhesive Tapes via Trapped‐Entanglement‐Regulated Topological Networks,https://advanced.onlinelibrary.wiley.com/doi/10.1002/adma.202513105?af=R,2025-11-17 09:07:28 UTC,Wiley: Advanced Materials: Table of Contents,2025-11-17 09:07:28+00:00
Deciphering the Novel Photoreactivity of β‐Enaminones,https://onlinelibrary.wiley.com/doi/10.1002/anie.202519037?af=R,2025-11-17 09:08:36 UTC,Wiley: Angewandte Chemie International Edition: Table of Contents,2025-11-17 09:08:36+00:00
Oxygen Vacancy‐Driven Asymmetrical Charge Distribution on Bi‐O‐Sn Sites in Sn‐Doped Bi2MoO6 for Efficient Photocatalytic CO2‐to‐CH4 Conversion,https://onlinelibrary.wiley.com/doi/10.1002/anie.202521874?af=R,2025-11-17 09:08:41 UTC,Wiley: Angewandte Chemie International Edition: Table of Contents,2025-11-17 09:08:41+00:00
Large‐Area COF Membrane with Hourglass‐Shaped Nanochannels for Enhanced Hydrogen Separation,https://onlinelibrary.wiley.com/doi/10.1002/anie.202512716?af=R,2025-11-17 09:09:27 UTC,Wiley: Angewandte Chemie International Edition: Table of Contents,2025-11-17 09:09:27+00:00
Beyond Conventional Cooling: Advanced Micro/Nanostructures for Managing Extreme Heat Flux,https://advanced.onlinelibrary.wiley.com/doi/10.1002/adma.202504706?af=R,2025-11-17 09:09:57 UTC,Wiley: Advanced Materials: Table of Contents,2025-11-17 09:09:57+00:00
Grain Welding Strategy Suppressing Chemomechanical Failure in Polycrystalline Cathode for High‐Voltage Fast‐Charging Sodium‐Ion Batteries,https://advanced.onlinelibrary.wiley.com/doi/10.1002/adma.202514943?af=R,2025-11-17 09:10:57 UTC,Wiley: Advanced Materials: Table of Contents,2025-11-17 09:10:57+00:00
Efficient Synthesis and Catalytic Performance Tuning of High‐Entropy Alloys Using a Weaving Strategy,https://onlinelibrary.wiley.com/doi/10.1002/anie.202522878?af=R,2025-11-17 09:12:04 UTC,Wiley: Angewandte Chemie International Edition: Table of Contents,2025-11-17 09:12:04+00:00
Mechanistic Insights of Bipolar Redox Cathodes for Organic Rechargeable Batteries: LUMO Anti‒Bonding Contributions,https://onlinelibrary.wiley.com/doi/10.1002/anie.202521979?af=R,2025-11-17 09:13:27 UTC,Wiley: Angewandte Chemie International Edition: Table of Contents,2025-11-17 09:13:27+00:00
Halogen Co‐Mixing—An Effective Strategy for Optimizing Luminescent Performance of Copper‐Based Hybrid Scintillator,https://onlinelibrary.wiley.com/doi/10.1002/anie.202515696?af=R,2025-11-17 09:13:31 UTC,Wiley: Angewandte Chemie International Edition: Table of Contents,2025-11-17 09:13:31+00:00
Correction to “Ring‐Opening Polymerization of Surface Ligands Enables Versatile Optical Patterning and Form Factor Flexibility in Quantum Dot Assemblies”,https://advanced.onlinelibrary.wiley.com/doi/10.1002/adma.71457?af=R,2025-11-17 09:13:59 UTC,Wiley: Advanced Materials: Table of Contents,2025-11-17 09:13:59+00:00
Proton Transfer‐Hydrogen Bonds Network for Highly Efficient and Stable Inverted Perovskite Solar Cells,https://onlinelibrary.wiley.com/doi/10.1002/anie.202522939?af=R,2025-11-17 09:14:30 UTC,Wiley: Angewandte Chemie International Edition: Table of Contents,2025-11-17 09:14:30+00:00
Unprecedented Energy Density of Polyimide Dielectrics at Elevated Temperatures Utilizing Atomic Engineering to Decouple π‐Conjugation,https://advanced.onlinelibrary.wiley.com/doi/10.1002/adma.202515860?af=R,2025-11-17 09:15:57 UTC,Wiley: Advanced Materials: Table of Contents,2025-11-17 09:15:57+00:00
Energy‐Efficient Electro‐Fenton Oxidation Enabled by CoCu Dual‐Atom Catalysts with High Oxygen Utilization,https://onlinelibrary.wiley.com/doi/10.1002/anie.202519275?af=R,2025-11-17 09:17:37 UTC,Wiley: Angewandte Chemie International Edition: Table of Contents,2025-11-17 09:17:37+00:00
The Methylbismuth Dication: Pentagonal Pyramidal Coordination and Ligand‐Induced Lewis Superacidity,https://onlinelibrary.wiley.com/doi/10.1002/anie.202516140?af=R,2025-11-17 09:17:55 UTC,Wiley: Angewandte Chemie International Edition: Table of Contents,2025-11-17 09:17:55+00:00
Dual Vacancy‐Driven “Lattice Softening” NiFeAlx LDHs for High‐Rate and Durable Chloride Ion Storage,https://advanced.onlinelibrary.wiley.com/doi/10.1002/adma.202517528?af=R,2025-11-17 09:19:44 UTC,Wiley: Advanced Materials: Table of Contents,2025-11-17 09:19:44+00:00
Enhanced CO Oxidation on PtOx Raft Species Synthesized via Citric Acid‐Assisted Electrostatic Adsorption,https://onlinelibrary.wiley.com/doi/10.1002/anie.202520136?af=R,2025-11-17 09:20:46 UTC,Wiley: Angewandte Chemie International Edition: Table of Contents,2025-11-17 09:20:46+00:00
Boosting Nitrate Reduction through Ru‐CO32− Microenvironment Modulated Hydrogen‐Bond Networks,https://onlinelibrary.wiley.com/doi/10.1002/anie.202521249?af=R,2025-11-17 09:21:29 UTC,Wiley: Angewandte Chemie International Edition: Table of Contents,2025-11-17 09:21:29+00:00
Non‐Halogenated Solvent Processed Shortwave Infrared Organic Photodetectors Using Sub‐1 eV Bandgap Acceptor with Cyano Substitution,https://advanced.onlinelibrary.wiley.com/doi/10.1002/adma.202514845?af=R,2025-11-17 09:21:56 UTC,Wiley: Advanced Materials: Table of Contents,2025-11-17 09:21:56+00:00
Direct Access to Acylboranes via Formal Condensation of Carboxylic Acids with Ligated Boranes,https://onlinelibrary.wiley.com/doi/10.1002/anie.202516826?af=R,2025-11-17 09:24:19 UTC,Wiley: Angewandte Chemie International Edition: Table of Contents,2025-11-17 09:24:19+00:00
Polymer–Perovskite Microcrystal Heterojunction for Self‐Powered Optical Sensing and Communication,https://advanced.onlinelibrary.wiley.com/doi/10.1002/adma.202517950?af=R,2025-11-17 09:25:50 UTC,Wiley: Advanced Materials: Table of Contents,2025-11-17 09:25:50+00:00
This parasitic ant tricks workers into killing their own queen,https://www.science.org/content/article/parasitic-ant-tricks-workers-killing-their-own-queen,2025-11-17 11:00:00 UTC,Latest News from Science Magazine,2025-11-17 11:00:00+00:00
Have wild wolves learned to use tools?,https://www.science.org/content/article/have-wild-wolves-learned-use-tools,2025-11-17 12:00:00 UTC,Latest News from Science Magazine,2025-11-17 12:00:00+00:00
"Giant telescope project, long planned for Hawaii, gets cozy with Spain",https://www.science.org/content/article/giant-telescope-project-long-planned-hawaii-gets-cozy-spain,2025-11-17 12:36:00 UTC,Latest News from Science Magazine,2025-11-17 12:36:00+00:00
[ASAP] Thermally Evaporated SnO2 Buffer Layers for p–i–n Perovskite Solar Cells,http://dx.doi.org/10.1021/acsenergylett.5c03206,2025-11-17 13:45:38 UTC,ACS Energy Letters: Latest Articles (ACS Publications),2025-11-17 13:45:38+00:00
"[ASAP] Biorthogonal PEGylation of Hierarchical Porous Metal–Organic Frameworks as Robust, Functional Nanocarriers for Hemoglobin-Based Oxygen Delivery",http://dx.doi.org/10.1021/jacs.5c10582,2025-11-17 13:49:05 UTC,Journal of the American Chemical Society: Latest Articles (ACS Publications),2025-11-17 13:49:05+00:00
From seabirds to sea turtles: the fatal toll of plastic revealed,https://www.bbc.com/news/articles/cr5eyjd2zz7o?at_medium=RSS&at_campaign=rss,2025-11-17 20:00:14 UTC,BBC News,2025-11-17 20:00:14+00:00
