title,link,published,source,pub_date
Spatial dynamics of brain development and neuroinflammation,https://www.nature.com/articles/s41586-025-09663-y,2025-11-05 00:00:00 UTC,Nature,2025-11-05 00:00:00+00:00
Targeting FSP1 triggers ferroptosis in lung cancer,https://www.nature.com/articles/s41586-025-09710-8,2025-11-05 00:00:00 UTC,Nature,2025-11-05 00:00:00+00:00
Dispersion-engineered multipass optical parametric amplification,https://www.nature.com/articles/s41586-025-09665-w,2025-11-05 00:00:00 UTC,Nature,2025-11-05 00:00:00+00:00
Meet the ‘Wee-rex’. Tiny tyrannosaur is its own species,https://www.nature.com/articles/d41586-025-03642-z,2025-11-05 00:00:00 UTC,Nature,2025-11-05 00:00:00+00:00
Myriad Aryne Derivatives from Carboxylic Acids,https://www.nature.com/articles/s41586-025-09830-1,2025-11-05 00:00:00 UTC,Nature,2025-11-05 00:00:00+00:00
Ultrashort laser pulse amplified by back-and-forth propagation,https://www.nature.com/articles/d41586-025-03449-y,2025-11-05 00:00:00 UTC,Nature,2025-11-05 00:00:00+00:00
"Daily briefing: UK science is ‘bleeding to death’, says report",https://www.nature.com/articles/d41586-025-03654-9,2025-11-05 00:00:00 UTC,Nature,2025-11-05 00:00:00+00:00
"Chinese scientists increasingly lead joint projects with the UK, US and Europe",https://www.nature.com/articles/d41586-025-03617-0,2025-11-05 00:00:00 UTC,Nature,2025-11-05 00:00:00+00:00
Most Antarctic ice shelves are set to disappear if greenhouse-gas emissions remain high,https://www.nature.com/articles/d41586-025-03581-9,2025-11-05 00:00:00 UTC,Nature,2025-11-05 00:00:00+00:00
‘Mind-captioning’ AI decodes brain activity to turn thoughts into text,https://www.nature.com/articles/d41586-025-03624-1,2025-11-05 00:00:00 UTC,Nature,2025-11-05 00:00:00+00:00
Images for AI use can be sourced responsibly,https://www.nature.com/articles/d41586-025-03568-6,2025-11-05 00:00:00 UTC,Nature,2025-11-05 00:00:00+00:00
Highly selective and efficient uranium recovery by size-sieving porous aromatic frameworks with rigidly functionalized windows,https://www.cell.com/chem/fulltext/S2451-9294(25)00405-X?rss=yes,2025-11-05 00:00:00 UTC,Chem,2025-11-05 00:00:00+00:00
Primitive genotype-phenotype coupling in fuel-dependent synthetic cells with an autocatalyst,https://www.cell.com/chem/fulltext/S2451-9294(25)00407-3?rss=yes,2025-11-05 00:00:00 UTC,Chem,2025-11-05 00:00:00+00:00
Can AI be truly creative?,https://www.nature.com/articles/d41586-025-03570-y,2025-11-05 00:00:00 UTC,Nature,2025-11-05 00:00:00+00:00
Developmental maps of the brain trace when cell types emerge,https://www.nature.com/articles/d41586-025-03450-5,2025-11-05 00:00:00 UTC,Nature,2025-11-05 00:00:00+00:00
Author Correction: Materials and systems for large-scale photocatalytic water splitting,https://www.nature.com/articles/s41578-025-00859-2,2025-11-05 00:00:00 UTC,Nature Reviews Materials,2025-11-05 00:00:00+00:00
Robust Interfaces via Synergistic Cation-Anion Manipulation for Highly Efficient and Stable Inverted Perovskite Solar Cells,http://pubs.rsc.org/en/Content/ArticleLanding/2025/EE/D5EE04111B,2025-11-05 00:00:00 UTC,RSC - Energy Environ. Sci. latest articles,2025-11-05 00:00:00+00:00
Ion Exchange-Induced LixMgyBOz Coating Synergized with Reinforced Bulk Doping Enables Fast-Charging Long-Cycling High-Voltage LiCoO2,http://pubs.rsc.org/en/Content/ArticleLanding/2025/EE/D5EE04240B,2025-11-05 00:00:00 UTC,RSC - Energy Environ. Sci. latest articles,2025-11-05 00:00:00+00:00
Nano-structured thin-film reversible solid oxide cells (TF-RSOCs) with exceptionally high performance at low temperatures (≤600℃),https://www.sciencedirect.com/science/article/pii/S1369702125004572?dgcid=rss_sd_all,2025-11-05 00:00:00 UTC,ScienceDirect Publication: Materials Today,2025-11-05 00:00:00+00:00
Mechano-induced patterned domain formation by monocytes,https://www.nature.com/articles/s41563-025-02397-2,2025-11-05 00:00:00 UTC,Nature Materials,2025-11-05 00:00:00+00:00
Secretome translation shaped by lysosomes and lunapark-marked ER junctions,https://www.nature.com/articles/s41586-025-09718-0,2025-11-05 00:00:00 UTC,Nature,2025-11-05 00:00:00+00:00
Diffracting atoms in solids,https://www.nature.com/articles/s41563-025-02401-9,2025-11-05 00:00:00 UTC,Nature Materials,2025-11-05 00:00:00+00:00
Assessing phylogenetic confidence at pandemic scales,https://www.nature.com/articles/s41586-025-09567-x,2025-11-05 00:00:00 UTC,Nature,2025-11-05 00:00:00+00:00
The new frontier in understanding human and mammalian brain development,https://www.nature.com/articles/s41586-025-09652-1,2025-11-05 00:00:00 UTC,Nature,2025-11-05 00:00:00+00:00
Transcriptomic and spatial organization of telencephalic GABAergic neurons,https://www.nature.com/articles/s41586-025-09296-1,2025-11-05 00:00:00 UTC,Nature,2025-11-05 00:00:00+00:00
Millisecond lifetimes and coherence times in 2D transmon qubits,https://www.nature.com/articles/s41586-025-09687-4,2025-11-05 00:00:00 UTC,Nature,2025-11-05 00:00:00+00:00
"Specificity, length and luck drive gene rankings in association studies",https://www.nature.com/articles/s41586-025-09703-7,2025-11-05 00:00:00 UTC,Nature,2025-11-05 00:00:00+00:00
The importance of past rifting in large igneous province development,https://www.nature.com/articles/s41586-025-09668-7,2025-11-05 00:00:00 UTC,Nature,2025-11-05 00:00:00+00:00
Anosophoros,https://www.nature.com/articles/d41586-025-03265-4,2025-11-05 00:00:00 UTC,Nature,2025-11-05 00:00:00+00:00
A probabilistic histological atlas of the human brain for MRI segmentation,https://www.nature.com/articles/s41586-025-09708-2,2025-11-05 00:00:00 UTC,Nature,2025-11-05 00:00:00+00:00
Anti-progestin therapy targets hallmarks of breast cancer risk,https://www.nature.com/articles/s41586-025-09684-7,2025-11-05 00:00:00 UTC,Nature,2025-11-05 00:00:00+00:00
Eight millennia of continuity of a previously unknown lineage in Argentina,https://www.nature.com/articles/s41586-025-09731-3,2025-11-05 00:00:00 UTC,Nature,2025-11-05 00:00:00+00:00
Two residues reprogram immunity receptors for nitrogen-fixing symbiosis,https://www.nature.com/articles/s41586-025-09696-3,2025-11-05 00:00:00 UTC,Nature,2025-11-05 00:00:00+00:00
Conservation and alteration of mammalian striatal interneurons,https://www.nature.com/articles/s41586-025-09592-w,2025-11-05 00:00:00 UTC,Nature,2025-11-05 00:00:00+00:00
Structural snapshots capture nucleotide release at the μ-opioid receptor,https://www.nature.com/articles/s41586-025-09677-6,2025-11-05 00:00:00 UTC,Nature,2025-11-05 00:00:00+00:00
Continuous cell-type diversification in mouse visual cortex development,https://www.nature.com/articles/s41586-025-09644-1,2025-11-05 00:00:00 UTC,Nature,2025-11-05 00:00:00+00:00
Lineage-resolved atlas of the developing human cortex,https://www.nature.com/articles/s41586-025-09033-8,2025-11-05 00:00:00 UTC,Nature,2025-11-05 00:00:00+00:00
Atomically accurate de novo design of antibodies with RFdiffusion,https://www.nature.com/articles/s41586-025-09721-5,2025-11-05 00:00:00 UTC,Nature,2025-11-05 00:00:00+00:00
Lymphoid gene expression supports neuroprotective microglia function,https://www.nature.com/articles/s41586-025-09662-z,2025-11-05 00:00:00 UTC,Nature,2025-11-05 00:00:00+00:00
Synthetic α-synuclein fibrils replicate in mice causing MSA-like pathology,https://www.nature.com/articles/s41586-025-09698-1,2025-11-05 00:00:00 UTC,Nature,2025-11-05 00:00:00+00:00
Global satellite survey reveals uncertainty in landfill methane emissions,https://www.nature.com/articles/s41586-025-09683-8,2025-11-05 00:00:00 UTC,Nature,2025-11-05 00:00:00+00:00
Fair human-centric image dataset for ethical AI benchmarking,https://www.nature.com/articles/s41586-025-09716-2,2025-11-05 00:00:00 UTC,Nature,2025-11-05 00:00:00+00:00
Lymph node environment drives FSP1 targetability in metastasizing melanoma,https://www.nature.com/articles/s41586-025-09709-1,2025-11-05 00:00:00 UTC,Nature,2025-11-05 00:00:00+00:00
Vector-stimuli-responsive magnetorheological fibrous materials,https://www.nature.com/articles/s41586-025-09706-4,2025-11-05 00:00:00 UTC,Nature,2025-11-05 00:00:00+00:00
Adenosine signalling drives antidepressant actions of ketamine and ECT,https://www.nature.com/articles/s41586-025-09755-9,2025-11-05 00:00:00 UTC,Nature,2025-11-05 00:00:00+00:00
Antibody drugs show promise for treating bird flu and HIV,https://www.nature.com/articles/d41586-025-03540-4,2025-11-05 00:00:00 UTC,Nature,2025-11-05 00:00:00+00:00
All-climate battery energy storage,https://www.cell.com/joule/fulltext/S2542-4351(25)00359-9?rss=yes,2025-11-05 00:00:00 UTC,Joule,2025-11-05 00:00:00+00:00
On-chip quantum interference of indistinguishable single photons from integrated independent molecules,https://www.nature.com/articles/s41565-025-02043-7,2025-11-05 00:00:00 UTC,Nature Nanotechnology,2025-11-05 00:00:00+00:00
Supramolecular chemical recycling of dynamic polymers,https://www.nature.com/articles/s41565-025-02041-9,2025-11-05 00:00:00 UTC,Nature Nanotechnology,2025-11-05 00:00:00+00:00
Graphene oxide doping of the hole injection layer enables 23.6% efficiency in perovskite solar cells with carbon electrodes,https://www.nature.com/articles/s41560-025-01893-8,2025-11-05 00:00:00 UTC,Nature Energy,2025-11-05 00:00:00+00:00
Backward-evaporating solar distillation: From efficiency promotion to practical application,https://www.cell.com/joule/fulltext/S2542-4351(25)00374-5?rss=yes,2025-11-05 00:00:00 UTC,Joule,2025-11-05 00:00:00+00:00
Small increases in material stocks to achieve decent living standards globally,https://www.nature.com/articles/s41893-025-01670-1,2025-11-05 00:00:00 UTC,Nature Sustainability,2025-11-05 00:00:00+00:00
The iodine-129 paradox in nuclear waste management strategies,https://www.nature.com/articles/s41893-025-01629-2,2025-11-05 00:00:00 UTC,Nature Sustainability,2025-11-05 00:00:00+00:00
Canada’s new budget aims to lure U.S. researchers to relocate,https://www.science.org/content/article/canada-s-new-budget-aims-lure-u-s-researchers-relocate,2025-11-05 01:05:00 UTC,Latest News from Science Magazine,2025-11-05 01:05:00+00:00
Simple mix of enzymes shows how information arises out of chemical chaos,https://www.science.org/content/article/simple-mix-enzymes-shows-how-information-arises-out-chemical-chaos,2025-11-05 03:15:00 UTC,Latest News from Science Magazine,2025-11-05 03:15:00+00:00
Researchers ‘decode’ Mandarin Chinese from neural signals,https://www.science.org/content/article/researchers-decode-mandarin-chinese-neural-signals,2025-11-05 03:55:00 UTC,Latest News from Science Magazine,2025-11-05 03:55:00+00:00
Site‐Selective Peptide and Protein Functionalization with Cyclopropenium Cations,https://onlinelibrary.wiley.com/doi/10.1002/anie.202518939?af=R,2025-11-05 06:50:13 UTC,Wiley: Angewandte Chemie International Edition: Table of Contents,2025-11-05 06:50:13+00:00
Programmable Thermochromic Coatings via Interfacial Phase Fusion‐Separation Engineering,https://advanced.onlinelibrary.wiley.com/doi/10.1002/adma.202519197?af=R,2025-11-05 06:52:20 UTC,Wiley: Advanced Materials: Table of Contents,2025-11-05 06:52:20+00:00
DFT‐Guided Design and Synthesis of Bipyridine‐Anchored Copper Single‐Atom Catalysts for Efficient Nitrate‐to‐Ammonia Electroreduction Across a Broad pH Range,https://onlinelibrary.wiley.com/doi/10.1002/anie.202517715?af=R,2025-11-05 06:54:09 UTC,Wiley: Angewandte Chemie International Edition: Table of Contents,2025-11-05 06:54:09+00:00
Pressure‐Modulated Molecular Stacking Strategy Extends Exciton Diffusion Length for Thick‐Film (300 nm) Organic Photovoltaics Exceeding 19% Efficiency,https://advanced.onlinelibrary.wiley.com/doi/10.1002/adma.202514047?af=R,2025-11-05 06:55:00 UTC,Wiley: Advanced Materials: Table of Contents,2025-11-05 06:55:00+00:00
Surface Vacancy Engineering Re‐Routes First‐Cycle Redox for Stabilized Li‐Rich Layered Cathodes,https://onlinelibrary.wiley.com/doi/10.1002/anie.202517720?af=R,2025-11-05 06:56:04 UTC,Wiley: Angewandte Chemie International Edition: Table of Contents,2025-11-05 06:56:04+00:00
Miniature Photoenzyme Enables Organelle‐Specific Cellular Control via Deboronative Hydroxylation,https://onlinelibrary.wiley.com/doi/10.1002/anie.202515137?af=R,2025-11-05 07:02:44 UTC,Wiley: Angewandte Chemie International Edition: Table of Contents,2025-11-05 07:02:44+00:00
Atomistic Landscape of Pt Nanoparticles via Machine Learning: How Size Effect and Hydrogen Adsorption Govern Structural Ensembles and Catalytic Activity,https://onlinelibrary.wiley.com/doi/10.1002/anie.202519209?af=R,2025-11-05 07:04:24 UTC,Wiley: Angewandte Chemie International Edition: Table of Contents,2025-11-05 07:04:24+00:00
Weakly‐Solvated and Co‐Intercalation‐Free Ether‐Based Electrolytes Enhance the Low‐ Temperature and Fast‐Charging Performance of LiFePO4||Graphite Batteries,https://onlinelibrary.wiley.com/doi/10.1002/anie.202521171?af=R,2025-11-05 07:05:54 UTC,Wiley: Angewandte Chemie International Edition: Table of Contents,2025-11-05 07:05:54+00:00
Substituent‐Generated Electric Fields and Ligand Non‐Innocence Drive the Record‐High Efficiency of Iron Tetraphenylporphyrin Catalysts for CO2‐to‐CO Conversion,https://onlinelibrary.wiley.com/doi/10.1002/anie.202520907?af=R,2025-11-05 07:08:00 UTC,Wiley: Angewandte Chemie International Edition: Table of Contents,2025-11-05 07:08:00+00:00
Aminative Suzuki–Miyaura Coupling: Tackling Alkyl Nucleophiles and Addressing the Viability of the Electrophile‐First Mechanism,https://onlinelibrary.wiley.com/doi/10.1002/anie.202518260?af=R,2025-11-05 07:09:25 UTC,Wiley: Angewandte Chemie International Edition: Table of Contents,2025-11-05 07:09:25+00:00
"Ultrafast Single Electron Transfer Enables General Visible Light C─X (S, SS, Se) Coupling via Carbonyl Activation",https://onlinelibrary.wiley.com/doi/10.1002/anie.202514726?af=R,2025-11-05 07:11:15 UTC,Wiley: Angewandte Chemie International Edition: Table of Contents,2025-11-05 07:11:15+00:00
Switching the Reaction Pathway to the Oxide Path for High‐Efficiency Acidic Oxygen Evolution,https://onlinelibrary.wiley.com/doi/10.1002/anie.202520553?af=R,2025-11-05 07:12:04 UTC,Wiley: Angewandte Chemie International Edition: Table of Contents,2025-11-05 07:12:04+00:00
Precise Interfacial Regulation Achieving High‐Rate and Long‐Life Polymer Solid‐State Sodium Metal Batteries,https://advanced.onlinelibrary.wiley.com/doi/10.1002/aenm.202503160?af=R,2025-11-05 07:12:24 UTC,Wiley: Advanced Energy Materials: Table of Contents,2025-11-05 07:12:24+00:00
Modulation of Photoluminescence and Solar Thermal Energy Storage in Norbornadiene–Quadricyclane Dimers,https://onlinelibrary.wiley.com/doi/10.1002/anie.202516629?af=R,2025-11-05 07:13:31 UTC,Wiley: Angewandte Chemie International Edition: Table of Contents,2025-11-05 07:13:31+00:00
siAkt2‐Loaded Nanoparticles Reprogramming Macrophages to M2 Phenotype for Effective Bone Defect Repair,https://advanced.onlinelibrary.wiley.com/doi/10.1002/adma.202410507?af=R,2025-11-05 07:14:37 UTC,Wiley: Advanced Materials: Table of Contents,2025-11-05 07:14:37+00:00
Vacancy‐Engineered Ceria Enables 4f‐Orbital‐Driven Redox Catalysis for Bidirectional Sulfur Conversion in Li─S Batteries,https://advanced.onlinelibrary.wiley.com/doi/10.1002/adma.202514402?af=R,2025-11-05 07:16:33 UTC,Wiley: Advanced Materials: Table of Contents,2025-11-05 07:16:33+00:00
Beyond Local Coordination: How Global Structure Engineers the Selectivity of Single Atom Catalysts for CO2 Reduction,https://onlinelibrary.wiley.com/doi/10.1002/anie.202519826?af=R,2025-11-05 07:17:45 UTC,Wiley: Angewandte Chemie International Edition: Table of Contents,2025-11-05 07:17:45+00:00
"Flexible, Stackable, and Fully Active Thick Electrode with Scalable 3D Topology Braid Structure Enables Supercontinuous Electron/Ion Transport",https://advanced.onlinelibrary.wiley.com/doi/10.1002/adma.202515575?af=R,2025-11-05 07:18:05 UTC,Wiley: Advanced Materials: Table of Contents,2025-11-05 07:18:05+00:00
Conformation‐Matched Symbiotic Noncovalent Sites Facilitated Supramolecular Nanotwists Featuring both P and M Sub‐Helical Domains,https://onlinelibrary.wiley.com/doi/10.1002/anie.202516712?af=R,2025-11-05 07:19:43 UTC,Wiley: Angewandte Chemie International Edition: Table of Contents,2025-11-05 07:19:43+00:00
Non‐Equilibrium Manufacturing for High‐Energy‐Input Solid‐State Battery Materials,https://advanced.onlinelibrary.wiley.com/doi/10.1002/adma.202515467?af=R,2025-11-05 07:20:33 UTC,Wiley: Advanced Materials: Table of Contents,2025-11-05 07:20:33+00:00
One Collision – Two Heteroatoms: Gas‐Phase Preparation of Azasilabenzenes,https://onlinelibrary.wiley.com/doi/10.1002/anie.202517656?af=R,2025-11-05 07:21:39 UTC,Wiley: Angewandte Chemie International Edition: Table of Contents,2025-11-05 07:21:39+00:00
Integrating the Substituent Effect into the Wade–Mingos Rules for Dicarboranes,https://onlinelibrary.wiley.com/doi/10.1002/anie.202513394?af=R,2025-11-05 07:23:20 UTC,Wiley: Angewandte Chemie International Edition: Table of Contents,2025-11-05 07:23:20+00:00
Channel Confinement: A Novel Approach to Tackle Batch Variation in Conjugated Polymers for Organic Electrochemical Transistors,https://advanced.onlinelibrary.wiley.com/doi/10.1002/adma.202510659?af=R,2025-11-05 07:27:51 UTC,Wiley: Advanced Materials: Table of Contents,2025-11-05 07:27:51+00:00
Minutes‐Scale Ultrafast Synthesis of New Oxyhalides Solid Electrolytes with Interfacial Ionic Conduction for All‐Solid‐State Batteries,https://onlinelibrary.wiley.com/doi/10.1002/anie.202516259?af=R,2025-11-05 07:30:17 UTC,Wiley: Angewandte Chemie International Edition: Table of Contents,2025-11-05 07:30:17+00:00
RETRACTION: An Amphiphilic Dendrimer for Effective Delivery of Small Interfering RNA and Gene Silencing In Vitro and In Vivo,https://onlinelibrary.wiley.com/doi/10.1002/anie.202522626?af=R,2025-11-05 07:31:34 UTC,Wiley: Angewandte Chemie International Edition: Table of Contents,2025-11-05 07:31:34+00:00
Design Strategies for High‐Performance Piezoelectric Energy Harvesting Devices,https://advanced.onlinelibrary.wiley.com/doi/10.1002/adma.202512672?af=R,2025-11-05 07:33:11 UTC,Wiley: Advanced Materials: Table of Contents,2025-11-05 07:33:11+00:00
Phosphate Bonded Perchloric Superstructure Enables Energy‐Dense and Ultra‐Stable Aqueous Sodium‐Ion Batteries,https://advanced.onlinelibrary.wiley.com/doi/10.1002/adma.202513415?af=R,2025-11-05 07:36:27 UTC,Wiley: Advanced Materials: Table of Contents,2025-11-05 07:36:27+00:00
"Correction for Young-Brun et al., Within-country inequality and the shaping of a just global climate policy",https://www.pnas.org/doi/abs/10.1073/pnas.2529652122?mi=eymic2&af=R&access=on&content=articlesChapters&publication=pnas&sortBy=Earliest&target=default,2025-11-05 08:00:00 UTC,Proceedings of the National Academy of Sciences: Keyword search for query,2025-11-05 08:00:00+00:00
Computational discovery and experimental validation of high–refractive index HfS2 nanoresonators,https://www.science.org/doi/abs/10.1126/sciadv.adw9339?af=R,2025-11-05 08:00:00 UTC,AAAS: Science Advances: Table of Contents,2025-11-05 08:00:00+00:00
Efficient launching of shear phonons in photostrictive halide perovskites,https://www.science.org/doi/abs/10.1126/sciadv.adw9172?af=R,2025-11-05 08:00:00 UTC,AAAS: Science Advances: Table of Contents,2025-11-05 08:00:00+00:00
Mind captioning: Evolving descriptive text of mental content from human brain activity,https://www.science.org/doi/abs/10.1126/sciadv.adw1464?af=R,2025-11-05 08:00:00 UTC,AAAS: Science Advances: Table of Contents,2025-11-05 08:00:00+00:00
The geometry of jamming algorithms in the random Lorentz gas,https://www.pnas.org/doi/abs/10.1073/pnas.2422096122?mi=eymic2&af=R&access=on&content=articlesChapters&publication=pnas&sortBy=Earliest&target=default,2025-11-05 08:00:00 UTC,Proceedings of the National Academy of Sciences: Keyword search for query,2025-11-05 08:00:00+00:00
The 2020 US Decennial Census is more private than you (might) think,https://www.pnas.org/doi/abs/10.1073/pnas.2500337122?mi=eymic2&af=R&access=on&content=articlesChapters&publication=pnas&sortBy=Earliest&target=default,2025-11-05 08:00:00 UTC,Proceedings of the National Academy of Sciences: Keyword search for query,2025-11-05 08:00:00+00:00
Revisiting the high-dimensional geometry of population responses in the visual cortex,https://www.pnas.org/doi/abs/10.1073/pnas.2506535122?mi=eymic2&af=R&access=on&content=articlesChapters&publication=pnas&sortBy=Earliest&target=default,2025-11-05 08:00:00 UTC,Proceedings of the National Academy of Sciences: Keyword search for query,2025-11-05 08:00:00+00:00
"Gene drives, species complexes, and the risks of collateral damage",https://www.pnas.org/doi/abs/10.1073/pnas.2512489122?mi=eymic2&af=R&access=on&content=articlesChapters&publication=pnas&sortBy=Earliest&target=default,2025-11-05 08:00:00 UTC,Proceedings of the National Academy of Sciences: Keyword search for query,2025-11-05 08:00:00+00:00
"Correction for Hazime et al., Nanoscale restructuring of the immune synapse with an engager enhances NK cell function",https://www.pnas.org/doi/abs/10.1073/pnas.2529651122?mi=eymic2&af=R&access=on&content=articlesChapters&publication=pnas&sortBy=Earliest&target=default,2025-11-05 08:00:00 UTC,Proceedings of the National Academy of Sciences: Keyword search for query,2025-11-05 08:00:00+00:00
Global profiling of polyketide synthases in facultative multicellular eukaryotes,https://www.pnas.org/doi/abs/10.1073/pnas.2515852122?mi=eymic2&af=R&access=on&content=articlesChapters&publication=pnas&sortBy=Earliest&target=default,2025-11-05 08:00:00 UTC,Proceedings of the National Academy of Sciences: Keyword search for query,2025-11-05 08:00:00+00:00
Robert Haselkorn (1934–2025): Pioneer in molecular biology and microbiology,https://www.pnas.org/doi/abs/10.1073/pnas.2522224122?mi=eymic2&af=R&access=on&content=articlesChapters&publication=pnas&sortBy=Earliest&target=default,2025-11-05 08:00:00 UTC,Proceedings of the National Academy of Sciences: Keyword search for query,2025-11-05 08:00:00+00:00
"Correction for Bellis et al., Genomics of sorghum local adaptation to a parasitic plant",https://www.pnas.org/doi/abs/10.1073/pnas.2526590122?mi=eymic2&af=R&access=on&content=articlesChapters&publication=pnas&sortBy=Earliest&target=default,2025-11-05 08:00:00 UTC,Proceedings of the National Academy of Sciences: Keyword search for query,2025-11-05 08:00:00+00:00
Neural correlates of phosphene perception in blind individuals: A step toward a bidirectional cortical visual prosthesis,https://www.science.org/doi/abs/10.1126/sciadv.adv8846?af=R,2025-11-05 08:00:00 UTC,AAAS: Science Advances: Table of Contents,2025-11-05 08:00:00+00:00
Intersectional inequalities in social ties,https://www.science.org/doi/abs/10.1126/sciadv.adu9025?af=R,2025-11-05 08:00:00 UTC,AAAS: Science Advances: Table of Contents,2025-11-05 08:00:00+00:00
"Correction for Zhou et al., 9,000-year-old barley consumption in the foothills of central Asia",https://www.pnas.org/doi/abs/10.1073/pnas.2528950122?mi=eymic2&af=R&access=on&content=articlesChapters&publication=pnas&sortBy=Earliest&target=default,2025-11-05 08:00:00 UTC,Proceedings of the National Academy of Sciences: Keyword search for query,2025-11-05 08:00:00+00:00
"Correction for Lu and Kang, Efficient acquisition of dual metastasis organotropism to bone and lung through stable spontaneous fusion between MDA-MB-231 variants",https://www.pnas.org/doi/abs/10.1073/pnas.2529667122?mi=eymic2&af=R&access=on&content=articlesChapters&publication=pnas&sortBy=Earliest&target=default,2025-11-05 08:00:00 UTC,Proceedings of the National Academy of Sciences: Keyword search for query,2025-11-05 08:00:00+00:00
"Correction for Younis et al., CFTR dictates monocyte adhesion by facilitating integrin clustering but not activation",https://www.pnas.org/doi/abs/10.1073/pnas.2529654122?mi=eymic2&af=R&access=on&content=articlesChapters&publication=pnas&sortBy=Earliest&target=default,2025-11-05 08:00:00 UTC,Proceedings of the National Academy of Sciences: Keyword search for query,2025-11-05 08:00:00+00:00
Strategic analysis of dissent and self-censorship,https://www.pnas.org/doi/abs/10.1073/pnas.2508028122?mi=eymic2&af=R&access=on&content=articlesChapters&publication=pnas&sortBy=Earliest&target=default,2025-11-05 08:00:00 UTC,Proceedings of the National Academy of Sciences: Keyword search for query,2025-11-05 08:00:00+00:00
Real-time decoding of full-spectrum Chinese using brain-computer interface,https://www.science.org/doi/abs/10.1126/sciadv.adz9968?af=R,2025-11-05 08:00:00 UTC,AAAS: Science Advances: Table of Contents,2025-11-05 08:00:00+00:00
Reefal regions were biodiversity hotspots throughout the Phanerozoic,https://www.science.org/doi/abs/10.1126/sciadv.adv9793?af=R,2025-11-05 08:00:00 UTC,AAAS: Science Advances: Table of Contents,2025-11-05 08:00:00+00:00
From breaking rules to making rules in materials science,https://www.science.org/doi/abs/10.1126/sciadv.aed2475?af=R,2025-11-05 08:00:00 UTC,AAAS: Science Advances: Table of Contents,2025-11-05 08:00:00+00:00
Nonfluorinated membrane with a decentralized ion-transport network enables efficient and sustainable polysulfide redox flow batteries,https://www.science.org/doi/abs/10.1126/sciadv.aea0032?af=R,2025-11-05 08:00:00 UTC,AAAS: Science Advances: Table of Contents,2025-11-05 08:00:00+00:00
Landscape-wide cosmogram built by the early community of Aguada Fénix in southeastern Mesoamerica,https://www.science.org/doi/abs/10.1126/sciadv.aea2037?af=R,2025-11-05 08:00:00 UTC,AAAS: Science Advances: Table of Contents,2025-11-05 08:00:00+00:00
Records of mantle geodynamics and atmospheric escape in Archean quartz,https://www.science.org/doi/abs/10.1126/sciadv.aea3380?af=R,2025-11-05 08:00:00 UTC,AAAS: Science Advances: Table of Contents,2025-11-05 08:00:00+00:00
