title,link,published,source,pub_date
Thermally‐Strained Black Phosphorus Photovoltaics Toward Spatially‐Resolved Biomimetic Vision Enhancement,https://advanced.onlinelibrary.wiley.com/doi/10.1002/adma.202517056?af=R,2025-11-06 04:49:37 UTC,Wiley: Advanced Materials: Table of Contents,2025-11-06 04:49:37+00:00
Water Interactions in Hydrated Aliphatic Polyester Composite Scaffolds,https://advanced.onlinelibrary.wiley.com/doi/10.1002/adma.202511614?af=R,2025-11-06 04:51:15 UTC,Wiley: Advanced Materials: Table of Contents,2025-11-06 04:51:15+00:00
High‐Performance and Stable Dual‐Nanograting‐Perovskite‐Based Near‐Infrared Photodetector,https://advanced.onlinelibrary.wiley.com/doi/10.1002/adma.202515848?af=R,2025-11-06 04:52:47 UTC,Wiley: Advanced Materials: Table of Contents,2025-11-06 04:52:47+00:00
Design Principles for Air Tolerance in Pyridinium‐Based Flow Batteries,https://advanced.onlinelibrary.wiley.com/doi/10.1002/adma.202508875?af=R,2025-11-06 04:53:22 UTC,Wiley: Advanced Materials: Table of Contents,2025-11-06 04:53:22+00:00
Mitochondria Rewiring by Polyphenol‐Copper Nanodots to Truncate Mitochondrial‐Endoplasmic Reticulum Crosstalk for Acute Kidney Injury Therapy,https://advanced.onlinelibrary.wiley.com/doi/10.1002/adma.202508379?af=R,2025-11-06 04:54:30 UTC,Wiley: Advanced Materials: Table of Contents,2025-11-06 04:54:30+00:00
Frontal Polymerization‐Enabled 3D Printing of Recyclable High‐Performance Carbon Fiber Reinforced Polymers,https://advanced.onlinelibrary.wiley.com/doi/10.1002/adma.202515033?af=R,2025-11-06 04:56:02 UTC,Wiley: Advanced Materials: Table of Contents,2025-11-06 04:56:02+00:00
Superior Energy‐Storage Performance in Sandwich‐Structured AgNbO3‐Based Ceramics,https://advanced.onlinelibrary.wiley.com/doi/10.1002/adma.202516723?af=R,2025-11-06 04:58:46 UTC,Wiley: Advanced Materials: Table of Contents,2025-11-06 04:58:46+00:00
Dual‐Electrode Synergistic Electrolyte Enabling Highly Reversible Multi‐Electron Redox in Aqueous Zinc‐Iodine Batteries,https://advanced.onlinelibrary.wiley.com/doi/10.1002/adma.202513389?af=R,2025-11-06 05:02:29 UTC,Wiley: Advanced Materials: Table of Contents,2025-11-06 05:02:29+00:00
Cost‐Effective Passive Ammonia Fuel Cells via Synergistic Integration of Optimized Membrane Electrode Assembly and Prototype,https://advanced.onlinelibrary.wiley.com/doi/10.1002/adma.202510855?af=R,2025-11-06 05:11:05 UTC,Wiley: Advanced Materials: Table of Contents,2025-11-06 05:11:05+00:00
Biologist David Sabatini loses again in legal fight against Whitehead Institute,https://www.science.org/content/article/biologist-david-sabatini-loses-again-legal-fight-against-whitehead-institute,2025-11-06 05:15:00 UTC,Latest News from Science Magazine,2025-11-06 05:15:00+00:00
From Promise to Production: Strategy for Halide‐Based All‐Solid‐State Battery Pilot Lines,https://advanced.onlinelibrary.wiley.com/doi/10.1002/aenm.202505286?af=R,2025-11-06 06:26:49 UTC,Wiley: Advanced Energy Materials: Table of Contents,2025-11-06 06:26:49+00:00
PFAS Free Organic Carbonate‐Based Electrolyte Formulation for LNMO||SiGr Cell Chemistry,https://advanced.onlinelibrary.wiley.com/doi/10.1002/aenm.202505133?af=R,2025-11-06 06:27:39 UTC,Wiley: Advanced Energy Materials: Table of Contents,2025-11-06 06:27:39+00:00
Accelerating Electron Extraction Enabled by Colloidal Cu−Ga−Zn−S/Ni9S8 Schottky Heterojunctions for Enhanced Solar Hydrogen Generation,https://advanced.onlinelibrary.wiley.com/doi/10.1002/aenm.202504755?af=R,2025-11-06 06:28:40 UTC,Wiley: Advanced Energy Materials: Table of Contents,2025-11-06 06:28:40+00:00
Biomedical philanthropy promises dramatic expansion and AI focus,https://www.science.org/doi/abs/10.1126/science.aed6534?af=R,2025-11-06 07:00:19 UTC,AAAS: Science: Table of Contents,2025-11-06 07:00:19+00:00
Tree rings from ancient coffins offer clues to Earth’s past,https://www.science.org/doi/abs/10.1126/science.aed6535?af=R,2025-11-06 07:00:19 UTC,AAAS: Science: Table of Contents,2025-11-06 07:00:19+00:00
Thinning of DOE advisory bodies dismays researchers,https://www.science.org/doi/abs/10.1126/science.aed6536?af=R,2025-11-06 07:00:19 UTC,AAAS: Science: Table of Contents,2025-11-06 07:00:19+00:00
Antarctic glacier’s retreat is fastest in modern history,https://www.science.org/doi/abs/10.1126/science.aed6537?af=R,2025-11-06 07:00:19 UTC,AAAS: Science: Table of Contents,2025-11-06 07:00:19+00:00
AI hallucinates because it’s trained to fake it till it makes it,https://www.science.org/doi/abs/10.1126/science.aed6538?af=R,2025-11-06 07:00:19 UTC,AAAS: Science: Table of Contents,2025-11-06 07:00:19+00:00
"The normalization of (almost) everything: Our minds can get used to anything, and even crises start feeling normal",https://www.science.org/doi/abs/10.1126/science.aeb2654?af=R,2025-11-06 07:00:19 UTC,AAAS: Science: Table of Contents,2025-11-06 07:00:19+00:00
New Products,https://www.science.org/doi/abs/10.1126/science.aed6544?af=R,2025-11-06 07:00:19 UTC,AAAS: Science: Table of Contents,2025-11-06 07:00:19+00:00
Understanding nature and nurture: Statistical and AI innovations uncover how genes and environment shape human health,https://www.science.org/doi/abs/10.1126/science.aeb2636?af=R,2025-11-06 07:00:19 UTC,AAAS: Science: Table of Contents,2025-11-06 07:00:19+00:00
The need for a global effort to attend to human neural organoid and assembloid research,https://www.science.org/doi/abs/10.1126/science.aeb1510?af=R,2025-11-06 07:00:19 UTC,AAAS: Science: Table of Contents,2025-11-06 07:00:19+00:00
In Science Journals,https://www.science.org/doi/abs/10.1126/science.aed6116?af=R,2025-11-06 07:00:19 UTC,AAAS: Science: Table of Contents,2025-11-06 07:00:19+00:00
A foundation of trust,https://www.science.org/doi/abs/10.1126/science.aed6115?af=R,2025-11-06 07:00:19 UTC,AAAS: Science: Table of Contents,2025-11-06 07:00:19+00:00
Advancing research on financial stability and climate-related financial risk,https://www.science.org/doi/abs/10.1126/science.aed1008?af=R,2025-11-06 07:00:19 UTC,AAAS: Science: Table of Contents,2025-11-06 07:00:19+00:00
Protect Iraq’s Mesopotamian Marshes,https://www.science.org/doi/abs/10.1126/science.aeb1912?af=R,2025-11-06 07:00:19 UTC,AAAS: Science: Table of Contents,2025-11-06 07:00:19+00:00
River metabolism in the contiguous United States: A West of extremes,https://www.science.org/doi/abs/10.1126/science.adu9843?af=R,2025-11-06 07:00:19 UTC,AAAS: Science: Table of Contents,2025-11-06 07:00:19+00:00
Britain must step up on AI policy,https://www.science.org/doi/abs/10.1126/science.aeb2621?af=R,2025-11-06 07:00:19 UTC,AAAS: Science: Table of Contents,2025-11-06 07:00:19+00:00
FDA export restrictions threaten collaboration,https://www.science.org/doi/abs/10.1126/science.aeb1546?af=R,2025-11-06 07:00:19 UTC,AAAS: Science: Table of Contents,2025-11-06 07:00:19+00:00
Platforms of power,https://www.science.org/doi/abs/10.1126/science.aea3088?af=R,2025-11-06 07:00:19 UTC,AAAS: Science: Table of Contents,2025-11-06 07:00:19+00:00
Frankenstein and the problem of abandonment,https://www.science.org/doi/abs/10.1126/science.aed0948?af=R,2025-11-06 07:00:19 UTC,AAAS: Science: Table of Contents,2025-11-06 07:00:19+00:00
Extreme warming of Amazon waters in a changing climate,https://www.science.org/doi/abs/10.1126/science.adr4029?af=R,2025-11-06 07:00:19 UTC,AAAS: Science: Table of Contents,2025-11-06 07:00:19+00:00
Multi-timescale frequency-phase matching for high-yield nonlinear photonics,https://www.science.org/doi/abs/10.1126/science.adu6368?af=R,2025-11-06 07:00:19 UTC,AAAS: Science: Table of Contents,2025-11-06 07:00:19+00:00
Shear-induced bubble nucleation in magmas,https://www.science.org/doi/abs/10.1126/science.adw8543?af=R,2025-11-06 07:00:19 UTC,AAAS: Science: Table of Contents,2025-11-06 07:00:19+00:00
Strengthening Ni alloys with nanoscale interfaces of negative excess energy,https://www.science.org/doi/abs/10.1126/science.aea4299?af=R,2025-11-06 07:00:19 UTC,AAAS: Science: Table of Contents,2025-11-06 07:00:19+00:00
Probing critical phenomena in open quantum systems using atom arrays,https://www.science.org/doi/abs/10.1126/science.adq0278?af=R,2025-11-06 07:00:19 UTC,AAAS: Science: Table of Contents,2025-11-06 07:00:19+00:00
Ultrafast inverse chirality-induced spin selectivity observed by THz emission,https://www.science.org/doi/abs/10.1126/science.ady4885?af=R,2025-11-06 07:00:19 UTC,AAAS: Science: Table of Contents,2025-11-06 07:00:19+00:00
"Cosmic dust reveals dynamic shifts in central Arctic sea-ice coverage over the past 30,000 years",https://www.science.org/doi/abs/10.1126/science.adv5767?af=R,2025-11-06 07:00:19 UTC,AAAS: Science: Table of Contents,2025-11-06 07:00:19+00:00
Shrinking interconnects beyond copper,https://www.science.org/doi/abs/10.1126/science.adu7099?af=R,2025-11-06 07:00:19 UTC,AAAS: Science: Table of Contents,2025-11-06 07:00:19+00:00
When ‘we’ turns wicked,https://www.science.org/doi/abs/10.1126/science.aed5522?af=R,2025-11-06 07:00:19 UTC,AAAS: Science: Table of Contents,2025-11-06 07:00:19+00:00
Seipin-adipogenin controls lipid storage in fat cells,https://www.science.org/doi/abs/10.1126/science.aec4109?af=R,2025-11-06 07:00:19 UTC,AAAS: Science: Table of Contents,2025-11-06 07:00:19+00:00
In Other Journals,https://www.science.org/doi/abs/10.1126/science.aed6117?af=R,2025-11-06 07:00:19 UTC,AAAS: Science: Table of Contents,2025-11-06 07:00:19+00:00
Cell signaling meets gene transcription,https://www.science.org/doi/abs/10.1126/science.aec1434?af=R,2025-11-06 07:00:19 UTC,AAAS: Science: Table of Contents,2025-11-06 07:00:19+00:00
Unbiased discovery of neuronal architectures,https://www.science.org/doi/abs/10.1126/science.adx6741?af=R,2025-11-06 07:00:19 UTC,AAAS: Science: Table of Contents,2025-11-06 07:00:19+00:00
Homogenized chlorine distribution for >27% power conversion efficiency in perovskite solar cells,https://www.science.org/doi/abs/10.1126/science.adw8780?af=R,2025-11-06 07:00:19 UTC,AAAS: Science: Table of Contents,2025-11-06 07:00:19+00:00
Hund’s flat band in a frustrated spinel oxide,https://www.pnas.org/doi/abs/10.1073/pnas.2518213122?mi=eymic2&af=R&access=on&content=articlesChapters&publication=pnas&sortBy=Earliest&target=default,2025-11-06 08:00:00 UTC,Proceedings of the National Academy of Sciences: Keyword search for query,2025-11-06 08:00:00+00:00
Methanogenic archaea encoding Pyrrolysine maintain ambiguous amber codon usage,https://www.pnas.org/doi/abs/10.1073/pnas.2517473122?mi=eymic2&af=R&access=on&content=articlesChapters&publication=pnas&sortBy=Earliest&target=default,2025-11-06 08:00:00 UTC,Proceedings of the National Academy of Sciences: Keyword search for query,2025-11-06 08:00:00+00:00
Unveiling FERONIA receptor kinase–mediated cellular mechanisms with a small-molecule inhibitor,https://www.pnas.org/doi/abs/10.1073/pnas.2515322122?mi=eymic2&af=R&access=on&content=articlesChapters&publication=pnas&sortBy=Earliest&target=default,2025-11-06 08:00:00 UTC,Proceedings of the National Academy of Sciences: Keyword search for query,2025-11-06 08:00:00+00:00
Direct and in situ examination of Li+ transport kinetics in an isotope-labeled solid–electrolyte interphase,https://www.pnas.org/doi/abs/10.1073/pnas.2514652122?mi=eymic2&af=R&access=on&content=articlesChapters&publication=pnas&sortBy=Earliest&target=default,2025-11-06 08:00:00 UTC,Proceedings of the National Academy of Sciences: Keyword search for query,2025-11-06 08:00:00+00:00
Abscisic acid regulates iron accumulation in plant seeds via the PYLs–bHLH IVc–YSLs module,https://www.pnas.org/doi/abs/10.1073/pnas.2512997122?mi=eymic2&af=R&access=on&content=articlesChapters&publication=pnas&sortBy=Earliest&target=default,2025-11-06 08:00:00 UTC,Proceedings of the National Academy of Sciences: Keyword search for query,2025-11-06 08:00:00+00:00
BRAF inhibition increases TGFβ2 production and stimulates metastasis in mice with endogenous BRAFV600E-induced hepatocellular carcinoma,https://www.pnas.org/doi/abs/10.1073/pnas.2503044122?mi=eymic2&af=R&access=on&content=articlesChapters&publication=pnas&sortBy=Earliest&target=default,2025-11-06 08:00:00 UTC,Proceedings of the National Academy of Sciences: Keyword search for query,2025-11-06 08:00:00+00:00
Dynamic changes of dopamine neuron activity and plasticity at different stages of negative reinforcement learning,https://www.pnas.org/doi/abs/10.1073/pnas.2509072122?mi=eymic2&af=R&access=on&content=articlesChapters&publication=pnas&sortBy=Earliest&target=default,2025-11-06 08:00:00 UTC,Proceedings of the National Academy of Sciences: Keyword search for query,2025-11-06 08:00:00+00:00
The role of active mRNA–ribosome dynamics and closing constriction in daughter chromosome separation in Escherichia coli,https://www.pnas.org/doi/abs/10.1073/pnas.2508100122?mi=eymic2&af=R&access=on&content=articlesChapters&publication=pnas&sortBy=Earliest&target=default,2025-11-06 08:00:00 UTC,Proceedings of the National Academy of Sciences: Keyword search for query,2025-11-06 08:00:00+00:00
Secreting salt glands constrain cuticle fracture to enhance desalination efficiency,https://www.pnas.org/doi/abs/10.1073/pnas.2505598122?mi=eymic2&af=R&access=on&content=articlesChapters&publication=pnas&sortBy=Earliest&target=default,2025-11-06 08:00:00 UTC,Proceedings of the National Academy of Sciences: Keyword search for query,2025-11-06 08:00:00+00:00
Divergent evolutionary dynamics of benign and malignant tumors,https://www.pnas.org/doi/abs/10.1073/pnas.2519203122?mi=eymic2&af=R&access=on&content=articlesChapters&publication=pnas&sortBy=Earliest&target=default,2025-11-06 08:00:00 UTC,Proceedings of the National Academy of Sciences: Keyword search for query,2025-11-06 08:00:00+00:00
An ADAR2-mimic base editor for efficient C-to-U RNA editing in vivo,https://www.pnas.org/doi/abs/10.1073/pnas.2505269122?mi=eymic2&af=R&access=on&content=articlesChapters&publication=pnas&sortBy=Earliest&target=default,2025-11-06 08:00:00 UTC,Proceedings of the National Academy of Sciences: Keyword search for query,2025-11-06 08:00:00+00:00
Amino acid insufficiency impairs hepatic vitamin A mobilization in mice,https://www.pnas.org/doi/abs/10.1073/pnas.2501834122?mi=eymic2&af=R&access=on&content=articlesChapters&publication=pnas&sortBy=Earliest&target=default,2025-11-06 08:00:00 UTC,Proceedings of the National Academy of Sciences: Keyword search for query,2025-11-06 08:00:00+00:00
Structural basis for a potent human neutralizing antibody targeting a conserved epitope on the H7 hemagglutinin head,https://www.pnas.org/doi/abs/10.1073/pnas.2503008122?mi=eymic2&af=R&access=on&content=articlesChapters&publication=pnas&sortBy=Earliest&target=default,2025-11-06 08:00:00 UTC,Proceedings of the National Academy of Sciences: Keyword search for query,2025-11-06 08:00:00+00:00
HIV-1 Vif and Vpr cooperatively modulate the cell cycle to maximize per-cell virion production,https://www.pnas.org/doi/abs/10.1073/pnas.2511502122?mi=eymic2&af=R&access=on&content=articlesChapters&publication=pnas&sortBy=Earliest&target=default,2025-11-06 08:00:00 UTC,Proceedings of the National Academy of Sciences: Keyword search for query,2025-11-06 08:00:00+00:00
A viral Cyclin D homolog protein hijacks the metabolic stress sensor SESN2 to promote primary effusion lymphoma growth,https://www.pnas.org/doi/abs/10.1073/pnas.2520925122?mi=eymic2&af=R&access=on&content=articlesChapters&publication=pnas&sortBy=Earliest&target=default,2025-11-06 08:00:00 UTC,Proceedings of the National Academy of Sciences: Keyword search for query,2025-11-06 08:00:00+00:00
"Correction for Hvid et al., Relationship dynamics and behavioral adaptations in the control of the 2022 mpox epidemic",https://www.pnas.org/doi/abs/10.1073/pnas.2529771122?mi=eymic2&af=R&access=on&content=articlesChapters&publication=pnas&sortBy=Earliest&target=default,2025-11-06 08:00:00 UTC,Proceedings of the National Academy of Sciences: Keyword search for query,2025-11-06 08:00:00+00:00
The role of organizations in fostering innovation,https://www.science.org/doi/abs/10.1126/science.aec5765?af=R,2025-11-06 08:00:00 UTC,AAAS: Science: Table of Contents,2025-11-06 08:00:00+00:00
Unlocking the potential of brassinosteroids: A path to precision plant engineering,https://www.science.org/doi/abs/10.1126/science.adu9798?af=R,2025-11-06 08:00:00 UTC,AAAS: Science: Table of Contents,2025-11-06 08:00:00+00:00
Deep generative models design mRNA sequences with enhanced translational capacity and stability,https://www.science.org/doi/abs/10.1126/science.adr8470?af=R,2025-11-06 08:00:00 UTC,AAAS: Science: Table of Contents,2025-11-06 08:00:00+00:00
Preventing hypocontractility-induced fibroblast expansion alleviates dilated cardiomyopathy,https://www.science.org/doi/abs/10.1126/science.adv9157?af=R,2025-11-06 08:00:00 UTC,AAAS: Science: Table of Contents,2025-11-06 08:00:00+00:00
Neuronal normalization in monkey MT is an intensity-weighted average,https://www.pnas.org/doi/abs/10.1073/pnas.2522104122?mi=eymic2&af=R&access=on&content=articlesChapters&publication=pnas&sortBy=Earliest&target=default,2025-11-06 08:00:00 UTC,Proceedings of the National Academy of Sciences: Keyword search for query,2025-11-06 08:00:00+00:00
"Correction for Reva et al., Higher-order interactions in neuronal function: From genes to ionic currents in biophysical models",https://www.pnas.org/doi/abs/10.1073/pnas.2529504122?mi=eymic2&af=R&access=on&content=articlesChapters&publication=pnas&sortBy=Earliest&target=default,2025-11-06 08:00:00 UTC,Proceedings of the National Academy of Sciences: Keyword search for query,2025-11-06 08:00:00+00:00
The anti-inflammatory activity of IgG is enhanced by co-engagement of type I and II Fc receptors,https://www.science.org/doi/abs/10.1126/science.adv2927?af=R,2025-11-06 08:00:00 UTC,AAAS: Science: Table of Contents,2025-11-06 08:00:00+00:00
Direct targeting and regulation of RNA polymerase II by cell signaling kinases,https://www.science.org/doi/abs/10.1126/science.ads7152?af=R,2025-11-06 08:00:00 UTC,AAAS: Science: Table of Contents,2025-11-06 08:00:00+00:00
Repair of DNA double-strand breaks leaves heritable impairment to genome function,https://www.science.org/doi/abs/10.1126/science.adk6662?af=R,2025-11-06 08:00:00 UTC,AAAS: Science: Table of Contents,2025-11-06 08:00:00+00:00
Adipogenin promotes the development of lipid droplets by binding a dodecameric seipin complex,https://www.science.org/doi/abs/10.1126/science.adr9755?af=R,2025-11-06 08:00:00 UTC,AAAS: Science: Table of Contents,2025-11-06 08:00:00+00:00
[ASAP] Unusual Regioselectivity in Pd-Catalyzed Heterogeneous Aromatic Hydrogenation of PV–Functionalized Naphthalene Derivatives,http://dx.doi.org/10.1021/jacs.5c16485,2025-11-06 09:10:48 UTC,Journal of the American Chemical Society: Latest Articles (ACS Publications),2025-11-06 09:10:48+00:00
AI drives dramatic expansion of Chan Zuckerberg Initiative’s funding to end all diseases,https://www.science.org/content/article/ai-drives-dramatic-expansion-chan-zuckerberg-initiative-s-funding-end-all-diseases,2025-11-06 09:30:00 UTC,Latest News from Science Magazine,2025-11-06 09:30:00+00:00
How do hurricanes or typhoons form and are they getting stronger?,https://www.bbc.com/news/articles/cz913gxlw3jo?at_medium=RSS&at_campaign=rss,2025-11-06 09:37:40 UTC,BBC News,2025-11-06 09:37:40+00:00
[ASAP] Tri- and Tetra-ortho-Substituted Biaryls via Lithium Cuprate-Catalyzed Reductive Desymmetrization of Isophthaldehydes,http://dx.doi.org/10.1021/jacs.5c15736,2025-11-06 10:01:36 UTC,Journal of the American Chemical Society: Latest Articles (ACS Publications),2025-11-06 10:01:36+00:00
William announces Earthshot Prize 2025 winners in Rio,https://www.bbc.com/news/articles/cy0y50457y9o?at_medium=RSS&at_campaign=rss,2025-11-06 10:06:45 UTC,BBC News,2025-11-06 10:06:45+00:00
"Bird flu virus spreading in UK could be worst yet, expert warns farmers",https://www.bbc.com/news/articles/cp85r67kn8xo?at_medium=RSS&at_campaign=rss,2025-11-06 12:07:36 UTC,BBC News,2025-11-06 12:07:36+00:00
[ASAP] Insights into the Wastewater-Free Synthesis of Zeolites,http://dx.doi.org/10.1021/jacs.5c15625,2025-11-06 13:47:43 UTC,Journal of the American Chemical Society: Latest Articles (ACS Publications),2025-11-06 13:47:43+00:00
BBC Inside Science,https://www.bbc.co.uk/sounds/play/w3ct8txj?at_medium=RSS&at_campaign=rss,2025-11-06 17:00:00 UTC,BBC News,2025-11-06 17:00:00+00:00
Understanding early Amazon communities and saving the endangered pocket mouse,https://www.science.org/doi/10.1126/science.z5xh8qa,2025-11-06 19:00:00 UTC,Science Magazine Podcast,2025-11-06 19:00:00+00:00
COP30: World leaders take aim at Trump for climate inaction,https://www.bbc.com/news/articles/cn4j8dgnj1wo?at_medium=RSS&at_campaign=rss,2025-11-06 19:33:59 UTC,BBC News,2025-11-06 19:33:59+00:00
[ASAP] A General Strategy to Access All Stereosequences in a Synthetic Polymer,http://dx.doi.org/10.1021/jacs.5c15603,2025-11-06 20:59:08 UTC,Journal of the American Chemical Society: Latest Articles (ACS Publications),2025-11-06 20:59:08+00:00
