title,link,published,source,pub_date
High-throughput screening identifies a critical role of the SPOP–PABPC1 axis in lung adenocarcinoma progression,https://www.pnas.org/doi/abs/10.1073/pnas.2602470123?mi=eymic2&af=R&access=on&content=articlesChapters&publication=pnas&sortBy=Earliest&target=default,2026-06-10 07:00:00 UTC,Proceedings of the National Academy of Sciences: Keyword search for query,2026-06-10 07:00:00+00:00
"Loss of erythrocyte sialic acid in sepsis disrupts inhibitory Siglec interactions, driving neutrophil hyperactivation and NET outspread",https://www.pnas.org/doi/abs/10.1073/pnas.2536989123?mi=eymic2&af=R&access=on&content=articlesChapters&publication=pnas&sortBy=Earliest&target=default,2026-06-10 07:00:00 UTC,Proceedings of the National Academy of Sciences: Keyword search for query,2026-06-10 07:00:00+00:00
IL-4 peptide hydrogel reprograms MSC heterogeneity toward the CD106+ population for enhanced renal repair,https://www.pnas.org/doi/abs/10.1073/pnas.2536368123?mi=eymic2&af=R&access=on&content=articlesChapters&publication=pnas&sortBy=Earliest&target=default,2026-06-10 07:00:00 UTC,Proceedings of the National Academy of Sciences: Keyword search for query,2026-06-10 07:00:00+00:00
Far-red chlorophyll d clusters extend photosystem I absorption toward the red limit,https://www.science.org/doi/abs/10.1126/sciadv.aed7355?af=R,2026-06-10 07:00:00 UTC,AAAS: Science Advances: Table of Contents,2026-06-10 07:00:00+00:00
Expression of four mitochondrial tRNAs from only two loci,https://www.pnas.org/doi/abs/10.1073/pnas.2534946123?mi=eymic2&af=R&access=on&content=articlesChapters&publication=pnas&sortBy=Earliest&target=default,2026-06-10 07:00:00 UTC,Proceedings of the National Academy of Sciences: Keyword search for query,2026-06-10 07:00:00+00:00
General inverse-cube thickness scaling of projectile penetration energy in ultrathin films,https://www.pnas.org/doi/abs/10.1073/pnas.2609202123?mi=eymic2&af=R&access=on&content=articlesChapters&publication=pnas&sortBy=Earliest&target=default,2026-06-10 07:00:00 UTC,Proceedings of the National Academy of Sciences: Keyword search for query,2026-06-10 07:00:00+00:00
The autophagy protein ATG-9 promotes aversive learning in Caenorhabditis elegans through trafficking neuropeptide receptors,https://www.pnas.org/doi/abs/10.1073/pnas.2531054123?mi=eymic2&af=R&access=on&content=articlesChapters&publication=pnas&sortBy=Earliest&target=default,2026-06-10 07:00:00 UTC,Proceedings of the National Academy of Sciences: Keyword search for query,2026-06-10 07:00:00+00:00
GREM1/FGFR1-activated myofibroblasts induce immunosuppression and accelerate metastasis in high-grade serous ovarian cancer,https://www.pnas.org/doi/abs/10.1073/pnas.2529786123?mi=eymic2&af=R&access=on&content=articlesChapters&publication=pnas&sortBy=Earliest&target=default,2026-06-10 07:00:00 UTC,Proceedings of the National Academy of Sciences: Keyword search for query,2026-06-10 07:00:00+00:00
Structural basis of long-range transcription–translation coupling,https://www.pnas.org/doi/abs/10.1073/pnas.2528970123?mi=eymic2&af=R&access=on&content=articlesChapters&publication=pnas&sortBy=Earliest&target=default,2026-06-10 07:00:00 UTC,Proceedings of the National Academy of Sciences: Keyword search for query,2026-06-10 07:00:00+00:00
Disruption to TFEB signaling and autophagy in newly formed oligodendrocytes leads to aberrant generation of CNS myelin,https://www.pnas.org/doi/abs/10.1073/pnas.2528668123?mi=eymic2&af=R&access=on&content=articlesChapters&publication=pnas&sortBy=Earliest&target=default,2026-06-10 07:00:00 UTC,Proceedings of the National Academy of Sciences: Keyword search for query,2026-06-10 07:00:00+00:00
Differential Wnt/β-catenin signaling via TCF7L2/LEF1 binding specificity shapes cellular and tumor phenotypes,https://www.pnas.org/doi/abs/10.1073/pnas.2528450123?mi=eymic2&af=R&access=on&content=articlesChapters&publication=pnas&sortBy=Earliest&target=default,2026-06-10 07:00:00 UTC,Proceedings of the National Academy of Sciences: Keyword search for query,2026-06-10 07:00:00+00:00
Telocyte-derived pentraxin 3 enables vascular pruning as a key driver in infantile hemangioma regression,https://www.pnas.org/doi/abs/10.1073/pnas.2526271123?mi=eymic2&af=R&access=on&content=articlesChapters&publication=pnas&sortBy=Earliest&target=default,2026-06-10 07:00:00 UTC,Proceedings of the National Academy of Sciences: Keyword search for query,2026-06-10 07:00:00+00:00
Nf2 orchestrates β-arrestin2-biased PTH1R signaling to couple bone mass with skeletal integrity,https://www.pnas.org/doi/abs/10.1073/pnas.2524671123?mi=eymic2&af=R&access=on&content=articlesChapters&publication=pnas&sortBy=Earliest&target=default,2026-06-10 07:00:00 UTC,Proceedings of the National Academy of Sciences: Keyword search for query,2026-06-10 07:00:00+00:00
Social immunity can be a consequence and cause of social evolution,https://www.pnas.org/doi/abs/10.1073/pnas.2518957123?mi=eymic2&af=R&access=on&content=articlesChapters&publication=pnas&sortBy=Earliest&target=default,2026-06-10 07:00:00 UTC,Proceedings of the National Academy of Sciences: Keyword search for query,2026-06-10 07:00:00+00:00
Drp1-driven fragmentation of scleral mitochondria promotes myopia development,https://www.pnas.org/doi/abs/10.1073/pnas.2511427123?mi=eymic2&af=R&access=on&content=articlesChapters&publication=pnas&sortBy=Earliest&target=default,2026-06-10 07:00:00 UTC,Proceedings of the National Academy of Sciences: Keyword search for query,2026-06-10 07:00:00+00:00
The tyrosine phosphatase STEP is a developmental suppressor of synaptogenesis,https://www.pnas.org/doi/abs/10.1073/pnas.2424788123?mi=eymic2&af=R&access=on&content=articlesChapters&publication=pnas&sortBy=Earliest&target=default,2026-06-10 07:00:00 UTC,Proceedings of the National Academy of Sciences: Keyword search for query,2026-06-10 07:00:00+00:00
Opportunities to strengthen US phosphorus supply resilience through circular pathways,https://www.pnas.org/doi/abs/10.1073/pnas.2530690123?mi=eymic2&af=R&access=on&content=articlesChapters&publication=pnas&sortBy=Earliest&target=default,2026-06-10 07:00:00 UTC,Proceedings of the National Academy of Sciences: Keyword search for query,2026-06-10 07:00:00+00:00
Testicular origin of epigenetic inheritance independent of sperm mitochondrial DNA and epididymal exposure,https://www.pnas.org/doi/abs/10.1073/pnas.2611096123?mi=eymic2&af=R&access=on&content=articlesChapters&publication=pnas&sortBy=Earliest&target=default,2026-06-10 07:00:00 UTC,Proceedings of the National Academy of Sciences: Keyword search for query,2026-06-10 07:00:00+00:00
A gustatory receptor–Akt axis couples nutrient sensing to hematopoiesis in the silkworm,https://www.pnas.org/doi/abs/10.1073/pnas.2535199123?mi=eymic2&af=R&access=on&content=articlesChapters&publication=pnas&sortBy=Earliest&target=default,2026-06-10 07:00:00 UTC,Proceedings of the National Academy of Sciences: Keyword search for query,2026-06-10 07:00:00+00:00
"Driven by climate change, sudden swings between wet and dry create “hydrologic whiplash”",https://www.pnas.org/doi/abs/10.1073/pnas.2617960123?mi=eymic2&af=R&access=on&content=articlesChapters&publication=pnas&sortBy=Earliest&target=default,2026-06-10 07:00:00 UTC,Proceedings of the National Academy of Sciences: Keyword search for query,2026-06-10 07:00:00+00:00
Oil-impregnated densified wood veneer with high electrical insulation enabled by nanosized oil channels,https://www.science.org/doi/abs/10.1126/sciadv.aed5744?af=R,2026-06-10 07:00:00 UTC,AAAS: Science Advances: Table of Contents,2026-06-10 07:00:00+00:00
Ultrastable green top-emitting OLEDs approaching BT.2020 enabled by narrowband phosphorescent emitters,https://www.science.org/doi/abs/10.1126/sciadv.aed4859?af=R,2026-06-10 07:00:00 UTC,AAAS: Science Advances: Table of Contents,2026-06-10 07:00:00+00:00
"Correction for Forrest et al., Early evidence for a stable and flexible foraging niche in the evolution of Homo",https://www.pnas.org/doi/abs/10.1073/pnas.2617803123?mi=eymic2&af=R&access=on&content=articlesChapters&publication=pnas&sortBy=Earliest&target=default,2026-06-10 07:00:00 UTC,Proceedings of the National Academy of Sciences: Keyword search for query,2026-06-10 07:00:00+00:00
Nonequilibrium ion transport in a hybrid battery material,https://www.science.org/doi/abs/10.1126/sciadv.aed1629?af=R,2026-06-10 07:00:00 UTC,AAAS: Science Advances: Table of Contents,2026-06-10 07:00:00+00:00
Ultrasound priming gated by solid tumor hallmarks to guide CAR-T therapy,https://www.science.org/doi/abs/10.1126/sciadv.aed0666?af=R,2026-06-10 07:00:00 UTC,AAAS: Science Advances: Table of Contents,2026-06-10 07:00:00+00:00
Deep learning reveals enhanced ENSO predictability under historical anthropogenic forcing,https://www.science.org/doi/abs/10.1126/sciadv.aec9518?af=R,2026-06-10 07:00:00 UTC,AAAS: Science Advances: Table of Contents,2026-06-10 07:00:00+00:00
High-energy-density aqueous magnesium metal battery textiles enable ultrasensitive pressure sensing across −40° to 100°C,https://www.science.org/doi/abs/10.1126/sciadv.aec8124?af=R,2026-06-10 07:00:00 UTC,AAAS: Science Advances: Table of Contents,2026-06-10 07:00:00+00:00
Distinct genomic architectures but the same gene underlie the convergent evolution of a plant supergene,https://www.science.org/doi/abs/10.1126/sciadv.aec1996?af=R,2026-06-10 07:00:00 UTC,AAAS: Science Advances: Table of Contents,2026-06-10 07:00:00+00:00
Spatial double-shelled structure achieving stable anion exchange membrane water electrolysis via enhanced local alkalinity,https://www.science.org/doi/abs/10.1126/sciadv.aeb8831?af=R,2026-06-10 07:00:00 UTC,AAAS: Science Advances: Table of Contents,2026-06-10 07:00:00+00:00
Single-nucleus profiling reveals a core disease signature and cell type–specific vulnerabilities in early Rett syndrome,https://www.science.org/doi/abs/10.1126/sciadv.aeb4265?af=R,2026-06-10 07:00:00 UTC,AAAS: Science Advances: Table of Contents,2026-06-10 07:00:00+00:00
Hierarchical laser-programmed soft actuators for designing bionic robots with freeform morphing shapes,https://www.science.org/doi/abs/10.1126/sciadv.aeb1989?af=R,2026-06-10 07:00:00 UTC,AAAS: Science Advances: Table of Contents,2026-06-10 07:00:00+00:00
Mice produce interneurons in the septum as a response to aversive experiences and antidepressant treatment,https://www.science.org/doi/abs/10.1126/sciadv.aed3625?af=R,2026-06-10 07:00:00 UTC,AAAS: Science Advances: Table of Contents,2026-06-10 07:00:00+00:00
Hp1bp3 loss links chromatin reorganization to metabolic vulnerability in glioma,https://www.pnas.org/doi/abs/10.1073/pnas.2601061123?mi=eymic2&af=R&access=on&content=articlesChapters&publication=pnas&sortBy=Earliest&target=default,2026-06-10 07:00:00 UTC,Proceedings of the National Academy of Sciences: Keyword search for query,2026-06-10 07:00:00+00:00
Chiral nanoparticles drive enantiomer-specific osteogenic differentiation of stem cells and accelerate bone regeneration,https://www.science.org/doi/abs/10.1126/sciadv.aea3822?af=R,2026-06-10 07:00:00 UTC,AAAS: Science Advances: Table of Contents,2026-06-10 07:00:00+00:00
Rpd3L regulates transcription-replication conflict via H3K4 methylation–dependent and –independent chromatin mechanisms,https://www.science.org/doi/abs/10.1126/sciadv.adz7842?af=R,2026-06-10 07:00:00 UTC,AAAS: Science Advances: Table of Contents,2026-06-10 07:00:00+00:00
Marine population-genetic inferences reveal stronger oceanic structure in protists than Archaeplastida (plants) and Metazoa (animals),https://www.science.org/doi/abs/10.1126/sciadv.adz7158?af=R,2026-06-10 07:00:00 UTC,AAAS: Science Advances: Table of Contents,2026-06-10 07:00:00+00:00
A decline in skeletal muscle NOX4 abrogates exercise-induced adaptive homeostasis and exacerbates biological aging,https://www.science.org/doi/abs/10.1126/sciadv.adz1953?af=R,2026-06-10 07:00:00 UTC,AAAS: Science Advances: Table of Contents,2026-06-10 07:00:00+00:00
Bacterial extracellular vesicles promote membrane repair and tolerance to polymyxin B,https://www.science.org/doi/abs/10.1126/sciadv.adx6378?af=R,2026-06-10 07:00:00 UTC,AAAS: Science Advances: Table of Contents,2026-06-10 07:00:00+00:00
Adaptive Spo11 RNA editing gate optimizes meiosis I pace and mitotic proliferation while preserving ascospore formation,https://www.science.org/doi/abs/10.1126/sciadv.adu7607?af=R,2026-06-10 07:00:00 UTC,AAAS: Science Advances: Table of Contents,2026-06-10 07:00:00+00:00
Strong and corrosion-resistant 3D-printed steel by self-assembled core-shell nanoparticles,https://www.science.org/doi/abs/10.1126/sciadv.aea5057?af=R,2026-06-10 07:00:00 UTC,AAAS: Science Advances: Table of Contents,2026-06-10 07:00:00+00:00
Top European Airlines Call On Brussels To Scale Back Aviation Carbon Charges,https://carbonherald.com/top-european-airlines-call-on-brussels-to-scale-back-aviation-carbon-charges/?utm_source=rss&utm_medium=rss&utm_campaign=top-european-airlines-call-on-brussels-to-scale-back-aviation-carbon-charges,2026-06-10 07:31:06 UTC,Carbon Herald,2026-06-10 07:31:06+00:00
Air Liquide And Holcim Launch Industrial-Scale Carbon Capture Pilot For Cement,https://carbonherald.com/air-liquide-and-holcim-launch-industrial-scale-carbon-capture-pilot-for-cement/?utm_source=rss&utm_medium=rss&utm_campaign=air-liquide-and-holcim-launch-industrial-scale-carbon-capture-pilot-for-cement,2026-06-10 07:31:15 UTC,Carbon Herald,2026-06-10 07:31:15+00:00
Evonik starts commercial-scale AEM membrane production,https://hydrogentechworld.com/evonik-starts-commercial-scale-aem-membrane-production,2026-06-10 08:59:48 UTC,Hydrogen Tech World.com,2026-06-10 08:59:48+00:00
This scientist is rethinking how to put GPS collars on wildlife,https://www.science.org/content/article/scientist-rethinking-how-put-gps-collars-wildlife,2026-06-10 09:00:00 UTC,Latest News from Science Magazine,2026-06-10 09:00:00+00:00
DMEGC-ESS unveils DC-coupled off-grid energy storage system,https://www.ess-news.com/2026/06/10/dmegc-ess-unveils-dc-coupled-off-grid-energy-storage-system/,2026-06-10 09:30:00 UTC,Latest news about ESS Projects & Applications | ESS News,2026-06-10 09:30:00+00:00
GM and Redwood expand partnership with second-life battery storage project,https://www.electrive.com/2026/06/10/gm-and-redwood-expand-partnership-with-second-life-battery-storage-project/,2026-06-10 09:30:00 UTC,Battery – electrive.com,2026-06-10 09:30:00+00:00
thyssenkrupp Uhde to support two green ammonia projects in Brazil,https://hydrogentechworld.com/thyssenkrupp-uhde-to-support-two-green-ammonia-projects-in-brazil,2026-06-10 09:55:39 UTC,Hydrogen Tech World.com,2026-06-10 09:55:39+00:00
Immense whale ‘graveyard’ discovered in the deep sea,https://www.science.org/content/article/immense-whale-graveyard-discovered-deep-sea,2026-06-10 11:00:00 UTC,Latest News from Science Magazine,2026-06-10 11:00:00+00:00
‘Weird and capricious’: Experts struggle to understand new list of political jobs at science agencies,https://www.science.org/content/article/weird-and-capricious-experts-struggle-understand-new-list-political-jobs-science,2026-06-10 11:10:00 UTC,Latest News from Science Magazine,2026-06-10 11:10:00+00:00
Syzygy Plasmonics Secures Future SAF Offtake Commitment With World Fuel Services,https://carbonherald.com/syzygy-plasmonics-secures-future-saf-offtake-commitment-with-world-fuel-services/?utm_source=rss&utm_medium=rss&utm_campaign=syzygy-plasmonics-secures-future-saf-offtake-commitment-with-world-fuel-services,2026-06-10 11:53:56 UTC,Carbon Herald,2026-06-10 11:53:56+00:00
New Digital Tool By Ocean Visions To Advance Seaweed As A Climate Solution,https://carbonherald.com/new-digital-tool-by-ocean-visions-to-advance-seaweed-as-a-climate-solution/?utm_source=rss&utm_medium=rss&utm_campaign=new-digital-tool-by-ocean-visions-to-advance-seaweed-as-a-climate-solution,2026-06-10 12:25:32 UTC,Carbon Herald,2026-06-10 12:25:32+00:00
Mitsubishi Electric And VTT Reach Milestone In Electrochemical DOC Project,https://carbonherald.com/mitsubishi-electric-and-vtt-reach-milestone-in-electrochemical-doc-project/?utm_source=rss&utm_medium=rss&utm_campaign=mitsubishi-electric-and-vtt-reach-milestone-in-electrochemical-doc-project,2026-06-10 13:42:28 UTC,Carbon Herald,2026-06-10 13:42:28+00:00
Green light for the EU’s ‘Battery Booster’,https://www.electrive.com/2026/06/10/green-light-for-the-eus-battery-booster/,2026-06-10 13:58:32 UTC,Battery – electrive.com,2026-06-10 13:58:32+00:00
Partial Atomic Disordered Ti2Nb10O29‐x Induced by Joule Thermal Shock for Superior Lithium‐Ion Storage,https://advanced.onlinelibrary.wiley.com/doi/10.1002/adma.73607?af=R,2026-06-10 14:16:46 UTC,Wiley: Advanced Materials: Table of Contents,2026-06-10 14:16:46+00:00
Co1/Ru Single‐Atom Alloy Catalyst for Sustainable Polypropylene Hydrogenolysis to Long‐Chain Liquid Products,https://advanced.onlinelibrary.wiley.com/doi/10.1002/adma.73643?af=R,2026-06-10 14:18:54 UTC,Wiley: Advanced Materials: Table of Contents,2026-06-10 14:18:54+00:00
Topology‐Regulated Polyurea: From Structural Design to Emerging Applications,https://advanced.onlinelibrary.wiley.com/doi/10.1002/adma.73677?af=R,2026-06-10 14:20:15 UTC,Wiley: Advanced Materials: Table of Contents,2026-06-10 14:20:15+00:00
Compact Solvation Enables Sub‐Minute Sodium‐Ion Storage: A Data‐Driven Perspective,https://advanced.onlinelibrary.wiley.com/doi/10.1002/adma.73658?af=R,2026-06-10 14:21:22 UTC,Wiley: Advanced Materials: Table of Contents,2026-06-10 14:21:22+00:00
Metal Atoms and Quantum Dots Coexist for Water Electrolysis,https://advanced.onlinelibrary.wiley.com/doi/10.1002/adma.73687?af=R,2026-06-10 14:25:04 UTC,Wiley: Advanced Materials: Table of Contents,2026-06-10 14:25:04+00:00
Reversible Thermoactuation Unlocks Minimally Invasive Implantation and Retrieval of Soft Bioelectronics,https://advanced.onlinelibrary.wiley.com/doi/10.1002/adma.73685?af=R,2026-06-10 14:56:18 UTC,Wiley: Advanced Materials: Table of Contents,2026-06-10 14:56:18+00:00
Light Intensity‐Driven Bidirectional Photoresponse Vision Sensor for Autonomous Obstacle Avoidance System,https://advanced.onlinelibrary.wiley.com/doi/10.1002/adma.73694?af=R,2026-06-10 15:20:46 UTC,Wiley: Advanced Materials: Table of Contents,2026-06-10 15:20:46+00:00
Rare butterfly population increases by 90 times,https://www.bbc.com/news/articles/cg537mr5qv3o?at_medium=RSS&at_campaign=rss,2026-06-10 16:53:02 UTC,BBC News,2026-06-10 16:53:02+00:00
The fight to stop animals dying in fishing nets,https://www.bbc.com/news/articles/c1kynwpd0jlo?at_medium=RSS&at_campaign=rss,2026-06-10 17:17:20 UTC,BBC News,2026-06-10 17:17:20+00:00
'Worrying' pollution in Cotswolds river - volunteers,https://www.bbc.com/news/articles/c0eynd2ndz7o?at_medium=RSS&at_campaign=rss,2026-06-10 18:11:32 UTC,BBC News,2026-06-10 18:11:32+00:00
Stabilizing the Buried Interface via Inorganic-Organic Hybrid Layers for High-Performance Perovskite Photovoltaics,http://pubs.rsc.org/en/Content/ArticleLanding/2026/EE/D6EE01195K,2026-06-10 23:00:00 UTC,RSC - Energy Environ. Sci. latest articles,2026-06-10 23:00:00+00:00
