title,link,published,source,pub_date
Mechanical regulation of immunity in metastasis,https://www.nature.com/articles/s41563-026-02658-8,2026-07-10 00:00:00 UTC,Nature Materials,2026-07-10 00:00:00+00:00
Direct conversion of N2 and CH4 to valuable N-containing compounds via a plasma-activated catalytic process,https://www.cell.com/chem/fulltext/S2451-9294(26)00202-0?rss=yes,2026-07-10 00:00:00 UTC,Chem,2026-07-10 00:00:00+00:00
Design principles for π-conjugated hydrogel semiconductors,https://www.nature.com/articles/s41563-026-02638-y,2026-07-10 00:00:00 UTC,Nature Materials,2026-07-10 00:00:00+00:00
Fluoride ions as charge carriers in electrochemical energy storage,https://www.nature.com/articles/s41563-026-02654-y,2026-07-10 00:00:00 UTC,Nature Materials,2026-07-10 00:00:00+00:00
In situ scattering optical microscopy offers power in numbers with single-particle precision,https://www.nature.com/articles/s41563-026-02637-z,2026-07-10 00:00:00 UTC,Nature Materials,2026-07-10 00:00:00+00:00
Briefing Chat: The 30 year-legacy of a science icon — Dolly the sheep,https://www.nature.com/articles/d41586-026-02185-1,2026-07-10 00:00:00 UTC,Nature,2026-07-10 00:00:00+00:00
Shining light in deep tissue,https://www.nature.com/articles/s41563-026-02671-x,2026-07-10 00:00:00 UTC,Nature Materials,2026-07-10 00:00:00+00:00
Which ‘AI scientist’ suits your lab? A guide for the perplexed,https://www.nature.com/articles/d41586-026-02091-6,2026-07-10 00:00:00 UTC,Nature,2026-07-10 00:00:00+00:00
"Think preprints are unreliable? Analysis of 70,000 studies might change your mind",https://www.nature.com/articles/d41586-026-02167-3,2026-07-10 00:00:00 UTC,Nature,2026-07-10 00:00:00+00:00
Lab-grown sperm: scientists inch closer to fertility breakthrough,https://www.nature.com/articles/d41586-026-02172-6,2026-07-10 00:00:00 UTC,Nature,2026-07-10 00:00:00+00:00
NSF plans cuts to core science programmes to fund White House initiative,https://www.nature.com/articles/d41586-026-02135-x,2026-07-10 00:00:00 UTC,Nature,2026-07-10 00:00:00+00:00
Author Correction: Authigenic mineral phases as a driver of the upper-ocean iron cycle,https://www.nature.com/articles/s41586-026-10853-5,2026-07-10 00:00:00 UTC,Nature,2026-07-10 00:00:00+00:00
Discovery of record-breaking high-Tc superconductivity among 5d transition-metal-oxides up to 17.8 K in ReO3,https://academic.oup.com/nsr/advance-article/doi/10.1093/nsr/nwag425/8731953?rss=1,2026-07-10 00:00:00 UTC,National Science Review Advance Access,2026-07-10 00:00:00+00:00
"Ganiopteris gen. nov., an early Carboniferous seed plant with foliar-borne ovules and its evolutionary significance",https://academic.oup.com/nsr/advance-article/doi/10.1093/nsr/nwag429/8731947?rss=1,2026-07-10 00:00:00 UTC,National Science Review Advance Access,2026-07-10 00:00:00+00:00
Alpine crossing took a heavy toll on Hannibal’s elephants and troops,https://www.nature.com/articles/d41586-026-02113-3,2026-07-10 00:00:00 UTC,Nature,2026-07-10 00:00:00+00:00
Endo-selective [2+2] cycloaddition of norbornadienes enables the synthesis of homocubanes,https://www.nature.com/articles/s41557-026-02201-x,2026-07-10 00:00:00 UTC,Nature Chemistry,2026-07-10 00:00:00+00:00
Scalable interface-interphase design of tin electrodes enables pouch-type sodium all-solid-state batteries,https://www.cell.com/joule/fulltext/S2542-4351(26)00254-0?rss=yes,2026-07-10 00:00:00 UTC,Joule,2026-07-10 00:00:00+00:00
Academic battery passports for the regulatory era of energy storage,https://www.cell.com/joule/fulltext/S2542-4351(26)00255-2?rss=yes,2026-07-10 00:00:00 UTC,Joule,2026-07-10 00:00:00+00:00
Anion-bridged secondary solvation sheaths for stable aqueous zinc batteries,https://academic.oup.com/nsr/advance-article/doi/10.1093/nsr/nwag422/8731938?rss=1,2026-07-10 00:00:00 UTC,National Science Review Advance Access,2026-07-10 00:00:00+00:00
NSF makes billion-dollar gamble on research with an economic payoff,https://www.science.org/content/article/nsf-makes-billion-dollar-gamble-research-economic-payoff,2026-07-10 01:15:50 UTC,Latest News from Science Magazine,2026-07-10 01:15:50+00:00
DNA could act like a famed gravity-defying pump,https://www.science.org/content/article/dna-could-act-famed-gravity-defying-pump,2026-07-10 02:23:00 UTC,Latest News from Science Magazine,2026-07-10 02:23:00+00:00
How a 40-year project helped save little terns,https://www.bbc.co.uk/news/articles/cd0mx1zzld7o?at_medium=RSS&at_campaign=rss,2026-07-10 04:24:37 UTC,BBC News,2026-07-10 04:24:37+00:00
Ancient DNA solves Medici murder mystery,https://www.science.org/content/article/ancient-dna-solves-medici-murder-mystery,2026-07-10 05:05:00 UTC,Latest News from Science Magazine,2026-07-10 05:05:00+00:00
New NSF policy would ban almost all collaborations with Chinese scientists,https://www.science.org/content/article/new-nsf-policy-would-ban-almost-all-collaborations-chinese-scientists,2026-07-10 05:55:28 UTC,Latest News from Science Magazine,2026-07-10 05:55:28+00:00
"China lands reusable rocket for first time, state media says",https://www.bbc.co.uk/news/articles/cm2rmmx86pdo?at_medium=RSS&at_campaign=rss,2026-07-10 06:44:21 UTC,BBC News,2026-07-10 06:44:21+00:00
H2BE113K mutation promotes breast cancer metastasis through modulating chromatin dynamics,https://www.science.org/doi/abs/10.1126/sciadv.adx4982?af=R,2026-07-10 07:00:00 UTC,AAAS: Science Advances: Table of Contents,2026-07-10 07:00:00+00:00
Low-intensity stimulation drives macrophage efferocytosis via ACSL4 lipid remodeling and CCL9-CCR1 signaling for tendon-bone healing,https://www.science.org/doi/abs/10.1126/sciadv.adw6666?af=R,2026-07-10 07:00:00 UTC,AAAS: Science Advances: Table of Contents,2026-07-10 07:00:00+00:00
Biogeography of community canopy leaf traits and their links to global forest photosynthesis,https://www.science.org/doi/abs/10.1126/sciadv.adk2998?af=R,2026-07-10 07:00:00 UTC,AAAS: Science Advances: Table of Contents,2026-07-10 07:00:00+00:00
Reply to Rana and Singh: Critical thresholds and critical actions for evolvable AI,https://www.pnas.org/doi/abs/10.1073/pnas.2619586123?mi=eymic2&af=R&access=on&content=articlesChapters&publication=pnas&sortBy=Earliest&target=default,2026-07-10 07:00:00 UTC,Proceedings of the National Academy of Sciences: Keyword search for query,2026-07-10 07:00:00+00:00
Evolvable AI needs operational risk thresholds,https://www.pnas.org/doi/abs/10.1073/pnas.2618781123?mi=eymic2&af=R&access=on&content=articlesChapters&publication=pnas&sortBy=Earliest&target=default,2026-07-10 07:00:00 UTC,Proceedings of the National Academy of Sciences: Keyword search for query,2026-07-10 07:00:00+00:00
Reply to Ernst and Spaak: The LV-map accurately estimates species interactions even when functional responses are nonlinear,https://www.pnas.org/doi/abs/10.1073/pnas.2616838123?mi=eymic2&af=R&access=on&content=articlesChapters&publication=pnas&sortBy=Earliest&target=default,2026-07-10 07:00:00 UTC,Proceedings of the National Academy of Sciences: Keyword search for query,2026-07-10 07:00:00+00:00
Enhancing Sn-Pb perovskite homogeneity via thioether coordination for efficient and stable all-perovskite tandem solar cells,https://www.science.org/doi/abs/10.1126/sciadv.aeb8790?af=R,2026-07-10 07:00:00 UTC,AAAS: Science Advances: Table of Contents,2026-07-10 07:00:00+00:00
The LV map leads to misleading interpretations of coexistence,https://www.pnas.org/doi/abs/10.1073/pnas.2535393123?mi=eymic2&af=R&access=on&content=articlesChapters&publication=pnas&sortBy=Earliest&target=default,2026-07-10 07:00:00 UTC,Proceedings of the National Academy of Sciences: Keyword search for query,2026-07-10 07:00:00+00:00
Fatigue-resistant and tough double network granular elastomers,https://www.science.org/doi/abs/10.1126/sciadv.aec3482?af=R,2026-07-10 07:00:00 UTC,AAAS: Science Advances: Table of Contents,2026-07-10 07:00:00+00:00
Equal in death: Ancient genomic analysis of children’s early Christian burials,https://www.science.org/doi/abs/10.1126/sciadv.aeb8588?af=R,2026-07-10 07:00:00 UTC,AAAS: Science Advances: Table of Contents,2026-07-10 07:00:00+00:00
"Progressive intestinal tumor cell plasticity, Myc activation, and loss of Lgr5+ tumor stem cell lineage commitment upon Wnt depletion",https://www.science.org/doi/abs/10.1126/sciadv.aeb8564?af=R,2026-07-10 07:00:00 UTC,AAAS: Science Advances: Table of Contents,2026-07-10 07:00:00+00:00
Multiplexing in networks and diffusion,https://www.pnas.org/doi/abs/10.1073/pnas.2534923123?mi=eymic2&af=R&access=on&content=articlesChapters&publication=pnas&sortBy=Earliest&target=default,2026-07-10 07:00:00 UTC,Proceedings of the National Academy of Sciences: Keyword search for query,2026-07-10 07:00:00+00:00
The MEK inhibitor trametinib incurs mitochondrial injury and induces innate immune responses in the mouse heart,https://www.science.org/doi/abs/10.1126/sciadv.aeb2695?af=R,2026-07-10 07:00:00 UTC,AAAS: Science Advances: Table of Contents,2026-07-10 07:00:00+00:00
Periodic shifts in viral load increase risk of Hendra virus spillover from Pteropus bats,https://www.science.org/doi/abs/10.1126/sciadv.aea6654?af=R,2026-07-10 07:00:00 UTC,AAAS: Science Advances: Table of Contents,2026-07-10 07:00:00+00:00
Localized sample-based quantum diagonalization for strongly correlated chemistry,https://www.pnas.org/doi/abs/10.1073/pnas.2603914123?mi=eymic2&af=R&access=on&content=articlesChapters&publication=pnas&sortBy=Earliest&target=default,2026-07-10 07:00:00 UTC,Proceedings of the National Academy of Sciences: Keyword search for query,2026-07-10 07:00:00+00:00
Unconventional vesicle transport driven by formin-actin-myosin working system during pollen germination,https://www.science.org/doi/abs/10.1126/sciadv.aeb7188?af=R,2026-07-10 07:00:00 UTC,AAAS: Science Advances: Table of Contents,2026-07-10 07:00:00+00:00
Provable cluster-preserving visualizations with curvature-based stochastic neighbor embeddings,https://www.pnas.org/doi/abs/10.1073/pnas.2509171123?mi=eymic2&af=R&access=on&content=articlesChapters&publication=pnas&sortBy=Earliest&target=default,2026-07-10 07:00:00 UTC,Proceedings of the National Academy of Sciences: Keyword search for query,2026-07-10 07:00:00+00:00
Light hydrogen isotopes in terrestrial core,https://www.science.org/doi/abs/10.1126/sciadv.aec5685?af=R,2026-07-10 07:00:00 UTC,AAAS: Science Advances: Table of Contents,2026-07-10 07:00:00+00:00
Erratum for the Research Article “Cystic fibrosis alters the structure of the olfactory epithelium and the expression of olfactory receptors affecting odor perception” by I. Caballero et al.,https://www.science.org/doi/abs/10.1126/sciadv.aej8309?af=R,2026-07-10 07:00:00 UTC,AAAS: Science Advances: Table of Contents,2026-07-10 07:00:00+00:00
A scalable deep-learning framework for cancer detection using cell-free DNA shallow whole-genome sequencing,https://www.science.org/doi/abs/10.1126/sciadv.ady9432?af=R,2026-07-10 07:00:00 UTC,AAAS: Science Advances: Table of Contents,2026-07-10 07:00:00+00:00
Congenital blindness reduces myelination in human visual cortex,https://www.science.org/doi/abs/10.1126/sciadv.aec2348?af=R,2026-07-10 07:00:00 UTC,AAAS: Science Advances: Table of Contents,2026-07-10 07:00:00+00:00
Motor-free hip exosuit via high-output fibrous dielectric elastomer actuators,https://www.science.org/doi/abs/10.1126/sciadv.aec6917?af=R,2026-07-10 07:00:00 UTC,AAAS: Science Advances: Table of Contents,2026-07-10 07:00:00+00:00
Origin of sulfur allotropes on the carbonaceous asteroid Ryugu and implications to the sulfur chemistry in the interstellar medium,https://www.science.org/doi/abs/10.1126/sciadv.aeb3358?af=R,2026-07-10 07:00:00 UTC,AAAS: Science Advances: Table of Contents,2026-07-10 07:00:00+00:00
Modeling Parkinson’s pathology in human iPSC dopaminergic neurons uncovers key mechanisms of Lewy body formation and heterogeneity,https://www.science.org/doi/abs/10.1126/sciadv.aed8851?af=R,2026-07-10 07:00:00 UTC,AAAS: Science Advances: Table of Contents,2026-07-10 07:00:00+00:00
Multicellular simulations with shape and volume constraints using optimal transport,https://www.science.org/doi/abs/10.1126/sciadv.adv2781?af=R,2026-07-10 07:00:00 UTC,AAAS: Science Advances: Table of Contents,2026-07-10 07:00:00+00:00
Mechanical control of polar order,https://www.science.org/doi/abs/10.1126/sciadv.aeh2106?af=R,2026-07-10 07:00:00 UTC,AAAS: Science Advances: Table of Contents,2026-07-10 07:00:00+00:00
Crystalline 3D covalent organic frameworks with nbo topology,https://www.science.org/doi/abs/10.1126/sciadv.aeg6230?af=R,2026-07-10 07:00:00 UTC,AAAS: Science Advances: Table of Contents,2026-07-10 07:00:00+00:00
Atomically chemical heterogeneity endowing dielectric ceramics with ultrahigh energy storage,https://www.science.org/doi/abs/10.1126/sciadv.aef3315?af=R,2026-07-10 07:00:00 UTC,AAAS: Science Advances: Table of Contents,2026-07-10 07:00:00+00:00
p38 MAP kinase senses short-chain fatty acids to attenuate Toll-like receptor signaling and intestinal inflammation,https://www.science.org/doi/abs/10.1126/sciadv.aef1419?af=R,2026-07-10 07:00:00 UTC,AAAS: Science Advances: Table of Contents,2026-07-10 07:00:00+00:00
A prolactin-receptive neural circuit drives maternal interactions with pups in mice,https://www.science.org/doi/abs/10.1126/sciadv.ady6498?af=R,2026-07-10 07:00:00 UTC,AAAS: Science Advances: Table of Contents,2026-07-10 07:00:00+00:00
Inverse design of guanine-defects in carbon nanotubes for high-resolution emission tuning,https://www.science.org/doi/abs/10.1126/sciadv.aee8922?af=R,2026-07-10 07:00:00 UTC,AAAS: Science Advances: Table of Contents,2026-07-10 07:00:00+00:00
Submicromolar imaging of intrinsic chromophores by two-photon photothermal microscopy captures mitochondrial response to chemotherapy,https://www.science.org/doi/abs/10.1126/sciadv.aee7678?af=R,2026-07-10 07:00:00 UTC,AAAS: Science Advances: Table of Contents,2026-07-10 07:00:00+00:00
Direct visualization of native GSDMD pores reveals lipid-driven stabilization during pyroptosis,https://www.science.org/doi/abs/10.1126/sciadv.aee4587?af=R,2026-07-10 07:00:00 UTC,AAAS: Science Advances: Table of Contents,2026-07-10 07:00:00+00:00
Multifunctional electrochemical memory stabilized by phase coexistence,https://www.science.org/doi/abs/10.1126/sciadv.aee1908?af=R,2026-07-10 07:00:00 UTC,AAAS: Science Advances: Table of Contents,2026-07-10 07:00:00+00:00
G protein selectivity in group I metabotropic glutamate receptors,https://www.science.org/doi/abs/10.1126/sciadv.aee0044?af=R,2026-07-10 07:00:00 UTC,AAAS: Science Advances: Table of Contents,2026-07-10 07:00:00+00:00
Oxidant-free Au(I)/Au(III) catalysis: Rational development of hemilabile proximity-guided N-heterocyclic carbenes,https://www.science.org/doi/abs/10.1126/sciadv.aed3424?af=R,2026-07-10 07:00:00 UTC,AAAS: Science Advances: Table of Contents,2026-07-10 07:00:00+00:00
Remote network for cognitive symptoms derived from tau accumulation in progressive supranuclear palsy,https://www.science.org/doi/abs/10.1126/sciadv.aed0348?af=R,2026-07-10 07:00:00 UTC,AAAS: Science Advances: Table of Contents,2026-07-10 07:00:00+00:00
Morphological and chemical changes in Cd-free colloidal QD-LEDs during operation,https://www.science.org/doi/abs/10.1126/sciadv.aec8208?af=R,2026-07-10 07:00:00 UTC,AAAS: Science Advances: Table of Contents,2026-07-10 07:00:00+00:00
Interfacial solvothermal synthesis of superhydrophilic ionic salt-derived chiral helical COFs with strong chiroptical activity,https://www.science.org/doi/abs/10.1126/sciadv.aec8167?af=R,2026-07-10 07:00:00 UTC,AAAS: Science Advances: Table of Contents,2026-07-10 07:00:00+00:00
"All-two-dimensional, ion-gating synaptic transistors for high-temperature and ultralow-energy-consumption neuromorphic applications",https://www.science.org/doi/abs/10.1126/sciadv.aec7731?af=R,2026-07-10 07:00:00 UTC,AAAS: Science Advances: Table of Contents,2026-07-10 07:00:00+00:00
Barium senses subtle pore changes in a voltage-gated K+ channel associated with voltage sensor states and regulatory subunits,https://www.science.org/doi/abs/10.1126/sciadv.aec6510?af=R,2026-07-10 07:00:00 UTC,AAAS: Science Advances: Table of Contents,2026-07-10 07:00:00+00:00
"Epigenetic landscape, key transcriptional regulators, and in vivo identification of human Tr1 cells",https://www.science.org/doi/abs/10.1126/sciadv.aec6358?af=R,2026-07-10 07:00:00 UTC,AAAS: Science Advances: Table of Contents,2026-07-10 07:00:00+00:00
Recent equatorward shift of the summer North Atlantic jet dominated by internal climate variability,https://www.science.org/doi/abs/10.1126/sciadv.aee8136?af=R,2026-07-10 07:00:00 UTC,AAAS: Science Advances: Table of Contents,2026-07-10 07:00:00+00:00
Modeling human embryo adhesion using a microfluidic platform,https://www.science.org/doi/abs/10.1126/sciadv.adz2249?af=R,2026-07-10 07:00:00 UTC,AAAS: Science Advances: Table of Contents,2026-07-10 07:00:00+00:00
IEA Unveils Fresh $900M Clean Cooking Push For Africa,https://carbonherald.com/iea-unveils-fresh-900m-clean-cooking-push-for-africa/?utm_source=rss&utm_medium=rss&utm_campaign=iea-unveils-fresh-900m-clean-cooking-push-for-africa,2026-07-10 07:59:21 UTC,Carbon Herald,2026-07-10 07:59:21+00:00
JD Energy bring high-voltage transmission expertise to European BESS markets,https://www.ess-news.com/2026/07/10/jd-energy-bring-high-voltage-transmission-expertise-to-european-bess-markets/,2026-07-10 08:15:00 UTC,Latest news about ESS Projects & Applications | ESS News,2026-07-10 08:15:00+00:00
How cows are helping one of Britain's rarest butterflies,https://www.bbc.co.uk/news/articles/c621jgepljvo?at_medium=RSS&at_campaign=rss,2026-07-10 09:07:01 UTC,BBC News,2026-07-10 09:07:01+00:00
LG Energy Solution likely to increase battery supply for Tesla,https://www.electrive.com/2026/07/10/lg-energy-solution-likely-to-increase-battery-supply-to-tesla/,2026-07-10 09:40:00 UTC,Battery – electrive.com,2026-07-10 09:40:00+00:00
"Idex And Nuada Launch Breakthrough 10,000-Ton BECCS Hub in France",https://carbonherald.com/idex-and-nuada-launch-breakthrough-10000-ton-beccs-hub-in-france/?utm_source=rss&utm_medium=rss&utm_campaign=idex-and-nuada-launch-breakthrough-10000-ton-beccs-hub-in-france,2026-07-10 11:08:38 UTC,Carbon Herald,2026-07-10 11:08:38+00:00
Microsoft’s AI Expansion Drives A 25% Increase In Annual Emissions,https://carbonherald.com/microsofts-ai-expansion-drives-a-25-increase-in-annual-emissions/?utm_source=rss&utm_medium=rss&utm_campaign=microsofts-ai-expansion-drives-a-25-increase-in-annual-emissions,2026-07-10 11:42:43 UTC,Carbon Herald,2026-07-10 11:42:43+00:00
Verra Opens Consultation On Major Cookstove Methodology Overhaul,https://carbonherald.com/verra-opens-consultation-on-major-cookstove-methodology-overhaul/?utm_source=rss&utm_medium=rss&utm_campaign=verra-opens-consultation-on-major-cookstove-methodology-overhaul,2026-07-10 11:59:30 UTC,Carbon Herald,2026-07-10 11:59:30+00:00
Spain opens consultation for 100 MW/400 MWh BESS at hybrid CSP-PV plant,https://www.ess-news.com/2026/07/10/spain-opens-consultation-for-100-mw-400-mwh-bess-at-hybrid-csp-pv-plant/,2026-07-10 12:30:00 UTC,Latest news about ESS Projects & Applications | ESS News,2026-07-10 12:30:00+00:00
Spain's largest research organization confronts its dark past,https://www.science.org/content/article/largest-research-organization-spain-confronts-its-dark-past,2026-07-10 12:30:46 UTC,Latest News from Science Magazine,2026-07-10 12:30:46+00:00
UK bakes in 35C highs as millions under hosepipe bans,https://www.bbc.co.uk/weather/articles/c0my38l4ex3o?at_medium=RSS&at_campaign=rss,2026-07-10 12:38:19 UTC,BBC News,2026-07-10 12:38:19+00:00
Shoosmiths To Invest In HUSK Biochar Credits Via Carbonaires,https://carbonherald.com/shoosmiths-to-invest-in-husk-biochar-credits-via-carbonaires/?utm_source=rss&utm_medium=rss&utm_campaign=shoosmiths-to-invest-in-husk-biochar-credits-via-carbonaires,2026-07-10 12:51:21 UTC,Carbon Herald,2026-07-10 12:51:21+00:00
Switzerland adds 1.33 GW of solar in 2025 as battery storage demand jumps 70%,https://www.ess-news.com/2026/07/10/switzerland-adds-1-33-gw-of-solar-in-2025-as-battery-storage-demand-jumps-70/,2026-07-10 13:15:00 UTC,Latest news about ESS Projects & Applications | ESS News,2026-07-10 13:15:00+00:00
Struggling pig farmers say £2m support package 'not enough',https://www.bbc.co.uk/news/articles/cn94rl1wj0ro?at_medium=RSS&at_campaign=rss,2026-07-10 13:30:31 UTC,BBC News,2026-07-10 13:30:31+00:00
"Watch: Typhoon Bavi forecast to bring heavy rains and floods to Taiwan, Japan and China",https://www.bbc.co.uk/news/videos/c0myengg8nzo?at_medium=RSS&at_campaign=rss,2026-07-10 13:40:19 UTC,BBC News,2026-07-10 13:40:19+00:00
East Asia braces for destructive typhoon as landslides kill 15 in Philippines,https://www.bbc.co.uk/news/articles/c04y6wr03gxo?at_medium=RSS&at_campaign=rss,2026-07-10 13:53:11 UTC,BBC News,2026-07-10 13:53:11+00:00
Spain publishes notices for 1 GW of battery storage projects in June,https://www.ess-news.com/2026/07/10/spain-publishes-notices-for-1-gw-of-battery-storage-projects-in-june/,2026-07-10 14:00:00 UTC,Latest news about ESS Projects & Applications | ESS News,2026-07-10 14:00:00+00:00
Sungrow to supply 125 MWh of grid-supporting battery storage for Maxsolar projects,https://www.ess-news.com/2026/07/10/sungrow-to-supply-125-mwh-of-grid-supporting-battery-storage-for-maxsolar-projects/,2026-07-10 14:45:00 UTC,Latest news about ESS Projects & Applications | ESS News,2026-07-10 14:45:00+00:00
Boxy forms and odd lights: US declassifies more UFO files,https://www.bbc.co.uk/news/videos/c8x2zez8qwzo?at_medium=RSS&at_campaign=rss,2026-07-10 15:28:17 UTC,BBC News,2026-07-10 15:28:17+00:00
"Giga Storage secures financing for 2.8 GWh Belgian BESS, sets construction date",https://www.ess-news.com/2026/07/10/giga-storage-secures-financing-for-2-8-gwh-belgian-bess-sets-construction-date/,2026-07-10 15:30:00 UTC,Latest news about ESS Projects & Applications | ESS News,2026-07-10 15:30:00+00:00
How can you help wildlife during hot weather?,https://www.bbc.co.uk/news/videos/c7vyp6lqv9yo?at_medium=RSS&at_campaign=rss,2026-07-10 16:00:54 UTC,BBC News,2026-07-10 16:00:54+00:00
Helping one of Britain's rarest butterflies,https://www.bbc.co.uk/news/videos/cwyezwg89n3o?at_medium=RSS&at_campaign=rss,2026-07-10 20:14:46 UTC,BBC News,2026-07-10 20:14:46+00:00
"The Bottlenecks, Architectures and Future Pathways of Optoelectronic Integration: an Interview with Qionghai Dai",https://academic.oup.com/nsr/advance-article/doi/10.1093/nsr/nwag431/8732558?rss=1,2026-07-11 00:00:00 UTC,National Science Review Advance Access,2026-07-11 00:00:00+00:00
Gapless fracton quantum spin liquid and emergent photons in a 2D spin-1 model,https://www.nature.com/articles/s41467-026-74797-0,2026-07-11 00:00:00 UTC,Nature Communications,2026-07-11 00:00:00+00:00
Constructing mesoscale functionomics by neural dynamics subspace clustering,https://academic.oup.com/nsr/advance-article/doi/10.1093/nsr/nwag420/8732559?rss=1,2026-07-11 00:00:00 UTC,National Science Review Advance Access,2026-07-11 00:00:00+00:00
Pervasive summertime nitrous oxide undersaturation in U.S. lakes and reservoirs,https://www.nature.com/articles/s41467-026-74705-6,2026-07-11 00:00:00 UTC,Nature Communications,2026-07-11 00:00:00+00:00
Efficiency-weighted cooling degree days reveal opposing temperature and humidity effects on energy demand,https://www.nature.com/articles/s41467-026-75388-9,2026-07-11 00:00:00 UTC,Nature Communications,2026-07-11 00:00:00+00:00
Phage portal proteins counteract stringent-response–mediated restriction,https://www.nature.com/articles/s41467-026-75532-5,2026-07-11 00:00:00 UTC,Nature Communications,2026-07-11 00:00:00+00:00
Direct synthesis of p-type PbS quantum dot inks toward wafer-scale SWIR imaging,https://academic.oup.com/nsr/advance-article/doi/10.1093/nsr/nwag421/8732561?rss=1,2026-07-11 00:00:00 UTC,National Science Review Advance Access,2026-07-11 00:00:00+00:00
High Young’s modulus NaF coating on bulk-Sn: mechanical confinement effect drives durable sodium storage by alleviating (De) sodiation stress,https://academic.oup.com/nsr/advance-article/doi/10.1093/nsr/nwag428/8732562?rss=1,2026-07-11 00:00:00 UTC,National Science Review Advance Access,2026-07-11 00:00:00+00:00
The traffic concentration effects of urban navigation services,https://www.nature.com/articles/s41467-026-75254-8,2026-07-11 00:00:00 UTC,Nature Communications,2026-07-11 00:00:00+00:00
Highly recyclable and efficient electrocatalytic synthesis of adipic acid catalyzed by ultra-alkali-resistant [Ni36] nanocages in MOF,https://academic.oup.com/nsr/advance-article/doi/10.1093/nsr/nwag427/8732565?rss=1,2026-07-11 00:00:00 UTC,National Science Review Advance Access,2026-07-11 00:00:00+00:00
Mesoscale ordered assembly of Er3+-doped quantum dots enables efficient 1.55 µm electroluminescence,https://www.nature.com/articles/s41467-026-75429-3,2026-07-11 00:00:00 UTC,Nature Communications,2026-07-11 00:00:00+00:00
Chip-integrated metasurface-enabled single-photon skyrmion sources,https://www.nature.com/articles/s41467-026-75516-5,2026-07-11 00:00:00 UTC,Nature Communications,2026-07-11 00:00:00+00:00
Microbially reduced flavins destabilize the TiO2 passive film of titanium under bulk aerobic conditions,https://academic.oup.com/nsr/advance-article/doi/10.1093/nsr/nwag426/8732568?rss=1,2026-07-11 00:00:00 UTC,National Science Review Advance Access,2026-07-11 00:00:00+00:00
British Hewing Championships,https://www.bbc.co.uk/news/videos/clye07l1gjro?at_medium=RSS&at_campaign=rss,2026-07-11 06:11:59 UTC,BBC News,2026-07-11 06:11:59+00:00
New research into basking sharks around island,https://www.bbc.co.uk/news/articles/c4gy82803dgo?at_medium=RSS&at_campaign=rss,2026-07-11 06:37:06 UTC,BBC News,2026-07-11 06:37:06+00:00
