title,link,published,source,pub_date
A Hormone Cell Atlas maps the human endocrine system at cellular resolution,https://www.science.org/doi/abs/10.1126/science.aeb2672?af=R,2026-07-02 07:00:00 UTC,AAAS: Science: Table of Contents,2026-07-02 07:00:00+00:00
ILC2s regulate a fibroblast progenitor niche in the pancreas,https://www.science.org/doi/abs/10.1126/science.aea5113?af=R,2026-07-02 07:00:00 UTC,AAAS: Science: Table of Contents,2026-07-02 07:00:00+00:00
Patterning human kidney organoids with synthetic Wnt-secreting organizers,https://www.science.org/doi/abs/10.1126/science.adu9122?af=R,2026-07-02 07:00:00 UTC,AAAS: Science: Table of Contents,2026-07-02 07:00:00+00:00
Membrane protein solubilization and structure determination using de novo–designed proteins,https://www.science.org/doi/abs/10.1126/science.adr3817?af=R,2026-07-02 07:00:00 UTC,AAAS: Science: Table of Contents,2026-07-02 07:00:00+00:00
Scotland’s battery storage pipeline nears 42 GW,https://www.ess-news.com/2026/07/02/scotlands-battery-storage-pipeline-nears-42-gw/,2026-07-02 07:00:00 UTC,Latest news about ESS Projects & Applications | ESS News,2026-07-02 07:00:00+00:00
Institutionalizing AI diplomacy in Africa,https://www.science.org/doi/abs/10.1126/science.aei7835?af=R,2026-07-02 07:00:00 UTC,AAAS: Science: Table of Contents,2026-07-02 07:00:00+00:00
Continuous Fabrication of Dendrite‐Free Zinc Fiber Anodes for Flexible Batteries,https://advanced.onlinelibrary.wiley.com/doi/10.1002/aenm.71235?af=R,2026-07-02 07:34:14 UTC,Wiley: Advanced Energy Materials: Table of Contents,2026-07-02 07:34:14+00:00
Nano One and Worley Chemetics Complete One-Pot™ LFP Cathode Package and Advance to Market,https://batteriesnews.com/nano-one-and-worley-chemetics-complete-one-pot-lfp-cathode-package-and-advance-to-market/,2026-07-02 08:13:59 UTC,Batteries News,2026-07-02 08:13:59+00:00
CIP commissions 220 MW/1.1 GWh standalone battery project in Chile,https://www.ess-news.com/2026/07/02/cip-commissions-220-mw-1-1-gwh-standalone-battery-project-in-chile/,2026-07-02 08:15:00 UTC,Latest news about ESS Projects & Applications | ESS News,2026-07-02 08:15:00+00:00
"J&T Express to deploy 5,000 CATL battery-swapping e-trucks",https://www.electrive.com/2026/07/02/jt-express-to-deploy-5000-catl-battery-swapping-e-trucks/,2026-07-02 08:44:00 UTC,Battery – electrive.com,2026-07-02 08:44:00+00:00
Why California’s carbon manure math doesn’t add up,https://www.technologyreview.com/2026/07/02/1139981/why-californias-carbon-manure-math-doesnt-add-up/,2026-07-02 09:00:00 UTC,Climate change and energy – MIT Technology Review,2026-07-02 09:00:00+00:00
Green Flexibility acquires 3 GWh battery storage portfolio in Germany,https://www.ess-news.com/2026/07/02/green-flexibility-acquires-3-gwh-battery-storage-portfolio-in-germany/,2026-07-02 09:00:00 UTC,Latest news about ESS Projects & Applications | ESS News,2026-07-02 09:00:00+00:00
Scientists fear cuts may shut radio telescope,https://www.bbc.co.uk/news/articles/c0qy3v15l98o?at_medium=RSS&at_campaign=rss,2026-07-02 09:11:52 UTC,BBC News,2026-07-02 09:11:52+00:00
OCSiAl to Supply Single Wall Carbon Nanotubes to PowerCo’s Salzgitter Facility,https://batteriesnews.com/ocsial-to-supply-single-wall-carbon-nanotubes-to-powercos-salzgitter-facility/,2026-07-02 09:12:52 UTC,Batteries News,2026-07-02 09:12:52+00:00
Alpiq secures Swissgrid approval for 300 MW/1.2 GWh battery project,https://www.ess-news.com/2026/07/02/alpiq-secures-swissgrid-approval-for-300-mw-1-2-gwh-battery-project/,2026-07-02 11:00:00 UTC,Latest news about ESS Projects & Applications | ESS News,2026-07-02 11:00:00+00:00
"Höegh Evi, Nord Gas Solutions validate ammonia cracking technology",https://hydrogentechworld.com/hoegh-evi-nord-gas-solutions-validate-ammonia-cracking-technology,2026-07-02 11:09:31 UTC,Hydrogen Tech World.com,2026-07-02 11:09:31+00:00
World Bank backs 300 MW pumped hydropower storage plant in Morocco,https://www.ess-news.com/2026/07/02/world-bank-backs-300-mw-pumped-hydropower-storage-plant-in-morocco/,2026-07-02 12:00:00 UTC,Latest news about ESS Projects & Applications | ESS News,2026-07-02 12:00:00+00:00
Alarm after herring gulls found covered in oil,https://www.bbc.co.uk/news/articles/cn07854ky4po?at_medium=RSS&at_campaign=rss,2026-07-02 12:55:56 UTC,BBC News,2026-07-02 12:55:56+00:00
"Tesla energy storage deployment over time, showing growth from 0.3 GWh in 2016 to 46.7 GWh in 2025, plus 22.3 GWh as of Q2 2026",https://www.ess-news.com/2026/07/02/tesla-deploys-13-5-gwh-of-energy-storage-in-q2/,2026-07-02 15:27:02 UTC,Latest news about ESS Projects & Applications | ESS News,2026-07-02 15:27:02+00:00
Rare American bird seen in Jersey for first time,https://www.bbc.co.uk/news/articles/cly78e07jzyo?at_medium=RSS&at_campaign=rss,2026-07-02 15:32:14 UTC,BBC News,2026-07-02 15:32:14+00:00
Extreme heat and high humidity hitting north-eastern US,https://www.bbc.co.uk/weather/videos/cjdg81ejk9ro?at_medium=RSS&at_campaign=rss,2026-07-02 16:31:29 UTC,BBC News,2026-07-02 16:31:29+00:00
Could a heatwave hit Taylor Swift's wedding?,https://www.bbc.co.uk/news/videos/c75ykqwgwl5o?at_medium=RSS&at_campaign=rss,2026-07-02 17:00:53 UTC,BBC News,2026-07-02 17:00:53+00:00
"How Antarctica got its ice sheets, and what happens when geopolitical relationships turn chilly in the Arctic",https://www.science.org/doi/10.1126/science.zzd5dms,2026-07-02 18:00:00 UTC,Science Magazine Podcast,2026-07-02 18:00:00+00:00
BBC Inside Science,https://www.bbc.co.uk/sounds/play/live:bbc_world_service_south_asia?at_medium=RSS&at_campaign=rss,2026-07-02 20:00:00 UTC,BBC News,2026-07-02 20:00:00+00:00
