title,link,published,source,pub_date
Xenopus IgX informs engineering strategies of IgM and IgG hexamers,https://www.science.org/doi/abs/10.1126/sciadv.aea3737?af=R,2025-11-05 08:00:00 UTC,AAAS: Science Advances: Table of Contents,2025-11-05 08:00:00+00:00
In situ structure of a gap junction–stomatin complex,https://www.science.org/doi/abs/10.1126/sciadv.aea8596?af=R,2025-11-05 08:00:00 UTC,AAAS: Science Advances: Table of Contents,2025-11-05 08:00:00+00:00
Universality in the small scales of turbulent Taylor-Couette flow,https://www.science.org/doi/abs/10.1126/sciadv.ady4417?af=R,2025-11-05 08:00:00 UTC,AAAS: Science Advances: Table of Contents,2025-11-05 08:00:00+00:00
Adhesive nonfibrotic bioelectronic interfaces on diverse peripheral nerves for long-term functional neuromodulation,https://www.science.org/doi/abs/10.1126/sciadv.adz3668?af=R,2025-11-05 08:00:00 UTC,AAAS: Science Advances: Table of Contents,2025-11-05 08:00:00+00:00
"Drivers of canyon incision in the Peruvian Andes: Tectonics, precipitation, and drainage basin capture",https://www.science.org/doi/abs/10.1126/sciadv.adz9285?af=R,2025-11-05 08:00:00 UTC,AAAS: Science Advances: Table of Contents,2025-11-05 08:00:00+00:00
Regiocontrolled hydrobromination of unactivated alkenes via direct and chain-walking pathways,https://www.science.org/doi/abs/10.1126/sciadv.adz7088?af=R,2025-11-05 08:00:00 UTC,AAAS: Science Advances: Table of Contents,2025-11-05 08:00:00+00:00
Creation of a black hole bomb instability in an electromagnetic system,https://www.science.org/doi/abs/10.1126/sciadv.adz4595?af=R,2025-11-05 08:00:00 UTC,AAAS: Science Advances: Table of Contents,2025-11-05 08:00:00+00:00
International trade regulations take a limited bite out of the shark fin trade,https://www.science.org/doi/abs/10.1126/sciadv.adz2821?af=R,2025-11-05 08:00:00 UTC,AAAS: Science Advances: Table of Contents,2025-11-05 08:00:00+00:00
Thalamo-hippocampal pathway determines aggression and self-harm,https://www.science.org/doi/abs/10.1126/sciadv.ady5540?af=R,2025-11-05 08:00:00 UTC,AAAS: Science Advances: Table of Contents,2025-11-05 08:00:00+00:00
Intrinsically charge-generating polymers with long-lived free carriers for efficient photon-to-hydrogen conversion,https://www.science.org/doi/abs/10.1126/sciadv.aea4191?af=R,2025-11-05 08:00:00 UTC,AAAS: Science Advances: Table of Contents,2025-11-05 08:00:00+00:00
Single-nucleus profiling highlights the all-brain echinoderm nervous system,https://www.science.org/doi/abs/10.1126/sciadv.adx7753?af=R,2025-11-05 08:00:00 UTC,AAAS: Science Advances: Table of Contents,2025-11-05 08:00:00+00:00
Dopamine and serotonin cotransmission filters striatonigral synaptic activity via 5-HT1B receptor activation,https://www.science.org/doi/abs/10.1126/sciadv.adx4577?af=R,2025-11-05 08:00:00 UTC,AAAS: Science Advances: Table of Contents,2025-11-05 08:00:00+00:00
The direct financial costs of having a family member incarcerated,https://www.science.org/doi/abs/10.1126/sciadv.adx2101?af=R,2025-11-05 08:00:00 UTC,AAAS: Science Advances: Table of Contents,2025-11-05 08:00:00+00:00
Spatially confined hydration for robust underwater adhesion,https://www.science.org/doi/abs/10.1126/sciadv.aea3097?af=R,2025-11-05 08:00:00 UTC,AAAS: Science Advances: Table of Contents,2025-11-05 08:00:00+00:00
Substantially underestimated winter CO2 sources of the Southern Ocean,https://www.science.org/doi/abs/10.1126/sciadv.aea0024?af=R,2025-11-05 08:00:00 UTC,AAAS: Science Advances: Table of Contents,2025-11-05 08:00:00+00:00
Focusing on family finances reveals actual cost of incarceration,https://www.science.org/doi/abs/10.1126/sciadv.aec7420?af=R,2025-11-05 08:00:00 UTC,AAAS: Science Advances: Table of Contents,2025-11-05 08:00:00+00:00
Sea surface warming and ocean-to-atmosphere feedback driven by large-scale offshore wind farms under seasonally stratified conditions,https://www.science.org/doi/abs/10.1126/sciadv.adw7603?af=R,2025-11-05 08:00:00 UTC,AAAS: Science Advances: Table of Contents,2025-11-05 08:00:00+00:00
Charting the nanotopography of inner hair cell synapses using MINFLUX nanoscopy,https://www.science.org/doi/abs/10.1126/sciadv.ady4344?af=R,2025-11-05 08:00:00 UTC,AAAS: Science Advances: Table of Contents,2025-11-05 08:00:00+00:00
[ASAP] Correction to “Discovery and Mechanism of a Diiron Enzyme in Ethylidene Azetidine Formation”,http://dx.doi.org/10.1021/jacs.5c18214,2025-11-05 10:09:39 UTC,Journal of the American Chemical Society: Latest Articles (ACS Publications),2025-11-05 10:09:39+00:00
[ASAP] Insights into the Catalytic Activity of a Metagenome-Derived Urethanase,http://dx.doi.org/10.1021/jacs.5c13147,2025-11-05 10:53:04 UTC,Journal of the American Chemical Society: Latest Articles (ACS Publications),2025-11-05 10:53:04+00:00
"Mystery group lived in central Argentina for millennia, ancient DNA reveals",https://www.science.org/content/article/mystery-group-lived-central-argentina-millennia-ancient-dna-reveals,2025-11-05 11:00:00 UTC,Latest News from Science Magazine,2025-11-05 11:00:00+00:00
[ASAP] Highly Sensitive Detection of Tyrosine and Neurotransmitters by Stereoselective Biosynthesis and Photochemically Induced Dynamic Nuclear Polarization,http://dx.doi.org/10.1021/jacs.5c11334,2025-11-05 11:51:17 UTC,Journal of the American Chemical Society: Latest Articles (ACS Publications),2025-11-05 11:51:17+00:00
[ASAP] Atoms and Bonds as Synergisms of Interacting Electrons and Nuclei. The Origin of Chemical Bonds in Polyatomic Molecules,http://dx.doi.org/10.1021/jacs.5c07438,2025-11-05 13:05:36 UTC,Journal of the American Chemical Society: Latest Articles (ACS Publications),2025-11-05 13:05:36+00:00
Mass‐Transfer Engineered Synthesis of Pitch‐Derived Hard Carbons for Enhanced Sodium Storage,https://advanced.onlinelibrary.wiley.com/doi/10.1002/aenm.202504973?af=R,2025-11-05 13:43:44 UTC,Wiley: Advanced Energy Materials: Table of Contents,2025-11-05 13:43:44+00:00
"Fabry–Pérot Matching Lossy Metasurface for Coordinated, Adaptive, and Ultra‐Broadband Visible‐Infrared‐Radar Compatible Camouflage",https://advanced.onlinelibrary.wiley.com/doi/10.1002/adma.202517422?af=R,2025-11-05 13:43:48 UTC,Wiley: Advanced Materials: Table of Contents,2025-11-05 13:43:48+00:00
Dynamic Bonding Enabled Ambient‐Driven Motors,https://onlinelibrary.wiley.com/doi/10.1002/anie.202518011?af=R,2025-11-05 13:43:54 UTC,Wiley: Angewandte Chemie International Edition: Table of Contents,2025-11-05 13:43:54+00:00
Turn‐On of Current‐Induced Spin Torque Upon Non‐collinear Antiferromagnetic Ordering in Delafossite PdCrO2,https://advanced.onlinelibrary.wiley.com/doi/10.1002/adma.202502670?af=R,2025-11-05 13:47:04 UTC,Wiley: Advanced Materials: Table of Contents,2025-11-05 13:47:04+00:00
Decoupling Photoinduced Lattice Evolution via Grain Spatial Isolation for Perovskite Solar Cells,https://advanced.onlinelibrary.wiley.com/doi/10.1002/adma.202511062?af=R,2025-11-05 13:49:26 UTC,Wiley: Advanced Materials: Table of Contents,2025-11-05 13:49:26+00:00
A Single‐Cell‐Inspired Self‐Enrichment Therapeutic Strategy Delays Intervertebral Disc Degeneration by Inhibiting Pyroptosis,https://advanced.onlinelibrary.wiley.com/doi/10.1002/adma.202516405?af=R,2025-11-05 13:50:10 UTC,Wiley: Advanced Materials: Table of Contents,2025-11-05 13:50:10+00:00
Light‐Driven Reconfigurable Logic in a Monolithic Perovskite Device via Nonlinear Photoresponse Switching,https://advanced.onlinelibrary.wiley.com/doi/10.1002/adma.202509566?af=R,2025-11-05 13:51:52 UTC,Wiley: Advanced Materials: Table of Contents,2025-11-05 13:51:52+00:00
Comprehensive Guide for the Rational Design of High‐Entropy Layered Transition Metal Oxide Cathodes for Sodium‐Ion Batteries,https://advanced.onlinelibrary.wiley.com/doi/10.1002/aenm.202504677?af=R,2025-11-05 13:53:06 UTC,Wiley: Advanced Energy Materials: Table of Contents,2025-11-05 13:53:06+00:00
Constructing Topological Vortex Domains in Polar Nano‐Regions Enables High‐Capacitive Energy Storage,https://advanced.onlinelibrary.wiley.com/doi/10.1002/adma.202518813?af=R,2025-11-05 13:54:20 UTC,Wiley: Advanced Materials: Table of Contents,2025-11-05 13:54:20+00:00
Oxygen‐Mediated Topological Growth of MoS2 for Symmetry‐Anisotropy Coengineered Ultrafast Electronic Switching,https://advanced.onlinelibrary.wiley.com/doi/10.1002/adma.202513984?af=R,2025-11-05 13:54:25 UTC,Wiley: Advanced Materials: Table of Contents,2025-11-05 13:54:25+00:00
Bio‐Orthogonally Labeled Orbitals‐Hybridizing Nanozymes Induce Tissue‐Resident NK Cells for Enhanced Photo‐Immunologic Therapy of Biofilms and Preventing Secondary Infection,https://advanced.onlinelibrary.wiley.com/doi/10.1002/adma.202503815?af=R,2025-11-05 13:54:28 UTC,Wiley: Advanced Materials: Table of Contents,2025-11-05 13:54:28+00:00
Mechanotyping of Organoids for Assessing Drug‐Induced Injuries,https://advanced.onlinelibrary.wiley.com/doi/10.1002/adma.202509675?af=R,2025-11-05 13:55:43 UTC,Wiley: Advanced Materials: Table of Contents,2025-11-05 13:55:43+00:00
"2D Open Framework Materials: Chemistry, Materials, and Applications",https://advanced.onlinelibrary.wiley.com/doi/10.1002/adma.202513499?af=R,2025-11-05 13:59:11 UTC,Wiley: Advanced Materials: Table of Contents,2025-11-05 13:59:11+00:00
Bioinspired Photothermal Superhydrophobic Metamaterial With Structured Micro‐Nano Crystal Arrays for Anti‐/De‐Icing,https://advanced.onlinelibrary.wiley.com/doi/10.1002/adma.202516655?af=R,2025-11-05 14:01:42 UTC,Wiley: Advanced Materials: Table of Contents,2025-11-05 14:01:42+00:00
Cosolvent Electrolyte Design for Li–S Batteries: Suppressing the Shuttle Effect via Phase Separation,https://advanced.onlinelibrary.wiley.com/doi/10.1002/adma.202515958?af=R,2025-11-05 14:02:38 UTC,Wiley: Advanced Materials: Table of Contents,2025-11-05 14:02:38+00:00
Biocompatible Nanozyme Shell‐Armed Probiotic with Inflammation Targeting and Scavenging Properties Enables Effective Treatment of Colitis,https://advanced.onlinelibrary.wiley.com/doi/10.1002/adma.202508532?af=R,2025-11-05 14:03:36 UTC,Wiley: Advanced Materials: Table of Contents,2025-11-05 14:03:36+00:00
Photoelectrochemical Glycerol Valorization Achieving an Internal Quantum Efficiency Over 180% via Current Doubling,https://advanced.onlinelibrary.wiley.com/doi/10.1002/adma.202516504?af=R,2025-11-05 14:12:08 UTC,Wiley: Advanced Materials: Table of Contents,2025-11-05 14:12:08+00:00
Synthesizer: Chemistry‐Aware Machine Learning for Precision Control of Nanocrystal Growth,https://advanced.onlinelibrary.wiley.com/doi/10.1002/adma.202509472?af=R,2025-11-05 14:13:29 UTC,Wiley: Advanced Materials: Table of Contents,2025-11-05 14:13:29+00:00
Breaking Bond‐Strain Lockstep in Multielectron Anodes,https://advanced.onlinelibrary.wiley.com/doi/10.1002/adma.202517295?af=R,2025-11-05 14:14:54 UTC,Wiley: Advanced Materials: Table of Contents,2025-11-05 14:14:54+00:00
Highly Active IrOx Formation on Strontium Manganite for Acidic Oxygen Evolution,https://advanced.onlinelibrary.wiley.com/doi/10.1002/adma.202515749?af=R,2025-11-05 14:21:17 UTC,Wiley: Advanced Materials: Table of Contents,2025-11-05 14:21:17+00:00
Spin–Orbit‐Driven Quarter Semimetals in Rhombohedral Graphene,https://advanced.onlinelibrary.wiley.com/doi/10.1002/adma.202512713?af=R,2025-11-05 14:22:39 UTC,Wiley: Advanced Materials: Table of Contents,2025-11-05 14:22:39+00:00
"The Rise of AIE‐Peptide Systems: Design Principles, Multifunctional Applications, and Future Perspectives",https://advanced.onlinelibrary.wiley.com/doi/10.1002/adma.202514134?af=R,2025-11-05 14:26:37 UTC,Wiley: Advanced Materials: Table of Contents,2025-11-05 14:26:37+00:00
Reactive Carbide‐Based Synthesis and Microstructure of NASICON Sodium Metal All Solid‐State Electrolyte,https://advanced.onlinelibrary.wiley.com/doi/10.1002/adma.202512961?af=R,2025-11-05 14:34:53 UTC,Wiley: Advanced Materials: Table of Contents,2025-11-05 14:34:53+00:00
A Pseudo‐Mytilus Edulis Foot Protein‐Based Hydrogel Adhesive with Osteo‐Vascular‐Immune Coupling Effects for Osteoporotic Bone‐Implant Integration,https://advanced.onlinelibrary.wiley.com/doi/10.1002/adma.202511840?af=R,2025-11-05 14:36:06 UTC,Wiley: Advanced Materials: Table of Contents,2025-11-05 14:36:06+00:00
Terracing Oxyphilic Platinum Sustains High‐Rate Ammonia Electrolysis and Fuel Cells,https://advanced.onlinelibrary.wiley.com/doi/10.1002/adma.202514467?af=R,2025-11-05 14:40:35 UTC,Wiley: Advanced Materials: Table of Contents,2025-11-05 14:40:35+00:00
Moisture‐Light Harvesting Enhanced Hydrovoltaic Electric Generation,https://advanced.onlinelibrary.wiley.com/doi/10.1002/adma.202515241?af=R,2025-11-05 14:41:46 UTC,Wiley: Advanced Materials: Table of Contents,2025-11-05 14:41:46+00:00
Trump U-turns to renominate billionaire for Nasa chief,https://www.bbc.com/news/articles/c78ze3r1xrro?at_medium=RSS&at_campaign=rss,2025-11-05 15:11:16 UTC,BBC News,2025-11-05 15:11:16+00:00
[ASAP] Polarization Engineering and Chemical Bond Reconstruction in Rare-Earth Hexagonal Manganite via Fe3+-Occupied B-Site Doping for Piezocatalytic Therapy and Ferroptosis,http://dx.doi.org/10.1021/jacs.5c14530,2025-11-05 15:51:29 UTC,Journal of the American Chemical Society: Latest Articles (ACS Publications),2025-11-05 15:51:29+00:00
[ASAP] Metallo-coiled Coil Stabilization via Chemical Cross-Linking: Implications for Gd(III)-Based MRI Contrast Agents,http://dx.doi.org/10.1021/jacs.5c13620,2025-11-05 16:03:03 UTC,Journal of the American Chemical Society: Latest Articles (ACS Publications),2025-11-05 16:03:03+00:00
[ASAP] Nitrite Reduction at Low Overpotentials on N-Doped Carbon: When Metal Single Atoms Become Poisons,http://dx.doi.org/10.1021/jacs.5c15469,2025-11-05 16:40:44 UTC,Journal of the American Chemical Society: Latest Articles (ACS Publications),2025-11-05 16:40:44+00:00
[ASAP] Cobalt-Catalyzed Double Carbonylation of Cyclopropenes through a Stereodivergent β-Alkenyl Ketene Pathway,http://dx.doi.org/10.1021/jacs.5c17134,2025-11-05 16:41:29 UTC,Journal of the American Chemical Society: Latest Articles (ACS Publications),2025-11-05 16:41:29+00:00
[ASAP] Structural and Mechanistic Insights into Bacterial Hydrazine Biosynthesis,http://dx.doi.org/10.1021/jacs.5c15949,2025-11-05 16:42:49 UTC,Journal of the American Chemical Society: Latest Articles (ACS Publications),2025-11-05 16:42:49+00:00
[ASAP] Electrochemical Deposition of an N-Heterocyclic Carbene (NHC) Functionalized CO2 Reduction Catalyst on Au Electrodes,http://dx.doi.org/10.1021/jacs.5c11267,2025-11-05 16:44:29 UTC,Journal of the American Chemical Society: Latest Articles (ACS Publications),2025-11-05 16:44:29+00:00
[ASAP] NO2 Adsorption on Oxygen-Modified Ag at Ambient Conditions,http://dx.doi.org/10.1021/jacs.5c16683,2025-11-05 17:06:52 UTC,Journal of the American Chemical Society: Latest Articles (ACS Publications),2025-11-05 17:06:52+00:00
[ASAP] Control of CO2 Electrocatalysis via Modularly Customizable Graphdiyne,http://dx.doi.org/10.1021/jacs.5c11774,2025-11-05 17:44:50 UTC,Journal of the American Chemical Society: Latest Articles (ACS Publications),2025-11-05 17:44:50+00:00
[ASAP] Ionic Liquids Anchored on Carbon Synchronize Ion-Electron Transport in Liquid- and Solid-State Sulfur Batteries,http://dx.doi.org/10.1021/acsenergylett.5c03148,2025-11-05 18:14:49 UTC,ACS Energy Letters: Latest Articles (ACS Publications),2025-11-05 18:14:49+00:00
[ASAP] Operando Cluster Catalysis via Coupled Surface–Subsurface Dynamics,http://dx.doi.org/10.1021/jacs.5c15920,2025-11-05 18:19:59 UTC,Journal of the American Chemical Society: Latest Articles (ACS Publications),2025-11-05 18:19:59+00:00
[ASAP] 0.5% Graphene Slashed 38.8 °C Supercooling in Plastic Crystals,http://dx.doi.org/10.1021/jacs.5c06886,2025-11-05 18:59:00 UTC,Journal of the American Chemical Society: Latest Articles (ACS Publications),2025-11-05 18:59:00+00:00
[ASAP] The Role of Edge States for Charge Carrier Separation in n = 1 2D Perovskites,http://dx.doi.org/10.1021/acsenergylett.5c03352,2025-11-05 19:37:34 UTC,ACS Energy Letters: Latest Articles (ACS Publications),2025-11-05 19:37:34+00:00
[ASAP] Ketoboronate as a Minimal Covalent-Reversible Tag for Targeted Lysosomal Degradation of Extracellular and Membrane Proteins,http://dx.doi.org/10.1021/jacs.5c16611,2025-11-05 19:47:31 UTC,Journal of the American Chemical Society: Latest Articles (ACS Publications),2025-11-05 19:47:31+00:00
[ASAP] Ammonia-Assisted Photosynthesis of Ethylene Glycol,http://dx.doi.org/10.1021/jacs.5c14704,2025-11-05 19:47:52 UTC,Journal of the American Chemical Society: Latest Articles (ACS Publications),2025-11-05 19:47:52+00:00
[ASAP] Frontiers of Ionic Liquids in Carbon Dioxide Separation and Valorization,http://dx.doi.org/10.1021/acs.chemrev.5c00329,2025-11-05 19:51:32 UTC,Chemical Reviews: Latest Articles (ACS Publications),2025-11-05 19:51:32+00:00
[ASAP] Total Synthesis of (+)-Resiniferatoxin via a Pyridinium Salt Photorearrangement,http://dx.doi.org/10.1021/jacs.5c16410,2025-11-05 20:00:00 UTC,Journal of the American Chemical Society: Latest Articles (ACS Publications),2025-11-05 20:00:00+00:00
"[ASAP] Development, Application, and Mechanistic Interrogation of a Dual Ni Catalysis Approach to Photoredox-Based C(sp3)–C(sp3) Cross-Coupling",http://dx.doi.org/10.1021/jacs.5c10906,2025-11-05 20:21:09 UTC,Journal of the American Chemical Society: Latest Articles (ACS Publications),2025-11-05 20:21:09+00:00
[ASAP] Visualizing the Invisible: Dual Click Imaging of Ruthenium-Based Photoactivated Chemotherapy Agents and Their DNA Synthesis Inhibition in Fixed Cancer Cells,http://dx.doi.org/10.1021/jacs.5c13249,2025-11-05 20:31:06 UTC,Journal of the American Chemical Society: Latest Articles (ACS Publications),2025-11-05 20:31:06+00:00
Electron transfer in catalysis: from fundamentals to strategies,http://pubs.rsc.org/en/Content/ArticleLanding/2025/CS/D4CS00600C,2025-11-06 00:00:00 UTC,RSC - Chem. Soc. Rev. latest articles,2025-11-06 00:00:00+00:00
An ATP-gated molecular switch orchestrates human messenger RNA export,https://www.nature.com/articles/s41586-025-09832-z,2025-11-06 00:00:00 UTC,Nature,2025-11-06 00:00:00+00:00
Author Correction: The emergence of transcriptional identity in somatosensory neurons,https://www.nature.com/articles/s41586-025-09817-y,2025-11-06 00:00:00 UTC,Nature,2025-11-06 00:00:00+00:00
Shadow scholars: inside Kenya’s multibillion-dollar fake-essay industry,https://www.nature.com/articles/d41586-025-03399-5,2025-11-06 00:00:00 UTC,Nature,2025-11-06 00:00:00+00:00
Electrochromic-based visualised flexible biosensing platforms: from single device to multifunctional device integration,http://pubs.rsc.org/en/Content/ArticleLanding/2025/CS/D5CS00386E,2025-11-06 00:00:00 UTC,RSC - Chem. Soc. Rev. latest articles,2025-11-06 00:00:00+00:00
"Activatable covalent labeling probes: design, mechanism, and biological applications",http://pubs.rsc.org/en/Content/ArticleLanding/2025/CS/D5CS00984G,2025-11-06 00:00:00 UTC,RSC - Chem. Soc. Rev. latest articles,2025-11-06 00:00:00+00:00
Author Correction: TNF-mediated inflammatory skin disease in mice with epidermis-specific deletion of IKK2,https://www.nature.com/articles/s41586-025-09789-z,2025-11-06 00:00:00 UTC,Nature,2025-11-06 00:00:00+00:00
Laser-driven spinel-type ceramics enabling NIR-II light sources for penetration optical imaging assisted by a guided filter network algorithm,https://www.sciencedirect.com/science/article/pii/S1369702125004584?dgcid=rss_sd_all,2025-11-06 00:00:00 UTC,ScienceDirect Publication: Materials Today,2025-11-06 00:00:00+00:00
Regulation of therapeutic protein release in response to circadian biomarkers,https://www.nature.com/articles/s41467-025-64761-9,2025-11-06 00:00:00 UTC,Nature Communications,2025-11-06 00:00:00+00:00
Plastics disposal as a climate decision,https://www.nature.com/articles/s41893-025-01682-x,2025-11-06 00:00:00 UTC,Nature Sustainability,2025-11-06 00:00:00+00:00
Iron/phosphine-catalyzed reductive cross-coupling to construct quaternary carbon centers,https://www.nature.com/articles/s41467-025-64781-5,2025-11-06 00:00:00 UTC,Nature Communications,2025-11-06 00:00:00+00:00
Addressing the Recurrent and Protracted Cholera Outbreaks in Africa: Challenges and the Way Forward,https://www.nature.com/articles/s41467-025-64789-x,2025-11-06 00:00:00 UTC,Nature Communications,2025-11-06 00:00:00+00:00
"An intranasal adjuvanted, recombinant influenza A/H5 vaccine primes against diverse H5N1 clades: a phase I trial",https://www.nature.com/articles/s41467-025-64686-3,2025-11-06 00:00:00 UTC,Nature Communications,2025-11-06 00:00:00+00:00
Memristor-based adaptive analog-to-digital conversion for efficient and accurate compute-in-memory,https://www.nature.com/articles/s41467-025-65233-w,2025-11-06 00:00:00 UTC,Nature Communications,2025-11-06 00:00:00+00:00
Effective descriptions of bosonic systems can be considered complete,https://www.nature.com/articles/s41467-025-64872-3,2025-11-06 00:00:00 UTC,Nature Communications,2025-11-06 00:00:00+00:00
PROTAC repurposing uncovers a noncanonical binding surface that mediates chemical degradation of nuclear receptors,https://www.nature.com/articles/s41467-025-64773-5,2025-11-06 00:00:00 UTC,Nature Communications,2025-11-06 00:00:00+00:00
‘Google Maps’ for Roman roads reveals vast extent of ancient network,https://www.nature.com/articles/d41586-025-03626-z,2025-11-06 00:00:00 UTC,Nature,2025-11-06 00:00:00+00:00
Quantifying the reasoning abilities of LLMs on clinical cases,https://www.nature.com/articles/s41467-025-64769-1,2025-11-06 00:00:00 UTC,Nature Communications,2025-11-06 00:00:00+00:00
Aqueous batteries beating the cold,https://www.nature.com/articles/s41893-025-01684-9,2025-11-06 00:00:00 UTC,Nature Sustainability,2025-11-06 00:00:00+00:00
Non-invasive bioinert room-temperature quantum sensor from silicon carbide qubits,https://www.nature.com/articles/s41563-025-02382-9,2025-11-06 00:00:00 UTC,Nature Materials,2025-11-06 00:00:00+00:00
First ever atlas of brain development shows how stem cells turn into neurons,https://www.nature.com/articles/d41586-025-03641-0,2025-11-06 00:00:00 UTC,Nature,2025-11-06 00:00:00+00:00
Dual modulation of coordination asymmetry and curvature unlocks record-level Zn-air battery performance with Fe-N-C single-atom catalysts,http://pubs.rsc.org/en/Content/ArticleLanding/2025/EE/D5EE04648C,2025-11-06 00:00:00 UTC,RSC - Energy Environ. Sci. latest articles,2025-11-06 00:00:00+00:00
Emerging quantum critical phase in a cluster spin-glass,https://academic.oup.com/nsr/advance-article/doi/10.1093/nsr/nwaf483/8316140?rss=1,2025-11-06 00:00:00 UTC,National Science Review Advance Access,2025-11-06 00:00:00+00:00
Primacy of lattice distortion over strain in platinum fuel cell nanoalloy catalysts,http://pubs.rsc.org/en/Content/ArticleLanding/2025/EE/D5EE04563K,2025-11-06 00:00:00 UTC,RSC - Energy Environ. Sci. latest articles,2025-11-06 00:00:00+00:00
Surface-Tension Induced High Packing Density Carbon Nanoribbons Film with Ultrahigh Volumetric Capacitance,http://pubs.rsc.org/en/Content/ArticleLanding/2025/EE/D5EE02047F,2025-11-06 00:00:00 UTC,RSC - Energy Environ. Sci. latest articles,2025-11-06 00:00:00+00:00
Global greenhouse gas emissions mitigation potential of existing and planned hydrogen projects,https://www.nature.com/articles/s41560-025-01892-9,2025-11-06 00:00:00 UTC,Nature Energy,2025-11-06 00:00:00+00:00
Magnetic keys unlock multichamber capsule robots for smart interventions in the digestive tract,https://academic.oup.com/nsr/advance-article/doi/10.1093/nsr/nwaf486/8316145?rss=1,2025-11-06 00:00:00 UTC,National Science Review Advance Access,2025-11-06 00:00:00+00:00
Publisher Correction: Quantification of enantiomorphs in chiral crystalline powders through three-dimensional electron diffraction,https://www.nature.com/articles/s41557-025-02020-6,2025-11-06 00:00:00 UTC,Nature Chemistry,2025-11-06 00:00:00+00:00
Molecular tools for decoding multicellular systems: from mechanisms to medicine,https://academic.oup.com/nsr/advance-article/doi/10.1093/nsr/nwaf473/8316129?rss=1,2025-11-06 00:00:00 UTC,National Science Review Advance Access,2025-11-06 00:00:00+00:00
Lifecycle of dynamic covalent polar-olefin macrocycles via entropy-driven ring-opening polymerization and closed-loop chemical recycling,https://academic.oup.com/nsr/advance-article/doi/10.1093/nsr/nwaf484/8316130?rss=1,2025-11-06 00:00:00 UTC,National Science Review Advance Access,2025-11-06 00:00:00+00:00
Electroactive ferrocene/ferrocenium redox coupling for shuttle-free aqueous zinc–iodine pouch cells,https://www.nature.com/articles/s41557-025-01986-7,2025-11-06 00:00:00 UTC,Nature Chemistry,2025-11-06 00:00:00+00:00
"To unearth their past, Amazonian people turn to ‘a language white men understand’",https://www.science.org/content/article/unearth-their-past-amazonian-people-turn-language-white-men-understand,2025-11-06 02:00:00 UTC,Latest News from Science Magazine,2025-11-06 02:00:00+00:00
How politicians soured on Europe’s biggest primate research center,https://www.science.org/content/article/how-politicians-soured-europe-s-biggest-primate-research-center,2025-11-06 02:00:00 UTC,Latest News from Science Magazine,2025-11-06 02:00:00+00:00
U.S. Congress considers sweeping ban on Chinese collaborations,https://www.science.org/content/article/u-s-congress-considers-sweeping-ban-chinese-collaborations,2025-11-06 03:15:00 UTC,Latest News from Science Magazine,2025-11-06 03:15:00+00:00
Bridging Organic and Inorganic Domains: Advances and Applications of Hybrid Materials in Electrocatalysis,https://advanced.onlinelibrary.wiley.com/doi/10.1002/aenm.202505010?af=R,2025-11-06 04:47:00 UTC,Wiley: Advanced Energy Materials: Table of Contents,2025-11-06 04:47:00+00:00
