title,link,source,published_str,pub_date,doi,abstract,abstract_source,must_have_abstract
"Final survival analysis of induction chemotherapy with lobaplatin and fluorouracil versus cisplatin and fluorouracil followed by concurrent chemoradiotherapy in nasopharyngeal carcinoma: a multicenter, randomized, phase 3 trial",https://www.nature.com/articles/s41467-026-69315-1,Nature Communications,2026-02-10 00:00:00 UTC,2026-02-10 00:00:00+00:00,,"In nasopharyngeal carcinoma, cisplatin is known to be associated with poor treatment compliance and notable side effects. More effective and safer platinum drugs are needed for the treatment of patients with nasopharyngeal carcinoma. In 2021, our multicenter, randomized, phase 3 trial reported that lobaplatin and fluorouracil induction chemotherapy plus concurrent chemoradiotherapy resulted in non-inferior survival and fewer toxic effects than did cisplatin-based therapy in nasopharyngeal carcinoma. Data from the 10-year survival analysis are updated here. With a median follow-up of 10.6 years in the intention-to-treat population, 10-year progression-free survival is 70.7% in the lobaplatin-based therapy group vs. 71.9% in the cisplatin-based therapy group (HR 1.02, 95% CI 0.72–1.43; log-rank p = 0.885). The difference between the groups is 1.2% (95% CI −6.7–9.1, pnon-inferiority = 0.015), which is lower than the prespecified non-inferiority margin of 10%. The results are similar when we analyze patients in the per-protocol population. In the univariable and multivariable analyses, stage is an independent prognostic factor for progression-free survival (p = 0.001). The subgroup analyses suggest that the non-inferiority of lobaplatin-based therapy did not differ among specific populations. The incidence of late toxic effects is similar between the therapy groups, except for grades 1–2 peripheral neuropathy (p = 0.033), grades 1–2 deafness/otitis (p = 0.021), and grades 1–2/3 nephrotoxicity (p = 0.005; p = 0.021), the incidence of which is greater in the cisplatin-based therapy group than in the lobaplatin-based therapy group. Our findings suggest that lobaplatin and fluorouracil induction chemotherapy plus lobaplatin-based concurrent chemoradiotherapy is an alternative doublet treatment strategy to cisplatin-based concurrent chemoradiotherapy in patients with locoregionally advanced nasopharyngeal carcinoma.",nature_html,0
Orbital effect induced finite-momentum pairing and Josephson vortex lattice melting in layered Ising superconductors,https://academic.oup.com/nsr/advance-article/doi/10.1093/nsr/nwag084/8471547?rss=1,National Science Review Advance Access,2026-02-10 00:00:00 UTC,2026-02-10 00:00:00+00:00,10.1093/nsr/nwag084/8471547,"The Fulde-Ferrell-Larkin-Ovchinnikov (FFLO) state is a fascinating superconducting phase characterized by a spatially modulated order parameter that occurs in unconventional superconductors under strong magnetic fields. In this study, we explore the impact of in-plane magnetic fields on the superconducting state in layered Ising superconductors. Our findings reveal the emergence of an orbital-effect-induced finite-momentum pairing state, which is coupled to Josephson vortices and is fundamentally different from the FFLO state. Notably, recent experiments have revealed an unexpected first-order phase transition in bulk Ising superconductors. Our theoretical analysis demonstrates that this phase transition is primarily driven by the melting of a Josephson vortex lattice. Furthermore, our calculations for both the in-plane upper critical field and the melting line are in excellent agreement with the experimental data. These results not only advance the understanding of novel field-induced phases in layered Ising superconductors, but also pave the way for controlling these exotic states through magnetic field manipulation.",rss_oup,0
Design of asymmetric electronic spring for stabilizing selective seawater oxidation,https://academic.oup.com/nsr/advance-article/doi/10.1093/nsr/nwag091/8471543?rss=1,National Science Review Advance Access,2026-02-10 00:00:00 UTC,2026-02-10 00:00:00+00:00,10.1093/nsr/nwag091/8471543,"The core in direct seawater electrolysis lies in developing efficient and corrosion-resistant electrocatalysts to suppress detrimental chloride oxidation reaction (ClOR). This work introduces an anodic electrocatalyst interface modulation strategy, revealing that NiFeOOH modified with Cr2O3 forms flexible Cr–O–Ni asymmetric bonds, which function as a dynamic ‘electronic spring’ during the oxygen evolution reaction (OER). The introduction of Cr2O3 selectively converts NiFeOOH into the active β",rss_oup,0
Crystalline nitrogen chain radical anions,https://www.nature.com/articles/s41557-025-02040-2,Nature Chemistry,2026-02-10 00:00:00 UTC,2026-02-10 00:00:00+00:00,,"Long-chain nitrogen ions and radicals ([Nn]x+/[Nn]x−, n > 3) are naturally occurring under the intense radiative conditions of the Earth’s ionosphere and those of other planetary bodies. However, the strong thermodynamic driving force to lose N2 renders these types of molecule extremely reactive under ambient conditions such that they can typically be studied only under extreme conditions, for example, at ultrahigh pressures (10 GPa to >200 GPa). Here we report the isolation of a series of five molecules featuring metal unsupported {N4}•− units under ambient conditions, with one derivative demonstrating remarkable multi-week long persistence in the solid state. Spectroscopic, crystallographic and computational studies provide insight into the bonding across the {N4}•− chain. Reactivity studies reveal that the chain can cleave into N1 and N3 fragments, and can act as a source of nitrene radical anions, an observation that such molecules could act as storable nitrogen group transfer reagents.",nature_html,0
Electric double layer overlapping effect in high-density sub-nanoclusters for enhanced acidic oxygen evolution reaction,http://pubs.rsc.org/en/Content/ArticleLanding/2026/EE/D5EE06950E,RSC - Energy Environ. Sci. latest articles,2026-02-10 00:00:00 UTC,2026-02-10 00:00:00+00:00,,"The electric double layer (EDL) overlapping between catalyst particles markedly modulates the local surface electric field, yet its influence on acidic oxygen evolution reaction (OER) performance remains elusive. Herein, we construct high-density RuO2 sub-nanoclusters (RuO2-SCs) anchored on an amorphous BNC support (RuO2-SCs/BNC) as a model, revealing that EDL overlapping between them elevates the compact layer potential at the catalyst surface. This physical field regulation synergistically enhances the H3O+ concentration gradient and boosts intermediate coverage, thereby promoting the formation of the key *OOH intermediate and lowering the energy barrier of the rate-determining step. Concurrently, it stabilizes the Ru-O bonds and markedly mitigates the dissolution of ruthenium active sites. Leveraging these advantages, the catalyst demonstrates exceptional acidic OER performance, with a low overpotential of 142 mV to reach 10 mA cm-2 and sustained stability for over 6300 hours. Moreover, it operates stably for 900 hours at 500 mA cm-2 in proton exchange membrane water electrolysis. This work elucidates EDL overlapping regulatory mechanism on acidic OER and provides a novel strategy to synergistically enhance electrocatalyst activity and stability.",rsc_html,0
Ultrafast scintillating metal-organic framework films,https://www.nature.com/articles/s41467-026-68546-6,Nature Communications,2026-02-10 00:00:00 UTC,2026-02-10 00:00:00+00:00,,"Compositionally engineered metal-organic frameworks are designed and used to fabricate ultrafast scintillating films. The inclusion of hafnium ions in the nodes of the metal-organic framework enhances the interaction with ionizing radiation, partially compensating for the low density of the porous material and increasing the scintillation yield. The high diffusivity of molecular excitons within the framed conjugated ligands allows bimolecular annihilation processes that partially quench the system luminescence, resulting in fast scintillation pulses in the hundreds of picoseconds time scale. Despite the quenching, the gain in scintillation yield achieved is large enough to maintain the film light yield above 104 ph MeV-1 under soft X-rays. These high efficiencies and fast emission kinetics are obtained at room temperature in a technologically attractive solid-state configuration, placing the metal-organic framework platform in a prominent position for the realization of the next generation of fast scintillation counters for high-energy physics studies and medical imaging applications.",nature_html,0
Ammonia synthesis at metallic Li/Ru interfaces under ambient conditions,https://www.cell.com/chem/fulltext/S2451-9294(25)00475-9?rss=yes,Chem,2026-02-10 00:00:00 UTC,2026-02-10 00:00:00+00:00,,"NH3 synthesis from N2 and H2 under mild conditions is a great challenge due to the extreme chemical inertness of N2. Here, by depositing Li atoms on a Ru surface to build highly active Li/Ru interfaces as catalytic sites, an efficient thermocatalytic conversion of N2 and H2 to NH3 is achieved under room temperature and ambient pressure. The metallic Li/Ru interface exhibits a significant synergetic effect, which facilitates both N2 dissociation and hydrogenation to NH3.",rss_cell,0
Triplet-triplet annihilation upconversion in covalent organic frameworks via interface and bulk exciton tunability,https://www.cell.com/chem/fulltext/S2451-9294(25)00477-2?rss=yes,Chem,2026-02-10 00:00:00 UTC,2026-02-10 00:00:00+00:00,,"The bulky substituents on the cyanine sensitizer not only enhance its triplet-state properties but also act as anchoring units, facilitating binding to the surface of an energy-level-matched, annihilator-incorporated COF. This strengthened interfacial connection promotes triplet exciton transfer, followed by long-range diffusion and triplet-triplet annihilation within the COF, ultimately resulting in bright yellow upconversion emission.",rss_cell,0
Bayesian optimization for chemical reactions,http://pubs.rsc.org/en/Content/ArticleLanding/2026/CS/D5CS00962F,RSC - Chem. Soc. Rev. latest articles,2026-02-10 00:00:00 UTC,2026-02-10 00:00:00+00:00,,"Bayesian optimization (BO) enables data-efficient optimization of complex chemical reactions by balancing exploration and exploitation in large, mixed-variable parameter spaces. This review provides an accessible introduction for chemists wishing to adopt BO, outlining the fundamentals of surrogate models, acquisition functions, and key mathematical concepts. Practical considerations are emphasized, including kernel design, representation of categorical variables, and strategies for multi-objective and batch optimization. Applications are comprehensively surveyed across experimental scales, from high-throughput platforms to automated flow reactors and larger-scale processes. Finally, emerging directions such as transfer learning and data reuse are discussed in the context of accelerating optimization campaigns and enabling more generalizable, data-driven strategies in chemistry.",rsc_html,0
Covalent organic frameworks for metal–gas batteries: fundamentals and applications,http://pubs.rsc.org/en/Content/ArticleLanding/2026/CS/D5CS00900F,RSC - Chem. Soc. Rev. latest articles,2026-02-10 00:00:00 UTC,2026-02-10 00:00:00+00:00,,"Metal–gas batteries (MGBs, e.g., Li–O2, Li–CO2, Zn–air batteries) are considered a promising candidate for next-generation energy conversion and storage systems due to their advantages of high energy density, environmental friendliness, and low cost. However, their practical applications are still limited by the slow kinetics of gas-involved reactions, insufficient electrolyte stability, and electrode passivation. Covalent organic frameworks (COFs) provide innovative solutions to break through these bottlenecks by virtue of their designable topology, high specific surface area, ordered pore channels and chemical stability. This review systematically summarizes the structural advantages of COFs in MGBs, and explores their synthesis strategies and electrocatalytic mechanisms. The application progress of COF-based materials as electrocatalysts, composite cathode materials, solid-state electrolytes, gas diffusion layers, etc. in Li–O2, Li–CO2 and Zn–air batteries is emphasized. In addition, this review deeply analyzes the current challenges faced by COF materials in MGBs and provides an outlook on the future development of COF materials in this field.",rsc_html,0
In situ gradient nanoprecipitation enables alloys with record-high as-cast strength−ductility synergy,https://academic.oup.com/nsr/advance-article/doi/10.1093/nsr/nwag094/8471554?rss=1,National Science Review Advance Access,2026-02-10 00:00:00 UTC,2026-02-10 00:00:00+00:00,10.1093/nsr/nwag094/8471554,"Direct manufacturing of alloys through casting is economical, user-friendly, and conducive to near-net-shape processing, and therefore of great application interest. However, as-cast alloys are rarely used directly, because without post-cast thermomechanical treatments, the solidification product is susceptible to coarse grains, compositional segregation, and particularly unsatisfying precipitates, which tend towards inadequate strength and brittleness. These ubiquitous disadvantages have long and seriously hindered practical applications. Here, through screening using thermodynamic calculations and calorimetric monitoring, we successfully landed non-equiatomic NiCoCrAlTaZrB complex-concentrated alloys (CCAs) to realize in situ",rss_oup,0
Daily briefing: Caffeine might reduce dementia risk and slow cognitive decline,https://www.nature.com/articles/d41586-026-00450-x,Nature,2026-02-10 00:00:00 UTC,2026-02-10 00:00:00+00:00,,,,0
Degraders of the dengue virus capsid protein exhibit differentiated pharmacology relative to capsid inhibitors,https://www.nature.com/articles/s41467-026-69263-w,Nature Communications,2026-02-10 00:00:00 UTC,2026-02-10 00:00:00+00:00,,"Due to the limited size of viral genomes, most viral proteins are multifunctional; yet most direct-acting antivirals are designed as single-function inhibitors. The dengue virus (DENV) capsid protein serves as a building block for new virions while also interacting with multiple host factors to remodel the cellular environment. Using established capsid inhibitor ST148 as a targeting ligand, we develop a DENV capsid degrader, RPG-01-132, that exhibits a broadened spectrum of activity against the four DENV serotypes and an ST148-resistant mutant virus. Using multiple approaches, we show that RPG-01-132’s sub-micromolar antiviral activity is due to CRL4CRBN-dependent degradation of capsid and that this mechanism disrupts capsid-related pathways required for productive infection, including infectious virus output and capsid-mediated antagonism of the interferon response. This pharmacology is well-differentiated from ST148, which interferes with assembly of new virions, but has no demonstrated effect on the capsid’s nonstructural functions. These findings demonstrate that targeted protein degradation can thus enable antiviral pharmacology not observed with conventional antiviral inhibitors and that is resilient to point mutations that reduce inhibitor potency.",nature_html,0
Dynamic chromium dopant promotes interfacial water activation on cobalt spinel oxide for efficient oxygen evolution in acid,https://www.nature.com/articles/s41467-026-69124-6,Nature Communications,2026-02-10 00:00:00 UTC,2026-02-10 00:00:00+00:00,,"Although cobalt spinel oxide-based catalysts have demonstrated promising performance for the oxygen evolution reaction in acid, strategies reported have largely focused on manipulating the binding energies of reaction intermediates through tailoring the inherent electronic structures. The role of interfacial water structures on the electrode surface in promoting the acidic oxygen evolution reaction performance through controlled water activation has been largely overlooked. Here we show that introducing chromium dopant into cobalt spinel oxide can simultaneously increase the activity and stability by promoting interfacial water dissociation and dynamic electron transfer. The chromium dopant can not only dynamically regulate the electronic structure of cobalt and mitigate the over-oxidation of active cobalt sites at high overpotential, but also enhance the coverage of hydroxyl species on the catalyst surface, thereby optimizing the interfacial water structure, accelerating the reactant free-water supply and promoting subsequent interfacial water dissociation. Consequently, the obtained catalyst demonstrates enhanced performance in both solution electrocatalysis and device electrocatalysis. This work provides a comprehensive understanding of enhancing the acidic oxygen evolution reaction performance by promoting interfacial water dissociation.",nature_html,0
What can we learn from US national transmission studies?,https://www.cell.com/joule/fulltext/S2542-4351(26)00023-1?rss=yes,Joule,2026-02-10 00:00:00 UTC,2026-02-10 00:00:00+00:00,,"A review of seven US national power system studies shows that significant transmission expansion, including at least a doubling of the current grid, is cost-optimal for serving new demand, integrating additional resources, and supporting grid reliability. The results are derived through multi-value, nationally coordinated, co-optimized, multi-scenario modeling, which provides lessons that could be adapted in current industry planning practices to yield lower-cost pathways.",rss_cell,0
Electrosynthesis of ethylene from syngas,https://www.nature.com/articles/s41893-025-01764-w,Nature Sustainability,2026-02-10 00:00:00 UTC,2026-02-10 00:00:00+00:00,,"The electrochemical carbon monoxide reduction (COR) reaction offers a carbon- and energy-efficient pathway to ethylene. However, present systems typically rely on pure CO, making the process costly and difficult to scale. An economically feasible alternative is to use syngas—the predominant industrial CO source—produced globally at quantities approximately 250 times higher than pure CO, but containing hydrogen and other components. Therefore, for a syngas-based COR system, achieving high single-pass conversion efficiency (SPCE) is essential, as high gas flow rates introduce excess hydrogen, complicating and increasing the cost of downstream product separation. Nevertheless, optimizing SPCE leads to hydrogen dilution and insufficient CO transport to the copper cathode, which in turn decreases ethylene Faradaic efficiency (FE). To overcome this trade-off, guided by Raman spectroscopy and density functional theory, here we develop a COOH-functionalized active carbon material which captures CO from syngas, strengthens CO adsorption on the copper cathode and thereby enhances ethylene FE even under CO-diluted conditions. This design enables an ethylene FE of 72% alongside a CO SPCE of 73% in a simulated syngas containing an H2/CO ratio of 2/1—outperforming reported systems operated with pure CO feed and offering a more scalable, resource-efficient route to sustainable ethylene.",nature_html,0
Large‐Capacity Rechargeable Silicon–Hydrogen Gas Battery,https://advanced.onlinelibrary.wiley.com/doi/10.1002/aenm.202505031?af=R,Wiley: Advanced Energy Materials: Table of Contents,2026-02-10 04:50:09 UTC,2026-02-10 04:50:09+00:00,10.1002/aenm.202505031,"ABSTRACT
                  
                    Silicon (Si) is an important energy storage material that promotes the development of advanced battery technology. At present, Si as an anode has been widely explored in theory and experiment, but its performance in energy storage has not yet reached the theoretical capacity limit. Here, we design a new silicon–hydrogen gas (Si–H
                    2
                    ) battery combining the alloying reaction of nano Si anode with the hydrogen evolution and oxidation reactions (HER/HOR) of hydrogen gas (H
                    2
                    ) cathode. Systematic electrochemical studies show that the Si–H
                    2
                    battery has a discharge capacity of ∼3400 mAh g
                    −1
                    with a discharge voltage of ∼2.45 V, and a lifetime of more than 100 cycles. The Si–H
                    2
                    battery also efficiently operates from 10°C to 80°C with excellent electrochemical performance. It can achieve high‐rate charge and discharge of 8 C at 60°C, and can stably cycle for more than 500 h. This work provides a new concept for promoting the application of hydrogen battery in energy storage and improving the capacity utilization of Si.",crossref,0
Multifaceted Molecular Design Enables Comprehensive Luminescence Modulation in Metalloligand‐Stabilized Gold Nanoclusters,https://onlinelibrary.wiley.com/doi/10.1002/anie.202518269?af=R,Wiley: Angewandte Chemie International Edition: Table of Contents,2026-02-10 04:50:35 UTC,2026-02-10 04:50:35+00:00,10.1002/anie.202518269,"ABSTRACT
                  
                    Photoluminescent metal nanoclusters hold promise for optoelectronics, photonics, and chemosensing, yet systematic modulation of their emission within a single system remains challenging. Here, we report two isostructural clusters,
                    
                      Au
                      13
                      @Au
                      3
                      ‐Cl
                    
                    and
                    
                      Au
                      9
                      Cu
                      4
                      @Au
                      3
                      ‐Cl
                    
                    , stabilized by a tridentate phosphine (NP
                    3
                    ) metalloligand. Both adopt an unprecedented “Au
                    9
                    M
                    4
                    (Au/Cu) icosahedron + Au
                    3
                    crown” configuration and exhibit high solid‐state PLQYs of 44.5% and 38.9%, respectively. In contrast, replacing NP
                    3
                    with a monophosphine ligand (BPP) affords
                    
                      Au
                      9
                      Cu
                      4
                      ‐Cl
                    
                    lacking the Au
                    3
                    crown, with a dramatically reduced PLQY of 0.6%, highlighting the crucial roles of NP
                    3
                    and the Au
                    3
                    crown in boosting luminescence. Distinct photophysical behaviors are observed:
                    
                      Au
                      13
                      @Au
                      3
                      ‐Cl
                    
                    shows phosphorescence, while
                    
                      Au
                      9
                      Cu
                      4
                      @Au
                      3
                      ‐Cl
                    
                    exhibits thermally activated delayed fluorescence (TADF), confirmed by femtosecond transient absorption spectroscopy. The role of Cu doping is further supported by the TADF activity of
                    
                      Au
                      9
                      Cu
                      4
                      ‐Cl
                    
                    . Coordinating anion substitution also modulates emission, with iodide promoting TADF in
                    
                      Au
                      13
                      @Au
                      3
                      ‐I
                    
                    . Moreover, the NP
                    3
                    ligand confers reversible protonation‐induced luminescence switching, enabling chemosensing potential. Collectively, these findings demonstrate a comprehensive investigation of TADF behavior and luminescence modulation in atomically precise metal nanoclusters, systematically engineered through heteroatom doping of the inner core, ligand design and anion exchange at the coordination surface, and outer‐sphere complexation and protonation.",crossref,0
