title,link,published,source,pub_date
Understanding the Entropy Decoupling for Ion Transport in Ordered Biomimetic Materials Toward Durable Aqueous Zinc Metal Batteries,https://onlinelibrary.wiley.com/doi/10.1002/anie.202522157?af=R,2025-12-17 08:57:30 UTC,Wiley: Angewandte Chemie International Edition: Table of Contents,2025-12-17 08:57:30+00:00
Programmable Antigen‐Specific Immunity via Self‐Adjuvanting Nanovaccines Co‐Delivering Immune Modulators,https://onlinelibrary.wiley.com/doi/10.1002/anie.202520474?af=R,2025-12-17 08:58:09 UTC,Wiley: Angewandte Chemie International Edition: Table of Contents,2025-12-17 08:58:09+00:00
Molecular Cages as Probes in Indicator Displacement Assays: The Case of Scopolamine Detection,https://onlinelibrary.wiley.com/doi/10.1002/anie.202523575?af=R,2025-12-17 08:58:15 UTC,Wiley: Angewandte Chemie International Edition: Table of Contents,2025-12-17 08:58:15+00:00
Nitrogen‐Shift‐Engineered Pt Single‐Atom/Cluster Synergy Boosts Covalent Organic Frameworks for Photocatalytic Hydrogen Evolution,https://onlinelibrary.wiley.com/doi/10.1002/anie.202524704?af=R,2025-12-17 09:01:10 UTC,Wiley: Angewandte Chemie International Edition: Table of Contents,2025-12-17 09:01:10+00:00
Twist and Shine: The Impact of Halogen Substitution on Thiele Hydrocarbon's Optical Properties,https://onlinelibrary.wiley.com/doi/10.1002/anie.202524043?af=R,2025-12-17 09:02:16 UTC,Wiley: Angewandte Chemie International Edition: Table of Contents,2025-12-17 09:02:16+00:00
[ASAP] Hydrated Electrons Bypass the −1.9 V Activation Barrier in Electrochemical CO2 Reduction,http://dx.doi.org/10.1021/jacs.5c15039,2025-12-17 09:19:19 UTC,Journal of the American Chemical Society: Latest Articles (ACS Publications),2025-12-17 09:19:19+00:00
[ASAP] Bridging a Gap in Marine Sulfur Cycling: Discovery of a d-Cysteinolic Acid Degradation Pathway,http://dx.doi.org/10.1021/jacs.5c11066,2025-12-17 09:39:18 UTC,Journal of the American Chemical Society: Latest Articles (ACS Publications),2025-12-17 09:39:18+00:00
[ASAP] Solvent Polarity Independent Symmetry-Breaking Charge Separation in a Slip-Stacked Covalent Terrylene Monoimide Dimer,http://dx.doi.org/10.1021/jacs.5c17847,2025-12-17 10:53:47 UTC,Journal of the American Chemical Society: Latest Articles (ACS Publications),2025-12-17 10:53:47+00:00
Stability Thresholds of Atomically Dispersed Platinum Catalysts for Solar Hydrogen Production,https://onlinelibrary.wiley.com/doi/10.1002/anie.202522214?af=R,2025-12-17 11:25:16 UTC,Wiley: Angewandte Chemie International Edition: Table of Contents,2025-12-17 11:25:16+00:00
Pulsed Electrolysis Promotes CO2 Electroreduction to Multicarbon Products by Suppressing Electrolyte Flooding,https://onlinelibrary.wiley.com/doi/10.1002/anie.202521745?af=R,2025-12-17 11:26:56 UTC,Wiley: Angewandte Chemie International Edition: Table of Contents,2025-12-17 11:26:56+00:00
Molecular Integration Strategy Enables Simultaneous Modulation of Crystal Growth and Interfacial Energy Loss for Efficient Inverted Perovskite Solar Cells,https://onlinelibrary.wiley.com/doi/10.1002/anie.202524806?af=R,2025-12-17 11:39:49 UTC,Wiley: Angewandte Chemie International Edition: Table of Contents,2025-12-17 11:39:49+00:00
Plasmonic Hot‐Carrier Redox Enables Proton‐Coupled Electron Transfer at C─H Bonds,https://onlinelibrary.wiley.com/doi/10.1002/anie.202518818?af=R,2025-12-17 11:40:15 UTC,Wiley: Angewandte Chemie International Edition: Table of Contents,2025-12-17 11:40:15+00:00
Differential Adsorption on Synergistic Cu─Cd Sites Enables Direct Hydrogenation in Acidic CO2 Electroreduction,https://onlinelibrary.wiley.com/doi/10.1002/anie.202522764?af=R,2025-12-17 11:45:41 UTC,Wiley: Angewandte Chemie International Edition: Table of Contents,2025-12-17 11:45:41+00:00
Facet‐Engineered Anatase TiO2 Nanoflowers with Anchored Single‐Atom Pd for Ultrafast Hydrogen Storage Kinetics,https://advanced.onlinelibrary.wiley.com/doi/10.1002/aenm.202505141?af=R,2025-12-17 11:48:14 UTC,Wiley: Advanced Energy Materials: Table of Contents,2025-12-17 11:48:14+00:00
[ASAP] Electropolymerization of Organic Mixed Ionic-Electronic Conductors: Fundamentals and Applications in Bioelectronics,http://dx.doi.org/10.1021/acs.chemrev.5c00183,2025-12-17 12:15:37 UTC,Chemical Reviews: Latest Articles (ACS Publications),2025-12-17 12:15:37+00:00
Chile’s new president could shake up nation’s science community,https://www.science.org/content/article/chile-s-new-president-could-shake-nation-s-science-community,2025-12-17 12:30:34 UTC,Latest News from Science Magazine,2025-12-17 12:30:34+00:00
[ASAP] Intrinsically Bifunctional and Tunable Tungsten Carbide Catalysts Enable Efficient PVC-Compatible Polyolefin Hydrocracking,http://dx.doi.org/10.1021/jacs.5c11845,2025-12-17 12:41:45 UTC,Journal of the American Chemical Society: Latest Articles (ACS Publications),2025-12-17 12:41:45+00:00
"[ASAP] Direct Catalytic Enantioselective C(sp2)–H Allylation of Acrylic Acids: Modular Access to Chiral 1,4-Skipped Dienes",http://dx.doi.org/10.1021/jacs.5c17825,2025-12-17 12:42:25 UTC,Journal of the American Chemical Society: Latest Articles (ACS Publications),2025-12-17 12:42:25+00:00
"[ASAP] Actifensin Evolution in the Human Oral Cavity over the Past 100,000 Years",http://dx.doi.org/10.1021/jacs.5c14335,2025-12-17 12:42:30 UTC,Journal of the American Chemical Society: Latest Articles (ACS Publications),2025-12-17 12:42:30+00:00
[ASAP] Amphiphilic Fluorinated Block Copolymer Additives for Ultrastable Aqueous Zn-Ion Batteries,http://dx.doi.org/10.1021/jacs.5c14364,2025-12-17 13:34:52 UTC,Journal of the American Chemical Society: Latest Articles (ACS Publications),2025-12-17 13:34:52+00:00
A Radical Cascade with Double Intramolecular Hydrogen Atom Transfer for the Generation of Bisfunctionalized Cyclopentanes from Linear Alkynes,https://onlinelibrary.wiley.com/doi/10.1002/anie.202524431?af=R,2025-12-17 14:00:44 UTC,Wiley: Angewandte Chemie International Edition: Table of Contents,2025-12-17 14:00:44+00:00
Precise Surface Engineering of Metal Nanoclusters: Ligand Programming for Functionality Design,https://advanced.onlinelibrary.wiley.com/doi/10.1002/adma.202508578?af=R,2025-12-17 14:13:34 UTC,Wiley: Advanced Materials: Table of Contents,2025-12-17 14:13:34+00:00
Materials Design and Assessment of Redox‐Mediated Flow Cell Systems for Enhanced Energy Storage and Conversion,https://advanced.onlinelibrary.wiley.com/doi/10.1002/adma.202509991?af=R,2025-12-17 14:13:34 UTC,Wiley: Advanced Materials: Table of Contents,2025-12-17 14:13:34+00:00
Galvanic‐Cell‐Based Self‐Powered Bioelectronic Devices,https://advanced.onlinelibrary.wiley.com/doi/10.1002/adma.202509169?af=R,2025-12-17 14:13:34 UTC,Wiley: Advanced Materials: Table of Contents,2025-12-17 14:13:34+00:00
Surface Energy‐Confined Multi‐Layer Inkjet Printing for Customizable Optical Microstructures,https://advanced.onlinelibrary.wiley.com/doi/10.1002/adma.202509818?af=R,2025-12-17 14:13:34 UTC,Wiley: Advanced Materials: Table of Contents,2025-12-17 14:13:34+00:00
De‐Saturation of Single‐Atom Copper Catalysts for Accelerating Propargylic Substitution Reactions,https://advanced.onlinelibrary.wiley.com/doi/10.1002/adma.202509221?af=R,2025-12-17 14:13:34 UTC,Wiley: Advanced Materials: Table of Contents,2025-12-17 14:13:34+00:00
Tailoring Graphite Interlayers with Electron‐Acceptor Bridges Raises Ion Diffusion Kinetics for Ultrafast Charging Batteries,https://advanced.onlinelibrary.wiley.com/doi/10.1002/adma.202509207?af=R,2025-12-17 14:13:34 UTC,Wiley: Advanced Materials: Table of Contents,2025-12-17 14:13:34+00:00
Ce Single Atom‐Engineered Amorphous/Crystalline Nanosheets for Enhanced Alkaline Water Electrolysis,https://advanced.onlinelibrary.wiley.com/doi/10.1002/adma.202508893?af=R,2025-12-17 14:13:34 UTC,Wiley: Advanced Materials: Table of Contents,2025-12-17 14:13:34+00:00
3D Photonic Metacrystals with Enhanced Collective Mie Resonances for Dual Structural Coloration,https://advanced.onlinelibrary.wiley.com/doi/10.1002/adma.202504222?af=R,2025-12-17 14:13:34 UTC,Wiley: Advanced Materials: Table of Contents,2025-12-17 14:13:34+00:00
Materials Innovation at the National University of Singapore: A Special Issue Dedicated to the 120th Anniversary,https://advanced.onlinelibrary.wiley.com/doi/10.1002/adma.202522375?af=R,2025-12-17 14:13:34 UTC,Wiley: Advanced Materials: Table of Contents,2025-12-17 14:13:34+00:00
Issue Information,https://advanced.onlinelibrary.wiley.com/doi/10.1002/adma.71622?af=R,2025-12-17 14:13:34 UTC,Wiley: Advanced Materials: Table of Contents,2025-12-17 14:13:34+00:00
De‐Saturation of Single‐Atom Copper Catalysts for Accelerating Propargylic Substitution Reactions (Adv. Mater. 50/2025),https://advanced.onlinelibrary.wiley.com/doi/10.1002/adma.71618?af=R,2025-12-17 14:13:34 UTC,Wiley: Advanced Materials: Table of Contents,2025-12-17 14:13:34+00:00
Recent Advances in Impurity‐Induced Room‐Temperature Phosphorescence (Adv. Mater. 50/2025),https://advanced.onlinelibrary.wiley.com/doi/10.1002/adma.71619?af=R,2025-12-17 14:13:34 UTC,Wiley: Advanced Materials: Table of Contents,2025-12-17 14:13:34+00:00
Precise Surface Engineering of Metal Nanoclusters: Ligand Programming for Functionality Design (Adv. Mater. 50/2025),https://advanced.onlinelibrary.wiley.com/doi/10.1002/adma.71620?af=R,2025-12-17 14:13:34 UTC,Wiley: Advanced Materials: Table of Contents,2025-12-17 14:13:34+00:00
Materials Innovation at the National University of Singapore: A Special Issue Dedicated to the 120th Anniversary (Adv. Mater. 50/2025),https://advanced.onlinelibrary.wiley.com/doi/10.1002/adma.71621?af=R,2025-12-17 14:13:34 UTC,Wiley: Advanced Materials: Table of Contents,2025-12-17 14:13:34+00:00
Bio‐Resorbable Magnetic Tunnel Junctions,https://advanced.onlinelibrary.wiley.com/doi/10.1002/adma.202507912?af=R,2025-12-17 14:13:34 UTC,Wiley: Advanced Materials: Table of Contents,2025-12-17 14:13:34+00:00
From Pollution to Value: Electrochemical Systems for Transforming Flue Gas into Chemicals and Fuels,https://advanced.onlinelibrary.wiley.com/doi/10.1002/adma.202509581?af=R,2025-12-17 14:13:34 UTC,Wiley: Advanced Materials: Table of Contents,2025-12-17 14:13:34+00:00
"2D Open Framework Materials: Chemistry, Materials, and Applications",https://advanced.onlinelibrary.wiley.com/doi/10.1002/adma.202513499?af=R,2025-12-17 14:13:34 UTC,Wiley: Advanced Materials: Table of Contents,2025-12-17 14:13:34+00:00
Design Strategies and Roles of Hydrogels for Sustainable Energy Conversion and Harvesting from Natural and Biological Environments,https://advanced.onlinelibrary.wiley.com/doi/10.1002/adma.202510270?af=R,2025-12-17 14:13:34 UTC,Wiley: Advanced Materials: Table of Contents,2025-12-17 14:13:34+00:00
Advances in Intelligent Nano‐Micro‐Scale Sensors and Actuators: Moving toward Self‐Sustained Edge AI Microsystems,https://advanced.onlinelibrary.wiley.com/doi/10.1002/adma.202510417?af=R,2025-12-17 14:13:34 UTC,Wiley: Advanced Materials: Table of Contents,2025-12-17 14:13:34+00:00
Advancing the Frontiers of HfO2‐Based Ferroelectric Memories: Innovative Concepts from Materials to Applications,https://advanced.onlinelibrary.wiley.com/doi/10.1002/adma.202509525?af=R,2025-12-17 14:13:34 UTC,Wiley: Advanced Materials: Table of Contents,2025-12-17 14:13:34+00:00
Recent Advances in Impurity‐Induced Room‐Temperature Phosphorescence,https://advanced.onlinelibrary.wiley.com/doi/10.1002/adma.202506549?af=R,2025-12-17 14:13:34 UTC,Wiley: Advanced Materials: Table of Contents,2025-12-17 14:13:34+00:00
HZO/HSO Superlattice ReFET Array Integrating Optical Sensing for Neuromorphic Vision Computing,https://advanced.onlinelibrary.wiley.com/doi/10.1002/adma.202508889?af=R,2025-12-17 14:13:34 UTC,Wiley: Advanced Materials: Table of Contents,2025-12-17 14:13:34+00:00
"Rhus Chinensis ‐ Inspired Vertical Hierarchical Structure for Solar ‐ Driven All ‐ Weather Co ‐ Harvesting of Fresh Water, Clean Salts, and Authigenic Electricity",https://advanced.onlinelibrary.wiley.com/doi/10.1002/adma.202506762?af=R,2025-12-17 14:13:34 UTC,Wiley: Advanced Materials: Table of Contents,2025-12-17 14:13:34+00:00
Reconfigurable Magnetotransport in MnBi2Te4 via Gate and Magnetic Field Tuning,https://advanced.onlinelibrary.wiley.com/doi/10.1002/adma.202510734?af=R,2025-12-17 14:13:34 UTC,Wiley: Advanced Materials: Table of Contents,2025-12-17 14:13:34+00:00
Zinc‐Coordinated Trienzyme Nanogel Cascade Therapy for Accelerated Post‐Pancreatectomy Cutaneous Wound Healing,https://advanced.onlinelibrary.wiley.com/doi/10.1002/adma.202508538?af=R,2025-12-17 14:13:34 UTC,Wiley: Advanced Materials: Table of Contents,2025-12-17 14:13:34+00:00
Targeted ROS Scavenging for Disease Therapies Using Nanomaterials,https://advanced.onlinelibrary.wiley.com/doi/10.1002/adma.202504435?af=R,2025-12-17 14:13:34 UTC,Wiley: Advanced Materials: Table of Contents,2025-12-17 14:13:34+00:00
Self‐Spiking Linear Neuromorphic Soft Pressure Sensor for Underwater Sensing Applications,https://advanced.onlinelibrary.wiley.com/doi/10.1002/adma.202505486?af=R,2025-12-17 14:13:34 UTC,Wiley: Advanced Materials: Table of Contents,2025-12-17 14:13:34+00:00
Advances in In Vitro Modeling of Cancer‐Stromal Interactions: From Fundamental Insights to Translational Applications,https://advanced.onlinelibrary.wiley.com/doi/10.1002/adma.202512252?af=R,2025-12-17 14:13:34 UTC,Wiley: Advanced Materials: Table of Contents,2025-12-17 14:13:34+00:00
Spatially Programmable Electroadhesive Enables In Situ Site‐Selective Functional Coupling,https://advanced.onlinelibrary.wiley.com/doi/10.1002/adma.202511039?af=R,2025-12-17 14:13:34 UTC,Wiley: Advanced Materials: Table of Contents,2025-12-17 14:13:34+00:00
Dry Transfer of CVD Graphene Film Using Adhesion Switchable Ferroelectric Polymers,https://advanced.onlinelibrary.wiley.com/doi/10.1002/adma.202510545?af=R,2025-12-17 14:13:34 UTC,Wiley: Advanced Materials: Table of Contents,2025-12-17 14:13:34+00:00
Utilize Natural Forces in Water Treatment Through 3D‐Printed Structures: From Purification to Clean Energy,https://advanced.onlinelibrary.wiley.com/doi/10.1002/adma.202509185?af=R,2025-12-17 14:13:34 UTC,Wiley: Advanced Materials: Table of Contents,2025-12-17 14:13:34+00:00
Perovskite Tandems: the Next Big Leap in Photovoltaic Technology,https://advanced.onlinelibrary.wiley.com/doi/10.1002/adma.202508331?af=R,2025-12-17 14:13:34 UTC,Wiley: Advanced Materials: Table of Contents,2025-12-17 14:13:34+00:00
[ASAP] Decoding the Oxygen Activity with Iron through Ligand-to-Metal Charge Transfer in Li-Rich Layered Cathodes,http://dx.doi.org/10.1021/jacs.5c10485,2025-12-17 14:18:08 UTC,Journal of the American Chemical Society: Latest Articles (ACS Publications),2025-12-17 14:18:08+00:00
[ASAP] Suppressing Fe Migration for Highly Reversible Oxygen Redox of Sodium-Ion Layered Oxide Cathode,http://dx.doi.org/10.1021/jacs.5c15943,2025-12-17 14:19:07 UTC,Journal of the American Chemical Society: Latest Articles (ACS Publications),2025-12-17 14:19:07+00:00
[ASAP] Reconciling the Stability-Activity Dilemma on Perovskite Oxide Electrode Surfaces with Oxygen-Deficient ZrOx Nanocoatings,http://dx.doi.org/10.1021/acsenergylett.5c03514,2025-12-17 15:38:43 UTC,ACS Energy Letters: Latest Articles (ACS Publications),2025-12-17 15:38:43+00:00
[ASAP] Telecom-Luminescent and Room Temperature Coherent Tetrathiafulvalene-Based Qubits in Spin-Rich Solids,http://dx.doi.org/10.1021/jacs.5c12570,2025-12-17 17:37:12 UTC,Journal of the American Chemical Society: Latest Articles (ACS Publications),2025-12-17 17:37:12+00:00
Spain to open network of climate shelters,https://www.bbc.com/news/articles/c5yj8ew1pnlo?at_medium=RSS&at_campaign=rss,2025-12-17 17:50:37 UTC,BBC News,2025-12-17 17:50:37+00:00
[ASAP] Hybrid Perovskites beyond Photovoltaics: Unlocking Multifunctional Energy and Optoelectronic Applications,http://dx.doi.org/10.1021/acsenergylett.5c03409,2025-12-17 18:11:37 UTC,ACS Energy Letters: Latest Articles (ACS Publications),2025-12-17 18:11:37+00:00
"[ASAP] Convergent Evolution: Self-Assembly of Small Molecule, Polymeric, and Inorganic Contrast Agents toward Advanced MRI",http://dx.doi.org/10.1021/jacs.4c11767,2025-12-17 19:33:22 UTC,Journal of the American Chemical Society: Latest Articles (ACS Publications),2025-12-17 19:33:22+00:00
[ASAP] Determination of Magnetic Anisotropy Tensors in Actinide Complexes Using Torque Magnetometry: A U(IV) Case Study,http://dx.doi.org/10.1021/jacs.5c16992,2025-12-17 19:44:23 UTC,Journal of the American Chemical Society: Latest Articles (ACS Publications),2025-12-17 19:44:23+00:00
[ASAP] Cascade Dearomative Hydride Transfer/Enantioselective Semipinacol Rearrangement of Quinolines by a Chiral Brønsted Acid,http://dx.doi.org/10.1021/jacs.5c19409,2025-12-17 20:40:08 UTC,Journal of the American Chemical Society: Latest Articles (ACS Publications),2025-12-17 20:40:08+00:00
[ASAP] Asymmetrical Substitution Manipulates Stacking Modes in 2D Conductive MOF Crystals,http://dx.doi.org/10.1021/jacs.5c15827,2025-12-17 20:40:49 UTC,Journal of the American Chemical Society: Latest Articles (ACS Publications),2025-12-17 20:40:49+00:00
[ASAP] Mechanistic Understanding of Thermal Stability and Safety in Lithium Metal Batteries,http://dx.doi.org/10.1021/acs.chemrev.5c00621,2025-12-17 20:41:32 UTC,Chemical Reviews: Latest Articles (ACS Publications),2025-12-17 20:41:32+00:00
Author Correction: Exploring the space of self-reproducing ribozymes using generative models,https://www.nature.com/articles/s41467-025-67592-w,2025-12-18 00:00:00 UTC,Nature Communications,2025-12-18 00:00:00+00:00
New shifts in olefin production,https://www.nature.com/articles/s44286-025-00330-7,2025-12-18 00:00:00 UTC,Nature Chemical Engineering,2025-12-18 00:00:00+00:00
Take it past the limit,https://www.nature.com/articles/s44286-025-00347-y,2025-12-18 00:00:00 UTC,Nature Chemical Engineering,2025-12-18 00:00:00+00:00
An enzymatic match made in high dimension,https://www.nature.com/articles/s44286-025-00319-2,2025-12-18 00:00:00 UTC,Nature Chemical Engineering,2025-12-18 00:00:00+00:00
Author Correction: A guidance to intelligent metamaterials and metamaterials intelligence,https://www.nature.com/articles/s41467-025-67597-5,2025-12-18 00:00:00 UTC,Nature Communications,2025-12-18 00:00:00+00:00
Genetic and dietary determinants of gut microbiome-bile acid interactions in the BXD genetic reference population,https://www.nature.com/articles/s41467-025-67680-x,2025-12-18 00:00:00 UTC,Nature Communications,2025-12-18 00:00:00+00:00
Molecular mechanisms of receptor recognition and antibody neutralization of coxsackievirus A6,https://www.nature.com/articles/s41467-025-67666-9,2025-12-18 00:00:00 UTC,Nature Communications,2025-12-18 00:00:00+00:00
Lactate mitochondrial oxidation drives stemness potential in metastatic breast cancer,https://www.nature.com/articles/s41467-025-67091-y,2025-12-18 00:00:00 UTC,Nature Communications,2025-12-18 00:00:00+00:00
Carbon-efficient synthesis,https://www.nature.com/articles/s41893-025-01731-5,2025-12-18 00:00:00 UTC,Nature Sustainability,2025-12-18 00:00:00+00:00
Casting pathways for net zero,https://www.nature.com/articles/s44286-025-00333-4,2025-12-18 00:00:00 UTC,Nature Chemical Engineering,2025-12-18 00:00:00+00:00
3D printing of organogel solar evaporators,https://www.nature.com/articles/s41893-025-01741-3,2025-12-18 00:00:00 UTC,Nature Sustainability,2025-12-18 00:00:00+00:00
Combining water and carbon footprint,https://www.nature.com/articles/s41893-025-01746-y,2025-12-18 00:00:00 UTC,Nature Sustainability,2025-12-18 00:00:00+00:00
Tigers and people,https://www.nature.com/articles/s41893-025-01744-0,2025-12-18 00:00:00 UTC,Nature Sustainability,2025-12-18 00:00:00+00:00
Rethinking education,https://www.nature.com/articles/s41893-025-01732-4,2025-12-18 00:00:00 UTC,Nature Sustainability,2025-12-18 00:00:00+00:00
Carbon conflicts in ocean fisheries,https://www.nature.com/articles/s41893-025-01737-z,2025-12-18 00:00:00 UTC,Nature Sustainability,2025-12-18 00:00:00+00:00
Clean energy straight from space,https://www.nature.com/articles/s41893-025-01742-2,2025-12-18 00:00:00 UTC,Nature Sustainability,2025-12-18 00:00:00+00:00
Lightweight luffa-like membranes,https://www.nature.com/articles/s41893-025-01743-1,2025-12-18 00:00:00 UTC,Nature Sustainability,2025-12-18 00:00:00+00:00
The blackjack of ice,https://www.nature.com/articles/s41563-025-02439-9,2025-12-18 00:00:00 UTC,Nature Materials,2025-12-18 00:00:00+00:00
A century-old reaction finds its rhythm,https://www.nature.com/articles/s44286-025-00346-z,2025-12-18 00:00:00 UTC,Nature Chemical Engineering,2025-12-18 00:00:00+00:00
From solvation shells to power cells,https://www.nature.com/articles/s44286-025-00304-9,2025-12-18 00:00:00 UTC,Nature Chemical Engineering,2025-12-18 00:00:00+00:00
Roadmap to 100 GWDC: Scientific and supply chain challenges for CdTe photovoltaics,https://www.cell.com/joule/fulltext/S2542-4351(25)00416-7?rss=yes,2025-12-18 00:00:00 UTC,Joule,2025-12-18 00:00:00+00:00
Interregional transmission can increase reliability while reducing costs and emissions in the US,https://www.nature.com/articles/s41560-025-01914-6,2025-12-18 00:00:00 UTC,Nature Energy,2025-12-18 00:00:00+00:00
"Enhanced εr/LD and improved acceptor crystal growth enable all-polymer solar cells with outstanding efficiency, stability, and processability from a chlorinated-dimer diluent additive",http://pubs.rsc.org/en/Content/ArticleLanding/2026/EE/D5EE06663H,2025-12-18 00:00:00 UTC,RSC - Energy Environ. Sci. latest articles,2025-12-18 00:00:00+00:00
Electrolyte-driven cathode catalysis chemistry in sodium–chlorine batteries,https://academic.oup.com/nsr/advance-article/doi/10.1093/nsr/nwaf579/8383420?rss=1,2025-12-18 00:00:00 UTC,National Science Review Advance Access,2025-12-18 00:00:00+00:00
Bienzyme-powered nanorobots with ultrasensitive chemotaxis for precision cancer therapy,https://academic.oup.com/nsr/advance-article/doi/10.1093/nsr/nwaf580/8383424?rss=1,2025-12-18 00:00:00 UTC,National Science Review Advance Access,2025-12-18 00:00:00+00:00
Dogma-defying signalling through G proteins could lead to better pain relief,https://www.nature.com/articles/d41586-025-03810-1,2025-12-18 00:00:00 UTC,Nature,2025-12-18 00:00:00+00:00
Point of no returns: researchers are crossing a threshold in the fight for funding,https://www.nature.com/articles/d41586-025-04060-x,2025-12-18 00:00:00 UTC,Nature,2025-12-18 00:00:00+00:00
Science in 2026: the events to watch for in the coming year,https://www.nature.com/articles/d41586-025-03673-6,2025-12-18 00:00:00 UTC,Nature,2025-12-18 00:00:00+00:00
Enzymes can multitask,https://www.nature.com/articles/s44286-025-00311-w,2025-12-18 00:00:00 UTC,Nature Chemical Engineering,2025-12-18 00:00:00+00:00
US–Africa bilateral health deals won’t help against diseases that ignore borders,https://www.nature.com/articles/d41586-025-04107-z,2025-12-18 00:00:00 UTC,Nature,2025-12-18 00:00:00+00:00
Living water and whispering rocks: Books in brief,https://www.nature.com/articles/d41586-025-04139-5,2025-12-18 00:00:00 UTC,Nature,2025-12-18 00:00:00+00:00
Publisher Correction: Covalent targeted radioligands potentiate radionuclide therapy,https://www.nature.com/articles/s41586-025-09982-0,2025-12-18 00:00:00 UTC,Nature,2025-12-18 00:00:00+00:00
Chromium-activated phosphors: from theory to applications,http://pubs.rsc.org/en/Content/ArticleLanding/2026/CS/D5CS00957J,2025-12-18 00:00:00 UTC,RSC - Chem. Soc. Rev. latest articles,2025-12-18 00:00:00+00:00
The next era of Fischer−Tropsch technology,https://www.nature.com/articles/s44286-025-00348-x,2025-12-18 00:00:00 UTC,Nature Chemical Engineering,2025-12-18 00:00:00+00:00
Hot spot: plants use infrared signals to say they’re ready to reproduce,https://www.nature.com/articles/d41586-025-04078-1,2025-12-18 00:00:00 UTC,Nature,2025-12-18 00:00:00+00:00
Real-space observation of flat-band ultrastrong coupling between optical phonons and surface plasmon polaritons,https://www.nature.com/articles/s41563-025-02412-6,2025-12-18 00:00:00 UTC,Nature Materials,2025-12-18 00:00:00+00:00
Our favorite science news stories of 2025,https://www.science.org/content/article/our-favorite-science-news-stories-2025,2025-12-18 02:00:00 UTC,Latest News from Science Magazine,2025-12-18 02:00:00+00:00
Why are women more likely to get irritable bowel syndrome? New study provides clues,https://www.science.org/content/article/why-are-women-more-likely-get-irritable-bowel-syndrome-new-study-provides-clues,2025-12-18 02:00:00 UTC,Latest News from Science Magazine,2025-12-18 02:00:00+00:00
Science’s 2025 Breakthrough of the Year: The unstoppable rise of renewable energy,https://www.science.org/content/article/breakthrough-2025,2025-12-18 02:00:00 UTC,Latest News from Science Magazine,2025-12-18 02:00:00+00:00
CDC funds controversial hepatitis B vaccine trial in African newborns,https://www.science.org/content/article/cdc-funds-controversial-hepatitis-b-vaccine-trial-african-newborns,2025-12-18 05:45:00 UTC,Latest News from Science Magazine,2025-12-18 05:45:00+00:00
Sir David Attenborough's London - why he wouldn't live anywhere else,https://www.bbc.com/news/articles/c93wj8134q0o?at_medium=RSS&at_campaign=rss,2025-12-18 06:06:57 UTC,BBC News,2025-12-18 06:06:57+00:00
"Archaeologists uncover 3,000-year-old mysterious mass burial site",https://www.bbc.com/news/articles/cedxev6e027o?at_medium=RSS&at_campaign=rss,2025-12-18 06:18:42 UTC,BBC News,2025-12-18 06:18:42+00:00
In Science Journals,https://www.science.org/doi/abs/10.1126/science.aee7987?af=R,2025-12-18 07:00:11 UTC,AAAS: Science: Table of Contents,2025-12-18 07:00:11+00:00
Scientific production in the era of large language models,https://www.science.org/doi/abs/10.1126/science.adw3000?af=R,2025-12-18 07:00:11 UTC,AAAS: Science: Table of Contents,2025-12-18 07:00:11+00:00
