title,link,published,source,pub_date
Strategies of high-accuracy memristor-based analogue computing in memory for artificial intelligence,https://www.nature.com/articles/s41563-026-02600-y,2026-05-11 00:00:00 UTC,Nature Materials,2026-05-11 00:00:00+00:00
Publisher Correction: Presymptomatic training mitigates functional deficits in a mouse model of Rett syndrome,https://www.nature.com/articles/s41586-026-10578-5,2026-05-11 00:00:00 UTC,Nature,2026-05-11 00:00:00+00:00
Audio long read: The air is full of DNA — here’s what scientists are using it for,https://www.nature.com/articles/d41586-026-01522-8,2026-05-11 00:00:00 UTC,Nature,2026-05-11 00:00:00+00:00
The sleep paradox: why do humans sleep so little when we need it so much?,https://www.nature.com/articles/d41586-026-01478-9,2026-05-11 00:00:00 UTC,Nature,2026-05-11 00:00:00+00:00
Elsevier vs Meta: first science publisher sues over scraped research papers,https://www.nature.com/articles/d41586-026-01481-0,2026-05-11 00:00:00 UTC,Nature,2026-05-11 00:00:00+00:00
Best. Day. Ever. What does a good day in science look like?,https://www.nature.com/articles/d41586-026-01479-8,2026-05-11 00:00:00 UTC,Nature,2026-05-11 00:00:00+00:00
Hantavirus outbreak exposes uncertainty about how disease spreads,https://www.nature.com/articles/d41586-026-01512-w,2026-05-11 00:00:00 UTC,Nature,2026-05-11 00:00:00+00:00
Evaluative governance for climate action in Australia,https://www.nature.com/articles/s41893-026-01814-x,2026-05-11 00:00:00 UTC,Nature Sustainability,2026-05-11 00:00:00+00:00
Giant map reveals thousands of cities worldwide with successful green policies,https://www.nature.com/articles/d41586-026-01491-y,2026-05-11 00:00:00 UTC,Nature,2026-05-11 00:00:00+00:00
In situ exsolving RuFe/La0.6Sr0.4Fe0.95Ru0.05O3-δ interfaces for direct and ethane-intensified CO2 electrolysis in solid oxide electrolysis cells,https://academic.oup.com/nsr/advance-article/doi/10.1093/nsr/nwag265/8676051?rss=1,2026-05-11 00:00:00 UTC,National Science Review Advance Access,2026-05-11 00:00:00+00:00
Carbon nanotube superplastic with long-awaited performance,https://academic.oup.com/nsr/advance-article/doi/10.1093/nsr/nwag271/8676050?rss=1,2026-05-11 00:00:00 UTC,National Science Review Advance Access,2026-05-11 00:00:00+00:00
Brain-computer interfaces for robotic control,https://academic.oup.com/nsr/advance-article/doi/10.1093/nsr/nwag269/8676048?rss=1,2026-05-11 00:00:00 UTC,National Science Review Advance Access,2026-05-11 00:00:00+00:00
All-in-one cocatalyst for photocatalytic overall water splitting,https://www.nature.com/articles/s41557-026-02143-4,2026-05-11 00:00:00 UTC,Nature Chemistry,2026-05-11 00:00:00+00:00
A neutral σ0π2 carbene enabling hydrogen activation via a σ-face pathway,https://www.nature.com/articles/s41557-026-02147-0,2026-05-11 00:00:00 UTC,Nature Chemistry,2026-05-11 00:00:00+00:00
Rice–fish co-culturing reduces schistosomiasis risk and increases yields and incomes,https://www.nature.com/articles/s41893-026-01833-8,2026-05-11 00:00:00 UTC,Nature Sustainability,2026-05-11 00:00:00+00:00
A closed-loop automated lab boosts perovskite performance,https://www.nature.com/articles/s41578-026-00928-0,2026-05-11 00:00:00 UTC,Nature Reviews Materials,2026-05-11 00:00:00+00:00
Rebirth of phosphorus in wastewater,https://www.nature.com/articles/s41893-026-01775-1,2026-05-11 00:00:00 UTC,Nature Sustainability,2026-05-11 00:00:00+00:00
"MAE’s Volta project: a renewable ammonia ecosystem in Mejillones, Chile",https://ammoniaenergy.org/articles/maes-volta-project-a-renewable-ammonia-ecosystem-in-mejillones-chile/,2026-05-11 01:57:43 UTC,Articles – Ammonia Energy Association,2026-05-11 01:57:43+00:00
Surrounding landscapes shape species persistence in fragmented forests,https://www.pnas.org/doi/abs/10.1073/pnas.2609139123?mi=eymic2&af=R&access=on&content=articlesChapters&publication=pnas&sortBy=Earliest&target=default,2026-05-11 07:00:00 UTC,Proceedings of the National Academy of Sciences: Keyword search for query,2026-05-11 07:00:00+00:00
A molecular lattice reinforces the sperm head–tail junction,https://www.pnas.org/doi/abs/10.1073/pnas.2608469123?mi=eymic2&af=R&access=on&content=articlesChapters&publication=pnas&sortBy=Earliest&target=default,2026-05-11 07:00:00 UTC,Proceedings of the National Academy of Sciences: Keyword search for query,2026-05-11 07:00:00+00:00
"Do negative social ties accelerate aging in adults, or does aging erode social ties?",https://www.pnas.org/doi/abs/10.1073/pnas.2608036123?mi=eymic2&af=R&access=on&content=articlesChapters&publication=pnas&sortBy=Earliest&target=default,2026-05-11 07:00:00 UTC,Proceedings of the National Academy of Sciences: Keyword search for query,2026-05-11 07:00:00+00:00
2024 global temperature record is consistent with model-predicted warming,https://www.pnas.org/doi/abs/10.1073/pnas.2600021123?mi=eymic2&af=R&access=on&content=articlesChapters&publication=pnas&sortBy=Earliest&target=default,2026-05-11 07:00:00 UTC,Proceedings of the National Academy of Sciences: Keyword search for query,2026-05-11 07:00:00+00:00
"Reply to Zhang: Causal identification, social networks, and biological aging",https://www.pnas.org/doi/abs/10.1073/pnas.2611082123?mi=eymic2&af=R&access=on&content=articlesChapters&publication=pnas&sortBy=Earliest&target=default,2026-05-11 07:00:00 UTC,Proceedings of the National Academy of Sciences: Keyword search for query,2026-05-11 07:00:00+00:00
Energetic interactions of water around ions determine transport properties of electrolyte solutions,https://www.pnas.org/doi/abs/10.1073/pnas.2611092123?mi=eymic2&af=R&access=on&content=articlesChapters&publication=pnas&sortBy=Earliest&target=default,2026-05-11 07:00:00 UTC,Proceedings of the National Academy of Sciences: Keyword search for query,2026-05-11 07:00:00+00:00
Anoxic photo-oxidation of Mn(II)-bearing carbonates on Mars and early Earth,https://www.pnas.org/doi/abs/10.1073/pnas.2607260123?mi=eymic2&af=R&access=on&content=articlesChapters&publication=pnas&sortBy=Earliest&target=default,2026-05-11 07:00:00 UTC,Proceedings of the National Academy of Sciences: Keyword search for query,2026-05-11 07:00:00+00:00
Extreme nonequilibrium synthesis of a Ca–Cu–Si clathrate during the Trinity nuclear test,https://www.pnas.org/doi/abs/10.1073/pnas.2604165123?mi=eymic2&af=R&access=on&content=articlesChapters&publication=pnas&sortBy=Earliest&target=default,2026-05-11 07:00:00 UTC,Proceedings of the National Academy of Sciences: Keyword search for query,2026-05-11 07:00:00+00:00
Deep-learning endomicroscope with large field-of-view and depth-of-field for real-time in vivo imaging of epithelial cancer hallmarks,https://www.pnas.org/doi/abs/10.1073/pnas.2602705123?mi=eymic2&af=R&access=on&content=articlesChapters&publication=pnas&sortBy=Earliest&target=default,2026-05-11 07:00:00 UTC,Proceedings of the National Academy of Sciences: Keyword search for query,2026-05-11 07:00:00+00:00
"Sperm, egg, and embryo proteins critical for genetic adaptation of herring to low salinity in the Baltic Sea",https://www.pnas.org/doi/abs/10.1073/pnas.2601861123?mi=eymic2&af=R&access=on&content=articlesChapters&publication=pnas&sortBy=Earliest&target=default,2026-05-11 07:00:00 UTC,Proceedings of the National Academy of Sciences: Keyword search for query,2026-05-11 07:00:00+00:00
Refining the mechanism of heme acquisition from free hemoglobin by Staphylococcus aureus IsdH,https://www.pnas.org/doi/abs/10.1073/pnas.2601134123?mi=eymic2&af=R&access=on&content=articlesChapters&publication=pnas&sortBy=Earliest&target=default,2026-05-11 07:00:00 UTC,Proceedings of the National Academy of Sciences: Keyword search for query,2026-05-11 07:00:00+00:00
A brain circuit of bidirectional modulation of social and nonsocial cognition by androgens and estrogens in male mice,https://www.pnas.org/doi/abs/10.1073/pnas.2600302123?mi=eymic2&af=R&access=on&content=articlesChapters&publication=pnas&sortBy=Earliest&target=default,2026-05-11 07:00:00 UTC,Proceedings of the National Academy of Sciences: Keyword search for query,2026-05-11 07:00:00+00:00
Promiscuity‐Guided Enzyme Evolution via Substrate Multiplexed Screening,https://chemistry-europe.onlinelibrary.wiley.com/doi/10.1002/anie.202600007?af=R,2026-05-11 07:00:00 UTC,Wiley: Angewandte Chemie International Edition: Table of Contents,2026-05-11 07:00:00+00:00
Hard and soft power in immigration enforcement,https://www.pnas.org/doi/abs/10.1073/pnas.2609140123?mi=eymic2&af=R&access=on&content=articlesChapters&publication=pnas&sortBy=Earliest&target=default,2026-05-11 07:00:00 UTC,Proceedings of the National Academy of Sciences: Keyword search for query,2026-05-11 07:00:00+00:00
Beyond antibodies in GAD65 autoimmunity: Reframing pathogenesis through intrathecal B–T cell cross-talk,https://www.pnas.org/doi/abs/10.1073/pnas.2609144123?mi=eymic2&af=R&access=on&content=articlesChapters&publication=pnas&sortBy=Earliest&target=default,2026-05-11 07:00:00 UTC,Proceedings of the National Academy of Sciences: Keyword search for query,2026-05-11 07:00:00+00:00
MHC-I diversity enables rapid adaptation during a viral pandemic in wild rabbit populations,https://www.pnas.org/doi/abs/10.1073/pnas.2532064123?mi=eymic2&af=R&access=on&content=articlesChapters&publication=pnas&sortBy=Earliest&target=default,2026-05-11 07:00:00 UTC,Proceedings of the National Academy of Sciences: Keyword search for query,2026-05-11 07:00:00+00:00
Exploring entropy landscapes using hard particle Monte Carlo metadynamics,https://www.pnas.org/doi/abs/10.1073/pnas.2537764123?mi=eymic2&af=R&access=on&content=articlesChapters&publication=pnas&sortBy=Earliest&target=default,2026-05-11 07:00:00 UTC,Proceedings of the National Academy of Sciences: Keyword search for query,2026-05-11 07:00:00+00:00
Temperature-dependent feedbacks drive the pattern of Antarctic temperature change,https://www.pnas.org/doi/abs/10.1073/pnas.2513383123?mi=eymic2&af=R&access=on&content=articlesChapters&publication=pnas&sortBy=Earliest&target=default,2026-05-11 07:00:00 UTC,Proceedings of the National Academy of Sciences: Keyword search for query,2026-05-11 07:00:00+00:00
Spectral mapping reveals a resemblance of the anesthetic brain state to both sleep and coma,https://www.pnas.org/doi/abs/10.1073/pnas.2514098123?mi=eymic2&af=R&access=on&content=articlesChapters&publication=pnas&sortBy=Earliest&target=default,2026-05-11 07:00:00 UTC,Proceedings of the National Academy of Sciences: Keyword search for query,2026-05-11 07:00:00+00:00
Synovial fibroblasts modulate endothelial activation in an acute injury-on-a-chip model,https://www.pnas.org/doi/abs/10.1073/pnas.2524677123?mi=eymic2&af=R&access=on&content=articlesChapters&publication=pnas&sortBy=Earliest&target=default,2026-05-11 07:00:00 UTC,Proceedings of the National Academy of Sciences: Keyword search for query,2026-05-11 07:00:00+00:00
Discovering regularity and mechanisms of word sense acquisition in childhood,https://www.pnas.org/doi/abs/10.1073/pnas.2525788123?mi=eymic2&af=R&access=on&content=articlesChapters&publication=pnas&sortBy=Earliest&target=default,2026-05-11 07:00:00 UTC,Proceedings of the National Academy of Sciences: Keyword search for query,2026-05-11 07:00:00+00:00
Chaperone-mediated autophagy protects against retinal photoreceptor degeneration by modulating proteostasis of glucose metabolism enzymes,https://www.pnas.org/doi/abs/10.1073/pnas.2527503123?mi=eymic2&af=R&access=on&content=articlesChapters&publication=pnas&sortBy=Earliest&target=default,2026-05-11 07:00:00 UTC,Proceedings of the National Academy of Sciences: Keyword search for query,2026-05-11 07:00:00+00:00
Structural and dynamic basis of indirect apoptosis inhibition by Bcl-xL: A case study with Bid,https://www.pnas.org/doi/abs/10.1073/pnas.2527963123?mi=eymic2&af=R&access=on&content=articlesChapters&publication=pnas&sortBy=Earliest&target=default,2026-05-11 07:00:00 UTC,Proceedings of the National Academy of Sciences: Keyword search for query,2026-05-11 07:00:00+00:00
Observing the mechanism of delayed collapse in colloidal gels: Yielding while becoming stronger,https://www.pnas.org/doi/abs/10.1073/pnas.2528499123?mi=eymic2&af=R&access=on&content=articlesChapters&publication=pnas&sortBy=Earliest&target=default,2026-05-11 07:00:00 UTC,Proceedings of the National Academy of Sciences: Keyword search for query,2026-05-11 07:00:00+00:00
"Correction for Asimovic et al., Testing the effects of Facebook usage in an ethnically polarized setting",https://www.pnas.org/doi/abs/10.1073/pnas.2614308123?mi=eymic2&af=R&access=on&content=articlesChapters&publication=pnas&sortBy=Earliest&target=default,2026-05-11 07:00:00 UTC,Proceedings of the National Academy of Sciences: Keyword search for query,2026-05-11 07:00:00+00:00
Swartkrans Paranthropus and Sterkfontein Australopithecus from southern Africa had different locomotor repertoires,https://www.pnas.org/doi/abs/10.1073/pnas.2532193123?mi=eymic2&af=R&access=on&content=articlesChapters&publication=pnas&sortBy=Earliest&target=default,2026-05-11 07:00:00 UTC,Proceedings of the National Academy of Sciences: Keyword search for query,2026-05-11 07:00:00+00:00
Global and regional climate modes modulate armed conflict risk,https://www.pnas.org/doi/abs/10.1073/pnas.2532935123?mi=eymic2&af=R&access=on&content=articlesChapters&publication=pnas&sortBy=Earliest&target=default,2026-05-11 07:00:00 UTC,Proceedings of the National Academy of Sciences: Keyword search for query,2026-05-11 07:00:00+00:00
"Oak masting breaks down in a highly fragmented, pollen-limited landscape",https://www.pnas.org/doi/abs/10.1073/pnas.2533900123?mi=eymic2&af=R&access=on&content=articlesChapters&publication=pnas&sortBy=Earliest&target=default,2026-05-11 07:00:00 UTC,Proceedings of the National Academy of Sciences: Keyword search for query,2026-05-11 07:00:00+00:00
Politics embodied: How politics shapes and is shaped by the bodily experience of emotions,https://www.pnas.org/doi/abs/10.1073/pnas.2534895123?mi=eymic2&af=R&access=on&content=articlesChapters&publication=pnas&sortBy=Earliest&target=default,2026-05-11 07:00:00 UTC,Proceedings of the National Academy of Sciences: Keyword search for query,2026-05-11 07:00:00+00:00
Climate mediates phenological and phylogenetic differentiation in plant invasions,https://www.pnas.org/doi/abs/10.1073/pnas.2536192123?mi=eymic2&af=R&access=on&content=articlesChapters&publication=pnas&sortBy=Earliest&target=default,2026-05-11 07:00:00 UTC,Proceedings of the National Academy of Sciences: Keyword search for query,2026-05-11 07:00:00+00:00
Peripheral complement C4 protein in schizophrenia: Association with gene copy number and immune cell subtypes,https://www.pnas.org/doi/abs/10.1073/pnas.2536376123?mi=eymic2&af=R&access=on&content=articlesChapters&publication=pnas&sortBy=Earliest&target=default,2026-05-11 07:00:00 UTC,Proceedings of the National Academy of Sciences: Keyword search for query,2026-05-11 07:00:00+00:00
A multinational megastudy of the effects of gratitude practices on subjective well-being,https://www.pnas.org/doi/abs/10.1073/pnas.2537789123?mi=eymic2&af=R&access=on&content=articlesChapters&publication=pnas&sortBy=Earliest&target=default,2026-05-11 07:00:00 UTC,Proceedings of the National Academy of Sciences: Keyword search for query,2026-05-11 07:00:00+00:00
"Correction for Kuhlisch et al., Mapping of the viral shunt across widespread coccolithophore blooms using metabolic biomarkers",https://www.pnas.org/doi/abs/10.1073/pnas.2614660123?mi=eymic2&af=R&access=on&content=articlesChapters&publication=pnas&sortBy=Earliest&target=default,2026-05-11 07:00:00 UTC,Proceedings of the National Academy of Sciences: Keyword search for query,2026-05-11 07:00:00+00:00
Emergent anisotropic three-phase order in critically doped superconducting diamond films,https://www.pnas.org/doi/abs/10.1073/pnas.2607730123?mi=eymic2&af=R&access=on&content=articlesChapters&publication=pnas&sortBy=Earliest&target=default,2026-05-11 07:00:00 UTC,Proceedings of the National Academy of Sciences: Keyword search for query,2026-05-11 07:00:00+00:00
Zn2+‐Rich Microgel‐Liquid Biphase Electrolyte to Alleviate Interface Concentration Polarization for Advanced Aqueous Zinc Batteries,https://advanced.onlinelibrary.wiley.com/doi/10.1002/aenm.71061?af=R,2026-05-11 07:19:56 UTC,Wiley: Advanced Energy Materials: Table of Contents,2026-05-11 07:19:56+00:00
Hydrogen Coupling Enables High‐Efficiency Zero‐Carbon Electrometallurgy,https://advanced.onlinelibrary.wiley.com/doi/10.1002/aenm.71030?af=R,2026-05-11 07:20:36 UTC,Wiley: Advanced Energy Materials: Table of Contents,2026-05-11 07:20:36+00:00
Bright‐and‐Cool Smart Windows: Visually Silent and Near‐Infrared Modulation via Quinoid Donor–Acceptor Polymers,https://advanced.onlinelibrary.wiley.com/doi/10.1002/aenm.71060?af=R,2026-05-11 07:22:07 UTC,Wiley: Advanced Energy Materials: Table of Contents,2026-05-11 07:22:07+00:00
LiMn0.5Fe0.5PO4: A Cathode Material for Lithium‐Ion Batteries: A Comprehensive Review,https://advanced.onlinelibrary.wiley.com/doi/10.1002/aenm.71014?af=R,2026-05-11 07:23:04 UTC,Wiley: Advanced Energy Materials: Table of Contents,2026-05-11 07:23:04+00:00
Mn‐Mediated Reduction Coupling Mechanism Stabilizes Anion Redox Chemistry Toward High‐Performance P2‐Type Na‐Layered Oxide Cathodes,https://advanced.onlinelibrary.wiley.com/doi/10.1002/aenm.71062?af=R,2026-05-11 07:23:05 UTC,Wiley: Advanced Energy Materials: Table of Contents,2026-05-11 07:23:05+00:00
Reliable Evaluation of Na‐Ion Battery Materials: Eliminating Na‐Metal Distortions,https://advanced.onlinelibrary.wiley.com/doi/10.1002/aenm.71044?af=R,2026-05-11 07:24:59 UTC,Wiley: Advanced Energy Materials: Table of Contents,2026-05-11 07:24:59+00:00
Interfacial Rotational Constraint Govern Buried‐Interface Energetics for Inverted Perovskite Solar Cells,https://advanced.onlinelibrary.wiley.com/doi/10.1002/aenm.71068?af=R,2026-05-11 07:25:26 UTC,Wiley: Advanced Energy Materials: Table of Contents,2026-05-11 07:25:26+00:00
Dual‐Site Cascade Mechanism Over Vacancy‐Rich CoO/High‐Spin CoOOH Heterointerfaces Enables Highly Efficient and Ultrastable 5‐hydroxymethylfurfural Electrooxidation,https://advanced.onlinelibrary.wiley.com/doi/10.1002/aenm.70985?af=R,2026-05-11 07:26:01 UTC,Wiley: Advanced Energy Materials: Table of Contents,2026-05-11 07:26:01+00:00
Interfacial Dipole Engineering Suppresses Charge Recombination for Achieving High‐Performance Binary Organic Solar Cells With 20.26% Efficiency,https://advanced.onlinelibrary.wiley.com/doi/10.1002/aenm.71054?af=R,2026-05-11 07:26:39 UTC,Wiley: Advanced Energy Materials: Table of Contents,2026-05-11 07:26:39+00:00
Natural Anionic Interfacial Reconstruction for Suppressing Pitting Corrosion Enables Durable Seawater Zinc‐Ion Batteries,https://advanced.onlinelibrary.wiley.com/doi/10.1002/aenm.71053?af=R,2026-05-11 07:27:22 UTC,Wiley: Advanced Energy Materials: Table of Contents,2026-05-11 07:27:22+00:00
Active Sites of Metal‐Free Carbon Materials in Energy Electrocatalysis,https://advanced.onlinelibrary.wiley.com/doi/10.1002/adma.73313?af=R,2026-05-11 07:32:51 UTC,Wiley: Advanced Materials: Table of Contents,2026-05-11 07:32:51+00:00
Nanomaterial Integration at Liquid–Liquid Interfaces for Green Catalysis,https://advanced.onlinelibrary.wiley.com/doi/10.1002/adma.73315?af=R,2026-05-11 07:33:33 UTC,Wiley: Advanced Materials: Table of Contents,2026-05-11 07:33:33+00:00
Amorphous π‐Conjugated Passivator Facilitates Widening Process Window for Reliable Perovskite Solar Modules,https://advanced.onlinelibrary.wiley.com/doi/10.1002/aenm.202506809?af=R,2026-05-11 07:35:30 UTC,Wiley: Advanced Energy Materials: Table of Contents,2026-05-11 07:35:30+00:00
Ladder‐Like Polysilsesquioxane Enable Space‐Durable Ultrathin Hard‐Yet‐Flexible Transparent Coatings,https://advanced.onlinelibrary.wiley.com/doi/10.1002/adma.73354?af=R,2026-05-11 07:35:48 UTC,Wiley: Advanced Materials: Table of Contents,2026-05-11 07:35:48+00:00
Asymmetric Polarization Enabled Robust Framework of Prussian Blue Analog Cathode for Ultrastable Sodiation Lifespan Over 50 000 Cycles,https://advanced.onlinelibrary.wiley.com/doi/10.1002/aenm.71063?af=R,2026-05-11 07:36:35 UTC,Wiley: Advanced Energy Materials: Table of Contents,2026-05-11 07:36:35+00:00
Ultrahigh‐Efficiency and Long‐Calendar‐Life Aqueous Cadmium Metal Batteries Under Extremely Harsh Conditions,https://chemistry-europe.onlinelibrary.wiley.com/doi/10.1002/anie.9382429?af=R,2026-05-11 07:36:48 UTC,Wiley: Angewandte Chemie International Edition: Table of Contents,2026-05-11 07:36:48+00:00
Compact‐Type Quasi‐2D Perovskites MAPbBr3@FABr: Reduced Interlayer Distances Enable Ultralow Threshold Lasing and High Electron Mobility,https://advanced.onlinelibrary.wiley.com/doi/10.1002/adma.202521981?af=R,2026-05-11 07:36:50 UTC,Wiley: Advanced Materials: Table of Contents,2026-05-11 07:36:50+00:00
Nucleophilic Gallyl Anions Enable Ga─Au Bimetallic Ammonia Activation,https://chemistry-europe.onlinelibrary.wiley.com/doi/10.1002/anie.7183298?af=R,2026-05-11 07:38:11 UTC,Wiley: Angewandte Chemie International Edition: Table of Contents,2026-05-11 07:38:11+00:00
Asymmetric α‐Alkylation With Activated and Unactivated Electrophiles by a Highly Productive and Recyclable Lewis Acid/Imidazolium Catalyst,https://chemistry-europe.onlinelibrary.wiley.com/doi/10.1002/anie.7069862?af=R,2026-05-11 07:39:13 UTC,Wiley: Angewandte Chemie International Edition: Table of Contents,2026-05-11 07:39:13+00:00
A Unified Radical C–SuFEx Platform via Catalytic EDA Complex‐Mediated S(VI)─F Bond Activation,https://chemistry-europe.onlinelibrary.wiley.com/doi/10.1002/anie.8964304?af=R,2026-05-11 07:40:23 UTC,Wiley: Angewandte Chemie International Edition: Table of Contents,2026-05-11 07:40:23+00:00
Threading an Aluminum Molecular Ring Onto a Chemically Growing Copper‐Directed Polyrotaxane,https://chemistry-europe.onlinelibrary.wiley.com/doi/10.1002/anie.8876257?af=R,2026-05-11 07:41:02 UTC,Wiley: Angewandte Chemie International Edition: Table of Contents,2026-05-11 07:41:02+00:00
Alkane as Hydrogen Source: Pd/Photoredox Dual‐Catalysis Enables Mild Olefin Hydrogenation,https://chemistry-europe.onlinelibrary.wiley.com/doi/10.1002/anie.7920745?af=R,2026-05-11 07:41:33 UTC,Wiley: Angewandte Chemie International Edition: Table of Contents,2026-05-11 07:41:33+00:00
Direct Seawater Hydrogen Evolution via Atomically Precise Regulation of Interfacial pH and Ion‐Water Interactions,https://chemistry-europe.onlinelibrary.wiley.com/doi/10.1002/anie.7140350?af=R,2026-05-11 07:42:43 UTC,Wiley: Angewandte Chemie International Edition: Table of Contents,2026-05-11 07:42:43+00:00
Unlocking Surface Sodiation Threshold of Titanium Dioxide via Coupled Electrochemical‐Thermal Activation,https://chemistry-europe.onlinelibrary.wiley.com/doi/10.1002/anie.4368463?af=R,2026-05-11 07:47:24 UTC,Wiley: Angewandte Chemie International Edition: Table of Contents,2026-05-11 07:47:24+00:00
[ASAP] Multienzyme-Mediated Dynamic Cross-Linking of All-Natural Hydrogels with High Adhesion and Redox Modulation for Rapid Tissue Filling and Repair,http://dx.doi.org/10.1021/jacs.6c01567,2026-05-11 08:16:49 UTC,Journal of the American Chemical Society: Latest Articles (ACS Publications),2026-05-11 08:16:49+00:00
[ASAP] Subparticle Operando Imaging for Probing Electrocatalytic Intermediates and Cation Effects,http://dx.doi.org/10.1021/jacs.5c21794,2026-05-11 08:17:48 UTC,Journal of the American Chemical Society: Latest Articles (ACS Publications),2026-05-11 08:17:48+00:00
2 GWh Australian solar-plus-storage Tumuruu project gains approval,https://www.ess-news.com/2026/05/11/2-gwh-australian-solar-plus-storage-tumuruu-project-gains-approval/,2026-05-11 08:20:00 UTC,Latest news about ESS Projects & Applications | ESS News,2026-05-11 08:20:00+00:00
Hybrid latent-sensible storage can improve PVT-driven residential heat pump COP by 72.4%,https://www.pv-magazine.com/2026/05/11/hybrid-latent-sensible-storage-can-improve-pvt-driven-residential-heat-pump-cop-by-72-4/,2026-05-11 08:28:38 UTC,Commercial & Industrial PV – pv magazine International,2026-05-11 08:28:38+00:00
[ASAP] Predicting the Thermodynamic Limits of Metal–Organic Framework Metastability,http://dx.doi.org/10.1021/jacs.5c20253,2026-05-11 08:42:43 UTC,Journal of the American Chemical Society: Latest Articles (ACS Publications),2026-05-11 08:42:43+00:00
Egypt installs 800 MW of solar in 2025,https://www.pv-magazine.com/2026/05/11/egypt-installs-800-mw-of-solar-in-2025/,2026-05-11 09:02:33 UTC,Commercial & Industrial PV – pv magazine International,2026-05-11 09:02:33+00:00
Floating solar offers Morocco’s dams antidote to evaporation loss,https://www.pv-magazine.com/2026/05/11/floating-solar-offers-moroccos-dams-antidote-to-evaporation-loss/,2026-05-11 09:15:19 UTC,Commercial & Industrial PV – pv magazine International,2026-05-11 09:15:19+00:00
Scientists ID ‘corkscrew killer’ behind gruesome seal deaths,https://www.science.org/content/article/scientists-id-corkscrew-killer-behind-gruesome-seal-deaths,2026-05-11 09:30:00 UTC,Latest News from Science Magazine,2026-05-11 09:30:00+00:00
[ASAP] Catalyst-Controlled Chemoselective β-Mannosylation of Phenols Via Attractive Noncovalent Interactions,http://dx.doi.org/10.1021/jacs.6c04849,2026-05-11 10:24:02 UTC,Journal of the American Chemical Society: Latest Articles (ACS Publications),2026-05-11 10:24:02+00:00
Ampere‐Level Syngas Synthesis by Controllable Active Hydrogen Supply to Regulate CO2 Reduction Depth on High‐Entropy (CuZnAlZrCe)O2 Oxide Nanosheets,https://chemistry-europe.onlinelibrary.wiley.com/doi/10.1002/anie.3290876?af=R,2026-05-11 10:30:56 UTC,Wiley: Angewandte Chemie International Edition: Table of Contents,2026-05-11 10:30:56+00:00
