title,link,published,source,pub_date
A Multifunctional Sulfur(VI) Fluoride for SuFEx Reactions: N‐CF2H Sulfamoyl Fluorides,https://onlinelibrary.wiley.com/doi/10.1002/anie.7689781?af=R,2026-06-09 11:39:55 UTC,Wiley: Angewandte Chemie International Edition: Table of Contents,2026-06-09 11:39:55+00:00
Scotland's greenhouse gas emissions fall slightly as progress slows,https://www.bbc.com/news/articles/cg748xd7vpjo?at_medium=RSS&at_campaign=rss,2026-06-09 11:42:03 UTC,BBC News,2026-06-09 11:42:03+00:00
Ordered Pt3Mn Intermetallic Nanoparticles Supported on Atomically Dispersed Mn–N–C as Electrocatalysts for Fuel Cells,https://onlinelibrary.wiley.com/doi/10.1002/anie.7818348?af=R,2026-06-09 11:42:28 UTC,Wiley: Angewandte Chemie International Edition: Table of Contents,2026-06-09 11:42:28+00:00
Enantioselective Synthesis of a New Class of Stable and Functionalized Cyclopentadienes via CuH‐Catalysis,https://onlinelibrary.wiley.com/doi/10.1002/anie.6630116?af=R,2026-06-09 11:44:17 UTC,Wiley: Angewandte Chemie International Edition: Table of Contents,2026-06-09 11:44:17+00:00
Outside Back Cover: Terminal Hydroxylated Side‐Chains Enhance Ionic‐Electronic Coupling Efficiency in Small‐Molecule Semiconductors,https://onlinelibrary.wiley.com/doi/10.1002/anie.2026-m0306035100?af=R,2026-06-09 11:44:25 UTC,Wiley: Angewandte Chemie International Edition: Table of Contents,2026-06-09 11:44:25+00:00
Coordination Engineering of Ir─Mo Atomic Pair Sites to Break Scaling Limitations for Acidic Oxygen Evolution,https://onlinelibrary.wiley.com/doi/10.1002/anie.3665828?af=R,2026-06-09 11:46:34 UTC,Wiley: Angewandte Chemie International Edition: Table of Contents,2026-06-09 11:46:34+00:00
Activating π‐Electron Conjugated Networks of Self‐Assembled Multilayers for 21.1% Efficiency Organic Solar Cells,https://onlinelibrary.wiley.com/doi/10.1002/anie.4154577?af=R,2026-06-09 11:48:09 UTC,Wiley: Angewandte Chemie International Edition: Table of Contents,2026-06-09 11:48:09+00:00
Synergistic Electronic and Steric Engineering of Thiophene Donors in Covalent Organic Frameworks for Efficient CO2 Photoconversion,https://onlinelibrary.wiley.com/doi/10.1002/anie.5240027?af=R,2026-06-09 11:48:59 UTC,Wiley: Angewandte Chemie International Edition: Table of Contents,2026-06-09 11:48:59+00:00
Inside Front Cover: Enhancing Interfacial Charge Transport in Gold Nanoparticle@Polyaniline Hybrids via N‐Heterocyclic Carbene Linkers,https://onlinelibrary.wiley.com/doi/10.1002/anie.2026-m0306041500?af=R,2026-06-09 11:50:22 UTC,Wiley: Angewandte Chemie International Edition: Table of Contents,2026-06-09 11:50:22+00:00
Boosting Natural Rubber Performance by Backbone Rigid Functionalization,https://onlinelibrary.wiley.com/doi/10.1002/anie.1326350?af=R,2026-06-09 11:51:08 UTC,Wiley: Angewandte Chemie International Edition: Table of Contents,2026-06-09 11:51:08+00:00
Molecular N‐Type Doping Unlocks Low‐Threshold Nanosecond Lasing in a Microcavity‐Integrated OLED Toward Electrically Pumped Organic Lasers,https://onlinelibrary.wiley.com/doi/10.1002/anie.5388345?af=R,2026-06-09 11:54:41 UTC,Wiley: Angewandte Chemie International Edition: Table of Contents,2026-06-09 11:54:41+00:00
Intracellular Proton Enrichment Drives Unified Dual‐Cofactor Regeneration for Biohybrid CO2 Fixation,https://onlinelibrary.wiley.com/doi/10.1002/anie.8155133?af=R,2026-06-09 11:55:31 UTC,Wiley: Angewandte Chemie International Edition: Table of Contents,2026-06-09 11:55:31+00:00
Photocatalytic Lignin Depolymerization and Cross‐Coupling With Alcohols to Produce Unsymmetric Aromatic Diols,https://onlinelibrary.wiley.com/doi/10.1002/anie.2045478?af=R,2026-06-09 11:56:22 UTC,Wiley: Angewandte Chemie International Edition: Table of Contents,2026-06-09 11:56:22+00:00
Coordination‐Engineered Interfacial Pathway Partitioning for Electrocatalytic CO2 Conversion and Downstream Upgrading,https://onlinelibrary.wiley.com/doi/10.1002/anie.7212170?af=R,2026-06-09 11:58:51 UTC,Wiley: Angewandte Chemie International Edition: Table of Contents,2026-06-09 11:58:51+00:00
Photocracking of Polystyrene into Aromatic Products in CH2Cl2,https://onlinelibrary.wiley.com/doi/10.1002/anie.5578835?af=R,2026-06-09 12:00:54 UTC,Wiley: Angewandte Chemie International Edition: Table of Contents,2026-06-09 12:00:54+00:00
Self‐Optimization With Oriented Facet Reconstruction for Universal Electrocatalytic C–N Coupling,https://onlinelibrary.wiley.com/doi/10.1002/anie.4658732?af=R,2026-06-09 12:02:59 UTC,Wiley: Angewandte Chemie International Edition: Table of Contents,2026-06-09 12:02:59+00:00
Regiodivergent Hydrogermylation of Alkynes Enabled by Dinuclear Cobalt Catalysts Bearing Different Ligands,https://onlinelibrary.wiley.com/doi/10.1002/anie.6685709?af=R,2026-06-09 12:06:48 UTC,Wiley: Angewandte Chemie International Edition: Table of Contents,2026-06-09 12:06:48+00:00
Mercedes benz eqs mit festkoerperbatterie von factorial energy,https://www.electrive.com/2026/06/09/factorial-completes-nasdaq-listing/,2026-06-09 12:30:00 UTC,Battery – electrive.com,2026-06-09 12:30:00+00:00
"EWE, Salzgitter sign 10,000 t/y green hydrogen supply contract",https://hydrogentechworld.com/ewe-salzgitter-sign-10000-t-y-green-hydrogen-supply-contract,2026-06-09 13:32:31 UTC,Hydrogen Tech World.com,2026-06-09 13:32:31+00:00
Summit Carbon Solutions Faces $15M Lawsuit As Pipeline Delays Continue,https://carbonherald.com/summit-carbon-solutions-faces-15m-lawsuit-as-pipeline-delays-continue/?utm_source=rss&utm_medium=rss&utm_campaign=summit-carbon-solutions-faces-15m-lawsuit-as-pipeline-delays-continue,2026-06-09 14:05:40 UTC,Carbon Herald,2026-06-09 14:05:40+00:00
Nasa has named the Artemis III crew - what is their mission?,https://www.bbc.com/news/articles/cr5j40ezgz4o?at_medium=RSS&at_campaign=rss,2026-06-09 17:45:34 UTC,BBC News,2026-06-09 17:45:34+00:00
Nasa names next astronauts for Artemis Moon programme,https://www.bbc.com/news/articles/cdejn0gj12go?at_medium=RSS&at_campaign=rss,2026-06-09 17:46:55 UTC,BBC News,2026-06-09 17:46:55+00:00
Nasa reveals crew for Artemis III mission,https://www.bbc.com/news/videos/cd95n8v8xgyo?at_medium=RSS&at_campaign=rss,2026-06-09 18:44:57 UTC,BBC News,2026-06-09 18:44:57+00:00
Self-assembly for cuproptosis-based cancer therapy and imaging,http://pubs.rsc.org/en/Content/ArticleLanding/2026/CS/D5CS01136A,2026-06-09 23:00:00 UTC,RSC - Chem. Soc. Rev. latest articles,2026-06-09 23:00:00+00:00
Multiscale cathode design for high-temperature proton exchange membrane fuel cells,http://pubs.rsc.org/en/Content/ArticleLanding/2026/CS/D6CS00242K,2026-06-09 23:00:00 UTC,RSC - Chem. Soc. Rev. latest articles,2026-06-09 23:00:00+00:00
Discharge-Triggered Electronic Delocalization via Asymmetric Motifs Suppresses Jahn-Teller Distortion in Mn-Based Layered Oxides,http://pubs.rsc.org/en/Content/ArticleLanding/2026/EE/D6EE03005J,2026-06-09 23:00:00 UTC,RSC - Energy Environ. Sci. latest articles,2026-06-09 23:00:00+00:00
A kinetic descriptor of solvent polarization for rational electrolyte design in lithium–metal batteries,http://pubs.rsc.org/en/Content/ArticleLanding/2026/EE/D6EE01727D,2026-06-09 23:00:00 UTC,RSC - Energy Environ. Sci. latest articles,2026-06-09 23:00:00+00:00
A High-Adaptability Ambient Energy Harvester Enhanced by the Canyon Effect for Smart Agriculture,http://pubs.rsc.org/en/Content/ArticleLanding/2026/EE/D6EE02135B,2026-06-09 23:00:00 UTC,RSC - Energy Environ. Sci. latest articles,2026-06-09 23:00:00+00:00
Modulating Interfacial Ion Flux via Electrode Coatings Enables Efficient Acidic CO₂ Electrolysis,http://pubs.rsc.org/en/Content/ArticleLanding/2026/EE/D6EE01796G,2026-06-09 23:00:00 UTC,RSC - Energy Environ. Sci. latest articles,2026-06-09 23:00:00+00:00
Framework materials for nuclear waste treatment,http://pubs.rsc.org/en/Content/ArticleLanding/2026/CS/D6CS00154H,2026-06-09 23:00:00 UTC,RSC - Chem. Soc. Rev. latest articles,2026-06-09 23:00:00+00:00
Watching catalysis take a walk,https://www.nature.com/articles/s41560-026-02089-4,2026-06-10 00:00:00 UTC,Nature Energy,2026-06-10 00:00:00+00:00
Interface-mediated crystallization enables PEDOT:PSS-free all-perovskite tandems with 29.1% efficiency and enhanced durability,https://www.cell.com/joule/fulltext/S2542-4351(26)00185-6?rss=yes,2026-06-10 00:00:00 UTC,Joule,2026-06-10 00:00:00+00:00
Interfacial ion depletion at high concentration guides electrolyte design for aqueous aluminum-iodine batteries,https://www.cell.com/joule/fulltext/S2542-4351(26)00186-8?rss=yes,2026-06-10 00:00:00 UTC,Joule,2026-06-10 00:00:00+00:00
Gen Z scepticism towards AI is a wake-up call — universities must take it seriously,https://www.nature.com/articles/d41586-026-01814-z,2026-06-10 00:00:00 UTC,Nature,2026-06-10 00:00:00+00:00
Five winning images of scientists at work,https://www.nature.com/articles/d41586-026-01819-8,2026-06-10 00:00:00 UTC,Nature,2026-06-10 00:00:00+00:00
Newly discovered whale graveyard dates back millions of years,https://www.nature.com/articles/d41586-026-01864-3,2026-06-10 00:00:00 UTC,Nature,2026-06-10 00:00:00+00:00
Deep learning four decades of human migration,https://www.nature.com/articles/s41586-026-10611-7,2026-06-10 00:00:00 UTC,Nature,2026-06-10 00:00:00+00:00
Improved quantum processor logical error rates via correction and detection,https://www.nature.com/articles/s41586-026-10628-y,2026-06-10 00:00:00 UTC,Nature,2026-06-10 00:00:00+00:00
A thalamus–brainstem attractor network drives history-biased decisions,https://www.nature.com/articles/s41586-026-10623-3,2026-06-10 00:00:00 UTC,Nature,2026-06-10 00:00:00+00:00
Strain-insensitive wet-tissue-adhesive biphasic bioelectronics for physicochemical monitoring and adaptive therapy,https://www.nature.com/articles/s41563-026-02624-4,2026-06-10 00:00:00 UTC,Nature Materials,2026-06-10 00:00:00+00:00
3D printing methods unite to engineer capillary networks,https://www.nature.com/articles/s44286-026-00401-3,2026-06-10 00:00:00 UTC,Nature Chemical Engineering,2026-06-10 00:00:00+00:00
Go with the flow,https://www.nature.com/articles/s44286-026-00397-w,2026-06-10 00:00:00 UTC,Nature Chemical Engineering,2026-06-10 00:00:00+00:00
Giant crustacean of the deep sea steals a trick from bacteria,https://www.nature.com/articles/d41586-026-01832-x,2026-06-10 00:00:00 UTC,Nature,2026-06-10 00:00:00+00:00
Lignin to adipic acid in a high-yield chemical and biological redox process,https://www.nature.com/articles/s41586-026-10580-x,2026-06-10 00:00:00 UTC,Nature,2026-06-10 00:00:00+00:00
Structural basis for chaperone-guided assembly of RNA-induced silencing complex,https://www.nature.com/articles/s41586-026-10640-2,2026-06-10 00:00:00 UTC,Nature,2026-06-10 00:00:00+00:00
SIRT7 regulates dosage compensation and safeguards the female X chromosome,https://www.nature.com/articles/s41586-026-10645-x,2026-06-10 00:00:00 UTC,Nature,2026-06-10 00:00:00+00:00
A 5.3-million-year-old deep-sea whale necropolis in the Diamantina Zone,https://www.nature.com/articles/s41586-026-10546-z,2026-06-10 00:00:00 UTC,Nature,2026-06-10 00:00:00+00:00
Amplified Arctic iceberg traffic reshapes benthic biodiversity,https://www.nature.com/articles/s41586-026-10630-4,2026-06-10 00:00:00 UTC,Nature,2026-06-10 00:00:00+00:00
Whole-genome duplication shaped cell-type evolution in the vertebrate brain,https://www.nature.com/articles/s41586-026-10629-x,2026-06-10 00:00:00 UTC,Nature,2026-06-10 00:00:00+00:00
A prognostic human brain network for diffuse midline glioma,https://www.nature.com/articles/s41586-026-10631-3,2026-06-10 00:00:00 UTC,Nature,2026-06-10 00:00:00+00:00
Two-component exciton condensates in an electron–hole bilayer,https://www.nature.com/articles/s41586-026-10636-y,2026-06-10 00:00:00 UTC,Nature,2026-06-10 00:00:00+00:00
Mutation-dependent responses to sleep and exercise in clonal haematopoiesis,https://www.nature.com/articles/s41586-026-10634-0,2026-06-10 00:00:00 UTC,Nature,2026-06-10 00:00:00+00:00
Efficient and accurate neural-field reconstruction using resistive memory,https://www.nature.com/articles/s41586-026-10646-w,2026-06-10 00:00:00 UTC,Nature,2026-06-10 00:00:00+00:00
Gene ancestries reveal diverse microbial associations during eukaryogenesis,https://www.nature.com/articles/s41586-026-10639-9,2026-06-10 00:00:00 UTC,Nature,2026-06-10 00:00:00+00:00
Mitochondria directly interact with the nuclear pore complex,https://www.nature.com/articles/s41586-026-10588-3,2026-06-10 00:00:00 UTC,Nature,2026-06-10 00:00:00+00:00
"Ligand-modulated metal–radical polarity match enables general 1,2-dicarbofunctionalization of ethylene",https://www.nature.com/articles/s41557-026-02177-8,2026-06-10 00:00:00 UTC,Nature Chemistry,2026-06-10 00:00:00+00:00
Aromatic ring flips reveal reshaping of protein dynamics in crystals and complexes,https://www.nature.com/articles/s41557-026-02155-0,2026-06-10 00:00:00 UTC,Nature Chemistry,2026-06-10 00:00:00+00:00
Measurement of reactor neutrino oscillation with the first JUNO data,https://www.nature.com/articles/s41586-026-10538-z,2026-06-10 00:00:00 UTC,Nature,2026-06-10 00:00:00+00:00
Author Correction: [2+2] Photocycloaddition reactions of sulfinylamines with alkenes to access β-sultam derivatives,https://www.nature.com/articles/s41557-026-02198-3,2026-06-10 00:00:00 UTC,Nature Chemistry,2026-06-10 00:00:00+00:00
Molecular glue degraders of HuR suppress BRAF-mutant colorectal cancer,https://www.nature.com/articles/s41586-026-10613-5,2026-06-10 00:00:00 UTC,Nature,2026-06-10 00:00:00+00:00
In situ nanocrystal confinement for efficient blue perovskite LEDs,https://www.nature.com/articles/s41586-026-10596-3,2026-06-10 00:00:00 UTC,Nature,2026-06-10 00:00:00+00:00
Trustworthy benchmarks for halide perovskite transistors,https://www.nature.com/articles/s41578-026-00935-1,2026-06-10 00:00:00 UTC,Nature Reviews Materials,2026-06-10 00:00:00+00:00
Building user-driven climate adaptation products,https://www.nature.com/articles/s41586-026-10555-y,2026-06-10 00:00:00 UTC,Nature,2026-06-10 00:00:00+00:00
Diverse binding poses of agonistic neurotoxins on human Nav1.6,https://www.nature.com/articles/s41586-026-10661-x,2026-06-10 00:00:00 UTC,Nature,2026-06-10 00:00:00+00:00
How I use AI to turn failed drugs into new medicines,https://www.nature.com/articles/d41586-026-01626-1,2026-06-10 00:00:00 UTC,Nature,2026-06-10 00:00:00+00:00
A vast whale necropolis has been found,https://www.nature.com/articles/d41586-026-01581-x,2026-06-10 00:00:00 UTC,Nature,2026-06-10 00:00:00+00:00
Doubting Thomas,https://www.nature.com/articles/d41586-026-01718-y,2026-06-10 00:00:00 UTC,Nature,2026-06-10 00:00:00+00:00
Light slows down carbon nanotubes in water,https://www.nature.com/articles/d41586-026-01701-7,2026-06-10 00:00:00 UTC,Nature,2026-06-10 00:00:00+00:00
Daily briefing: Ancient ground squirrels ate like ‘zombies of the Pleistocene’,https://www.nature.com/articles/d41586-026-01878-x,2026-06-10 00:00:00 UTC,Nature,2026-06-10 00:00:00+00:00
Rocks falling from melting icebergs host deep-sea oases of biodiversity,https://www.nature.com/articles/d41586-026-01835-8,2026-06-10 00:00:00 UTC,Nature,2026-06-10 00:00:00+00:00
Artificial intelligence shines a light on hidden global migration flows,https://www.nature.com/articles/d41586-026-01588-4,2026-06-10 00:00:00 UTC,Nature,2026-06-10 00:00:00+00:00
Chinese detector edges closer to solving the mystery of neutrino mass,https://www.nature.com/articles/d41586-026-01851-8,2026-06-10 00:00:00 UTC,Nature,2026-06-10 00:00:00+00:00
A first-in-class pulsatile FXR agonist for bile-acid-related liver diseases,https://www.nature.com/articles/s41586-026-10633-1,2026-06-10 00:00:00 UTC,Nature,2026-06-10 00:00:00+00:00
Light-induced quantum friction of carbon nanotubes in water,https://www.nature.com/articles/s41586-026-10632-2,2026-06-10 00:00:00 UTC,Nature,2026-06-10 00:00:00+00:00
JUNO experiment ushers in next generation of neutrino experiments,https://www.nature.com/articles/d41586-026-01585-7,2026-06-10 00:00:00 UTC,Nature,2026-06-10 00:00:00+00:00
Is the peptide craze backed by science? The promise behind the hype,https://www.nature.com/articles/d41586-026-01816-x,2026-06-10 00:00:00 UTC,Nature,2026-06-10 00:00:00+00:00
When drug discovery fails: scientists share their frustrations with the process,https://www.nature.com/articles/d41586-026-01797-x,2026-06-10 00:00:00 UTC,Nature,2026-06-10 00:00:00+00:00
‘Hidden hero’ peptides guard crops against sudden cold,https://www.nature.com/articles/d41586-026-01754-8,2026-06-10 00:00:00 UTC,Nature,2026-06-10 00:00:00+00:00
Mitochondria tethered to the nucleus secure its energy supply,https://www.nature.com/articles/d41586-026-01587-5,2026-06-10 00:00:00 UTC,Nature,2026-06-10 00:00:00+00:00
Nature Index 2026 Research Leaders rankings: are China’s East Asian neighbours keeping pace with it?,https://www.nature.com/articles/d41586-026-01662-x,2026-06-10 00:00:00 UTC,Nature,2026-06-10 00:00:00+00:00
Human migration has surged since 2000 — these maps reveal where people are going,https://www.nature.com/articles/d41586-026-01796-y,2026-06-10 00:00:00 UTC,Nature,2026-06-10 00:00:00+00:00
The Amazon can be saved — with concerted action inside and outside Brazil,https://www.nature.com/articles/d41586-026-01824-x,2026-06-10 00:00:00 UTC,Nature,2026-06-10 00:00:00+00:00
Confirmation that bryozoan animals were present during the Cambrian explosion,https://www.nature.com/articles/d41586-026-01753-9,2026-06-10 00:00:00 UTC,Nature,2026-06-10 00:00:00+00:00
Hybrid refinery process turns plant material into industrially important chemical,https://www.nature.com/articles/d41586-026-01586-6,2026-06-10 00:00:00 UTC,Nature,2026-06-10 00:00:00+00:00
Simultaneous single-base resolution profiling of 5mC and 5hmC using BRIGHT-seq,https://academic.oup.com/nsr/advance-article/doi/10.1093/nsr/nwag353/8705453?rss=1,2026-06-10 00:00:00 UTC,National Science Review Advance Access,2026-06-10 00:00:00+00:00
First results put neutrino experiment in China on track for breakthrough,https://www.science.org/content/article/first-results-put-neutrino-experiment-china-track-breakthrough,2026-06-10 01:20:00 UTC,Latest News from Science Magazine,2026-06-10 01:20:00+00:00
"VOC Port, AM Green: renewable mega-project in southern India",https://ammoniaenergy.org/articles/voc-port-am-green-renewable-mega-project-in-southern-india/,2026-06-10 02:54:14 UTC,Articles – Ammonia Energy Association,2026-06-10 02:54:14+00:00
Will the World Cup kick off disease outbreaks?,https://www.science.org/content/article/will-world-cup-kick-disease-outbreaks,2026-06-10 03:45:00 UTC,Latest News from Science Magazine,2026-06-10 03:45:00+00:00
Building a Brazil – Belgium green shipping corridor,https://ammoniaenergy.org/articles/building-a-brazil-belgium-green-shipping-corridor/,2026-06-10 04:49:18 UTC,Articles – Ammonia Energy Association,2026-06-10 04:49:18+00:00
Double‐Sided Mechanical Interlocking Enables Soft‐Rigid Conductive Interfaces With a Record High Toughness for Flexible Electronics,https://advanced.onlinelibrary.wiley.com/doi/10.1002/adma.73649?af=R,2026-06-10 05:03:28 UTC,Wiley: Advanced Materials: Table of Contents,2026-06-10 05:03:28+00:00
Crystallization Pathway Optimization and High‐Index Facet Stabilization for Perovskite Photovoltaics,https://advanced.onlinelibrary.wiley.com/doi/10.1002/adma.73663?af=R,2026-06-10 05:06:01 UTC,Wiley: Advanced Materials: Table of Contents,2026-06-10 05:06:01+00:00
Women prepare for 'space jobs that don't exist yet',https://www.bbc.com/news/articles/cy49d000kgwo?at_medium=RSS&at_campaign=rss,2026-06-10 05:21:06 UTC,BBC News,2026-06-10 05:21:06+00:00
"Study finds sharp decline in Black, Hispanic researchers receiving NIH funding",https://www.science.org/content/article/study-finds-sharp-decline-black-hispanic-researchers-receiving-nih-funding,2026-06-10 05:45:38 UTC,Latest News from Science Magazine,2026-06-10 05:45:38+00:00
Restoration of endogenous electric fields with a glucose-powered symbiotic bioabsorbable bandage for diabetic wound healing,https://www.science.org/doi/abs/10.1126/sciadv.aed9445?af=R,2026-06-10 07:00:00 UTC,AAAS: Science Advances: Table of Contents,2026-06-10 07:00:00+00:00
Scalable hierarchical textile fibers toward personalized wearable atmospheric water harvesting,https://www.science.org/doi/abs/10.1126/sciadv.aed9949?af=R,2026-06-10 07:00:00 UTC,AAAS: Science Advances: Table of Contents,2026-06-10 07:00:00+00:00
Experimental violation of a Bell-like inequality for causal order,https://www.science.org/doi/abs/10.1126/sciadv.aee2912?af=R,2026-06-10 07:00:00 UTC,AAAS: Science Advances: Table of Contents,2026-06-10 07:00:00+00:00
Metasurface-enabled astronomical polarimetry,https://www.science.org/doi/abs/10.1126/sciadv.aee8035?af=R,2026-06-10 07:00:00 UTC,AAAS: Science Advances: Table of Contents,2026-06-10 07:00:00+00:00
Discovery of a [4Fe-4S] cluster in the PRRSV Nsp1α leader protease reveals host-virus interplay in its downstream functions,https://www.science.org/doi/abs/10.1126/sciadv.aef0094?af=R,2026-06-10 07:00:00 UTC,AAAS: Science Advances: Table of Contents,2026-06-10 07:00:00+00:00
Programmed oral delivery of peptide therapeutics for multiorgan targeting in metabolic disorders of hyperglycemia and hyperuricemia,https://www.science.org/doi/abs/10.1126/sciadv.aef3323?af=R,2026-06-10 07:00:00 UTC,AAAS: Science Advances: Table of Contents,2026-06-10 07:00:00+00:00
Legacies of foundation species shape life after death,https://www.science.org/doi/abs/10.1126/sciadv.aef9983?af=R,2026-06-10 07:00:00 UTC,AAAS: Science Advances: Table of Contents,2026-06-10 07:00:00+00:00
Single-particle tunneling spectrum with a robust superconducting gap in La2PrNi2O7 thin films at ambient pressure,https://www.science.org/doi/abs/10.1126/sciadv.aeg2429?af=R,2026-06-10 07:00:00 UTC,AAAS: Science Advances: Table of Contents,2026-06-10 07:00:00+00:00
Restoring access to long-term social recognition memories disrupted by sleep deprivation,https://www.science.org/doi/abs/10.1126/sciadv.adu9805?af=R,2026-06-10 07:00:00 UTC,AAAS: Science Advances: Table of Contents,2026-06-10 07:00:00+00:00
Exploring the third dimension in quantum confinement of surface electrons,https://www.science.org/doi/abs/10.1126/sciadv.aed3926?af=R,2026-06-10 07:00:00 UTC,AAAS: Science Advances: Table of Contents,2026-06-10 07:00:00+00:00
A conserved biphasic venous remodeling program governs inferior vena cava formation in zebrafish,https://www.science.org/doi/abs/10.1126/sciadv.ady3541?af=R,2026-06-10 07:00:00 UTC,AAAS: Science Advances: Table of Contents,2026-06-10 07:00:00+00:00
Human-caused sea level rise drives 21st-century worldwide water level extremes,https://www.science.org/doi/abs/10.1126/sciadv.adz3595?af=R,2026-06-10 07:00:00 UTC,AAAS: Science Advances: Table of Contents,2026-06-10 07:00:00+00:00
A Noachian hydrosphere component in the 4.1-Ga Martian meteorite Teghaza 001,https://www.science.org/doi/abs/10.1126/sciadv.aea3420?af=R,2026-06-10 07:00:00 UTC,AAAS: Science Advances: Table of Contents,2026-06-10 07:00:00+00:00
Precision medicine’s blind spot: Rebalancing the evidence base to reflect women’s health,https://www.science.org/doi/abs/10.1126/sciadv.aei0515?af=R,2026-06-10 07:00:00 UTC,AAAS: Science Advances: Table of Contents,2026-06-10 07:00:00+00:00
Lymph node microenvironment remodeling unlocks local antibody-mediated B cell depletion,https://www.science.org/doi/abs/10.1126/sciadv.aed8962?af=R,2026-06-10 07:00:00 UTC,AAAS: Science Advances: Table of Contents,2026-06-10 07:00:00+00:00
PM2.5 air pollution inequities in the US by sector and state: Past trajectories and future directions,https://www.science.org/doi/abs/10.1126/sciadv.aed7425?af=R,2026-06-10 07:00:00 UTC,AAAS: Science Advances: Table of Contents,2026-06-10 07:00:00+00:00
PathTIGR: A pathway topology-informed graph representation learning framework for immunotherapy response prediction,https://www.science.org/doi/abs/10.1126/sciadv.aed6373?af=R,2026-06-10 07:00:00 UTC,AAAS: Science Advances: Table of Contents,2026-06-10 07:00:00+00:00
Multiphase nanocomposite prelithiation agents for service life lithium replenishment in Si-based Li-ion batteries,https://www.science.org/doi/abs/10.1126/sciadv.aed6926?af=R,2026-06-10 07:00:00 UTC,AAAS: Science Advances: Table of Contents,2026-06-10 07:00:00+00:00
Quantum algorithms for viscosity solutions to nonlinear Hamilton–Jacobi equations based on an entropy penalization method,https://www.pnas.org/doi/abs/10.1073/pnas.2607144123?mi=eymic2&af=R&access=on&content=articlesChapters&publication=pnas&sortBy=Earliest&target=default,2026-06-10 07:00:00 UTC,Proceedings of the National Academy of Sciences: Keyword search for query,2026-06-10 07:00:00+00:00
Adaptive self-organization of global swidden forests,https://www.pnas.org/doi/abs/10.1073/pnas.2606552123?mi=eymic2&af=R&access=on&content=articlesChapters&publication=pnas&sortBy=Earliest&target=default,2026-06-10 07:00:00 UTC,Proceedings of the National Academy of Sciences: Keyword search for query,2026-06-10 07:00:00+00:00
Ultrarapid MC1R protein and associated plumage color evolution in the domestic chicken,https://www.pnas.org/doi/abs/10.1073/pnas.2605288123?mi=eymic2&af=R&access=on&content=articlesChapters&publication=pnas&sortBy=Earliest&target=default,2026-06-10 07:00:00 UTC,Proceedings of the National Academy of Sciences: Keyword search for query,2026-06-10 07:00:00+00:00
Dark diversity framework reconciles Darwin’s naturalization conundrum for freshwater fish invasions,https://www.pnas.org/doi/abs/10.1073/pnas.2604929123?mi=eymic2&af=R&access=on&content=articlesChapters&publication=pnas&sortBy=Earliest&target=default,2026-06-10 07:00:00 UTC,Proceedings of the National Academy of Sciences: Keyword search for query,2026-06-10 07:00:00+00:00
