title,link,published,source,pub_date
FIGNL1 inhibits homologous recombination in BRCA2 deficient cells by dissociating RAD51 filaments,https://www.science.org/doi/abs/10.1126/science.adt1210?af=R,2025-10-30 07:00:00 UTC,AAAS: Science: Table of Contents,2025-10-30 07:00:00+00:00
Diverse somatic genomic alterations in single neurons in chronic traumatic encephalopathy,https://www.science.org/doi/abs/10.1126/science.adu1351?af=R,2025-10-30 07:00:00 UTC,AAAS: Science: Table of Contents,2025-10-30 07:00:00+00:00
Global methane action pays for itself at least six times over,https://www.science.org/doi/abs/10.1126/science.adu7392?af=R,2025-10-30 07:00:00 UTC,AAAS: Science: Table of Contents,2025-10-30 07:00:00+00:00
Regional encoding of enteric nervous system responses to microbiota and type 2 inflammation,https://www.science.org/doi/abs/10.1126/science.adr3545?af=R,2025-10-30 07:00:00 UTC,AAAS: Science: Table of Contents,2025-10-30 07:00:00+00:00
Conversion of syngas into olefins with high hydrogen atom economy,https://www.science.org/doi/abs/10.1126/science.aea0774?af=R,2025-10-30 07:00:00 UTC,AAAS: Science: Table of Contents,2025-10-30 07:00:00+00:00
Electron accumulation across the perovskite layer enhances tandem solar cells with textured silicon,https://www.science.org/doi/abs/10.1126/science.adx1745?af=R,2025-10-30 07:00:00 UTC,AAAS: Science: Table of Contents,2025-10-30 07:00:00+00:00
Structural dissection of αβ-tubulin heterodimer assembly and disassembly by human tubulin–specific chaperones,https://www.science.org/doi/abs/10.1126/science.ady2708?af=R,2025-10-30 07:00:00 UTC,AAAS: Science: Table of Contents,2025-10-30 07:00:00+00:00
[ASAP] Boosting Ion Transport in Manganese Dioxide Cathodes through Electronically Tuned Molecular Intercalants,http://dx.doi.org/10.1021/jacs.5c08301,2025-10-30 08:55:09 UTC,Journal of the American Chemical Society: Latest Articles (ACS Publications),2025-10-30 08:55:09+00:00
[ASAP] Engineering the Cu(0)–Co2C Interface via Reaction-Induced Reconstruction for CO2 Hydrogenation to C2+ Hydrocarbons,http://dx.doi.org/10.1021/jacs.5c15658,2025-10-30 10:27:07 UTC,Journal of the American Chemical Society: Latest Articles (ACS Publications),2025-10-30 10:27:07+00:00
"Mini-tyrannosaur lived alongside T. rex, extraordinary fossil confirms",https://www.science.org/content/article/mini-tyrannosaur-lived-alongside-t-rex-extraordinary-fossil-confirms,2025-10-30 12:00:00 UTC,Latest News from Science Magazine,2025-10-30 12:00:00+00:00
How one of the world’s rarest and most valuable gemstones gets its vivid colors,https://www.science.org/content/article/how-one-world-s-rarest-and-most-valuable-gemstones-gets-its-vivid-colors,2025-10-30 12:00:00 UTC,Latest News from Science Magazine,2025-10-30 12:00:00+00:00
[ASAP] Traceless 6-O-Lysyl Modification of N-Acetylglucosamine Enables Synthesis and Derivatization of Aggregation-Prone GlcNAcylated Peptides,http://dx.doi.org/10.1021/jacs.5c11038,2025-10-30 12:47:07 UTC,Journal of the American Chemical Society: Latest Articles (ACS Publications),2025-10-30 12:47:07+00:00
[ASAP] Upcycling CO2 and PET Waste: Ampere-Level Formate Electrosynthesis in an Integrated Electrolyzer,http://dx.doi.org/10.1021/jacs.5c11708,2025-10-30 12:48:19 UTC,Journal of the American Chemical Society: Latest Articles (ACS Publications),2025-10-30 12:48:19+00:00
Teesside hydrogen plant decision delayed again,https://www.bbc.com/news/articles/cgql472en09o?at_medium=RSS&at_campaign=rss,2025-10-30 13:26:04 UTC,BBC News,2025-10-30 13:26:04+00:00
What is COP30 and why does it matter?,https://www.bbc.com/news/articles/c04gqez4lkyo?at_medium=RSS&at_campaign=rss,2025-10-30 16:19:30 UTC,BBC News,2025-10-30 16:19:30+00:00
"Detecting the acidity of the ocean with sound, the role of lead in human evolution, and how the universe ends",https://www.science.org/doi/10.1126/science.zo9md0g,2025-10-30 18:00:00 UTC,Science Magazine Podcast,2025-10-30 18:00:00+00:00
[ASAP] Synergistic Electrolyte Design for High-Performance Static Zinc–Bromine Batteries,http://dx.doi.org/10.1021/acsenergylett.5c02463,2025-10-30 19:31:38 UTC,ACS Energy Letters: Latest Articles (ACS Publications),2025-10-30 19:31:38+00:00
