title,link,published,source,pub_date
Realization of room-temperature magnetism and multistep magnetization switching in 2D metallic ferrimagnets,https://www.science.org/doi/abs/10.1126/sciadv.aee0391?af=R,2026-06-24 07:00:00 UTC,AAAS: Science Advances: Table of Contents,2026-06-24 07:00:00+00:00
Image feature embedding with a deep learning framework improves genome-wide association studies on dog endophenotypes,https://www.science.org/doi/abs/10.1126/sciadv.aee1088?af=R,2026-06-24 07:00:00 UTC,AAAS: Science Advances: Table of Contents,2026-06-24 07:00:00+00:00
Profile of John P. Smol,https://www.pnas.org/doi/abs/10.1073/pnas.2615527123?mi=eymic2&af=R&access=on&content=articlesChapters&publication=pnas&sortBy=Earliest&target=default,2026-06-24 07:00:00 UTC,Proceedings of the National Academy of Sciences: Keyword search for query,2026-06-24 07:00:00+00:00
A stable superatomic nitrogen ring crystal under ambient conditions,https://www.science.org/doi/abs/10.1126/sciadv.aee5798?af=R,2026-06-24 07:00:00 UTC,AAAS: Science Advances: Table of Contents,2026-06-24 07:00:00+00:00
Smart contact lens–trained digital twin for device-free personalized uric acid prediction,https://www.science.org/doi/abs/10.1126/sciadv.aee8506?af=R,2026-06-24 07:00:00 UTC,AAAS: Science Advances: Table of Contents,2026-06-24 07:00:00+00:00
Inflammatory monocytes constrain YAP-induced cell proliferation,https://www.science.org/doi/abs/10.1126/sciadv.aee8580?af=R,2026-06-24 07:00:00 UTC,AAAS: Science Advances: Table of Contents,2026-06-24 07:00:00+00:00
Multihydrogen-bond-bridged composite solid electrolytes enabling continuous Li+ pathways for stable solid-state lithium batteries,https://www.science.org/doi/abs/10.1126/sciadv.aed5972?af=R,2026-06-24 07:00:00 UTC,AAAS: Science Advances: Table of Contents,2026-06-24 07:00:00+00:00
The wisdom of crowds emerges in flocks of thousands of migrating songbirds,https://www.science.org/doi/abs/10.1126/sciadv.aef3512?af=R,2026-06-24 07:00:00 UTC,AAAS: Science Advances: Table of Contents,2026-06-24 07:00:00+00:00
Decoding skeletal diversity and complexity: A biomimetic and photochemical remodeling strategy,https://www.science.org/doi/abs/10.1126/sciadv.aeh0883?af=R,2026-06-24 07:00:00 UTC,AAAS: Science Advances: Table of Contents,2026-06-24 07:00:00+00:00
"A modular hydrogel system with independent control of bioadhesion, fibrosis, and stiffness",https://www.science.org/doi/abs/10.1126/sciadv.aee3894?af=R,2026-06-24 07:00:00 UTC,AAAS: Science Advances: Table of Contents,2026-06-24 07:00:00+00:00
"NatPower, Tesla agree to deploy more than 25 GWh of BESS in Europe",https://www.ess-news.com/2026/06/24/natpower-tesla-agree-to-deploy-more-than-25-gwh-of-bess-in-europe/,2026-06-24 07:00:00 UTC,Latest news about ESS Projects & Applications | ESS News,2026-06-24 07:00:00+00:00
Clearing the noise to predict the rhythm of the North Atlantic climate,https://www.science.org/doi/abs/10.1126/sciadv.aed8616?af=R,2026-06-24 07:00:00 UTC,AAAS: Science Advances: Table of Contents,2026-06-24 07:00:00+00:00
Co-option and innovation in neural crest evolution,https://www.science.org/doi/abs/10.1126/sciadv.aed9037?af=R,2026-06-24 07:00:00 UTC,AAAS: Science Advances: Table of Contents,2026-06-24 07:00:00+00:00
"A battery-free wireless intelligent aligner for spatially resolved, closed-loop theranostics of chronic oral diseases",https://www.science.org/doi/abs/10.1126/sciadv.aeg9950?af=R,2026-06-24 07:00:00 UTC,AAAS: Science Advances: Table of Contents,2026-06-24 07:00:00+00:00
Fox ESS secures 10 GWh of Australian battery supply deals,https://www.ess-news.com/2026/06/24/fox-ess-secures-10-gwh-of-australian-battery-supply-deals/,2026-06-24 07:30:00 UTC,Latest news about ESS Projects & Applications | ESS News,2026-06-24 07:30:00+00:00
BioCirc Launches World’s Largest BECCS Facility In Denmark,https://carbonherald.com/biocirc-launches-worlds-largest-beccs-facility-in-denmark/?utm_source=rss&utm_medium=rss&utm_campaign=biocirc-launches-worlds-largest-beccs-facility-in-denmark,2026-06-24 07:54:52 UTC,Carbon Herald,2026-06-24 07:54:52+00:00
"Ore Energy, Budget Thuis announce 1 GWh iron-air storage deal",https://www.ess-news.com/2026/06/24/ore-energy-budget-thuis-announce-1-gwh-iron-air-storage-deal/,2026-06-24 08:00:00 UTC,Latest news about ESS Projects & Applications | ESS News,2026-06-24 08:00:00+00:00
"Inbreeding didn’t doom the Neanderthals, study suggests",https://www.science.org/content/article/inbreeding-didn-t-doom-neanderthals-study-suggests,2026-06-24 08:00:00 UTC,Latest News from Science Magazine,2026-06-24 08:00:00+00:00
Nano‐Antenna Reactors With Spatially Coordinated Microenvironments Enable Atmospheric CO2 Photoreduction to C2H6,https://advanced.onlinelibrary.wiley.com/doi/10.1002/adma.73817?af=R,2026-06-24 08:11:02 UTC,Wiley: Advanced Materials: Table of Contents,2026-06-24 08:11:02+00:00
Confinement‐Engineered Ir‐IrO2 Interfaces Activate Hydrogen‐Bond‐Mediated Oxide Pathway Mechanism for Durable Acidic Water Oxidation,https://advanced.onlinelibrary.wiley.com/doi/10.1002/adma.73818?af=R,2026-06-24 08:12:43 UTC,Wiley: Advanced Materials: Table of Contents,2026-06-24 08:12:43+00:00
E. coli Extracellular Matrix: A Tunable Composite With Hierarchical Structure,https://advanced.onlinelibrary.wiley.com/doi/10.1002/adma.73724?af=R,2026-06-24 08:13:38 UTC,Wiley: Advanced Materials: Table of Contents,2026-06-24 08:13:38+00:00
Fluorobenzene‐Mediated Dragging Effect Boosting Bulk/Interfacial Ion Transport Enables −50°C Operation of Long‐Life Potassium‐Ion Batteries,https://advanced.onlinelibrary.wiley.com/doi/10.1002/adma.73768?af=R,2026-06-24 08:17:21 UTC,Wiley: Advanced Materials: Table of Contents,2026-06-24 08:17:21+00:00
Modulation of Local Environment for Selective Bicarbonate Conversion to Multi‐Carbon Products,https://advanced.onlinelibrary.wiley.com/doi/10.1002/aenm.71214?af=R,2026-06-24 10:32:34 UTC,Wiley: Advanced Energy Materials: Table of Contents,2026-06-24 10:32:34+00:00
Iron‐Based Sodium‐Salt Composite Cathode for Sodium‐Ion Batteries,https://advanced.onlinelibrary.wiley.com/doi/10.1002/aenm.71154?af=R,2026-06-24 10:33:58 UTC,Wiley: Advanced Energy Materials: Table of Contents,2026-06-24 10:33:58+00:00
Boosting Oxygen Reduction via Nanotwinned High‐Entropy Aerogels With Deficient Pd Coordination and Multi‐d‐Orbital Hybridization for Zinc‐Air Battery Applications,https://advanced.onlinelibrary.wiley.com/doi/10.1002/aenm.71223?af=R,2026-06-24 10:35:36 UTC,Wiley: Advanced Energy Materials: Table of Contents,2026-06-24 10:35:36+00:00
Boosting Proton Conduction and Oxygen Reduction Kinetics via In Situ Reverse Atom Capture for Protonic Ceramic Fuel Cell Cathodes,https://advanced.onlinelibrary.wiley.com/doi/10.1002/aenm.71226?af=R,2026-06-24 10:36:16 UTC,Wiley: Advanced Energy Materials: Table of Contents,2026-06-24 10:36:16+00:00
Practical Perspectives and Energy Density Criteria for Current Collector Engineering in Anode‐Free Li‐Metal Batteries,https://advanced.onlinelibrary.wiley.com/doi/10.1002/aenm.71220?af=R,2026-06-24 10:39:45 UTC,Wiley: Advanced Energy Materials: Table of Contents,2026-06-24 10:39:45+00:00
Chiral Molecular Configuration‐Mediated Crystallization of Perovskites for High‐Performance Solar Cells,https://advanced.onlinelibrary.wiley.com/doi/10.1002/aenm.71222?af=R,2026-06-24 10:41:02 UTC,Wiley: Advanced Energy Materials: Table of Contents,2026-06-24 10:41:02+00:00
Novo Nordisk And Re.green To Restore Amazonian Forest In New CDR Deal,https://carbonherald.com/novo-nordisk-and-re-green-to-restore-amazonian-forest-in-new-cdr-deal/?utm_source=rss&utm_medium=rss&utm_campaign=novo-nordisk-and-re-green-to-restore-amazonian-forest-in-new-cdr-deal,2026-06-24 10:56:08 UTC,Carbon Herald,2026-06-24 10:56:08+00:00
Why were mysterious ancient humans found in an African cave all female?,https://www.science.org/content/article/why-were-mysterious-ancient-humans-found-african-cave-all-female,2026-06-24 11:00:00 UTC,Latest News from Science Magazine,2026-06-24 11:00:00+00:00
"WOOD & Company, Delta Capacity complete 70 MW/160 MWh BESS",https://www.ess-news.com/2026/06/24/wood-company-delta-capacity-say-they-completed-nordics-largest-bess/,2026-06-24 11:00:00 UTC,Latest news about ESS Projects & Applications | ESS News,2026-06-24 11:00:00+00:00
Retraction questions claim that cancer therapy works better in morning,https://www.science.org/content/article/retraction-questions-claim-cancer-therapy-works-better-morning,2026-06-24 11:20:00 UTC,Latest News from Science Magazine,2026-06-24 11:20:00+00:00
ITM Power and DB Systemtechnik deepen rail decarbonization collaboration,https://hydrogentechworld.com/itm-power-and-db-systemtechnik-deepen-rail-decarbonization-collaboration,2026-06-24 11:27:24 UTC,Hydrogen Tech World.com,2026-06-24 11:27:24+00:00
Why this heatwave feels worse than the last one,https://www.bbc.co.uk/weather/articles/c3vyzly206no?at_medium=RSS&at_campaign=rss,2026-06-24 12:24:39 UTC,BBC News,2026-06-24 12:24:39+00:00
Synergistic Anion‐Reinforced Solvation Chemistry and Cationic Electrostatic Shielding for Fast‐Charging Sodium‐Ion Full Batteries Over a Wide Temperature Range,https://onlinelibrary.wiley.com/doi/10.1002/anie.3303191?af=R,2026-06-24 12:58:41 UTC,Wiley: Angewandte Chemie International Edition: Table of Contents,2026-06-24 12:58:41+00:00
Tuning the Mechanical Properties of Crosslinked Copolymers via Sequence and Solvent‐Selective Swelling for Vat Photopolymerization,https://onlinelibrary.wiley.com/doi/10.1002/anie.8144140?af=R,2026-06-24 13:01:14 UTC,Wiley: Angewandte Chemie International Edition: Table of Contents,2026-06-24 13:01:14+00:00
Outside Back Cover: Facet‐Dependent Water Inhibition of Alkanol Dehydration on TiO2 via Distinct Water–Alkanol Complexes,https://onlinelibrary.wiley.com/doi/10.1002/anie.2026-m1906014500?af=R,2026-06-24 13:02:31 UTC,Wiley: Angewandte Chemie International Edition: Table of Contents,2026-06-24 13:02:31+00:00
Flame‐Retardant Quasi‐Solid‐State Electrolytes From Self‐Assembled Azolate Hybrid Frameworks for Highly Safe Lithium Batteries,https://onlinelibrary.wiley.com/doi/10.1002/anie.1279221?af=R,2026-06-24 13:03:56 UTC,Wiley: Angewandte Chemie International Edition: Table of Contents,2026-06-24 13:03:56+00:00
Electrochemically Triggered Supramolecular Polymerization Under Kinetic Control,https://onlinelibrary.wiley.com/doi/10.1002/anie.8733637?af=R,2026-06-24 13:06:03 UTC,Wiley: Angewandte Chemie International Edition: Table of Contents,2026-06-24 13:06:03+00:00
Water‐Mediated SEI in Fluorinated Alkoxylborate Electrolytes for Long‐Cycling Calcium Metal Anodes,https://onlinelibrary.wiley.com/doi/10.1002/anie.6048136?af=R,2026-06-24 13:06:48 UTC,Wiley: Angewandte Chemie International Edition: Table of Contents,2026-06-24 13:06:48+00:00
Interstitial Copper Doping and Thermally Activated Rattling in La3‐xTe4 for Enhanced Thermoelectric Performance,https://onlinelibrary.wiley.com/doi/10.1002/anie.1695429?af=R,2026-06-24 13:08:08 UTC,Wiley: Angewandte Chemie International Edition: Table of Contents,2026-06-24 13:08:08+00:00
Inside Back Cover: Large‐Diameter DNA‐Scaffolded Nanopores Enabled by Loosely Packed Peptides for Single‐Molecule Sensing,https://onlinelibrary.wiley.com/doi/10.1002/anie.2026-m1906020000?af=R,2026-06-24 13:10:50 UTC,Wiley: Angewandte Chemie International Edition: Table of Contents,2026-06-24 13:10:50+00:00
Crosslinking of Linear Polyimines Into Aminal‐Linked Porous Organic Polymers for C2 Hydrocarbon/Methane Separation,https://onlinelibrary.wiley.com/doi/10.1002/anie.5692086?af=R,2026-06-24 13:13:09 UTC,Wiley: Angewandte Chemie International Edition: Table of Contents,2026-06-24 13:13:09+00:00
Surface BO3 Configuration in Li‐Rich Cathode Materials Enabling Highly‐Stable Anionic Redox Reactions,https://onlinelibrary.wiley.com/doi/10.1002/anie.5674026?af=R,2026-06-24 13:16:56 UTC,Wiley: Angewandte Chemie International Edition: Table of Contents,2026-06-24 13:16:56+00:00
Force‐Locking DNA Hairpin Probes for High‐Throughput and Cumulative Detection of Intercellular Molecular Tensions,https://onlinelibrary.wiley.com/doi/10.1002/anie.6632525?af=R,2026-06-24 13:32:27 UTC,Wiley: Angewandte Chemie International Edition: Table of Contents,2026-06-24 13:32:27+00:00
Hydrogel‐Engineered Interface Suppressing Water Activity by Hydrogen Bonds and Regulated Solvation for Stable Zn Metal Anodes,https://advanced.onlinelibrary.wiley.com/doi/10.1002/aenm.71211?af=R,2026-06-24 13:39:12 UTC,Wiley: Advanced Energy Materials: Table of Contents,2026-06-24 13:39:12+00:00
Måde PtX facility starts hydrogen production,https://hydrogentechworld.com/made-ptx-facility-starts-hydrogen-production,2026-06-24 13:40:31 UTC,Hydrogen Tech World.com,2026-06-24 13:40:31+00:00
Solar‐Driven Photothermal Hydrogen Production: Recent Advances and Future Perspectives,https://advanced.onlinelibrary.wiley.com/doi/10.1002/aenm.70941?af=R,2026-06-24 13:52:06 UTC,Wiley: Advanced Energy Materials: Table of Contents,2026-06-24 13:52:06+00:00
Issue Information,https://advanced.onlinelibrary.wiley.com/doi/10.1002/aenm.71119?af=R,2026-06-24 13:52:06 UTC,Wiley: Advanced Energy Materials: Table of Contents,2026-06-24 13:52:06+00:00
Solar‐Driven Photothermal Hydrogen Production: Recent Advances and Future Perspectives (Adv. Energy Mater. 24/2026),https://advanced.onlinelibrary.wiley.com/doi/10.1002/aenm.71120?af=R,2026-06-24 13:52:06 UTC,Wiley: Advanced Energy Materials: Table of Contents,2026-06-24 13:52:06+00:00
Disorder‐Driven Fast Na+ Transport: From Crystalline to Amorphous Networks in the Mixed‐Anion NaTaOxCl6−2x Oxychlorides,https://advanced.onlinelibrary.wiley.com/doi/10.1002/aenm.70977?af=R,2026-06-24 13:52:06 UTC,Wiley: Advanced Energy Materials: Table of Contents,2026-06-24 13:52:06+00:00
π‐Conjugation and Hole–Electron Separation in Self‐Assembled Monolayers Enables Efficient Inverted Perovskite Solar Cells,https://advanced.onlinelibrary.wiley.com/doi/10.1002/aenm.70942?af=R,2026-06-24 13:52:06 UTC,Wiley: Advanced Energy Materials: Table of Contents,2026-06-24 13:52:06+00:00
LiMn0.5Fe0.5PO4: A Cathode Material for Lithium‐Ion Batteries: A Comprehensive Review,https://advanced.onlinelibrary.wiley.com/doi/10.1002/aenm.71014?af=R,2026-06-24 13:52:06 UTC,Wiley: Advanced Energy Materials: Table of Contents,2026-06-24 13:52:06+00:00
"Surface Reconstruction in High‐Entropy OER Electrocatalysts: Mechanisms, Energy Consumption, and Design Principles",https://advanced.onlinelibrary.wiley.com/doi/10.1002/aenm.71012?af=R,2026-06-24 13:52:06 UTC,Wiley: Advanced Energy Materials: Table of Contents,2026-06-24 13:52:06+00:00
Sustainable Radiative Cooling Materials Enabled by Engineered Lignocellulose,https://advanced.onlinelibrary.wiley.com/doi/10.1002/aenm.71007?af=R,2026-06-24 13:52:06 UTC,Wiley: Advanced Energy Materials: Table of Contents,2026-06-24 13:52:06+00:00
Advances and Perspectives of Electrolyte Modification Strategies for Vanadium‐Based Materials in Aqueous Zinc‐Ion Batteries,https://advanced.onlinelibrary.wiley.com/doi/10.1002/aenm.71016?af=R,2026-06-24 13:52:06 UTC,Wiley: Advanced Energy Materials: Table of Contents,2026-06-24 13:52:06+00:00
3D Interconnected Zn‐Ion Pathways Through Anionic Nanochannels Surrounding Bacterial Cellulose Nanofibers by Repetitive Interfacial Assembly for Aqueous Zn‐Ion Battery Separators (Adv. Energy Mater. 24/2026),https://advanced.onlinelibrary.wiley.com/doi/10.1002/aenm.71121?af=R,2026-06-24 13:52:06 UTC,Wiley: Advanced Energy Materials: Table of Contents,2026-06-24 13:52:06+00:00
Integrating Anionic Chemistry in Cosolvent Electrolyte for High‐Performance Aqueous Zn Metal Batteries,https://advanced.onlinelibrary.wiley.com/doi/10.1002/aenm.70974?af=R,2026-06-24 13:52:06 UTC,Wiley: Advanced Energy Materials: Table of Contents,2026-06-24 13:52:06+00:00
Synergistic Manipulating Electron Buffer and Hydrogen Spillover of Pt Catalysts for Ampere‐Level Efficient and Durable Hydrogen Evolution,https://advanced.onlinelibrary.wiley.com/doi/10.1002/aenm.70959?af=R,2026-06-24 13:52:06 UTC,Wiley: Advanced Energy Materials: Table of Contents,2026-06-24 13:52:06+00:00
Tuning Multi‐Active Sites in Ni(OH)2 Catalyst via V/Ru Doping for Ampere‐Level Upcycling of Polyethylene Terephthalate Plastic,https://advanced.onlinelibrary.wiley.com/doi/10.1002/aenm.70958?af=R,2026-06-24 13:52:06 UTC,Wiley: Advanced Energy Materials: Table of Contents,2026-06-24 13:52:06+00:00
Rigid vs Flexible COFs: Skeleton Engineering Strategies for Enhancing Lithium‐Ion Storage,https://advanced.onlinelibrary.wiley.com/doi/10.1002/aenm.70971?af=R,2026-06-24 13:52:06 UTC,Wiley: Advanced Energy Materials: Table of Contents,2026-06-24 13:52:06+00:00
Tungsten‐Mediated Hydroxyl Supply Enhances PtIr Activity Toward Electrochemical Ammonia Oxidation for High‐Performance Direct Ammonia Fuel Cells,https://advanced.onlinelibrary.wiley.com/doi/10.1002/aenm.70968?af=R,2026-06-24 13:52:06 UTC,Wiley: Advanced Energy Materials: Table of Contents,2026-06-24 13:52:06+00:00
Interface Engineering With Annealed MXene and SAM Molecules for High‐Performance Inverted Perovskite Solar Cells,https://advanced.onlinelibrary.wiley.com/doi/10.1002/aenm.70966?af=R,2026-06-24 13:52:06 UTC,Wiley: Advanced Energy Materials: Table of Contents,2026-06-24 13:52:06+00:00
Two‐Dimensional Template Induced Ultradense Solid Polymer Electrolytes for High‐Performance Solid‐State Lithium Batteries,https://advanced.onlinelibrary.wiley.com/doi/10.1002/aenm.70943?af=R,2026-06-24 13:52:06 UTC,Wiley: Advanced Energy Materials: Table of Contents,2026-06-24 13:52:06+00:00
Building a Long‐Cycle‐Life Rechargeable Daniel Cell from Solvent Isotope Effect of Hydrogen,https://advanced.onlinelibrary.wiley.com/doi/10.1002/aenm.70982?af=R,2026-06-24 13:52:06 UTC,Wiley: Advanced Energy Materials: Table of Contents,2026-06-24 13:52:06+00:00
3D Interconnected Zn‐Ion Pathways Through Anionic Nanochannels Surrounding Bacterial Cellulose Nanofibers by Repetitive Interfacial Assembly for Aqueous Zn‐Ion Battery Separators,https://advanced.onlinelibrary.wiley.com/doi/10.1002/aenm.70929?af=R,2026-06-24 13:52:06 UTC,Wiley: Advanced Energy Materials: Table of Contents,2026-06-24 13:52:06+00:00
Self‐Heating and Thermal Gradient in Solid‐State Batteries: Friend or Foe?,https://advanced.onlinelibrary.wiley.com/doi/10.1002/aenm.70978?af=R,2026-06-24 13:52:06 UTC,Wiley: Advanced Energy Materials: Table of Contents,2026-06-24 13:52:06+00:00
A Low‐Viscosity Electrolyte With Fluorine‐Rich Interphase Empowers Stable High‐kinetics and Cold‐Resistant SPAN Cathodes,https://advanced.onlinelibrary.wiley.com/doi/10.1002/aenm.70976?af=R,2026-06-24 13:52:06 UTC,Wiley: Advanced Energy Materials: Table of Contents,2026-06-24 13:52:06+00:00
A Thermo‐Responsive Refractive Index‐Matching Film for Solar Modulation of Smart Windows,https://advanced.onlinelibrary.wiley.com/doi/10.1002/aenm.70975?af=R,2026-06-24 13:52:06 UTC,Wiley: Advanced Energy Materials: Table of Contents,2026-06-24 13:52:06+00:00
Multi‐Level Design and Irreversible Ion Exchange Involved Sodium‐Storage Mechanism of Zero‐Strain K2Ti6O13 Toward Sodium‐Ion Capacitors,https://advanced.onlinelibrary.wiley.com/doi/10.1002/aenm.70969?af=R,2026-06-24 13:52:06 UTC,Wiley: Advanced Energy Materials: Table of Contents,2026-06-24 13:52:06+00:00
Suppressing Dissolution of Solid Electrolyte Interphase Enables Highly Stable Sodium‐Ion Batteries,https://advanced.onlinelibrary.wiley.com/doi/10.1002/aenm.70981?af=R,2026-06-24 13:52:06 UTC,Wiley: Advanced Energy Materials: Table of Contents,2026-06-24 13:52:06+00:00
New Nonprofit Alliance Seeks To Strengthen Corporate Action On Superpollutants,https://carbonherald.com/new-nonprofit-alliance-seeks-to-strengthen-corporate-action-on-superpollutants/?utm_source=rss&utm_medium=rss&utm_campaign=new-nonprofit-alliance-seeks-to-strengthen-corporate-action-on-superpollutants,2026-06-24 14:16:28 UTC,Carbon Herald,2026-06-24 14:16:28+00:00
"Heat pump growth stalls as government support cut, warns climate watchdog",https://www.bbc.co.uk/news/articles/cn8k4pek3gzo?at_medium=RSS&at_campaign=rss,2026-06-24 14:32:02 UTC,BBC News,2026-06-24 14:32:02+00:00
16 Winners Will Share The Nearly $30M Award From Tencent’s CarbonX 2.0 Program,https://carbonherald.com/16-winners-will-share-the-nearly-30m-award-from-tencents-carbonx-2-0-program/?utm_source=rss&utm_medium=rss&utm_campaign=16-winners-will-share-the-nearly-30m-award-from-tencents-carbonx-2-0-program,2026-06-24 14:54:55 UTC,Carbon Herald,2026-06-24 14:54:55+00:00
Hottest June day on record for the UK as temperature reaches 36C,https://www.bbc.co.uk/weather/articles/cwy0n6r5zrzo?at_medium=RSS&at_campaign=rss,2026-06-24 15:23:41 UTC,BBC News,2026-06-24 15:23:41+00:00
Europe’s extreme heat is shutting down power plants,https://www.technologyreview.com/2026/06/24/1139676/europe-heat-power-plants/,2026-06-24 15:25:28 UTC,Climate change and energy – MIT Technology Review,2026-06-24 15:25:28+00:00
Built-In Electric Fields and Ir-Cl Motifs at Heterointerfaces Enable Selective and Durable Seawater Electrolysis,http://pubs.rsc.org/en/Content/ArticleLanding/2026/EE/D6EE02150F,2026-06-24 23:00:00 UTC,RSC - Energy Environ. Sci. latest articles,2026-06-24 23:00:00+00:00
Antibacterial drug discovery: challenges and preclinical promises from synthetic small molecules,http://pubs.rsc.org/en/Content/ArticleLanding/2026/CS/D5CS00617A,2026-06-24 23:00:00 UTC,RSC - Chem. Soc. Rev. latest articles,2026-06-24 23:00:00+00:00
Contact loss in all-solid-state Li-ion batteries via deposition of impurities,https://www.cell.com/joule/fulltext/S2542-4351(26)00223-0?rss=yes,2026-06-25 00:00:00 UTC,Joule,2026-06-25 00:00:00+00:00
The role of hydrogen in a global net-zero greenhouse gas emission plastics industry,https://www.cell.com/joule/fulltext/S2542-4351(26)00221-7?rss=yes,2026-06-25 00:00:00 UTC,Joule,2026-06-25 00:00:00+00:00
Molecular neighbours reshape protein dynamics,https://www.nature.com/articles/s41557-026-02194-7,2026-06-25 00:00:00 UTC,Nature Chemistry,2026-06-25 00:00:00+00:00
A polarized high-field infrared instrument reveals giant infrared chirality in Weyl semimetals,https://academic.oup.com/nsr/advance-article/doi/10.1093/nsr/nwag390/8716361?rss=1,2026-06-25 00:00:00 UTC,National Science Review Advance Access,2026-06-25 00:00:00+00:00
Bulk-to-interphase polybromide confinement and electric-field-responsive recovery enable Ah-level aqueous zinc-bromine batteries at room/low temperatures,https://academic.oup.com/nsr/advance-article/doi/10.1093/nsr/nwag393/8716362?rss=1,2026-06-25 00:00:00 UTC,National Science Review Advance Access,2026-06-25 00:00:00+00:00
Ultralow-dose X-ray imaging enabled by vertically homogeneous perovskite films,https://academic.oup.com/nsr/advance-article/doi/10.1093/nsr/nwag391/8716367?rss=1,2026-06-25 00:00:00 UTC,National Science Review Advance Access,2026-06-25 00:00:00+00:00
Heterogeneous viral-host response at single-cell resolution and viral adaptive mutational atlas in birds and mammals upon H5 influenza virus infection,https://academic.oup.com/nsr/advance-article/doi/10.1093/nsr/nwag380/8716371?rss=1,2026-06-25 00:00:00 UTC,National Science Review Advance Access,2026-06-25 00:00:00+00:00
‘Edited’ human embryos reveal secrets of our development — and fuel ethical debate,https://www.nature.com/articles/d41586-026-02027-0,2026-06-25 00:00:00 UTC,Nature,2026-06-25 00:00:00+00:00
Electric fields probe the symmetry of the ‘heavy hydrogen’ nucleus,https://www.nature.com/articles/d41586-026-02036-z,2026-06-25 00:00:00 UTC,Nature,2026-06-25 00:00:00+00:00
How long-term dietary cholesterol can slow down its own clearance by liver cells,https://www.nature.com/articles/d41586-026-01899-6,2026-06-25 00:00:00 UTC,Nature,2026-06-25 00:00:00+00:00
Can you terraform Mars? Try Nature’s game,https://www.nature.com/articles/d41586-026-01978-8,2026-06-25 00:00:00 UTC,Nature,2026-06-25 00:00:00+00:00
China’s LineShine just topped the global supercomputer ranking: what you need to know,https://www.nature.com/articles/d41586-026-02047-w,2026-06-25 00:00:00 UTC,Nature,2026-06-25 00:00:00+00:00
"Oo oo, ha ha: why humans and great apes giggle alike when tickled",https://www.nature.com/articles/d41586-026-01994-8,2026-06-25 00:00:00 UTC,Nature,2026-06-25 00:00:00+00:00
US funding uncertainties threaten to sink key global oceanography projects,https://www.nature.com/articles/d41586-026-02028-z,2026-06-25 00:00:00 UTC,Nature,2026-06-25 00:00:00+00:00
Ketones to ketyls by radical relocation,https://www.nature.com/articles/s41557-026-02181-y,2026-06-25 00:00:00 UTC,Nature Chemistry,2026-06-25 00:00:00+00:00
Ligand-enabled distal desaturative lactonization of aliphatic acids,https://www.nature.com/articles/s41586-026-10826-8,2026-06-25 00:00:00 UTC,Nature,2026-06-25 00:00:00+00:00
Publisher Correction: In situ nanocrystal confinement for efficient blue perovskite LEDs,https://www.nature.com/articles/s41586-026-10829-5,2026-06-25 00:00:00 UTC,Nature,2026-06-25 00:00:00+00:00
A highly conductive polar metal with efficient charge–spin conversion,https://www.nature.com/articles/s41563-026-02639-x,2026-06-25 00:00:00 UTC,Nature Materials,2026-06-25 00:00:00+00:00
Batteries versus fuel cells for decarbonizing medium- and heavy-duty vehicles across applications,https://www.nature.com/articles/s41560-026-02095-6,2026-06-25 00:00:00 UTC,Nature Energy,2026-06-25 00:00:00+00:00
A cascade hole-transfer strategy towards stable hybrid perovskite solar cells,https://www.nature.com/articles/s41560-026-02088-5,2026-06-25 00:00:00 UTC,Nature Energy,2026-06-25 00:00:00+00:00
Base editing reveals an essential role for NANOG in human embryogenesis,https://www.nature.com/articles/s41586-026-10792-1,2026-06-25 00:00:00 UTC,Nature,2026-06-25 00:00:00+00:00
