title,link,source,published_str,pub_date,doi,last_author,abstract,abstract_source,must_have_abstract
High-entropy-inspired multi-principal single-atom materials,https://www.cell.com/chem/fulltext/S2451-9294(26)00219-6?rss=yes,Chem,2026-07-23 00:00:00 UTC,2026-07-23 00:00:00+00:00,10.1016/j.chempr.2026.103153,Hsien-Yi Hsu,"Multi-principal single-atom materials (MPSAMs) are inspired by the compositional complexity of high-entropy materials and the site-specific control of single-atom catalysis. This perspective conceptualizes key terminology, examines how high-entropy principles shape atomically dispersed designs, and critically assesses strategies to control atomic arrangements. The discussion explores how MPSAMs support cooperative functions across multiple metal sites within a confined space, enabling reactivity and selectivity unattainable with conventional SAMs. Challenges and future outlooks for entropy-informed catalyst design are further outlined.",rss_cell,0
Magnetic brightening and nanoscale imaging of spin-polarized helical edge modes in ZrTe5,https://www.nature.com/articles/s41565-026-02193-2,Nature Nanotechnology,2026-07-23 00:00:00 UTC,2026-07-23 00:00:00+00:00,10.1038/s41565-026-02193-2,Jigang Wang,"Efficient charge transport remains a fundamental challenge for nanoelectronic devices, as their performance is constrained by high dissipation and the impedance mismatch between high-frequency signal sources and nanoscale circuit interfaces. Although topologically protected helical edge modes offer a dissipationless and backscattering-resilient alternative, achieving nanoscale control over these modes requires direct visualization of their spatial electrodynamics, especially under high-frequency operation. Here, by utilizing cryogenic magneto-infrared scattering-type scanning near-field optical microscopy (cm-IR-sSNOM), we image spin-polarized helical edge channels in ZrTe5 at the nanoscale, revealing magnetic-field-induced brightening as a high-frequency electrodynamic signature of robust topological edge modes. Operating at 1.8 K and under a magnetic field of up to 5 T, we observe the emergence of edge-state polarizability at infrared frequencies that is notably resilient to the magnetic gaps that typically quench d.c. and microwave edge transport. Our results reveal a topological ‘two-lane’ spatial reorganization in which an external magnetic field induces a spin-population imbalance between counterpropagating edge modes. Favoured helical branches are confined against physical boundaries to activate a net infrared near-field contrast. This electrodynamic response scales linearly with the number of atomic layers, which confirms that individual layers in ZrTe5 preserve their discrete quantum spin Hall identities. These findings may be useful for developing topological spintronic devices, as the magnetic infrared tunability of helical edge channels provides a pathway for low-loss nanoscale interconnects and high-speed information processing.",nature_html,0
Dynamic delocalization of stress in brittle battery positive electrode active materials by shape-memory polymer nanocoating,https://www.nature.com/articles/s41565-026-02224-y,Nature Nanotechnology,2026-07-23 00:00:00 UTC,2026-07-23 00:00:00+00:00,10.1038/s41565-026-02224-y,Qiang Liu,"Stress-induced fractures are recognized as a primary cause of degradation in a wide range of positive electrode active materials during battery operation. However, the state-of-the-art mechanistic understanding and strategy development often overlook the brittle nature of these materials, as well as the dynamic and localized characteristics of mechanical stress during the charge and discharge cycles of the cell. Here we present a shape-memory polymer nanocoating method using initiated chemical vapour deposition to dynamically delocalize concentrated stresses in various positive electrode active materials, including Ni-rich layered oxides with different Ni contents and LiFePO4. Fracture simulations and surface-to-bulk physicochemical characterizations collectively show that the balanced stiffness and deformability of the shape-memory polymer nanocoating on the positive electrode material effectively mitigate stress gradients and the consequent surface reconstruction, chemical heterogeneity and intergranular cracking during battery operation. In particular, when a polymeric nanocoated nickel-rich layered oxide positive electrode active material (90 at% of Ni) is tested in non-aqueous lithium metal coin cell configuration at 25 °C, the cells can be consistently charged and discharged over long cycles at moderate (for example, 1,000 cycles at 400 mA g−1) and high (for example, 500 cycles at 1 A g−1) specific currents.",nature_html,0
Immunostimulatory lipogel implant enhances cancer immunotherapy,https://www.nature.com/articles/s41565-026-02194-1,Nature Nanotechnology,2026-07-23 00:00:00 UTC,2026-07-23 00:00:00+00:00,10.1038/s41565-026-02194-1,Ran Mo,"Cancer stem-like cells contribute to innate tumour immunoresistance and an immunosuppressive tumour microenvironment, leading to poor responses to immune checkpoint inhibitors. Chemotherapeutic agents can elicit tumour immunogenicity by inducing immunogenic cell death to reinforce the therapeutic efficacies of immune checkpoint inhibitors, but suffer from inefficient immunogenic cell death activation in highly resistant cancer stem-like cells. Here we report an immunostimulatory lyotropic liquid-crystal-based lipogel for localized co-delivery of all-trans retinoic acid, a differentiation-inducing drug, and doxorubicin, an immunogenic-cell-death-inducing chemotherapeutic agent with distinct release kinetics. The lipogel is tailored to release the combinatorial drugs in a differential and sustained manner, which fulfils the requirement for enhanced drug synergism in promoting the immunogenic cell death of cancer stem-like cells. Local implantation of the immunostimulatory lipogel elicits an antitumour immune response that is further augmented by an immune checkpoint inhibitor to suppress tumour growth and metastasis, as well as to prevent post-surgical recurrence in murine models of high-stemness tumours.",nature_html,0
Low-temperature oxide-ion conduction in Aurivillius-type ((Na0.5Bi0.5)n–1TinO3n)(Bi2O2) phases,https://www.nature.com/articles/s41560-026-02115-5,Nature Energy,2026-07-23 00:00:00 UTC,2026-07-23 00:00:00+00:00,10.1038/s41560-026-02115-5,Jun Chen,"Solid oxide-ion conductors are key functional materials in high-temperature (>500 °C) electrochemical energy technologies, such as solid oxide fuel cells. Operating these devices at lower temperatures could simplify system design, reduce degradation and broaden material options, but few conductors exhibit sufficient ion mobility in this regime. Here we report a family of oxide-ion conductors based on ((Na0.5Bi0.5)n–1TinO3n)(Bi2O2) (where n = 4, 5, 7 and 8) Aurivillius-type thin films with promising low-temperature performance. These Aurivillius phases, characterized by periodic bismuth oxide layers and a tetragonally distorted Na0.5Bi0.5TiO3 lattice, establish well-defined periodic fast ion-conducting channels allowing ionic conductivity of 0.025 S cm−1 at 350 °C. Combining atomic-scale electron ptychography imaging with first-principles calculations, we attribute these intriguing properties to localized lattice stretching and the unique dual-ion conduction pathways induced by the specific bismuth oxide intercalation. Based on this design, we constructed fuel cells that achieve a maximum power density of 0.726 W cm−2 at 400 °C, showing promising potential for technological applications.",nature_html,0
Van der Waals surface reconstruction for oriented epitaxial growth of two-dimensional metallic oxides,https://www.nature.com/articles/s41563-026-02683-7,Nature Materials,2026-07-23 00:00:00 UTC,2026-07-23 00:00:00+00:00,10.1038/s41563-026-02683-7,Lijie Zhang,"Hybrid integration of two-dimensional single-crystalline metal oxides, including semiconductors, dielectrics, ferroelectrics and ferromagnetics, with silicon circuits enables functionalities such as spintronics and neuromorphic and quantum computing, forming a key part of the ‘More-than-Moore’ roadmap. However, synthesizing two-dimensional metal oxide single-crystal films has remained challenging. Here we report a van der Waals surface reconstruction of mica for the general large-scale, unidirectional growth of two-dimensional metal oxides (where M = Co, Fe, Ni, Mn) and their doped counterparts, which seamlessly coalesce into single-crystalline films. Quantum mechanics calculations reveal that reconstructing mica’s oxygen atomic plane is critical for achieving the single-crystal epitaxy of these two-dimensional metal oxides. As an example, centimetre-scale two-dimensional Fe-doped CoO single-crystalline films were grown and exhibit room-temperature ferromagnetic semiconductor properties with a high Curie temperature of up to 430 K. These results demonstrate the power of this synthesis strategy, enabling the exploration of two-dimensional metal oxides for quantum physics and spintronics devices.",nature_html,0
Intact-film orthogonal 2D X-ray diffraction mapping for crystallographic homogeneity evaluation in perovskite solar modules,https://www.cell.com/joule/fulltext/S2542-4351(26)00278-3?rss=yes,Joule,2026-07-23 00:00:00 UTC,2026-07-23 00:00:00+00:00,10.1016/j.joule.2026.102594,Dong Suk Kim,"Kim et al. developed an orthogonal 2D X-ray diffraction mapping technique for non-destructive structural characterization of large-area intact perovskite modules. The platform enables simultaneous spatial visualization of crystallinity, crystal orientation, and residual strain across entire films, revealing how structural homogeneity governs scalable, high-efficiency module fabrication.",rss_cell,0
One-pot synthesis of a long-chain metal-backboned polymer,https://academic.oup.com/nsr/advance-article/doi/10.1093/nsr/nwag451/8740806?rss=1,National Science Review Advance Access,2026-07-23 00:00:00 UTC,2026-07-23 00:00:00+00:00,10.1093/nsr/nwag451,Huisheng Peng,"Metal-backboned polymers, featuring backbones composed exclusively of metal atoms interconnected by consecutive metal–metal bonds, have been proposed as a new class of materials for promising applications in optics, electronics, and magnetics; however, they remain unavailable for synthesis. Taking advantage of the long-range aurophilic attraction of gold, we report a straightforward one-pot synthesis method to fabricate metal-backboned polymers. This strategy achieves a degree of polymerization exceeding 50 and stable chain integrity in solution, providing a concise and efficient route for their production. Systematic structural characterizations revealed a one-dimensional Au backbone with continuous Au–Au bonds stabilized by quasi-covalent bonding in synergy with ligand protection. The resulting gold-backboned polymer (GBP) exhibits typical polymer behaviors, including the glass transition temperature and film-forming ability. In addition, GBP exhibits effective electron delocalization, semiconducting properties, and long-wavelength phosphorescence, with a preliminary electroluminescent fiber device demonstrating its potential in flexible optoelectronics. This study establishes a general and efficient route for the synthesis of metal-backboned polymers.",rss_oup,0
Seafood biosecurity gaps threaten biodiversity,https://www.science.org/doi/abs/10.1126/science.aej1248?af=R,AAAS: Science: Table of Contents,2026-07-23 06:00:11 UTC,2026-07-23 06:00:11+00:00,10.1126/science.aej1248,James Kar-Hei Fang,,,0
Brazil’s environmental governance at risk,https://www.science.org/doi/abs/10.1126/science.aej1473?af=R,AAAS: Science: Table of Contents,2026-07-23 06:00:11 UTC,2026-07-23 06:00:11+00:00,10.1126/science.aej1473,Rafael Loyola,,,0
Prominent Salk Institute biologist to resign following sexual misconduct investigation,https://www.science.org/doi/abs/10.1126/science.aek8026?af=R,AAAS: Science: Table of Contents,2026-07-23 06:00:11 UTC,2026-07-23 06:00:11+00:00,10.1126/science.aek8026,Sara Reardon,"Staffers complain that Salk allowed circadian rhythms researcher Satchidananda Panda to depart quietly, while the allegations and findings remain under wraps",crossref,0
Ebola’s rapid spread spurs new drug and vaccine trials,https://www.science.org/doi/abs/10.1126/science.aek8027?af=R,AAAS: Science: Table of Contents,2026-07-23 06:00:11 UTC,2026-07-23 06:00:11+00:00,10.1126/science.aek8027,Kai Kupferschmidt,Pioneering studies are underway amid difficult conditions to address Bundibugyo’s threat,crossref,0
Contagious fish cancer overruns New England lake,https://www.science.org/doi/abs/10.1126/science.aek8028?af=R,AAAS: Science: Table of Contents,2026-07-23 06:00:11 UTC,2026-07-23 06:00:11+00:00,10.1126/science.aek8028,Tim Appenzeller,Genetic studies reveal rare example of identical transmissible tumors,crossref,0
Climate scientists sharpen tools for linking global warming to extreme weather,https://www.science.org/doi/abs/10.1126/science.aek8030?af=R,AAAS: Science: Table of Contents,2026-07-23 06:00:11 UTC,2026-07-23 06:00:11+00:00,10.1126/science.aek8030,Julia Vaz,National Academies report says more rigorous results will boost confidence in fast-growing field,crossref,0
A fatal reaction,https://www.science.org/doi/abs/10.1126/science.aek8000?af=R,AAAS: Science: Table of Contents,2026-07-23 06:00:11 UTC,2026-07-23 06:00:11+00:00,10.1126/science.aek8000,Brendan Borrell,A cutting-edge gene-editing trial in China went disastrously wrong. A family wants accountability,crossref,0
Detention of U.S. seismologist by China alarms researchers,https://www.science.org/doi/abs/10.1126/science.aek8033?af=R,AAAS: Science: Table of Contents,2026-07-23 06:00:11 UTC,2026-07-23 06:00:11+00:00,10.1126/science.aek8033,Richard Stone,Youlin Chen analyzed earthquake data that can also aid nuclear test monitoring,crossref,0
Protect and expand ocean observation systems,https://www.science.org/doi/abs/10.1126/science.aej4152?af=R,AAAS: Science: Table of Contents,2026-07-23 06:00:11 UTC,2026-07-23 06:00:11+00:00,10.1126/science.aej4152,Albert V. Norström,,,0
Alzheimer’s trial results lend momentum to drugs targeting tau,https://www.science.org/doi/abs/10.1126/science.aek8032?af=R,AAAS: Science: Table of Contents,2026-07-23 06:00:11 UTC,2026-07-23 06:00:11+00:00,10.1126/science.aek8032,Jennie Erin Smith,First drug to lower the protein and slow cognitive decline created buzz despite puzzling data,crossref,0
University science in the US needs a coherent plan,https://www.science.org/doi/abs/10.1126/science.aek7500?af=R,AAAS: Science: Table of Contents,2026-07-23 06:00:11 UTC,2026-07-23 06:00:11+00:00,10.1126/science.aek7500,H. Holden Thorp,"The Trump administration continues to degrade America’s scientific establishment, causing widespread harm to the country’s broader interests and well-being. Last week, the Association of American Universities reported that graduate student enrollment in major research universities, which award half of all doctorate degrees in the United States, is down 15% compared to a year ago. And no wonder, considering the effect of recent immigration policies that deter international students and the financial uncertainties that universities are facing given the unpredictable nature of federal funding. The ability to support new doctoral students depends heavily on research grants, and any responsible administrator would be cautious about making commitments to students they can’t keep. This is discouraging to the scientific community but should be alarming to everyone.",crossref,0
In Science Journals,https://www.science.org/doi/abs/10.1126/science.aek7590?af=R,AAAS: Science: Table of Contents,2026-07-23 06:00:11 UTC,2026-07-23 06:00:11+00:00,10.1126/science.aek7590,Molly Ogle,"Highlights from the
                    Science
                    family of journals",crossref,0
Oldest known Mars rock offers glimpse of planet’s watery youth,https://www.science.org/doi/abs/10.1126/science.aek8031?af=R,AAAS: Science: Table of Contents,2026-07-23 06:00:11 UTC,2026-07-23 06:00:11+00:00,10.1126/science.aek8031,Paul Voosen,Teghaza meteorite hints at surprisingly Earth-like crust and shows Mars was already losing its water 4.1 billion years ago,crossref,0
Birdsong diversity across the world,https://www.science.org/doi/abs/10.1126/science.aej0087?af=R,AAAS: Science: Table of Contents,2026-07-23 06:00:11 UTC,2026-07-23 06:00:11+00:00,10.1126/science.aej0087,Elodie F. Briefer,"Birdsong motifs are shaped by evolutionary history, biological traits, and environmental constraints",crossref,0
A tiny cone of reactivity,https://www.science.org/doi/abs/10.1126/science.aej5890?af=R,AAAS: Science: Table of Contents,2026-07-23 06:00:11 UTC,2026-07-23 06:00:11+00:00,10.1126/science.aej5890,Jonas Björk,Colliding molecules react only when their orientations and point of impact fall within a narrow range,crossref,0
"No strain, no gain",https://www.science.org/doi/abs/10.1126/science.aej4566?af=R,AAAS: Science: Table of Contents,2026-07-23 06:00:11 UTC,2026-07-23 06:00:11+00:00,10.1126/science.aej4566,Matthias Gehringer,A modular approach could expand the repertoire of spring-loaded covalent drugs,crossref,0
Dispatches from the front lines of science,https://www.science.org/doi/abs/10.1126/science.aei1520?af=R,AAAS: Science: Table of Contents,2026-07-23 06:00:11 UTC,2026-07-23 06:00:11+00:00,10.1126/science.aei1520,Vijaysree Venkatraman,Young scientists’ passion and commitment take center stage in a moving portrait of research in action,crossref,0
The tangled world of snake taxonomy,https://www.science.org/doi/abs/10.1126/science.aei8559?af=R,AAAS: Science: Table of Contents,2026-07-23 06:00:11 UTC,2026-07-23 06:00:11+00:00,10.1126/science.aei8559,Christopher Kemp,Fringe figures in herpetology advance unlikely (and unchecked) claims in an offbeat taxonomical history,crossref,0
The rise and fall of language diversity through the Holocene,https://www.science.org/doi/abs/10.1126/science.adx4343?af=R,AAAS: Science: Table of Contents,2026-07-23 06:00:11 UTC,2026-07-23 06:00:11+00:00,10.1126/science.adx4343,C. L. Bowern,"Characterizing the factors that have shaped linguistic diversity is fundamental for understanding human history, culture, and cognition. In this study, we combined statistical and social computational modeling, ethnographic data, and paleodemographic inference to model trajectories of global linguistic diversity. Before the onset of plant and animal domestication, the number of languages was smaller than it is today (4500 to 6000 compared with 7500). Subsequent increases in global population precipitated increased linguistic diversity. We uncovered a linguistic “golden age” with tens of thousands of languages 3000 to 1000 years ago. Great loss of linguistic diversity did not begin with recent colonial expansion but as multinational empires first spread along with their languages, pathogens, and cultures. Thus, extinction has likely played a much greater role in shaping linguistic and cultural diversity than previously thought.",crossref,0
Late-stage functionalization with strain-release warheads enables tunable covalent inhibition,https://www.science.org/doi/abs/10.1126/science.adx7219?af=R,AAAS: Science: Table of Contents,2026-07-23 06:00:11 UTC,2026-07-23 06:00:11+00:00,10.1126/science.adx7219,Justin M. Lopchuk,"Covalent inhibition continues to gain momentum as a strategy for selective protein modulation in both therapeutic and chemical biology contexts. Covalent reactive groups (CRGs) typically engage nucleophilic residues such as cysteine, resulting in targeted protein inactivation. However, common electrophiles such as acrylamides often suffer from nonselective reactivity, leading to off-target effects and toxicity. To overcome these limitations, we developed a modular sulfur(IV) reagent platform for the mild, late-stage installation of sulfonyl- and sulfonimidoyl-bicyclobutane motifs with complete cysteine selectivity. This methodology enables access to diverse sulfur(VI) CRGs with tunable strain-release reactivity. Incorporation into US Food and Drug Administration–approved covalent inhibitors demonstrated effective bioisosteric replacement of acrylamides and the potential of strain-release CRGs for selective protein targeting. Preclinical studies in mice have validated this approach, highlighting its promise for next-generation covalent drug design.",crossref,0
Invasive species’ environmental impacts are more severe in the Global South,https://www.science.org/doi/abs/10.1126/science.aed0603?af=R,AAAS: Science: Table of Contents,2026-07-23 06:00:11 UTC,2026-07-23 06:00:11+00:00,10.1126/science.aed0603,Hanno Seebens,"Invasive alien species (IAS) are a major threat to biodiversity, yet their impact distribution remains poorly understood. Global biodiversity assessments suggest the highest impacts in wealthy countries of the Global North, but this is only inferred from IAS numbers, reflecting research bias. Using a new global database of standardized impact measures, we calculated average impact severity per country and found that it is higher in the Global South despite more than twice as many reports in the Global North. Weak governance and limited management capacity are the main drivers of high impact severity. Emerging economies with rapid economic growth but poor governance are particularly vulnerable. Failure to recognize the Global South as facing the highest IAS impacts diverts attention away from the most threatened regions.",crossref,0
Crush-resistant air sacs allow insect larvae to exploit aquatic habitats at extreme depth,https://www.science.org/doi/abs/10.1126/science.aed0667?af=R,AAAS: Science: Table of Contents,2026-07-23 06:00:11 UTC,2026-07-23 06:00:11+00:00,10.1126/science.aed0667,Philip G. D. Matthews,"The absence of aquatic insects from pelagic marine habitats has been attributed to their air-filled tracheal respiratory system, which could implode at depth while undertaking diel vertical migrations to escape predatory fish. However, we found that the aquatic larvae of the lake fly
                    Chaoborus edulis
                    in Lake Malawi have modified their tracheal system into reinforced buoyancy-regulating air-filled sacs, allowing them to escape predatory fish by undertaking these migrations well over 200 meters deep into the lake’s anoxic hypolimnion during the day. The crush depth of their air sacs increases with each instar, with final instars resisting implosion at depths greater than half a kilometer. Contrary to expectations, these insects adapt to the extreme hydrostatic pressures of deep-water habitats, allowing them to coexist with pelagic fish.",crossref,0
Spatially resolving the cone of reaction for a single molecule,https://www.science.org/doi/abs/10.1126/science.aec7913?af=R,AAAS: Science: Table of Contents,2026-07-23 06:00:11 UTC,2026-07-23 06:00:11+00:00,10.1126/science.aec7913,Leonhard Grill,"Collisions of atoms and molecules are required for bond formation and are thus key to any chemical reaction. Their outcome is determined by the collision energy, relative orientation, and impact parameter of the reactants. Collision studies in the gas phase have shown that energies are easily controlled, whereas it is difficult to steer the molecular orientations and completely impossible to control the impact parameter. Here, we study the collision of individual molecules at a surface where each involved compound is imaged before and after collision by scanning tunneling microscopy, allowing precise control of orientations and impact parameter. We observe that the molecules must collide in a narrow cone of reaction and that surface atom displacements can enable a reaction even for disfavored pathways.",crossref,0
Step geometry–guided growth of rhombohedral graphene,https://www.science.org/doi/abs/10.1126/science.aed9202?af=R,AAAS: Science: Table of Contents,2026-07-23 06:00:11 UTC,2026-07-23 06:00:11+00:00,10.1126/science.aed9202,Kaihui Liu,"Rhombohedral (ABC)–stacked graphene has emerged as a platform for exploring correlated and topological physics. However, its large-scale, pure-phase synthesis has been hindered by intrinsic thermodynamic metastability and kinetic instability. In this work, we introduce a step geometry–guided epitaxial strategy to deterministically control interlayer slip, enabling the synthesis of pure-phase rhombohedral graphene. Using this approach, we obtained pure (phase purity &gt; 99%) rhombohedral graphene with an area reaching 160 micrometers by 80 micrometers and thickness ranging from ~15 layers to ~120 nanometers. The resulting samples establish the first comprehensive reference dataset of Raman fingerprints and intrinsic band structures from few-layer films to ~200-layer bulk. Electronic transport measurements reveal a layer-antiferromagnetic state and the quantum anomalous Hall effect, enabling scalable exploration of next-generation quantum science and technology applications.",crossref,0
Genome in motion: Mapping the nucleus in health,https://www.science.org/doi/abs/10.1126/science.aek3868?af=R,AAAS: Science: Table of Contents,2026-07-23 06:00:11 UTC,2026-07-23 06:00:11+00:00,10.1126/science.aek3868,Sarah Ross,,,0
In Other Journals,https://www.science.org/doi/abs/10.1126/science.aek7591?af=R,AAAS: Science: Table of Contents,2026-07-23 06:00:11 UTC,2026-07-23 06:00:11+00:00,10.1126/science.aek7591,Di Jiang,Editors’ selections from the current scientific literature,crossref,0
A geologist learns AI,https://www.science.org/doi/abs/10.1126/science.aek7592?af=R,AAAS: Science: Table of Contents,2026-07-23 06:00:11 UTC,2026-07-23 06:00:11+00:00,10.1126/science.aek7592,Isaac Pope,,,0
