title,link,source,published_str,pub_date,doi,last_author,abstract,abstract_source,must_have_abstract
Pushing tunnel oxide passivating contact technology,https://www.nature.com/articles/s41560-026-02051-4,Nature Energy,2026-05-01 00:00:00 UTC,2026-05-01 00:00:00+00:00,10.1038/s41560-026-02051-4,Andreas Wolf,,,0
Author Correction: Titration of RAS alters senescent state and influences tumour initiation,https://www.nature.com/articles/s41586-026-10601-9,Nature,2026-05-01 00:00:00 UTC,2026-05-01 00:00:00+00:00,10.1038/s41586-026-10601-9,Masashi Narita,,,0
Flapping vibrations contributed to heat insulation in Cs2ZnI4,https://academic.oup.com/nsr/advance-article/doi/10.1093/nsr/nwag256/8666273?rss=1,National Science Review Advance Access,2026-05-01 00:00:00 UTC,2026-05-01 00:00:00+00:00,10.1093/nsr/nwag256,,"Shear modulus is commonly lower than its elastic counterpart in solids, leading to our experience that in the elastic region, it is usually much easier to shear than to compress/stretch a solid. Scientifically, this implies an easier change in molecular bonding angle than bonding length, further corresponding to the normally observed phenomenon that the propagation of longitudinal lattice vibrations is faster than that of shear ones. Populating the easier vibrations of flapping bond angles fundamentally opens an opportunity to insulate heat conduction in solids, since this type of vibration ensures slow propagation and low energy/frequency, leading to a low thermal conductivity. Here we demonstrate that single-crystalline orthorhombic Cs2ZnI4, with two sets of extremely low-frequency flapping vibrations in the crystallographic planes of ac (0.4 THz) and bc (0.5 THz) respectively, exposes extraordinarily low thermal conductivities of 0.11 W m−1 K−1 along the c direction and of 0.16 W m−1 K−1 along the b direction at room temperature, as compared to ∼0.2 W m−1 K−1 in existing heat insulators in the dense form. The strategy and material developed in this work are believed to enrich the advancements of heat insulation technology.",rss_oup,0
Prestigious European science funder scraps stricter rules after researcher backlash,https://www.nature.com/articles/d41586-026-01435-6,Nature,2026-05-01 00:00:00 UTC,2026-05-01 00:00:00+00:00,10.1038/d41586-026-01435-6,Elizabeth Gibney,,,0
This organoid can menstruate — and shows how tissue can repair itself,https://www.nature.com/articles/d41586-026-01428-5,Nature,2026-05-01 00:00:00 UTC,2026-05-01 00:00:00+00:00,10.1038/d41586-026-01428-5,Claudia Steiner,,,0
European funder must increase capacity to meet the ambition of scientists,https://www.nature.com/articles/d41586-026-01411-0,Nature,2026-05-01 00:00:00 UTC,2026-05-01 00:00:00+00:00,10.1038/d41586-026-01411-0,João Conde,,,0
The news is not all bad: five inspiring science stories to lift your mood,https://www.nature.com/articles/d41586-026-01290-5,Nature,2026-05-01 00:00:00 UTC,2026-05-01 00:00:00+00:00,10.1038/d41586-026-01290-5,Rachel Fieldhouse,,,0
The exotic particles that could finally break the Standard Model,https://www.nature.com/articles/d41586-026-01387-x,Nature,2026-05-01 00:00:00 UTC,2026-05-01 00:00:00+00:00,10.1038/d41586-026-01387-x,Elizabeth Gibney,,,0
US faculty members report high levels of anxiety,https://www.nature.com/articles/d41586-026-01252-x,Nature,2026-05-01 00:00:00 UTC,2026-05-01 00:00:00+00:00,10.1038/d41586-026-01252-x,Amanda Heidt,,,0
The imperfect legacy,https://www.nature.com/articles/d41586-026-01075-w,Nature,2026-05-01 00:00:00 UTC,2026-05-01 00:00:00+00:00,10.1038/d41586-026-01075-w,Fei Qi,,,0
Briefing Chat: Stressed mitochondria spawn new 'organelles' in cells,https://www.nature.com/articles/d41586-026-01439-2,Nature,2026-05-01 00:00:00 UTC,2026-05-01 00:00:00+00:00,10.1038/d41586-026-01439-2,Shamini Bundell,,,0
"Photoelectrochemical flow conversion of water-insoluble, naturally abundant molecules into valuable chemicals",https://www.cell.com/joule/fulltext/S2542-4351(26)00123-6?rss=yes,Joule,2026-05-01 00:00:00 UTC,2026-05-01 00:00:00+00:00,10.1016/j.joule.2026.102439,Yujie Xiong,"Converting abundant but poorly soluble, chemically inert methane and nitrogen into valuable chemicals under mild conditions remains a fundamental challenge in sustainable chemical manufacturing. This work develops a fibrous photoelectrode in a continuous-flow solar system that achieves direct CH4–N2 coupling into high-value C–N chemicals under ambient conditions.",rss_cell,0
Field-resolved observation of exciton coherence in a van der Waals magnet,https://www.nature.com/articles/s41563-026-02598-3,Nature Materials,2026-05-01 00:00:00 UTC,2026-05-01 00:00:00+00:00,10.1038/s41563-026-02598-3,Nuh Gedik,"The emergence of coherence among electronic quasiparticles underlies collective quantum phenomena from superconductivity to superradiance. In semiconductors, exciton coherence is generally thought to decay rapidly due to scattering and dephasing, limiting its persistence on ultrafast timescales. Here we demonstrate a light-field-driven mechanism that creates and stabilizes exciton coherence in the layered antiferromagnet CrSBr. We directly record the coherent optical field emitted by excitons and track in real time how a deterministic phase, imprinted by the excitation laser, drives incoherent excitons to synchronize into a collective state. This ensemble remains phase coherent for more than 2 ps, whereas its resonance energy undergoes an ultrafast modulation mediated by spin and lattice interactions. The time-resolved field evolution indicates that the multiple peaks seen in conventional spectra originate from a single excitonic resonance subject to dynamic energy modulation. Our findings establish optical phase imprinting as a mechanism to control and sustain collective order in semiconducting magnets, bridging light-driven dynamics with excitonic and magnetic correlations in layered quantum materials.",nature_html,0
Interface effects unlock unusual superconductivity in a light-element superconductor,https://www.nature.com/articles/s41563-026-02605-7,Nature Materials,2026-05-01 00:00:00 UTC,2026-05-01 00:00:00+00:00,10.1038/s41563-026-02605-7,,,,0
Upcycling plant biomass into photosynthetic microspheres for diabetic wound healing,https://www.nature.com/articles/s41893-026-01810-1,Nature Sustainability,2026-05-01 00:00:00 UTC,2026-05-01 00:00:00+00:00,10.1038/s41893-026-01810-1,Jianliang Shen,"Plant-based materials provide a renewable and sustainable platform for tackling global challenges in energy, environment and healthcare. Among these, chronic diabetic wounds, currently affecting over 10% of the global population, remain a pressing public health crisis, largely owing to persistent hypoxia and unresolved inflammation. Here we report photosynthetic microspheres derived from the invasive aquatic plant Eichhornia crassipes (water hyacinth) as a green therapeutic strategy for chronic wound repair. Harnessing intact chloroplasts, these biogenic microspheres deliver sustained oxygen evolution for up to 3 weeks, alleviating local hypoxia and restoring redox balance. When integrated with the metabolic regulator metformin, the system couples exogenous photosynthesis and endogenous glucose metabolism, synergistically reprogramming the wound microenvironment. In both mouse and pig diabetic wound models, this approach suppresses inflammation, promotes angiogenesis and expedites re-epithelialization, leading to adaptive tissue regeneration. Our findings reveal that inexpensive, invasive aquatic biomass can be upcycled into advanced therapeutic biomaterials, offering a scalable and sustainable framework for next-generation regenerative medicine.",nature_html,0
Unveiling a flip-over retention mechanism in the gas-phase Cl− + (CH3)3CI SN2 reaction,https://www.nature.com/articles/s41467-026-72121-4,Nature Communications,2026-05-01 00:00:00 UTC,2026-05-01 00:00:00+00:00,10.1038/s41467-026-72121-4,Roland Wester,"Bimolecular nucleophilic substitution (SN2) and base-induced elimination (E2) reactions play crucial roles in chemistry. Here, we report a combined study of ion-molecule crossed-beam 3D velocity map imaging experiments and dynamics simulations on an accurate 39-dimensional potential energy surface for the Cl− + (CH3)3CI reaction, allowing the most rigorous investigation of the atomistic dynamics. Good agreement between experimental and theoretical product angular and energy distributions is achieved, revealing that predominantly direct E2 reactions produce the majority of highly excited neutral products and slow ion product distributions. Moreover, we uncover a direct “flip-over” retention mechanism for the SN2 reaction, where substitution occurs via the direct flipping of the tert-butyl group, leading to retention of the tetrahedral carbon center. This mechanism manifests as a predominant forward-scattering feature in the product angular distribution and provides an important perspective on substitution dynamics in organic reactions.",nature_html,0
A novel stereochemistry retention mechanism in the SN2 reaction,https://www.nature.com/articles/s41467-026-72120-5,Nature Communications,2026-05-01 00:00:00 UTC,2026-05-01 00:00:00+00:00,10.1038/s41467-026-72120-5,Jing Xie,,,0
Functional impact of genetic background on variable expressivity in neurodevelopmental disorders,https://www.nature.com/articles/s41467-026-72598-z,Nature Communications,2026-05-01 00:00:00 UTC,2026-05-01 00:00:00+00:00,10.1038/s41467-026-72598-z,Santhosh Girirajan,"Disease-associated variants can lead to variable phenotypic outcomes in neurodevelopmental disorders, but the biological mechanisms underlying this variability remain poorly understood. Here, we develop a framework to investigate this phenomenon using the 16p12.1 deletion as a paradigm of variable expressivity. Using induced pluripotent stem cell models from affected families and CRISPR-edited lines with the 16p12.1 deletion, we find that the deletion and rare variants in the genetic background jointly influence chromatin accessibility and expression of neurodevelopmental genes. Cellular analyses identify family-specific phenotypes, including altered inhibitory neuron production and neural progenitor cell proliferation, which correlate with head-size variation. CRISPR activation of individual 16p12.1 genes variably rescue these defects by modulating key developmental signaling pathways. Integrative analyses further identify regulatory hubs, including transcription factors FOXG1 and JUN, as mediators of these effects. Our study provides a functional framework for investigating how individual genetic architectures contribute to phenotypic variability in neurodevelopmental disorders.",nature_html,0
Interfacial excess charge dynamics as a quantitative descriptor to understand lithium dendrite growth,https://www.nature.com/articles/s41467-026-72472-y,Nature Communications,2026-05-01 00:00:00 UTC,2026-05-01 00:00:00+00:00,10.1038/s41467-026-72472-y,Yongbing Tang,"Unraveling the origins of Li dendrite growth remains a critical challenge for lithium metal batteries. Existing studies often treat diffusion-reaction mismatches or electrode surface excess charge in isolation, overlooking the coupled interfacial processes at the nanoscale solid-liquid interface that govern Li dendrite growth. Herein, we introduce the interfacial excess charge distribution factor, a quantitative descriptor that captures the dynamic equilibrium by integrating the contributions of electrode surface excess charge, charge depletion rate and solvation chemistry. We further propose an electrochemical method to monitor Li dendrite growth rates, confirming that electrolytes with rapid excess charge redistribution ability favor planar Li plating. Our findings reveal that the depletion rate of interfacial excess charge governed by Li⁺-dipole-anion interactions, and the degree of electrode excess charge modulated by solvation structures and cation screening, competitively determine the interfacial excess charge dynamics. Guided by these insights, we designed an electrolyte with optimized excess charge redistribution capability, which suppresses dendrite formation and enables stable cycling in ~6.4 Ah lithium metal batteries. This work provides mechanistic insight into how competitive interfacial processes dictate Li dendrite growth.",nature_html,0
Spatially decoding genotype-associated epigenetic landscapes in human lymphoma FFPE tissues via epi-Patho-DBiT,https://www.nature.com/articles/s41467-026-71576-9,Nature Communications,2026-05-01 00:00:00 UTC,2026-05-01 00:00:00+00:00,10.1038/s41467-026-71576-9,Rong Fan,"While formalin-fixed paraffin-embedded (FFPE) samples are invaluable for human non-Hodgkin B-cell lymphoma translational research, effective methods for spatial profiling of chromatin accessibility and histone modifications in these tissues remain limited. Here, we introduce epi-Patho-DBiT, a platform that combines reverse crosslinking of FFPE tissues with spatially resolved assays for transposase-accessible chromatin using sequencing (spatial-FFPE-ATAC) or cleavage under targets and tagmentation (spatial-FFPE-CUT&Tag). Using spatial-FFPE-ATAC, we map epigenetic landscapes in mucosa-associated lymphoid tissue and follicular lymphoma, identifying chromatin variants linked to B-cell malignancy and resolving tumor karyotypes. Mitotic age inference reveals spatial tumor dynamics and uncovers cholesterol-mediated cell proliferation. Furthermore, spatial-FFPE-CUT&Tag elucidates genomic alterations during transformation of follicular lymphoma into diffuse large B-cell lymphoma and identifies DIP2C with dysregulated H3K4me3 and H3K27me3 levels. Unexpectedly, we observe elevated H3K27me3 occupancy at a chromosome 2 locus containing tumor-promoting genes, attributed to copy number amplification and thereby upregulation in transformed diffuse large B-cell lymphoma.",nature_html,0
Addendum: Telomouse—a mouse model with human-length telomeres generated by a single amino acid change in RTEL1,https://www.nature.com/articles/s41467-026-71821-1,Nature Communications,2026-05-01 00:00:00 UTC,2026-05-01 00:00:00+00:00,10.1038/s41467-026-71821-1,Yehuda Tzfati,,,0
Thin membranes with Cu-ion crosslinking for high temperature polymer electrolyte membrane fuel cells,https://www.nature.com/articles/s41560-026-02049-y,Nature Energy,2026-05-01 00:00:00 UTC,2026-05-01 00:00:00+00:00,10.1038/s41560-026-02049-y,Shanfu Lu,"High-temperature polymer electrolyte membrane fuel cells offer inherent impurity tolerance and simplified thermal/water management. However, conventional phosphoric acid-doped membranes must be relatively thick (typically >50 μm) to counteract H3PO4-induced mechanical degradation, leading to ohmic losses that limit fuel cell performance. Here we report a 20-μm-thin, mechanically robust phosphoric acid-doped membrane incorporating dynamic Cu-ion crosslinking for high-power-density high-temperature polymer electrolyte membrane fuel cells. The dynamic Cu-polymer coordination establishes dynamic crosslinking networks that provide exceptional toughness and extensibility, alongside spontaneous self-healing capability. Simultaneously, the Cu ions improve H3PO4 retention and proton dissociation through electrostatic interactions and polarization of O–H bonds in H3PO4 molecules. The resulting thin membranes exhibit minimal ohmic resistance (0.06 Ω cm2) while maintaining low H2 crossover current density (0.95 mA cm−2). Fuel cells incorporating this membrane achieved a peak power density of 3.08 W cm−2 at 200 °C (H2/O2), with negligible degradation over 503 h at 1.0 A cm−2 and 160 °C.",nature_html,0
An analytical model to describe self-discharge rates in solid-state batteries,https://www.nature.com/articles/s41560-026-02047-0,Nature Energy,2026-05-01 00:00:00 UTC,2026-05-01 00:00:00+00:00,10.1038/s41560-026-02047-0,,,,0
Breakthrough in 2D ultrahigh-κ dielectrics by paraelectric phase engineering in vdW crystal,https://academic.oup.com/nsr/advance-article/doi/10.1093/nsr/nwag240/8666269?rss=1,National Science Review Advance Access,2026-05-01 00:00:00 UTC,2026-05-01 00:00:00+00:00,10.1093/nsr/nwag240,,,,0
From Magma Ocean to Core–Mantle Boundary: The Key Role of Hydrous Ferropericlase in Shaping Deep Earth’s Low-Velocity Anomalies,https://academic.oup.com/nsr/advance-article/doi/10.1093/nsr/nwag258/8666267?rss=1,National Science Review Advance Access,2026-05-01 00:00:00 UTC,2026-05-01 00:00:00+00:00,10.1093/nsr/nwag258,,,,0
Pervasive enhanced transcription in inflammatory breast cancer tumors and PBMCs impacts RNA splicing and intronic RNAs in plasma,https://www.science.org/doi/abs/10.1126/sciadv.adu0031?af=R,AAAS: Science Advances: Table of Contents,2026-05-01 07:00:00 UTC,2026-05-01 07:00:00+00:00,10.1126/sciadv.adu0031,Alan M. Lambowitz,"Inflammatory breast cancer (IBC), an aggressive and lethal breast cancer subtype, lacks unequivocal genomic differences or robust biomarkers that differentiate it from non-IBC. Here, TGIRT-seq revealed myriad differences in tumors, PBMC, and plasma RNAs that distinguished IBC patients from non-IBC patients and healthy donors across different tested breast cancer subtypes. By mapping reads to genome and transcriptome reference sequences and quantitating intron-to-exon read depth ratios (IDRs), we developed methods for parallel analysis of transcriptional and posttranscriptional gene regulation. This analysis identified numerous protein-coding genes in IBC patient tumors and PBMCs with high IDRs, suggesting rate-limiting RNA splicing that decreases mRNA production. Mirroring gene expression differences in tumors and PBMCs, overrepresented protein-coding gene RNAs in IBC patient plasma were largely intron RNA fragments, while those in non-IBC patient and healthy donor plasma were largely mRNA fragments. Our findings provide insights into IBC and should enable monitoring disease progression by liquid biopsy.",pubmed,0
"Stress-induced CXCL13 regulates pancreatic exocrine homeostasis, age-related chronic inflammation, and cancer progression",https://www.science.org/doi/abs/10.1126/sciadv.adu7865?af=R,AAAS: Science Advances: Table of Contents,2026-05-01 07:00:00 UTC,2026-05-01 07:00:00+00:00,10.1126/sciadv.adu7865,Yoshiya Kawaguchi,"Pancreatic cancers, whose incidence increases with age, are often refractory to treatment. Here, we identified a core mechanism shared by physiological homeostasis, senescent cell accumulation during aging, and pancreatic cancers. Pancreatic acinar cells, when stressed, secrete CXCL13, which protects stressed cells while transiently activating paracrine Hippo/YAP signaling to induce proliferation and PD-L1-mediated immune protection to maintain organ homeostasis. In the aged pancreas, CXCL13/YAP/PD-L1 signaling permits senescent cells to survive, driving feedforward chronic inflammation and steatosis. Because of prolonged CXCL13/YAP/PD-L1 activation in pancreatic cancers, neighboring noncancerous cells, activated for proliferation and immune-protected, eventually transform and accelerate tumor progression. CXCL13 blockade removed senescent cells and ameliorated steatosis in the aged pancreas while suppressing tumor growth in pancreatic cancer models, highlighting the CXCL13/YAP/PD-L1 axis as a potential therapeutic target. Together, our findings demonstrate the stress-induced CXCL13/YAP/PD-L1 axis as a central regulator of cell-state transitions in the pancreas, providing a unifying principle by which organ homeostasis, aging, and tumorigenesis are governed.",pubmed,0
"Nanographenic bowls based on contorted hexabenzocoronene: Synthesis, structure, and supramolecular assembly with fullerene C60",https://www.science.org/doi/abs/10.1126/sciadv.aed5921?af=R,AAAS: Science Advances: Table of Contents,2026-05-01 07:00:00 UTC,2026-05-01 07:00:00+00:00,10.1126/sciadv.aed5921,Junfa Wei,"Buckybowls, the curved fragments of fullerenes, are attractive synthetic targets for exploring carbon nanomaterials, but constructing atomically well-defined, large multilayered architectures remains a formidable challenge. Here we report the synthesis of a class of coronene-bottomed nanographenic bowls, namely, tricarbon-annulated trifluorenocoronenes (TCTFCs), based on a contorted hexa-cata-hexabenzocoronene (c-HBC) skeleton. Two TCTFC derivatives bearing gem-diaryl or gem-dialkyl appendages were prepared via a ""branching arms cyclization"" (BAC) strategy. X-ray crystallography unambiguously confirms their C3-symmetric bowl-shaped geometry with bowl depths up to 2.3 angstrom and diameters exceeding 1 nanometer. These bowls exhibit red-shifted absorption/emission profiles, enhanced electron affinity, and reduced aromaticity relative to the c-HBC derivative. Notably, both compounds form 1:1 complexes with C60 in solution, while their cocrystals adopt columnar or honeycomb packing motifs. This work establishes a synthetic paradigm in constructing fully edge-closed c-HBC-based buckybowls, further delivering fundamental insights into their substituent-dependent host-guest binding and supramolecular assembly.",pubmed,0
Spliceosomal mutation drives melanoma tumorigenesis via lineage-specific RAS activation,https://www.science.org/doi/abs/10.1126/sciadv.adz8289?af=R,AAAS: Science Advances: Table of Contents,2026-05-01 07:00:00 UTC,2026-05-01 07:00:00+00:00,10.1126/sciadv.adz8289,Hanlin Zeng,"Mutations in splicing factors are recurrent across human cancers and drive widespread RNA splicing dysregulation. Among these, SF3B1 is the most frequently mutated, yet its hotspot mutations exhibit lineage specificity, with SF3B1R625 mutations predominantly found in melanoma and SF3B1K700E in hematologic malignancies. However, the mechanistic basis for this cancer-type specificity remains unclear. Here, we demonstrate that SF3B1R625H induces greater activation of alternative 3' splice site than SF3B1K700E. Mechanistically, the polyadenine-enriched sequence surrounding cryptic branch point sites confers SF3B1R625H selective advantage in aberrant splicing. This splicing bias leads to preferential missplicing of NF1, a RAS inhibitor, resulting in RAS hyperactivation and accelerated melanoma progression in mouse models. This study redefines the oncogenic paradigm of SF3B1 mutations by demonstrating that distinct hotspot mutations exploit lineage-specific splicing vulnerabilities to drive tumorigenesis and establishes RAS activation as key mechanism underlying SF3B1R625H-driven melanoma, positioning RAS pathway as tractable therapeutic target in SF3B1-mutant melanoma.",pubmed,0
Precise borylation of targeted methyl group via an orderly chain-walking strategy,https://www.science.org/doi/abs/10.1126/sciadv.aed6913?af=R,AAAS: Science Advances: Table of Contents,2026-05-01 07:00:00 UTC,2026-05-01 07:00:00+00:00,10.1126/sciadv.aed6913,Zhan Lu,"C─H functionalization is an attractive approach in organic synthesis due to its directness and efficiency. Nevertheless, achieving precise differentiation among multiple methyl groups with highly similar chemical environments remains a notable challenge. Here, an orderly chain-walking borylation strategy was introduced via targeted hook and enduring slide that enables precise remote C(sp3)-H borylation and affords a series of ""Y-shape"" boron analogs through rational desymmetric ligand design. This method exhibits broad substrate scope, good functional group tolerance, and high atom economy and achieves a chain-walking distance of 32 carbons, and we hope it will promote cross-disciplinary innovation in areas including materials science and pharmaceuticals.",pubmed,0
Ultra-narrowband perovskite single-crystal photodetector enabled by dynamic space charge region for portable concentration detection,https://www.science.org/doi/abs/10.1126/sciadv.adz9250?af=R,AAAS: Science Advances: Table of Contents,2026-05-01 07:00:00 UTC,2026-05-01 07:00:00+00:00,10.1126/sciadv.adz9250,Liang Shen,"Narrowband photodetectors with wavelength-selective light response are essential for applications involving environmental monitoring and biomedical sensing. Although perovskites with excellent optoelectronic characteristics and tunable bandgaps have been demonstrated as promising candidates for the realization of narrowband detection, their practical performance still lags behind the combination of traditional photodetectors with optical filters. Here, we construct a dynamic space charge region model for achieving high-performance narrowband detection in perovskite single crystals. In this model, the space charge region formed by mobile ions suppresses the response to above-bandgap photons and amplifies the response to band-edge photons, as well as providing an adjustable narrowband wavelength. As a result, the photodetectors achieve a record narrowband performance with a full width at half maximum of 9.0 nanometers. We further develop a portable application of our narrowband photodetectors to rapidly and effectively detect water pollutant concentrations, showing an order of magnitude less in the limit of detection than commercial silicon photodetectors combined with complex optical filters.",pubmed,0
