title,link,published,source,pub_date
Molecular rotary motors switch direction,https://www.nature.com/articles/s41557-026-02189-4,2026-06-25 00:00:00 UTC,Nature Chemistry,2026-06-25 00:00:00+00:00
A coloured radiative cooling coating with high solar reflectance,https://www.nature.com/articles/s41560-026-02085-8,2026-06-25 00:00:00 UTC,Nature Energy,2026-06-25 00:00:00+00:00
Bridging nanotechnology and mechanobiology,https://www.nature.com/articles/s41565-026-02215-z,2026-06-25 00:00:00 UTC,Nature Nanotechnology,2026-06-25 00:00:00+00:00
"As better chatbots get harder to build, AI turns to simulated worlds",https://www.science.org/content/article/better-chatbots-get-harder-build-ai-turns-simulated-worlds,2026-06-25 02:00:00 UTC,Latest News from Science Magazine,2026-06-25 02:00:00+00:00
Why have papers by one of history’s most famous physicists been retracted?,https://www.science.org/content/article/why-have-papers-one-history-s-most-famous-physicists-been-retracted,2026-06-25 04:00:00 UTC,Latest News from Science Magazine,2026-06-25 04:00:00+00:00
Scientists to spend 8 months drifting in Arctic ice,https://www.science.org/doi/abs/10.1126/science.aej9812?af=R,2026-06-25 06:00:09 UTC,AAAS: Science: Table of Contents,2026-06-25 06:00:09+00:00
Words vs. worlds,https://www.science.org/doi/abs/10.1126/science.aej9814?af=R,2026-06-25 06:00:09 UTC,AAAS: Science: Table of Contents,2026-06-25 06:00:09+00:00
In Science Journals,https://www.science.org/doi/abs/10.1126/science.aej9372?af=R,2026-06-25 06:00:09 UTC,AAAS: Science: Table of Contents,2026-06-25 06:00:09+00:00
The enduring pursuit of science in America,https://www.science.org/doi/abs/10.1126/science.aej8205?af=R,2026-06-25 06:00:09 UTC,AAAS: Science: Table of Contents,2026-06-25 06:00:09+00:00
Researchers caught in the crossfire as firms and U.S. government grapple over AI safety,https://www.science.org/doi/abs/10.1126/science.aej9813?af=R,2026-06-25 06:00:09 UTC,AAAS: Science: Table of Contents,2026-06-25 06:00:09+00:00
"A bright, sun-splashed future for renewable energy",https://www.science.org/doi/abs/10.1126/science.aej9392?af=R,2026-06-25 06:00:09 UTC,AAAS: Science: Table of Contents,2026-06-25 06:00:09+00:00
Rise in papers using powerful medical research tool raises concern,https://www.science.org/doi/abs/10.1126/science.aej9810?af=R,2026-06-25 06:00:09 UTC,AAAS: Science: Table of Contents,2026-06-25 06:00:09+00:00
Superconducting phase diagram of multilayer square-planar nickelates,https://www.science.org/doi/abs/10.1126/science.adp4440?af=R,2026-06-25 06:00:09 UTC,AAAS: Science: Table of Contents,2026-06-25 06:00:09+00:00
Reversible suppression of autophagy in a mouse model reveals neuronal resilience,https://www.science.org/doi/abs/10.1126/science.ady3911?af=R,2026-06-25 06:00:09 UTC,AAAS: Science: Table of Contents,2026-06-25 06:00:09+00:00
Has NSF slashed research to support tech initiative?,https://www.science.org/doi/abs/10.1126/science.aej9811?af=R,2026-06-25 06:00:09 UTC,AAAS: Science: Table of Contents,2026-06-25 06:00:09+00:00
Dartmouth’s AI summer and what came next,https://www.science.org/doi/abs/10.1126/science.aei0476?af=R,2026-06-25 06:00:09 UTC,AAAS: Science: Table of Contents,2026-06-25 06:00:09+00:00
Nano–electron volt Fourier-limited transition of a single surface-adsorbed molecule,https://www.science.org/doi/abs/10.1126/science.aeg5014?af=R,2026-06-25 06:00:09 UTC,AAAS: Science: Table of Contents,2026-06-25 06:00:09+00:00
Innate factors and ontogeny determine nonbreeding areas of migrant songbirds,https://www.science.org/doi/abs/10.1126/science.ads0532?af=R,2026-06-25 06:00:09 UTC,AAAS: Science: Table of Contents,2026-06-25 06:00:09+00:00
Impact heating and the hidden Hadean,https://www.science.org/doi/abs/10.1126/science.aeb5402?af=R,2026-06-25 06:00:09 UTC,AAAS: Science: Table of Contents,2026-06-25 06:00:09+00:00
Diversification of angiosperm reproductive strategies predated the end-Cretaceous extinction,https://www.science.org/doi/abs/10.1126/science.adw9457?af=R,2026-06-25 06:00:09 UTC,AAAS: Science: Table of Contents,2026-06-25 06:00:09+00:00
Industrial-scale nanocrystalline Ni–Mo–MgO catalysts for hybrid reforming of waste to fuels,https://www.science.org/doi/abs/10.1126/science.adp5208?af=R,2026-06-25 06:00:09 UTC,AAAS: Science: Table of Contents,2026-06-25 06:00:09+00:00
Lariat RNA debranching prevents harmful siRNA burst in plants,https://www.science.org/doi/abs/10.1126/science.aeb4938?af=R,2026-06-25 06:00:09 UTC,AAAS: Science: Table of Contents,2026-06-25 06:00:09+00:00
In Other Journals,https://www.science.org/doi/abs/10.1126/science.aej9373?af=R,2026-06-25 06:00:09 UTC,AAAS: Science: Table of Contents,2026-06-25 06:00:09+00:00
An ancient mystery: missing males,https://www.science.org/doi/abs/10.1126/science.aej9809?af=R,2026-06-25 06:00:09 UTC,AAAS: Science: Table of Contents,2026-06-25 06:00:09+00:00
Impacts shaped Earth’s first continents,https://www.science.org/doi/abs/10.1126/science.aei7140?af=R,2026-06-25 06:00:09 UTC,AAAS: Science: Table of Contents,2026-06-25 06:00:09+00:00
Coordinated demise of harmful algal blooms,https://www.science.org/doi/abs/10.1126/science.aei7111?af=R,2026-06-25 06:00:09 UTC,AAAS: Science: Table of Contents,2026-06-25 06:00:09+00:00
Dorothy Hodgkin: A Life,https://www.science.org/doi/abs/10.1126/science.aei9819?af=R,2026-06-25 06:00:09 UTC,AAAS: Science: Table of Contents,2026-06-25 06:00:09+00:00
Genetic effects put into context,https://www.science.org/doi/abs/10.1126/science.aei6085?af=R,2026-06-25 06:00:09 UTC,AAAS: Science: Table of Contents,2026-06-25 06:00:09+00:00
Bacteria share proteins to survive antibiotics,https://www.science.org/doi/abs/10.1126/science.aei4132?af=R,2026-06-25 06:00:09 UTC,AAAS: Science: Table of Contents,2026-06-25 06:00:09+00:00
Recognizing my worth,https://www.science.org/doi/abs/10.1126/science.aej9374?af=R,2026-06-25 06:00:09 UTC,AAAS: Science: Table of Contents,2026-06-25 06:00:09+00:00
Deloitte sees $11.1 billion opportunity for Brazilian storage market,https://www.ess-news.com/2026/06/25/deloitte-sees-11-1-billion-opportunity-for-brazil-storage-market/,2026-06-25 06:30:00 UTC,Latest news about ESS Projects & Applications | ESS News,2026-06-25 06:30:00+00:00
"Ubiquitin-like proteins NEDD8 and SUMO2 control epithelial homeostasis, regeneration, and inflammation",https://www.science.org/doi/abs/10.1126/science.aeb3900?af=R,2026-06-25 07:00:00 UTC,AAAS: Science: Table of Contents,2026-06-25 07:00:00+00:00
Cryo–electron microscopy structures of human cone visual pigments,https://www.science.org/doi/abs/10.1126/science.adz8141?af=R,2026-06-25 07:00:00 UTC,AAAS: Science: Table of Contents,2026-06-25 07:00:00+00:00
Structural insights into spectral tuning and retinal exchange in cone visual pigments,https://www.science.org/doi/abs/10.1126/science.adz3996?af=R,2026-06-25 07:00:00 UTC,AAAS: Science: Table of Contents,2026-06-25 07:00:00+00:00
Illuminating the molecular basis of human daylight vision,https://www.science.org/doi/abs/10.1126/science.adz3624?af=R,2026-06-25 07:00:00 UTC,AAAS: Science: Table of Contents,2026-06-25 07:00:00+00:00
Undead models and shrouded black holes,https://www.science.org/doi/abs/10.1126/science.aei7838?af=R,2026-06-25 07:00:00 UTC,AAAS: Science: Table of Contents,2026-06-25 07:00:00+00:00
Structural N- and O-glycans revealed by high-resolution cryo-EM analysis of tubular mastigonemes,https://www.science.org/doi/abs/10.1126/science.aef4958?af=R,2026-06-25 07:00:00 UTC,AAAS: Science: Table of Contents,2026-06-25 07:00:00+00:00
Iron-catalyzed active lipid peroxides drive ultrafast collective cell death in blooming algae,https://www.science.org/doi/abs/10.1126/science.aed3823?af=R,2026-06-25 07:00:00 UTC,AAAS: Science: Table of Contents,2026-06-25 07:00:00+00:00
Erratum for the Report “Covalently bonded single-molecule junctions with stable and reversible photoswitched conductivity” by C. Jia et al.,https://www.science.org/doi/abs/10.1126/science.aej5835?af=R,2026-06-25 07:00:00 UTC,AAAS: Science: Table of Contents,2026-06-25 07:00:00+00:00
Antibiotics stimulate protein transfer to persister cells,https://www.science.org/doi/abs/10.1126/science.adx3972?af=R,2026-06-25 07:00:00 UTC,AAAS: Science: Table of Contents,2026-06-25 07:00:00+00:00
Single-cell multiomics of neuron activation reveals context-specific genetics of brain disorders,https://www.science.org/doi/abs/10.1126/science.adw3949?af=R,2026-06-25 07:00:00 UTC,AAAS: Science: Table of Contents,2026-06-25 07:00:00+00:00
Canada Backs ASEAN Carbon Capture Push With C$1.38M,https://carbonherald.com/canada-backs-asean-carbon-capture-push-with-c1-38m/?utm_source=rss&utm_medium=rss&utm_campaign=canada-backs-asean-carbon-capture-push-with-c1-38m,2026-06-25 07:48:49 UTC,Carbon Herald,2026-06-25 07:48:49+00:00
What Europe’s heat wave means for the power grid,https://www.technologyreview.com/2026/06/25/1139690/europe-heat-wave-grid/,2026-06-25 10:00:00 UTC,Climate change and energy – MIT Technology Review,2026-06-25 10:00:00+00:00
Verra Inks Million-Dollar AI Overhaul To Slash Carbon Market Bureaucracy,https://carbonherald.com/verra-inks-million-dollar-ai-overhaul-to-slash-carbon-market-bureaucracy/?utm_source=rss&utm_medium=rss&utm_campaign=verra-inks-million-dollar-ai-overhaul-to-slash-carbon-market-bureaucracy,2026-06-25 10:21:04 UTC,Carbon Herald,2026-06-25 10:21:04+00:00
Sumitomo Mitsui Banking Corp Invests In Deep Sky To Support DAC And CDR In Japan,https://carbonherald.com/sumitomo-mitsui-banking-corp-invests-in-deep-sky-to-support-dac-and-cdr-in-japan/?utm_source=rss&utm_medium=rss&utm_campaign=sumitomo-mitsui-banking-corp-invests-in-deep-sky-to-support-dac-and-cdr-in-japan,2026-06-25 10:27:39 UTC,Carbon Herald,2026-06-25 10:27:39+00:00
Gold Standard: $17B A Year Could Flow To Climate Action If Companies Account For Ongoing Emissions,https://carbonherald.com/gold-standard-17b-a-year-could-flow-to-climate-action-if-companies-account-for-ongoing-emissions/?utm_source=rss&utm_medium=rss&utm_campaign=gold-standard-17b-a-year-could-flow-to-climate-action-if-companies-account-for-ongoing-emissions,2026-06-25 10:29:29 UTC,Carbon Herald,2026-06-25 10:29:29+00:00
Opinion: Why Satellite Data Alone Isn’t Enough for Credible Carbon Markets,https://carbonherald.com/opinion-why-satellite-data-alone-isnt-enough-for-credible-carbon-markets/?utm_source=rss&utm_medium=rss&utm_campaign=opinion-why-satellite-data-alone-isnt-enough-for-credible-carbon-markets,2026-06-25 10:32:18 UTC,Carbon Herald,2026-06-25 10:32:18+00:00
Digital battery passport test environment goes online,https://www.electrive.com/2026/06/25/digital-battery-passport-test-environment-goes-online/,2026-06-25 12:00:00 UTC,Battery – electrive.com,2026-06-25 12:00:00+00:00
MatH2 launches to validate hydrogen-compatible materials,https://hydrogentechworld.com/math2-launches-to-validate-hydrogen-compatible-materials,2026-06-25 12:00:55 UTC,Hydrogen Tech World.com,2026-06-25 12:00:55+00:00
Groundwork BioAg Issues First Verified Credits From Its Rootella Carbon® Program,https://carbonherald.com/groundwork-bioag-issues-first-verified-credits-from-its-rootella-carbon-program/?utm_source=rss&utm_medium=rss&utm_campaign=groundwork-bioag-issues-first-verified-credits-from-its-rootella-carbon-program,2026-06-25 12:15:37 UTC,Carbon Herald,2026-06-25 12:15:37+00:00
First red squirrel kits born at sanctuary,https://www.bbc.co.uk/news/articles/cly0xg8ezyzo?at_medium=RSS&at_campaign=rss,2026-06-25 12:37:05 UTC,BBC News,2026-06-25 12:37:05+00:00
Faster battery buildout could save German consumers up to €2.8 billion by 2035,https://www.ess-news.com/2026/06/25/faster-battery-buildout-could-save-german-consumers-up-to-e2-8-billion-by-2035/,2026-06-25 13:00:00 UTC,Latest news about ESS Projects & Applications | ESS News,2026-06-25 13:00:00+00:00
In pictures: Britain swelters in record-breaking June heat,https://www.bbc.co.uk/news/articles/cy5vq3q2g19o?at_medium=RSS&at_campaign=rss,2026-06-25 13:48:24 UTC,BBC News,2026-06-25 13:48:24+00:00
Rock Tech struggles with financing for lithium converter in Guben,https://www.electrive.com/2026/06/25/rock-tech-struggles-with-financing-for-lithium-converter-in-guben/,2026-06-25 14:45:00 UTC,Battery – electrive.com,2026-06-25 14:45:00+00:00
Calls for government action on chemical pollution,https://www.bbc.co.uk/news/articles/cjegkw20peno?at_medium=RSS&at_campaign=rss,2026-06-25 16:52:54 UTC,BBC News,2026-06-25 16:52:54+00:00
"Cracking color vision, U.S. science policy changes, and a trailblazing biography",https://www.science.org/doi/10.1126/science.z7ulgow,2026-06-25 18:00:00 UTC,Science Magazine Podcast,2026-06-25 18:00:00+00:00
BBC Inside Science,https://www.bbc.co.uk/sounds/play/w3ct977s?at_medium=RSS&at_campaign=rss,2026-06-25 20:00:00 UTC,BBC News,2026-06-25 20:00:00+00:00
