title,link,published,source,pub_date
Ultrafast photocurrent detection contradicts optical detection conclusions: Exciton diffusion contributes little to carbon nanotube device efficiency,https://www.science.org/doi/abs/10.1126/sciadv.aec3186?af=R,2026-07-01 07:00:00 UTC,AAAS: Science Advances: Table of Contents,2026-07-01 07:00:00+00:00
Loss of O-antigen due to wbbL mutations is common and associated with increased mortality in Escherichia coli bloodstream infections,https://www.science.org/doi/abs/10.1126/sciadv.aec4661?af=R,2026-07-01 07:00:00 UTC,AAAS: Science Advances: Table of Contents,2026-07-01 07:00:00+00:00
Dual-mode analysis of ischemic stroke based on urine SERS spectra and carotid B-ultrasound,https://www.science.org/doi/abs/10.1126/sciadv.aee3487?af=R,2026-07-01 07:00:00 UTC,AAAS: Science Advances: Table of Contents,2026-07-01 07:00:00+00:00
Bio-integrated μBots with overtone ultrawideband magnetoelectric antennas for wireless telemetry,https://www.science.org/doi/abs/10.1126/sciadv.aec7011?af=R,2026-07-01 07:00:00 UTC,AAAS: Science Advances: Table of Contents,2026-07-01 07:00:00+00:00
Antiferroelectric thin films embedded with ferroelectric switching loop for giant negative electrocaloric effect,https://www.science.org/doi/abs/10.1126/sciadv.aed5447?af=R,2026-07-01 07:00:00 UTC,AAAS: Science Advances: Table of Contents,2026-07-01 07:00:00+00:00
A unified ligand-dimensional design to halt cation migration in perovskite photovoltaics,https://www.science.org/doi/abs/10.1126/sciadv.aed6327?af=R,2026-07-01 07:00:00 UTC,AAAS: Science Advances: Table of Contents,2026-07-01 07:00:00+00:00
Stellar feedback drives the baryon deficiency in low-mass galaxies,https://www.science.org/doi/abs/10.1126/sciadv.aed7506?af=R,2026-07-01 07:00:00 UTC,AAAS: Science Advances: Table of Contents,2026-07-01 07:00:00+00:00
Dimer asymmetry in signaling of blue light sensor histidine kinases,https://www.science.org/doi/abs/10.1126/sciadv.aed8943?af=R,2026-07-01 07:00:00 UTC,AAAS: Science Advances: Table of Contents,2026-07-01 07:00:00+00:00
"Large-area, photo-programmable 2D semiconductors with chromic molecular functionalization",https://www.science.org/doi/abs/10.1126/sciadv.aee1510?af=R,2026-07-01 07:00:00 UTC,AAAS: Science Advances: Table of Contents,2026-07-01 07:00:00+00:00
"Safe, high-performance, moisture-activated batteries for powering next-generation Internet-of-Things devices",https://www.science.org/doi/abs/10.1126/sciadv.aee2065?af=R,2026-07-01 07:00:00 UTC,AAAS: Science Advances: Table of Contents,2026-07-01 07:00:00+00:00
Spatiotemporal control of myoblast identity drives muscle diversity in the Drosophila leg,https://www.science.org/doi/abs/10.1126/sciadv.aed0910?af=R,2026-07-01 07:00:00 UTC,AAAS: Science Advances: Table of Contents,2026-07-01 07:00:00+00:00
A systems-level atlas of carbon-response transcriptional states in Escherichia coli,https://www.pnas.org/doi/abs/10.1073/pnas.2531884123?mi=eymic2&af=R&access=on&content=articlesChapters&publication=pnas&sortBy=Earliest&target=default,2026-07-01 07:00:00 UTC,Proceedings of the National Academy of Sciences: Keyword search for query,2026-07-01 07:00:00+00:00
Granulosa cell glycogen fuels the avascular corpus luteum,https://www.pnas.org/doi/abs/10.1073/pnas.2523789123?mi=eymic2&af=R&access=on&content=articlesChapters&publication=pnas&sortBy=Earliest&target=default,2026-07-01 07:00:00 UTC,Proceedings of the National Academy of Sciences: Keyword search for query,2026-07-01 07:00:00+00:00
Combinatorial decision-making driven by multicomponent surface condensates,https://www.pnas.org/doi/abs/10.1073/pnas.2527873123?mi=eymic2&af=R&access=on&content=articlesChapters&publication=pnas&sortBy=Earliest&target=default,2026-07-01 07:00:00 UTC,Proceedings of the National Academy of Sciences: Keyword search for query,2026-07-01 07:00:00+00:00
Why environmental scientists need ethics training more than ever before,https://www.pnas.org/doi/abs/10.1073/pnas.2525403123?mi=eymic2&af=R&access=on&content=articlesChapters&publication=pnas&sortBy=Earliest&target=default,2026-07-01 07:00:00 UTC,Proceedings of the National Academy of Sciences: Keyword search for query,2026-07-01 07:00:00+00:00
Neuropeptide signaling and the blood–brain barrier generate a persistent stress-induced internal state in Drosophila,https://www.pnas.org/doi/abs/10.1073/pnas.2517987123?mi=eymic2&af=R&access=on&content=articlesChapters&publication=pnas&sortBy=Earliest&target=default,2026-07-01 07:00:00 UTC,Proceedings of the National Academy of Sciences: Keyword search for query,2026-07-01 07:00:00+00:00
A genome-wide screen identifies that PLCG2 restrains lysosomal GCase activity,https://www.pnas.org/doi/abs/10.1073/pnas.2514112123?mi=eymic2&af=R&access=on&content=articlesChapters&publication=pnas&sortBy=Earliest&target=default,2026-07-01 07:00:00 UTC,Proceedings of the National Academy of Sciences: Keyword search for query,2026-07-01 07:00:00+00:00
Nitrogen–TOR targets a bivalent chromatin reader to modulate floral transition,https://www.pnas.org/doi/abs/10.1073/pnas.2530341123?mi=eymic2&af=R&access=on&content=articlesChapters&publication=pnas&sortBy=Earliest&target=default,2026-07-01 07:00:00 UTC,Proceedings of the National Academy of Sciences: Keyword search for query,2026-07-01 07:00:00+00:00
Dry‑Contact Trimming for All‑Perovskite Tandem Solar Cells via Solid‑Solution Homogenization,https://advanced.onlinelibrary.wiley.com/doi/10.1002/aenm.202506753?af=R,2026-07-01 07:00:00 UTC,Wiley: Advanced Energy Materials: Table of Contents,2026-07-01 07:00:00+00:00
Farming worries after India records driest June in over a decade,https://www.bbc.co.uk/news/articles/c5yzk5rqyr4o?at_medium=RSS&at_campaign=rss,2026-07-01 07:15:15 UTC,BBC News,2026-07-01 07:15:15+00:00
Proposed new satellite fleets could overwhelm the night sky,https://www.science.org/content/article/proposed-new-satellite-fleets-could-overwhelm-night-sky,2026-07-01 08:00:00 UTC,Latest News from Science Magazine,2026-07-01 08:00:00+00:00
Impact‐Resistant Hydrogels Via Quaternary Ammonium‐Regulated Networks,https://advanced.onlinelibrary.wiley.com/doi/10.1002/adma.73787?af=R,2026-07-01 08:45:32 UTC,Wiley: Advanced Materials: Table of Contents,2026-07-01 08:45:32+00:00
Orica takes FID on Hunter Valley Hydrogen Hub,https://hydrogentechworld.com/orica-takes-fid-on-hunter-valley-hydrogen-hub,2026-07-01 09:28:03 UTC,Hydrogen Tech World.com,2026-07-01 09:28:03+00:00
CATL resumes operations at its lithium mine in Jiangxi,https://www.electrive.com/2026/07/01/catl-resumes-operations-at-its-lithium-mine-in-jiangxi/,2026-07-01 09:48:58 UTC,Battery – electrive.com,2026-07-01 09:48:58+00:00
Lab-created ‘SpudCell’ marks ‘stunning’ step toward building life from scratch,https://www.science.org/content/article/lab-created-spudcell-marks-major-step-toward-building-life-scratch,2026-07-01 10:00:00 UTC,Latest News from Science Magazine,2026-07-01 10:00:00+00:00
Stricter EV and battery standards take effect in China,https://www.electrive.com/2026/07/01/stricter-ev-and-battery-standards-take-effect-in-china/,2026-07-01 10:00:00 UTC,Battery – electrive.com,2026-07-01 10:00:00+00:00
Exceptional Rare‐Earth Half‐Heusler Thermoelectrics With Sublattice Softening,https://advanced.onlinelibrary.wiley.com/doi/10.1002/adma.73841?af=R,2026-07-01 10:36:04 UTC,Wiley: Advanced Materials: Table of Contents,2026-07-01 10:36:04+00:00
Toward Practical Solid‐State Lithium Batteries With High‐Nickel Cathodes: An Interface‐Centered Perspective,https://advanced.onlinelibrary.wiley.com/doi/10.1002/adma.73888?af=R,2026-07-01 10:40:27 UTC,Wiley: Advanced Materials: Table of Contents,2026-07-01 10:40:27+00:00
A Planarity‐Hindrance Co‐Balance Strategy to Develop Antiparallel H‐Aggregates With Minimal Absorbance Blueshift for Type I Photodynamic Therapy,https://advanced.onlinelibrary.wiley.com/doi/10.1002/adma.73868?af=R,2026-07-01 10:40:38 UTC,Wiley: Advanced Materials: Table of Contents,2026-07-01 10:40:38+00:00
Co‐Assembled Hybrid Interlayer Engineering for Enhanced Upper Interface Stability in Inverted Perovskite Solar Cells,https://advanced.onlinelibrary.wiley.com/doi/10.1002/adma.73886?af=R,2026-07-01 10:45:07 UTC,Wiley: Advanced Materials: Table of Contents,2026-07-01 10:45:07+00:00
Dangerous heatwave to hit US ahead of holiday weekend,https://www.bbc.co.uk/news/articles/cm2j8kd0dk4o?at_medium=RSS&at_campaign=rss,2026-07-01 10:45:49 UTC,BBC News,2026-07-01 10:45:49+00:00
Three beaver kits born in Wyre Forest enclosure,https://www.bbc.co.uk/news/articles/c23yz4dd9vzo?at_medium=RSS&at_campaign=rss,2026-07-01 10:56:08 UTC,BBC News,2026-07-01 10:56:08+00:00
"Greenvolt, BYD Energy sign supply deal for 600 MW BESS in Poland",https://www.ess-news.com/2026/07/01/greenvolt-byd-energy-sign-supply-deal-for-600-mw-bess-in-poland/,2026-07-01 11:05:46 UTC,Latest news about ESS Projects & Applications | ESS News,2026-07-01 11:05:46+00:00
Zein‐Ceria Hybrid Microparticles Enable Long‐Term ROS‐Scavenging Oxygenation for Osteogenic Microtissues Engineering,https://advanced.onlinelibrary.wiley.com/doi/10.1002/adma.73849?af=R,2026-07-01 11:30:49 UTC,Wiley: Advanced Materials: Table of Contents,2026-07-01 11:30:49+00:00
Energiabörze completes 4.77 MWh battery storage project in Hungary,https://www.ess-news.com/2026/07/01/energiaborze-completes-4-77-mwh-battery-storage-project-in-hungary/,2026-07-01 11:55:00 UTC,Latest news about ESS Projects & Applications | ESS News,2026-07-01 11:55:00+00:00
Energy Dome to build 23 MW/200 MWh CO2 battery in Ireland,https://www.ess-news.com/2026/07/01/energy-dome-to-build-23-mw-200-mwh-long-duration-carbon-battery-in-ireland/,2026-07-01 12:00:00 UTC,Latest news about ESS Projects & Applications | ESS News,2026-07-01 12:00:00+00:00
How west London beavers are tackling flooding,https://www.bbc.co.uk/news/articles/ckg728erp1yo?at_medium=RSS&at_campaign=rss,2026-07-01 12:19:30 UTC,BBC News,2026-07-01 12:19:30+00:00
Demand for water use highest since 2022 drought,https://www.bbc.co.uk/news/articles/c992j5y77j2o?at_medium=RSS&at_campaign=rss,2026-07-01 12:39:58 UTC,BBC News,2026-07-01 12:39:58+00:00
England's warmest June on record following historic heatwave,https://www.bbc.co.uk/weather/articles/cjdg98g8lg8o?at_medium=RSS&at_campaign=rss,2026-07-01 13:49:42 UTC,BBC News,2026-07-01 13:49:42+00:00
"Poland, Italy lead Europe’s battery storage revenue rankings",https://www.ess-news.com/2026/07/01/poland-italy-lead-europes-battery-storage-revenue-rankings/,2026-07-01 14:00:00 UTC,Latest news about ESS Projects & Applications | ESS News,2026-07-01 14:00:00+00:00
Redesigning Interlayers for Anode‐Free Batteries: Harnessing Continuity and Metal Inventory,https://advanced.onlinelibrary.wiley.com/doi/10.1002/aenm.71206?af=R,2026-07-01 14:42:14 UTC,Wiley: Advanced Energy Materials: Table of Contents,2026-07-01 14:42:14+00:00
Chemical intuition on bond-dissociation energies as an emergent ability of universal machine-learning interatomic potentials,https://www.nature.com/articles/s41467-026-74919-8,2026-07-02 00:00:00 UTC,Nature Communications,2026-07-02 00:00:00+00:00
"A low-temperature, water-free fabrication route to Mg-based micro thermoelectric coolers for thermal management",https://www.nature.com/articles/s41467-026-75165-8,2026-07-02 00:00:00 UTC,Nature Communications,2026-07-02 00:00:00+00:00
The Bipartisan infrastructure law’s impact on drinking water funding for disadvantaged communities,https://www.nature.com/articles/s41467-026-74287-3,2026-07-02 00:00:00 UTC,Nature Communications,2026-07-02 00:00:00+00:00
Fluid-mediated nuclearity control in heterogeneous polyolefin catalysis,https://www.nature.com/articles/s41467-026-75099-1,2026-07-02 00:00:00 UTC,Nature Communications,2026-07-02 00:00:00+00:00
Structure-guided reprogramming of DELLA turnover for a sustainable Green Revolution in rice,https://www.nature.com/articles/s41467-026-75068-8,2026-07-02 00:00:00 UTC,Nature Communications,2026-07-02 00:00:00+00:00
Increased dengue transmission following highway paving in the Peruvian Amazon,https://www.nature.com/articles/s41893-026-01879-8,2026-07-02 00:00:00 UTC,Nature Sustainability,2026-07-02 00:00:00+00:00
Critical surface strain regime for stable and active epitaxial platinum oxygen reduction electrocatalysts,https://www.nature.com/articles/s41560-026-02108-4,2026-07-02 00:00:00 UTC,Nature Energy,2026-07-02 00:00:00+00:00
Rapidly constructed Ru-NiMn sites regulate the –CHO/–CH2OH pathway and deprotonate to elevate biomass-derived molecule electrooxidation,https://www.cell.com/joule/fulltext/S2542-4351(26)00229-1?rss=yes,2026-07-02 00:00:00 UTC,Joule,2026-07-02 00:00:00+00:00
Driving movement in the field of molecular machines,https://www.nature.com/articles/s41557-026-02210-w,2026-07-02 00:00:00 UTC,Nature Chemistry,2026-07-02 00:00:00+00:00
Electrodeposited self-assembled molecules for perovskite photovoltaics,https://www.nature.com/articles/s41586-026-10844-6,2026-07-02 00:00:00 UTC,Nature,2026-07-02 00:00:00+00:00
Author Correction: Synthesis of enantioenriched atropisomers by biocatalytic deracemization,https://www.nature.com/articles/s41586-026-10854-4,2026-07-02 00:00:00 UTC,Nature,2026-07-02 00:00:00+00:00
Neutrino’s nursery found: the ‘Shadow Blaster’,https://www.nature.com/articles/d41586-026-02034-1,2026-07-02 00:00:00 UTC,Nature,2026-07-02 00:00:00+00:00
Can you actually do a nine-to-five PhD? Nature readers weigh in,https://www.nature.com/articles/d41586-026-01773-5,2026-07-02 00:00:00 UTC,Nature,2026-07-02 00:00:00+00:00
Incoming US science academy chief vows to ‘double down’ on research,https://www.nature.com/articles/d41586-026-02088-1,2026-07-02 00:00:00 UTC,Nature,2026-07-02 00:00:00+00:00
"Paleogenomics retraces the ancient population history of Southwestern East Asia for the past 12,000 years",https://academic.oup.com/nsr/advance-article/doi/10.1093/nsr/nwag398/8723923?rss=1,2026-07-02 00:00:00 UTC,National Science Review Advance Access,2026-07-02 00:00:00+00:00
Inflammation-triggered sensing and miRNA immunotherapy with a wireless battery-free hydrogel bioelectronic patch,https://academic.oup.com/nsr/advance-article/doi/10.1093/nsr/nwag409/8723916?rss=1,2026-07-02 00:00:00 UTC,National Science Review Advance Access,2026-07-02 00:00:00+00:00
Setting a direction for molecular motors,https://www.nature.com/articles/s41557-026-02205-7,2026-07-02 00:00:00 UTC,Nature Chemistry,2026-07-02 00:00:00+00:00
How isoprene connects plants to global climate,https://www.nature.com/articles/s41557-026-02192-9,2026-07-02 00:00:00 UTC,Nature Chemistry,2026-07-02 00:00:00+00:00
First ladies of chemistry,https://www.nature.com/articles/s41557-026-02187-6,2026-07-02 00:00:00 UTC,Nature Chemistry,2026-07-02 00:00:00+00:00
Convergent evolution of dogs and humans: a promising new model system for human social behaviors and mental health,https://academic.oup.com/nsr/advance-article/doi/10.1093/nsr/nwag405/8723906?rss=1,2026-07-02 00:00:00 UTC,National Science Review Advance Access,2026-07-02 00:00:00+00:00
A key Arctic science outpost finds itself tangled in a geopolitical web,https://www.science.org/content/article/key-arctic-science-outpost-finds-itself-tangled-geopolitical-web,2026-07-02 02:00:00 UTC,Latest News from Science Magazine,2026-07-02 02:00:00+00:00
How an ancient continental breakup helped spawn the Antarctic Ice Sheet,https://www.science.org/content/article/how-ancient-continental-breakup-helped-spawn-antarctic-ice-sheet,2026-07-02 02:00:00 UTC,Latest News from Science Magazine,2026-07-02 02:00:00+00:00
Generation of the Camptothecin Scaffold by a Flavin‐Catalyzed Photooxidative Skeletal Reorganization,https://onlinelibrary.wiley.com/doi/10.1002/anie.4569029?af=R,2026-07-02 03:07:26 UTC,Wiley: Angewandte Chemie International Edition: Table of Contents,2026-07-02 03:07:26+00:00
Hydrophobic Promoter‐Enhanced Tandem Catalysis for Alkene Epoxidation With H2 and O2,https://onlinelibrary.wiley.com/doi/10.1002/anie.2551607?af=R,2026-07-02 03:08:16 UTC,Wiley: Angewandte Chemie International Edition: Table of Contents,2026-07-02 03:08:16+00:00
Asymmetric Ionic Liquid Modulated Anion‐Reinforced Electric Double Layer for Advanced Durable Lithium Batteries,https://onlinelibrary.wiley.com/doi/10.1002/anie.5759017?af=R,2026-07-02 03:26:25 UTC,Wiley: Angewandte Chemie International Edition: Table of Contents,2026-07-02 03:26:25+00:00
First-ever treatment trial for Ebola Bundibugyo kicks off in the Congo,https://www.science.org/content/article/first-ever-treatment-trial-ebola-bundibugyo-kicks-congo,2026-07-02 03:50:00 UTC,Latest News from Science Magazine,2026-07-02 03:50:00+00:00
Major Ukraine research center damaged in Russian strikes,https://www.science.org/content/article/major-ukraine-research-center-damaged-russian-strikes,2026-07-02 05:10:00 UTC,Latest News from Science Magazine,2026-07-02 05:10:00+00:00
Being a taller tree doesn’t doom you to drought after all,https://www.science.org/content/article/being-taller-tree-doesn-t-doom-you-drought-after-all,2026-07-02 05:30:00 UTC,Latest News from Science Magazine,2026-07-02 05:30:00+00:00
Engineering Layered Magnetic Hydrogels for Cell Placement via Shear and Magnetic Field‐Induced Assembly,https://advanced.onlinelibrary.wiley.com/doi/10.1002/adma.73847?af=R,2026-07-02 05:54:28 UTC,Wiley: Advanced Materials: Table of Contents,2026-07-02 05:54:28+00:00
Interfacial Acid Sites‐Mediated ZnO‐Based Electrocatalysts for Sustainable Dual‐Pathway H2O2 Production and Rechargeable Zn‐H2O2 Electrochemical Cell,https://advanced.onlinelibrary.wiley.com/doi/10.1002/adma.73786?af=R,2026-07-02 05:55:44 UTC,Wiley: Advanced Materials: Table of Contents,2026-07-02 05:55:44+00:00
Stop the biodiversity sampling arms race,https://www.science.org/doi/abs/10.1126/science.aei5413?af=R,2026-07-02 06:00:12 UTC,AAAS: Science: Table of Contents,2026-07-02 06:00:12+00:00
Family stability sustains scientific talent,https://www.science.org/doi/abs/10.1126/science.aei9444?af=R,2026-07-02 06:00:12 UTC,AAAS: Science: Table of Contents,2026-07-02 06:00:12+00:00
End “reusable” waste dumping in Africa,https://www.science.org/doi/abs/10.1126/science.aei3868?af=R,2026-07-02 06:00:12 UTC,AAAS: Science: Table of Contents,2026-07-02 06:00:12+00:00
Ecology of the gut microbiome,https://www.science.org/doi/abs/10.1126/science.aej2365?af=R,2026-07-02 06:00:12 UTC,AAAS: Science: Table of Contents,2026-07-02 06:00:12+00:00
"On Zeppelin Mountain, sensors sniff Russian air",https://www.science.org/doi/abs/10.1126/science.aek1835?af=R,2026-07-02 06:00:12 UTC,AAAS: Science: Table of Contents,2026-07-02 06:00:12+00:00
Lab creates new kind of synthetic cell,https://www.science.org/doi/abs/10.1126/science.aek1826?af=R,2026-07-02 06:00:12 UTC,AAAS: Science: Table of Contents,2026-07-02 06:00:12+00:00
Why have a revered physicist’s papers been retracted?,https://www.science.org/doi/abs/10.1126/science.aek1827?af=R,2026-07-02 06:00:12 UTC,AAAS: Science: Table of Contents,2026-07-02 06:00:12+00:00
Transparent fish takes center stage in $1 billion neuroscience initiative,https://www.science.org/doi/abs/10.1126/science.aek1830?af=R,2026-07-02 06:00:12 UTC,AAAS: Science: Table of Contents,2026-07-02 06:00:12+00:00
"Local signals, systemic decline",https://www.science.org/doi/abs/10.1126/science.aej0415?af=R,2026-07-02 06:00:12 UTC,AAAS: Science: Table of Contents,2026-07-02 06:00:12+00:00
How an ancient continental breakup ultimately helped spawn the vast Antarctic Ice Sheet,https://www.science.org/doi/abs/10.1126/science.aek1832?af=R,2026-07-02 06:00:12 UTC,AAAS: Science: Table of Contents,2026-07-02 06:00:12+00:00
Rubin telescope begins a 10-year movie of the cosmos,https://www.science.org/doi/abs/10.1126/science.aek1833?af=R,2026-07-02 06:00:12 UTC,AAAS: Science: Table of Contents,2026-07-02 06:00:12+00:00
Feeling a chill,https://www.science.org/doi/abs/10.1126/science.aek1834?af=R,2026-07-02 06:00:12 UTC,AAAS: Science: Table of Contents,2026-07-02 06:00:12+00:00
NIH security rules for genomic data sets are slowing research,https://www.science.org/doi/abs/10.1126/science.aek1828?af=R,2026-07-02 06:00:12 UTC,AAAS: Science: Table of Contents,2026-07-02 06:00:12+00:00
250 years of promise,https://www.science.org/doi/abs/10.1126/science.aek0783?af=R,2026-07-02 06:00:12 UTC,AAAS: Science: Table of Contents,2026-07-02 06:00:12+00:00
The invisible hand,https://www.science.org/doi/abs/10.1126/science.aej2364?af=R,2026-07-02 06:00:12 UTC,AAAS: Science: Table of Contents,2026-07-02 06:00:12+00:00
NIH again faces year-end grantmaking scramble,https://www.science.org/doi/abs/10.1126/science.aek1829?af=R,2026-07-02 06:00:12 UTC,AAAS: Science: Table of Contents,2026-07-02 06:00:12+00:00
Computing in a memory with physics,https://www.science.org/doi/abs/10.1126/science.aei8090?af=R,2026-07-02 06:00:12 UTC,AAAS: Science: Table of Contents,2026-07-02 06:00:12+00:00
Surface immune signaling unlocks NLR activation through mRNA alternative splicing,https://www.science.org/doi/abs/10.1126/science.adx9929?af=R,2026-07-02 06:00:12 UTC,AAAS: Science: Table of Contents,2026-07-02 06:00:12+00:00
Making time,https://www.science.org/doi/abs/10.1126/science.aei6905?af=R,2026-07-02 06:00:12 UTC,AAAS: Science: Table of Contents,2026-07-02 06:00:12+00:00
From Edison’s Invention Factory to the new architecture of innovation,https://www.science.org/doi/abs/10.1126/science.aei5415?af=R,2026-07-02 06:00:12 UTC,AAAS: Science: Table of Contents,2026-07-02 06:00:12+00:00
American science at 250,https://www.science.org/doi/abs/10.1126/science.aej4833?af=R,2026-07-02 06:00:12 UTC,AAAS: Science: Table of Contents,2026-07-02 06:00:12+00:00
Observation of disorder-free localization using a (2+1)D lattice gauge theory on a quantum processor,https://www.science.org/doi/abs/10.1126/science.adr9680?af=R,2026-07-02 06:00:12 UTC,AAAS: Science: Table of Contents,2026-07-02 06:00:12+00:00
Orbital magnetoresistance in the antiferromagnet CoO driven by dynamic orbital angular momentum,https://www.science.org/doi/abs/10.1126/science.adw1808?af=R,2026-07-02 06:00:12 UTC,AAAS: Science: Table of Contents,2026-07-02 06:00:12+00:00
Fruit flies actively restart their circadian clock by proactively shaping their environment,https://www.science.org/doi/abs/10.1126/science.adw2239?af=R,2026-07-02 06:00:12 UTC,AAAS: Science: Table of Contents,2026-07-02 06:00:12+00:00
A dietary switch promotes sensory neuron–dependent cancer-associated cachexia,https://www.science.org/doi/abs/10.1126/science.adz4196?af=R,2026-07-02 06:00:12 UTC,AAAS: Science: Table of Contents,2026-07-02 06:00:12+00:00
In Science Journals,https://www.science.org/doi/abs/10.1126/science.aek1433?af=R,2026-07-02 06:00:12 UTC,AAAS: Science: Table of Contents,2026-07-02 06:00:12+00:00
Alternating atomic-dipole layers and switching dynamics in Al1-xScxN ferroelectrics,https://www.science.org/doi/abs/10.1126/science.aee9639?af=R,2026-07-02 06:00:12 UTC,AAAS: Science: Table of Contents,2026-07-02 06:00:12+00:00
Retraction,https://www.science.org/doi/abs/10.1126/science.aej3933?af=R,2026-07-02 06:00:12 UTC,AAAS: Science: Table of Contents,2026-07-02 06:00:12+00:00
A sub–10-millisecond neural dynamical system based on phase-change memristors,https://www.science.org/doi/abs/10.1126/science.aee6277?af=R,2026-07-02 06:00:12 UTC,AAAS: Science: Table of Contents,2026-07-02 06:00:12+00:00
Johns Hopkins University and the American research enterprise,https://www.science.org/doi/abs/10.1126/science.aej0512?af=R,2026-07-02 06:00:12 UTC,AAAS: Science: Table of Contents,2026-07-02 06:00:12+00:00
The missing thriftiness,https://www.science.org/doi/abs/10.1126/science.aej2367?af=R,2026-07-02 06:00:12 UTC,AAAS: Science: Table of Contents,2026-07-02 06:00:12+00:00
Height does not impair the hydraulic system of the tallest tropical Dipterocarp trees,https://www.science.org/doi/abs/10.1126/science.aea9013?af=R,2026-07-02 06:00:12 UTC,AAAS: Science: Table of Contents,2026-07-02 06:00:12+00:00
In Other Journals,https://www.science.org/doi/abs/10.1126/science.aek1434?af=R,2026-07-02 06:00:12 UTC,AAAS: Science: Table of Contents,2026-07-02 06:00:12+00:00
A classroom contract for AI,https://www.science.org/doi/abs/10.1126/science.aek1435?af=R,2026-07-02 06:00:12 UTC,AAAS: Science: Table of Contents,2026-07-02 06:00:12+00:00
The mechanics of liver regeneration,https://www.science.org/doi/abs/10.1126/science.aei7784?af=R,2026-07-02 06:00:12 UTC,AAAS: Science: Table of Contents,2026-07-02 06:00:12+00:00
WWII and the evolution of US federal research funding,https://www.science.org/doi/abs/10.1126/science.aej2321?af=R,2026-07-02 06:00:12 UTC,AAAS: Science: Table of Contents,2026-07-02 06:00:12+00:00
“Green Port Hydrogen City” operational in northeast China,https://ammoniaenergy.org/articles/green-port-hydrogen-city-operational-in-northeast-china/,2026-07-02 06:05:42 UTC,Articles – Ammonia Energy Association,2026-07-02 06:05:42+00:00
Erratum for the Research Article “Detecting supramolecular organic nanoparticles during heat wave”,https://www.science.org/doi/abs/10.1126/science.aej7556?af=R,2026-07-02 07:00:00 UTC,AAAS: Science: Table of Contents,2026-07-02 07:00:00+00:00
Continental breakup–driven uplift instigated East Antarctic Ice Sheet formation,https://www.science.org/doi/abs/10.1126/science.adz6758?af=R,2026-07-02 07:00:00 UTC,AAAS: Science: Table of Contents,2026-07-02 07:00:00+00:00
TranscriptFormer: A generative cell atlas across 1.5 billion years of evolution,https://www.science.org/doi/abs/10.1126/science.aec8514?af=R,2026-07-02 07:00:00 UTC,AAAS: Science: Table of Contents,2026-07-02 07:00:00+00:00
Zonated mechanosensing by PIEZO1 controls liver regeneration,https://www.science.org/doi/abs/10.1126/science.aef0825?af=R,2026-07-02 07:00:00 UTC,AAAS: Science: Table of Contents,2026-07-02 07:00:00+00:00
