title,link,source,published_str,pub_date,doi,last_author,abstract,abstract_source,must_have_abstract
[ASAP] Mixing of Spacer Cations in 2D Halide Perovskites,http://dx.doi.org/10.1021/jacs.6c03761,Journal of the American Chemical Society: Latest Articles (ACS Publications),2026-04-30 09:20:20 UTC,2026-04-30 09:20:20+00:00,10.1021/jacs.6c03761,Xiaotong Li,"Two-dimensional (2D) perovskites incorporating large organic spacer cations between the octahedral anion layers exhibit exceptional optoelectronic properties and structural tunability. Given the limited availability of commercial spacer cations, mixing different cations within a single perovskite structure becomes an intriguing prospect. However, clear principles for selecting compatible spacer combinations are still lacking. To address this, we explore three guiding principles: solubility, interlayer distance, and Pb-I-Pb bond angle. Guided by those principles, we choose five spacer cations with a variety of shapes and sizes: BA = butylammonium, IPA = 3-iodopropyl ammonium, CPA = cyclopentylammonium, DAO = 1,8-diammonium octane, PA = pentylammonium, and successfully synthesize five new mixed-spacer 2D perovskites, including (BA)(IPA)PbI4, (CPA)(IPA)PbI4, (BA)(CPA)PbI4, (DAO)0.5(CPA)PbI4, and (DAO)0.5(PA)PbI4. Our findings show that mixing spacers can lead to higher symmetry, significantly suppress out-of-plane tilting, and give rise to a unique rippling structure in some systems. The optical bandgaps of the mixed-spacer 2D perovskites are typically located between those of the two parent phases. Finally, we extend this approach to systems incorporating up to five spacers in a single system, with phase purity confirmed through powder and single-crystal X-ray diffraction characterizations. This work offers simple yet practical indicators for selecting compatible spacer cations, providing a pathway to better understand how spacer mixing influences the structural, physical, and optical properties of 2D perovskites.",pubmed,0
[ASAP] Exact Stoichiometry Far-Off Neutrality Catanionic Nanotubes: Unconventional Self-Assembly of Oppositely Charged Surfactants,http://dx.doi.org/10.1021/jacs.5c21811,Journal of the American Chemical Society: Latest Articles (ACS Publications),2026-04-30 09:29:30 UTC,2026-04-30 09:29:30+00:00,10.1021/jacs.5c21811,Luciano Galantini,"Electrostatic energy plays a pivotal role in the minimization of the free energy of self-assembling oppositely charged ions. This is a fundamental principle that guides the formation of aggregates and the separation of phases characterized by a stoichiometric balance between the opposite charges. However, this study unveils the self-assembly of catanionic nanotubes from a mixture of oppositely charged surfactants in aqueous buffer, comprising an anionic bile salt derivative and the cationic cetyltrimethylammonium bromide (CTAB) at an exact strongly unbalanced charge ratio of 9 anions to 1 cation. This anomalous aggregation leads to the formation of highly stable and ordered supramolecular nanotubes with a uniform cross-section of about 20 nm. The key to this behavior lies in the unique, rigid, and facial amphiphilic structure of the bile salt derivative, allocating hydrogen bond donors/acceptors and an aromatic residue, which promotes geometrically constrained derivative-derivative interactions. This facilitates the assembly of the anionic derivative into parallel, helically wrapped, negatively charged ribbons with interspersed CTAB cations, acting to promote their adhesion. Supramolecular nanotubes are highly valued in nanotechnology for applications such as catalysis and tissue engineering due to their rigidity, intrinsic directionality, and capability for dual compartmentalization (inner cavity and outer surface). The catanionic structures reported here are ordered architectures that allow for a high charge and a minimal interference from free monomers, which are essential for optimizing functions such as material loading. A loading ability was demonstrated here by the nanotube interaction with positively charged carbon dots and gold nanorods.",pubmed,0
[ASAP] Anion Coordination Transition Enabled by Ion–Dipole Interactions At Low Temperatures,http://dx.doi.org/10.1021/jacs.6c03001,Journal of the American Chemical Society: Latest Articles (ACS Publications),2026-04-30 09:30:23 UTC,2026-04-30 09:30:23+00:00,10.1021/jacs.6c03001,Zhongwei Chen,"While constructing anion-involved solvation structures is key to improving electrolyte performance at low temperatures (LTs), conventional strategies that primarily manipulate Li+-solvent interactions present significant challenges. These include weakened anion coordination, impeded ion transport, and aggravated interfacial side reactions, making the realization of effective LT operation elusive. Here, we propose a ""polarity-contrast"" electrolyte design strategy, which enables the construction of a LT-stable, anion-rich solvation structure through deliberate regulation of anion-solvent interactions. The solvent pairs, dimethoxymethane (DMM) and fluoroethylene carbonate (FEC), which exhibits the lowest and highest maximum electrostatic potential, respectively, were selected for electrolyte engineering. At LTs, the weakened interactions between primary solvent DMM and FSI- promote the coordination of solvation of anions. Meanwhile, the coordinated FEC cosolvent enhances ion-dipole interactions with FSI-, further anchoring these anions within the solvation sheath. This FSI--dominated solvation environment facilitates the formation of a fluorine-rich solid electrolyte interphase, which in turn enables uniform Li deposition under LT conditions. Therefore, Li||SPAN full cells demonstrate excellent LT performance, including a high areal capacity of 4.5 mAh cm-2 and 150 cycles with 80% retention at -40 °C. Notably, Ah-level Li||SPAN pouch cells demonstrate 50 cycles at -20 °C with exceptional capacity-temperature-lifespan balance, surpassing the most reported LT LMBs.",pubmed,0
Scalable Production of Leaf‐Stomata‐Inspired Moisture‐Responsive Knitted Fabric for Personal Thermal and Moisture Management,https://advanced.onlinelibrary.wiley.com/doi/10.1002/aenm.71020?af=R,Wiley: Advanced Energy Materials: Table of Contents,2026-04-30 12:42:03 UTC,2026-04-30 12:42:03+00:00,10.1002/aenm.71020,Jintu Fan,,,0
From Planar to 3D: The Evolution of Complementary Field‐Effect Transistor for Next‐Generation Semiconductor Nodes,https://advanced.onlinelibrary.wiley.com/doi/10.1002/adma.73226?af=R,Wiley: Advanced Materials: Table of Contents,2026-04-30 12:43:32 UTC,2026-04-30 12:43:32+00:00,10.1002/adma.73226,Jianhua Zhang,"Complementary Field-Effect Transistor (CFET) technology is emerging as a critical point to extending Moore's Law by transitioning device scaling and integration from 2- to 3D architectures. Recent advancements, including silicon-based homogeneous CFETs and van der Waals-based heterogeneous CFETs, have demonstrated significant progress, yet a comprehensive and up-to-date review is absent to further advance the field. This work explores CFET fabrication methodologies, comparing the advantages and challenges of Monolithic and Sequential integration approaches, with a focus on thermal management, process complexity, and material compatibility. We highlight the critical role of layered van der Waals materials in addressing thermal constraints and enhancing gate control, leveraging their atomic-scale thickness and unique electronic properties. Furthermore, we discuss strategies to overcome key challenges such as achieving balanced electrical characteristics, optimizing thermal management, and minimizing parasitic capacitance through innovative channel engineering, gate-dielectric design, and structural optimization. The co-design principles of CFET architectures are also examined, showcasing their potential in logic circuits, memory units, and computing-in-memory systems. This review provides a forward-looking perspective on CFET technology, emphasizing the need for continued innovation in material-processing-structure co-design and co-optimization to unlock new frontiers in semiconductor technology.",openalex,0
Intrinsic Coordination Architecture Governing Selectivity Divergence Between Extended and Single‐Site Electrocatalysts,https://advanced.onlinelibrary.wiley.com/doi/10.1002/adma.73223?af=R,Wiley: Advanced Materials: Table of Contents,2026-04-30 12:44:54 UTC,2026-04-30 12:44:54+00:00,10.1002/adma.73223,Ziyun Wang,"and nitrate reduction. While thermodynamic descriptors effectively rank catalysts within homologous families, they often fail to rationalize why fundamentally different material classes intrinsically favor distinct reaction pathways. Here, we identify local coordination geometry as a key structural factor that shapes this selectivity bifurcation. By establishing a general coordination-constraint framework, we show that extended surfaces stabilize intermediates through multi-atom coordination (ensemble effects). This imposes structural constraints on hydrogenation access to carbon or nitrogen centers while oxygen remains bound, thereby biasing reactions toward fully deoxygenated products (e.g., ethylene and ammonia). In contrast, the unilateral coordination of single-atom and molecular sites leaves the reactive center spatially exposed, enabling hydrogenation pathways to oxygen-retaining products (e.g., methanol and hydroxylamine) that are rarely accessible on close-packed surfaces. Importantly, this geometric effect operates in conjunction with electronic structure and interfacial factors. While coordination geometry defines the set of structurally accessible reaction pathways, electronic and electrochemical conditions govern their relative energetics and kinetic competition. This insight provides a transferable principle for the rational design of selective electrocatalysts.",openalex,0
Multifunctional Conjugated Ligands Synergistically Optimize the Interface and Regulate Crystallization for High‐Performance 2D/3D Perovskite Solar Cells,https://advanced.onlinelibrary.wiley.com/doi/10.1002/adma.202520251?af=R,Wiley: Advanced Materials: Table of Contents,2026-04-30 12:45:45 UTC,2026-04-30 12:45:45+00:00,10.1002/adma.202520251,Aihui Liang,"devices, 20.61% for devices with 1.72 eV bandgap, and 22.14% for mini-modules.",openalex,0
Phase‐Pure and Size‐Tunable Tin Halide Perovskite Quantum Dots,https://advanced.onlinelibrary.wiley.com/doi/10.1002/adma.202523678?af=R,Wiley: Advanced Materials: Table of Contents,2026-04-30 12:47:31 UTC,2026-04-30 12:47:31+00:00,10.1002/adma.202523678,Maksym V. Kovalenko,"QDs, finely tunable between 4 and 22 nm, providing access to size-dependent optical bandgap energies across the strong-to-weak confinement regimes. Increasing the availability of Sn(II) through an additional tin carboxylate source reduces defect densities and leads to the emergence of pronounced and spectrally well-resolved excitonic absorption in strongly confined QDs. Variation of the tin halide and A-cation yields formamidinium, methylammonium, and cesium tin bromide and iodide, all with narrow size distributions. This synthetic route sets the stage for further defect engineering to yield bright tin halide perovskite emitters.",openalex,0
Investigation Into the Electrochemical Performance of Micron‐ and Nanosized Tin in Diglyme and Carbonate Electrolytes in Sodium Ion Batteries,https://advanced.onlinelibrary.wiley.com/doi/10.1002/aenm.71023?af=R,Wiley: Advanced Energy Materials: Table of Contents,2026-04-30 12:47:56 UTC,2026-04-30 12:47:56+00:00,10.1002/aenm.71023,John T. S. Irvine,,,0
Near‐Infrared Upconversion Modulation of Intracellular Protons for Autophagy‐Induced Apoptosis,https://advanced.onlinelibrary.wiley.com/doi/10.1002/adma.202523657?af=R,Wiley: Advanced Materials: Table of Contents,2026-04-30 12:49:45 UTC,2026-04-30 12:49:45+00:00,10.1002/adma.202523657,Guanying Chen,"-triggered biodegradation, restoring the NIR upconversion luminescence (at 800 nm) of UCNPs. Following intravenous administration, the nanoagent achieves a six-fold reduction in tumor weight and elevates proton levels in glioma, effectively triggering PAA under non-invasive NIR irradiation. This work establishes a spatiotemporally controlled platform for intratumoral proton dynamics, enabling precision cancer theranostics.",openalex,0
Transpiration‐Inspired Radiative Cooling Metafabric for Efficient Personal Thermal and Moisture Management,https://advanced.onlinelibrary.wiley.com/doi/10.1002/adma.73241?af=R,Wiley: Advanced Materials: Table of Contents,2026-04-30 12:51:03 UTC,2026-04-30 12:51:03+00:00,10.1002/adma.73241,Zaisheng Cai,"O, effectively preventing liquid pinning and back penetration. What's more, the coupled strategy of thermal radiation, conduction, and evaporation resulted in a temperature drop of 20.2°C in the sweaty state. The metafabric also demonstrated superb mechanical robustness, breathability, and washability. The work may offer a scalable and energy-efficient strategy for advanced thermal and moisture management textiles.",openalex,0
"Covalent Adaptable Ionic Networks for Robust, On‐Demand Dismantlable and Fully Recyclable Adhesives",https://advanced.onlinelibrary.wiley.com/doi/10.1002/adma.73259?af=R,Wiley: Advanced Materials: Table of Contents,2026-04-30 12:55:47 UTC,2026-04-30 12:55:47+00:00,10.1002/adma.73259,Feng Yan,"On-demand debonding is a critical yet challenging requirement for advanced adhesives. Herein, we report a rational design strategy for robust, on-demand debondable, and fully recyclable adhesives via constructing covalent adaptable ionic networks (CAINs). Integrating the advantages of poly(ionic liquid)s (PILs) and covalent adaptable networks (CANs), the CAINs exhibit exceptional adhesion strength (>15 MPa on stainless steel), significantly outperforming most reported adhesives based solely on PILs or CANs. The material also maintains a shear strength of 11.0 MPa after immersion in liquid nitrogen, demonstrating excellent low‑temperature tolerance. Bis(trifluoromethanesulfonyl)imide anions endow the adhesives with remarkable hydrophobicity and excellent waterproof performance. Importantly, facile on-demand debonding is achieved via ethanol treatment under mild conditions, enabling complete substrate separation and efficient material recovery with minimal performance degradation over multiple cycles. Mechanistic studies indicate that the covalent crosslinked network is the primary contributor to high adhesion, while hydrogen bonding plays a secondary supportive role. This work establishes a versatile platform for designing high-performance dismantlable adhesives with superior recyclability, advancing sustainable adhesive technologies in advanced manufacturing and materials engineering.",openalex,0
[ASAP] Rational Creation of the Second Xe-Matched Adsorption Site in a Covalent Organic Framework via a Digging-Patching Strategy for Simultaneously Boosting Xe Uptake and Xe/Kr Selectivity,http://dx.doi.org/10.1021/jacs.6c00584,Journal of the American Chemical Society: Latest Articles (ACS Publications),2026-04-30 12:57:44 UTC,2026-04-30 12:57:44+00:00,10.1021/jacs.6c00584,Feng Luo,"It is highly desirable to achieve both high Xe uptake and big Xe/Kr selectivity for Xe/Kr separation but it remains a long-term challenging issue due to an inherent trade-off between Xe uptake and Xe/Kr selectivity. We herein show a general and convenient digging-patching (DP) strategy in a covalent organic framework for simultaneously boosting Xe uptake and Xe/Kr selectivity. Notably, this DP method plays dual functions, creating dual micropores to match the kinetic diameter of Xe and increasing the porosity with surface areas from 573 m2/g to 1134 m2/g. As a result, we observed a large enhancement in both Xe uptake and selectivity from 1.37 to 2.29 mmol/g and from 14.6 to 22.0. It was found that structural design by the digging (D) operation in the DP strategy functions to create dual adsorption sites for Xe, which helps to improve Xe uptake, while the patching (P) operation functions to optimize the second adsorption site with its size close to the kinetic diameters of Xe, which helps to improve Xe/Kr selectivity, finally breaking the inherent trade-off between Xe uptake and Xe/Kr selectivity. The actual Xe-Kr separation capability was further confirmed by breakthrough experiments. This work highlights a fundamental structural design of two-dimensional COFs for size-based gas separation.",pubmed,0
Rigid Flexible Pillaring via Synergistic Co‐Doping Stabilizes High‐Capacity Sodium Layered Oxide Cathode,https://advanced.onlinelibrary.wiley.com/doi/10.1002/adma.73078?af=R,Wiley: Advanced Materials: Table of Contents,2026-04-30 12:58:02 UTC,2026-04-30 12:58:02+00:00,10.1002/adma.73078,Jun Liu,"at 4.2 V, retains 80% after 500 cycles at 5C. Furthermore, the cathode is scalable to kilogram batches. With excellent coin and Ah-scale pouch-cell performance, it shows guidance of design and commercial promise for high-voltage O3-type cathodes.",openalex,0
Rational Design of Rhodanine‐Based Hole‐Selective Layers for Optimizing Interfacial Passivation in High‐Performance Wide‐Bandgap Perovskite Solar Cells,https://advanced.onlinelibrary.wiley.com/doi/10.1002/adma.202523276?af=R,Wiley: Advanced Materials: Table of Contents,2026-04-30 13:01:42 UTC,2026-04-30 13:01:42+00:00,10.1002/adma.202523276,Beata Łuszczyńska,"Wide-bandgap (WBG) perovskite solar cells (PSCs) are promising candidates for indoor photovoltaics (IPVs), but their efficiency is limited by non-radiative recombination at the buried perovskite/transport layer interface. To reduce these losses, this study proposes using self-assembled monolayers (SAMs) combining a triphenylamine (TPA) donor with rhodanine (RH) or rhodanine-3-acetic acid (RA) anchoring groups, as effective hole-selective layers (HSLs). Using NiOx/SAM double HSLs, we found that the heteroatom-rich RA group with a carboxymethyl co-anchor enhances NiOx surface oxidation and provides strong interfacial passivation. DFT calculations, electrochemical analysis, and characterization via XPS, UPS, PL, and SEM were used to elucidate the HSL-perovskite interface relationship. Structural studies revealed that the molecular spacer influences perovskite growth. Sterically hindered TPA-AN-RA yields smaller grains with more defects, while planar TPA-PH-RA enables larger grains and fewer traps. The optimized TPA-RA structure ensures balanced energetics and improved charge extraction, delivering an impressive indoor iPCE of 41.81% under a 1000 lux white LED. Under AM 1.5G conditions, it achieves 18.68% PCE, making it suitable for hybrid lighting environments. Furthermore, the unencapsulated TPA-RA device retained 84% of its indoor efficiency after 1600 h in an inert atmosphere, demonstrating excellent intrinsic stability. This work highlights the potential of molecular engineering for producing high-efficiency stable indoor PSCs.",openalex,0
[ASAP] Optimized Scheduling for CO2 Electrolyzers Coupled with Solar Generation,http://dx.doi.org/10.1021/acsenergylett.6c00146,ACS Energy Letters: Latest Articles (ACS Publications),2026-04-30 13:12:37 UTC,2026-04-30 13:12:37+00:00,10.1021/acsenergylett.6c00146,Joaquin Resasco,,,0
[ASAP] Time-Resolved Resonant Inelastic X-ray Scattering Reveals How Orbital Symmetry Alignment Enables C–H Activation,http://dx.doi.org/10.1021/jacs.6c05747,Journal of the American Chemical Society: Latest Articles (ACS Publications),2026-04-30 15:13:59 UTC,2026-04-30 15:13:59+00:00,10.1021/jacs.6c05747,Philippe Wernet,"Photochemical C-H activation reactions mediated by transition metal complexes often proceed via the formation of σ-complexes. In these intermediates, the metal center coordinates to a C-H σ-bond, and metal-ligand donation and back-donation interactions ultimately lead to C-H bond cleavage. Because metal-alkane σ-complexes are weakly bond and short-lived, current experimental methods provide limited access to the transient electronic-structure effects that control their reactivity. Here, we photochemically prepared three different types of Rh-alkane σ-complexes in solution and demonstrate how optical pump and X-ray probe spectroscopy gives access to their decisive valence-electron interactions. With femtosecond-resolution and Rh specific X-ray absorption spectroscopy (XAS) and resonant inelastic X-ray scattering (RIXS) at the Rh L3-edge we access the orbital interactions between the Rh centers, the ancillary ligands and the alkane C-H σ-bonds of the Rh-alkane σ-complexes. Supported by theoretical calculations, we identify spectral fingerprints of Rh-alkane donation and back-donation interactions and find trends for the reactivity of the σ-complexes toward C-H activation. We uncover the particular importance of specific occupied molecular orbitals with specific symmetry in modulating reactivity by providing, channeling and directing electron density via the metal to and from the C-H bond. Elucidating the electronic factors that facilitate C-H bond activation provides a basis for future ligand substitutions aimed at enhancing the reactivity of metal-alkane σ-complexes with enhanced efficiency of the activation step.",pubmed,0
[ASAP] Mechanochemical Synthesis and Fluorescence Reporting of Conjugated Polymers through Flex-Activation,http://dx.doi.org/10.1021/jacs.6c02514,Journal of the American Chemical Society: Latest Articles (ACS Publications),2026-04-30 15:13:59 UTC,2026-04-30 15:13:59+00:00,10.1021/jacs.6c02514,Zhengbiao Zhang,"Polymer mechanochemistry enables the transduction of mechanical force into chemical signals, providing a versatile approach for the design of adaptive and functional materials. Of particular interest is the mechanochemical generation of conjugated polymers, which holds significant promise for applications in electronics and sensing. However, progress in this area has been hindered by low activation yields and difficult quantification in bulk materials. Herein, we report a flex-activated mechanophore based on benzotricyclodecatriene (BTCD), which undergoes a retro-Diels-Alder reaction via a bond-bending mechanism. Upon ball milling, poly(BTCD) achieves efficient activation, simultaneously releasing the fluorescent reporter 1,4-bis(hexyloxy)naphthalene (BHN) for straightforward quantification and generating semiconducting polyacetylene. The reaction kinetics and activation efficiency show clear dependencies on the milling time and polymer molecular weight. The same flex-activation pathway can be triggered under uniaxial compression, enabling iterative activation in cross-linked networks without macroscopic fracture. By integration of built-in fluorescence reporting with mechanochromic response, this system establishes a multifunctional platform for mechanoresponsive materials. Our work provides a scalable and quantitative strategy to mechanochemically generate functional polyenes directly in bulk polymers, significantly expanding the scope of flex-activated mechanophores.",pubmed,0
[ASAP] Scalable Buried Passivation of Wide-Bandgap Perovskite Solar Cells,http://dx.doi.org/10.1021/acsenergylett.6c00439,ACS Energy Letters: Latest Articles (ACS Publications),2026-04-30 15:52:33 UTC,2026-04-30 15:52:33+00:00,10.1021/acsenergylett.6c00439,John Devin MacKenzie,,,0
[ASAP] Structured Electrodes Induce Local pH as a Primary Determinant of CO2 Reduction Selectivity,http://dx.doi.org/10.1021/jacs.5c22508,Journal of the American Chemical Society: Latest Articles (ACS Publications),2026-04-30 16:02:13 UTC,2026-04-30 16:02:13+00:00,10.1021/jacs.5c22508,Daniel G. Nocera,"Highly structured electrodes permit high operating currents to be achieved as well as enhanced selectivity, especially for the carbon dioxide reduction (CDR) reaction. An understanding of the origins of CDR selectivity is complicated by the intricate internal structure of high surface area electrodes, which may modify the microenvironment in which catalysis occurs. We report here enhanced faradaic efficiency of the reduction of CO2 to CO (FE(CO)) on photolithographically fabricated Au microwire (MW) electrodes as compared with their planar counterpart. We demonstrate that this selectivity arises from the local pH gradient at the electrode-solution interface, as a result of the electrode microstructure. By employing confocal microscopy with a ratiometric pH sensor, we can construct in situ maps of the local pH at the electrode-solution interface. When normalized for local pH, the same dependence of FE(CO) is observed for the fabricated MW and planar electrodes, and the selectivity is a direct result of the HCO3-/CO32- equilibrium.",pubmed,0
