title,link,source,published_str,pub_date,doi,last_author,abstract,abstract_source,must_have_abstract
Multiple human transgenes prolong survival of triple-carbohydrate knockout porcine kidney xenografts in nonhuman primates,https://www.nature.com/articles/s41467-026-74933-w,Nature Communications,2026-06-27 00:00:00 UTC,2026-06-27 00:00:00+00:00,10.1038/s41467-026-74933-w,Tatsuo Kawai,"Genetically modified pigs are being developed to address the critical shortage of human organs for transplantation. Although porcine xenografts lacking the three major carbohydrate xenoantigens (3KO) have been considered ideal for human transplantation, the optimal combination of human transgenes (HTGs) to mitigate protein incompatibility remains undefined. In the current study, we evaluate immune responses and transplant outcomes of 3KO kidney xenografts with four different combinations of HTGs in a nonhuman primate model. Here, we show that the addition of HTGs significantly reduces transcripts associated with early immune activation, resulting in markedly prolonged survival of 3KO xenografts. Notably, the inclusion of the anti-inflammatory genes TNFAIP3 and HMOX1 is associated with improved graft survival, significantly reduced T-cell and CD11b⁺ myeloid cell infiltration, and lower expression of rejection-related gene sets in protocol xenograft biopsies.",nature_html,0
Hyperbranched dielectric polymer networks exhibiting giant energy storage density at 250 °C,https://www.nature.com/articles/s41467-026-74830-2,Nature Communications,2026-06-27 00:00:00 UTC,2026-06-27 00:00:00+00:00,10.1038/s41467-026-74830-2,Qi Li,"Harsh-environment requirements of electrical and electronic systems demand advanced dielectrics with high energy storage density at elevated temperatures. Heat-resistant polymers are usually designed with densely packed molecular chains to maintain structural integrity. Unfortunately, the narrowed inter-chain spacing causes severe charge transfer under high electro-thermal fields, prohibiting capacitive energy storage beyond 200 °C. Here we report hyperbranched dielectric polymer networks as a solution to the persistent challenge. The hyperbranched topological junctions not only transform the linear polymer chains into a robust network to tolerate thermal stress, but also expand the inter-chain spacing to inhibit charge transfer. Results suggest that the hyperbranched networks exhibit suppressed secondary chain relaxation alongside expanded free volume. Moreover, the customizable chemical structure of hyperbranched centers renders this method general to capacitive polymer design. The hyperbranched polymer networks exhibit an exceptionally high discharged energy density of 4.9 J/cm3 above 90% efficiency at 250 °C, surpassing the existing polymeric dielectrics.",nature_html,0
Enhancing molecular property prediction of transformer models with dual graph representation,https://www.nature.com/articles/s41467-026-75005-9,Nature Communications,2026-06-27 00:00:00 UTC,2026-06-27 00:00:00+00:00,10.1038/s41467-026-75005-9,Alexei A. Lapkin,"Accurate prediction of molecular properties is central to advancing chemistry, materials science, and drug discovery. Machine learning on molecular graphs depends critically on representations that capture the topology and structure of molecules. Here we propose the dual graph transformer (DGT), a self-attention architecture that jointly models atom and bond graphs to achieve comprehensive molecular encodings. DGT fuses atom and bond features, graph topology and structure, and stereogeometric information within its self-attention module for an effective molecular representation. We benchmark DGT across a range of datasets for molecular property prediction, showing that it considerably outperforms the current state of the art. DGT demonstrates performance contributions from its dual graph representation, relative positional and structural encodings, and stereogeometric information incorporation while also offering interpretability at the molecular structural level. We envision DGT advancing molecular machine learning by improving both the prediction accuracy and interpretability of molecular properties.",nature_html,0
Prediction error correlates in the striosome-dopamine circuit emerge from information gain,https://www.nature.com/articles/s41467-026-73994-1,Nature Communications,2026-06-27 00:00:00 UTC,2026-06-27 00:00:00+00:00,10.1038/s41467-026-73994-1,Alexander Friedman,"The striosome compartments in the striatum gate cortical inputs to dopamine neurons, which then feed back to the striosomes and surrounding matrix. This loop underlies decision-making, learning, and movement. Dopamine signals strongly correlate with reward prediction errors (RPEs) in certain tasks. However, many dopaminergic responses, such as to high costs, novelty, aversive stimuli, and real-time movement guidance, do not align with RPE. Separately, information theory explains how dopamine responds to uncertainty and encodes when rewards are expected to occur. Here, we show that apparent RPE correlations arise mathematically from the information gain of the policy of actions (policy-IG). Policy-IG quantifies how much newly arriving information changes choice. In simple reward tasks, policy-IG reduces to classic RPEs, but it also predicts dopamine responses to aversive events, nonlinear reward scaling, novelty, movement, state valuation, and moment-by-moment decision control. Thus, RPE could be a special case of this more general function. We show that policy-IG is mathematically related to a range of information-centric, Bayesian, active inference, and casual association models, allowing those models to formally incorporate the experimental RPE literature in their support. Simulating impaired policy-IG replicates basal ganglia disorder features, suggesting policy-IG as a target for therapies.",nature_html,0
Highly robust molecular information carriers for traceability of plastic materials,https://www.nature.com/articles/s41467-026-73889-1,Nature Communications,2026-06-27 00:00:00 UTC,2026-06-27 00:00:00+00:00,10.1038/s41467-026-73889-1,Filip E. Du Prez,"Sequence-defined oligomers offer programmable molecular architectures with potential in data storage, authentication, and anticounterfeiting. However, their deployment in real-world materials has been constrained by their low scale, limited thermal resilience and the need for specialized analytical methods. Here we introduce a molecular tagging strategy based on abiotic sequence-defined oligoamides incorporated at ultralow concentrations (",nature_html,0
NAD+ modulates mitochondrial vulnerability in MERTK-associated models of retinitis pigmentosa,https://www.nature.com/articles/s41467-026-74400-6,Nature Communications,2026-06-27 00:00:00 UTC,2026-06-27 00:00:00+00:00,10.1038/s41467-026-74400-6,Shaochong Zhang,"Retinitis pigmentosa (RP) is the most common inherited retinal degenerative disease leading to blindness. RP is characterized by progressive loss of photoreceptors and retinal pigment epithelium (RPE), leading to retinal degeneration. The mechanisms that initiate RP and drive retinal vulnerability are poorly understood, and new strategies for preventing and treating RP are urgently needed. Although mitochondrial dysfunction initiates many neurodegenerative diseases, the contribution of mitochondrial dysfunction to RP is unclear. Single-cell RNA sequencing, transmission electron microscopy, and enzyme-linked immunosorbent assays revealed that photoreceptor and RPE cells have abnormal mitochondria in rats with RP. Nicotinamide adenine dinucleotide (NAD+) metabolism decreased in rats with RP, increasing the vulnerability to disease-related insults. Similar experimental results were observed in a Mer tyrosine kinase receptor (MERTK)-associated RP primary human RPE cell model. Electroretinography, immunofluorescence, and fundus photography revealed that oral administration of the NAD+ precursor nicotinamide mononucleotide (NMN) protected rats with RP from retinal degeneration. Single-cell RNA sequencing, siRNA targeting, and Adeno-associated virus applications demonstrated that NMN elicits therapeutic effects via the glyceraldehyde-phosphate dehydrogenase-mitochondria pathway. These results indicate that mitochondrial abnormalities may be drivers of RP, and NMN elicits therapeutic effects on RP.",nature_html,0
Ecological multifunctionality of watersheds increases with tree species richness,https://www.nature.com/articles/s41467-026-74914-z,Nature Communications,2026-06-27 00:00:00 UTC,2026-06-27 00:00:00+00:00,10.1038/s41467-026-74914-z,Kerong Zhang,"Watersheds are natural units and meta-ecosystems of the earth’s land surface providing multiple ecological functions. However, little is known about the biodiversity-ecological multifunctionality relationships of watersheds, particularly regarding how these relationships scale to large and complex landscapes. Here, we explore the impact of forest tree species richness on the ecological multifunctionality of watersheds in terms of carbon sequestration, carbon storage, water supply, water regulation, and soil conservation, by utilizing integrated ground-sourced forest inventory datasets comprising 846 forest watersheds from the Global Forest Biodiversity Initiative, the Global Streamflow Indices and Metadata Archive, and remote sensing data products. We find a consistently positive relationship between forest tree species richness and watershed ecological multifunctionality by accounting for factors such as forest structural characteristics and environmental conditions. Furthermore, we find that this biodiversity-multifunctionality link is dependent on spatial scale and climatic context, becoming stronger in larger watersheds but diminishing in arid climatic conditions. These insights enhance our understanding of ecosystem multifunctionality and underscore the importance of considering watershed-scale ecological processes and biodiversity in ecosystem management and conservation strategies.",nature_html,0
Electrocatalytic galvanic cells: A paradigm toward spontaneous chemicals synthesis and electricity generation,https://academic.oup.com/nsr/advance-article/doi/10.1093/nsr/nwag396/8719657?rss=1,National Science Review Advance Access,2026-06-27 00:00:00 UTC,2026-06-27 00:00:00+00:00,10.1093/nsr/nwag396,Zhong-Shuai Wu,Electrocatalytic galvanic cells redefine electrochemical energy conversion by enabling the spontaneous co-production of chemicals and electricity from renewable and waste feedstocks.,crossref,0
In‐situ p‐Doping of Nanometer Tellurium‐based Oxide for Room‐Temperature CMOS Circuits (Adv. Mater. 36/2026),https://advanced.onlinelibrary.wiley.com/doi/10.1002/adma.73719?af=R,Wiley: Advanced Materials: Table of Contents,2026-06-27 14:55:55 UTC,2026-06-27 14:55:55+00:00,10.1002/adma.73719,Ao Liu,"Room-Temperature CMOS Circuits A room-temperature in-situ redox strategy enables intrinsic p-doping of nanometer tellurium-based oxide films by creating tunable Te conductive channels within an oxide matrix. The resulting p-type transistors exhibit high mobility and broadly tunable carrier density, and can be monolithically integrated with n-type oxide devices to realize fully room-temperature all-oxide CMOS circuits. More details can be found in the Research Article by Ao Liu, Mingyang Wang, Huihui Zhu, Yong-Young Noh, and co-workers (DOI: 10.1002/adma.72813).",openalex,0
Intelligent Acousto‐Electrical Metamaterials (IAM) for Sound Source Detection (Adv. Mater. 36/2026),https://advanced.onlinelibrary.wiley.com/doi/10.1002/adma.73717?af=R,Wiley: Advanced Materials: Table of Contents,2026-06-27 14:55:55 UTC,2026-06-27 14:55:55+00:00,10.1002/adma.73717,Xiaoyu (Rayne) Zheng,"Intelligent Acousto-Electrical Metamaterials This cover illustrates an architected piezoelectric hydrophone composed of distinct 3D micro-architectures. Unlike traditional crystals, these Intelligent Acousto-Electrical Metamaterials dynamically program piezoelectricity through geometry rather than chemistry. This structural variety yields unique electromechanical responses, enabling a single device to perform real-time, automatic sound localization of diverse underwater targets, such as marine wildlife and submerged vehicles, thereby advancing next-generation acoustic sensing. More details can be found in the Research Article by Xiaoyu (Rayne) Zheng, Victor Couëdel, and co-workers (DOI: 10.1002/adma.202513205).",openalex,0
The Resolution–Throughput Conflict In Material Extrusion Additive Manufacturing (Adv. Mater. 36/2026),https://advanced.onlinelibrary.wiley.com/doi/10.1002/adma.73718?af=R,Wiley: Advanced Materials: Table of Contents,2026-06-27 14:55:55 UTC,2026-06-27 14:55:55+00:00,10.1002/adma.73718,Jochen Mueller,"From Microscale Architected Features to Large Structural Prints This frontispiece captures the fundamental resolution–throughput tradeoff in material extrusion additive manufacturing. The flowing multiscale paths represent the interplay of material behavior, transport, and print architecture, emphasizing emerging system-level approaches that could decouple precision and speed to enable robust manufacturing across diverse materials and scales. More details can be found in the Research Article by Jochen Mueller (DOI: 10.1002/adma.73039).",openalex,0
Large‐Area 2D Metasurface‐Based Triboelectric E‐Skin Arrays: Contact & Proximity Tactile Mapping with Broadband Acoustic Readouts (Adv. Mater. 36/2026),https://advanced.onlinelibrary.wiley.com/doi/10.1002/adma.73715?af=R,Wiley: Advanced Materials: Table of Contents,2026-06-27 14:55:55 UTC,2026-06-27 14:55:55+00:00,10.1002/adma.73715,Amit Das,"Large-Area 2D Metasurface-Based Triboelectric E-Skin Arrays An engineered triboelectric metasurface enables multimodal sensing of tactile pressure, inductive non-contact stimuli, and broadband acoustic waves. By integrating microstructured active pixels into a conformable electronic skin, the dielectric metasurface achieves spatially resolved transduction of mechanical and field-mediated inputs for advanced human-machine interfaces. More details can be found in the Research Article by Injamamul Arief and co-workers (DOI: 10.1002/adma.202521525).",openalex,0
Digital Microneedles for Multiplexed Transdermal Sensing via Fluorescent QR Codes (Adv. Mater. 36/2026),https://advanced.onlinelibrary.wiley.com/doi/10.1002/adma.73716?af=R,Wiley: Advanced Materials: Table of Contents,2026-06-27 14:55:55 UTC,2026-06-27 14:55:55+00:00,10.1002/adma.73716,Giuseppe Barillaro,"Digital Microneedles for Multiplexed Transdermal Sensing Digital microneedles convert biochemical signals in skin into binary fluorescent outputs that assemble into scannable QR codes. By transforming analog chemistry into on-off fluorescence states, digital microneedles enables calibration-free, multiplexed transdermal biosensing and establishes a digital paradigm for decentralized health monitoring. More details can be found in the Research Article by Giuseppe Barillaro and co-workers (DOI: 10.1002/adma.202518935).",openalex,0
Dynamic degradation mechanisms of PEM water electrolysis membrane electrode assembly under multiple operating conditions,https://www.sciencedirect.com/science/article/pii/S0306261926008755?dgcid=rss_sd_all,ScienceDirect Publication: Applied Energy,2026-06-28 00:00:00 UTC,2026-06-28 00:00:00+00:00,,Depeng Kong,,,0
Collateral impact: U.S.-China tensions and energy transition in third countries,https://www.sciencedirect.com/science/article/pii/S0301421526003605?dgcid=rss_sd_all,ScienceDirect Publication: Energy Policy,2026-06-28 00:00:00 UTC,2026-06-28 00:00:00+00:00,,Qianying Chen,,,0
Financial inclusion and access to clean cooking fuels and technologies under uncertainty in emerging and developing countries,https://www.sciencedirect.com/science/article/pii/S0301421526003824?dgcid=rss_sd_all,ScienceDirect Publication: Energy Policy,2026-06-28 00:00:00 UTC,2026-06-28 00:00:00+00:00,,Haithem Awijen,,,0
How do green certificate and carbon emission trading impact clean energy investment? Evidence from evolutionary game modeling,https://www.sciencedirect.com/science/article/pii/S0301421526003691?dgcid=rss_sd_all,ScienceDirect Publication: Energy Policy,2026-06-28 00:00:00 UTC,2026-06-28 00:00:00+00:00,,Lei Cheng,,,0
Alleviating energy poverty through grid modernization: Micro-evidence from China's ultra-high-voltage transmission projects,https://www.sciencedirect.com/science/article/pii/S030142152600385X?dgcid=rss_sd_all,ScienceDirect Publication: Energy Policy,2026-06-28 00:00:00 UTC,2026-06-28 00:00:00+00:00,,Xin Zhao,,,0
"How geopolitical risks, green finance, and environmental technologies dynamics shape energy trilemma in BRICS economies?",https://www.sciencedirect.com/science/article/pii/S0301421526003873?dgcid=rss_sd_all,ScienceDirect Publication: Energy Policy,2026-06-28 00:00:00 UTC,2026-06-28 00:00:00+00:00,,Daniel Balsalobre-Lorente,,,0
Adaptive risk-difference-based network pricing for shared energy storage in distribution networks,https://www.sciencedirect.com/science/article/pii/S0306261926009153?dgcid=rss_sd_all,ScienceDirect Publication: Applied Energy,2026-06-28 00:00:00 UTC,2026-06-28 00:00:00+00:00,,Siyu Ma,,,0
Digital twin-driven deep reinforcement learning for coordinated scheduling and state prediction of distributed energy storage clusters,https://www.sciencedirect.com/science/article/pii/S0306261926009049?dgcid=rss_sd_all,ScienceDirect Publication: Applied Energy,2026-06-28 00:00:00 UTC,2026-06-28 00:00:00+00:00,,Li Zhou,,,0
A stochastic simulation framework for EV charging station dynamic pricing with leader-driven dream optimization algorithm,https://www.sciencedirect.com/science/article/pii/S0306261926008998?dgcid=rss_sd_all,ScienceDirect Publication: Applied Energy,2026-06-28 00:00:00 UTC,2026-06-28 00:00:00+00:00,,YuanBin Mo,,,0
Physics-informed neural networks for wind turbine wake prediction: Constraint hierarchy under varying data density,https://www.sciencedirect.com/science/article/pii/S0306261926008901?dgcid=rss_sd_all,ScienceDirect Publication: Applied Energy,2026-06-28 00:00:00 UTC,2026-06-28 00:00:00+00:00,,Yong Jiang,,,0
Integrated multiscale modeling and coordinated balance-of-plant optimization to maximize vehicle system efficiency in a heavy-duty fuel cell electric vehicle,https://www.sciencedirect.com/science/article/pii/S0306261926009128?dgcid=rss_sd_all,ScienceDirect Publication: Applied Energy,2026-06-28 00:00:00 UTC,2026-06-28 00:00:00+00:00,,Kyoungdoug Min,,,0
Steady-state dynamics of an offshore hybrid wind-wave energy conversion system,https://www.sciencedirect.com/science/article/pii/S0306261926008810?dgcid=rss_sd_all,ScienceDirect Publication: Applied Energy,2026-06-28 00:00:00 UTC,2026-06-28 00:00:00+00:00,,Feifei Cao,,,0
Wild tomato genome assemblies reveal structural variants and repeat content act as recombination barriers,https://www.nature.com/articles/s41467-026-74784-5,Nature Communications,2026-06-28 00:00:00 UTC,2026-06-28 00:00:00+00:00,10.1038/s41467-026-74784-5,Charles J. Underwood,"Crop wild relatives are used to improve cultivated plants and precise tracking of genetic introgression requires high-quality genome assemblies. Here we present de novo genome assemblies of two wild tomato species — the broadly stress-resistant Solanum pennellii (LA0716) and the salt-resistant Solanum cheesmaniae (LA1039). The improved S. pennellii genome adds 146 Mbp to the twelve chromosomes compared with the original reference. The alignment of the new assemblies with multiple gold-standard assemblies identified shared and species-specific structural variants. Analysis of repeat content demonstrates independent explosions of Tekay retrotransposons in S. pennellii and S. peruvianum. Genome sequencing of 709 recombinant plants derived from male and female backcrosses of three different hybrids reveals higher crossover rate in female meiosis. Conserved female-enhanced recombination regions were discovered and coldspots were attributed to megabase-scale inversions and insertion-deletion polymorphisms. Our S. pennellii and S. cheesmaniae genome assemblies reveal how repeat content diverged in nature and during breeding, and uncovers how both reproductive gender and structural variants dictate recombination landscapes in tomato hybrids.",nature_html,0
Spectrally selective c-Si agrivoltaic modules: Evaluating a new approach,https://www.sciencedirect.com/science/article/pii/S0306261926009207?dgcid=rss_sd_all,ScienceDirect Publication: Applied Energy,2026-06-28 00:00:00 UTC,2026-06-28 00:00:00+00:00,,Timothy W. Schmidt,,,0
Dynamic responses of wind turbines under unwaked and waked conditions,https://www.sciencedirect.com/science/article/pii/S0306261926009098?dgcid=rss_sd_all,ScienceDirect Publication: Applied Energy,2026-06-28 00:00:00 UTC,2026-06-28 00:00:00+00:00,,Zheng Li,,,0
Enhancing current distribution estimation in parallel battery modules using neural network ensembles,https://www.sciencedirect.com/science/article/pii/S0306261926008962?dgcid=rss_sd_all,ScienceDirect Publication: Applied Energy,2026-06-28 00:00:00 UTC,2026-06-28 00:00:00+00:00,,Limei Wang,,,0
Spatiotemporal supply-demand matching in residential building rooftop photovoltaics (PV) under climate change: a cross-climate zone assessment,https://www.sciencedirect.com/science/article/pii/S0306261926008640?dgcid=rss_sd_all,ScienceDirect Publication: Applied Energy,2026-06-28 00:00:00 UTC,2026-06-28 00:00:00+00:00,,Jian Zuo,,,0
Reconciling fiscal resilience with low-carbon energy goals: Sri Lanka's carbon-aligned fuel pricing,https://www.sciencedirect.com/science/article/pii/S0301421526003927?dgcid=rss_sd_all,ScienceDirect Publication: Energy Policy,2026-06-28 00:00:00 UTC,2026-06-28 00:00:00+00:00,,HyeMin Park,,,0
Dynamic multi-objective operation optimization of dimethyl oxalate hydrogenation process under green hydrogen flow fluctuation,https://www.sciencedirect.com/science/article/pii/S030626192600749X?dgcid=rss_sd_all,ScienceDirect Publication: Applied Energy,2026-06-28 00:00:00 UTC,2026-06-28 00:00:00+00:00,,Jian Chu,,,0
A review of electrochemical process-driven recycling and regeneration technologies for lithium-ion batteries,https://www.sciencedirect.com/science/article/pii/S0306261926008263?dgcid=rss_sd_all,ScienceDirect Publication: Applied Energy,2026-06-28 00:00:00 UTC,2026-06-28 00:00:00+00:00,,Dean Pan,,,0
Energy modeling for a low-carbon future and global decarbonization,https://www.sciencedirect.com/science/article/pii/S0306261926008688?dgcid=rss_sd_all,ScienceDirect Publication: Applied Energy,2026-06-28 00:00:00 UTC,2026-06-28 00:00:00+00:00,,Muhammad Shahzad Zafar,,,0
Wind power forecasting with deep representation: A survey,https://www.sciencedirect.com/science/article/pii/S0306261926007580?dgcid=rss_sd_all,ScienceDirect Publication: Applied Energy,2026-06-28 00:00:00 UTC,2026-06-28 00:00:00+00:00,,Haibin Zhang,,,0
Deep learning-based health monitoring and prognostics for nuclear power plants: a systematic review,https://www.sciencedirect.com/science/article/pii/S0306261926009062?dgcid=rss_sd_all,ScienceDirect Publication: Applied Energy,2026-06-28 00:00:00 UTC,2026-06-28 00:00:00+00:00,,Xuefeng Chen,,,0
Prediction of high-frequency resistance for automotive PEMFC stacks using a Bayesian-optimized LSTM-XGBoost fusion model,https://www.sciencedirect.com/science/article/pii/S030626192600872X?dgcid=rss_sd_all,ScienceDirect Publication: Applied Energy,2026-06-28 00:00:00 UTC,2026-06-28 00:00:00+00:00,,Zixuan Cheng,,,0
Data-driven energy sharing in collective self-consumption communities: a medium-term predictive ensemble framework,https://www.sciencedirect.com/science/article/pii/S0306261926009256?dgcid=rss_sd_all,ScienceDirect Publication: Applied Energy,2026-06-28 00:00:00 UTC,2026-06-28 00:00:00+00:00,,Jose Miguel Riquelme-Dominguez,,,0
Inherent Microstructural Engineering: Tailoring Amorphous‐Nanocrystalline Composite Films via Ion Beam Technology for Long‐Cycle Lithium Metal Batteries,https://advanced.onlinelibrary.wiley.com/doi/10.1002/adma.73795?af=R,Wiley: Advanced Materials: Table of Contents,2026-06-28 05:34:59 UTC,2026-06-28 05:34:59+00:00,10.1002/adma.73795,Bin Liao,"ABSTRACT
                  Lithium metal anode faces formidable challenges from uncontrollable dendrite growth and unstable solid‐electrolyte interphase (SEI). Interface engineering of the current collectors (CCs) or lithium anodes presents a viable solution. We propose engineering the intrinsic microstructure of coatings to precisely construct interlayers that are both lithiophilic and possess rapid kinetics. A strategy using ion beam deposition (IBD) technology to craft ZnMgSn films with composite microstructures on commercial Cu CCs and lithium foils is reported. This artificial interphase not only exhibits a strongly lithium adsorption energy, but also significantly reduces the diffusion barrier for lithium atoms, thereby synergistically enabling uniform lithium plating. Crucially, this interphase promotes the in‐situ formation of a mechanically robust, bilayer SEI rich in LiF, which can effectively accommodate volume changes during cycling. As a result, the ZnMgSn@Cu CC symmetric cell achieves an ultralong lifespan of over 11000 h. The full cell shows a capacity retention of 85.13% after 130 cycles at 5C. The modified lithium anode maintains over 80% capacity after 620 cycles at 1C. This work not only provides an efficient modification strategy but also offers profound insights into the microscopic design principles for an ideal lithium metal interphase, paving the way for practical lithium metal batteries.",crossref,0
