title,link,source,published_str,pub_date,doi,last_author,abstract,abstract_source,must_have_abstract
[ASAP] Integrating Sulfate with Crown Ether To Construct Supramolecular Radium Traps in an Anionic Zirconium Metal–Organic Framework,http://dx.doi.org/10.1021/jacs.6c02736,Journal of the American Chemical Society: Latest Articles (ACS Publications),2026-03-11 19:38:40 UTC,2026-03-11 19:38:40+00:00,10.1021/jacs.6c02736,Chengliang Xiao,"Sequestration of radiotoxic 226Ra2+ is challenged by its complex coordination chemistry, which requires a precise molecular recognition strategy. Here, we report a supramolecular trap engineered within a stable zirconium metal-organic framework (ZJU-X102-SO4) by integrating a size-selective 24-crown-8 ether with a proximal sulfate anchor. The formation of this preorganized trap and its cooperative binding mechanism were elucidated by single-crystal X-ray diffraction, solid-state NMR, XAFS, and DFT calculations. This dual-recognition design was first validated with the Ba2+ surrogate, affording rapid kinetics (equilibrium in 30 s) and a high capacity (455 mg g-1). For the target 226Ra2+, ZJU-X102-SO4 could remove 70% of 226Ra2+ within 10 min (C0 = 10 Bq mL-1) and demonstrate a capacity of 3.3 × 104 Bq g-1. In high-salinity media, a salting-out effect was observed and ZJU-X102-SO4 showed a high distribution coefficient of 5.3 × 104 mL g-1. The sequestration of 226Ra2+ was also effective in 3 M HNO3. This work presents a molecular engineering strategy for designing sorbents for the targeted sequestration of specific cations from aqueous media.",pubmed,0
Understanding UK public preferences and attitudes to a decarbonized heating system,https://www.nature.com/articles/s41560-026-01978-y,Nature Energy,2026-03-12 00:00:00 UTC,2026-03-12 00:00:00+00:00,10.1038/s41560-026-01978-y,,,,0
Is there a role for liquid fuels in future low-carbon energy systems? – A continuous interaction between global energy systems modeling and local energy port cluster participation,https://www.sciencedirect.com/science/article/pii/S0306261926002928?dgcid=rss_sd_all,ScienceDirect Publication: Applied Energy,2026-03-12 00:00:00 UTC,2026-03-12 00:00:00+00:00,,Selma Brynolf,,,0
Motoring control of a free piston engine and linear electric machine,https://www.sciencedirect.com/science/article/pii/S0306261926003016?dgcid=rss_sd_all,ScienceDirect Publication: Applied Energy,2026-03-12 00:00:00 UTC,2026-03-12 00:00:00+00:00,,Guohong Tian,,,0
Study on the cycling performance of silicon-based cylindrical batteries via process-structure optimization strategy,https://www.sciencedirect.com/science/article/pii/S0306261926003405?dgcid=rss_sd_all,ScienceDirect Publication: Applied Energy,2026-03-12 00:00:00 UTC,2026-03-12 00:00:00+00:00,,Bin Yang,,,0
Hydrogen production from flare gas: a dual opportunity to turn emissions into energy - a prospective review,https://www.sciencedirect.com/science/article/pii/S0306261926002850?dgcid=rss_sd_all,ScienceDirect Publication: Applied Energy,2026-03-12 00:00:00 UTC,2026-03-12 00:00:00+00:00,,Achinta Bera,,,0
Modeling methods for chiller and heat pump systems in buildings: A systematic review in the context of digital twin applications,https://www.sciencedirect.com/science/article/pii/S0306261926002849?dgcid=rss_sd_all,ScienceDirect Publication: Applied Energy,2026-03-12 00:00:00 UTC,2026-03-12 00:00:00+00:00,,Seungjae Lee,,,0
Linking short-term electricity demand forecasting and explainable AI: A review for building energy applications,https://www.sciencedirect.com/science/article/pii/S0306261926003107?dgcid=rss_sd_all,ScienceDirect Publication: Applied Energy,2026-03-12 00:00:00 UTC,2026-03-12 00:00:00+00:00,,Zita Vale,,,0
Advances in MXene-Polymer Composites for Cutting-edge Supercapacitor and EMI Shielding Applications,https://www.sciencedirect.com/science/article/pii/S0306261926003119?dgcid=rss_sd_all,ScienceDirect Publication: Applied Energy,2026-03-12 00:00:00 UTC,2026-03-12 00:00:00+00:00,,Iftikhar Hussain,,,0
"The decline of fossil fuels and the search for viable alternatives: A critical review of biodiesel, electric, and biogas energy systems under global socio-political and technical constraints",https://www.sciencedirect.com/science/article/pii/S0306261926002990?dgcid=rss_sd_all,ScienceDirect Publication: Applied Energy,2026-03-12 00:00:00 UTC,2026-03-12 00:00:00+00:00,,Gadisa Sufe,,,0
Research progress on in-situ strategies for modulating the anode/electrolyte interface in zinc-ion batteries,https://www.sciencedirect.com/science/article/pii/S0306261926003417?dgcid=rss_sd_all,ScienceDirect Publication: Applied Energy,2026-03-12 00:00:00 UTC,2026-03-12 00:00:00+00:00,,Weigen Chen,,,0
Smart prosumers management based on multi-agent deep reinforcement learning to participate in decentralized peer-to-peer market,https://www.sciencedirect.com/science/article/pii/S0306261926003028?dgcid=rss_sd_all,ScienceDirect Publication: Applied Energy,2026-03-12 00:00:00 UTC,2026-03-12 00:00:00+00:00,,Behnam Mohammadi-Ivatloo,,,0
XA-Novo: high-throughput mass spectrometry-based de novo sequencing technology for monoclonal antibodies and antibody mixtures,https://www.nature.com/articles/s41467-026-70496-y,Nature Communications,2026-03-12 00:00:00 UTC,2026-03-12 00:00:00+00:00,10.1038/s41467-026-70496-y,Quan Yuan,"Elucidating antibody sequences by mass spectrometry-based de novo sequencing is essential but remains technically challenging. Here we present XA-Novo, an accurate and high-throughput de novo sequencing solution that integrates a single-pot multi-enzymatic gradient digestion method with a beam search-based assembler (Fusion) to reconstruct full-length antibody sequences directly from bottom-up mass spectrometry data. Benchmarking across well-characterized antibodies from multiple species demonstrates that XA-Novo outperforms commercial solutions in identification sensitivity, sequence completeness, and reconstruction accuracy. Furthermore, XA-Novo successfully reconstructs six immunotherapeutic antibodies with unknown sequences, and in vitro/vivo assays validate that these generated antibodies exhibit functionality equivalent to their commercial counterparts. Moreover, XA-Novo achieves over 99.54% accurate sequence coverage in distinguishing mixed COVID-19 neutralizing antibodies, exceeding the performance of current assemblers reported for single-antibody sequencing. Overall, XA-Novo establishes a reliable, scalable, and broadly applicable workflow for routine antibody sequencing, thereby accelerating both fundamental antibody research and therapeutic antibody development.",nature_html,0
Recent progress in bubble dynamics and detachment mechanisms of photocatalytic water splitting microreactors for H₂ production: a review,https://www.sciencedirect.com/science/article/pii/S0306261926003053?dgcid=rss_sd_all,ScienceDirect Publication: Applied Energy,2026-03-12 00:00:00 UTC,2026-03-12 00:00:00+00:00,,Liang Zhao,,,0
Retraction Note: NIR-light-mediated spatially selective triggering of anti-tumor immunity via upconversion nanoparticle-based immunodevices,https://www.nature.com/articles/s41467-026-70557-2,Nature Communications,2026-03-12 00:00:00 UTC,2026-03-12 00:00:00+00:00,10.1038/s41467-026-70557-2,Lele Li,,,0
Temporal resolution matters: Evaluating carbon emission factors for accurate accounting in commercial buildings,https://www.sciencedirect.com/science/article/pii/S0306261926003077?dgcid=rss_sd_all,ScienceDirect Publication: Applied Energy,2026-03-12 00:00:00 UTC,2026-03-12 00:00:00+00:00,,Stefano Schiavon,,,0
The multiple consequences of energy poverty: A global meta-analysis,https://www.sciencedirect.com/science/article/pii/S0301421526001679?dgcid=rss_sd_all,ScienceDirect Publication: Energy Policy,2026-03-12 00:00:00 UTC,2026-03-12 00:00:00+00:00,,Chu Wei,,,0
Improving renewable energy forecasting with FuXi-Energy,https://www.sciencedirect.com/science/article/pii/S0306261926003090?dgcid=rss_sd_all,ScienceDirect Publication: Applied Energy,2026-03-12 00:00:00 UTC,2026-03-12 00:00:00+00:00,,Libo Wu,,,0
"Collaborative governance of carbon mitigation, energy transition, and material management: A factorial non-deterministic carbon-energy-metal nexus optimization model",https://www.sciencedirect.com/science/article/pii/S0306261926003004?dgcid=rss_sd_all,ScienceDirect Publication: Applied Energy,2026-03-12 00:00:00 UTC,2026-03-12 00:00:00+00:00,,Nan Wang,,,0
Nonreciprocal radiative cooling of vertical surface and adjacent ground,https://www.cell.com/joule/fulltext/S2542-4351(26)00032-2?rss=yes,Joule,2026-03-12 00:00:00 UTC,2026-03-12 00:00:00+00:00,10.1016/j.joule.2026.102348,Wei Li,"Liu et al. introduce nonreciprocal thermal photonics to many-body systems, enabling simultaneous vertical surface cooling and ground-level heat mitigation. By decoupling radiative pathways, the study demonstrates path-selective and independent heat flow control, setting the foundation for advanced thermal management in complex, realistic urban environments.",rss_cell,0
Robust Koopman EMPC for optimal frequency regulation of VSC-MTDC systems,https://www.sciencedirect.com/science/article/pii/S0306261926002916?dgcid=rss_sd_all,ScienceDirect Publication: Applied Energy,2026-03-12 00:00:00 UTC,2026-03-12 00:00:00+00:00,,Hongming Yang,,,0
Operational decision of wind–photovoltaic–energy storage integrated system in day-ahead and ancillary service joint market considering weather variability,https://www.sciencedirect.com/science/article/pii/S0306261926002680?dgcid=rss_sd_all,ScienceDirect Publication: Applied Energy,2026-03-12 00:00:00 UTC,2026-03-12 00:00:00+00:00,,Jiaying Wang,,,0
Privacy-preserving transfer learning framework for building energy forecasting with fully anonymized data,https://www.sciencedirect.com/science/article/pii/S0306261926002527?dgcid=rss_sd_all,ScienceDirect Publication: Applied Energy,2026-03-12 00:00:00 UTC,2026-03-12 00:00:00+00:00,,Ruchi Choudhary,,,0
Shaping the buildings energy act: Stakeholder influence and the role of hydrogen in the German heating transition,https://www.sciencedirect.com/science/article/pii/S0301421526001333?dgcid=rss_sd_all,ScienceDirect Publication: Energy Policy,2026-03-12 00:00:00 UTC,2026-03-12 00:00:00+00:00,,Jonna Sophie Schmude,,,0
Mixture-of-experts based multi-critic deep reinforcement learning for sustainable management of data center microgrids,https://www.sciencedirect.com/science/article/pii/S0306261926002138?dgcid=rss_sd_all,ScienceDirect Publication: Applied Energy,2026-03-12 00:00:00 UTC,2026-03-12 00:00:00+00:00,,Dawei Qiu,,,0
System-level insights into flow-pressure-saturation coupling for safe and efficient methane hydrate production,https://www.sciencedirect.com/science/article/pii/S0306261926002758?dgcid=rss_sd_all,ScienceDirect Publication: Applied Energy,2026-03-12 00:00:00 UTC,2026-03-12 00:00:00+00:00,,Mingjun Yang,,,0
Blockchain-integrated software defined decentralized peer-to-peer energy trading network for sustainable smart power grid,https://www.sciencedirect.com/science/article/pii/S0306261926002217?dgcid=rss_sd_all,ScienceDirect Publication: Applied Energy,2026-03-12 00:00:00 UTC,2026-03-12 00:00:00+00:00,,Ghulam Muhammad,,,0
Hybrid solar-driven interfacial evaporation systems for water-energy nexus: recent advances in freshwater and energy sustainability,https://www.sciencedirect.com/science/article/pii/S0306261926001686?dgcid=rss_sd_all,ScienceDirect Publication: Applied Energy,2026-03-12 00:00:00 UTC,2026-03-12 00:00:00+00:00,,Zhien Zhang,,,0
Urban development and the energy transition: Evidence from Chinese cities,https://www.sciencedirect.com/science/article/pii/S0301421526001643?dgcid=rss_sd_all,ScienceDirect Publication: Energy Policy,2026-03-12 00:00:00 UTC,2026-03-12 00:00:00+00:00,,Shuping Wu,,,0
Can data infrastructure construction alleviate clean energy misallocation?—An analysis based on China's provincial data,https://www.sciencedirect.com/science/article/pii/S0301421526001813?dgcid=rss_sd_all,ScienceDirect Publication: Energy Policy,2026-03-12 00:00:00 UTC,2026-03-12 00:00:00+00:00,,Wei Zhang,,,0
How do Indian states fare in electricity decarbonization? A consumption-based decomposition analysis at subnational level,https://www.sciencedirect.com/science/article/pii/S0301421526001473?dgcid=rss_sd_all,ScienceDirect Publication: Energy Policy,2026-03-12 00:00:00 UTC,2026-03-12 00:00:00+00:00,,Mousami Prasad,,,0
Mexico’s energy crossroads: Navigating a complex transition,https://www.sciencedirect.com/science/article/pii/S0301421526001588?dgcid=rss_sd_all,ScienceDirect Publication: Energy Policy,2026-03-12 00:00:00 UTC,2026-03-12 00:00:00+00:00,,Hector H. Sandoval,,,0
Geopolitical fragmentation and the clean energy transition: How economic sanctions hinder renewable energy development,https://www.sciencedirect.com/science/article/pii/S0301421526001667?dgcid=rss_sd_all,ScienceDirect Publication: Energy Policy,2026-03-12 00:00:00 UTC,2026-03-12 00:00:00+00:00,,Leishuo Hu,,,0
Toward scalable electrochemical CO2 capture from air and oceanwater: a unified techno-economic framework and design guidelines,https://www.sciencedirect.com/science/article/pii/S0306261926003065?dgcid=rss_sd_all,ScienceDirect Publication: Applied Energy,2026-03-12 00:00:00 UTC,2026-03-12 00:00:00+00:00,,Meng Lin,,,0
Synergistic Steric-Dipole Modulation via Stepwise Trifluoromethyl Substitution Enables Active-Layer Hierarchical Assembly and >20% Power Conversion Efficiency in Organic Photovoltaic Devices,http://pubs.rsc.org/en/Content/ArticleLanding/2026/EE/D5EE07321A,RSC - Energy Environ. Sci. latest articles,2026-03-12 00:00:00 UTC,2026-03-12 00:00:00+00:00,,Yongsheng Chen,"Rational molecular design can effectively optimize the fineness of phase separation and vertical phase gradients of organic solar cells (OSCs), thereby boosting exciton dissociation kinetics and device efficiency. The ""C δ⁺ -F δ⁻ "" polarity of -CF3 promotes diverse noncovalent interactions, providing a key driving force for ordered assembly of active layer morphology. Herein, three acceptors (named CHE-nF n = 3, 6, 9) were synthesized by stepwise -CF3 functionalization of CHE-Me, progressively enhancing steric and molecular dipole effects, while continuously reducing surface energy. Research indicates that increased steric hindrance suppresses acceptor over-aggregation, thereby optimizing domain size. Enhanced dipoles strengthen donor/acceptor (D/A) interactions, shorten π-π stacking distances, accelerate exciton dissociation, and mitigate trapassisted recombination; while minimized surface energy induces vertical phase gradients that facilitate charge transport.The steric-dipole-surface energy synergistic regulation strategy yielded an optimized morphology, delivering a power conversion efficiency (PCE) of 19.32% (fill factor (FF) of 82.06%) for the CHE-9F device, 20.30% for the ternary device, and 16.69% for the module. This work establishes a molecular steric-dipole regulation strategy for the precise control of phase separation and vertical composition gradients in photoactive layers, providing an effective pathway for high-performance OSCs.",rsc_html,0
Hybrid Pickering emulsifiers (HYPIEs) via synergistic water/oil interfacial interactions: enhanced properties and applications,https://academic.oup.com/nsr/advance-article/doi/10.1093/nsr/nwag149/8516484?rss=1,National Science Review Advance Access,2026-03-12 00:00:00 UTC,2026-03-12 00:00:00+00:00,10.1093/nsr/nwag149,Véronique Nardello-Rataj,"Emulsions stabilized by surface-active solid particles, known as Pickering emulsions, offer advantages over conventional emulsions, including enhanced stability, biocompatibility, and the potential recyclability of particles. These attributes underpin their growing use in cosmetics, food, catalysis, enhanced oil recovery, and pharmaceuticals. However, single-particle emulsifiers often lack the versatility required to precisely control emulsion formation, stability, and morphology. To address these limitations, hybrid Pickering emulsifiers",rss_oup,0
"Nervous networker or conference presenter? Just care less, says voice coach Susie Ashfield",https://www.nature.com/articles/d41586-026-00547-3,Nature,2026-03-12 00:00:00 UTC,2026-03-12 00:00:00+00:00,10.1038/d41586-026-00547-3,Holly Newson,,,0
Seaborne imports or domestic production? A techno-economic assessment of hydrogen-based energy carriers,https://www.sciencedirect.com/science/article/pii/S0306261926002795?dgcid=rss_sd_all,ScienceDirect Publication: Applied Energy,2026-03-12 00:00:00 UTC,2026-03-12 00:00:00+00:00,,Maria Grahn,,,0
Power distribution and energy consumption in ionic compressors: A novel theoretical formulation,https://www.sciencedirect.com/science/article/pii/S0306261926003168?dgcid=rss_sd_all,ScienceDirect Publication: Applied Energy,2026-03-12 00:00:00 UTC,2026-03-12 00:00:00+00:00,,Yun Li,,,0
Numerical optimization of aviation decarbonization scenarios: balancing traffic and emissions with maturing energy carriers and aircraft technology,https://www.sciencedirect.com/science/article/pii/S0306261926002837?dgcid=rss_sd_all,ScienceDirect Publication: Applied Energy,2026-03-12 00:00:00 UTC,2026-03-12 00:00:00+00:00,,Thierry Druot,,,0
MARLEM: A multi-agent reinforcement learning simulation framework for implicit cooperation in decentralized local energy markets,https://www.sciencedirect.com/science/article/pii/S0306261926001984?dgcid=rss_sd_all,ScienceDirect Publication: Applied Energy,2026-03-12 00:00:00 UTC,2026-03-12 00:00:00+00:00,,Andrés González-Mancera,,,0
A short-term load forecasting hybrid model based on hierarchical optimization and ensemble networks,https://www.sciencedirect.com/science/article/pii/S0306261926003089?dgcid=rss_sd_all,ScienceDirect Publication: Applied Energy,2026-03-12 00:00:00 UTC,2026-03-12 00:00:00+00:00,,Yongchuan Zhang,,,0
Systematic under-representation of ERA5 10 m wind speeds in the ERA5-land product undermines wind energy studies,https://www.sciencedirect.com/science/article/pii/S0306261926002862?dgcid=rss_sd_all,ScienceDirect Publication: Applied Energy,2026-03-12 00:00:00 UTC,2026-03-12 00:00:00+00:00,,Andreas C.W. Baas,,,0
Enriched membrane stackings made possible,https://www.nature.com/articles/s41563-026-02530-9,Nature Materials,2026-03-12 00:00:00 UTC,2026-03-12 00:00:00+00:00,10.1038/s41563-026-02530-9,Atsushi Tsukazaki,,,0
Typhoon-resilient coordinated dispatch of wind farm cluster and hydrogen energy storage plant driven by extreme scenarios,https://www.sciencedirect.com/science/article/pii/S030626192600320X?dgcid=rss_sd_all,ScienceDirect Publication: Applied Energy,2026-03-12 00:00:00 UTC,2026-03-12 00:00:00+00:00,,Pierluigi Siano,,,0
Optical probes of hot carriers in halide perovskites,http://pubs.rsc.org/en/Content/ArticleLanding/2026/CS/D5CS00777A,RSC - Chem. Soc. Rev. latest articles,2026-03-12 00:00:00 UTC,2026-03-12 00:00:00+00:00,,Tze Chien Sum,"The unusual slow cooling of hot carriers (HCs) in halide perovskites presents a promising route to harvest the excess carrier energy and exceed the Shockley–Queisser (SQ) efficiency limit of single-junction perovskite solar cells. Spectroscopic interrogation of HC dynamics is a crucial step toward an in-depth understanding of the HC properties and underlying cooling mechanisms in these materials. A range of spectroscopy techniques – most notably pump–probe (or transient absorption (TA)) spectroscopy, pump–push–probe spectroscopy, steady-state photoluminescence (PL) and time-resolved PL spectroscopy – have been employed to study HC behaviour. However, variations in experimental implementations and data analyses can lead to conflicting or even erroneous interpretations, impeding meaningful comparisons across studies and hindering progress in the field. This tutorial review provides an overview of the most commonly used optical spectroscopy techniques for probing HC dynamics in the representative halide perovskite systems, detailing the underlying physical principles and models used to extract HC temperatures and cooling rates. We also discuss best practices for experimental design and data interpretation, aiming to minimize methodological pitfalls. By consolidating current approaches and offering guidance for their application, this tutorial serves as a resource for researchers seeking to explore HC phenomena and advance HC-based optoelectronic technologies in emergent semiconductor systems.",rsc_html,0
Machine learning-driven molecular engineering of nucleic acids,http://pubs.rsc.org/en/Content/ArticleLanding/2026/CS/D5CS01091H,RSC - Chem. Soc. Rev. latest articles,2026-03-12 00:00:00 UTC,2026-03-12 00:00:00+00:00,,Mingqiang Li,"Molecular engineering has played a pivotal role in biomedical fields, driving significant advancements in gene therapy, disease diagnosis, and biosensing. However, nucleic acid molecular engineering faces various challenges including vast design spaces, complex structure–function relationships, lengthy application validation cycles, and inefficient optimization processes. Machine learning (ML), with its superior pattern recognition, multidimensional data integration, and automated optimization capabilities, offers a unique opportunity to construct predictive models of sequence-structure–function relationships, thereby enabling a paradigm shift from empirically driven to data-driven approaches. This review systematically surveys recent progress in ML applications across three major domains: nucleic acid structure construction, performance modulation, and application expansion. It also explores core challenges such as data quality, model interpretability, and experimental validation efficiency, along with potential resolution strategies. These insights are poised to propel nucleic acid molecular engineering from static structure prediction toward dynamic behavior simulation, and from single-molecule design to complex system engineering, guiding future directions in hybrid ML-quantum models and expanded applications to non-canonical nucleic acids for transformative innovation in biomedicine, environmental monitoring, and information technology.",rsc_html,0
Youthful antics predict lifespan — at least for these fish,https://www.nature.com/articles/d41586-026-00782-8,Nature,2026-03-12 00:00:00 UTC,2026-03-12 00:00:00+00:00,10.1038/d41586-026-00782-8,Gemma Conroy,,,0
No such thing as a shark? Genomes shake up ocean predator’s family tree,https://www.nature.com/articles/d41586-026-00594-w,Nature,2026-03-12 00:00:00 UTC,2026-03-12 00:00:00+00:00,10.1038/d41586-026-00594-w,Ewen Callaway,,,0
‘Einstein‘ bot sharpens debate over AI in the classroom,https://www.nature.com/articles/d41586-026-00764-w,Nature,2026-03-12 00:00:00 UTC,2026-03-12 00:00:00+00:00,10.1038/d41586-026-00764-w,Amanda Heidt,,,0
Reckoning with my ‘ghost years’: why a high publication rate doesn’t always reflect success,https://www.nature.com/articles/d41586-025-04062-9,Nature,2026-03-12 00:00:00 UTC,2026-03-12 00:00:00+00:00,10.1038/d41586-025-04062-9,Michael L. Wong,,,0
"‘Baked, not fried’: five highlights from nutrition research",https://www.nature.com/articles/d41586-026-00598-6,Nature,2026-03-12 00:00:00 UTC,2026-03-12 00:00:00+00:00,10.1038/d41586-026-00598-6,Bianca Nogrady,,,0
How bioRxiv changed the way biologists share ideas – in numbers,https://www.nature.com/articles/d41586-026-00709-3,Nature,2026-03-12 00:00:00 UTC,2026-03-12 00:00:00+00:00,10.1038/d41586-026-00709-3,Chris Simms,,,0
Surface-initiated living crystallization-driven self-assembly: from precision nanofabrication to functional interfaces,http://pubs.rsc.org/en/Content/ArticleLanding/2026/CS/D6CS00030D,RSC - Chem. Soc. Rev. latest articles,2026-03-12 00:00:00 UTC,2026-03-12 00:00:00+00:00,,Huibin Qiu,"The precise fabrication of nanostructured materials on surfaces is paramount for advancing next-generation technologies in catalysis, electronics, biomedicine, etc. Recently, surface-initiated living crystallization-driven self-assembly (SIL-CDSA) has enabled unprecedented control over the architecture, orientation, and functionality of solid-state nanostructures on desired substrates. This review outlines key principles of SIL-CDSA, including seed immobilization, confined epitaxial growth and micellar brush formation, together with practical methods for dimension control and spatial ordering. Intrinsic core/corona chemistry and the incorporation of exogenous species allowing targeted functionalization are also discussed, covering catalytic, electronic and bioactive features. Case studies are introduced to demonstrate SIL-CDSA as a versatile platform for hierarchically ordered nanostructures, delivering exceptional control over size, periodicity, and composition. By directly translating precision self-assembly to surfaces, SIL-CDSA opens powerful routes to multifunctional, high-performance materials for catalysis, energy systems, sensing, and device fabrication, positioning it as a transformative tool for advanced nanomanufacturing.",rsc_html,0
Sequence impedance identification-based online small-signal stability assessment of grid-connected renewable energy stations considering measurement noise,https://www.sciencedirect.com/science/article/pii/S0306261926002904?dgcid=rss_sd_all,ScienceDirect Publication: Applied Energy,2026-03-12 00:00:00 UTC,2026-03-12 00:00:00+00:00,,Jinyu Wen,,,0
ARPA-H bets big to foster drugs that thwart aging,https://www.science.org/doi/abs/10.1126/science.aeh1092?af=R,AAAS: Science: Table of Contents,2026-03-12 06:00:03 UTC,2026-03-12 06:00:03+00:00,10.1126/science.aeh1092,Mitch Leslie,Awards intended to “build the train tracks” for approval of therapies to extend healthy life,crossref,0
