title,link,published,source,pub_date
Outside Back Cover: Precise Synthesis of Donor–Acceptor [17]Helicenes Exhibiting Circularly Polarized Emission (Angew. Chem. Int. Ed. 20/2026),https://chemistry-europe.onlinelibrary.wiley.com/doi/10.1002/anie.2026-m2603032100?af=R,2026-05-11 11:46:46 UTC,Wiley: Angewandte Chemie International Edition: Table of Contents,2026-05-11 11:46:46+00:00
Inside Front Cover: A Novel Acetylcholine Nanosensor for Single Vesicle Storage and Sub‐Quantal Exocytosis in Living Neurons and Organoids (Angew. Chem. Int. Ed. 20/2026),https://chemistry-europe.onlinelibrary.wiley.com/doi/10.1002/anie.2026-m2603023100?af=R,2026-05-11 11:46:46 UTC,Wiley: Angewandte Chemie International Edition: Table of Contents,2026-05-11 11:46:46+00:00
Inside Back Cover: Giant Magnetostriction in Ferrimagnetic SmFe5As3 (Angew. Chem. Int. Ed. 20/2026),https://chemistry-europe.onlinelibrary.wiley.com/doi/10.1002/anie.2026-m1704054900?af=R,2026-05-11 11:46:46 UTC,Wiley: Angewandte Chemie International Edition: Table of Contents,2026-05-11 11:46:46+00:00
Correction to “High Spin Iron–Phosphinidene and Arsinidene Complexes With Attenuated Metal–Ligand Multiple Bond Character”,https://chemistry-europe.onlinelibrary.wiley.com/doi/10.1002/anie.5682206?af=R,2026-05-11 11:46:46 UTC,Wiley: Angewandte Chemie International Edition: Table of Contents,2026-05-11 11:46:46+00:00
Perspective on Material Design and Interface Engineering toward Low‐Stack‐Pressure All‐Solid‐State Lithium Batteries,https://advanced.onlinelibrary.wiley.com/doi/10.1002/adma.73342?af=R,2026-05-11 11:51:09 UTC,Wiley: Advanced Materials: Table of Contents,2026-05-11 11:51:09+00:00
Synergistic Modulation of Crystallization Kinetics and Interface Energy‐Level Alignment for Efficient Perovskite/Silicon Tandem Solar Cells,https://advanced.onlinelibrary.wiley.com/doi/10.1002/adma.73361?af=R,2026-05-11 11:51:18 UTC,Wiley: Advanced Materials: Table of Contents,2026-05-11 11:51:18+00:00
"Wooden‐Monolithic Catalytic Microreactors: Construction Strategy, Structural Regulation, and Advanced Energy and Environmental Applications",https://advanced.onlinelibrary.wiley.com/doi/10.1002/adma.72844?af=R,2026-05-11 11:53:25 UTC,Wiley: Advanced Materials: Table of Contents,2026-05-11 11:53:25+00:00
[ASAP] Buried Interface Engineering in Metal-Halide Perovskite/NiO Heterostructures through Direct Observation of Interfacial Reactions,http://dx.doi.org/10.1021/acsenergylett.6c00785,2026-05-11 12:21:40 UTC,ACS Energy Letters: Latest Articles (ACS Publications),2026-05-11 12:21:40+00:00
A Hydroxy‐Substituted Trialkyloxonium Ion and Its Oxonium Alkoxide Zwitterion,https://chemistry-europe.onlinelibrary.wiley.com/doi/10.1002/anie.2727232?af=R,2026-05-11 12:32:22 UTC,Wiley: Angewandte Chemie International Edition: Table of Contents,2026-05-11 12:32:22+00:00
Site‐Specific Ir Single Atoms in Spinel Induce 5d Spin Polarization for Enhanced Oxygen Evolution,https://chemistry-europe.onlinelibrary.wiley.com/doi/10.1002/anie.2500154?af=R,2026-05-11 12:41:25 UTC,Wiley: Angewandte Chemie International Edition: Table of Contents,2026-05-11 12:41:25+00:00
Spin‐Dominated Reconstruction Kinetics in Prussian Blue Analog Enables Efficient Seawater Splitting,https://chemistry-europe.onlinelibrary.wiley.com/doi/10.1002/anie.6457530?af=R,2026-05-11 12:43:38 UTC,Wiley: Angewandte Chemie International Edition: Table of Contents,2026-05-11 12:43:38+00:00
An Agonist/Antagonist Photo‐Switchable Vitamin D Mimetic Enables Bidirectional Optical Control of VDR,https://chemistry-europe.onlinelibrary.wiley.com/doi/10.1002/anie.9726457?af=R,2026-05-11 12:45:33 UTC,Wiley: Angewandte Chemie International Edition: Table of Contents,2026-05-11 12:45:33+00:00
Embedding Chemistry and Pharmacy Into Sustainability,https://chemistry-europe.onlinelibrary.wiley.com/doi/10.1002/anie.3329101?af=R,2026-05-11 12:47:32 UTC,Wiley: Angewandte Chemie International Edition: Table of Contents,2026-05-11 12:47:32+00:00
Hybrid tidal-photovoltaic system for modular renewables deployment in estuarine channels,https://www.pv-magazine.com/2026/05/11/hybrid-tidal-photovoltaic-system-for-modular-renewables-deployment-in-estuarine-channels/,2026-05-11 13:15:22 UTC,Commercial & Industrial PV – pv magazine International,2026-05-11 13:15:22+00:00
"Ferroli launches monobloc propane air-to-water heat pumps for residential, commercial use",https://www.pv-magazine.com/2026/05/11/ferroli-launches-monobloc-propane-air-to-water-heat-pumps-for-residential-commercial-use/,2026-05-11 14:22:51 UTC,Commercial & Industrial PV – pv magazine International,2026-05-11 14:22:51+00:00
Norwegian cell manufacturer Morrow Batteries files for insolvency,https://www.electrive.com/2026/05/11/norwegian-cell-manufacturer-morrow-batteries-files-for-insolvency/,2026-05-11 14:24:09 UTC,Battery – electrive.com,2026-05-11 14:24:09+00:00
Drax deploying solar panels at Scottish hydropower stations,https://www.pv-magazine.com/2026/05/11/drax-deploying-solar-panels-at-scottish-hydropower-stations/,2026-05-11 14:29:44 UTC,Commercial & Industrial PV – pv magazine International,2026-05-11 14:29:44+00:00
Holcim Deploys Carbon-Storing Concrete Technology In Commercial Project,https://carbonherald.com/holcim-deploys-carbon-storing-concrete-technology-in-commercial-project/?utm_source=rss&utm_medium=rss&utm_campaign=holcim-deploys-carbon-storing-concrete-technology-in-commercial-project,2026-05-11 14:39:23 UTC,Carbon Herald,2026-05-11 14:39:23+00:00
Selective Nitrate Transmembrane Transport Through Adaptive Weak C─H Bonding Cyanostilbene Water Channels,https://chemistry-europe.onlinelibrary.wiley.com/doi/10.1002/anie.4918548?af=R,2026-05-11 15:10:44 UTC,Wiley: Angewandte Chemie International Edition: Table of Contents,2026-05-11 15:10:44+00:00
[ASAP] In Situ Light-Induced Degradation of Hybrid Perovskites by NMR Spectroscopy,http://dx.doi.org/10.1021/jacs.6c04176,2026-05-11 15:52:54 UTC,Journal of the American Chemical Society: Latest Articles (ACS Publications),2026-05-11 15:52:54+00:00
[ASAP] “Three-in-One” Self-Assembled Molecule Enables Inverted CsPbI3 Solar Cells,http://dx.doi.org/10.1021/acsenergylett.6c00820,2026-05-11 16:13:43 UTC,ACS Energy Letters: Latest Articles (ACS Publications),2026-05-11 16:13:43+00:00
Emsteel And Gulf Cryo Partner On Carbon Capture And Utilization,https://carbonherald.com/emsteel-and-gulf-cryo-partner-on-carbon-capture-and-utilization/?utm_source=rss&utm_medium=rss&utm_campaign=emsteel-and-gulf-cryo-partner-on-carbon-capture-and-utilization,2026-05-11 16:48:58 UTC,Carbon Herald,2026-05-11 16:48:58+00:00
Morocco And Norway Sign Carbon Market Cooperation Agreement,https://carbonherald.com/morocco-and-norway-sign-carbon-market-cooperation-agreement/?utm_source=rss&utm_medium=rss&utm_campaign=morocco-and-norway-sign-carbon-market-cooperation-agreement,2026-05-11 17:12:57 UTC,Carbon Herald,2026-05-11 17:12:57+00:00
[ASAP] Low-Rate Cycling Regeneration Sustains NMC811–Graphite Battery Performance through Extreme Ultrafast Charging,http://dx.doi.org/10.1021/acsenergylett.5c04186,2026-05-11 18:43:23 UTC,ACS Energy Letters: Latest Articles (ACS Publications),2026-05-11 18:43:23+00:00
[ASAP] PdGa Alloy Dynamics under CO2 Hydrogenation from Surface Organometallic Chemistry on a Chip and Operando Transmission Electron Microscopy,http://dx.doi.org/10.1021/jacs.6c01393,2026-05-11 19:03:54 UTC,Journal of the American Chemical Society: Latest Articles (ACS Publications),2026-05-11 19:03:54+00:00
Large-Pore Mesoporous Covalent Organic Frameworks Fast Ion Sieves by Kinetics-Mediated Micelle Assembly for Aqueous Batteries,http://pubs.rsc.org/en/Content/ArticleLanding/2026/EE/D6EE01393G,2026-05-11 23:00:00 UTC,RSC - Energy Environ. Sci. latest articles,2026-05-11 23:00:00+00:00
Circularly polarized luminescence in chiral hybrid metal halides,http://pubs.rsc.org/en/Content/ArticleLanding/2026/CS/D6CS00132G,2026-05-11 23:00:00 UTC,RSC - Chem. Soc. Rev. latest articles,2026-05-11 23:00:00+00:00
Concentration–structure dual-gradient architecture in high-Ni/low-Co single-crystal NCM cathodes,http://pubs.rsc.org/en/Content/ArticleLanding/2026/EE/D6EE00273K,2026-05-11 23:00:00 UTC,RSC - Energy Environ. Sci. latest articles,2026-05-11 23:00:00+00:00
Cruise-ship hantavirus cluster exposes a wider preparedness gap,https://www.nature.com/articles/d41586-026-01518-4,2026-05-12 00:00:00 UTC,Nature,2026-05-12 00:00:00+00:00
Author Correction: A mechanical ratchet drives unilateral cytokinesis,https://www.nature.com/articles/s41586-026-10618-0,2026-05-12 00:00:00 UTC,Nature,2026-05-12 00:00:00+00:00
Charles Darwin reports a squirrel surprise,https://www.nature.com/articles/d41586-026-01334-w,2026-05-12 00:00:00 UTC,Nature,2026-05-12 00:00:00+00:00
UK Biobank breach prompts the field of genomics to rethink open science,https://www.nature.com/articles/d41586-026-01520-w,2026-05-12 00:00:00 UTC,Nature,2026-05-12 00:00:00+00:00
Author Correction: Predictive coding of reward in the hippocampus,https://www.nature.com/articles/s41586-026-10615-3,2026-05-12 00:00:00 UTC,Nature,2026-05-12 00:00:00+00:00
Ice core reveals longest-ever continuous record of Earth’s climate,https://www.nature.com/articles/d41586-026-01523-7,2026-05-12 00:00:00 UTC,Nature,2026-05-12 00:00:00+00:00
Models for the architecture of the human inner kinetochore on centromeric α-satellite CENP-A nucleosome arrays,https://www.nature.com/articles/s41467-026-72856-0,2026-05-12 00:00:00 UTC,Nature Communications,2026-05-12 00:00:00+00:00
Bacterial−viral conflicts shape cholera evolution,https://www.nature.com/articles/d41586-026-01156-w,2026-05-12 00:00:00 UTC,Nature,2026-05-12 00:00:00+00:00
Chemistry in the AI era,https://www.nature.com/articles/d41586-026-01521-9,2026-05-12 00:00:00 UTC,Nature,2026-05-12 00:00:00+00:00
Science can take the lead in making better measures of economic growth,https://www.nature.com/articles/d41586-026-01474-z,2026-05-12 00:00:00 UTC,Nature,2026-05-12 00:00:00+00:00
A solvent-free route to high-performance silk materials,https://www.nature.com/articles/s41893-026-01822-x,2026-05-12 00:00:00 UTC,Nature Sustainability,2026-05-12 00:00:00+00:00
A probe for the origin of superconductivity,https://www.nature.com/articles/s41578-026-00929-z,2026-05-12 00:00:00 UTC,Nature Reviews Materials,2026-05-12 00:00:00+00:00
Open data is key to genomics research — if the information can be kept safe,https://www.nature.com/articles/d41586-026-01475-y,2026-05-12 00:00:00 UTC,Nature,2026-05-12 00:00:00+00:00
Sweet spots for nitrogen reduction in a coastal watershed,https://www.nature.com/articles/s41893-026-01828-5,2026-05-12 00:00:00 UTC,Nature Sustainability,2026-05-12 00:00:00+00:00
3D-printed multiscale-ordered hierarchical frameworks for rapid atmospheric water harvesting,https://www.nature.com/articles/s41893-026-01834-7,2026-05-12 00:00:00 UTC,Nature Sustainability,2026-05-12 00:00:00+00:00
Hierarchical materials from fused silk,https://www.nature.com/articles/s41893-026-01821-y,2026-05-12 00:00:00 UTC,Nature Sustainability,2026-05-12 00:00:00+00:00
Best practices for thermoelectric materials and devices,https://www.nature.com/articles/s41893-026-01826-7,2026-05-12 00:00:00 UTC,Nature Sustainability,2026-05-12 00:00:00+00:00
Animal-testing alternatives will require a cultural change in research institutions,https://www.nature.com/articles/d41586-026-01519-3,2026-05-12 00:00:00 UTC,Nature,2026-05-12 00:00:00+00:00
"High-titer, antibiotic-free, pilot-scale production of 1,3-propanediol by engineered Corynebacterium",https://www.nature.com/articles/s44286-026-00389-w,2026-05-12 00:00:00 UTC,Nature Chemical Engineering,2026-05-12 00:00:00+00:00
Local graph estimation with pathwise false discovery control,https://www.nature.com/articles/s41467-026-72796-9,2026-05-12 00:00:00 UTC,Nature Communications,2026-05-12 00:00:00+00:00
Ultrafast laser induces macroscopic symmetry-breaking of diamond color centers,https://www.nature.com/articles/s41467-026-72813-x,2026-05-12 00:00:00 UTC,Nature Communications,2026-05-12 00:00:00+00:00
AI bills can be as big as a postdoc salary. Is the cost worth it?,https://www.nature.com/articles/d41586-026-01369-z,2026-05-12 00:00:00 UTC,Nature,2026-05-12 00:00:00+00:00
Harmonized sodium coordination engineering for high-energy phosphate cathodes,https://www.nature.com/articles/s41560-026-02059-w,2026-05-12 00:00:00 UTC,Nature Energy,2026-05-12 00:00:00+00:00
Unlocking hidden sodium,https://www.nature.com/articles/s41560-026-02060-3,2026-05-12 00:00:00 UTC,Nature Energy,2026-05-12 00:00:00+00:00
Tunable polaritonic topologies generated by non-local photonic modes,https://www.nature.com/articles/s41565-026-02174-5,2026-05-12 00:00:00 UTC,Nature Nanotechnology,2026-05-12 00:00:00+00:00
Detecting linear dichroism with atomic resolution,https://www.nature.com/articles/s41563-026-02606-6,2026-05-12 00:00:00 UTC,Nature Materials,2026-05-12 00:00:00+00:00
Connecting minds and machines: an interview with Miguel Nicolelis on brain-machine interfaces,https://academic.oup.com/nsr/advance-article/doi/10.1093/nsr/nwag273/8676369?rss=1,2026-05-12 00:00:00 UTC,National Science Review Advance Access,2026-05-12 00:00:00+00:00
Decoding brain dynamics: an interview with Jose Principe on Brain-Machine Interfaces,https://academic.oup.com/nsr/advance-article/doi/10.1093/nsr/nwag262/8676370?rss=1,2026-05-12 00:00:00 UTC,National Science Review Advance Access,2026-05-12 00:00:00+00:00
How to vibe code in science: early adopters share their tips,https://www.nature.com/articles/d41586-026-01477-w,2026-05-12 00:00:00 UTC,Nature,2026-05-12 00:00:00+00:00
Optical ising machine,https://academic.oup.com/nsr/advance-article/doi/10.1093/nsr/nwag261/8676379?rss=1,2026-05-12 00:00:00 UTC,National Science Review Advance Access,2026-05-12 00:00:00+00:00
One Health Genomics Reveals Niche-Specific Lineage Replacement in Salmonella Enteritidis,https://academic.oup.com/nsr/advance-article/doi/10.1093/nsr/nwag275/8676381?rss=1,2026-05-12 00:00:00 UTC,National Science Review Advance Access,2026-05-12 00:00:00+00:00
Robust production of heavy-chain-only antibodies in mice by CRISPR/Cas mediated in situ modification of IgH locus,https://academic.oup.com/nsr/advance-article/doi/10.1093/nsr/nwag270/8676386?rss=1,2026-05-12 00:00:00 UTC,National Science Review Advance Access,2026-05-12 00:00:00+00:00
Chirality-induced spin selectivity as a mechanism to control product selectivity during electrochemical CO2 reduction,https://www.nature.com/articles/s41560-026-02062-1,2026-05-12 00:00:00 UTC,Nature Energy,2026-05-12 00:00:00+00:00
Opposing diversity-stability relationships within versus between aquatic producers and consumers,https://academic.oup.com/nsr/advance-article/doi/10.1093/nsr/nwag274/8676377?rss=1,2026-05-12 00:00:00 UTC,National Science Review Advance Access,2026-05-12 00:00:00+00:00
Identification and quantification of intracellular N-acetylglucosamine modified glycoRNAs,https://www.nature.com/articles/s41467-026-72909-4,2026-05-12 00:00:00 UTC,Nature Communications,2026-05-12 00:00:00+00:00
Opposing transient and equilibrium effective radiative forcing from aerosol-cloud interactions,https://www.nature.com/articles/s41467-026-72896-6,2026-05-12 00:00:00 UTC,Nature Communications,2026-05-12 00:00:00+00:00
PepsiCo signs three low-carbon fertilizer supply deals,https://ammoniaenergy.org/articles/pepsico-signs-three-low-carbon-fertilizer-supply-deals/,2026-05-12 01:14:56 UTC,Articles – Ammonia Energy Association,2026-05-12 01:14:56+00:00
Two skeptics of antidepressant drugs named to NIH mental health council,https://www.science.org/content/article/two-skeptics-antidepressant-drugs-named-nih-mental-health-council,2026-05-12 03:00:00 UTC,Latest News from Science Magazine,2026-05-12 03:00:00+00:00
Chinese postdocs in U.S. hit with a wave of prosecutions and deportations,https://www.science.org/content/article/chinese-postdocs-u-s-hit-wave-prosecutions-and-deportations,2026-05-12 04:35:00 UTC,Latest News from Science Magazine,2026-05-12 04:35:00+00:00
A Deep‐Red‐Absorbing Osmium(II) Complex as a Photosensitizer for Photodynamic Therapy Inducing Immunogenic Cell Death,https://chemistry-europe.onlinelibrary.wiley.com/doi/10.1002/anie.8677989?af=R,2026-05-12 04:40:47 UTC,Wiley: Angewandte Chemie International Edition: Table of Contents,2026-05-12 04:40:47+00:00
Proteolysis‐Assisted Cyclization Facilitates Site‐Centric Target Deconvolution of Isothiocyanates,https://chemistry-europe.onlinelibrary.wiley.com/doi/10.1002/anie.5512891?af=R,2026-05-12 04:42:17 UTC,Wiley: Angewandte Chemie International Edition: Table of Contents,2026-05-12 04:42:17+00:00
Correction to “Thermally‐Stable Single‐Site Pd on CeO2 Catalyst for Selective Amination of Phenols to Aromatic Amines Without External Hydrogen”,https://chemistry-europe.onlinelibrary.wiley.com/doi/10.1002/anie.6349130?af=R,2026-05-12 04:43:19 UTC,Wiley: Angewandte Chemie International Edition: Table of Contents,2026-05-12 04:43:19+00:00
Regulating π–π Stacking Interactions to Boost Near‐Infrared Light‐Driven CO2 Reduction,https://chemistry-europe.onlinelibrary.wiley.com/doi/10.1002/anie.7481604?af=R,2026-05-12 04:43:57 UTC,Wiley: Angewandte Chemie International Edition: Table of Contents,2026-05-12 04:43:57+00:00
SPECTRAL: An Intelligent and Ultra‐Sensitive Photonic Hydrogel Platform for Biomarker‐Based Cancer Prediction,https://chemistry-europe.onlinelibrary.wiley.com/doi/10.1002/anie.7454058?af=R,2026-05-12 04:44:25 UTC,Wiley: Angewandte Chemie International Edition: Table of Contents,2026-05-12 04:44:25+00:00
Beyond Hyperfluorescence: Leveraging a Host‐Guest Exciplex to Significantly Suppress the Efficiency Roll‐Off and Improve the Operational Stability in Narrowband Emissive Devices,https://chemistry-europe.onlinelibrary.wiley.com/doi/10.1002/anie.5182394?af=R,2026-05-12 04:44:30 UTC,Wiley: Angewandte Chemie International Edition: Table of Contents,2026-05-12 04:44:30+00:00
Poisoning‐Resistant Complete Hydrogenation of Liquid Organic Hydrogen Carriers Over Ni‐Based Inverse Catalysts,https://chemistry-europe.onlinelibrary.wiley.com/doi/10.1002/anie.9919505?af=R,2026-05-12 04:45:58 UTC,Wiley: Angewandte Chemie International Edition: Table of Contents,2026-05-12 04:45:58+00:00
Beyond the Pre‐Equilibrium Approximation: Consequences of Elementary Step (Ir)reversibility on the Mechanistic Interpretation of Tafel Slope,https://chemistry-europe.onlinelibrary.wiley.com/doi/10.1002/anie.1052729?af=R,2026-05-12 04:47:03 UTC,Wiley: Angewandte Chemie International Edition: Table of Contents,2026-05-12 04:47:03+00:00
High‐Entropy Catalyst Activated Molecular Oxygen for Oxidative Coupling Under Ambient Conditions,https://chemistry-europe.onlinelibrary.wiley.com/doi/10.1002/anie.1664539?af=R,2026-05-12 04:50:18 UTC,Wiley: Angewandte Chemie International Edition: Table of Contents,2026-05-12 04:50:18+00:00
Fully Planarized Donor Enables Record‐High Efficiency for Blue Through‐Space Charge Transfer Emission,https://chemistry-europe.onlinelibrary.wiley.com/doi/10.1002/anie.4991944?af=R,2026-05-12 04:51:07 UTC,Wiley: Angewandte Chemie International Edition: Table of Contents,2026-05-12 04:51:07+00:00
Most dementia patients have multiple brain diseases. How should they be treated?,https://www.science.org/content/article/most-dementia-patients-have-multiple-brain-diseases-how-should-they-be-treated,2026-05-12 05:05:00 UTC,Latest News from Science Magazine,2026-05-12 05:05:00+00:00
Compatible Dynamically Wetting Electrolyte–Electrode Interface Design for Solid‐State Lithium–Sulfur Batteries,https://chemistry-europe.onlinelibrary.wiley.com/doi/10.1002/anie.1261984?af=R,2026-05-12 05:34:44 UTC,Wiley: Angewandte Chemie International Edition: Table of Contents,2026-05-12 05:34:44+00:00
Enhancing Interfacial Charge Transport in Gold Nanoparticle@Polyaniline Hybrids via N‐Heterocyclic Carbene Linkers,https://chemistry-europe.onlinelibrary.wiley.com/doi/10.1002/anie.202526136?af=R,2026-05-12 05:37:25 UTC,Wiley: Angewandte Chemie International Edition: Table of Contents,2026-05-12 05:37:25+00:00
Electron‐Localized RuNi Nanosheet Assemblies Enable Low‐Overpotential Mg‐CO2 Battery,https://chemistry-europe.onlinelibrary.wiley.com/doi/10.1002/anie.1677991?af=R,2026-05-12 05:38:05 UTC,Wiley: Angewandte Chemie International Edition: Table of Contents,2026-05-12 05:38:05+00:00
Local Electronic Modulation in Pillararene‐Based Donor–Acceptor Conjugated Polymers for Selective Photocatalytic Oxygen Reduction,https://chemistry-europe.onlinelibrary.wiley.com/doi/10.1002/anie.9577048?af=R,2026-05-12 06:32:37 UTC,Wiley: Angewandte Chemie International Edition: Table of Contents,2026-05-12 06:32:37+00:00
Virologist accused of starting COVID-19 will fight U.S. ban on funding,https://www.science.org/content/article/virologist-accused-starting-covid-19-will-fight-u-s-ban-funding,2026-05-12 06:35:44 UTC,Latest News from Science Magazine,2026-05-12 06:35:44+00:00
Universal In Situ Flowrate Monitoring for Piezoelectric Microfluidics via Triboelectric Self‐Sensing,https://advanced.onlinelibrary.wiley.com/doi/10.1002/adma.73364?af=R,2026-05-12 06:42:04 UTC,Wiley: Advanced Materials: Table of Contents,2026-05-12 06:42:04+00:00
MEPC84: support for Net Zero Framework stabilizes ahead of key decision point in late 2026,https://ammoniaenergy.org/articles/mepc84-support-for-net-zero-framework-stabilizes-ahead-of-key-decision-point-in-late-2026/,2026-05-12 06:44:04 UTC,Articles – Ammonia Energy Association,2026-05-12 06:44:04+00:00
A Robust Biopolymer Network Binder for High‐Loading Iodine Cathodes in Zinc‐Iodine Batteries,https://advanced.onlinelibrary.wiley.com/doi/10.1002/adma.73339?af=R,2026-05-12 06:44:39 UTC,Wiley: Advanced Materials: Table of Contents,2026-05-12 06:44:39+00:00
Field data challenge predictions of universal crop pest proliferation under warming,https://www.pnas.org/doi/abs/10.1073/pnas.2606726123?mi=eymic2&af=R&access=on&content=articlesChapters&publication=pnas&sortBy=Earliest&target=default,2026-05-12 07:00:00 UTC,Proceedings of the National Academy of Sciences: Keyword search for query,2026-05-12 07:00:00+00:00
Modular genetic architecture underlies human hand and foot evolution,https://www.pnas.org/doi/abs/10.1073/pnas.2603297123?mi=eymic2&af=R&access=on&content=articlesChapters&publication=pnas&sortBy=Earliest&target=default,2026-05-12 07:00:00 UTC,Proceedings of the National Academy of Sciences: Keyword search for query,2026-05-12 07:00:00+00:00
Temporally gated offline engram ensemble reverberation in the lateral amygdala is required for fear memory consolidation,https://www.pnas.org/doi/abs/10.1073/pnas.2602678123?mi=eymic2&af=R&access=on&content=articlesChapters&publication=pnas&sortBy=Earliest&target=default,2026-05-12 07:00:00 UTC,Proceedings of the National Academy of Sciences: Keyword search for query,2026-05-12 07:00:00+00:00
Bioinspired ultrasound-driven ultrafast soft microgripper,https://www.pnas.org/doi/abs/10.1073/pnas.2537655123?mi=eymic2&af=R&access=on&content=articlesChapters&publication=pnas&sortBy=Earliest&target=default,2026-05-12 07:00:00 UTC,Proceedings of the National Academy of Sciences: Keyword search for query,2026-05-12 07:00:00+00:00
Identification of immunostimulatory antigens in Group A Streptococcus–derived vesicles,https://www.pnas.org/doi/abs/10.1073/pnas.2537351123?mi=eymic2&af=R&access=on&content=articlesChapters&publication=pnas&sortBy=Earliest&target=default,2026-05-12 07:00:00 UTC,Proceedings of the National Academy of Sciences: Keyword search for query,2026-05-12 07:00:00+00:00
"Binocular vision emerges from the coordinated development of orbit convergence, eye orientation, and high-acuity retinal specializations",https://www.pnas.org/doi/abs/10.1073/pnas.2537038123?mi=eymic2&af=R&access=on&content=articlesChapters&publication=pnas&sortBy=Earliest&target=default,2026-05-12 07:00:00 UTC,Proceedings of the National Academy of Sciences: Keyword search for query,2026-05-12 07:00:00+00:00
Fungal proliferation before and after the Cretaceous–Paleogene mass extinction event in North America,https://www.pnas.org/doi/abs/10.1073/pnas.2536899123?mi=eymic2&af=R&access=on&content=articlesChapters&publication=pnas&sortBy=Earliest&target=default,2026-05-12 07:00:00 UTC,Proceedings of the National Academy of Sciences: Keyword search for query,2026-05-12 07:00:00+00:00
Spatiotemporal control of PIWI compartmentalization by mitochondrial scaffolds defines pachytene piRNA pathway organization,https://www.pnas.org/doi/abs/10.1073/pnas.2533968123?mi=eymic2&af=R&access=on&content=articlesChapters&publication=pnas&sortBy=Earliest&target=default,2026-05-12 07:00:00 UTC,Proceedings of the National Academy of Sciences: Keyword search for query,2026-05-12 07:00:00+00:00
Lineage-specific evolution of regulatory landscapes in a polyploid plant and its diploid progenitors,https://www.pnas.org/doi/abs/10.1073/pnas.2530814123?mi=eymic2&af=R&access=on&content=articlesChapters&publication=pnas&sortBy=Earliest&target=default,2026-05-12 07:00:00 UTC,Proceedings of the National Academy of Sciences: Keyword search for query,2026-05-12 07:00:00+00:00
SFTSV NSs protein is a tick antiviral RNAi response suppressor,https://www.pnas.org/doi/abs/10.1073/pnas.2524728123?mi=eymic2&af=R&access=on&content=articlesChapters&publication=pnas&sortBy=Earliest&target=default,2026-05-12 07:00:00 UTC,Proceedings of the National Academy of Sciences: Keyword search for query,2026-05-12 07:00:00+00:00
Evolution of noisy learning in games,https://www.pnas.org/doi/abs/10.1073/pnas.2529959123?mi=eymic2&af=R&access=on&content=articlesChapters&publication=pnas&sortBy=Earliest&target=default,2026-05-12 07:00:00 UTC,Proceedings of the National Academy of Sciences: Keyword search for query,2026-05-12 07:00:00+00:00
