title,link,published,source,pub_date
Machine learning predicts meter-scale laboratory earthquakes,https://www.nature.com/articles/s41467-025-64542-4,2025-10-30 00:00:00 UTC,Nature Communications,2025-10-30 00:00:00+00:00
Author Correction: Reciprocal signalling by Notch–Collagen V–CALCR retains muscle stem cells in their niche,https://www.nature.com/articles/s41586-025-09787-1,2025-10-30 00:00:00 UTC,Nature,2025-10-30 00:00:00+00:00
Experiments reveal extreme water generation during planet formation,https://www.nature.com/articles/s41586-025-09816-z,2025-10-30 00:00:00 UTC,Nature,2025-10-30 00:00:00+00:00
Nanotyrannus and Tyrannosaurus coexisted at the close of the Cretaceous,https://www.nature.com/articles/s41586-025-09801-6,2025-10-30 00:00:00 UTC,Nature,2025-10-30 00:00:00+00:00
Hotly debated dinosaur is not a tiny T. rex after all,https://www.nature.com/articles/d41586-025-03561-z,2025-10-30 00:00:00 UTC,Nature,2025-10-30 00:00:00+00:00
"T. rex debate settled: contested fossils are smaller rival species, not juveniles",https://www.nature.com/articles/d41586-025-03552-0,2025-10-30 00:00:00 UTC,Nature,2025-10-30 00:00:00+00:00
"Publisher Correction: Wearable device-based health equivalence of different physical activity intensities against mortality, cardiometabolic disease, and cancer",https://www.nature.com/articles/s41467-025-65754-4,2025-10-30 00:00:00 UTC,Nature Communications,2025-10-30 00:00:00+00:00
Publisher Correction: The bandgap-detuned excitation regime in photonic-crystal resonators,https://www.nature.com/articles/s41467-025-65401-y,2025-10-30 00:00:00 UTC,Nature Communications,2025-10-30 00:00:00+00:00
Doubling of the global freshwater footprint of material production over two decades,https://www.nature.com/articles/s41893-025-01661-2,2025-10-30 00:00:00 UTC,Nature Sustainability,2025-10-30 00:00:00+00:00
Bistable and absolute switching driven by superconducting exchange coupling,https://www.nature.com/articles/s41467-025-64594-6,2025-10-30 00:00:00 UTC,Nature Communications,2025-10-30 00:00:00+00:00
Can IVF save the northern white rhino from extinction? — October’s best science images,https://www.nature.com/articles/d41586-025-03499-2,2025-10-30 00:00:00 UTC,Nature,2025-10-30 00:00:00+00:00
Collective intelligence in animals and robots,https://www.nature.com/articles/s41467-025-65814-9,2025-10-30 00:00:00 UTC,Nature Communications,2025-10-30 00:00:00+00:00
A pipeline for proteome-wide analysis of electrophile selectivity,https://www.nature.com/articles/s41557-025-01906-9,2025-10-30 00:00:00 UTC,Nature Chemistry,2025-10-30 00:00:00+00:00
‘Teenage T. rex’ fossil is actually a different species,https://www.nature.com/articles/d41586-025-03553-z,2025-10-30 00:00:00 UTC,Nature,2025-10-30 00:00:00+00:00
Anti-dimerization 56π-electron fullerene adduct bearing bulky functional groups for inverted perovskite solar cells with enhanced interfacial stability,https://academic.oup.com/nsr/advance-article/doi/10.1093/nsr/nwaf466/8306883?rss=1,2025-10-30 00:00:00 UTC,National Science Review Advance Access,2025-10-30 00:00:00+00:00
Intelligent structural microbatteries for adaptive microrobots,https://academic.oup.com/nsr/advance-article/doi/10.1093/nsr/nwaf467/8306855?rss=1,2025-10-30 00:00:00 UTC,National Science Review Advance Access,2025-10-30 00:00:00+00:00
Kinetically-controlled intermediate-direct-pinning for homogeneous energy landscapes in quasi-two-dimensional perovskites for efficient and narrow blue emission,https://www.nature.com/articles/s41467-025-62863-y,2025-10-30 00:00:00 UTC,Nature Communications,2025-10-30 00:00:00+00:00
Discovery of obesity genes through cross-ancestry analysis,https://www.nature.com/articles/s41467-025-64933-7,2025-10-30 00:00:00 UTC,Nature Communications,2025-10-30 00:00:00+00:00
PEG alternatives for RNA therapeutics,https://www.nature.com/articles/s41563-025-02408-2,2025-10-30 00:00:00 UTC,Nature Materials,2025-10-30 00:00:00+00:00
Copper integrative catalytic pairs with mixed-valence Cu2+-Cu3+ Species for selective alkyne conversion,https://www.nature.com/articles/s41467-025-64639-w,2025-10-30 00:00:00 UTC,Nature Communications,2025-10-30 00:00:00+00:00
Profiling the proteome-wide selectivity of diverse electrophiles,https://www.nature.com/articles/s41557-025-01902-z,2025-10-30 00:00:00 UTC,Nature Chemistry,2025-10-30 00:00:00+00:00
Metrics for evaluating safe electrolytes in energy-dense lithium batteries,https://www.nature.com/articles/s41560-025-01887-6,2025-10-30 00:00:00 UTC,Nature Energy,2025-10-30 00:00:00+00:00
Superconductivity in substitutional Ga-hyperdoped Ge epitaxial thin films,https://www.nature.com/articles/s41565-025-02042-8,2025-10-30 00:00:00 UTC,Nature Nanotechnology,2025-10-30 00:00:00+00:00
Electrically driven heterostructured far-infrared wire lasers with integrated graphene plasmons,https://www.nature.com/articles/s41565-025-02005-z,2025-10-30 00:00:00 UTC,Nature Nanotechnology,2025-10-30 00:00:00+00:00
Graphene grating lifts terahertz quantum cascade lasers into the Reststrahlen band,https://www.nature.com/articles/s41565-025-02006-y,2025-10-30 00:00:00 UTC,Nature Nanotechnology,2025-10-30 00:00:00+00:00
Identifying safe electrolytes for fire-free lithium batteries,https://www.nature.com/articles/s41560-025-01896-5,2025-10-30 00:00:00 UTC,Nature Energy,2025-10-30 00:00:00+00:00
"Chemiresistive gas sensors for intelligent sensing: design strategies, emerging applications and future challenges",http://pubs.rsc.org/en/Content/ArticleLanding/2025/CS/D5CS00979K,2025-10-30 00:00:00 UTC,RSC - Chem. Soc. Rev. latest articles,2025-10-30 00:00:00+00:00
Author Correction: Two-step crystallization modulated through acenaphthene enabling 21% binary organic solar cells and 83.2% fill factor,https://www.nature.com/articles/s41560-025-01918-2,2025-10-30 00:00:00 UTC,Nature Energy,2025-10-30 00:00:00+00:00
Can AI capture the mind-boggling complexity of a human cell?,https://www.science.org/content/article/can-ai-capture-mind-boggling-complexity-human-cell,2025-10-30 02:00:00 UTC,Latest News from Science Magazine,2025-10-30 02:00:00+00:00
"New evidence? No problem. Chimps can weigh conflicting clues, just like humans",https://www.science.org/content/article/new-evidence-no-problem-chimps-can-weigh-conflicting-clues-just-humans,2025-10-30 02:00:00 UTC,Latest News from Science Magazine,2025-10-30 02:00:00+00:00
Chemical additive slashes carbon emissions when creating synthetic fuels,https://www.science.org/content/article/chemical-additive-slashes-carbon-emissions-when-creating-synthetic-fuels,2025-10-30 02:05:00 UTC,Latest News from Science Magazine,2025-10-30 02:05:00+00:00
Tree rings from ancient coffins offer clues to Earth’s past,https://www.science.org/content/article/tree-rings-ancient-coffins-offer-clues-earth-s-past,2025-10-30 03:15:00 UTC,Latest News from Science Magazine,2025-10-30 03:15:00+00:00
Exclusive: Future of chronic disease journal in limbo after cuts at CDC,https://www.science.org/content/article/exclusive-future-chronic-disease-journal-limbo-after-cuts-cdc,2025-10-30 03:40:00 UTC,Latest News from Science Magazine,2025-10-30 03:40:00+00:00
Cryo‐Sampling Enables Atomistic Insights Into Bulk Degradation of High‐Voltage LiCoO2,https://advanced.onlinelibrary.wiley.com/doi/10.1002/aenm.202503723?af=R,2025-10-30 05:46:01 UTC,Wiley: Advanced Energy Materials: Table of Contents,2025-10-30 05:46:01+00:00
Safety Assessment of Large‐Format Quasi‐Solid‐State Lithium‐Ion Batteries,https://advanced.onlinelibrary.wiley.com/doi/10.1002/aenm.202504346?af=R,2025-10-30 05:47:03 UTC,Wiley: Advanced Energy Materials: Table of Contents,2025-10-30 05:47:03+00:00
Understanding the Cathode Electrochemistry of Humidified Solid‐State Lithium‐Oxygen Batteries,https://advanced.onlinelibrary.wiley.com/doi/10.1002/aenm.202504050?af=R,2025-10-30 05:48:53 UTC,Wiley: Advanced Energy Materials: Table of Contents,2025-10-30 05:48:53+00:00
Electrically Reconfigurable Liquid Metal Nanophotonic Platform for Color Display and Imaging,https://advanced.onlinelibrary.wiley.com/doi/10.1002/adma.202512901?af=R,2025-10-30 05:49:08 UTC,Wiley: Advanced Materials: Table of Contents,2025-10-30 05:49:08+00:00
Crosstalk‐Enabled High In‐Plane Anisotropy of Monolayer MoS2 Nanoribbons,https://advanced.onlinelibrary.wiley.com/doi/10.1002/adma.202515066?af=R,2025-10-30 05:50:52 UTC,Wiley: Advanced Materials: Table of Contents,2025-10-30 05:50:52+00:00
"Four‐Dimensional Dynamic Multicolor Emission in MgGa2O4:Tb3+ Through Orthogonal Modulation of Excitation Wavelength, Time, Temperature and Pressure",https://advanced.onlinelibrary.wiley.com/doi/10.1002/adma.202517021?af=R,2025-10-30 05:52:03 UTC,Wiley: Advanced Materials: Table of Contents,2025-10-30 05:52:03+00:00
Advancing Seawater Electrolysis: NiFe‐LDH‐Based Electrocatalysts for the Oxygen Evolution Reaction,https://advanced.onlinelibrary.wiley.com/doi/10.1002/aenm.202504101?af=R,2025-10-30 05:52:26 UTC,Wiley: Advanced Energy Materials: Table of Contents,2025-10-30 05:52:26+00:00
Self‐Adaptive Mechanical Metasurface Enabling Zero‐Power‐Consumption Thermal Management of Electronic Devices,https://advanced.onlinelibrary.wiley.com/doi/10.1002/adma.202509005?af=R,2025-10-30 05:52:42 UTC,Wiley: Advanced Materials: Table of Contents,2025-10-30 05:52:42+00:00
Probing All‐Solid‐State Batteries with Real‐Time Synchrotron and Neutron Techniques,https://advanced.onlinelibrary.wiley.com/doi/10.1002/aenm.202504045?af=R,2025-10-30 05:53:37 UTC,Wiley: Advanced Energy Materials: Table of Contents,2025-10-30 05:53:37+00:00
Efficient and Stable Electrochemical Ammonia Synthesis Promoted by in Situ Alloying in Tubular Protonic Ceramic Electrolysis Cells,https://advanced.onlinelibrary.wiley.com/doi/10.1002/aenm.202504493?af=R,2025-10-30 05:54:15 UTC,Wiley: Advanced Energy Materials: Table of Contents,2025-10-30 05:54:15+00:00
Ultrahigh‐Efficiency Zinc‐Air Batteries Enabled by Defect‐Engineered Biomass Carbon and Dynamic Nickel Redox Mediation,https://advanced.onlinelibrary.wiley.com/doi/10.1002/adma.202513768?af=R,2025-10-30 05:57:26 UTC,Wiley: Advanced Materials: Table of Contents,2025-10-30 05:57:26+00:00
Dual‐Mode Afterglow of Organic–Inorganic Hybrid Metal Halides for Multi‐Dimensional Information Encryption,https://advanced.onlinelibrary.wiley.com/doi/10.1002/adma.202515658?af=R,2025-10-30 05:58:59 UTC,Wiley: Advanced Materials: Table of Contents,2025-10-30 05:58:59+00:00
In Science Journals,https://www.science.org/doi/abs/10.1126/science.aed4208?af=R,2025-10-30 06:00:11 UTC,AAAS: Science: Table of Contents,2025-10-30 06:00:11+00:00
How collaboration with China can revitalize US automotive innovation,https://www.science.org/doi/abs/10.1126/science.adz0541?af=R,2025-10-30 06:00:11 UTC,AAAS: Science: Table of Contents,2025-10-30 06:00:11+00:00
Fear protects. Until it doesn’t.: The brain learns to suppress instinctive defensive responses when threats prove harmless,https://www.science.org/doi/abs/10.1126/science.aeb5165?af=R,2025-10-30 06:00:11 UTC,AAAS: Science: Table of Contents,2025-10-30 06:00:11+00:00
Respecifying partners: Neural circuits are rewired by manipulating cell surface combinatorial code,https://www.science.org/doi/abs/10.1126/science.aeb5128?af=R,2025-10-30 06:00:11 UTC,AAAS: Science: Table of Contents,2025-10-30 06:00:11+00:00
White matters arising: Rethinking Alzheimer’s disease through the lens of myelin,https://www.science.org/doi/abs/10.1126/science.aeb5153?af=R,2025-10-30 06:00:11 UTC,AAAS: Science: Table of Contents,2025-10-30 06:00:11+00:00
Saving science by the sea,https://www.science.org/doi/abs/10.1126/science.aed1909?af=R,2025-10-30 06:00:11 UTC,AAAS: Science: Table of Contents,2025-10-30 06:00:11+00:00
"At a novel meeting, AI wrote and reviewed the papers",https://www.science.org/doi/abs/10.1126/science.aed4591?af=R,2025-10-30 06:00:11 UTC,AAAS: Science: Table of Contents,2025-10-30 06:00:11+00:00
Dangerous ocean acidification tracked using ambient noise,https://www.science.org/doi/abs/10.1126/science.aed4590?af=R,2025-10-30 06:00:11 UTC,AAAS: Science: Table of Contents,2025-10-30 06:00:11+00:00
How NSF floats Antarctic research with no icebreaker,https://www.science.org/doi/abs/10.1126/science.aed4589?af=R,2025-10-30 06:00:11 UTC,AAAS: Science: Table of Contents,2025-10-30 06:00:11+00:00
New antivenom is a ‘potential game changer’ for snakebites,https://www.science.org/doi/abs/10.1126/science.aed4588?af=R,2025-10-30 06:00:11 UTC,AAAS: Science: Table of Contents,2025-10-30 06:00:11+00:00
Europe faults Big Tech platforms for lack of research access,https://www.science.org/doi/abs/10.1126/science.aed4587?af=R,2025-10-30 06:00:11 UTC,AAAS: Science: Table of Contents,2025-10-30 06:00:11+00:00
Asian dust threatens air pollution control efforts,https://www.science.org/doi/abs/10.1126/science.aeb2629?af=R,2025-10-30 06:00:11 UTC,AAAS: Science: Table of Contents,2025-10-30 06:00:11+00:00
The silicon cell,https://www.science.org/doi/abs/10.1126/science.aed4210?af=R,2025-10-30 06:00:11 UTC,AAAS: Science: Table of Contents,2025-10-30 06:00:11+00:00
More than a miracle,https://www.science.org/doi/abs/10.1126/science.aeb9832?af=R,2025-10-30 06:00:11 UTC,AAAS: Science: Table of Contents,2025-10-30 06:00:11+00:00
The End of Everything (Astrophysically Speaking),https://www.science.org/doi/abs/10.1126/science.aec7043?af=R,2025-10-30 06:00:11 UTC,AAAS: Science: Table of Contents,2025-10-30 06:00:11+00:00
Extraterrestrials illustrated,https://www.science.org/doi/abs/10.1126/science.aeb1978?af=R,2025-10-30 06:00:11 UTC,AAAS: Science: Table of Contents,2025-10-30 06:00:11+00:00
Human RPA is an essential telomerase processivity factor for maintaining telomeres,https://www.science.org/doi/abs/10.1126/science.ads5297?af=R,2025-10-30 06:00:11 UTC,AAAS: Science: Table of Contents,2025-10-30 06:00:11+00:00
Genomic architecture of egg mimicry and its consequences for speciation in parasitic cuckoos,https://www.science.org/doi/abs/10.1126/science.adt9355?af=R,2025-10-30 06:00:11 UTC,AAAS: Science: Table of Contents,2025-10-30 06:00:11+00:00
Glycolysis-compatible urethanases for polyurethane recycling,https://www.science.org/doi/abs/10.1126/science.adw4487?af=R,2025-10-30 06:00:11 UTC,AAAS: Science: Table of Contents,2025-10-30 06:00:11+00:00
Collateral effects of COVID-19 pandemic control on the US infectious disease landscape,https://www.science.org/doi/abs/10.1126/science.adw4964?af=R,2025-10-30 06:00:11 UTC,AAAS: Science: Table of Contents,2025-10-30 06:00:11+00:00
Trace-level halogen blocks CO2 emission in Fischer-Tropsch synthesis for olefins production,https://www.science.org/doi/abs/10.1126/science.aea1655?af=R,2025-10-30 06:00:11 UTC,AAAS: Science: Table of Contents,2025-10-30 06:00:11+00:00
Supershear rupture sustained through a thick fault zone in the 2025 Mw 7.8 Mandalay earthquake,https://www.science.org/doi/abs/10.1126/science.adz2101?af=R,2025-10-30 06:00:11 UTC,AAAS: Science: Table of Contents,2025-10-30 06:00:11+00:00
Direct estimation of earthquake source properties from a single CCTV camera,https://www.science.org/doi/abs/10.1126/science.adz1705?af=R,2025-10-30 06:00:11 UTC,AAAS: Science: Table of Contents,2025-10-30 06:00:11+00:00
Argentine telescope caught in U.S.-China crossfire,https://www.science.org/doi/abs/10.1126/science.aed4586?af=R,2025-10-30 06:00:11 UTC,AAAS: Science: Table of Contents,2025-10-30 06:00:11+00:00
"Ultralong, supershear rupture of the 2025 Mw 7.7 Mandalay earthquake reveals unaccounted risk",https://www.science.org/doi/abs/10.1126/science.ady3581?af=R,2025-10-30 06:00:11 UTC,AAAS: Science: Table of Contents,2025-10-30 06:00:11+00:00
2025 Mandalay Earthquake,https://www.science.org/doi/abs/10.1126/science.aec3871?af=R,2025-10-30 06:00:11 UTC,AAAS: Science: Table of Contents,2025-10-30 06:00:11+00:00
Adjusting to retirement,https://www.science.org/doi/abs/10.1126/science.aed3663?af=R,2025-10-30 06:00:11 UTC,AAAS: Science: Table of Contents,2025-10-30 06:00:11+00:00
In Other Journals,https://www.science.org/doi/abs/10.1126/science.aed4209?af=R,2025-10-30 06:00:11 UTC,AAAS: Science: Table of Contents,2025-10-30 06:00:11+00:00
Mandalay earthquake pushes rupture limits,https://www.science.org/doi/abs/10.1126/science.aec0791?af=R,2025-10-30 06:00:11 UTC,AAAS: Science: Table of Contents,2025-10-30 06:00:11+00:00
How common cuckoos adapt to multiple hosts,https://www.science.org/doi/abs/10.1126/science.aec1973?af=R,2025-10-30 06:00:11 UTC,AAAS: Science: Table of Contents,2025-10-30 06:00:11+00:00
Broad benefits of the COVID-19 pandemic response,https://www.science.org/doi/abs/10.1126/science.aeb5722?af=R,2025-10-30 06:00:11 UTC,AAAS: Science: Table of Contents,2025-10-30 06:00:11+00:00
Two diverging paths for clean fuel,https://www.science.org/doi/abs/10.1126/science.aec1997?af=R,2025-10-30 06:00:11 UTC,AAAS: Science: Table of Contents,2025-10-30 06:00:11+00:00
Chimpanzees are natural scientists,https://www.science.org/doi/abs/10.1126/science.aeb7565?af=R,2025-10-30 06:00:11 UTC,AAAS: Science: Table of Contents,2025-10-30 06:00:11+00:00
Restore strict protection for wolves in Europe,https://www.science.org/doi/abs/10.1126/science.aeb0660?af=R,2025-10-30 06:00:11 UTC,AAAS: Science: Table of Contents,2025-10-30 06:00:11+00:00
A legendary request for narwhal DNA,https://www.science.org/doi/abs/10.1126/science.ady6674?af=R,2025-10-30 06:00:11 UTC,AAAS: Science: Table of Contents,2025-10-30 06:00:11+00:00
Chimpanzees rationally revise their beliefs,https://www.science.org/doi/abs/10.1126/science.adq5229?af=R,2025-10-30 06:00:11 UTC,AAAS: Science: Table of Contents,2025-10-30 06:00:11+00:00
Bimaterial effect and favorable energy ratio enabled supershear rupture in the 2025 Mandalay earthquake,https://www.science.org/doi/abs/10.1126/science.ady6100?af=R,2025-10-30 06:00:11 UTC,AAAS: Science: Table of Contents,2025-10-30 06:00:11+00:00
Electroactive Organic Cage as Efficient Adsorbent and Ultrasensitive Transistor Sensor for Trace Iodine,https://advanced.onlinelibrary.wiley.com/doi/10.1002/adma.202513678?af=R,2025-10-30 06:08:29 UTC,Wiley: Advanced Materials: Table of Contents,2025-10-30 06:08:29+00:00
Rare wolf spider rediscovered after 40 years,https://www.bbc.com/news/articles/ckg1y66y80ro?at_medium=RSS&at_campaign=rss,2025-10-30 06:09:35 UTC,BBC News,2025-10-30 06:09:35+00:00
Cleaning the scientific house: Rebuilding trust in science requires confronting the harms of ghostwriting,https://www.science.org/doi/abs/10.1126/science.aec4187?af=R,2025-10-30 07:00:00 UTC,AAAS: Science: Table of Contents,2025-10-30 07:00:00+00:00
Proximity to explosive synchronization determines network collapse and recovery trajectories in neural and economic crises,https://www.pnas.org/doi/abs/10.1073/pnas.2505434122?mi=eymic2&af=R&access=on&content=articlesChapters&publication=pnas&sortBy=Earliest&target=default,2025-10-30 07:00:00 UTC,Proceedings of the National Academy of Sciences: Keyword search for query,2025-10-30 07:00:00+00:00
Synaptobrevin-2 disease variants reveal spatial constraints within the presynaptic active zone,https://www.pnas.org/doi/abs/10.1073/pnas.2507347122?mi=eymic2&af=R&access=on&content=articlesChapters&publication=pnas&sortBy=Earliest&target=default,2025-10-30 07:00:00 UTC,Proceedings of the National Academy of Sciences: Keyword search for query,2025-10-30 07:00:00+00:00
Glycosaminoglycans activate peptidylarginine deiminase 4 by enhancing calcium affinity,https://www.pnas.org/doi/abs/10.1073/pnas.2508369122?mi=eymic2&af=R&access=on&content=articlesChapters&publication=pnas&sortBy=Earliest&target=default,2025-10-30 07:00:00 UTC,Proceedings of the National Academy of Sciences: Keyword search for query,2025-10-30 07:00:00+00:00
A natural allele of PC08 lost in domestication contributes to soybean seed storage protein accumulation,https://www.pnas.org/doi/abs/10.1073/pnas.2508709122?mi=eymic2&af=R&access=on&content=articlesChapters&publication=pnas&sortBy=Earliest&target=default,2025-10-30 07:00:00 UTC,Proceedings of the National Academy of Sciences: Keyword search for query,2025-10-30 07:00:00+00:00
Programming cellular condensates for living materials using an intrinsically disordered protein display platform,https://www.pnas.org/doi/abs/10.1073/pnas.2510167122?mi=eymic2&af=R&access=on&content=articlesChapters&publication=pnas&sortBy=Earliest&target=default,2025-10-30 07:00:00 UTC,Proceedings of the National Academy of Sciences: Keyword search for query,2025-10-30 07:00:00+00:00
WrtF from Rhizobium tropici CIAT 899 is a GT-A fold fucosyltransferase that binds its donor nonproductively,https://www.pnas.org/doi/abs/10.1073/pnas.2512460122?mi=eymic2&af=R&access=on&content=articlesChapters&publication=pnas&sortBy=Earliest&target=default,2025-10-30 07:00:00 UTC,Proceedings of the National Academy of Sciences: Keyword search for query,2025-10-30 07:00:00+00:00
Neutron crystallography of the covalent intermediate of β-glucosidase reveals remodeling of the catalytic center,https://www.pnas.org/doi/abs/10.1073/pnas.2502828122?mi=eymic2&af=R&access=on&content=articlesChapters&publication=pnas&sortBy=Earliest&target=default,2025-10-30 07:00:00 UTC,Proceedings of the National Academy of Sciences: Keyword search for query,2025-10-30 07:00:00+00:00
Reevaluation of whether histones are asymmetrically segregated during asymmetric divisions of stem cells in Drosophila,https://www.pnas.org/doi/abs/10.1073/pnas.2513015122?mi=eymic2&af=R&access=on&content=articlesChapters&publication=pnas&sortBy=Earliest&target=default,2025-10-30 07:00:00 UTC,Proceedings of the National Academy of Sciences: Keyword search for query,2025-10-30 07:00:00+00:00
Analgesia through FKBP51 inhibition at disease onset confers lasting relief from sensory and emotional chronic pain symptoms,https://www.pnas.org/doi/abs/10.1073/pnas.2517405122?mi=eymic2&af=R&access=on&content=articlesChapters&publication=pnas&sortBy=Earliest&target=default,2025-10-30 07:00:00 UTC,Proceedings of the National Academy of Sciences: Keyword search for query,2025-10-30 07:00:00+00:00
Automaticity speeds the retrieval of instances from the human hippocampus,https://www.pnas.org/doi/abs/10.1073/pnas.2518523122?mi=eymic2&af=R&access=on&content=articlesChapters&publication=pnas&sortBy=Earliest&target=default,2025-10-30 07:00:00 UTC,Proceedings of the National Academy of Sciences: Keyword search for query,2025-10-30 07:00:00+00:00
In vivo parcellation of the human superior colliculus from brain-wide probabilistic connectivity,https://www.pnas.org/doi/abs/10.1073/pnas.2518549122?mi=eymic2&af=R&access=on&content=articlesChapters&publication=pnas&sortBy=Earliest&target=default,2025-10-30 07:00:00 UTC,Proceedings of the National Academy of Sciences: Keyword search for query,2025-10-30 07:00:00+00:00
Parallel systems for social and spatial cognition reaching the cortical apex,https://www.pnas.org/doi/abs/10.1073/pnas.2520067122?mi=eymic2&af=R&access=on&content=articlesChapters&publication=pnas&sortBy=Earliest&target=default,2025-10-30 07:00:00 UTC,Proceedings of the National Academy of Sciences: Keyword search for query,2025-10-30 07:00:00+00:00
Rats pursue food and leisure following the same rational principles,https://www.pnas.org/doi/abs/10.1073/pnas.2520884122?mi=eymic2&af=R&access=on&content=articlesChapters&publication=pnas&sortBy=Earliest&target=default,2025-10-30 07:00:00 UTC,Proceedings of the National Academy of Sciences: Keyword search for query,2025-10-30 07:00:00+00:00
Accurate site-specific folding via conditional diffusion based on AlphaFold3,https://www.pnas.org/doi/abs/10.1073/pnas.2521048122?mi=eymic2&af=R&access=on&content=articlesChapters&publication=pnas&sortBy=Earliest&target=default,2025-10-30 07:00:00 UTC,Proceedings of the National Academy of Sciences: Keyword search for query,2025-10-30 07:00:00+00:00
A cell-based scrambling assay reveals the phospholipid headgroup preference of TMEM16F on the plasma membrane,https://www.pnas.org/doi/abs/10.1073/pnas.2516822122?mi=eymic2&af=R&access=on&content=articlesChapters&publication=pnas&sortBy=Earliest&target=default,2025-10-30 07:00:00 UTC,Proceedings of the National Academy of Sciences: Keyword search for query,2025-10-30 07:00:00+00:00
Divergent patterns of engagement with partisan and low-quality news across seven social media platforms,https://www.pnas.org/doi/abs/10.1073/pnas.2425739122?mi=eymic2&af=R&access=on&content=articlesChapters&publication=pnas&sortBy=Earliest&target=default,2025-10-30 07:00:00 UTC,Proceedings of the National Academy of Sciences: Keyword search for query,2025-10-30 07:00:00+00:00
Habenula–ventral tegmental area functional coupling and risk aversion in humans,https://www.pnas.org/doi/abs/10.1073/pnas.2500815122?mi=eymic2&af=R&access=on&content=articlesChapters&publication=pnas&sortBy=Earliest&target=default,2025-10-30 07:00:00 UTC,Proceedings of the National Academy of Sciences: Keyword search for query,2025-10-30 07:00:00+00:00
Hierarchical assembly of biomass fiber–lamella–macromolecule networks for biocomposites with high strength and water-resistant sealing,https://www.pnas.org/doi/abs/10.1073/pnas.2521173122?mi=eymic2&af=R&access=on&content=articlesChapters&publication=pnas&sortBy=Earliest&target=default,2025-10-30 07:00:00 UTC,Proceedings of the National Academy of Sciences: Keyword search for query,2025-10-30 07:00:00+00:00
LRP8 is an entry receptor for tick-borne encephalitis viruses,https://www.pnas.org/doi/abs/10.1073/pnas.2525771122?mi=eymic2&af=R&access=on&content=articlesChapters&publication=pnas&sortBy=Earliest&target=default,2025-10-30 07:00:00 UTC,Proceedings of the National Academy of Sciences: Keyword search for query,2025-10-30 07:00:00+00:00
Porous materials: The next frontier in energy technologies,https://www.science.org/doi/abs/10.1126/science.adn9391?af=R,2025-10-30 07:00:00 UTC,AAAS: Science: Table of Contents,2025-10-30 07:00:00+00:00
