title,link,published,source,pub_date
Water-catalyzed ultrafast formation of hydronium clusters,https://academic.oup.com/nsr/advance-article/doi/10.1093/nsr/nwag443/8736517?rss=1,2026-07-17 00:00:00 UTC,National Science Review Advance Access,2026-07-17 00:00:00+00:00
Man’s ability to make sperm restored after testicular tissue transplant: what scientists think,https://www.nature.com/articles/d41586-026-02191-3,2026-07-17 00:00:00 UTC,Nature,2026-07-17 00:00:00+00:00
Found: a rocky exoplanet with an atmosphere — could it host life?,https://www.nature.com/articles/d41586-026-02200-5,2026-07-17 00:00:00 UTC,Nature,2026-07-17 00:00:00+00:00
Can giant space mirrors boost green energy on Earth? A start-up aims to find out,https://www.nature.com/articles/d41586-026-02218-9,2026-07-17 00:00:00 UTC,Nature,2026-07-17 00:00:00+00:00
A Safe Shelter to Survive and Thrive in a Changing Climate,https://academic.oup.com/nsr/advance-article/doi/10.1093/nsr/nwag441/8736513?rss=1,2026-07-17 00:00:00 UTC,National Science Review Advance Access,2026-07-17 00:00:00+00:00
"Why pain hurts more when we’re lonely, and the myth of original sin: Books in brief",https://www.nature.com/articles/d41586-026-02264-3,2026-07-17 00:00:00 UTC,Nature,2026-07-17 00:00:00+00:00
Wearable sensors on the face are invisible to the eye,https://www.nature.com/articles/d41586-026-02193-1,2026-07-17 00:00:00 UTC,Nature,2026-07-17 00:00:00+00:00
Jammed interconnected bilayer emulsions as 3D-printable biological tissue mimics,https://www.nature.com/articles/s41563-026-02679-3,2026-07-17 00:00:00 UTC,Nature Materials,2026-07-17 00:00:00+00:00
Author Correction: Spatial assessment of tap-water safety in China,https://www.nature.com/articles/s41893-026-01911-x,2026-07-17 00:00:00 UTC,Nature Sustainability,2026-07-17 00:00:00+00:00
Briefing Chat: Sweet! Elusive sugar molecules found in space,https://www.nature.com/articles/d41586-026-02263-4,2026-07-17 00:00:00 UTC,Nature,2026-07-17 00:00:00+00:00
High-rate electro-photochemical alkane conversion to isoalcohols under ambient conditions,https://www.cell.com/joule/fulltext/S2542-4351(26)00270-9?rss=yes,2026-07-17 00:00:00 UTC,Joule,2026-07-17 00:00:00+00:00
Topology-engineered metallic glass metamaterial-supported NiMo nanoglass catalysts for ultra-efficient water splitting,https://academic.oup.com/nsr/advance-article/doi/10.1093/nsr/nwag442/8736522?rss=1,2026-07-17 00:00:00 UTC,National Science Review Advance Access,2026-07-17 00:00:00+00:00
Prominent Salk Institute biologist to resign following sexual misconduct investigation,https://www.science.org/content/article/prominent-salk-institute-biologist-resign-following-sexual-misconduct-investigation,2026-07-17 01:10:00 UTC,Latest News from Science Magazine,2026-07-17 01:10:00+00:00
U.K. government details plan for dramatic aid cuts to African nations,https://www.science.org/content/article/u-k-government-details-plan-dramatic-aid-cuts-african-nations,2026-07-17 02:50:00 UTC,Latest News from Science Magazine,2026-07-17 02:50:00+00:00
China’s detention of U.S. seismologist and data-sharing crackdown alarm researchers,https://www.science.org/content/article/china-s-detention-u-s-seismologist-and-data-sharing-crackdown-alarm-researchers,2026-07-17 04:30:00 UTC,Latest News from Science Magazine,2026-07-17 04:30:00+00:00
Curlew chicks released to boost species numbers,https://www.bbc.co.uk/news/articles/c6212gynxd5o?at_medium=RSS&at_campaign=rss,2026-07-17 05:06:18 UTC,BBC News,2026-07-17 05:06:18+00:00
Probe the Electron Spin Polarization of the Otherwise Unobservable 3MLCT Triplet State Through Polarization Transfer Accompanying the Intramolecular Triplet–Triplet Energy Transfer in Pt(II)‐Salen Schiff Base Complexes,https://onlinelibrary.wiley.com/doi/10.1002/anie.5596109?af=R,2026-07-17 05:17:54 UTC,Wiley: Angewandte Chemie International Edition: Table of Contents,2026-07-17 05:17:54+00:00
A Multidentate Coordination Complex‐Based Self‐Assembled Monolayer Stabilizes Perovskite Interface,https://onlinelibrary.wiley.com/doi/10.1002/anie.8080769?af=R,2026-07-17 05:19:22 UTC,Wiley: Angewandte Chemie International Edition: Table of Contents,2026-07-17 05:19:22+00:00
Cycloazulenylene,https://onlinelibrary.wiley.com/doi/10.1002/anie.2204400?af=R,2026-07-17 05:20:41 UTC,Wiley: Angewandte Chemie International Edition: Table of Contents,2026-07-17 05:20:41+00:00
Controlled Reactive Metal−Support Interactions in NiIn/CeO2 Catalysts for Enhanced Methanol Synthesis from CO2,https://onlinelibrary.wiley.com/doi/10.1002/anie.1906096?af=R,2026-07-17 05:21:53 UTC,Wiley: Angewandte Chemie International Edition: Table of Contents,2026-07-17 05:21:53+00:00
A Carbon‐Induced Surface Reconstruction on an Operating Fischer–Tropsch Catalyst,https://onlinelibrary.wiley.com/doi/10.1002/anie.5104870?af=R,2026-07-17 05:23:46 UTC,Wiley: Angewandte Chemie International Edition: Table of Contents,2026-07-17 05:23:46+00:00
Azole γ‐Peptides Helix Switching via Heterocycle Substitutions,https://onlinelibrary.wiley.com/doi/10.1002/anie.9299244?af=R,2026-07-17 05:23:49 UTC,Wiley: Angewandte Chemie International Edition: Table of Contents,2026-07-17 05:23:49+00:00
Water‐Derived Radical Species Initiate Six‐Electron Oxidation of Cyclic Ketones in Microdroplets,https://onlinelibrary.wiley.com/doi/10.1002/anie.1888676?af=R,2026-07-17 05:25:18 UTC,Wiley: Angewandte Chemie International Edition: Table of Contents,2026-07-17 05:25:18+00:00
"Hyundai, KR: operational guidelines for ammonia-fueled ships in South Korea",https://ammoniaenergy.org/articles/hyundai-kr-operational-guidelines-for-ammonia-fueled-ships-in-south-korea/,2026-07-17 05:26:36 UTC,Articles – Ammonia Energy Association,2026-07-17 05:26:36+00:00
Dynamic Ion‐Pair Networks Enable Selective Li+ Transport for Stable and Efficient Solid‐State Lithium‐Sulfur Batteries,https://onlinelibrary.wiley.com/doi/10.1002/anie.4252910?af=R,2026-07-17 05:26:41 UTC,Wiley: Angewandte Chemie International Edition: Table of Contents,2026-07-17 05:26:41+00:00
Biosynthesis of the Fully Saturated C16 Homosesquiterpene Descartane Through Deprotonation With Cyclopropanation,https://onlinelibrary.wiley.com/doi/10.1002/anie.1585472?af=R,2026-07-17 05:29:00 UTC,Wiley: Angewandte Chemie International Edition: Table of Contents,2026-07-17 05:29:00+00:00
Synergetic Relay of Phenoxyl‐Radical‐Mediated Oligomerization and Aromatic‐Ring‐Opening Processes for Organic Wastewater Treatment,https://onlinelibrary.wiley.com/doi/10.1002/anie.2359022?af=R,2026-07-17 05:30:44 UTC,Wiley: Angewandte Chemie International Edition: Table of Contents,2026-07-17 05:30:44+00:00
"Multirole Integrated Filler Design for Polymer‐in‐Salt Electrolytes Enables Long‐Life, Safe Solid‐State Lithium Batteries",https://onlinelibrary.wiley.com/doi/10.1002/anie.4049895?af=R,2026-07-17 05:34:48 UTC,Wiley: Angewandte Chemie International Edition: Table of Contents,2026-07-17 05:34:48+00:00
Taming a Blue Gas—Structure and Chemistry of Hexafluorothioacetone,https://onlinelibrary.wiley.com/doi/10.1002/anie.1044664?af=R,2026-07-17 05:42:52 UTC,Wiley: Angewandte Chemie International Edition: Table of Contents,2026-07-17 05:42:52+00:00
Trump administration ends dozens of grants for studying patient care,https://www.science.org/content/article/trump-administration-officially-ends-dozens-grants-studying-patient-care,2026-07-17 06:15:00 UTC,Latest News from Science Magazine,2026-07-17 06:15:00+00:00
"EnBW, Zelestra sign tolling deal for 300 MW of battery storage in Italy",https://www.ess-news.com/2026/07/17/enbw-zelestra-sign-tolling-deal-for-300-mw-of-battery-storage-in-italy/,2026-07-17 06:30:00 UTC,Latest news about ESS Projects & Applications | ESS News,2026-07-17 06:30:00+00:00
Ridge-assisted micro positioning of cells in a channel,https://www.science.org/doi/abs/10.1126/sciadv.aec9227?af=R,2026-07-17 07:00:00 UTC,AAAS: Science Advances: Table of Contents,2026-07-17 07:00:00+00:00
FGF21 induced by endoplasmic reticulum stress maintains medullary thymic epithelial cell function and central immune tolerance,https://www.science.org/doi/abs/10.1126/sciadv.aee9999?af=R,2026-07-17 07:00:00 UTC,AAAS: Science Advances: Table of Contents,2026-07-17 07:00:00+00:00
A distinct antigen presentation pathway drives potent T cell immunity in lipid nanoparticle–based mRNA vaccines,https://www.science.org/doi/abs/10.1126/sciadv.aec7827?af=R,2026-07-17 07:00:00 UTC,AAAS: Science Advances: Table of Contents,2026-07-17 07:00:00+00:00
Photoinduced anion exchange for spatially patterned perovskite ASE: Enabling full-color pixelated lasing displays,https://www.science.org/doi/abs/10.1126/sciadv.aef5186?af=R,2026-07-17 07:00:00 UTC,AAAS: Science Advances: Table of Contents,2026-07-17 07:00:00+00:00
Tailored forecasting from short time series via meta-learning,https://www.science.org/doi/abs/10.1126/sciadv.ady7216?af=R,2026-07-17 07:00:00 UTC,AAAS: Science Advances: Table of Contents,2026-07-17 07:00:00+00:00
Seamount subduction drives bonanza-grade gold mineralization,https://www.science.org/doi/abs/10.1126/sciadv.aef6613?af=R,2026-07-17 07:00:00 UTC,AAAS: Science Advances: Table of Contents,2026-07-17 07:00:00+00:00
PUM1 and PUM2 promote translation of chromatin regulators to ensure mammalian spermatogenesis,https://www.science.org/doi/abs/10.1126/sciadv.aed5708?af=R,2026-07-17 07:00:00 UTC,AAAS: Science Advances: Table of Contents,2026-07-17 07:00:00+00:00
Direct characterization of quantum dynamics via generalized weak values,https://www.science.org/doi/abs/10.1126/sciadv.aeb7304?af=R,2026-07-17 07:00:00 UTC,AAAS: Science Advances: Table of Contents,2026-07-17 07:00:00+00:00
Hyperwrinkling of the nuclear lamina is associated with attenuated mechanosensitivity in giant nucleated cancer cells,https://www.science.org/doi/abs/10.1126/sciadv.aed1645?af=R,2026-07-17 07:00:00 UTC,AAAS: Science Advances: Table of Contents,2026-07-17 07:00:00+00:00
Focused ultrasound blood-brain barrier opening reveals a paradoxical remote metabolic response in the primate brain,https://www.science.org/doi/abs/10.1126/sciadv.aed4944?af=R,2026-07-17 07:00:00 UTC,AAAS: Science Advances: Table of Contents,2026-07-17 07:00:00+00:00
Shaping of developmental gradients through selection on multiple loci in Antirrhinum,https://www.science.org/doi/abs/10.1126/sciadv.adx2011?af=R,2026-07-17 07:00:00 UTC,AAAS: Science Advances: Table of Contents,2026-07-17 07:00:00+00:00
The RhMPK3-RhLOB41-RhWRKY9 module orchestrates ethylene-induced petal abscission via dual control of ROS homeostasis in rose,https://www.science.org/doi/abs/10.1126/sciadv.adu6821?af=R,2026-07-17 07:00:00 UTC,AAAS: Science Advances: Table of Contents,2026-07-17 07:00:00+00:00
Extensive parasite transmission and variation in a functional receptor associated with drug resistance in endemic Schistosoma mansoni,https://www.science.org/doi/abs/10.1126/sciadv.adt3721?af=R,2026-07-17 07:00:00 UTC,AAAS: Science Advances: Table of Contents,2026-07-17 07:00:00+00:00
"Correction for Sudhakar et al., Human tumstatin and human endostatin exhibit distinct antiangiogenic activities mediated by αvβ3 and α5β1 integrins",https://www.pnas.org/doi/abs/10.1073/pnas.2622617123?mi=eymic2&af=R&access=on&content=articlesChapters&publication=pnas&sortBy=Earliest&target=default,2026-07-17 07:00:00 UTC,Proceedings of the National Academy of Sciences: Keyword search for query,2026-07-17 07:00:00+00:00
"Correction for Stöhr et al., Distinct synthetic Aβ prion strains producing different amyloid deposits in bigenic mice",https://www.pnas.org/doi/abs/10.1073/pnas.2622455123?mi=eymic2&af=R&access=on&content=articlesChapters&publication=pnas&sortBy=Earliest&target=default,2026-07-17 07:00:00 UTC,Proceedings of the National Academy of Sciences: Keyword search for query,2026-07-17 07:00:00+00:00
Reply to Cosgrove: Catalytic activity in expansin-like proteins does not explain wall creep but raises a flag,https://www.pnas.org/doi/abs/10.1073/pnas.2617956123?mi=eymic2&af=R&access=on&content=articlesChapters&publication=pnas&sortBy=Earliest&target=default,2026-07-17 07:00:00 UTC,Proceedings of the National Academy of Sciences: Keyword search for query,2026-07-17 07:00:00+00:00
"Reply to Zhou et al.: Exercise, caloric restriction, and immunotherapy responsiveness in 4T1 breast cancer progression",https://www.pnas.org/doi/abs/10.1073/pnas.2617811123?mi=eymic2&af=R&access=on&content=articlesChapters&publication=pnas&sortBy=Earliest&target=default,2026-07-17 07:00:00 UTC,Proceedings of the National Academy of Sciences: Keyword search for query,2026-07-17 07:00:00+00:00
When does exercise hinder rather than halt tumor progression? The decisive role of immunotherapy responsiveness,https://www.pnas.org/doi/abs/10.1073/pnas.2616250123?mi=eymic2&af=R&access=on&content=articlesChapters&publication=pnas&sortBy=Earliest&target=default,2026-07-17 07:00:00 UTC,Proceedings of the National Academy of Sciences: Keyword search for query,2026-07-17 07:00:00+00:00
Catalysis does not explain expansin-mediated wall creep: Distinguishing catalytic ERPs from creep-active expansins,https://www.pnas.org/doi/abs/10.1073/pnas.2615892123?mi=eymic2&af=R&access=on&content=articlesChapters&publication=pnas&sortBy=Earliest&target=default,2026-07-17 07:00:00 UTC,Proceedings of the National Academy of Sciences: Keyword search for query,2026-07-17 07:00:00+00:00
Simultaneous measurements of translation rate and transcriptome uncovers linked regulation within an active bacterial cell population,https://www.science.org/doi/abs/10.1126/sciadv.adz1707?af=R,2026-07-17 07:00:00 UTC,AAAS: Science Advances: Table of Contents,2026-07-17 07:00:00+00:00
Response duration tracks confidence,https://www.pnas.org/doi/abs/10.1073/pnas.2612367123?mi=eymic2&af=R&access=on&content=articlesChapters&publication=pnas&sortBy=Earliest&target=default,2026-07-17 07:00:00 UTC,Proceedings of the National Academy of Sciences: Keyword search for query,2026-07-17 07:00:00+00:00
Iron overload suppresses LKB1 and induces IL36G anti-tumor immunity in PDAC metastasis,https://www.science.org/doi/abs/10.1126/sciadv.adz8681?af=R,2026-07-17 07:00:00 UTC,AAAS: Science Advances: Table of Contents,2026-07-17 07:00:00+00:00
Mesenchymal stem cells receive adaptive islet–derived miR-151–containing sEVs to promote β cell compensation in obesity,https://www.science.org/doi/abs/10.1126/sciadv.adu4196?af=R,2026-07-17 07:00:00 UTC,AAAS: Science Advances: Table of Contents,2026-07-17 07:00:00+00:00
"Reconfigurable ferroelectric transistor array for embodied neuromorphic vision with hardware-native sensing, computing, and activation",https://www.science.org/doi/abs/10.1126/sciadv.aed9436?af=R,2026-07-17 07:00:00 UTC,AAAS: Science Advances: Table of Contents,2026-07-17 07:00:00+00:00
Mitigating surface structural disorder for high-performance near-infrared quantum dot light-emitting diodes,https://www.science.org/doi/abs/10.1126/sciadv.aeg2635?af=R,2026-07-17 07:00:00 UTC,AAAS: Science Advances: Table of Contents,2026-07-17 07:00:00+00:00
Single-cell and spatial omics reveals region-specific plasticity and therapeutic vulnerabilities in metastatic high-risk neuroblastoma,https://www.science.org/doi/abs/10.1126/sciadv.aec6749?af=R,2026-07-17 07:00:00 UTC,AAAS: Science Advances: Table of Contents,2026-07-17 07:00:00+00:00
Picosecond switching of magnetic tunnel junctions by spin-orbit torque,https://www.science.org/doi/abs/10.1126/sciadv.aed0607?af=R,2026-07-17 07:00:00 UTC,AAAS: Science Advances: Table of Contents,2026-07-17 07:00:00+00:00
iPLA2β: A novel store-operated calcium entry modulator contributing to muscle dysfunction during denervation,https://www.science.org/doi/abs/10.1126/sciadv.aed1646?af=R,2026-07-17 07:00:00 UTC,AAAS: Science Advances: Table of Contents,2026-07-17 07:00:00+00:00
ALR couples IMS redox and heme biosynthesis beyond the disulfide relay,https://www.science.org/doi/abs/10.1126/sciadv.aed2430?af=R,2026-07-17 07:00:00 UTC,AAAS: Science Advances: Table of Contents,2026-07-17 07:00:00+00:00
3D topologically polarized elastic metamaterials enable asymmetric energy isolation at finite frequencies,https://www.science.org/doi/abs/10.1126/sciadv.aec6144?af=R,2026-07-17 07:00:00 UTC,AAAS: Science Advances: Table of Contents,2026-07-17 07:00:00+00:00
Linking functional and structural dendritic spine remodeling during fear learning and extinction in vivo,https://www.science.org/doi/abs/10.1126/sciadv.aec3961?af=R,2026-07-17 07:00:00 UTC,AAAS: Science Advances: Table of Contents,2026-07-17 07:00:00+00:00
Methane oxidation in African and European rivers depends on stream size and wetland connectivity,https://www.science.org/doi/abs/10.1126/sciadv.aeb8250?af=R,2026-07-17 07:00:00 UTC,AAAS: Science Advances: Table of Contents,2026-07-17 07:00:00+00:00
A neurocutaneous NaV1.8 channelopathy underlies a genetic subtype of primary idiopathic hyperhidrosis,https://www.science.org/doi/abs/10.1126/sciadv.aed3221?af=R,2026-07-17 07:00:00 UTC,AAAS: Science Advances: Table of Contents,2026-07-17 07:00:00+00:00
Low-temperature alcoholysis as a strategy for polyethylene terephthalate recycling and upcycling,https://www.science.org/doi/abs/10.1126/sciadv.aed4780?af=R,2026-07-17 07:00:00 UTC,AAAS: Science Advances: Table of Contents,2026-07-17 07:00:00+00:00
SORLA up-regulation suppresses pathological effects in aged tauopathy mouse brain,https://www.science.org/doi/abs/10.1126/sciadv.aed6825?af=R,2026-07-17 07:00:00 UTC,AAAS: Science Advances: Table of Contents,2026-07-17 07:00:00+00:00
High-resolution cryo-EM structure of integrin αIIbβ3 bound to disease-causing maternal HPA-1a antibody that blocks integrin activation,https://www.science.org/doi/abs/10.1126/sciadv.aed9833?af=R,2026-07-17 07:00:00 UTC,AAAS: Science Advances: Table of Contents,2026-07-17 07:00:00+00:00
Thermodynamic control of Cu-I nanotopologies enables solar-driven CO2-to-multicarbon conversion,https://www.science.org/doi/abs/10.1126/sciadv.aec6434?af=R,2026-07-17 07:00:00 UTC,AAAS: Science Advances: Table of Contents,2026-07-17 07:00:00+00:00
Central nervous system B cell multiomics reveals a legacy of immune dysregulation in long-term treated HIV infection,https://www.science.org/doi/abs/10.1126/sciadv.aee1278?af=R,2026-07-17 07:00:00 UTC,AAAS: Science Advances: Table of Contents,2026-07-17 07:00:00+00:00
Fibroblast-specific ablation of MHC-I antigen presentation via the IGF2 axis cripples CD8+ T cell surveillance in lung cancer,https://www.science.org/doi/abs/10.1126/sciadv.aee5738?af=R,2026-07-17 07:00:00 UTC,AAAS: Science Advances: Table of Contents,2026-07-17 07:00:00+00:00
Optical-based stretchable multimodal sensors for detecting strain and light with periodic buckling structures,https://www.science.org/doi/abs/10.1126/sciadv.aee9547?af=R,2026-07-17 07:00:00 UTC,AAAS: Science Advances: Table of Contents,2026-07-17 07:00:00+00:00
The origin of Cretaceous-Palaeogene impactor revealed by nickel isotopes,https://www.science.org/doi/abs/10.1126/sciadv.aef4858?af=R,2026-07-17 07:00:00 UTC,AAAS: Science Advances: Table of Contents,2026-07-17 07:00:00+00:00
A deep learning model for predicting daily PM2.5 concentration in response to emission reduction,https://www.science.org/doi/abs/10.1126/sciadv.aef5759?af=R,2026-07-17 07:00:00 UTC,AAAS: Science Advances: Table of Contents,2026-07-17 07:00:00+00:00
Microbubble-activated CO2 regeneration in scalable microporous liquids enabled by contact electrocatalysis,https://www.science.org/doi/abs/10.1126/sciadv.aef9017?af=R,2026-07-17 07:00:00 UTC,AAAS: Science Advances: Table of Contents,2026-07-17 07:00:00+00:00
Asymmetric radical NHC organocatalysis–enabled highly enantioselective acylation of inert C(sp2)─C(sp3) bonds,https://www.science.org/doi/abs/10.1126/sciadv.aeg0999?af=R,2026-07-17 07:00:00 UTC,AAAS: Science Advances: Table of Contents,2026-07-17 07:00:00+00:00
When trust building looks like surveillance: Public polarization toward Chicago policing,https://www.science.org/doi/abs/10.1126/sciadv.aeb7575?af=R,2026-07-17 07:00:00 UTC,AAAS: Science Advances: Table of Contents,2026-07-17 07:00:00+00:00
Disease landscape–guided design of neutrophil-specific reporters for early and accurate pneumonia detection in vivo and in urine,https://www.science.org/doi/abs/10.1126/sciadv.aeb4417?af=R,2026-07-17 07:00:00 UTC,AAAS: Science Advances: Table of Contents,2026-07-17 07:00:00+00:00
Global warming makes nitrogen oxide abatement key to ozone pollution mitigation,https://www.science.org/doi/abs/10.1126/sciadv.aea4124?af=R,2026-07-17 07:00:00 UTC,AAAS: Science Advances: Table of Contents,2026-07-17 07:00:00+00:00
Reversed functional gradient in primate prefrontal cortex: Posterior dominance and frontopolar task-related deactivation,https://www.science.org/doi/abs/10.1126/sciadv.aea1094?af=R,2026-07-17 07:00:00 UTC,AAAS: Science Advances: Table of Contents,2026-07-17 07:00:00+00:00
Albumin binding improves the pharmacokinetics and therapeutic efficacy of a 177Lu-labeled HER2 Fab radioconjugate,https://www.science.org/doi/abs/10.1126/sciadv.aee4052?af=R,2026-07-17 07:00:00 UTC,AAAS: Science Advances: Table of Contents,2026-07-17 07:00:00+00:00
Polarons are probes of the dynamic nanoscale environments found in electrochemically doped π-conjugated polymers,https://www.pnas.org/doi/abs/10.1073/pnas.2615650123?mi=eymic2&af=R&access=on&content=articlesChapters&publication=pnas&sortBy=Earliest&target=default,2026-07-17 07:00:00 UTC,Proceedings of the National Academy of Sciences: Keyword search for query,2026-07-17 07:00:00+00:00
Varicose projection astrocytes: Conserved reactive cells in brain pathology,https://www.science.org/doi/abs/10.1126/sciadv.ady8204?af=R,2026-07-17 07:00:00 UTC,AAAS: Science Advances: Table of Contents,2026-07-17 07:00:00+00:00
The accuracy of electrostatic interactions captured by AI protein structure prediction models,https://www.pnas.org/doi/abs/10.1073/pnas.2609610123?mi=eymic2&af=R&access=on&content=articlesChapters&publication=pnas&sortBy=Earliest&target=default,2026-07-17 07:00:00 UTC,Proceedings of the National Academy of Sciences: Keyword search for query,2026-07-17 07:00:00+00:00
"Relative Thom conjectures, symplectic and beyond",https://www.pnas.org/doi/abs/10.1073/pnas.2536898123?mi=eymic2&af=R&access=on&content=articlesChapters&publication=pnas&sortBy=Earliest&target=default,2026-07-17 07:00:00 UTC,Proceedings of the National Academy of Sciences: Keyword search for query,2026-07-17 07:00:00+00:00
Active thermodynamics of inertial chiral active gases: Equation of state and edge currents,https://www.pnas.org/doi/abs/10.1073/pnas.2532158123?mi=eymic2&af=R&access=on&content=articlesChapters&publication=pnas&sortBy=Earliest&target=default,2026-07-17 07:00:00 UTC,Proceedings of the National Academy of Sciences: Keyword search for query,2026-07-17 07:00:00+00:00
Hybrid Amyloid–Boron Nitride Aerogels for Lightweight Sound Insulation,https://advanced.onlinelibrary.wiley.com/doi/10.1002/adma.74088?af=R,2026-07-17 07:00:00 UTC,Wiley: Advanced Materials: Table of Contents,2026-07-17 07:00:00+00:00
Hysteresis Inversion Driven by Polar‐Order Competition in van der Waals Ferrielectric,https://advanced.onlinelibrary.wiley.com/doi/10.1002/adma.74102?af=R,2026-07-17 07:07:05 UTC,Wiley: Advanced Materials: Table of Contents,2026-07-17 07:07:05+00:00
Superwetting Framework Polymer Membranes Enabling Fast TFSI− Conduction for Nonaqueous Redox Flow Batteries,https://advanced.onlinelibrary.wiley.com/doi/10.1002/adma.74164?af=R,2026-07-17 07:15:32 UTC,Wiley: Advanced Materials: Table of Contents,2026-07-17 07:15:32+00:00
Leveraging Mitochondria‐Endoplasmic Reticulum Functional Interplay With an On‐Demand Nanoparticle to Boost mtDNA‐Based STING Immunotherapy,https://advanced.onlinelibrary.wiley.com/doi/10.1002/adma.74146?af=R,2026-07-17 07:17:22 UTC,Wiley: Advanced Materials: Table of Contents,2026-07-17 07:17:22+00:00
A CO2‐Mediated Li‐O2 Battery With 3.3 V Discharge Voltage,https://onlinelibrary.wiley.com/doi/10.1002/anie.4071427?af=R,2026-07-17 07:17:22 UTC,Wiley: Angewandte Chemie International Edition: Table of Contents,2026-07-17 07:17:22+00:00
Solar‐Driven CO2‐Mediated Upcycling of Waste Plastics Into Value‐Added Syngas and Carbon Nanotubes,https://onlinelibrary.wiley.com/doi/10.1002/anie.2880918?af=R,2026-07-17 07:18:24 UTC,Wiley: Angewandte Chemie International Edition: Table of Contents,2026-07-17 07:18:24+00:00
Sulfur‐to‐Metal Single‐Atom Editing of a Thiourea Self‐Assembled Monolayer into an Adatom‐Bound N‐Heterocyclic Carbene Monolayer on Coinage Metal Surfaces,https://onlinelibrary.wiley.com/doi/10.1002/anie.3064564?af=R,2026-07-17 07:20:08 UTC,Wiley: Angewandte Chemie International Edition: Table of Contents,2026-07-17 07:20:08+00:00
Engineering Tandem Catalysis for Direct CO2‐Enabled N‐Methylaniline Synthesis With a Fixed‐Bed Flow Reaction Process,https://onlinelibrary.wiley.com/doi/10.1002/anie.3089595?af=R,2026-07-17 07:21:54 UTC,Wiley: Angewandte Chemie International Edition: Table of Contents,2026-07-17 07:21:54+00:00
Skeletal Reorganization of Cycloalkylamines Into Angular Azatetracyclic Scaffolds,https://onlinelibrary.wiley.com/doi/10.1002/anie.3086835?af=R,2026-07-17 07:22:45 UTC,Wiley: Angewandte Chemie International Edition: Table of Contents,2026-07-17 07:22:45+00:00
CeOx‐Induced Spatial and Electronic Modulation for General Direct Oxo Coupling in Transition Metal Hydroxides,https://onlinelibrary.wiley.com/doi/10.1002/anie.6104492?af=R,2026-07-17 07:23:32 UTC,Wiley: Angewandte Chemie International Edition: Table of Contents,2026-07-17 07:23:32+00:00
Flavin Catalysts in Organic Synthesis,https://onlinelibrary.wiley.com/doi/10.1002/anie.6683110?af=R,2026-07-17 07:26:00 UTC,Wiley: Angewandte Chemie International Edition: Table of Contents,2026-07-17 07:26:00+00:00
