title,link,published,source,pub_date,doi,abstract,abstract_source
Structural insights into clonal restriction and diversity in T cell recognition of two immunodominant SARS-CoV-2 nucleocapsid epitopes,https://www.nature.com/articles/s41467-025-66322-6,2025-12-10 00:00:00 UTC,Nature Communications,2025-12-10 00:00:00+00:00,,,
Rising worldwide challenges to climate-induced extreme low-production events of photovoltaic and wind power,https://www.nature.com/articles/s41467-025-67428-7,2025-12-10 00:00:00 UTC,Nature Communications,2025-12-10 00:00:00+00:00,,,
PTEN regulates vagal-insulin signaling to optimize autonomic output determining peripheral inflammatory and metabolic homeostasis,https://www.nature.com/articles/s41467-025-67192-8,2025-12-10 00:00:00 UTC,Nature Communications,2025-12-10 00:00:00+00:00,,,
Author Correction: Activating newborn neurons suppresses depression and anxiety-like behaviors,https://www.nature.com/articles/s41467-025-66664-1,2025-12-10 00:00:00 UTC,Nature Communications,2025-12-10 00:00:00+00:00,,,
Human gut M cells resemble dendritic cells and present gluten antigen,https://www.nature.com/articles/s41586-025-09829-8,2025-12-10 00:00:00 UTC,Nature,2025-12-10 00:00:00+00:00,,,
Gene-drive-capable mosquitoes suppress patient-derived malaria in Tanzania,https://www.nature.com/articles/s41586-025-09685-6,2025-12-10 00:00:00 UTC,Nature,2025-12-10 00:00:00+00:00,,,
Thermodynamically stable colloid dispersion electrolytes with Tyndall effect for practical zinc-ion pouch cells,http://pubs.rsc.org/en/Content/ArticleLanding/2025/EE/D5EE05434F,2025-12-10 00:00:00 UTC,RSC - Energy Environ. Sci. latest articles,2025-12-10 00:00:00+00:00,,,
A strategic tuning of interfacial Li+ solvation with ultrathin polymer layers for anode-free lithium metal batteries,https://www.cell.com/joule/fulltext/S2542-4351(25)00407-6?rss=yes,2025-12-10 00:00:00 UTC,Joule,2025-12-10 00:00:00+00:00,,,
Six highlights from pancreatic cancer research,https://www.nature.com/articles/d41586-025-03948-y,2025-12-10 00:00:00 UTC,Nature,2025-12-10 00:00:00+00:00,,,
Observation of deuteron and antideuteron formation from resonance-decay nucleons,https://www.nature.com/articles/s41586-025-09775-5,2025-12-10 00:00:00 UTC,Nature,2025-12-10 00:00:00+00:00,,,
"Recent advances in stable halide perovskite nanocrystals for optoelectronic devices, biological imaging, and X-ray detection",http://pubs.rsc.org/en/Content/ArticleLanding/2025/CS/D5CS00230C,2025-12-10 00:00:00 UTC,RSC - Chem. Soc. Rev. latest articles,2025-12-10 00:00:00+00:00,,,
Earliest evidence of making fire,https://www.nature.com/articles/s41586-025-09855-6,2025-12-10 00:00:00 UTC,Nature,2025-12-10 00:00:00+00:00,,,
The influence of short-lived halogens on atmospheric chemistry and climate,https://www.nature.com/articles/s41586-025-09753-x,2025-12-10 00:00:00 UTC,Nature,2025-12-10 00:00:00+00:00,,,
Causal modelling of gene effects from regulators to programs to traits,https://www.nature.com/articles/s41586-025-09866-3,2025-12-10 00:00:00 UTC,Nature,2025-12-10 00:00:00+00:00,,,
SOS: RNA-processing mechanism rescues genes from invasive DNA,https://www.nature.com/articles/d41586-025-03734-w,2025-12-10 00:00:00 UTC,Nature,2025-12-10 00:00:00+00:00,,,
Genetically engineered mosquitoes block development of circulating malaria strains,https://www.nature.com/articles/d41586-025-03577-5,2025-12-10 00:00:00 UTC,Nature,2025-12-10 00:00:00+00:00,,,
A guide to the Nature Index,https://www.nature.com/articles/d41586-025-03952-2,2025-12-10 00:00:00 UTC,Nature,2025-12-10 00:00:00+00:00,,,
The pancreatic cancer models helping to drive innovation in the field,https://www.nature.com/articles/d41586-025-03944-2,2025-12-10 00:00:00 UTC,Nature,2025-12-10 00:00:00+00:00,,,
China is leading the world on AI governance: other countries must engage,https://www.nature.com/articles/d41586-025-03972-y,2025-12-10 00:00:00 UTC,Nature,2025-12-10 00:00:00+00:00,,,
Four young universities share their strategies for success,https://www.nature.com/articles/d41586-025-03951-3,2025-12-10 00:00:00 UTC,Nature,2025-12-10 00:00:00+00:00,,,
A simple slipknot for precise force control,https://www.nature.com/articles/d41586-025-03829-4,2025-12-10 00:00:00 UTC,Nature,2025-12-10 00:00:00+00:00,,,
Nuclear clocks could use electrical signals to keep time,https://www.nature.com/articles/d41586-025-03732-y,2025-12-10 00:00:00 UTC,Nature,2025-12-10 00:00:00+00:00,,,
Huge genetic study reveals hidden links between psychiatric conditions,https://www.nature.com/articles/d41586-025-04037-w,2025-12-10 00:00:00 UTC,Nature,2025-12-10 00:00:00+00:00,,,
Mutations in mitochondrial ferredoxin FDX2 suppress frataxin deficiency,https://www.nature.com/articles/s41586-025-09821-2,2025-12-10 00:00:00 UTC,Nature,2025-12-10 00:00:00+00:00,,,
Therapeutic vaccines can challenge pancreatic cancer before it takes hold,https://www.nature.com/articles/d41586-025-03947-z,2025-12-10 00:00:00 UTC,Nature,2025-12-10 00:00:00+00:00,,,
The brain’s speech centre responds to universal and specific features of language,https://www.nature.com/articles/d41586-025-03827-6,2025-12-10 00:00:00 UTC,Nature,2025-12-10 00:00:00+00:00,,,
Shared genetic risk in psychiatric disorders,https://www.nature.com/articles/d41586-025-03728-8,2025-12-10 00:00:00 UTC,Nature,2025-12-10 00:00:00+00:00,,,
Sterilization and contraception increase lifespan across vertebrates,https://www.nature.com/articles/s41586-025-09836-9,2025-12-10 00:00:00 UTC,Nature,2025-12-10 00:00:00+00:00,,,
Oldest known evidence of the controlled ignition of fire,https://www.nature.com/articles/d41586-025-03735-9,2025-12-10 00:00:00 UTC,Nature,2025-12-10 00:00:00+00:00,,,
A giant catalogue of microscopic species across Denmark,https://www.nature.com/articles/d41586-025-03819-6,2025-12-10 00:00:00 UTC,Nature,2025-12-10 00:00:00+00:00,,,
Is your brain tired? Researchers are discovering the roots of mental fatigue,https://www.nature.com/articles/d41586-025-03974-w,2025-12-10 00:00:00 UTC,Nature,2025-12-10 00:00:00+00:00,,,
Early detection could improve pancreatic cancer’s poor survival rates,https://www.nature.com/articles/d41586-025-03945-1,2025-12-10 00:00:00 UTC,Nature,2025-12-10 00:00:00+00:00,,,
What would an AI university look like and how might it change education?,https://www.nature.com/articles/d41586-025-03950-4,2025-12-10 00:00:00 UTC,Nature,2025-12-10 00:00:00+00:00,,,
Self-Optimizing Metal-Free Porous Reactors with Dynamic Active Sites Unlock Record Oxygen Reduction Activity,http://pubs.rsc.org/en/Content/ArticleLanding/2026/EE/D5EE03645C,2025-12-10 00:00:00 UTC,RSC - Energy Environ. Sci. latest articles,2025-12-10 00:00:00+00:00,,,
Quantifying grain boundary deformation mechanisms in small-grained metals,https://www.nature.com/articles/s41586-025-09800-7,2025-12-10 00:00:00 UTC,Nature,2025-12-10 00:00:00+00:00,,,
Photoswitchable latent monomers enable on‑demand metathesis,https://www.nature.com/articles/s41557-025-02013-5,2025-12-10 00:00:00 UTC,Nature Chemistry,2025-12-10 00:00:00+00:00,,,
But only just,https://www.nature.com/articles/d41586-025-04022-3,2025-12-10 00:00:00 UTC,Nature,2025-12-10 00:00:00+00:00,,,
Peering into cracked cathodes,https://www.nature.com/articles/s41563-025-02428-y,2025-12-10 00:00:00 UTC,Nature Materials,2025-12-10 00:00:00+00:00,,,
Low-nickel cathode chemistry for sustainable and high-energy lithium-ion batteries,https://www.nature.com/articles/s41893-025-01704-8,2025-12-10 00:00:00 UTC,Nature Sustainability,2025-12-10 00:00:00+00:00,,,
Hydrogel–elastomer-based conductive nanomembranes for soft bioelectronics,https://www.nature.com/articles/s41565-025-02031-x,2025-12-10 00:00:00 UTC,Nature Nanotechnology,2025-12-10 00:00:00+00:00,,,
"Global joint climate action is indispensable, but the time is running out",https://academic.oup.com/nsr/advance-article/doi/10.1093/nsr/nwaf564/8376640?rss=1,2025-12-10 00:00:00 UTC,National Science Review Advance Access,2025-12-10 00:00:00+00:00,,,
Bound to entangle,https://www.nature.com/articles/s41563-025-02437-x,2025-12-10 00:00:00 UTC,Nature Materials,2025-12-10 00:00:00+00:00,,,
Cross-regulation of [2Fe–2S] cluster synthesis by ferredoxin-2 and frataxin,https://www.nature.com/articles/s41586-025-09822-1,2025-12-10 00:00:00 UTC,Nature,2025-12-10 00:00:00+00:00,,,
A breathalyser-style test for detecting pancreatic cancer,https://www.nature.com/articles/d41586-025-03946-0,2025-12-10 00:00:00 UTC,Nature,2025-12-10 00:00:00+00:00,,,
"Gut micro-organisms associated with health, nutrition and dietary interventions",https://www.nature.com/articles/s41586-025-09854-7,2025-12-10 00:00:00 UTC,Nature,2025-12-10 00:00:00+00:00,,,
Revitalizing multifunctionality of Li-Al-O system enabling mother-powder-free sintering of garnet-type solid electrolytes,https://www.sciencedirect.com/science/article/pii/S1369702125005139?dgcid=rss_sd_all,2025-12-10 00:00:00 UTC,ScienceDirect Publication: Materials Today,2025-12-10 00:00:00+00:00,,,
Pancreatic cancer is evasive. Is the nervous system the reason why?,https://www.nature.com/articles/d41586-025-03943-3,2025-12-10 00:00:00 UTC,Nature,2025-12-10 00:00:00+00:00,,,
Cell-free immuno-profiling on a genetically programmed biochip,https://www.nature.com/articles/s41565-025-02058-0,2025-12-10 00:00:00 UTC,Nature Nanotechnology,2025-12-10 00:00:00+00:00,,,
Replenishing sapped groundwater could trigger small earthquakes,https://www.science.org/content/article/replenishing-sapped-groundwater-could-trigger-small-earthquakes,2025-12-10 03:00:00 UTC,Latest News from Science Magazine,2025-12-10 03:00:00+00:00,,,
"Iain Douglas-Hamilton, pioneering elephant conservationist, dies aged 83",https://www.bbc.com/news/articles/cwyx8yj410po?at_medium=RSS&at_campaign=rss,2025-12-10 03:37:06 UTC,BBC News,2025-12-10 03:37:06+00:00,,,
U.S. military funds AI tools to speed modeling of viral outbreaks,https://www.science.org/content/article/u-s-military-funds-ai-tools-speed-modeling-viral-outbreaks,2025-12-10 04:15:00 UTC,Latest News from Science Magazine,2025-12-10 04:15:00+00:00,,,
A new preprint server welcomes papers written and reviewed by AI,https://www.science.org/content/article/new-preprint-server-welcomes-papers-written-and-reviewed-ai,2025-12-10 05:25:00 UTC,Latest News from Science Magazine,2025-12-10 05:25:00+00:00,,,
Humidity‐Gated Memristive Dynamics Enabling Near‐Sensor Spiking Computation for Wind Direction and Noise‐Resilient Speech Recognition,https://advanced.onlinelibrary.wiley.com/doi/10.1002/adma.202518105?af=R,2025-12-10 06:21:54 UTC,Wiley: Advanced Materials: Table of Contents,2025-12-10 06:21:54+00:00,,,
Tunnel Thin‐Film Transistors for Ultralow‐Power and High‐Performance Flexible Electronics,https://advanced.onlinelibrary.wiley.com/doi/10.1002/adma.202517266?af=R,2025-12-10 06:23:48 UTC,Wiley: Advanced Materials: Table of Contents,2025-12-10 06:23:48+00:00,,,
Hygroscopic V‐MOF Layer Enabling Stable Zn‐Ion Batteries Under Fast and Deep Charging/Discharging,https://advanced.onlinelibrary.wiley.com/doi/10.1002/aenm.202505767?af=R,2025-12-10 06:27:20 UTC,Wiley: Advanced Energy Materials: Table of Contents,2025-12-10 06:27:20+00:00,,,
Decoupling the Failure Mechanism of 360 Wh kg−1 Lithium‐Ion Pouch Cell During Overcharging,https://advanced.onlinelibrary.wiley.com/doi/10.1002/adma.202518298?af=R,2025-12-10 06:27:28 UTC,Wiley: Advanced Materials: Table of Contents,2025-12-10 06:27:28+00:00,,,
Harnessing Interfacial Electronic Effects to Advance Electrocatalytic Ammonia Synthesis,https://advanced.onlinelibrary.wiley.com/doi/10.1002/aenm.202505289?af=R,2025-12-10 06:29:34 UTC,Wiley: Advanced Energy Materials: Table of Contents,2025-12-10 06:29:34+00:00,,,
Circularly Polarized Polariton Lasing from Spin‐Momentum Locking in Deformed Plasmonic Kagome Cavities,https://advanced.onlinelibrary.wiley.com/doi/10.1002/adma.202514310?af=R,2025-12-10 06:29:49 UTC,Wiley: Advanced Materials: Table of Contents,2025-12-10 06:29:49+00:00,,,
Directional Flow of Confined Polaritons in CrSBr,https://advanced.onlinelibrary.wiley.com/doi/10.1002/adma.202512557?af=R,2025-12-10 06:30:25 UTC,Wiley: Advanced Materials: Table of Contents,2025-12-10 06:30:25+00:00,,,
Bench‐Stable Boryl Thianthrenium Dication Enables Aziridinyl Boronate Synthesis via Metal‐Free Late‐Stage Aziridination with Diverse Nitrogen Nucleophiles,https://onlinelibrary.wiley.com/doi/10.1002/anie.202520969?af=R,2025-12-10 06:31:54 UTC,Wiley: Angewandte Chemie International Edition: Table of Contents,2025-12-10 06:31:54+00:00,,,
Dynamic Li+ Respiration Effect Enables Cascade Conversion of Lithium Polysulfides for Li–S Batteries,https://onlinelibrary.wiley.com/doi/10.1002/anie.202524645?af=R,2025-12-10 06:39:36 UTC,Wiley: Angewandte Chemie International Edition: Table of Contents,2025-12-10 06:39:36+00:00,,,
Ni‐Doped ZnIn2S4 Piezophotocatalysts for 100% Selective Stoichiometric Conversion of Glucose to Arabinose and Formic Acid With Concurrent Hydrogen Evolution From Water,https://advanced.onlinelibrary.wiley.com/doi/10.1002/aenm.202505106?af=R,2025-12-10 06:40:03 UTC,Wiley: Advanced Energy Materials: Table of Contents,2025-12-10 06:40:03+00:00,,,
Regulating *H Dynamics via Photoinduced Oxygen Vacancy‐Lattice Oxygen Frustrated Lewis Pairs for Superior CO2 Photoreduction,https://onlinelibrary.wiley.com/doi/10.1002/anie.202517024?af=R,2025-12-10 06:41:10 UTC,Wiley: Angewandte Chemie International Edition: Table of Contents,2025-12-10 06:41:10+00:00,,,
"Novel Sulfonium Reagents for the Modular Synthesis of Spiro[2.3]Hexanes and Heteroatom‐Containing Analogues: Synthesis, Application, and Evaluation as Bioisosteres",https://onlinelibrary.wiley.com/doi/10.1002/anie.202521633?af=R,2025-12-10 06:41:45 UTC,Wiley: Angewandte Chemie International Edition: Table of Contents,2025-12-10 06:41:45+00:00,,,
A Quantitative Water‐Speciation Identification Strategy Enables Efficient Four‐Electron Conversion in Aqueous Zn‐I2 Batteries,https://advanced.onlinelibrary.wiley.com/doi/10.1002/aenm.202505649?af=R,2025-12-10 06:41:49 UTC,Wiley: Advanced Energy Materials: Table of Contents,2025-12-10 06:41:49+00:00,,,
Molecularly Engineered Memristors for Reconfigurable Neuromorphic Functionalities,https://advanced.onlinelibrary.wiley.com/doi/10.1002/adma.202509143?af=R,2025-12-10 06:44:30 UTC,Wiley: Advanced Materials: Table of Contents,2025-12-10 06:44:30+00:00,,,
Excited State Modulation of Copper Clusters Realized by Single‐Site Alteration Achieving Near‐Infrared Luminescence,https://onlinelibrary.wiley.com/doi/10.1002/anie.202518017?af=R,2025-12-10 06:48:10 UTC,Wiley: Angewandte Chemie International Edition: Table of Contents,2025-12-10 06:48:10+00:00,,,
Transmembrane Transport of cAMP and AMP Using a Two Component Small Molecule Transport System,https://onlinelibrary.wiley.com/doi/10.1002/anie.202524663?af=R,2025-12-10 06:49:50 UTC,Wiley: Angewandte Chemie International Edition: Table of Contents,2025-12-10 06:49:50+00:00,,,
Molecular Design of Nitrile Electrolytes Enabling Lithiated Silicon–Sulfur Batteries with Quasi‐Solid‐State Sulfur Reaction,https://onlinelibrary.wiley.com/doi/10.1002/anie.202518760?af=R,2025-12-10 06:50:34 UTC,Wiley: Angewandte Chemie International Edition: Table of Contents,2025-12-10 06:50:34+00:00,,,
Irreversible Inversion of Circularly Polarized Luminescence via Magneto‐Thermal‐Induced Structural Reorganization in a Chiral Lead Bromide Crystal,https://onlinelibrary.wiley.com/doi/10.1002/anie.202521709?af=R,2025-12-10 06:51:15 UTC,Wiley: Angewandte Chemie International Edition: Table of Contents,2025-12-10 06:51:15+00:00,,,
Atomic‐Scale Structural Distortion Drives Exciton Localization for Near‐Unity Photoluminescence in Copper–Iodide Clusters,https://onlinelibrary.wiley.com/doi/10.1002/anie.202522640?af=R,2025-12-10 07:02:24 UTC,Wiley: Angewandte Chemie International Edition: Table of Contents,2025-12-10 07:02:24+00:00,,,
Biocatalytic Atroposelective Synthesis of Axially Chiral Styrenes via Dynamic Kinetic Resolution,https://onlinelibrary.wiley.com/doi/10.1002/anie.202521538?af=R,2025-12-10 07:05:47 UTC,Wiley: Angewandte Chemie International Edition: Table of Contents,2025-12-10 07:05:47+00:00,,,
How monogamous are humans? Scientists compile 'league table' of pairing up,https://www.bbc.com/news/articles/c4gpvx3exglo?at_medium=RSS&at_campaign=rss,2025-12-10 07:11:10 UTC,BBC News,2025-12-10 07:11:10+00:00,,,
Thiophene Derivatives as Versatile Precursors for (Hetero)Arene and Natural Product Synthesis,https://onlinelibrary.wiley.com/doi/10.1002/anie.202516780?af=R,2025-12-10 07:25:56 UTC,Wiley: Angewandte Chemie International Edition: Table of Contents,2025-12-10 07:25:56+00:00,,,
In Situ Formation of Lattice‐Distorted Mn‐Based Catalysts Boosting High Energy‐Efficiency Aqueous Metal‐Air Batteries,https://advanced.onlinelibrary.wiley.com/doi/10.1002/adma.202517696?af=R,2025-12-10 07:26:22 UTC,Wiley: Advanced Materials: Table of Contents,2025-12-10 07:26:22+00:00,,,
Achieving Bichelating Solvation Structure toward Fast Charging and Long Lifespan Aqueous Zn‐Ion Batteries,https://advanced.onlinelibrary.wiley.com/doi/10.1002/adma.202505049?af=R,2025-12-10 07:28:08 UTC,Wiley: Advanced Materials: Table of Contents,2025-12-10 07:28:08+00:00,,,
Embedding Cu4X4 Cubane Clusters into Lead Halide Lattices: Stable 3D Cu‐Pb Bimetallic Halide Frameworks for Photocatalytic CO2‐to‐Ethylene Conversion in Water,https://advanced.onlinelibrary.wiley.com/doi/10.1002/adma.202516054?af=R,2025-12-10 07:29:21 UTC,Wiley: Advanced Materials: Table of Contents,2025-12-10 07:29:21+00:00,,,
Aqueously Upcycled Lignin with Emergent Tribonegativity for Skin‐Integrated Triboelectronics,https://advanced.onlinelibrary.wiley.com/doi/10.1002/adma.202518412?af=R,2025-12-10 07:30:20 UTC,Wiley: Advanced Materials: Table of Contents,2025-12-10 07:30:20+00:00,,,
Garnet‐Type Solid‐State Electrolyte with Tailored Lithium Compatibility for High Performance All‐Solid‐State Lithium Batteries,https://advanced.onlinelibrary.wiley.com/doi/10.1002/adma.202509828?af=R,2025-12-10 07:32:03 UTC,Wiley: Advanced Materials: Table of Contents,2025-12-10 07:32:03+00:00,,,
Reconfigurable Physical Unclonable Functions Based on Magnetic Domain Patterns,https://advanced.onlinelibrary.wiley.com/doi/10.1002/adma.202517750?af=R,2025-12-10 07:32:38 UTC,Wiley: Advanced Materials: Table of Contents,2025-12-10 07:32:38+00:00,,,
Lattice‐Reconstructed Ru‐Clusters on FeOOH‐Based Self‐Adaptive Artificial Peroxisome with Programmed ROS Regulation for Infectious and Inflammatory Chronic Wounds,https://advanced.onlinelibrary.wiley.com/doi/10.1002/adma.202520395?af=R,2025-12-10 07:36:32 UTC,Wiley: Advanced Materials: Table of Contents,2025-12-10 07:36:32+00:00,,,
Multi‐scale Engineered Vasculature and Hierarchical Porosity via Volumetric Bioprinting‐Guided Photopolymerization‐Induced Phase Separation,https://advanced.onlinelibrary.wiley.com/doi/10.1002/adma.202521171?af=R,2025-12-10 07:41:16 UTC,Wiley: Advanced Materials: Table of Contents,2025-12-10 07:41:16+00:00,,,
On‐Demand Thermal Transport Modulation with Photoactive Nanofluid,https://advanced.onlinelibrary.wiley.com/doi/10.1002/adma.202515879?af=R,2025-12-10 07:43:58 UTC,Wiley: Advanced Materials: Table of Contents,2025-12-10 07:43:58+00:00,,,
CDCA7 facilitates MET1-mediated CG DNA methylation maintenance in centromeric heterochromatin via linker histone H1,https://www.pnas.org/doi/abs/10.1073/pnas.2526408122?mi=eymic2&af=R&access=on&content=articlesChapters&publication=pnas&sortBy=Earliest&target=default,2025-12-10 08:00:00 UTC,Proceedings of the National Academy of Sciences: Keyword search for query,2025-12-10 08:00:00+00:00,,,
Distinct neural dynamics in the ventral hippocampus and medial prefrontal cortex during social information processing,https://www.pnas.org/doi/abs/10.1073/pnas.2516279122?mi=eymic2&af=R&access=on&content=articlesChapters&publication=pnas&sortBy=Earliest&target=default,2025-12-10 08:00:00 UTC,Proceedings of the National Academy of Sciences: Keyword search for query,2025-12-10 08:00:00+00:00,,,
A mechano-gated ionic diode enables low-power synaptic tactile spiking,https://www.science.org/doi/abs/10.1126/sciadv.aea5656?af=R,2025-12-10 08:00:00 UTC,AAAS: Science Advances: Table of Contents,2025-12-10 08:00:00+00:00,,,
We need transparency standards for social media research that involves companies,https://www.pnas.org/doi/abs/10.1073/pnas.2501819122?mi=eymic2&af=R&access=on&content=articlesChapters&publication=pnas&sortBy=Earliest&target=default,2025-12-10 08:00:00 UTC,Proceedings of the National Academy of Sciences: Keyword search for query,2025-12-10 08:00:00+00:00,,,
Coexistence of trapped and flow-transported nuclei enables fast pigeon post communication across multinucleated cell,https://www.pnas.org/doi/abs/10.1073/pnas.2411101122?mi=eymic2&af=R&access=on&content=articlesChapters&publication=pnas&sortBy=Earliest&target=default,2025-12-10 08:00:00 UTC,Proceedings of the National Academy of Sciences: Keyword search for query,2025-12-10 08:00:00+00:00,,,
Reconstructing Eocene Antarctic river drainage from provenance analysis of Amundsen Sea embayment sediments,https://www.science.org/doi/abs/10.1126/sciadv.aea2373?af=R,2025-12-10 08:00:00 UTC,AAAS: Science Advances: Table of Contents,2025-12-10 08:00:00+00:00,,,
Repair of female reproductive function by GDF-9–overexpressing extracellular vesicles via ACVR1B/SMAD2 regulation in ovarian granulosa,https://www.science.org/doi/abs/10.1126/sciadv.adw9006?af=R,2025-12-10 08:00:00 UTC,AAAS: Science Advances: Table of Contents,2025-12-10 08:00:00+00:00,,,
Stereospecific cross-coupling reactions: Programmed assembly of chiral molecules by reaction of chiral reagents,https://www.science.org/doi/abs/10.1126/sciadv.adz3901?af=R,2025-12-10 08:00:00 UTC,AAAS: Science Advances: Table of Contents,2025-12-10 08:00:00+00:00,,,
Arresting Microphase Separation Encodes Material Mechanics by Sculpting Microarchitectures and Local Polymer Enrichment,https://advanced.onlinelibrary.wiley.com/doi/10.1002/adma.202512578?af=R,2025-12-10 08:00:00 UTC,Wiley: Advanced Materials: Table of Contents,2025-12-10 08:00:00+00:00,,,
Plasmonic Su–Schrieffer–Heeger chains with strong coupling amplitudes,https://www.science.org/doi/abs/10.1126/sciadv.aea3844?af=R,2025-12-10 08:00:00 UTC,AAAS: Science Advances: Table of Contents,2025-12-10 08:00:00+00:00,,,
Evolutionarily convergent mechanism of formin regulation coordinates actin polymerization in apicomplexan parasites,https://www.science.org/doi/abs/10.1126/sciadv.aea2136?af=R,2025-12-10 08:00:00 UTC,AAAS: Science Advances: Table of Contents,2025-12-10 08:00:00+00:00,,,
Quantum geometrical molecular dynamics,https://www.science.org/doi/abs/10.1126/sciadv.adz3711?af=R,2025-12-10 08:00:00 UTC,AAAS: Science Advances: Table of Contents,2025-12-10 08:00:00+00:00,,,
"Correction for Jang et al., Lipid raft proteomics identify endothelial myosin-9 (MYH9) as a regulator of low-density lipoprotein transcytosis and atherosclerosis",https://www.pnas.org/doi/abs/10.1073/pnas.2533488122?mi=eymic2&af=R&access=on&content=articlesChapters&publication=pnas&sortBy=Earliest&target=default,2025-12-10 08:00:00 UTC,Proceedings of the National Academy of Sciences: Keyword search for query,2025-12-10 08:00:00+00:00,,,
Down-regulation of gastrin-releasing peptide in medial orbitofrontal cortex to nucleus accumbens projections contributes to allodynia and negative affect,https://www.science.org/doi/abs/10.1126/sciadv.adz1614?af=R,2025-12-10 08:00:00 UTC,AAAS: Science Advances: Table of Contents,2025-12-10 08:00:00+00:00,,,
Deep-blue light-emitting diodes based on perovskite single-crystal thin films,https://www.science.org/doi/abs/10.1126/sciadv.adz8060?af=R,2025-12-10 08:00:00 UTC,AAAS: Science Advances: Table of Contents,2025-12-10 08:00:00+00:00,,,
Brainstem circuit for sickness-induced sleep,https://www.science.org/doi/abs/10.1126/sciadv.ady0245?af=R,2025-12-10 08:00:00 UTC,AAAS: Science Advances: Table of Contents,2025-12-10 08:00:00+00:00,,,
Direct imaging of facet development during growth of single-crystal covalent organic frameworks,https://www.science.org/doi/abs/10.1126/sciadv.adz8131?af=R,2025-12-10 08:00:00 UTC,AAAS: Science Advances: Table of Contents,2025-12-10 08:00:00+00:00,,,
Unusual inheritance of a functional cki homolog in the human pathogen Schistosoma mansoni,https://www.science.org/doi/abs/10.1126/sciadv.aea4905?af=R,2025-12-10 08:00:00 UTC,AAAS: Science Advances: Table of Contents,2025-12-10 08:00:00+00:00,,,
Seed metabolites headstart haustoriogenesis and potentiate aggressiveness of parasitic weeds,https://www.science.org/doi/abs/10.1126/sciadv.aea1449?af=R,2025-12-10 08:00:00 UTC,AAAS: Science Advances: Table of Contents,2025-12-10 08:00:00+00:00,,,
Insect-inspired micro-optical antenna enables ultrasensitive multisensory perception,https://www.science.org/doi/abs/10.1126/sciadv.aec4252?af=R,2025-12-10 08:00:00 UTC,AAAS: Science Advances: Table of Contents,2025-12-10 08:00:00+00:00,,,
HERVH-derived eRNA activates a super-enhancer–driven ALDH1A3/SAT1 axis to promote ferroptosis escape and pancreatic cancer development,https://www.science.org/doi/abs/10.1126/sciadv.aea9074?af=R,2025-12-10 08:00:00 UTC,AAAS: Science Advances: Table of Contents,2025-12-10 08:00:00+00:00,,,
High-resolution lidar observations of sedimentation-induced size sorting of droplets near a laboratory cloud top,https://www.pnas.org/doi/abs/10.1073/pnas.2505421122?mi=eymic2&af=R&access=on&content=articlesChapters&publication=pnas&sortBy=Earliest&target=default,2025-12-10 08:00:00 UTC,Proceedings of the National Academy of Sciences: Keyword search for query,2025-12-10 08:00:00+00:00,,,
Cosmic-ray bath in a past supernova gives birth to Earth-like planets,https://www.science.org/doi/abs/10.1126/sciadv.adx7892?af=R,2025-12-10 08:00:00 UTC,AAAS: Science Advances: Table of Contents,2025-12-10 08:00:00+00:00,,,
