title,link,published,source,pub_date
[ASAP] Single-Layer Silica Nanosheets with In-Plane Porosity Enable High-Performance Nanolaminate Membranes for Organic Solvent Nanofiltration,http://dx.doi.org/10.1021/jacs.5c13454,2025-12-16 17:31:50 UTC,Journal of the American Chemical Society: Latest Articles (ACS Publications),2025-12-16 17:31:50+00:00
[ASAP] Regio- and Stereoselective Halogenation by an Iron(II)- and 2-Oxoglutarate-Dependent Halogenase in the Biosynthesis of Halogenated Nucleosides,http://dx.doi.org/10.1021/jacs.5c16374,2025-12-16 17:32:57 UTC,Journal of the American Chemical Society: Latest Articles (ACS Publications),2025-12-16 17:32:57+00:00
Government rolls back nature protections to boost housing,https://www.bbc.com/news/articles/c3r7zp418p8o?at_medium=RSS&at_campaign=rss,2025-12-16 17:51:04 UTC,BBC News,2025-12-16 17:51:04+00:00
[ASAP] Controlling Intramolecular Rotation with Five-Membered Heterocycles Facilitates the Design of Highly Cell-Permeable Xanthene-Based Fluorogenic Probes,http://dx.doi.org/10.1021/jacs.5c12696,2025-12-16 18:48:46 UTC,Journal of the American Chemical Society: Latest Articles (ACS Publications),2025-12-16 18:48:46+00:00
"[ASAP] Multilayer Formation, Interfacial Binding, and Stability of Self-Assembled Molecules in Perovskite Solar Cells",http://dx.doi.org/10.1021/jacs.5c15955,2025-12-16 18:49:45 UTC,Journal of the American Chemical Society: Latest Articles (ACS Publications),2025-12-16 18:49:45+00:00
EU waters down plans to end new petrol and diesel car sales by 2035,https://www.bbc.com/news/articles/crk78y7k8ezo?at_medium=RSS&at_campaign=rss,2025-12-16 19:28:36 UTC,BBC News,2025-12-16 19:28:36+00:00
"[ASAP] Basic Aluminum Benzoate is Low-Cost, Porous, and Superhydrophobic",http://dx.doi.org/10.1021/jacs.5c12200,2025-12-16 19:58:02 UTC,Journal of the American Chemical Society: Latest Articles (ACS Publications),2025-12-16 19:58:02+00:00
[ASAP] Evaluation of Elementary Steps in Csp2–Csp3 Cross-Electrophile Coupling Reactions Mediated by a Common Ni Complex,http://dx.doi.org/10.1021/jacs.5c15344,2025-12-16 19:59:11 UTC,Journal of the American Chemical Society: Latest Articles (ACS Publications),2025-12-16 19:59:11+00:00
[ASAP] Overcoming the Luminescence Efficiency Limitations of InP Magic-Sized Clusters,http://dx.doi.org/10.1021/jacs.5c13963,2025-12-16 20:08:21 UTC,Journal of the American Chemical Society: Latest Articles (ACS Publications),2025-12-16 20:08:21+00:00
[ASAP] Strengthened Perovskite/SAM Heterointerface for Stable Perovskite Solar Cells,http://dx.doi.org/10.1021/jacs.5c20051,2025-12-16 20:19:05 UTC,Journal of the American Chemical Society: Latest Articles (ACS Publications),2025-12-16 20:19:05+00:00
A universal flu vaccine has proved challenging — could it finally be possible?,https://www.nature.com/articles/d41586-025-03608-1,2025-12-17 00:00:00 UTC,Nature,2025-12-17 00:00:00+00:00
Systematic maps reveal how human chromosomes are organized,https://www.nature.com/articles/d41586-025-03808-9,2025-12-17 00:00:00 UTC,Nature,2025-12-17 00:00:00+00:00
Restoring youth to old immune cells: mRNA therapy turns back the clock,https://www.nature.com/articles/d41586-025-04082-5,2025-12-17 00:00:00 UTC,Nature,2025-12-17 00:00:00+00:00
Trump team plans to break up ‘global mothership’ of climate science,https://www.nature.com/articles/d41586-025-04134-w,2025-12-17 00:00:00 UTC,Nature,2025-12-17 00:00:00+00:00
Annual flu vaccines are far from ideal — this is why,https://www.nature.com/articles/d41586-025-03599-z,2025-12-17 00:00:00 UTC,Nature,2025-12-17 00:00:00+00:00
Probing frozen solid electrolyte interphases,https://www.nature.com/articles/s41563-025-02443-z,2025-12-17 00:00:00 UTC,Nature Materials,2025-12-17 00:00:00+00:00
The Nature Podcast festive spectacular 2025,https://www.nature.com/articles/d41586-025-04140-y,2025-12-17 00:00:00 UTC,Nature,2025-12-17 00:00:00+00:00
A modular quantum processor made using phosphorus atoms in silicon,https://www.nature.com/articles/d41586-025-04044-x,2025-12-17 00:00:00 UTC,Nature,2025-12-17 00:00:00+00:00
Speeding up antiferromagnetic switching,https://www.nature.com/articles/s41563-025-02454-w,2025-12-17 00:00:00 UTC,Nature Materials,2025-12-17 00:00:00+00:00
Healing crystals without heat,https://www.nature.com/articles/s41563-025-02455-9,2025-12-17 00:00:00 UTC,Nature Materials,2025-12-17 00:00:00+00:00
The quest to hatch a bird-flu vaccine,https://www.nature.com/articles/d41586-025-03612-5,2025-12-17 00:00:00 UTC,Nature,2025-12-17 00:00:00+00:00
How common is Alzheimer’s? Blood-test study holds surprises,https://www.nature.com/articles/d41586-025-04133-x,2025-12-17 00:00:00 UTC,Nature,2025-12-17 00:00:00+00:00
Beauty is in the eye of the beholder,https://www.nature.com/articles/d41586-025-04024-1,2025-12-17 00:00:00 UTC,Nature,2025-12-17 00:00:00+00:00
Synthesis of heterobicyclo[n.1.1]alkanes,http://pubs.rsc.org/en/Content/ArticleLanding/2026/CS/D5CS01128K,2025-12-17 00:00:00 UTC,RSC - Chem. Soc. Rev. latest articles,2025-12-17 00:00:00+00:00
Stopping the next flu pandemic,https://www.nature.com/articles/d41586-025-03613-4,2025-12-17 00:00:00 UTC,Nature,2025-12-17 00:00:00+00:00
Could tracking animals’ health help to avert the next pandemic?,https://www.nature.com/articles/d41586-025-03602-7,2025-12-17 00:00:00 UTC,Nature,2025-12-17 00:00:00+00:00
Flu’s link to cardiovascular disease shows why vaccination is essential,https://www.nature.com/articles/d41586-025-03598-0,2025-12-17 00:00:00 UTC,Nature,2025-12-17 00:00:00+00:00
ReCHEMbinant stapling enhances intracellular delivery and bioactivity of engineered protein inhibitors,https://www.cell.com/chem/fulltext/S2451-9294(25)00430-9?rss=yes,2025-12-17 00:00:00 UTC,Chem,2025-12-17 00:00:00+00:00
MIT fusion-lab head shot dead: a horror 'impossible to believe',https://www.nature.com/articles/d41586-025-04135-9,2025-12-17 00:00:00 UTC,Nature,2025-12-17 00:00:00+00:00
Virology’s most wanted: the influenza virus,https://www.nature.com/articles/d41586-025-03607-2,2025-12-17 00:00:00 UTC,Nature,2025-12-17 00:00:00+00:00
Mechanism for water formation on rocky exoplanets demonstrated in the lab,https://www.nature.com/articles/d41586-025-04015-2,2025-12-17 00:00:00 UTC,Nature,2025-12-17 00:00:00+00:00
I’ve earned my PhD — what now?,https://www.nature.com/articles/d41586-025-03489-4,2025-12-17 00:00:00 UTC,Nature,2025-12-17 00:00:00+00:00
Seven feel-good science stories to restore your faith in 2025,https://www.nature.com/articles/d41586-025-03505-7,2025-12-17 00:00:00 UTC,Nature,2025-12-17 00:00:00+00:00
Distributionally robust free energy principle for decision-making,https://www.nature.com/articles/s41467-025-67348-6,2025-12-17 00:00:00 UTC,Nature Communications,2025-12-17 00:00:00+00:00
"Take the News & Views end-of-year quiz: vampire fungus, migratory moths and a 160-year-old mystery",https://www.nature.com/articles/d41586-025-04119-9,2025-12-17 00:00:00 UTC,Nature,2025-12-17 00:00:00+00:00
Mazdutide versus placebo in Chinese adults with type 2 diabetes,https://www.nature.com/articles/s41586-025-10026-w,2025-12-17 00:00:00 UTC,Nature,2025-12-17 00:00:00+00:00
Human assembloids recapitulate periportal liver tissue in vitro,https://www.nature.com/articles/s41586-025-09884-1,2025-12-17 00:00:00 UTC,Nature,2025-12-17 00:00:00+00:00
Lesion-remote astrocytes govern microglia-mediated white matter repair,https://www.nature.com/articles/s41586-025-09887-y,2025-12-17 00:00:00 UTC,Nature,2025-12-17 00:00:00+00:00
The hidden cost of video-call glitches,https://www.nature.com/articles/d41586-025-03820-z,2025-12-17 00:00:00 UTC,Nature,2025-12-17 00:00:00+00:00
Superbase CO2-concentrating layers protected nickel catalyst for solar CH4 synthesis via direct air capture,http://pubs.rsc.org/en/Content/ArticleLanding/2026/EE/D5EE06482A,2025-12-17 00:00:00 UTC,RSC - Energy Environ. Sci. latest articles,2025-12-17 00:00:00+00:00
Decoupling shear from grain boundary migration,https://www.nature.com/articles/s41563-025-02457-7,2025-12-17 00:00:00 UTC,Nature Materials,2025-12-17 00:00:00+00:00
Mechanochemical extraction of gallium from chemically akin metal mixtures via an atomic-scale low-entropy-increasing strategy,https://www.cell.com/joule/fulltext/S2542-4351(25)00415-5?rss=yes,2025-12-17 00:00:00 UTC,Joule,2025-12-17 00:00:00+00:00
Immunological sin: how a person’s earliest flu infections dictate life-long immunity,https://www.nature.com/articles/d41586-025-03606-3,2025-12-17 00:00:00 UTC,Nature,2025-12-17 00:00:00+00:00
Peptides and bioelectronics for cardiac cell therapy,https://www.nature.com/articles/s41563-025-02453-x,2025-12-17 00:00:00 UTC,Nature Materials,2025-12-17 00:00:00+00:00
3D nanolithography with metalens arrays and spatially adaptive illumination,https://www.nature.com/articles/s41586-025-09842-x,2025-12-17 00:00:00 UTC,Nature,2025-12-17 00:00:00+00:00
Palaeometabolomes yield biological and ecological profiles at early human sites,https://www.nature.com/articles/s41586-025-09843-w,2025-12-17 00:00:00 UTC,Nature,2025-12-17 00:00:00+00:00
Author Correction: Neuroimmune cardiovascular interfaces control atherosclerosis,https://www.nature.com/articles/s41586-025-10043-9,2025-12-17 00:00:00 UTC,Nature,2025-12-17 00:00:00+00:00
How the Romans built their empire of concrete,https://www.nature.com/articles/d41586-025-04080-7,2025-12-17 00:00:00 UTC,Nature,2025-12-17 00:00:00+00:00
Genes don’t explain what made humans different,https://www.nature.com/articles/d41586-025-04079-0,2025-12-17 00:00:00 UTC,Nature,2025-12-17 00:00:00+00:00
Laser spectroscopy and CP-violation sensitivity of actinium monofluoride,https://www.nature.com/articles/s41586-025-09814-1,2025-12-17 00:00:00 UTC,Nature,2025-12-17 00:00:00+00:00
Is bird flu the next pandemic? The science so far,https://www.nature.com/articles/d41586-025-03777-z,2025-12-17 00:00:00 UTC,Nature,2025-12-17 00:00:00+00:00
Gene-specific selective sweeps are pervasive across human gut microbiomes,https://www.nature.com/articles/s41586-025-09798-y,2025-12-17 00:00:00 UTC,Nature,2025-12-17 00:00:00+00:00
Programmable 200 GOPS Hopfield-inspired photonic Ising machine,https://www.nature.com/articles/s41586-025-09838-7,2025-12-17 00:00:00 UTC,Nature,2025-12-17 00:00:00+00:00
An integrated view of the structure and function of the human 4D nucleome,https://www.nature.com/articles/s41586-025-09890-3,2025-12-17 00:00:00 UTC,Nature,2025-12-17 00:00:00+00:00
Astrocyte CCN1 stabilizes neural circuits in the adult brain,https://www.nature.com/articles/s41586-025-09770-w,2025-12-17 00:00:00 UTC,Nature,2025-12-17 00:00:00+00:00
Mazdutide versus dulaglutide in Chinese adults with type 2 diabetes,https://www.nature.com/articles/s41586-025-10031-z,2025-12-17 00:00:00 UTC,Nature,2025-12-17 00:00:00+00:00
An 11-qubit atom processor in silicon,https://www.nature.com/articles/s41586-025-09827-w,2025-12-17 00:00:00 UTC,Nature,2025-12-17 00:00:00+00:00
The global hydrogen budget,https://www.nature.com/articles/s41586-025-09806-1,2025-12-17 00:00:00 UTC,Nature,2025-12-17 00:00:00+00:00
Visualizing interaction-driven restructuring of quantum Hall edge states,https://www.nature.com/articles/s41586-025-09858-3,2025-12-17 00:00:00 UTC,Nature,2025-12-17 00:00:00+00:00
Prevalence of Alzheimer’s disease pathology in the community,https://www.nature.com/articles/s41586-025-09841-y,2025-12-17 00:00:00 UTC,Nature,2025-12-17 00:00:00+00:00
Titan’s strong tidal dissipation precludes a subsurface ocean,https://www.nature.com/articles/s41586-025-09818-x,2025-12-17 00:00:00 UTC,Nature,2025-12-17 00:00:00+00:00
Spatiotemporal cellular map of the developing human reproductive tract,https://www.nature.com/articles/s41586-025-09875-2,2025-12-17 00:00:00 UTC,Nature,2025-12-17 00:00:00+00:00
Transient hepatic reconstitution of trophic factors enhances aged immunity,https://www.nature.com/articles/s41586-025-09873-4,2025-12-17 00:00:00 UTC,Nature,2025-12-17 00:00:00+00:00
GTP release-selective agonists prolong opioid analgesic efficacy,https://www.nature.com/articles/s41586-025-09880-5,2025-12-17 00:00:00 UTC,Nature,2025-12-17 00:00:00+00:00
On to the next century of Fischer–Tropsch synthesis,https://www.nature.com/articles/s44286-025-00326-3,2025-12-17 00:00:00 UTC,Nature Chemical Engineering,2025-12-17 00:00:00+00:00
Operando X-ray imaging reveals size-dependent evolution of cobalt oxide thermochemical material during thermal redox cycles,https://www.nature.com/articles/s41467-025-66174-0,2025-12-17 00:00:00 UTC,Nature Communications,2025-12-17 00:00:00+00:00
Spatial correlation at the boson peak frequency in amorphous materials,https://www.nature.com/articles/s41467-025-67574-y,2025-12-17 00:00:00 UTC,Nature Communications,2025-12-17 00:00:00+00:00
Agonist signaling drives neutrophil subpopulations to promote/inhibit colorectal cancer liver metastasis,https://www.nature.com/articles/s41467-025-67579-7,2025-12-17 00:00:00 UTC,Nature Communications,2025-12-17 00:00:00+00:00
PhaseT3M: 3D imaging at 1.6 Å resolution via electron cryo-tomography with nonlinear phase retrieval,https://www.nature.com/articles/s41467-025-67303-5,2025-12-17 00:00:00 UTC,Nature Communications,2025-12-17 00:00:00+00:00
"Switchable Reactivities of Metalated Phosphasilenes Regulated by Reversible 1,2‐Metal Migration",https://onlinelibrary.wiley.com/doi/10.1002/anie.202518102?af=R,2025-12-17 00:43:51 UTC,Wiley: Angewandte Chemie International Edition: Table of Contents,2025-12-17 00:43:51+00:00
Why have so many different eyes evolved? Gamelike simulation could provide answers,https://www.science.org/content/article/why-have-so-many-different-eyes-evolved-gamelike-simulation-could-provide-answers,2025-12-17 02:00:00 UTC,Latest News from Science Magazine,2025-12-17 02:00:00+00:00
Ancient tectonic plates are oozing along Earth’s core,https://www.science.org/content/article/ancient-tectonic-plates-are-oozing-along-earth-s-core,2025-12-17 03:45:00 UTC,Latest News from Science Magazine,2025-12-17 03:45:00+00:00
New NASA administrator takes over after a year of scientific loss—and survival,https://www.science.org/content/article/new-nasa-administrator-takes-over-after-year-scientific-loss-and-survival,2025-12-17 04:10:00 UTC,Latest News from Science Magazine,2025-12-17 04:10:00+00:00
Misconduct sleuth wins $2.63 million from major cancer institute in $15 million settlement,https://www.science.org/content/article/misconduct-sleuth-wins-2-63-million-major-cancer-institute-15-million-settlement,2025-12-17 05:00:00 UTC,Latest News from Science Magazine,2025-12-17 05:00:00+00:00
Trump administration moves to break up leading U.S. climate and weather center,https://www.science.org/content/article/trump-administration-moves-break-leading-u-s-climate-and-weather-center,2025-12-17 05:45:00 UTC,Latest News from Science Magazine,2025-12-17 05:45:00+00:00
Aromatic Pentaamide Macrocycles as High‐Affinity Sulfate Binders and Efficient Transporters,https://onlinelibrary.wiley.com/doi/10.1002/anie.202523430?af=R,2025-12-17 06:04:06 UTC,Wiley: Angewandte Chemie International Edition: Table of Contents,2025-12-17 06:04:06+00:00
Thermal Runaway Mechanisms and Mitigation Strategies of Silicon‐Based Anode in Lithium‐Ion Batteries: A Review,https://advanced.onlinelibrary.wiley.com/doi/10.1002/aenm.202505793?af=R,2025-12-17 07:00:42 UTC,Wiley: Advanced Energy Materials: Table of Contents,2025-12-17 07:00:42+00:00
"Astrocytic CREB regulates transcriptomic, neuronal, and behavioral responses to cocaine",https://www.science.org/doi/abs/10.1126/sciadv.aea2419?af=R,2025-12-17 08:00:00 UTC,AAAS: Science Advances: Table of Contents,2025-12-17 08:00:00+00:00
What if eye...? Computationally recreating vision evolution,https://www.science.org/doi/abs/10.1126/sciadv.ady2888?af=R,2025-12-17 08:00:00 UTC,AAAS: Science Advances: Table of Contents,2025-12-17 08:00:00+00:00
High-order expansion of neural ordinary differential equation flows,https://www.science.org/doi/abs/10.1126/sciadv.ady1348?af=R,2025-12-17 08:00:00 UTC,AAAS: Science Advances: Table of Contents,2025-12-17 08:00:00+00:00
GPNMB is a biomarker for lysosomal dysfunction and is secreted via LRRK2-modulated lysosomal exocytosis,https://www.science.org/doi/abs/10.1126/sciadv.adv1434?af=R,2025-12-17 08:00:00 UTC,AAAS: Science Advances: Table of Contents,2025-12-17 08:00:00+00:00
Flexible low-voltage organic transistors with a transit frequency of 40 MHz and an on/off current ratio of 10 orders of magnitude,https://www.science.org/doi/abs/10.1126/sciadv.aeb9693?af=R,2025-12-17 08:00:00 UTC,AAAS: Science Advances: Table of Contents,2025-12-17 08:00:00+00:00
Persistent glycolysis defines pathological foreign body–associated inflammation to polymeric implants,https://www.science.org/doi/abs/10.1126/sciadv.adx6368?af=R,2025-12-17 08:00:00 UTC,AAAS: Science Advances: Table of Contents,2025-12-17 08:00:00+00:00
Programmable acoustofluidic engineering for creating gradient biomaterials,https://www.science.org/doi/abs/10.1126/sciadv.aeb0879?af=R,2025-12-17 08:00:00 UTC,AAAS: Science Advances: Table of Contents,2025-12-17 08:00:00+00:00
Immunometabolic insights into the foreign body response,https://www.science.org/doi/abs/10.1126/sciadv.aed8370?af=R,2025-12-17 08:00:00 UTC,AAAS: Science Advances: Table of Contents,2025-12-17 08:00:00+00:00
Direct trapping of the transport-segment DNA by the central domain of type IIA topoisomerases,https://www.science.org/doi/abs/10.1126/sciadv.adw2839?af=R,2025-12-17 08:00:00 UTC,AAAS: Science Advances: Table of Contents,2025-12-17 08:00:00+00:00
Neurexin regulates mechanical nociceptive sensitization by central inhibition in Drosophila,https://www.science.org/doi/abs/10.1126/sciadv.adz9682?af=R,2025-12-17 08:00:00 UTC,AAAS: Science Advances: Table of Contents,2025-12-17 08:00:00+00:00
Microbubble-induced erosion releases micro- and nanoplastics into water,https://www.science.org/doi/abs/10.1126/sciadv.aea4729?af=R,2025-12-17 08:00:00 UTC,AAAS: Science Advances: Table of Contents,2025-12-17 08:00:00+00:00
Piezo-photocatalysis over high-nuclearity titanium-oxide cluster via lead heterocoordination enhances activity by piezoelectric effect,https://www.science.org/doi/abs/10.1126/sciadv.aea4692?af=R,2025-12-17 08:00:00 UTC,AAAS: Science Advances: Table of Contents,2025-12-17 08:00:00+00:00
Heterophase RuO2 oxygen evolution catalyst for durable proton exchange membrane water electrolysis,https://www.science.org/doi/abs/10.1126/sciadv.aea4543?af=R,2025-12-17 08:00:00 UTC,AAAS: Science Advances: Table of Contents,2025-12-17 08:00:00+00:00
lncRNA LINC-PINT controls lymphatic function and inflammatory profile in lymphedema,https://www.science.org/doi/abs/10.1126/sciadv.aea2960?af=R,2025-12-17 08:00:00 UTC,AAAS: Science Advances: Table of Contents,2025-12-17 08:00:00+00:00
"GPNMB, LRRK2, and lysosome exocytosis in Parkinson’s",https://www.science.org/doi/abs/10.1126/sciadv.aed8002?af=R,2025-12-17 08:00:00 UTC,AAAS: Science Advances: Table of Contents,2025-12-17 08:00:00+00:00
Direct recruitment of TONSOKU by the N-terminal tails of histone variants H2A.X and H2A.W coordinates DNA repair,https://www.science.org/doi/abs/10.1126/sciadv.ady2104?af=R,2025-12-17 08:00:00 UTC,AAAS: Science Advances: Table of Contents,2025-12-17 08:00:00+00:00
A plant NLR receptor activates auxin signaling through Aux/IAAs-ARF19 and YUC8-TIR1/AFBs to promote callose-mediated antiviral defense,https://www.science.org/doi/abs/10.1126/sciadv.aea2275?af=R,2025-12-17 08:00:00 UTC,AAAS: Science Advances: Table of Contents,2025-12-17 08:00:00+00:00
Learning to learn ecosystems from limited data,https://www.pnas.org/doi/abs/10.1073/pnas.2525347122?mi=eymic2&af=R&access=on&content=articlesChapters&publication=pnas&sortBy=Earliest&target=default,2025-12-17 08:00:00 UTC,Proceedings of the National Academy of Sciences: Keyword search for query,2025-12-17 08:00:00+00:00
DNA methylation shapes transcription factor binding beyond canonical CpG contexts,https://www.pnas.org/doi/abs/10.1073/pnas.2520814122?mi=eymic2&af=R&access=on&content=articlesChapters&publication=pnas&sortBy=Earliest&target=default,2025-12-17 08:00:00 UTC,Proceedings of the National Academy of Sciences: Keyword search for query,2025-12-17 08:00:00+00:00
Frog vocal sacs-inspired soft acoustic system with continuously tunable resonance for sound emission and stethoscopic sensing,https://www.science.org/doi/abs/10.1126/sciadv.adz5930?af=R,2025-12-17 08:00:00 UTC,AAAS: Science Advances: Table of Contents,2025-12-17 08:00:00+00:00
Stress granule dynamics govern TOR reactivation and growth recovery during post-heat stress adaptation,https://www.science.org/doi/abs/10.1126/sciadv.adv6202?af=R,2025-12-17 08:00:00 UTC,AAAS: Science Advances: Table of Contents,2025-12-17 08:00:00+00:00
SLFN14 functions as a P-TEFb inhibitor to modulate the transcription of HIV-1 and cellular genes,https://www.science.org/doi/abs/10.1126/sciadv.adt7982?af=R,2025-12-17 08:00:00 UTC,AAAS: Science Advances: Table of Contents,2025-12-17 08:00:00+00:00
Humpback whale genomes reflect the increased efficiency of commercial whaling,https://www.science.org/doi/abs/10.1126/sciadv.ady7091?af=R,2025-12-17 08:00:00 UTC,AAAS: Science Advances: Table of Contents,2025-12-17 08:00:00+00:00
RIPK1 inhibition reduces biliary injury and fibrosis in primary sclerosing cholangitis,https://www.science.org/doi/abs/10.1126/sciadv.adz7907?af=R,2025-12-17 08:00:00 UTC,AAAS: Science Advances: Table of Contents,2025-12-17 08:00:00+00:00
"Correction for Agrawal and Dehaene, From retinotopic to ordinal coding: Dissecting the cortical stages of visual word recognition",https://www.pnas.org/doi/abs/10.1073/pnas.2534270122?mi=eymic2&af=R&access=on&content=articlesChapters&publication=pnas&sortBy=Earliest&target=default,2025-12-17 08:00:00 UTC,Proceedings of the National Academy of Sciences: Keyword search for query,2025-12-17 08:00:00+00:00
Single-nucleus multiomics reveals the disrupted regulatory programs in three brain regions of sporadic early-onset Alzheimer’s disease,https://www.science.org/doi/abs/10.1126/sciadv.adw4917?af=R,2025-12-17 08:00:00 UTC,AAAS: Science Advances: Table of Contents,2025-12-17 08:00:00+00:00
Observation of moiré plasmonic skyrmion clusters,https://www.science.org/doi/abs/10.1126/sciadv.adx0478?af=R,2025-12-17 08:00:00 UTC,AAAS: Science Advances: Table of Contents,2025-12-17 08:00:00+00:00
"David John “Davo” Mangelsdorf (1958–2025): A life of science, friendship, and joy",https://www.pnas.org/doi/abs/10.1073/pnas.2534320122?mi=eymic2&af=R&access=on&content=articlesChapters&publication=pnas&sortBy=Earliest&target=default,2025-12-17 08:00:00 UTC,Proceedings of the National Academy of Sciences: Keyword search for query,2025-12-17 08:00:00+00:00
"Correction for Wang et al., Engineering bacteria for cancer immunotherapy by inhibiting IDO activity and reprogramming CD8+ T cell response",https://www.pnas.org/doi/abs/10.1073/pnas.2533734122?mi=eymic2&af=R&access=on&content=articlesChapters&publication=pnas&sortBy=Earliest&target=default,2025-12-17 08:00:00 UTC,Proceedings of the National Academy of Sciences: Keyword search for query,2025-12-17 08:00:00+00:00
Resident phagocytes promote non–cell-autonomous fragmentation of apoptotic cells,https://www.science.org/doi/abs/10.1126/sciadv.adz5264?af=R,2025-12-17 08:00:00 UTC,AAAS: Science Advances: Table of Contents,2025-12-17 08:00:00+00:00
"Correction for Goteti et al., Collective neural network behavior in a dynamically driven disordered system of superconducting loops",https://www.pnas.org/doi/abs/10.1073/pnas.2533693122?mi=eymic2&af=R&access=on&content=articlesChapters&publication=pnas&sortBy=Earliest&target=default,2025-12-17 08:00:00 UTC,Proceedings of the National Academy of Sciences: Keyword search for query,2025-12-17 08:00:00+00:00
Phosphorus-lithium double-helix nanoribbons,https://www.science.org/doi/abs/10.1126/sciadv.adz4766?af=R,2025-12-17 08:00:00 UTC,AAAS: Science Advances: Table of Contents,2025-12-17 08:00:00+00:00
Derepression of transposable elements in the mouse prefrontal cortex disrupts social behavior,https://www.pnas.org/doi/abs/10.1073/pnas.2510663122?mi=eymic2&af=R&access=on&content=articlesChapters&publication=pnas&sortBy=Earliest&target=default,2025-12-17 08:00:00 UTC,Proceedings of the National Academy of Sciences: Keyword search for query,2025-12-17 08:00:00+00:00
Nanosheet-bridged metal-organic framework membranes for durable hydrocarbon separation under high pressure,https://www.science.org/doi/abs/10.1126/sciadv.adz3219?af=R,2025-12-17 08:00:00 UTC,AAAS: Science Advances: Table of Contents,2025-12-17 08:00:00+00:00
The mechanism of action of digoxin requires the sodium-dependent inactivation of the sodium-calcium exchanger,https://www.science.org/doi/abs/10.1126/sciadv.ady9596?af=R,2025-12-17 08:00:00 UTC,AAAS: Science Advances: Table of Contents,2025-12-17 08:00:00+00:00
In situ NMR–guided design of alkaline electrochemical ammonia synthesis,https://www.science.org/doi/abs/10.1126/sciadv.ady8858?af=R,2025-12-17 08:00:00 UTC,AAAS: Science Advances: Table of Contents,2025-12-17 08:00:00+00:00
Turncoat antibodies unmasked in a model of autoimmune demyelination: From biology to therapy,https://www.pnas.org/doi/abs/10.1073/pnas.2424988122?mi=eymic2&af=R&access=on&content=articlesChapters&publication=pnas&sortBy=Earliest&target=default,2025-12-17 08:00:00 UTC,Proceedings of the National Academy of Sciences: Keyword search for query,2025-12-17 08:00:00+00:00
Lab on an end: Micromanipulation using the acoustohydrodynamic pillar array as an end effector,https://www.pnas.org/doi/abs/10.1073/pnas.2505479122?mi=eymic2&af=R&access=on&content=articlesChapters&publication=pnas&sortBy=Earliest&target=default,2025-12-17 08:00:00 UTC,Proceedings of the National Academy of Sciences: Keyword search for query,2025-12-17 08:00:00+00:00
