title,link,published,source,pub_date
Ambient‐Stable NIR Nanolasing: Monolithic Integration of PbS CQDs on a Silicon Photonic Platform,https://advanced.onlinelibrary.wiley.com/doi/10.1002/adma.202516460?af=R,2025-11-13 13:55:39 UTC,Wiley: Advanced Materials: Table of Contents,2025-11-13 13:55:39+00:00
Bright Circularly Polarized Electrochemiluminescence from Heterobinuclear IrIII–AuI Enantiomers,https://onlinelibrary.wiley.com/doi/10.1002/anie.202510787?af=R,2025-11-13 13:57:03 UTC,Wiley: Angewandte Chemie International Edition: Table of Contents,2025-11-13 13:57:03+00:00
Switchable Phenanthroline‐Cu Catalysts for Enantioselective Alkynylation and Amination of Cyclic Diaryliodonium Salts,https://onlinelibrary.wiley.com/doi/10.1002/anie.202514745?af=R,2025-11-13 13:57:05 UTC,Wiley: Angewandte Chemie International Edition: Table of Contents,2025-11-13 13:57:05+00:00
Holistic Recovery of Spent Lithium‐Ion Batteries by Flash Joule Heating,https://advanced.onlinelibrary.wiley.com/doi/10.1002/adma.202517293?af=R,2025-11-13 13:57:15 UTC,Wiley: Advanced Materials: Table of Contents,2025-11-13 13:57:15+00:00
From Data to Physics: An Agentic Large Language Model Solves a Competitive Adsorption Puzzle,https://onlinelibrary.wiley.com/doi/10.1002/anie.202512151?af=R,2025-11-13 13:57:55 UTC,Wiley: Angewandte Chemie International Edition: Table of Contents,2025-11-13 13:57:55+00:00
Trace Chlorine‐Induced Lattice Oxygen Activation for Enhanced High‐Temperature CO2 Electrolysis,https://advanced.onlinelibrary.wiley.com/doi/10.1002/adma.202518116?af=R,2025-11-13 13:59:19 UTC,Wiley: Advanced Materials: Table of Contents,2025-11-13 13:59:19+00:00
"[ASAP] Advances in Gel-Based Solar Interfacial Evaporators: Advantages, Performance and Applications",http://dx.doi.org/10.1021/acsenergylett.5c02413,2025-11-13 13:59:23 UTC,ACS Energy Letters: Latest Articles (ACS Publications),2025-11-13 13:59:23+00:00
Non‐Alternant Helical Bilayer Molecular Carbons Bearing a Diaza[9]Helicene with Enhanced Emission and Circularly Polarized Luminescence,https://onlinelibrary.wiley.com/doi/10.1002/anie.202521835?af=R,2025-11-13 14:01:20 UTC,Wiley: Angewandte Chemie International Edition: Table of Contents,2025-11-13 14:01:20+00:00
Charge‐Driven Self‐Assembly of Cholesterol Surfactants into Biofunctional Nanodiscs with Antiviral Activity,https://onlinelibrary.wiley.com/doi/10.1002/anie.202516207?af=R,2025-11-13 14:03:11 UTC,Wiley: Angewandte Chemie International Edition: Table of Contents,2025-11-13 14:03:11+00:00
Noble Metal‐Free Photosensitive Terpyridine Coordination Assemblies for Efficient Single‐Molecule H2O2 Photocatalysis,https://onlinelibrary.wiley.com/doi/10.1002/anie.202518696?af=R,2025-11-13 14:03:15 UTC,Wiley: Angewandte Chemie International Edition: Table of Contents,2025-11-13 14:03:15+00:00
"Triplet‐Enhanced Photoiniferter Polymerization: Ultrafast, Oxygen‐Tolerant, and Biocompatible Synthesis of Well‐Defined Polymers Under Visible Light",https://onlinelibrary.wiley.com/doi/10.1002/anie.202522611?af=R,2025-11-13 14:05:24 UTC,Wiley: Angewandte Chemie International Edition: Table of Contents,2025-11-13 14:05:24+00:00
"Hierarchical, Template‐Controlled Self‐Assembly of Two Different Organometallic Capsules from a Tetrakisimidazolium Salt",https://onlinelibrary.wiley.com/doi/10.1002/anie.202520814?af=R,2025-11-13 14:05:31 UTC,Wiley: Angewandte Chemie International Edition: Table of Contents,2025-11-13 14:05:31+00:00
Incorporating Redox‐Active Hexaazatrinaphthylene into a 2D Conductive Metal–Organic Framework for Robust Sodium‐Ion Batteries,https://onlinelibrary.wiley.com/doi/10.1002/anie.202516381?af=R,2025-11-13 14:07:50 UTC,Wiley: Angewandte Chemie International Edition: Table of Contents,2025-11-13 14:07:50+00:00
Room Temperature Giant Magnetostriction in Ultrathin FexMn1–xGa4,https://advanced.onlinelibrary.wiley.com/doi/10.1002/adma.202509734?af=R,2025-11-13 14:07:52 UTC,Wiley: Advanced Materials: Table of Contents,2025-11-13 14:07:52+00:00
Mechanistic Characterisation of Bacterial Terpene Synthases from Chitinophagaceae Producing Marine‐Type Diterpenes,https://onlinelibrary.wiley.com/doi/10.1002/anie.202517373?af=R,2025-11-13 14:11:44 UTC,Wiley: Angewandte Chemie International Edition: Table of Contents,2025-11-13 14:11:44+00:00
Cyclically Dynamic Defect Management Enables High‐efficiency Sn─Pb Perovskite Photovoltaics with Enhanced Photostability and Fatigue Resistance,https://onlinelibrary.wiley.com/doi/10.1002/anie.202514563?af=R,2025-11-13 14:13:09 UTC,Wiley: Angewandte Chemie International Edition: Table of Contents,2025-11-13 14:13:09+00:00
Key Structural Motifs Underlying the Unusual Deformation Flexibility and Phase‐Change Propensity in Amorphous Alloys,https://advanced.onlinelibrary.wiley.com/doi/10.1002/adma.202515726?af=R,2025-11-13 14:14:35 UTC,Wiley: Advanced Materials: Table of Contents,2025-11-13 14:14:35+00:00
Ferroelectrics Hybrids: Harnessing Multifunctionality of 2D Semiconductors in the Post‐Moore Era,https://advanced.onlinelibrary.wiley.com/doi/10.1002/adma.202517269?af=R,2025-11-13 14:21:12 UTC,Wiley: Advanced Materials: Table of Contents,2025-11-13 14:21:12+00:00
Stereodivergent Deacylative Mizoroki–Heck Reaction of Unstrained Ketones,https://onlinelibrary.wiley.com/doi/10.1002/anie.202518599?af=R,2025-11-13 14:30:08 UTC,Wiley: Angewandte Chemie International Edition: Table of Contents,2025-11-13 14:30:08+00:00
"[ASAP] Mutanobactin D from the Human Microbiome: Chemistry, Biology, and Molecular Dynamics Studies",http://dx.doi.org/10.1021/jacs.5c08850,2025-11-13 14:41:33 UTC,Journal of the American Chemical Society: Latest Articles (ACS Publications),2025-11-13 14:41:33+00:00
[ASAP] The Chemistry and Thermodynamics of Point Source CO2 Capture by Liquid Chemical Absorption and Its Impact on Process Performance,http://dx.doi.org/10.1021/acs.chemrev.5c00377,2025-11-13 14:45:23 UTC,Chemical Reviews: Latest Articles (ACS Publications),2025-11-13 14:45:23+00:00
Balancing Oxidative Stability and Ion Transport in Quasi‐Solid Polymer Electrolytes via Chlorine‐Driven Halogenation Engineering,https://onlinelibrary.wiley.com/doi/10.1002/anie.202521087?af=R,2025-11-13 14:52:55 UTC,Wiley: Angewandte Chemie International Edition: Table of Contents,2025-11-13 14:52:55+00:00
UK's first small nuclear power station to be built in north Wales,https://www.bbc.com/news/articles/c051y3d7myzo?at_medium=RSS&at_campaign=rss,2025-11-13 15:09:17 UTC,BBC News,2025-11-13 15:09:17+00:00
[ASAP] Temperature-Controlled Chemoselective Editing of Heterostructured Nanorods Using a Broad-Scope Reverse Cation Exchange Reaction,http://dx.doi.org/10.1021/jacs.5c16368,2025-11-13 15:15:32 UTC,Journal of the American Chemical Society: Latest Articles (ACS Publications),2025-11-13 15:15:32+00:00
[ASAP] Tuning Interphasial Chemistry with Titanium–Oxo Clusters for High-Energy-Density Lithium Metal Batteries,http://dx.doi.org/10.1021/jacs.5c13474,2025-11-13 15:19:01 UTC,Journal of the American Chemical Society: Latest Articles (ACS Publications),2025-11-13 15:19:01+00:00
[ASAP] Dual-Donor Doped Perovskite as Bifunctional Oxygen Electrode Catalyst for Reversible Protonic Ceramic Electrochemical Cell,http://dx.doi.org/10.1021/jacs.5c13058,2025-11-13 15:28:55 UTC,Journal of the American Chemical Society: Latest Articles (ACS Publications),2025-11-13 15:28:55+00:00
[ASAP] Supramolecular Assembly of a Macrocyclic Rhodium(I) Isocyanide Complex with Long-Lived Near-Infrared Luminescence,http://dx.doi.org/10.1021/jacs.5c12755,2025-11-13 16:03:48 UTC,Journal of the American Chemical Society: Latest Articles (ACS Publications),2025-11-13 16:03:48+00:00
[ASAP] General Light-Induced Pd-Catalyzed Allylic C–H Alkylation of Internal Alkenes: Direct Access to Tertiary and Quaternary Carbon Centers,http://dx.doi.org/10.1021/jacs.5c15245,2025-11-13 16:48:16 UTC,Journal of the American Chemical Society: Latest Articles (ACS Publications),2025-11-13 16:48:16+00:00
BBC Inside Science,https://www.bbc.co.uk/sounds/play/w3ct8txk?at_medium=RSS&at_campaign=rss,2025-11-13 17:00:00 UTC,BBC News,2025-11-13 17:00:00+00:00
[ASAP] A Chiral Electrocatalyst for High-Performance Aluminum–Sulfur Battery,http://dx.doi.org/10.1021/jacs.5c14506,2025-11-13 17:36:54 UTC,Journal of the American Chemical Society: Latest Articles (ACS Publications),2025-11-13 17:36:54+00:00
[ASAP] Stereoconvergent Polymerization Driven by Catalytic Racemization,http://dx.doi.org/10.1021/jacs.5c15819,2025-11-13 17:38:44 UTC,Journal of the American Chemical Society: Latest Articles (ACS Publications),2025-11-13 17:38:44+00:00
"[ASAP] β-Substituted Styrenes in Heteroaryl-Directed Hydroalkylative Cross-Couplings: Regio-, Diastereo-, and Enantioselective Formation of β-Stereogenic Tertiary Alcohols",http://dx.doi.org/10.1021/jacs.5c17840,2025-11-13 17:57:18 UTC,Journal of the American Chemical Society: Latest Articles (ACS Publications),2025-11-13 17:57:18+00:00
Solving the ‘golfer’s curse’ and using space as a heat sink,https://www.science.org/doi/10.1126/science.zib9ohx,2025-11-13 19:00:00 UTC,Science Magazine Podcast,2025-11-13 19:00:00+00:00
Our dogs' diversity can be traced back to the Stone Age,https://www.bbc.com/news/articles/ce9d7j89ykro?at_medium=RSS&at_campaign=rss,2025-11-13 19:00:29 UTC,BBC News,2025-11-13 19:00:29+00:00
[ASAP] Conductive Covalent Organic Frameworks as Chemiresistive Sensor Arrays for the Detection and Differentiation of Gasotransmitters,http://dx.doi.org/10.1021/jacs.5c11454,2025-11-13 19:31:18 UTC,Journal of the American Chemical Society: Latest Articles (ACS Publications),2025-11-13 19:31:18+00:00
A Chinese AI model taught itself basic physics — what discoveries could it make?,https://www.nature.com/articles/d41586-025-03659-4,2025-11-14 00:00:00 UTC,Nature,2025-11-14 00:00:00+00:00
Why I moved my research to China from Germany: a biologist’s experience,https://www.nature.com/articles/d41586-025-03762-6,2025-11-14 00:00:00 UTC,Nature,2025-11-14 00:00:00+00:00
Three research stars fighting to protect coastlines,https://www.nature.com/articles/d41586-025-03531-5,2025-11-14 00:00:00 UTC,Nature,2025-11-14 00:00:00+00:00
Sinking cities: how China is moving subsidence research forward,https://www.nature.com/articles/d41586-025-03529-z,2025-11-14 00:00:00 UTC,Nature,2025-11-14 00:00:00+00:00
The leading cities in the world for high-quality research in 2024,https://www.nature.com/articles/d41586-025-03530-6,2025-11-14 00:00:00 UTC,Nature,2025-11-14 00:00:00+00:00
Why coastal megacities should look inland for research collaborations,https://www.nature.com/articles/d41586-025-03528-0,2025-11-14 00:00:00 UTC,Nature,2025-11-14 00:00:00+00:00
The future of AI,https://www.nature.com/articles/d41586-025-03701-5,2025-11-14 00:00:00 UTC,Nature,2025-11-14 00:00:00+00:00
Author Correction: Mechanisms of stretch-mediated skin expansion at single-cell resolution,https://www.nature.com/articles/s41586-025-09878-z,2025-11-14 00:00:00 UTC,Nature,2025-11-14 00:00:00+00:00
Ripple-assisted adsorption of noble gases on graphene at room temperature,https://academic.oup.com/nsr/advance-article/doi/10.1093/nsr/nwaf506/8323155?rss=1,2025-11-14 00:00:00 UTC,National Science Review Advance Access,2025-11-14 00:00:00+00:00
Complete biotransformation of cellulose to starch in vitro,https://academic.oup.com/nsr/advance-article/doi/10.1093/nsr/nwaf503/8323153?rss=1,2025-11-14 00:00:00 UTC,National Science Review Advance Access,2025-11-14 00:00:00+00:00
Metal-hydroxyls mediate intramolecular proton transfer in heterogeneous O–O bond formation,https://www.nature.com/articles/s41557-025-01993-8,2025-11-14 00:00:00 UTC,Nature Chemistry,2025-11-14 00:00:00+00:00
Construction of sulfur stereocentres by asymmetric geminate recasting,https://www.nature.com/articles/s41557-025-01996-5,2025-11-14 00:00:00 UTC,Nature Chemistry,2025-11-14 00:00:00+00:00
Metallurgical refractory lining-guided inorganic binder for stable lithium storage in silicon microparticle anodes,http://pubs.rsc.org/en/Content/ArticleLanding/2025/EE/D5EE03194J,2025-11-14 00:00:00 UTC,RSC - Energy Environ. Sci. latest articles,2025-11-14 00:00:00+00:00
Dual hole transport layer for ultra-flexible perovskite solar cells with unprecedented stability,https://www.cell.com/joule/fulltext/S2542-4351(25)00390-3?rss=yes,2025-11-14 00:00:00 UTC,Joule,2025-11-14 00:00:00+00:00
Particle swarm optimization in the realm of chemistry: from theory to applications,http://pubs.rsc.org/en/Content/ArticleLanding/2025/CS/D5CS00912J,2025-11-14 00:00:00 UTC,RSC - Chem. Soc. Rev. latest articles,2025-11-14 00:00:00+00:00
‘Malicious use is already happening’: machine-learning pioneer on making AI safer,https://www.nature.com/articles/d41586-025-03760-8,2025-11-14 00:00:00 UTC,Nature,2025-11-14 00:00:00+00:00
Who will fill the climate-data void left by the Trump administration?,https://www.nature.com/articles/d41586-025-03532-4,2025-11-14 00:00:00 UTC,Nature,2025-11-14 00:00:00+00:00
DFT calculations and theory do not support enantiospecificity in NMR J-coupling constants,https://www.nature.com/articles/s41467-025-66247-0,2025-11-14 00:00:00 UTC,Nature Communications,2025-11-14 00:00:00+00:00
Piezocatalytic nitrate reduction to ammonia in seawater,https://academic.oup.com/nsr/advance-article/doi/10.1093/nsr/nwaf508/8323159?rss=1,2025-11-14 00:00:00 UTC,National Science Review Advance Access,2025-11-14 00:00:00+00:00
Hydrogen-bonded π-conjugated supramolecular polymers,http://pubs.rsc.org/en/Content/ArticleLanding/2025/CS/D5CS00909J,2025-11-14 00:00:00 UTC,RSC - Chem. Soc. Rev. latest articles,2025-11-14 00:00:00+00:00
Van-der-Waals-forces-modulated graphene-P-phenyl-graphene carbon allotropes,https://www.nature.com/articles/s41467-025-64971-1,2025-11-14 00:00:00 UTC,Nature Communications,2025-11-14 00:00:00+00:00
Scalable ruthenium core–shell hydrogen catalyst for efficient and robust proton-exchange membrane electrolyser,https://www.nature.com/articles/s41563-025-02405-5,2025-11-14 00:00:00 UTC,Nature Materials,2025-11-14 00:00:00+00:00
Modelling PM2.5 reduction scenarios for future cardiopulmonary disease reduction,https://www.nature.com/articles/s41893-025-01676-9,2025-11-14 00:00:00 UTC,Nature Sustainability,2025-11-14 00:00:00+00:00
Climate action and clean cooking are vital for sustaining air pollution-related health benefits,https://www.nature.com/articles/s41893-025-01680-z,2025-11-14 00:00:00 UTC,Nature Sustainability,2025-11-14 00:00:00+00:00
Synergistic Cu–OH and zeolite confinement in Cu/MCM-22 for benzaldehyde-mediated Mukaiyama epoxidation of long-chain α-olefins,https://academic.oup.com/nsr/advance-article/doi/10.1093/nsr/nwaf502/8323156?rss=1,2025-11-14 00:00:00 UTC,National Science Review Advance Access,2025-11-14 00:00:00+00:00
A preserved TGFβ cytostatic response through DLD-mediated metabolic modulation undermines anti-TGFβ therapy in gastric cancer,https://www.nature.com/articles/s41467-025-64997-5,2025-11-14 00:00:00 UTC,Nature Communications,2025-11-14 00:00:00+00:00
Biomimetic Janus membrane with spongy channels for directional liquid transport,https://www.nature.com/articles/s41467-025-64964-0,2025-11-14 00:00:00 UTC,Nature Communications,2025-11-14 00:00:00+00:00
Electrodeposition of magnetic nanonetworks featuring triangular motifs and parallel ridges on a macroscopic scale,https://www.nature.com/articles/s41467-025-65589-z,2025-11-14 00:00:00 UTC,Nature Communications,2025-11-14 00:00:00+00:00
CarbaDetector: a machine learning model for detecting carbapenemase-producing Enterobacterales from disk diffusion tests,https://www.nature.com/articles/s41467-025-66183-z,2025-11-14 00:00:00 UTC,Nature Communications,2025-11-14 00:00:00+00:00
Covalent organic framework/hexagonal boron nitride heterostructure photocatalysts for efficient degradation of emerging contaminants,https://www.sciencedirect.com/science/article/pii/S1369702125004626?dgcid=rss_sd_all,2025-11-14 00:00:00 UTC,ScienceDirect Publication: Materials Today,2025-11-14 00:00:00+00:00
Author Correction: Non-temperature environmental drivers modulate warming-induced 21st-century permafrost degradation on the Tibetan Plateau,https://www.nature.com/articles/s41467-025-65187-z,2025-11-14 00:00:00 UTC,Nature Communications,2025-11-14 00:00:00+00:00
Nanoscale domains govern local diffusion and ageing within fused-in-sarcoma condensates,https://www.nature.com/articles/s41565-025-02077-x,2025-11-14 00:00:00 UTC,Nature Nanotechnology,2025-11-14 00:00:00+00:00
Flexoelectric tunnel junctions based on centrosymmetric dielectric monolayer,https://www.sciencedirect.com/science/article/pii/S1369702125004766?dgcid=rss_sd_all,2025-11-14 00:00:00 UTC,ScienceDirect Publication: Materials Today,2025-11-14 00:00:00+00:00
"Multipolarized radar reveals shallow subsurface structure and middle-late Amazonian aqueous activity in Utopia Planitia, Mars",https://academic.oup.com/nsr/advance-article/doi/10.1093/nsr/nwaf505/8323158?rss=1,2025-11-14 00:00:00 UTC,National Science Review Advance Access,2025-11-14 00:00:00+00:00
Multifunctional nanomaterials for dental photo-theranostics,http://pubs.rsc.org/en/Content/ArticleLanding/2025/CS/D5CS00825E,2025-11-14 00:00:00 UTC,RSC - Chem. Soc. Rev. latest articles,2025-11-14 00:00:00+00:00
Spaceport mementos,https://www.nature.com/articles/d41586-025-03688-z,2025-11-14 00:00:00 UTC,Nature,2025-11-14 00:00:00+00:00
Tetrafunctional cyclobutanes tune toughness via network strand continuity,https://www.nature.com/articles/s41557-025-01984-9,2025-11-14 00:00:00 UTC,Nature Chemistry,2025-11-14 00:00:00+00:00
Land use-induced soil carbon loss in the dry tropics nearly offsets gains in northern lands,https://www.nature.com/articles/s41467-025-64929-3,2025-11-14 00:00:00 UTC,Nature Communications,2025-11-14 00:00:00+00:00
Is NIH cutting corners as it rushes to fill leadership positions?,https://www.science.org/content/article/nih-cutting-corners-it-rushes-fill-leadership-positions,2025-11-14 04:55:00 UTC,Latest News from Science Magazine,2025-11-14 04:55:00+00:00
Republican push to make U.S. census surveys voluntary alarms statisticians,https://www.science.org/content/article/republican-push-make-u-s-census-surveys-voluntary-alarms-statisticians,2025-11-14 05:00:00 UTC,Latest News from Science Magazine,2025-11-14 05:00:00+00:00
Serine tRNAs compete to regulate the mRNA translation of serine-sensitive codons,https://www.science.org/doi/abs/10.1126/sciadv.ady4521?af=R,2025-11-14 08:00:00 UTC,AAAS: Science Advances: Table of Contents,2025-11-14 08:00:00+00:00
Bio-inspired material-structure-function integrated additive manufacturing of Al-based metamaterials with surpassing energy absorption,https://www.science.org/doi/abs/10.1126/sciadv.aea0430?af=R,2025-11-14 08:00:00 UTC,AAAS: Science Advances: Table of Contents,2025-11-14 08:00:00+00:00
"Hyperoside, a flavonoid, induces lnc187 and lnc999 to enhance pigeon pea pollen tube growth and seed production",https://www.science.org/doi/abs/10.1126/sciadv.adz3499?af=R,2025-11-14 08:00:00 UTC,AAAS: Science Advances: Table of Contents,2025-11-14 08:00:00+00:00
Quantification of redox thermodynamics shifts within coacervates,https://www.pnas.org/doi/abs/10.1073/pnas.2521526122?mi=eymic2&af=R&access=on&content=articlesChapters&publication=pnas&sortBy=Earliest&target=default,2025-11-14 08:00:00 UTC,Proceedings of the National Academy of Sciences: Keyword search for query,2025-11-14 08:00:00+00:00
RNA binding protein RBM20 regulates turtle temperature-dependent sex determination by repressing the splicing of Wt1 KTS,https://www.science.org/doi/abs/10.1126/sciadv.adv9587?af=R,2025-11-14 08:00:00 UTC,AAAS: Science Advances: Table of Contents,2025-11-14 08:00:00+00:00
Hepatic hypertension on-a-chip identifies GPR116 as a hydrostatic pressure mechanosensor to regulate vascular injury in cirrhosis,https://www.science.org/doi/abs/10.1126/sciadv.adu7596?af=R,2025-11-14 08:00:00 UTC,AAAS: Science Advances: Table of Contents,2025-11-14 08:00:00+00:00
Adaptation of hippocampal spatial and contextual representations to task structure,https://www.science.org/doi/abs/10.1126/sciadv.adu4899?af=R,2025-11-14 08:00:00 UTC,AAAS: Science Advances: Table of Contents,2025-11-14 08:00:00+00:00
Structural and epistatic regulatory variants cause hallmark white spotting in cattle,https://www.science.org/doi/abs/10.1126/sciadv.adt5913?af=R,2025-11-14 08:00:00 UTC,AAAS: Science Advances: Table of Contents,2025-11-14 08:00:00+00:00
Neurodevelopmental disorder–linked Argonaute mutations permit delayed RISC formation and unusual shortening of miRNAs by 3′→5′ trimming,https://www.pnas.org/doi/abs/10.1073/pnas.2524644122?mi=eymic2&af=R&access=on&content=articlesChapters&publication=pnas&sortBy=Earliest&target=default,2025-11-14 08:00:00 UTC,Proceedings of the National Academy of Sciences: Keyword search for query,2025-11-14 08:00:00+00:00
Structure of the D1-Val185Asn mutated photosystem II complex with slow O–O bond formation reveals changes in the Cl1 water channel,https://www.pnas.org/doi/abs/10.1073/pnas.2522652122?mi=eymic2&af=R&access=on&content=articlesChapters&publication=pnas&sortBy=Earliest&target=default,2025-11-14 08:00:00 UTC,Proceedings of the National Academy of Sciences: Keyword search for query,2025-11-14 08:00:00+00:00
Advancing stochastic 3-SAT solvers by dissipating oversatisfied constraints,https://www.pnas.org/doi/abs/10.1073/pnas.2517297122?mi=eymic2&af=R&access=on&content=articlesChapters&publication=pnas&sortBy=Earliest&target=default,2025-11-14 08:00:00 UTC,Proceedings of the National Academy of Sciences: Keyword search for query,2025-11-14 08:00:00+00:00
Hybrid functional 3D artificial synapses for convolution and reinforcement learning,https://www.science.org/doi/abs/10.1126/sciadv.adw7498?af=R,2025-11-14 08:00:00 UTC,AAAS: Science Advances: Table of Contents,2025-11-14 08:00:00+00:00
Platelets induce endothelial cell mitochondrial dysfunction in myocardial infarction,https://www.science.org/doi/abs/10.1126/sciadv.adx0268?af=R,2025-11-14 08:00:00 UTC,AAAS: Science Advances: Table of Contents,2025-11-14 08:00:00+00:00
Ist2 promotes lipid transfer by Osh6 via its membrane tethering and lipid scramblase activities,https://www.science.org/doi/abs/10.1126/sciadv.adz2217?af=R,2025-11-14 08:00:00 UTC,AAAS: Science Advances: Table of Contents,2025-11-14 08:00:00+00:00
Discovery of crystalline Fe2O3 in returned lunar soils,https://www.science.org/doi/abs/10.1126/sciadv.ady5169?af=R,2025-11-14 08:00:00 UTC,AAAS: Science Advances: Table of Contents,2025-11-14 08:00:00+00:00
mTORC1 regulates autophagosomal components recycling through SNX16 phosphorylation,https://www.pnas.org/doi/abs/10.1073/pnas.2511069122?mi=eymic2&af=R&access=on&content=articlesChapters&publication=pnas&sortBy=Earliest&target=default,2025-11-14 08:00:00 UTC,Proceedings of the National Academy of Sciences: Keyword search for query,2025-11-14 08:00:00+00:00
Artificial Intelligence vs Human Intelligence?,https://pubs.acs.org/doi/10.1021/acsenergylett.5c03509?af=R,2025-11-14 08:00:00 UTC,acs: ACS Energy Letters: Table of Contents,2025-11-14 08:00:00+00:00
Mapping neurophysiological and molecular profiles of heterogeneity and homogeneity in schizophrenia-bipolar disorder,https://www.science.org/doi/abs/10.1126/sciadv.adz0389?af=R,2025-11-14 08:00:00 UTC,AAAS: Science Advances: Table of Contents,2025-11-14 08:00:00+00:00
How public involvement can improve the science of AI,https://www.pnas.org/doi/abs/10.1073/pnas.2421111122?mi=eymic2&af=R&access=on&content=articlesChapters&publication=pnas&sortBy=Earliest&target=default,2025-11-14 08:00:00 UTC,Proceedings of the National Academy of Sciences: Keyword search for query,2025-11-14 08:00:00+00:00
Contractile forces direct the chiral swirling of minimal cell collectives,https://www.pnas.org/doi/abs/10.1073/pnas.2415028122?mi=eymic2&af=R&access=on&content=articlesChapters&publication=pnas&sortBy=Earliest&target=default,2025-11-14 08:00:00 UTC,Proceedings of the National Academy of Sciences: Keyword search for query,2025-11-14 08:00:00+00:00
The Kinship Formula: Inferring the numbers of all kin from any structured population projection model,https://www.pnas.org/doi/abs/10.1073/pnas.2411888122?mi=eymic2&af=R&access=on&content=articlesChapters&publication=pnas&sortBy=Earliest&target=default,2025-11-14 08:00:00 UTC,Proceedings of the National Academy of Sciences: Keyword search for query,2025-11-14 08:00:00+00:00
Comparing photosynthetic light harvesting of single photons and pseudothermal light under ultraweak illumination,https://www.science.org/doi/abs/10.1126/sciadv.adz2616?af=R,2025-11-14 08:00:00 UTC,AAAS: Science Advances: Table of Contents,2025-11-14 08:00:00+00:00
Meltwater from West Antarctic ice sheet tipping affects AMOC resilience,https://www.science.org/doi/abs/10.1126/sciadv.adw3852?af=R,2025-11-14 08:00:00 UTC,AAAS: Science Advances: Table of Contents,2025-11-14 08:00:00+00:00
Digital and plasmonic artificial neural networks—Improved nonlinear signal processing at high speed and low complexity,https://www.science.org/doi/abs/10.1126/sciadv.adx1657?af=R,2025-11-14 08:00:00 UTC,AAAS: Science Advances: Table of Contents,2025-11-14 08:00:00+00:00
PIEZO1 gain-of-function mutation drives cardiomyopathy by disrupting myocardial lipid homeostasis besides iron overload,https://www.science.org/doi/abs/10.1126/sciadv.ady9242?af=R,2025-11-14 08:00:00 UTC,AAAS: Science Advances: Table of Contents,2025-11-14 08:00:00+00:00
Severe floods significantly reduce global rice yields,https://www.science.org/doi/abs/10.1126/sciadv.adx7799?af=R,2025-11-14 08:00:00 UTC,AAAS: Science Advances: Table of Contents,2025-11-14 08:00:00+00:00
Anomalous electrostriction degradation in Sm-doped ceria ceramics at room temperature,https://www.science.org/doi/abs/10.1126/sciadv.adx4319?af=R,2025-11-14 08:00:00 UTC,AAAS: Science Advances: Table of Contents,2025-11-14 08:00:00+00:00
