title,link,published,source,pub_date
Scalable synthesis of semiconducting MoB2 nanosheets for flexible and multifunctional UV–Vis photodetection,https://www.sciencedirect.com/science/article/pii/S1369702125004663?dgcid=rss_sd_all,2025-11-09 00:00:00 UTC,ScienceDirect Publication: Materials Today,2025-11-09 00:00:00+00:00
James Watson: Titan of science with tragic flaws,https://www.science.org/content/article/james-watson-titan-science-tragic-flaws,2025-11-09 05:30:00 UTC,Latest News from Science Magazine,2025-11-09 05:30:00+00:00
Back from the brink: UK red kites aid Spanish cousins,https://www.bbc.com/news/articles/crrez8x7l55o?at_medium=RSS&at_campaign=rss,2025-11-09 07:38:34 UTC,BBC News,2025-11-09 07:38:34+00:00
[ASAP] Sulfur-MOP: A Highly Robust Metal–Organic Polyhedron Built with Nickel Thiocarboxylate Paddlewheels,http://dx.doi.org/10.1021/jacs.5c14365,2025-11-09 13:51:00 UTC,Journal of the American Chemical Society: Latest Articles (ACS Publications),2025-11-09 13:51:00+00:00
[ASAP] Stereoselective De Novo Construction of Cyclopropane by a Multifunctional Class I Aldolase,http://dx.doi.org/10.1021/jacs.5c13402,2025-11-09 17:46:31 UTC,Journal of the American Chemical Society: Latest Articles (ACS Publications),2025-11-09 17:46:31+00:00
[ASAP] Dynamic Surface Restructuring Driven Formation of a Highly Polarized CO Species on a Defected Copper Surface,http://dx.doi.org/10.1021/jacs.5c12851,2025-11-09 17:47:30 UTC,Journal of the American Chemical Society: Latest Articles (ACS Publications),2025-11-09 17:47:30+00:00
[ASAP] Algorithm-Guided Experimentation for Optimization of High-Performance Perovskite Solar Cells,http://dx.doi.org/10.1021/acsenergylett.5c02477,2025-11-09 18:02:06 UTC,ACS Energy Letters: Latest Articles (ACS Publications),2025-11-09 18:02:06+00:00
[ASAP] Chemical Recycling of Polyesters and Polycarbonates: Why Is Zinc(II) Such an Effective Depolymerization Catalyst?,http://dx.doi.org/10.1021/jacs.5c16346,2025-11-09 19:02:08 UTC,Journal of the American Chemical Society: Latest Articles (ACS Publications),2025-11-09 19:02:08+00:00
Witnessing chamois populations recover,https://www.nature.com/articles/d41586-025-03640-1,2025-11-10 00:00:00 UTC,Nature,2025-11-10 00:00:00+00:00
Flexible perovskite/silicon tandem solar cell with a dual buffer layer,https://www.nature.com/articles/s41586-025-09835-w,2025-11-10 00:00:00 UTC,Nature,2025-11-10 00:00:00+00:00
Publisher Correction: Radiation-induced amphiregulin drives tumour metastasis,https://www.nature.com/articles/s41586-025-09862-7,2025-11-10 00:00:00 UTC,Nature,2025-11-10 00:00:00+00:00
Aligned-pore engineering: Decoupling gas-liquid transport in gas diffusion electrodes,https://www.cell.com/joule/fulltext/S2542-4351(25)00380-0?rss=yes,2025-11-10 00:00:00 UTC,Joule,2025-11-10 00:00:00+00:00
Flexible perovskite/silicon tandem solar cells with 33.6% efficiency,https://www.nature.com/articles/s41586-025-09849-4,2025-11-10 00:00:00 UTC,Nature,2025-11-10 00:00:00+00:00
The human right to a safe climate,https://www.nature.com/articles/s41893-025-01700-y,2025-11-10 00:00:00 UTC,Nature Sustainability,2025-11-10 00:00:00+00:00
Sand-mining-driven reduction in Tonle Sap Lake’s critical flood pulse,https://www.nature.com/articles/s41893-025-01677-8,2025-11-10 00:00:00 UTC,Nature Sustainability,2025-11-10 00:00:00+00:00
Environmental impact and net-zero pathways for sustainable artificial intelligence servers in the USA,https://www.nature.com/articles/s41893-025-01681-y,2025-11-10 00:00:00 UTC,Nature Sustainability,2025-11-10 00:00:00+00:00
Decarboxylative photocatalytic transformations,http://pubs.rsc.org/en/Content/ArticleLanding/2025/CS/D4CS01051E,2025-11-10 00:00:00 UTC,RSC - Chem. Soc. Rev. latest articles,2025-11-10 00:00:00+00:00
Breaking the activity-stability trade-off with a high-entropy perovskite oxygen electrode for sustainable solid oxide cells,https://www.cell.com/joule/fulltext/S2542-4351(25)00379-4?rss=yes,2025-11-10 00:00:00 UTC,Joule,2025-11-10 00:00:00+00:00
Author Correction: The oldest known lepidosaur and origins of lepidosaur feeding adaptations,https://www.nature.com/articles/s41586-025-09782-6,2025-11-10 00:00:00 UTC,Nature,2025-11-10 00:00:00+00:00
Formaldehyde and its surrogates as a C1 platform for defossilised modern societies,http://pubs.rsc.org/en/Content/ArticleLanding/2025/CS/D5CS00882D,2025-11-10 00:00:00 UTC,RSC - Chem. Soc. Rev. latest articles,2025-11-10 00:00:00+00:00
Dynamic photothermal modulation in energy-efficient buildings,https://www.sciencedirect.com/science/article/pii/S1369702125004675?dgcid=rss_sd_all,2025-11-10 00:00:00 UTC,ScienceDirect Publication: Materials Today,2025-11-10 00:00:00+00:00
"Electrolyte engineering and nanoarchitectonics for aqueous zinc-ion batteries: Challenges, solutions, and practical applications",https://www.sciencedirect.com/science/article/pii/S1369702125004614?dgcid=rss_sd_all,2025-11-10 00:00:00 UTC,ScienceDirect Publication: Materials Today,2025-11-10 00:00:00+00:00
Microhole array metasurface-enhanced InAs/GaSb superlattice LWIR detectors with boosted photoresponse via guided-mode resonance coupling,https://www.sciencedirect.com/science/article/pii/S136970212500464X?dgcid=rss_sd_all,2025-11-10 00:00:00 UTC,ScienceDirect Publication: Materials Today,2025-11-10 00:00:00+00:00
Vaccine advice: how a US centre is filling growing gaps in public-health information,https://www.nature.com/articles/d41586-025-03625-0,2025-11-10 00:00:00 UTC,Nature,2025-11-10 00:00:00+00:00
Africa finally has its own drug-regulation agency — and it could transform the continent’s health,https://www.nature.com/articles/d41586-025-03637-w,2025-11-10 00:00:00 UTC,Nature,2025-11-10 00:00:00+00:00
Hamilton Smith obituary: molecular biologist who co-discovered precise molecular scissors for cutting DNA,https://www.nature.com/articles/d41586-025-03635-y,2025-11-10 00:00:00 UTC,Nature,2025-11-10 00:00:00+00:00
Rebuilding Ukraine — one university’s bold vision,https://www.nature.com/articles/d41586-025-03638-9,2025-11-10 00:00:00 UTC,Nature,2025-11-10 00:00:00+00:00
"Don’t despair, collective action can address climate change",https://www.nature.com/articles/d41586-025-03634-z,2025-11-10 00:00:00 UTC,Nature,2025-11-10 00:00:00+00:00
Vaccine advice based on science: US centre fills gaps in public-health information,https://www.nature.com/articles/d41586-025-03625-0,2025-11-10 00:00:00 UTC,Nature,2025-11-10 00:00:00+00:00
Electromagnetic Situation Awareness and Modeling for Space-Air-Ground Integrated Networks,https://academic.oup.com/nsr/advance-article/doi/10.1093/nsr/nwaf492/8317941?rss=1,2025-11-10 00:00:00 UTC,National Science Review Advance Access,2025-11-10 00:00:00+00:00
Bridging multiscale dynamics with AIE: a case study in polymer emulsions,https://academic.oup.com/nsr/advance-article/doi/10.1093/nsr/nwaf494/8317936?rss=1,2025-11-10 00:00:00 UTC,National Science Review Advance Access,2025-11-10 00:00:00+00:00
Human infections with avian influenza a(H5) viruses with potential pandemic risk: 1997-2025,https://academic.oup.com/nsr/advance-article/doi/10.1093/nsr/nwaf471/8317928?rss=1,2025-11-10 00:00:00 UTC,National Science Review Advance Access,2025-11-10 00:00:00+00:00
A sustained-release strategy of fluorinated solvents enables highly safe lithium metal batteries,http://pubs.rsc.org/en/Content/ArticleLanding/2025/EE/D5EE03640B,2025-11-10 00:00:00 UTC,RSC - Energy Environ. Sci. latest articles,2025-11-10 00:00:00+00:00
Want a younger brain? Learn another language,https://www.nature.com/articles/d41586-025-03677-2,2025-11-10 00:00:00 UTC,Nature,2025-11-10 00:00:00+00:00
Gut-primed neutrophils activate Kupffer cells to promote hepatic injury in mouse sepsis,https://www.nature.com/articles/s41467-025-65572-8,2025-11-10 00:00:00 UTC,Nature Communications,2025-11-10 00:00:00+00:00
A fault-tolerant neutral-atom architecture for universal quantum computation,https://www.nature.com/articles/s41586-025-09848-5,2025-11-10 00:00:00 UTC,Nature,2025-11-10 00:00:00+00:00
Prognostic value of an abnormal chest X-ray result in predicting the development of tuberculosis,https://www.nature.com/articles/s41467-025-64834-9,2025-11-10 00:00:00 UTC,Nature Communications,2025-11-10 00:00:00+00:00
LUBAC modulates CBM complex functions downstream of TRAF6 in T cells,https://www.nature.com/articles/s41467-025-65879-6,2025-11-10 00:00:00 UTC,Nature Communications,2025-11-10 00:00:00+00:00
Fluctuation-learning relationship in recurrent neural networks,https://www.nature.com/articles/s41467-025-64976-w,2025-11-10 00:00:00 UTC,Nature Communications,2025-11-10 00:00:00+00:00
"Cross-sectional survey of the incidence, mortality and socioeconomic burden of snakebite envenoming in India",https://www.nature.com/articles/s41467-025-64849-2,2025-11-10 00:00:00 UTC,Nature Communications,2025-11-10 00:00:00+00:00
Beyond the niche - unlocking the full potential of synthetic riboswitches,https://www.nature.com/articles/s41467-025-65808-7,2025-11-10 00:00:00 UTC,Nature Communications,2025-11-10 00:00:00+00:00
Magnetostrictive mechanical frequency combs,https://www.nature.com/articles/s41467-025-64878-x,2025-11-10 00:00:00 UTC,Nature Communications,2025-11-10 00:00:00+00:00
Surface-plasmon control of ultrafast energy-relaxation modes in photoexcited Au nanorods probed by time-resolved single-particle X-ray imaging,https://www.nature.com/articles/s41467-025-64853-6,2025-11-10 00:00:00 UTC,Nature Communications,2025-11-10 00:00:00+00:00
"COP30: Trump and many leaders are skipping it, so does the summit still have a point?",https://www.bbc.com/news/articles/c205jvyg3wjo?at_medium=RSS&at_campaign=rss,2025-11-10 00:09:19 UTC,BBC News,2025-11-10 00:09:19+00:00
Canadian government kills ostriches afflicted by H5N1 despite appeal from RFK Jr.,https://www.science.org/content/article/canadian-government-kills-ostriches-afflicted-h5n1-despite-appeal-rfk-jr,2025-11-10 03:45:00 UTC,Latest News from Science Magazine,2025-11-10 03:45:00+00:00
The twisted secret behind a chameleon’s oddball eyes,https://www.science.org/content/article/twisted-secret-behind-chameleon-s-oddball-eyes,2025-11-10 05:00:00 UTC,Latest News from Science Magazine,2025-11-10 05:00:00+00:00
Sand mining threatens Asia’s largest lake,https://www.science.org/content/article/sand-mining-threatens-asia-s-largest-lake,2025-11-10 06:00:00 UTC,Latest News from Science Magazine,2025-11-10 06:00:00+00:00
Coordination Engineering of Iron‐Polyphthalocyanines with H‐Substituted Graphdiyne for the Tandem Catalysis of Nitrate to Hydroxylamine,https://onlinelibrary.wiley.com/doi/10.1002/anie.202517615?af=R,2025-11-10 07:59:43 UTC,Wiley: Angewandte Chemie International Edition: Table of Contents,2025-11-10 07:59:43+00:00
Co‐Free and Ni‐Minimized Li‐ and Mn‐Rich Layered Cathodes With Suppressed Structural Disordering for High‐Performance and Cost‐Effective LIBs,https://advanced.onlinelibrary.wiley.com/doi/10.1002/aenm.202505121?af=R,2025-11-10 08:00:00 UTC,Wiley: Advanced Energy Materials: Table of Contents,2025-11-10 08:00:00+00:00
Pressure-induced redox reversal of iron and the distribution of elements in deep Earth,https://www.pnas.org/doi/abs/10.1073/pnas.2414911122?mi=eymic2&af=R&access=on&content=articlesChapters&publication=pnas&sortBy=Earliest&target=default,2025-11-10 08:00:00 UTC,Proceedings of the National Academy of Sciences: Keyword search for query,2025-11-10 08:00:00+00:00
Biomolecular condensation of ERC1 recruits ATG8 and NBR1 to drive autophagosome formation for plant heat tolerance,https://www.pnas.org/doi/abs/10.1073/pnas.2425689122?mi=eymic2&af=R&access=on&content=articlesChapters&publication=pnas&sortBy=Earliest&target=default,2025-11-10 08:00:00 UTC,Proceedings of the National Academy of Sciences: Keyword search for query,2025-11-10 08:00:00+00:00
Design strategies for ion-sieving charge mosaic membranes toward sustainable lithium extraction,https://www.pnas.org/doi/abs/10.1073/pnas.2511666122?mi=eymic2&af=R&access=on&content=articlesChapters&publication=pnas&sortBy=Earliest&target=default,2025-11-10 08:00:00 UTC,Proceedings of the National Academy of Sciences: Keyword search for query,2025-11-10 08:00:00+00:00
Auxin transport positions stem cells in the vascular cambium during normal development and regeneration,https://www.pnas.org/doi/abs/10.1073/pnas.2511087122?mi=eymic2&af=R&access=on&content=articlesChapters&publication=pnas&sortBy=Earliest&target=default,2025-11-10 08:00:00 UTC,Proceedings of the National Academy of Sciences: Keyword search for query,2025-11-10 08:00:00+00:00
Synergistic interactions between Candida albicans and Enterococcus faecalis promote toxin-dependent host cell damage,https://www.pnas.org/doi/abs/10.1073/pnas.2505310122?mi=eymic2&af=R&access=on&content=articlesChapters&publication=pnas&sortBy=Earliest&target=default,2025-11-10 08:00:00 UTC,Proceedings of the National Academy of Sciences: Keyword search for query,2025-11-10 08:00:00+00:00
"Early female germline development in Xenopus laevis: Stem cells, nurse cells, and germline cysts",https://www.pnas.org/doi/abs/10.1073/pnas.2522343122?mi=eymic2&af=R&access=on&content=articlesChapters&publication=pnas&sortBy=Earliest&target=default,2025-11-10 08:00:00 UTC,Proceedings of the National Academy of Sciences: Keyword search for query,2025-11-10 08:00:00+00:00
Forecasting weather and health heat impact,https://www.pnas.org/doi/abs/10.1073/pnas.2525458122?mi=eymic2&af=R&access=on&content=articlesChapters&publication=pnas&sortBy=Earliest&target=default,2025-11-10 08:00:00 UTC,Proceedings of the National Academy of Sciences: Keyword search for query,2025-11-10 08:00:00+00:00
"Genome synthesis, assembly, and rebooting of therapeutically useful high G+C% mycobacteriophages",https://www.pnas.org/doi/abs/10.1073/pnas.2523871122?mi=eymic2&af=R&access=on&content=articlesChapters&publication=pnas&sortBy=Earliest&target=default,2025-11-10 08:00:00 UTC,Proceedings of the National Academy of Sciences: Keyword search for query,2025-11-10 08:00:00+00:00
Neither inaccurate nor biased in later life: Age-related differences in the accuracy and bias of facial trustworthiness judgment,https://www.pnas.org/doi/abs/10.1073/pnas.2512093122?mi=eymic2&af=R&access=on&content=articlesChapters&publication=pnas&sortBy=Earliest&target=default,2025-11-10 08:00:00 UTC,Proceedings of the National Academy of Sciences: Keyword search for query,2025-11-10 08:00:00+00:00
High-energy impact and vapor recondensation history of the angrite parent body revealed by nickel isotopes,https://www.pnas.org/doi/abs/10.1073/pnas.2519759122?mi=eymic2&af=R&access=on&content=articlesChapters&publication=pnas&sortBy=Earliest&target=default,2025-11-10 08:00:00 UTC,Proceedings of the National Academy of Sciences: Keyword search for query,2025-11-10 08:00:00+00:00
Pollen-inspired biopolymer-based multifunctional films,https://www.pnas.org/doi/abs/10.1073/pnas.2517985122?mi=eymic2&af=R&access=on&content=articlesChapters&publication=pnas&sortBy=Earliest&target=default,2025-11-10 08:00:00 UTC,Proceedings of the National Academy of Sciences: Keyword search for query,2025-11-10 08:00:00+00:00
"Fluorescein-based dyes are not valid reporters of oxidative stress in bacteria, and conclusions based on their use must be reconsidered",https://www.pnas.org/doi/abs/10.1073/pnas.2516113122?mi=eymic2&af=R&access=on&content=articlesChapters&publication=pnas&sortBy=Earliest&target=default,2025-11-10 08:00:00 UTC,Proceedings of the National Academy of Sciences: Keyword search for query,2025-11-10 08:00:00+00:00
Engineering chronological lifespan toward a robust yeast cell factory,https://www.pnas.org/doi/abs/10.1073/pnas.2515324122?mi=eymic2&af=R&access=on&content=articlesChapters&publication=pnas&sortBy=Earliest&target=default,2025-11-10 08:00:00 UTC,Proceedings of the National Academy of Sciences: Keyword search for query,2025-11-10 08:00:00+00:00
Spatial variation in the mutation rate within the plant shoot apical meristem,https://www.pnas.org/doi/abs/10.1073/pnas.2514507122?mi=eymic2&af=R&access=on&content=articlesChapters&publication=pnas&sortBy=Earliest&target=default,2025-11-10 08:00:00 UTC,Proceedings of the National Academy of Sciences: Keyword search for query,2025-11-10 08:00:00+00:00
"Strategy for coordinating near-term PM2.5, ozone, and CO2 mitigation in China",https://www.pnas.org/doi/abs/10.1073/pnas.2513194122?mi=eymic2&af=R&access=on&content=articlesChapters&publication=pnas&sortBy=Earliest&target=default,2025-11-10 08:00:00 UTC,Proceedings of the National Academy of Sciences: Keyword search for query,2025-11-10 08:00:00+00:00
Warming waters herald a submarine eruption,https://www.pnas.org/doi/abs/10.1073/pnas.2526455122?mi=eymic2&af=R&access=on&content=articlesChapters&publication=pnas&sortBy=Earliest&target=default,2025-11-10 08:00:00 UTC,Proceedings of the National Academy of Sciences: Keyword search for query,2025-11-10 08:00:00+00:00
Testing whether connectivity stabilizes metacommunities and rescues declining diversity in a 25-y grassland study,https://www.pnas.org/doi/abs/10.1073/pnas.2520768122?mi=eymic2&af=R&access=on&content=articlesChapters&publication=pnas&sortBy=Earliest&target=default,2025-11-10 08:00:00 UTC,Proceedings of the National Academy of Sciences: Keyword search for query,2025-11-10 08:00:00+00:00
The invisible subsoil compaction risk under no-till farming,https://www.pnas.org/doi/abs/10.1073/pnas.2515473122?mi=eymic2&af=R&access=on&content=articlesChapters&publication=pnas&sortBy=Earliest&target=default,2025-11-10 08:00:00 UTC,Proceedings of the National Academy of Sciences: Keyword search for query,2025-11-10 08:00:00+00:00
Correction to “A Small‐Molecule Drug for the Self‐Checking of Mitophagy”,https://onlinelibrary.wiley.com/doi/10.1002/anie.202523766?af=R,2025-11-10 08:03:52 UTC,Wiley: Angewandte Chemie International Edition: Table of Contents,2025-11-10 08:03:52+00:00
Domain‐Trained Language Model for Inverse Design and Synthesis of High‐Performance Hydrogen Storage MOFs,https://onlinelibrary.wiley.com/doi/10.1002/anie.202513366?af=R,2025-11-10 08:05:22 UTC,Wiley: Angewandte Chemie International Edition: Table of Contents,2025-11-10 08:05:22+00:00
A Zinc Ion Capacitor‐Based Fluidic Memristor,https://advanced.onlinelibrary.wiley.com/doi/10.1002/adma.202512592?af=R,2025-11-10 08:11:22 UTC,Wiley: Advanced Materials: Table of Contents,2025-11-10 08:11:22+00:00
Homogeneous SnF2‐Induced Strain Modulation in Sn–Pb Perovskites for High‐Performance Monolithic All‐Perovskite Tandem Solar Cells,https://onlinelibrary.wiley.com/doi/10.1002/anie.202515733?af=R,2025-11-10 08:12:15 UTC,Wiley: Angewandte Chemie International Edition: Table of Contents,2025-11-10 08:12:15+00:00
Programmable DNA Nanospheres for Photothermal‐Controlled Intracellular Protein Degradation,https://onlinelibrary.wiley.com/doi/10.1002/anie.202517452?af=R,2025-11-10 08:13:48 UTC,Wiley: Angewandte Chemie International Edition: Table of Contents,2025-11-10 08:13:48+00:00
Elucidating the Donor/Acceptor Regulatory Mechanism for CO2 Electroreduction,https://advanced.onlinelibrary.wiley.com/doi/10.1002/adma.202512478?af=R,2025-11-10 08:20:43 UTC,Wiley: Advanced Materials: Table of Contents,2025-11-10 08:20:43+00:00
"Reaction of Blatter and Verdazyl Radicals with Arynes: Synthesis and Investigation of N‐Chiral, Antiaromatic Triazines, and Tetrazinones",https://onlinelibrary.wiley.com/doi/10.1002/anie.202520021?af=R,2025-11-10 08:25:12 UTC,Wiley: Angewandte Chemie International Edition: Table of Contents,2025-11-10 08:25:12+00:00
NADH Mimic‐Decorated Coordination Capsules for Biomimetic Capture of NO and Electrocatalytic Reduction to NH3,https://onlinelibrary.wiley.com/doi/10.1002/anie.202519123?af=R,2025-11-10 08:27:43 UTC,Wiley: Angewandte Chemie International Edition: Table of Contents,2025-11-10 08:27:43+00:00
Cryogenic Carbon Monoxide Oxidation on Cuprous Oxide,https://onlinelibrary.wiley.com/doi/10.1002/anie.202515673?af=R,2025-11-10 08:28:46 UTC,Wiley: Angewandte Chemie International Edition: Table of Contents,2025-11-10 08:28:46+00:00
Structural and Interfacial Design of Atomically Thin Materials and Their Heterostructures for Advancing Electrocatalysis,https://onlinelibrary.wiley.com/doi/10.1002/adma.202515722?af=R,2025-11-10 08:33:36 UTC,Wiley: Advanced Materials: Table of Contents,2025-11-10 08:33:36+00:00
Non‐Fused Carbonyl/Nitrogen Multi‐Resonance Emitters Enable Efficient Pure‐Red Narrowband Electroluminescence,https://onlinelibrary.wiley.com/doi/10.1002/anie.202518808?af=R,2025-11-10 08:35:14 UTC,Wiley: Angewandte Chemie International Edition: Table of Contents,2025-11-10 08:35:14+00:00
"Customized Molecular Design of a Novel Wide‐Bandgap Polymer Donor Based on Benzo[1,2‐b:3,4‐b′:6,5‐b″]Trithiophene Unit with Over 20% Solar Cell Efficiency",https://advanced.onlinelibrary.wiley.com/doi/10.1002/adma.202516146?af=R,2025-11-10 08:35:21 UTC,Wiley: Advanced Materials: Table of Contents,2025-11-10 08:35:21+00:00
"2D Assemblies Based on a Tetraphenylethylene D,L‐Cyclic Peptide Scaffold",https://onlinelibrary.wiley.com/doi/10.1002/anie.202514543?af=R,2025-11-10 08:40:23 UTC,Wiley: Angewandte Chemie International Edition: Table of Contents,2025-11-10 08:40:23+00:00
Tannin‐Mediated Ischemia‐Homing‐Angiogenesis Nanodots (IHAND) for Synergistic Angiogenesis and Heart Failure Prevention Post‐Myocardial Infarction,https://advanced.onlinelibrary.wiley.com/doi/10.1002/adma.202514662?af=R,2025-11-10 08:42:40 UTC,Wiley: Advanced Materials: Table of Contents,2025-11-10 08:42:40+00:00
Phosphorus‐Enhanced Anodes: A Scalable Solution to Transition‐Metal Ion Crosstalk in High‐Energy Lithium‐Ion Batteries,https://onlinelibrary.wiley.com/doi/10.1002/anie.202518717?af=R,2025-11-10 08:43:45 UTC,Wiley: Angewandte Chemie International Edition: Table of Contents,2025-11-10 08:43:45+00:00
"Three Conformations, Four Stimuli: Balancing Bond Order and Aromaticity in a Dual‐BN Dihydrophenazine Switch",https://onlinelibrary.wiley.com/doi/10.1002/anie.202522719?af=R,2025-11-10 08:45:45 UTC,Wiley: Angewandte Chemie International Edition: Table of Contents,2025-11-10 08:45:45+00:00
Tuning Amorphous‐Crystalline Catalytic Interfaces by Mechanochemistry: Cu‐Based Metallic Glasses Coupled with Ceria for CO Oxidation,https://onlinelibrary.wiley.com/doi/10.1002/adma.202511305?af=R,2025-11-10 08:50:25 UTC,Wiley: Advanced Materials: Table of Contents,2025-11-10 08:50:25+00:00
Reversible Thermally Driven Phenyl Torsion in Self‐Assembled Monolayers Releases Strain for Heat‐Resilient Inverted Perovskite Solar Cells,https://onlinelibrary.wiley.com/doi/10.1002/anie.202521774?af=R,2025-11-10 08:51:38 UTC,Wiley: Angewandte Chemie International Edition: Table of Contents,2025-11-10 08:51:38+00:00
[ASAP] Au76(SC6H4-p-CH3)42 Square Quantum Platelet: One-Dimensional Growth of Quantum Rods Turns 90 Degrees,http://dx.doi.org/10.1021/jacs.5c14654,2025-11-10 09:00:59 UTC,Journal of the American Chemical Society: Latest Articles (ACS Publications),2025-11-10 09:00:59+00:00
Local Coordination‐Dependent CO2 Reduction Activity of Bimetallic Cu─Al Catalysts for Selective Ethylene/Ethanol Electrosynthesis,https://onlinelibrary.wiley.com/doi/10.1002/anie.202520291?af=R,2025-11-10 09:08:40 UTC,Wiley: Angewandte Chemie International Edition: Table of Contents,2025-11-10 09:08:40+00:00
[ASAP] Unraveling the Dynamic Low-Spin State Evolution of Single-Fe-Atom Sites for Efficient CO2 Electroreduction,http://dx.doi.org/10.1021/jacs.5c13466,2025-11-10 09:25:02 UTC,Journal of the American Chemical Society: Latest Articles (ACS Publications),2025-11-10 09:25:02+00:00
[ASAP] Effective Recycling Pathways of Commodity Polymers Enabled by Mechanoradical Capture,http://dx.doi.org/10.1021/jacs.5c13585,2025-11-10 09:25:54 UTC,Journal of the American Chemical Society: Latest Articles (ACS Publications),2025-11-10 09:25:54+00:00
[ASAP] Hydrogen Bond-Assisted Two-Component Lipid Nanoparticles for Spleen-Specific mRNA Delivery,http://dx.doi.org/10.1021/jacs.5c14194,2025-11-10 09:26:41 UTC,Journal of the American Chemical Society: Latest Articles (ACS Publications),2025-11-10 09:26:41+00:00
[ASAP] Luminescent Perhalofluoro Trityl Radicals,http://dx.doi.org/10.1021/jacs.5c16418,2025-11-10 09:27:51 UTC,Journal of the American Chemical Society: Latest Articles (ACS Publications),2025-11-10 09:27:51+00:00
Square‐Planar Ruthenium Alkylidyne Complexes Undergo Stepwise Rather Than Concerted [2 + 2] Cycloadditions with Alkynes,https://onlinelibrary.wiley.com/doi/10.1002/anie.202519905?af=R,2025-11-10 09:28:13 UTC,Wiley: Angewandte Chemie International Edition: Table of Contents,2025-11-10 09:28:13+00:00
Natural Resin Nanofilms through Flexible Coordination for Molecular Separation,https://onlinelibrary.wiley.com/doi/10.1002/anie.202513921?af=R,2025-11-10 09:29:41 UTC,Wiley: Angewandte Chemie International Edition: Table of Contents,2025-11-10 09:29:41+00:00
"The Biicosahedral Complex Anions [M(B11H11)2]3− (M = Cu, Ag, Au): Synthesis and Unexpected Low‐Temperature Phase Transition of [Ag(η5‐B11H11)2]3− to [Ag(η2‐B11H11)2]3−",https://onlinelibrary.wiley.com/doi/10.1002/anie.202519283?af=R,2025-11-10 09:31:45 UTC,Wiley: Angewandte Chemie International Edition: Table of Contents,2025-11-10 09:31:45+00:00
Direct C─H Lactonization of Carboxylic Acids Enabled by LMCT Photoactivation,https://onlinelibrary.wiley.com/doi/10.1002/anie.202515582?af=R,2025-11-10 09:32:57 UTC,Wiley: Angewandte Chemie International Edition: Table of Contents,2025-11-10 09:32:57+00:00
Solvation‐Shell Engineering Enables Additive‐Dominated Coordination for Stable Silicon Anodes Under Minimal Salt Conditions,https://onlinelibrary.wiley.com/doi/10.1002/anie.202518092?af=R,2025-11-10 09:40:13 UTC,Wiley: Angewandte Chemie International Edition: Table of Contents,2025-11-10 09:40:13+00:00
