title,link,published,source,pub_date
Insatiable squirrel ravages cherry blossoms for breakfast,https://www.nature.com/articles/d41586-025-03456-z,2025-11-11 00:00:00 UTC,Nature,2025-11-11 00:00:00+00:00
COP meetings must evolve to turn climate promises into action,https://www.nature.com/articles/d41586-025-03682-5,2025-11-11 00:00:00 UTC,Nature,2025-11-11 00:00:00+00:00
Partnerships between academia and industry must serve the public good,https://www.nature.com/articles/d41586-025-03684-3,2025-11-11 00:00:00 UTC,Nature,2025-11-11 00:00:00+00:00
High performance tandem perovskite LEDs through interlayer photon recycling,https://www.nature.com/articles/s41586-025-09865-4,2025-11-11 00:00:00 UTC,Nature,2025-11-11 00:00:00+00:00
Comprehensive echocardiogram evaluation with view primed vision language AI,https://www.nature.com/articles/s41586-025-09850-x,2025-11-11 00:00:00 UTC,Nature,2025-11-11 00:00:00+00:00
Failure is not an option for Africa’s newly launched medicines agency,https://www.nature.com/articles/d41586-025-03668-3,2025-11-11 00:00:00 UTC,Nature,2025-11-11 00:00:00+00:00
"Triply convergent Ni-electrocatalytic assembly of 1,1-diaryl cyclobutanes, azetidines and oxetanes",https://www.nature.com/articles/s41557-025-01990-x,2025-11-11 00:00:00 UTC,Nature Chemistry,2025-11-11 00:00:00+00:00
How genetically encoded sensors have lit up neuroscience,https://www.nature.com/articles/d41586-025-03639-8,2025-11-11 00:00:00 UTC,Nature,2025-11-11 00:00:00+00:00
Boron–halide interactions for crystallization regulation of a 1.68 eV wide-bandgap perovskite prepared via a two-step method,http://pubs.rsc.org/en/Content/ArticleLanding/2025/EE/D5EE03984C,2025-11-11 00:00:00 UTC,RSC - Energy Environ. Sci. latest articles,2025-11-11 00:00:00+00:00
Ab initio electronic structure calculations of lanthanide single-molecule magnets; a practical guide,http://pubs.rsc.org/en/Content/ArticleLanding/2025/CS/D5CS00493D,2025-11-11 00:00:00 UTC,RSC - Chem. Soc. Rev. latest articles,2025-11-11 00:00:00+00:00
Achieving high strength and ductility in optoelectronic semiconductor,https://www.sciencedirect.com/science/article/pii/S1369702125004729?dgcid=rss_sd_all,2025-11-11 00:00:00 UTC,ScienceDirect Publication: Materials Today,2025-11-11 00:00:00+00:00
Mesopore-tunable synthesis of multihybrid organosilica nanoparticles with hierarchical biomimetic engineering for tumor-oriented sono-immunometabolic therapy,https://www.sciencedirect.com/science/article/pii/S1369702125004717?dgcid=rss_sd_all,2025-11-11 00:00:00 UTC,ScienceDirect Publication: Materials Today,2025-11-11 00:00:00+00:00
Academic freedom is key to the future of universities,https://www.nature.com/articles/d41586-025-03683-4,2025-11-11 00:00:00 UTC,Nature,2025-11-11 00:00:00+00:00
Hydration Equilibrium-controlled Cation-Anion Coordination Competition for Precise Recovery of All Valuable Metals from Spent Lithium-ion Batteries,http://pubs.rsc.org/en/Content/ArticleLanding/2025/EE/D5EE05276A,2025-11-11 00:00:00 UTC,RSC - Energy Environ. Sci. latest articles,2025-11-11 00:00:00+00:00
Wild-type KRAS activation drives evasion of interferon-mediated immunity and resistance to immunotherapy in hepatocellular carcinoma,https://www.nature.com/articles/s41467-025-64860-7,2025-11-11 00:00:00 UTC,Nature Communications,2025-11-11 00:00:00+00:00
Reply to: Bias-induced electrostatic magnetoresistance in ferromagnet/chiral systems,https://www.nature.com/articles/s41467-025-65682-3,2025-11-11 00:00:00 UTC,Nature Communications,2025-11-11 00:00:00+00:00
Bias-induced electrostatic magnetoresistance in ferromagnet/chiral systems,https://www.nature.com/articles/s41467-025-65680-5,2025-11-11 00:00:00 UTC,Nature Communications,2025-11-11 00:00:00+00:00
Measurement of correlated charge noise in superconducting qubits at an underground facility,https://www.nature.com/articles/s41467-025-63724-4,2025-11-11 00:00:00 UTC,Nature Communications,2025-11-11 00:00:00+00:00
Dynamic dosage changes in X-linked transposable elements during mammalian dosage compensation,https://www.nature.com/articles/s41467-025-64865-2,2025-11-11 00:00:00 UTC,Nature Communications,2025-11-11 00:00:00+00:00
Heterogeneous plasticity of amygdala interneurons in associative learning and extinction,https://www.nature.com/articles/s41467-025-66122-y,2025-11-11 00:00:00 UTC,Nature Communications,2025-11-11 00:00:00+00:00
CO2-triggered reversible transformation of soft elastomers into rigid and highly fluorescent plastics,https://www.nature.com/articles/s41467-025-65495-4,2025-11-11 00:00:00 UTC,Nature Communications,2025-11-11 00:00:00+00:00
"New, more stable qubits could simplify dreamed-of quantum computers",https://www.science.org/content/article/new-more-stable-qubits-could-simplify-dreamed-quantum-computers,2025-11-11 03:10:00 UTC,Latest News from Science Magazine,2025-11-11 03:10:00+00:00
Australia’s unprecedented toxic algal bloom has a surprise culprit,https://www.science.org/content/article/australia-s-unprecedented-toxic-algal-bloom-has-surprise-culprit,2025-11-11 05:00:00 UTC,Latest News from Science Magazine,2025-11-11 05:00:00+00:00
Pathology‐Driven Design of a Biomimetic Ferromagnetic Nanomedicine for Dual‐Mode Treatment of Ulcerative Colitis and Colitis‐Associated Colorectal Cancer,https://advanced.onlinelibrary.wiley.com/doi/10.1002/adma.202514413?af=R,2025-11-11 07:35:53 UTC,Wiley: Advanced Materials: Table of Contents,2025-11-11 07:35:53+00:00
Reply to Correspondence on “Suppressing Energy Migration via Antiparallel Spin Alignment in One‐Dimensional Mn2+ Halide Magnets with High Luminescence Efficiency”,https://onlinelibrary.wiley.com/doi/10.1002/anie.202519218?af=R,2025-11-11 07:37:55 UTC,Wiley: Angewandte Chemie International Edition: Table of Contents,2025-11-11 07:37:55+00:00
Modular Design of Hydrogel Adhesives for Enhanced Tissue Healing,https://advanced.onlinelibrary.wiley.com/doi/10.1002/adma.202516770?af=R,2025-11-11 07:42:50 UTC,Wiley: Advanced Materials: Table of Contents,2025-11-11 07:42:50+00:00
Dynamics and Mechanism of Off‐ to On‐Switching in Dreiklang a Decoupled Reversibly Switchable Fluorescent Protein,https://onlinelibrary.wiley.com/doi/10.1002/anie.202518264?af=R,2025-11-11 07:44:27 UTC,Wiley: Angewandte Chemie International Edition: Table of Contents,2025-11-11 07:44:27+00:00
The Pursuit for High Power Density in Silicon‐Based ASSBs: Insights Into Limitations and Perspectives,https://advanced.onlinelibrary.wiley.com/doi/10.1002/aenm.202505061?af=R,2025-11-11 07:47:22 UTC,Wiley: Advanced Energy Materials: Table of Contents,2025-11-11 07:47:22+00:00
Decoding Gas Evolution Pathways and Interfacial Chemistry in Layered Oxide Cathodes for Safer Sodium‐Ion Batteries,https://advanced.onlinelibrary.wiley.com/doi/10.1002/aenm.202504756?af=R,2025-11-11 07:48:57 UTC,Wiley: Advanced Energy Materials: Table of Contents,2025-11-11 07:48:57+00:00
Electroactive Model‐Guided Design of Conductive Metal–Organic Framework Heterojunctions for Enhanced Photocatalytic Performance,https://onlinelibrary.wiley.com/doi/10.1002/anie.202521258?af=R,2025-11-11 07:49:45 UTC,Wiley: Angewandte Chemie International Edition: Table of Contents,2025-11-11 07:49:45+00:00
Quantifying Effective Dehydrated Ion Sizes Based on Pore‐Ion Steric Properties to Predict Separation Selectivity,https://onlinelibrary.wiley.com/doi/10.1002/anie.202508461?af=R,2025-11-11 07:49:51 UTC,Wiley: Angewandte Chemie International Edition: Table of Contents,2025-11-11 07:49:51+00:00
Multiply Nano‐Twinned Copper as a “Dual‐Site Cooperative” Catalyst for Enhanced Electrocatalytic Nitrate Reduction to Ammonia,https://advanced.onlinelibrary.wiley.com/doi/10.1002/adma.202516937?af=R,2025-11-11 07:49:51 UTC,Wiley: Advanced Materials: Table of Contents,2025-11-11 07:49:51+00:00
"Temperature Invariant, Nearly Zero Temperature Coefficient of Resistivity in Si‐Doped Titanium Nitrides",https://advanced.onlinelibrary.wiley.com/doi/10.1002/adma.202514483?af=R,2025-11-11 07:51:47 UTC,Wiley: Advanced Materials: Table of Contents,2025-11-11 07:51:47+00:00
Chiral Bifacial Non‐Fullerene Acceptors with Chirality‐Induced Spin Selectivity: A Homochiral Strategy to Improve Organic Solar Cell Performance,https://onlinelibrary.wiley.com/doi/10.1002/anie.202518505?af=R,2025-11-11 07:51:55 UTC,Wiley: Angewandte Chemie International Edition: Table of Contents,2025-11-11 07:51:55+00:00
Synergistic Effect of Mixed Cations in the Electrochemical Double Layer Enables Highly Efficient Electrochemical CO2 Methanation,https://onlinelibrary.wiley.com/doi/10.1002/anie.202520997?af=R,2025-11-11 07:52:20 UTC,Wiley: Angewandte Chemie International Edition: Table of Contents,2025-11-11 07:52:20+00:00
Potassium Coordination Stabilized Ruδ+ State on Potassium Titanate Nanowire for Efficient Photothermal CO2 Methanation,https://advanced.onlinelibrary.wiley.com/doi/10.1002/adma.202507515?af=R,2025-11-11 07:53:31 UTC,Wiley: Advanced Materials: Table of Contents,2025-11-11 07:53:31+00:00
Dual Self‐Promoted Ring‐Opening Polymerization towards Cationic Polypeptoids with Stable Helices,https://onlinelibrary.wiley.com/doi/10.1002/anie.202521129?af=R,2025-11-11 07:56:04 UTC,Wiley: Angewandte Chemie International Edition: Table of Contents,2025-11-11 07:56:04+00:00
Photocatalytic Overall Water Splitting at the Integrated Rh–MoRhOx Cluster Heterostructure on InGaN/GaN Nanowires,https://onlinelibrary.wiley.com/doi/10.1002/anie.202520831?af=R,2025-11-11 07:56:10 UTC,Wiley: Angewandte Chemie International Edition: Table of Contents,2025-11-11 07:56:10+00:00
Research Progress on Electrochemical Oxidation of Aldehydes Coupled With Hydrogen Production From Water Electrocatalysis,https://advanced.onlinelibrary.wiley.com/doi/10.1002/aenm.202505386?af=R,2025-11-11 07:58:22 UTC,Wiley: Advanced Energy Materials: Table of Contents,2025-11-11 07:58:22+00:00
High Entropy Design Tailored Local Chemical Coordination in Lead‐Free Dielectrics Toward Superior Capacitive Energy Storage,https://advanced.onlinelibrary.wiley.com/doi/10.1002/aenm.202504925?af=R,2025-11-11 07:59:27 UTC,Wiley: Advanced Energy Materials: Table of Contents,2025-11-11 07:59:27+00:00
Forward genetic screening in engineered colorectal cancer organoids identifies regulators of metastasis,https://www.pnas.org/doi/abs/10.1073/pnas.2510910122?mi=eymic2&af=R&access=on&content=articlesChapters&publication=pnas&sortBy=Earliest&target=default,2025-11-11 08:00:00 UTC,Proceedings of the National Academy of Sciences: Keyword search for query,2025-11-11 08:00:00+00:00
In This Issue,https://www.pnas.org/doi/abs/10.1073/iti4525122?mi=eymic2&af=R&access=on&content=articlesChapters&publication=pnas&sortBy=Earliest&target=default,2025-11-11 08:00:00 UTC,Proceedings of the National Academy of Sciences: Keyword search for query,2025-11-11 08:00:00+00:00
Physiologically based pharmacokinetic model for CAR-T cell delivery and efficacy in solid tumors,https://www.pnas.org/doi/abs/10.1073/pnas.2522634122?mi=eymic2&af=R&access=on&content=articlesChapters&publication=pnas&sortBy=Earliest&target=default,2025-11-11 08:00:00 UTC,Proceedings of the National Academy of Sciences: Keyword search for query,2025-11-11 08:00:00+00:00
Machine-learning models based on histological images from healthy donors identify imageQTLs and predict chronological age,https://www.pnas.org/doi/abs/10.1073/pnas.2423469122?mi=eymic2&af=R&access=on&content=articlesChapters&publication=pnas&sortBy=Earliest&target=default,2025-11-11 08:00:00 UTC,Proceedings of the National Academy of Sciences: Keyword search for query,2025-11-11 08:00:00+00:00
Diffuse pacemaker mechanism with distinctive organization drives pulsation in the octocoral Xenia umbellata,https://www.pnas.org/doi/abs/10.1073/pnas.2500611122?mi=eymic2&af=R&access=on&content=articlesChapters&publication=pnas&sortBy=Earliest&target=default,2025-11-11 08:00:00 UTC,Proceedings of the National Academy of Sciences: Keyword search for query,2025-11-11 08:00:00+00:00
MC1R determines healing outcomes in acute and chronic cutaneous wounds,https://www.pnas.org/doi/abs/10.1073/pnas.2503308122?mi=eymic2&af=R&access=on&content=articlesChapters&publication=pnas&sortBy=Earliest&target=default,2025-11-11 08:00:00 UTC,Proceedings of the National Academy of Sciences: Keyword search for query,2025-11-11 08:00:00+00:00
Regulation of epithelial tissue homeostasis by active transepithelial transport,https://www.pnas.org/doi/abs/10.1073/pnas.2503156122?mi=eymic2&af=R&access=on&content=articlesChapters&publication=pnas&sortBy=Earliest&target=default,2025-11-11 08:00:00 UTC,Proceedings of the National Academy of Sciences: Keyword search for query,2025-11-11 08:00:00+00:00
Angle dependence as a unifying feature of root graviresponse modules,https://www.pnas.org/doi/abs/10.1073/pnas.2506400122?mi=eymic2&af=R&access=on&content=articlesChapters&publication=pnas&sortBy=Earliest&target=default,2025-11-11 08:00:00 UTC,Proceedings of the National Academy of Sciences: Keyword search for query,2025-11-11 08:00:00+00:00
FZD7 expression marks mammary tumor–initiating cells,https://www.pnas.org/doi/abs/10.1073/pnas.2522465122?mi=eymic2&af=R&access=on&content=articlesChapters&publication=pnas&sortBy=Earliest&target=default,2025-11-11 08:00:00 UTC,Proceedings of the National Academy of Sciences: Keyword search for query,2025-11-11 08:00:00+00:00
Time-of-day modulation in mosquito response persistence to carbon dioxide is controlled by Pigment-Dispersing Factor,https://www.pnas.org/doi/abs/10.1073/pnas.2520826122?mi=eymic2&af=R&access=on&content=articlesChapters&publication=pnas&sortBy=Earliest&target=default,2025-11-11 08:00:00 UTC,Proceedings of the National Academy of Sciences: Keyword search for query,2025-11-11 08:00:00+00:00
General laws of biodiversity: Climatic niches predict plant range size and ecological dominance globally,https://www.pnas.org/doi/abs/10.1073/pnas.2517585122?mi=eymic2&af=R&access=on&content=articlesChapters&publication=pnas&sortBy=Earliest&target=default,2025-11-11 08:00:00 UTC,Proceedings of the National Academy of Sciences: Keyword search for query,2025-11-11 08:00:00+00:00
PAK2-driven cytoskeleton–endosome dynamics control macrophage hyperphagia and SIRPA engagement,https://www.pnas.org/doi/abs/10.1073/pnas.2516025122?mi=eymic2&af=R&access=on&content=articlesChapters&publication=pnas&sortBy=Earliest&target=default,2025-11-11 08:00:00 UTC,Proceedings of the National Academy of Sciences: Keyword search for query,2025-11-11 08:00:00+00:00
METTL3-dependent m6A RNA methylation suppresses aberrant mammary epithelial differentiation and neoplastic transformation,https://www.pnas.org/doi/abs/10.1073/pnas.2514643122?mi=eymic2&af=R&access=on&content=articlesChapters&publication=pnas&sortBy=Earliest&target=default,2025-11-11 08:00:00 UTC,Proceedings of the National Academy of Sciences: Keyword search for query,2025-11-11 08:00:00+00:00
Sirt6 prevents the age-related decline of H2S through the control of one-carbon metabolism,https://www.pnas.org/doi/abs/10.1073/pnas.2514084122?mi=eymic2&af=R&access=on&content=articlesChapters&publication=pnas&sortBy=Earliest&target=default,2025-11-11 08:00:00 UTC,Proceedings of the National Academy of Sciences: Keyword search for query,2025-11-11 08:00:00+00:00
Mechanomedicine: Present state and future promise,https://www.pnas.org/doi/abs/10.1073/pnas.2509566122?mi=eymic2&af=R&access=on&content=articlesChapters&publication=pnas&sortBy=Earliest&target=default,2025-11-11 08:00:00 UTC,Proceedings of the National Academy of Sciences: Keyword search for query,2025-11-11 08:00:00+00:00
Estimated impact of 2022–2023 influenza vaccines on annual hospital burden in the United States,https://www.pnas.org/doi/abs/10.1073/pnas.2505175122?mi=eymic2&af=R&access=on&content=articlesChapters&publication=pnas&sortBy=Earliest&target=default,2025-11-11 08:00:00 UTC,Proceedings of the National Academy of Sciences: Keyword search for query,2025-11-11 08:00:00+00:00
Erythroid precursors regulate local oxygen tension and repair outcomes in the bone marrow niche,https://www.pnas.org/doi/abs/10.1073/pnas.2522548122?mi=eymic2&af=R&access=on&content=articlesChapters&publication=pnas&sortBy=Earliest&target=default,2025-11-11 08:00:00 UTC,Proceedings of the National Academy of Sciences: Keyword search for query,2025-11-11 08:00:00+00:00
Electrokinetic nanoparticle transport in an interconnected porous environment: Decoupling cavity escape and directional bias,https://www.pnas.org/doi/abs/10.1073/pnas.2514874122?mi=eymic2&af=R&access=on&content=articlesChapters&publication=pnas&sortBy=Earliest&target=default,2025-11-11 08:00:00 UTC,Proceedings of the National Academy of Sciences: Keyword search for query,2025-11-11 08:00:00+00:00
Metalloid Coordination Reinforcing Electronic Synergy in Dual‐Atom Sites for Large‐Scale CO2 Electrolysis,https://onlinelibrary.wiley.com/doi/10.1002/anie.202516353?af=R,2025-11-11 08:02:12 UTC,Wiley: Angewandte Chemie International Edition: Table of Contents,2025-11-11 08:02:12+00:00
Heteromultivalent Nanogels as Highly Potent Inhibitors of Pseudomonas Aeruginosa,https://onlinelibrary.wiley.com/doi/10.1002/anie.202513121?af=R,2025-11-11 08:07:38 UTC,Wiley: Angewandte Chemie International Edition: Table of Contents,2025-11-11 08:07:38+00:00
Phase‐Dependent Reverse Electronic Metal‐Support Interaction to Boost Alkaline Hydrogen Evolution,https://advanced.onlinelibrary.wiley.com/doi/10.1002/adma.202518017?af=R,2025-11-11 08:07:43 UTC,Wiley: Advanced Materials: Table of Contents,2025-11-11 08:07:43+00:00
Rechargeable Aprotic Zinc–Oxygen Batteries with Reversible ZnO Formation on Cathodes,https://onlinelibrary.wiley.com/doi/10.1002/anie.202519306?af=R,2025-11-11 08:09:20 UTC,Wiley: Angewandte Chemie International Edition: Table of Contents,2025-11-11 08:09:20+00:00
Ambient‐Compatible Solvent Bath Thermal Annealing for Highly Efficient Organic Solar Cells and Large‐Area Modules,https://advanced.onlinelibrary.wiley.com/doi/10.1002/adma.202514741?af=R,2025-11-11 08:09:44 UTC,Wiley: Advanced Materials: Table of Contents,2025-11-11 08:09:44+00:00
Tailoring Inner Helmholtz Layer via the Lewis Acid–Base Theory Endow an Elastic SEI for Dendrites‐Free Lithium Metal Anode,https://advanced.onlinelibrary.wiley.com/doi/10.1002/aenm.202504697?af=R,2025-11-11 08:09:58 UTC,Wiley: Advanced Energy Materials: Table of Contents,2025-11-11 08:09:58+00:00
Regulation of Proton Vehicle Migration for Synergetic Interfacial Stability Enables Long‐Lasting Ah‐Level Zinc‐Ion Batteries,https://advanced.onlinelibrary.wiley.com/doi/10.1002/adma.202516427?af=R,2025-11-11 08:11:18 UTC,Wiley: Advanced Materials: Table of Contents,2025-11-11 08:11:18+00:00
Covalently Anchored Cationic Groups Tailor Electric Double Layer for Supporting‐Electrolyte‐Free CO2 Reduction in Acidic Media,https://onlinelibrary.wiley.com/doi/10.1002/anie.202518465?af=R,2025-11-11 08:15:43 UTC,Wiley: Angewandte Chemie International Edition: Table of Contents,2025-11-11 08:15:43+00:00
"Directed Evolution of a Nonheme Iron Enzyme to Access Chiral α‐Amino Acid Derivatives by 1,3‐Migratory Nitrene C(sp3)─H Insertion",https://onlinelibrary.wiley.com/doi/10.1002/anie.202515741?af=R,2025-11-11 08:22:03 UTC,Wiley: Angewandte Chemie International Edition: Table of Contents,2025-11-11 08:22:03+00:00
Dual Electric Fields in Cyclooctatetrathiophene‐Based COF/ ZnIn2S4 Z‐Scheme Heterojunction Boost Photocatalytic Seawater Hydrogen Evolution,https://onlinelibrary.wiley.com/doi/10.1002/anie.202519752?af=R,2025-11-11 08:27:44 UTC,Wiley: Angewandte Chemie International Edition: Table of Contents,2025-11-11 08:27:44+00:00
An All‐Solid‐State Li–Cu Battery via Cuprous/Lithium‐Ion Halide Solid Electrolyte,https://onlinelibrary.wiley.com/doi/10.1002/anie.202518966?af=R,2025-11-11 08:30:08 UTC,Wiley: Angewandte Chemie International Edition: Table of Contents,2025-11-11 08:30:08+00:00
Government sets out plan to phase out animal experiments,https://www.bbc.com/news/articles/cm2lpekjeg9o?at_medium=RSS&at_campaign=rss,2025-11-11 08:34:24 UTC,BBC News,2025-11-11 08:34:24+00:00
Tandem Conversion of Polysulfides via Coupling Ni Single–Atoms and Clusters for Na–S Batteries,https://advanced.onlinelibrary.wiley.com/doi/10.1002/adma.202516313?af=R,2025-11-11 08:35:31 UTC,Wiley: Advanced Materials: Table of Contents,2025-11-11 08:35:31+00:00
Synergistic Enhancement of Photoredox Catalysis Beyond the Singlet Bottleneck Through Triplet Charge Recombination and Magnetic Field Effects,https://onlinelibrary.wiley.com/doi/10.1002/anie.202518648?af=R,2025-11-11 08:36:48 UTC,Wiley: Angewandte Chemie International Edition: Table of Contents,2025-11-11 08:36:48+00:00
[ASAP] Plasma-Driven Dual-Membrane System for Intensified Hydrogen Production with Integrated Ammonia Recovery,http://dx.doi.org/10.1021/jacs.5c15789,2025-11-11 09:12:30 UTC,Journal of the American Chemical Society: Latest Articles (ACS Publications),2025-11-11 09:12:30+00:00
[ASAP] Atomically Precise PbSe Nanocrystal Protected by Carboxylates,http://dx.doi.org/10.1021/jacs.5c16293,2025-11-11 09:31:06 UTC,Journal of the American Chemical Society: Latest Articles (ACS Publications),2025-11-11 09:31:06+00:00
Structural Transformation and Photochromism of Chiral Hybrid Metal Halides for Stimulus‐Responsive Phosphorescence and Circularly Polarized Luminescence,https://onlinelibrary.wiley.com/doi/10.1002/anie.202518259?af=R,2025-11-11 10:02:40 UTC,Wiley: Angewandte Chemie International Edition: Table of Contents,2025-11-11 10:02:40+00:00
Difluoro Carbenes: From Genuine Gold Complexes to Unprecedented Metallacyclic Reactivity,https://onlinelibrary.wiley.com/doi/10.1002/anie.202515429?af=R,2025-11-11 10:02:40 UTC,Wiley: Angewandte Chemie International Edition: Table of Contents,2025-11-11 10:02:40+00:00
Microdroplet‐Driven Synthesis of a Metal–Organic Framework Catalyst,https://onlinelibrary.wiley.com/doi/10.1002/anie.202515006?af=R,2025-11-11 10:02:40 UTC,Wiley: Angewandte Chemie International Edition: Table of Contents,2025-11-11 10:02:40+00:00
Haifeng Zheng,https://onlinelibrary.wiley.com/doi/10.1002/anie.202521307?af=R,2025-11-11 10:02:40 UTC,Wiley: Angewandte Chemie International Edition: Table of Contents,2025-11-11 10:02:40+00:00
Photochemical Spin‐State Switching of an All‐Organic Molecular System with Visible Light,https://onlinelibrary.wiley.com/doi/10.1002/anie.202515144?af=R,2025-11-11 10:02:40 UTC,Wiley: Angewandte Chemie International Edition: Table of Contents,2025-11-11 10:02:40+00:00
Late‐Stage Oxidation of C(sp3)─H Bonds with High Efficiency and Alkyl Group Dihydroxylation of Complex Molecules,https://onlinelibrary.wiley.com/doi/10.1002/anie.202513418?af=R,2025-11-11 10:02:40 UTC,Wiley: Angewandte Chemie International Edition: Table of Contents,2025-11-11 10:02:40+00:00
Breaking the Deep‐UV Transparency/Optical Nonlinearity Trade‐Off: Three‐Parameter Optimization in Oxyfluorides by Tailoring d0‐Metal Incorporation,https://onlinelibrary.wiley.com/doi/10.1002/anie.202513438?af=R,2025-11-11 10:02:40 UTC,Wiley: Angewandte Chemie International Edition: Table of Contents,2025-11-11 10:02:40+00:00
Chiral Hybrid Cu(I) Halide Scintillation Films with Polarization‐Engineered Light Management for High‐Resolution X‐ray Imaging,https://onlinelibrary.wiley.com/doi/10.1002/anie.202513987?af=R,2025-11-11 10:02:40 UTC,Wiley: Angewandte Chemie International Edition: Table of Contents,2025-11-11 10:02:40+00:00
Silylative Amide to Nitrile Conversion Mediated by Simple Lanthanide–Organoamides: Scope and Mechanism,https://onlinelibrary.wiley.com/doi/10.1002/anie.202513996?af=R,2025-11-11 10:02:40 UTC,Wiley: Angewandte Chemie International Edition: Table of Contents,2025-11-11 10:02:40+00:00
Enantioconvergent Borylation of α‐Benzoyl Alkyl Bromides by Zinc Catalysis,https://onlinelibrary.wiley.com/doi/10.1002/anie.202514261?af=R,2025-11-11 10:02:40 UTC,Wiley: Angewandte Chemie International Edition: Table of Contents,2025-11-11 10:02:40+00:00
Dual Regulation of Reduction and Oxidation Center in Metal–Organic Frameworks to Boost CO2 Photoreduction,https://onlinelibrary.wiley.com/doi/10.1002/anie.202514515?af=R,2025-11-11 10:02:40 UTC,Wiley: Angewandte Chemie International Edition: Table of Contents,2025-11-11 10:02:40+00:00
Fluorescent Peptide Tracers for Simultaneous Oxytocin Receptor Activation and Visualization,https://onlinelibrary.wiley.com/doi/10.1002/anie.202515180?af=R,2025-11-11 10:02:40 UTC,Wiley: Angewandte Chemie International Edition: Table of Contents,2025-11-11 10:02:40+00:00
Modulating Adsorption Intermediate Metastability for Tip‐Directed Zinc Stripping and Suppressed Vanadium Dissolution Toward Long‐Cycling Zinc–Vanadium Batteries,https://onlinelibrary.wiley.com/doi/10.1002/anie.202515085?af=R,2025-11-11 10:02:40 UTC,Wiley: Angewandte Chemie International Edition: Table of Contents,2025-11-11 10:02:40+00:00
Enzymatic Flow Electrolyzer for CO2 and Waste Comproportionation to Formate and Its Use in Photocatalytic Alkene Hydrocarboxylation,https://onlinelibrary.wiley.com/doi/10.1002/anie.202515810?af=R,2025-11-11 10:02:40 UTC,Wiley: Angewandte Chemie International Edition: Table of Contents,2025-11-11 10:02:40+00:00
Time‐Dependent Divergent Synthesis via Photochemical Rearrangement,https://onlinelibrary.wiley.com/doi/10.1002/anie.202516222?af=R,2025-11-11 10:02:40 UTC,Wiley: Angewandte Chemie International Edition: Table of Contents,2025-11-11 10:02:40+00:00
Heteromultivalency Enhances Resolution in Cellular Mechanical Sorting,https://onlinelibrary.wiley.com/doi/10.1002/anie.202515324?af=R,2025-11-11 10:02:40 UTC,Wiley: Angewandte Chemie International Edition: Table of Contents,2025-11-11 10:02:40+00:00
