title,link,published,source,pub_date
Polarized N+‐Mediated Charge‐Transfer State Drives Two‐Electron Water Oxidation,https://onlinelibrary.wiley.com/doi/10.1002/anie.202518179?af=R,2025-11-11 13:22:58 UTC,Wiley: Angewandte Chemie International Edition: Table of Contents,2025-11-11 13:22:58+00:00
Electrooxidative Divergent Halocyclizations of Ambident Amides,https://onlinelibrary.wiley.com/doi/10.1002/anie.202516250?af=R,2025-11-11 13:24:44 UTC,Wiley: Angewandte Chemie International Edition: Table of Contents,2025-11-11 13:24:44+00:00
Rational Design of 3D Morphable Color‐shifting Mesosurfaces Using Bioinspired Janus Micro‐ and Nanolattices,https://advanced.onlinelibrary.wiley.com/doi/10.1002/adma.202511683?af=R,2025-11-11 13:27:22 UTC,Wiley: Advanced Materials: Table of Contents,2025-11-11 13:27:22+00:00
Environment‐Responsive Self‐Assembly and Coupled‐Network Effect in Dynamic Replicating Nucleopeptide Networks,https://onlinelibrary.wiley.com/doi/10.1002/anie.202518297?af=R,2025-11-11 13:28:39 UTC,Wiley: Angewandte Chemie International Edition: Table of Contents,2025-11-11 13:28:39+00:00
Tumor‐Targeting Co‐Delivery of T‐Cell Antigen and Camptothecin Guided by Cascade‐Responsive Peptide Self‐Assembly to Reshape Tumor Antigenicity for Cancer Immunotherapy,https://advanced.onlinelibrary.wiley.com/doi/10.1002/adma.202516767?af=R,2025-11-11 13:28:41 UTC,Wiley: Advanced Materials: Table of Contents,2025-11-11 13:28:41+00:00
Xiao‐Hui Yang,https://onlinelibrary.wiley.com/doi/10.1002/anie.202522612?af=R,2025-11-11 13:31:27 UTC,Wiley: Angewandte Chemie International Edition: Table of Contents,2025-11-11 13:31:27+00:00
Polymer‐Nanodomains Regulation for Optimized Ionic Translocation Enabling High‐Voltage and Practical Utility Lithium Metal Batteries,https://onlinelibrary.wiley.com/doi/10.1002/anie.202515515?af=R,2025-11-11 13:32:11 UTC,Wiley: Angewandte Chemie International Edition: Table of Contents,2025-11-11 13:32:11+00:00
Spin‐Matching Effect Triggering Enhanced Oxygen Reduction Reaction in Acidic and Alkaline Media,https://onlinelibrary.wiley.com/doi/10.1002/anie.202515517?af=R,2025-11-11 13:32:19 UTC,Wiley: Angewandte Chemie International Edition: Table of Contents,2025-11-11 13:32:19+00:00
BODIPY‐Anthracene‐Binaphthyl Compounds Display Aging‐Driven Narrow‐Band Circularly Polarized Luminescence Enhancement with Light‐Activated AIE‐to‐ACQ Transformation,https://onlinelibrary.wiley.com/doi/10.1002/anie.202515768?af=R,2025-11-11 13:33:24 UTC,Wiley: Angewandte Chemie International Edition: Table of Contents,2025-11-11 13:33:24+00:00
On the Nature of Improper Hydrogen Bonding in RCH2F and RCHF2 Motifs,https://onlinelibrary.wiley.com/doi/10.1002/anie.202518500?af=R,2025-11-11 13:34:55 UTC,Wiley: Angewandte Chemie International Edition: Table of Contents,2025-11-11 13:34:55+00:00
An Intelligence Programmable Intrathecal Injection System Based on Tween 80‐Confined Halide Perovskite Optoelectronic Memristor,https://advanced.onlinelibrary.wiley.com/doi/10.1002/adma.202513992?af=R,2025-11-11 13:37:38 UTC,Wiley: Advanced Materials: Table of Contents,2025-11-11 13:37:38+00:00
Electron‐Enriched Pt‐In Synergistic Sites for Highly Selective and Direct Photo‐Reforming of PET Plastic Wastes into Acetic Acid,https://onlinelibrary.wiley.com/doi/10.1002/anie.202521531?af=R,2025-11-11 13:55:19 UTC,Wiley: Angewandte Chemie International Edition: Table of Contents,2025-11-11 13:55:19+00:00
[ASAP] Oxygen-Mediated Structural Modulation and Ion Transport in xNa2O-TaCl5 Glass Electrolytes,http://dx.doi.org/10.1021/jacs.5c10564,2025-11-11 14:00:15 UTC,Journal of the American Chemical Society: Latest Articles (ACS Publications),2025-11-11 14:00:15+00:00
Pollutant‐Powered Oxygen Activation by Enzyme‐Inspired Self‐Sustaining Catalytic Membranes for Water Purification,https://onlinelibrary.wiley.com/doi/10.1002/anie.202521747?af=R,2025-11-11 14:00:45 UTC,Wiley: Angewandte Chemie International Edition: Table of Contents,2025-11-11 14:00:45+00:00
[ASAP] Enzymatic Anti-Baldwin Ring-Closure Cascade for Fused Bicyclic Ether Formation,http://dx.doi.org/10.1021/jacs.5c17188,2025-11-11 14:40:49 UTC,Journal of the American Chemical Society: Latest Articles (ACS Publications),2025-11-11 14:40:49+00:00
[ASAP] A Push–Pull Type Electron-Selective Self-Assembled Monolayer in Organic Semiconductor Photoanodes for Solar Water Oxidation,http://dx.doi.org/10.1021/acsenergylett.5c02848,2025-11-11 14:53:03 UTC,ACS Energy Letters: Latest Articles (ACS Publications),2025-11-11 14:53:03+00:00
[ASAP] Palladium-Catalyzed Asymmetric Hydrogenolysis of Epoxides,http://dx.doi.org/10.1021/jacs.5c12776,2025-11-11 14:53:23 UTC,Journal of the American Chemical Society: Latest Articles (ACS Publications),2025-11-11 14:53:23+00:00
[ASAP] Electronic Activation Enables the Borylation of Alkyl C–H Bonds in Saturated Nitrogen Heterocycles,http://dx.doi.org/10.1021/jacs.5c15431,2025-11-11 15:56:49 UTC,Journal of the American Chemical Society: Latest Articles (ACS Publications),2025-11-11 15:56:49+00:00
[ASAP] On-Surface Synthesis of a Nitrogen-Doped Curved Cycloarene: π-Extended Pentaazaquintulene and Its Gold Complex,http://dx.doi.org/10.1021/jacs.5c11883,2025-11-11 15:57:32 UTC,Journal of the American Chemical Society: Latest Articles (ACS Publications),2025-11-11 15:57:32+00:00
[ASAP] Unraveling Exciton-Carrier Correlations in Orthorhombic Lead Halide Perovskite,http://dx.doi.org/10.1021/jacs.5c15799,2025-11-11 16:32:49 UTC,Journal of the American Chemical Society: Latest Articles (ACS Publications),2025-11-11 16:32:49+00:00
[ASAP] Single-Step Synthesis of Cs3Bi2I9 Nanocrystals for Scalable Direct X-ray Detectors,http://dx.doi.org/10.1021/acsenergylett.5c02509,2025-11-11 17:02:03 UTC,ACS Energy Letters: Latest Articles (ACS Publications),2025-11-11 17:02:03+00:00
[ASAP] Driving Force Dependent Photoinduced Charge Transfer Dynamics in Polymer-Wrapped Semiconducting Single-Walled Carbon Nanotubes,http://dx.doi.org/10.1021/jacs.5c14868,2025-11-11 17:54:34 UTC,Journal of the American Chemical Society: Latest Articles (ACS Publications),2025-11-11 17:54:34+00:00
[ASAP] Chemoselective Tagging of Protein Methacrylation,http://dx.doi.org/10.1021/jacs.5c13826,2025-11-11 19:11:07 UTC,Journal of the American Chemical Society: Latest Articles (ACS Publications),2025-11-11 19:11:07+00:00
[ASAP] Identification of Transient Intermediates and Active Species in Atomic CZA Catalysts for CO2 Hydrogenation to Methanol,http://dx.doi.org/10.1021/jacs.5c08043,2025-11-11 20:11:16 UTC,Journal of the American Chemical Society: Latest Articles (ACS Publications),2025-11-11 20:11:16+00:00
Material system enhances superconducting qubits,https://www.nature.com/articles/d41586-025-03644-x,2025-11-12 00:00:00 UTC,Nature,2025-11-12 00:00:00+00:00
Could humans live to 150? Why some researchers think we’re on the cusp of a major longevity breakthrough,https://www.nature.com/articles/d41586-025-03524-4,2025-11-12 00:00:00 UTC,Nature,2025-11-12 00:00:00+00:00
Fossilized technology: Books in brief,https://www.nature.com/articles/d41586-025-03702-4,2025-11-12 00:00:00 UTC,Nature,2025-11-12 00:00:00+00:00
Ultrathin films of a 2D polymer provide airtight seal,https://www.nature.com/articles/d41586-025-03583-7,2025-11-12 00:00:00 UTC,Nature,2025-11-12 00:00:00+00:00
Influential list of highly cited researchers now shuts out more scientists: here’s why,https://www.nature.com/articles/d41586-025-03691-4,2025-11-12 00:00:00 UTC,Nature,2025-11-12 00:00:00+00:00
A guide to the Nature Index,https://www.nature.com/articles/d41586-025-03527-1,2025-11-12 00:00:00 UTC,Nature,2025-11-12 00:00:00+00:00
Is ageing a disease? The debate that could reshape medicine,https://www.nature.com/articles/d41586-025-03525-3,2025-11-12 00:00:00 UTC,Nature,2025-11-12 00:00:00+00:00
SIGLEC12 mediates plasma membrane rupture during necroptotic cell death,https://www.nature.com/articles/s41586-025-09741-1,2025-11-12 00:00:00 UTC,Nature,2025-11-12 00:00:00+00:00
Radio burst from a stellar coronal mass ejection,https://www.nature.com/articles/s41586-025-09715-3,2025-11-12 00:00:00 UTC,Nature,2025-11-12 00:00:00+00:00
Viral NblA proteins negatively affect oceanic cyanobacterial photosynthesis,https://www.nature.com/articles/s41586-025-09656-x,2025-11-12 00:00:00 UTC,Nature,2025-11-12 00:00:00+00:00
GREGoR: accelerating genomics for rare diseases,https://www.nature.com/articles/s41586-025-09613-8,2025-11-12 00:00:00 UTC,Nature,2025-11-12 00:00:00+00:00
Cytosolic acetyl-coenzyme A is a signalling metabolite to control mitophagy,https://www.nature.com/articles/s41586-025-09745-x,2025-11-12 00:00:00 UTC,Nature,2025-11-12 00:00:00+00:00
A molecularly impermeable polymer from two-dimensional polyaramids,https://www.nature.com/articles/s41586-025-09674-9,2025-11-12 00:00:00 UTC,Nature,2025-11-12 00:00:00+00:00
Mathematicians put AI model AlphaProof to the test,https://www.nature.com/articles/d41586-025-03585-5,2025-11-12 00:00:00 UTC,Nature,2025-11-12 00:00:00+00:00
The future of ageing: science aims to deliver another leap in lifespan,https://www.nature.com/articles/d41586-025-03523-5,2025-11-12 00:00:00 UTC,Nature,2025-11-12 00:00:00+00:00
Can UK science really spawn a $1-trillion company?,https://www.nature.com/articles/d41586-025-03700-6,2025-11-12 00:00:00 UTC,Nature,2025-11-12 00:00:00+00:00
Controlling pyramidal nitrogen chirality by asymmetric organocatalysis,https://www.nature.com/articles/s41586-025-09607-6,2025-11-12 00:00:00 UTC,Nature,2025-11-12 00:00:00+00:00
Extreme rainfall poses the biggest risk to Mumbai’s most vulnerable people,https://www.nature.com/articles/d41586-025-03453-2,2025-11-12 00:00:00 UTC,Nature,2025-11-12 00:00:00+00:00
"To reform universities, first tackle global rankings",https://www.nature.com/articles/d41586-025-03636-x,2025-11-12 00:00:00 UTC,Nature,2025-11-12 00:00:00+00:00
Metabolite maps reveal spatial gradients in liver and intestinal tissue,https://www.nature.com/articles/d41586-025-03457-y,2025-11-12 00:00:00 UTC,Nature,2025-11-12 00:00:00+00:00
An ancient recombination desert is a speciation supergene in placental mammals,https://www.nature.com/articles/s41586-025-09740-2,2025-11-12 00:00:00 UTC,Nature,2025-11-12 00:00:00+00:00
First new type of malaria treatment in decades shows promise against drug resistance,https://www.nature.com/articles/d41586-025-03690-5,2025-11-12 00:00:00 UTC,Nature,2025-11-12 00:00:00+00:00
Gut bacteria help mice to stay lean,https://www.nature.com/articles/d41586-025-03661-w,2025-11-12 00:00:00 UTC,Nature,2025-11-12 00:00:00+00:00
Dye or die: bacterium forced to make pigment to stay alive,https://www.nature.com/articles/d41586-025-03663-8,2025-11-12 00:00:00 UTC,Nature,2025-11-12 00:00:00+00:00
Global greenhouse-gas emissions are still rising: when will they peak?,https://www.nature.com/articles/d41586-025-03618-z,2025-11-12 00:00:00 UTC,Nature,2025-11-12 00:00:00+00:00
Huge eruption on a distant star confirmed at last,https://www.nature.com/articles/d41586-025-03710-4,2025-11-12 00:00:00 UTC,Nature,2025-11-12 00:00:00+00:00
Money and power underlie mysterious Andean ‘band of holes’,https://www.nature.com/articles/d41586-025-03660-x,2025-11-12 00:00:00 UTC,Nature,2025-11-12 00:00:00+00:00
Emerging climate impact on carbon sinks in a consolidated carbon budget,https://www.nature.com/articles/s41586-025-09802-5,2025-11-12 00:00:00 UTC,Nature,2025-11-12 00:00:00+00:00
Olympiad-level formal mathematical reasoning with reinforcement learning,https://www.nature.com/articles/s41586-025-09833-y,2025-11-12 00:00:00 UTC,Nature,2025-11-12 00:00:00+00:00
Potent neutralization of Marburg virus by a vaccine-elicited antibody,https://www.nature.com/articles/s41586-025-09868-1,2025-11-12 00:00:00 UTC,Nature,2025-11-12 00:00:00+00:00
Author Correction: Learning the natural history of human disease with generative transformers,https://www.nature.com/articles/s41586-025-09879-y,2025-11-12 00:00:00 UTC,Nature,2025-11-12 00:00:00+00:00
How much protein do you really need? What the science says,https://www.nature.com/articles/d41586-025-03632-1,2025-11-12 00:00:00 UTC,Nature,2025-11-12 00:00:00+00:00
Magnetic fibres give this robot a soft grip,https://www.nature.com/articles/d41586-025-03708-y,2025-11-12 00:00:00 UTC,Nature,2025-11-12 00:00:00+00:00
Synthesis of enantioenriched atropisomers by biocatalytic deracemization,https://www.nature.com/articles/s41586-025-09738-w,2025-11-12 00:00:00 UTC,Nature,2025-11-12 00:00:00+00:00
Academic boycotts: data hint at shifting research partnerships,https://www.nature.com/articles/d41586-025-03025-4,2025-11-12 00:00:00 UTC,Nature,2025-11-12 00:00:00+00:00
Silicon solar cells with hybrid back contacts,https://www.nature.com/articles/s41586-025-09681-w,2025-11-12 00:00:00 UTC,Nature,2025-11-12 00:00:00+00:00
Sodium-compensating electrolyte additive stabilizes interfaces for highly reversible anode-free sodium batteries,http://pubs.rsc.org/en/Content/ArticleLanding/2025/EE/D5EE04804D,2025-11-12 00:00:00 UTC,RSC - Energy Environ. Sci. latest articles,2025-11-12 00:00:00+00:00
Unveiling the Single-Solvent Vacuum-Flash Process for High-Efficiency Perovskite Solar Cells,http://pubs.rsc.org/en/Content/ArticleLanding/2025/EE/D5EE05421D,2025-11-12 00:00:00 UTC,RSC - Energy Environ. Sci. latest articles,2025-11-12 00:00:00+00:00
Compact RNA sensors for increasingly complex functions of multiple inputs,https://www.nature.com/articles/s41557-025-01907-8,2025-11-12 00:00:00 UTC,Nature Chemistry,2025-11-12 00:00:00+00:00
Stereodivergent construction of non-adjacent stereocentres via migratory functionalization of alkenes,https://www.nature.com/articles/s41557-025-01994-7,2025-11-12 00:00:00 UTC,Nature Chemistry,2025-11-12 00:00:00+00:00
Artificial cytoskeletons in viscoelastic confinement,https://www.nature.com/articles/s41563-025-02420-6,2025-11-12 00:00:00 UTC,Nature Materials,2025-11-12 00:00:00+00:00
Convergent genome evolution shaped the emergence of terrestrial animals,https://www.nature.com/articles/s41586-025-09722-4,2025-11-12 00:00:00 UTC,Nature,2025-11-12 00:00:00+00:00
iPEX enables micrometre-resolution deep spatial proteomics via tissue expansion,https://www.nature.com/articles/s41586-025-09734-0,2025-11-12 00:00:00 UTC,Nature,2025-11-12 00:00:00+00:00
Electronic switching of topology in LaSbTe,https://www.nature.com/articles/s41563-025-02396-3,2025-11-12 00:00:00 UTC,Nature Materials,2025-11-12 00:00:00+00:00
‘It keeps me awake at night’: machine-learning pioneer on AI’s threat to humanity,https://www.nature.com/articles/d41586-025-03686-1,2025-11-12 00:00:00 UTC,Nature,2025-11-12 00:00:00+00:00
Chinese researchers reveal unexplored section of mysterious Arctic Ocean ridge,https://www.nature.com/articles/d41586-025-03679-0,2025-11-12 00:00:00 UTC,Nature,2025-11-12 00:00:00+00:00
Multi-site electrocatalysts for hydrogen production under neutral conditions,http://pubs.rsc.org/en/Content/ArticleLanding/2025/CS/D5CS00881F,2025-11-12 00:00:00 UTC,RSC - Chem. Soc. Rev. latest articles,2025-11-12 00:00:00+00:00
Chemical tools for discriminating single nucleotide variants: from design principles to clinical applications,http://pubs.rsc.org/en/Content/ArticleLanding/2025/CS/D5CS01006C,2025-11-12 00:00:00 UTC,RSC - Chem. Soc. Rev. latest articles,2025-11-12 00:00:00+00:00
Three rising stars in ageing research,https://www.nature.com/articles/d41586-025-03526-2,2025-11-12 00:00:00 UTC,Nature,2025-11-12 00:00:00+00:00
Rare genetic variants confer a high risk of ADHD and implicate neuronal biology,https://www.nature.com/articles/s41586-025-09702-8,2025-11-12 00:00:00 UTC,Nature,2025-11-12 00:00:00+00:00
Vacancy-enhanced cation ordering via magnesium doping to enable kesterite solar cells with 14.9% certified efficiency,https://www.nature.com/articles/s41560-025-01902-w,2025-11-12 00:00:00 UTC,Nature Energy,2025-11-12 00:00:00+00:00
Dual switches ignite tumour-specific mRNA therapeutics,https://www.nature.com/articles/s41565-025-02047-3,2025-11-12 00:00:00 UTC,Nature Nanotechnology,2025-11-12 00:00:00+00:00
A universal speed limit for spreading of coherence,https://www.nature.com/articles/s41586-025-09735-z,2025-11-12 00:00:00 UTC,Nature,2025-11-12 00:00:00+00:00
Photoinduced twist and untwist of moiré superlattices,https://www.nature.com/articles/s41586-025-09707-3,2025-11-12 00:00:00 UTC,Nature,2025-11-12 00:00:00+00:00
Aligning machine and human visual representations across abstraction levels,https://www.nature.com/articles/s41586-025-09631-6,2025-11-12 00:00:00 UTC,Nature,2025-11-12 00:00:00+00:00
Mortality impacts of rainfall and sea-level rise in a developing megacity,https://www.nature.com/articles/s41586-025-09730-4,2025-11-12 00:00:00 UTC,Nature,2025-11-12 00:00:00+00:00
The contribution of rock strength to soil production,https://www.nature.com/articles/s41586-025-09751-z,2025-11-12 00:00:00 UTC,Nature,2025-11-12 00:00:00+00:00
Florigen activation complex forms via multifaceted assembly in Arabidopsis,https://www.nature.com/articles/s41586-025-09704-6,2025-11-12 00:00:00 UTC,Nature,2025-11-12 00:00:00+00:00
The governance evolution of nanotechnology from controversy to consensus,https://www.nature.com/articles/s41565-025-02035-7,2025-11-12 00:00:00 UTC,Nature Nanotechnology,2025-11-12 00:00:00+00:00
Spatial fibroblast niches define Crohn’s fistulae,https://www.nature.com/articles/s41586-025-09744-y,2025-11-12 00:00:00 UTC,Nature,2025-11-12 00:00:00+00:00
Ecology and spread of the North American H5N1 epizootic,https://www.nature.com/articles/s41586-025-09737-x,2025-11-12 00:00:00 UTC,Nature,2025-11-12 00:00:00+00:00
In situ structural mechanism of epothilone-B-induced CNS axon regeneration,https://www.nature.com/articles/s41586-025-09654-z,2025-11-12 00:00:00 UTC,Nature,2025-11-12 00:00:00+00:00
‘Godfather of AI’ becomes first person to hit one million citations,https://www.nature.com/articles/d41586-025-03681-6,2025-11-12 00:00:00 UTC,Nature,2025-11-12 00:00:00+00:00
Hotcakes at the end times,https://www.nature.com/articles/d41586-025-03666-5,2025-11-12 00:00:00 UTC,Nature,2025-11-12 00:00:00+00:00
Official statistics are vastly undercounting deaths from extreme weather,https://www.nature.com/articles/d41586-025-03669-2,2025-11-12 00:00:00 UTC,Nature,2025-11-12 00:00:00+00:00
Estimation and mapping of the missing heritability of human phenotypes,https://www.nature.com/articles/s41586-025-09720-6,2025-11-12 00:00:00 UTC,Nature,2025-11-12 00:00:00+00:00
YTHDF2 regulates self non-coding RNA metabolism to control inflammation and tumorigenesis,https://www.nature.com/articles/s41467-025-64898-7,2025-11-12 00:00:00 UTC,Nature Communications,2025-11-12 00:00:00+00:00
Variation in surface protein expression leads to heterogeneous Trypanosoma cruzi populations during host cell infection,https://www.nature.com/articles/s41467-025-64900-2,2025-11-12 00:00:00 UTC,Nature Communications,2025-11-12 00:00:00+00:00
"Catalytic asymmetric constructions of nitrogen, boron and carbon continuous stereogenic centers",https://www.nature.com/articles/s41467-025-64905-x,2025-11-12 00:00:00 UTC,Nature Communications,2025-11-12 00:00:00+00:00
Nickel-catalyzed arylative telomerization of isoprene,https://www.nature.com/articles/s41467-025-64893-y,2025-11-12 00:00:00 UTC,Nature Communications,2025-11-12 00:00:00+00:00
Heteroaromatic π-stacking engineered near-infrared absorption for highly stable near-zero transmittance electrochromic window,https://www.nature.com/articles/s41467-025-64955-1,2025-11-12 00:00:00 UTC,Nature Communications,2025-11-12 00:00:00+00:00
A composite motif in calcimembrin/C16orf74 dictates multimeric dephosphorylation by calcineurin,https://www.nature.com/articles/s41467-025-64884-z,2025-11-12 00:00:00 UTC,Nature Communications,2025-11-12 00:00:00+00:00
Colistin resistance plasmids dually enhance bacterial virulence and antibiotic resistance via surface polysaccharide biosynthesis,https://www.nature.com/articles/s41467-025-65412-9,2025-11-12 00:00:00 UTC,Nature Communications,2025-11-12 00:00:00+00:00
How geopolitics is reshaping research: Data hint at shifting collaborations,https://www.nature.com/articles/d41586-025-03025-4,2025-11-12 00:00:00 UTC,Nature,2025-11-12 00:00:00+00:00
Achieving electrochemical and mechanical stability in a lightweight titanium alloy,https://www.nature.com/articles/s41467-025-64875-0,2025-11-12 00:00:00 UTC,Nature Communications,2025-11-12 00:00:00+00:00
Fossil vomit contains new species of pterosaur from Brazil,https://www.science.org/content/article/fossil-vomit-contains-new-species-pterosaur-brazil,2025-11-12 02:50:00 UTC,Latest News from Science Magazine,2025-11-12 02:50:00+00:00
Protesters break into COP30 venue in Brazil,https://www.bbc.com/news/articles/c0l7yjgn050o?at_medium=RSS&at_campaign=rss,2025-11-12 02:50:49 UTC,BBC News,2025-11-12 02:50:49+00:00
"After Coalition S disrupted scientific publishing, new plan retreats from strict requirements",https://www.science.org/content/article/after-coalition-s-disrupted-scientific-publishing-new-plan-retreats-strict-requirements,2025-11-12 05:00:00 UTC,Latest News from Science Magazine,2025-11-12 05:00:00+00:00
‘A sigh of relief’: New malaria drug succeeds in large clinical trial,https://www.science.org/content/article/sigh-relief-new-malaria-drug-succeeds-large-clinical-trial,2025-11-12 05:10:00 UTC,Latest News from Science Magazine,2025-11-12 05:10:00+00:00
Unveiling Ion Pairing Reorganization Mechanism of Oxygen Vacancy‐Rich Amorphous Molybdenum Oxide‐Based Solid‐Electrolyte Interphase for Fast Zn2+ Desolvation,https://advanced.onlinelibrary.wiley.com/doi/10.1002/aenm.202503167?af=R,2025-11-12 07:59:54 UTC,Wiley: Advanced Energy Materials: Table of Contents,2025-11-12 07:59:54+00:00
Mechanical power generation using Earth’s ambient radiation,https://www.science.org/doi/abs/10.1126/sciadv.adw6833?af=R,2025-11-12 08:00:00 UTC,AAAS: Science Advances: Table of Contents,2025-11-12 08:00:00+00:00
Suppression of marine heatwave activity by tropical cyclone–induced upper ocean cooling,https://www.science.org/doi/abs/10.1126/sciadv.adw8070?af=R,2025-11-12 08:00:00 UTC,AAAS: Science Advances: Table of Contents,2025-11-12 08:00:00+00:00
Designing unique mechanical modes through an extension of the quantum hopping method,https://www.pnas.org/doi/abs/10.1073/pnas.2423603122?mi=eymic2&af=R&access=on&content=articlesChapters&publication=pnas&sortBy=Earliest&target=default,2025-11-12 08:00:00 UTC,Proceedings of the National Academy of Sciences: Keyword search for query,2025-11-12 08:00:00+00:00
"Correction for Ma et al., Intercellular propagation of RIPK1/RIPK3 amyloid fibrils",https://www.pnas.org/doi/abs/10.1073/pnas.2530468122?mi=eymic2&af=R&access=on&content=articlesChapters&publication=pnas&sortBy=Earliest&target=default,2025-11-12 08:00:00 UTC,Proceedings of the National Academy of Sciences: Keyword search for query,2025-11-12 08:00:00+00:00
Rewilding microbiology,https://www.pnas.org/doi/abs/10.1073/pnas.2525453122?mi=eymic2&af=R&access=on&content=articlesChapters&publication=pnas&sortBy=Earliest&target=default,2025-11-12 08:00:00 UTC,Proceedings of the National Academy of Sciences: Keyword search for query,2025-11-12 08:00:00+00:00
A high-entropy mixed ionic and electronic conductor for accelerating the cathode dynamics in all solid–state lithium metal batteries,https://www.science.org/doi/abs/10.1126/sciadv.adw4710?af=R,2025-11-12 08:00:00 UTC,AAAS: Science Advances: Table of Contents,2025-11-12 08:00:00+00:00
Coevolution of cooperative lifestyles and reduced cancer prevalence in mammals,https://www.science.org/doi/abs/10.1126/sciadv.adw0685?af=R,2025-11-12 08:00:00 UTC,AAAS: Science Advances: Table of Contents,2025-11-12 08:00:00+00:00
Dynamic structures of a membrane transporter in native cellular membranes,https://www.science.org/doi/abs/10.1126/sciadv.adv4583?af=R,2025-11-12 08:00:00 UTC,AAAS: Science Advances: Table of Contents,2025-11-12 08:00:00+00:00
Glial-to-mesenchymal transition of tumor Schwann cells drives the genetic burden in MPNSTs from neurofibromatosis type 1 mouse model,https://www.science.org/doi/abs/10.1126/sciadv.adt9210?af=R,2025-11-12 08:00:00 UTC,AAAS: Science Advances: Table of Contents,2025-11-12 08:00:00+00:00
Single-nucleus multi-omics identifies shared and distinct pathways in Pick’s and Alzheimer’s disease,https://www.science.org/doi/abs/10.1126/sciadv.ads7973?af=R,2025-11-12 08:00:00 UTC,AAAS: Science Advances: Table of Contents,2025-11-12 08:00:00+00:00
"Correction to Supporting Information for Giossi et al., Arkypallidal neurons in the external globus pallidus can mediate inhibitory control by altering competition in the striatum",https://www.pnas.org/doi/abs/10.1073/pnas.2530470122?mi=eymic2&af=R&access=on&content=articlesChapters&publication=pnas&sortBy=Earliest&target=default,2025-11-12 08:00:00 UTC,Proceedings of the National Academy of Sciences: Keyword search for query,2025-11-12 08:00:00+00:00
"Correction for Dong et al., Hybridoma-inspired strategy crafts tailored multifunctional exosomes for precision therapy",https://www.pnas.org/doi/abs/10.1073/pnas.2530464122?mi=eymic2&af=R&access=on&content=articlesChapters&publication=pnas&sortBy=Earliest&target=default,2025-11-12 08:00:00 UTC,Proceedings of the National Academy of Sciences: Keyword search for query,2025-11-12 08:00:00+00:00
Wildfires have created instability within risk transfer markets. Here’s a path forward,https://www.pnas.org/doi/abs/10.1073/pnas.2530050122?mi=eymic2&af=R&access=on&content=articlesChapters&publication=pnas&sortBy=Earliest&target=default,2025-11-12 08:00:00 UTC,Proceedings of the National Academy of Sciences: Keyword search for query,2025-11-12 08:00:00+00:00
