title,link,published,source,pub_date,doi,abstract,abstract_source
Tailoring cobalt gradient distribution toward practical Ni95 cathode for high-energy-density lithium-ion battery,https://www.cell.com/joule/fulltext/S2542-4351(25)00410-6?rss=yes,2025-12-12 00:00:00 UTC,Joule,2025-12-12 00:00:00+00:00,,,
Projecting the products of hydrogen projects,https://www.nature.com/articles/s44286-025-00339-y,2025-12-12 00:00:00 UTC,Nature Chemical Engineering,2025-12-12 00:00:00+00:00,,,
Steel-stencil printing and local polysilicon contacts enable 26.09%-efficient industrial-grade tunnel oxide passivating contact solar cells,https://www.cell.com/joule/fulltext/S2542-4351(25)00412-X?rss=yes,2025-12-12 00:00:00 UTC,Joule,2025-12-12 00:00:00+00:00,,,
Achieving over 200 Wh kg−1 sodium-ion pouch cell by quantitative engineering of hard carbon pores,https://academic.oup.com/nsr/advance-article/doi/10.1093/nsr/nwaf566/8378102?rss=1,2025-12-12 00:00:00 UTC,National Science Review Advance Access,2025-12-12 00:00:00+00:00,,,
Author Correction: Cancer SLC43A2 alters T cell methionine metabolism and histone methylation,https://www.nature.com/articles/s41586-025-09845-8,2025-12-12 00:00:00 UTC,Nature,2025-12-12 00:00:00+00:00,,,
Author Correction: Unravelling cysteine-deficiency-associated rapid weight loss,https://www.nature.com/articles/s41586-025-09780-8,2025-12-12 00:00:00 UTC,Nature,2025-12-12 00:00:00+00:00,,,
Force spectroscopy on molecular rotors,https://www.cell.com/chem/fulltext/S2451-9294(25)00281-5?rss=yes,2025-12-12 00:00:00 UTC,Chem,2025-12-12 00:00:00+00:00,,,
Science sleuths raise concerns about scores of bioengineering papers,https://www.nature.com/articles/d41586-025-03870-3,2025-12-12 00:00:00 UTC,Nature,2025-12-12 00:00:00+00:00,,,
Revised estimates of CO2 sources and sinks improve global carbon accounting,https://www.nature.com/articles/d41586-025-03981-x,2025-12-12 00:00:00 UTC,Nature,2025-12-12 00:00:00+00:00,,,
China leads research in 90% of crucial technologies — a dramatic shift this century,https://www.nature.com/articles/d41586-025-04048-7,2025-12-12 00:00:00 UTC,Nature,2025-12-12 00:00:00+00:00,,,
"In praise of inefficiency, failure and friendship: ten galvanizing reads for this festive season",https://www.nature.com/articles/d41586-025-04052-x,2025-12-12 00:00:00 UTC,Nature,2025-12-12 00:00:00+00:00,,,
"The world of metal nanowires: Recent advances in syntheses, electronic applications, and engineering challenges",https://www.sciencedirect.com/science/article/pii/S1369702125005188?dgcid=rss_sd_all,2025-12-12 00:00:00 UTC,ScienceDirect Publication: Materials Today,2025-12-12 00:00:00+00:00,,,
Bringing together sustainability science and chemical process design,https://www.nature.com/articles/s44286-025-00328-1,2025-12-12 00:00:00 UTC,Nature Chemical Engineering,2025-12-12 00:00:00+00:00,,,
Quantum Phases in Twisted Homobilayer Transition Metal Dichalcogenides,https://academic.oup.com/nsr/advance-article/doi/10.1093/nsr/nwaf570/8378091?rss=1,2025-12-12 00:00:00 UTC,National Science Review Advance Access,2025-12-12 00:00:00+00:00,,,
Vehicle-to-home charging can cut costs and greenhouse gas emissions across the USA,https://www.nature.com/articles/s41560-025-01894-7,2025-12-12 00:00:00 UTC,Nature Energy,2025-12-12 00:00:00+00:00,,,
Closed-loop manufacturing for sustainable perovskite photovoltaics,https://www.nature.com/articles/s41578-025-00872-5,2025-12-12 00:00:00 UTC,Nature Reviews Materials,2025-12-12 00:00:00+00:00,,,
An electronic paper with human-eye resolution,https://www.nature.com/articles/s41563-025-02447-9,2025-12-12 00:00:00 UTC,Nature Materials,2025-12-12 00:00:00+00:00,,,
Want to sway an election? Here’s how much fake online accounts cost,https://www.science.org/content/article/want-sway-election-here-s-how-much-fake-online-accounts-cost,2025-12-12 02:00:00 UTC,Latest News from Science Magazine,2025-12-12 02:00:00+00:00,,,
NIH’s proposed caps on open-access publishing fees roil scientific community,https://www.science.org/content/article/nih-s-proposed-caps-open-access-publishing-fees-roil-scientific-community,2025-12-12 02:30:00 UTC,Latest News from Science Magazine,2025-12-12 02:30:00+00:00,,,
Geminid meteor shower set to light up sky during weekend peak,https://www.bbc.com/news/articles/cwyvkkxxj42o?at_medium=RSS&at_campaign=rss,2025-12-12 07:37:51 UTC,BBC News,2025-12-12 07:37:51+00:00,,,
To know is not enough: Adaptation requires means,https://www.science.org/doi/abs/10.1126/sciadv.aee0726?af=R,2025-12-12 08:00:00 UTC,AAAS: Science Advances: Table of Contents,2025-12-12 08:00:00+00:00,,,
Global models predict clouds at the wrong time of day: Does it matter for radiation and climate?,https://www.science.org/doi/abs/10.1126/sciadv.ady3236?af=R,2025-12-12 08:00:00 UTC,AAAS: Science Advances: Table of Contents,2025-12-12 08:00:00+00:00,,,
Spiking world model with multicompartment neurons for model-based reinforcement learning,https://www.pnas.org/doi/abs/10.1073/pnas.2513319122?mi=eymic2&af=R&access=on&content=articlesChapters&publication=pnas&sortBy=Earliest&target=default,2025-12-12 08:00:00 UTC,Proceedings of the National Academy of Sciences: Keyword search for query,2025-12-12 08:00:00+00:00,,,
"A fluorescent probe for concurrent detection of cysteine, homocysteine, and superoxide anion",https://www.science.org/doi/abs/10.1126/sciadv.adx6659?af=R,2025-12-12 08:00:00 UTC,AAAS: Science Advances: Table of Contents,2025-12-12 08:00:00+00:00,,,
Fluctuation theorems for autonomous work,https://www.pnas.org/doi/abs/10.1073/pnas.2524775122?mi=eymic2&af=R&access=on&content=articlesChapters&publication=pnas&sortBy=Earliest&target=default,2025-12-12 08:00:00 UTC,Proceedings of the National Academy of Sciences: Keyword search for query,2025-12-12 08:00:00+00:00,,,
Influence of atomic-scale defects on coherent phonon excitations by THz near fields in an STM,https://www.science.org/doi/abs/10.1126/sciadv.adz6549?af=R,2025-12-12 08:00:00 UTC,AAAS: Science Advances: Table of Contents,2025-12-12 08:00:00+00:00,,,
Glomerular endothelial cells eliminate nicotinamide adenine dinucleotide to instruct CD103+ T cells in human lupus nephritis,https://www.pnas.org/doi/abs/10.1073/pnas.2507422122?mi=eymic2&af=R&access=on&content=articlesChapters&publication=pnas&sortBy=Earliest&target=default,2025-12-12 08:00:00 UTC,Proceedings of the National Academy of Sciences: Keyword search for query,2025-12-12 08:00:00+00:00,,,
Erratum for the Research Article “Single-cell profiling of alveolar rhabdomyosarcoma reveals RAS pathway inhibitors as cell-fate hijackers with therapeutic relevance” by S. G. Danielli et al.,https://www.science.org/doi/abs/10.1126/sciadv.aee1296?af=R,2025-12-12 08:00:00 UTC,AAAS: Science Advances: Table of Contents,2025-12-12 08:00:00+00:00,,,
Reviving Vavilov’s vision: The tragedy of biodiversity governance and principles for reform,https://www.pnas.org/doi/abs/10.1073/pnas.2501753122?mi=eymic2&af=R&access=on&content=articlesChapters&publication=pnas&sortBy=Earliest&target=default,2025-12-12 08:00:00 UTC,Proceedings of the National Academy of Sciences: Keyword search for query,2025-12-12 08:00:00+00:00,,,
Phytophthora effector exploits WY module truncation to manipulate Nt-acetylation–mediated AtMBP-1 turnover and suppress plant immunity,https://www.science.org/doi/abs/10.1126/sciadv.ady1482?af=R,2025-12-12 08:00:00 UTC,AAAS: Science Advances: Table of Contents,2025-12-12 08:00:00+00:00,,,
"Correction for Pospisil and Pillow, Revisiting the high-dimensional geometry of population responses in the visual cortex",https://www.pnas.org/doi/abs/10.1073/pnas.2533074122?mi=eymic2&af=R&access=on&content=articlesChapters&publication=pnas&sortBy=Earliest&target=default,2025-12-12 08:00:00 UTC,Proceedings of the National Academy of Sciences: Keyword search for query,2025-12-12 08:00:00+00:00,,,
Industrial‐Grade H2O2 Electrosynthesis via N/O‐Doped Hierarchically Porous Carbon Nanoreactors with Remarkable Yield and Stability,https://onlinelibrary.wiley.com/doi/10.1002/anie.202519013?af=R,2025-12-12 08:00:00 UTC,Wiley: Angewandte Chemie International Edition: Table of Contents,2025-12-12 08:00:00+00:00,,,
The extracellular matrix drives guanylate production and protects pancreatic cancer cells from oxaliplatin-induced DNA damage,https://www.science.org/doi/abs/10.1126/sciadv.adu2276?af=R,2025-12-12 08:00:00 UTC,AAAS: Science Advances: Table of Contents,2025-12-12 08:00:00+00:00,,,
Integrated single-cell atlases unveil the operation principles of whole-brain 5-HT neuronal subsystems,https://www.science.org/doi/abs/10.1126/sciadv.adv8128?af=R,2025-12-12 08:00:00 UTC,AAAS: Science Advances: Table of Contents,2025-12-12 08:00:00+00:00,,,
Histone methyltransferase DOT1L maintains cell state and restricts cytotoxic potential of CD8 T cells,https://www.science.org/doi/abs/10.1126/sciadv.adw1289?af=R,2025-12-12 08:00:00 UTC,AAAS: Science Advances: Table of Contents,2025-12-12 08:00:00+00:00,,,
High-efficiency active membrane metasurfaces,https://www.science.org/doi/abs/10.1126/sciadv.adw4752?af=R,2025-12-12 08:00:00 UTC,AAAS: Science Advances: Table of Contents,2025-12-12 08:00:00+00:00,,,
Erratum for the Research Article “Extracellular vesicle–hitchhiking nanoliposomes for cancer-associated fibroblast phenotype modulation impede metastasis progression” by F. Chen et al.,https://www.science.org/doi/abs/10.1126/sciadv.aee0685?af=R,2025-12-12 08:00:00 UTC,AAAS: Science Advances: Table of Contents,2025-12-12 08:00:00+00:00,,,
SPNS1 is an essential cellular factor for EV-A71 by acting as a transporter of viral pocket factor,https://www.pnas.org/doi/abs/10.1073/pnas.2510020122?mi=eymic2&af=R&access=on&content=articlesChapters&publication=pnas&sortBy=Earliest&target=default,2025-12-12 08:00:00 UTC,Proceedings of the National Academy of Sciences: Keyword search for query,2025-12-12 08:00:00+00:00,,,
Conservation of cis-regulatory codes over half a billion years of evolution,https://www.science.org/doi/abs/10.1126/sciadv.adw7681?af=R,2025-12-12 08:00:00 UTC,AAAS: Science Advances: Table of Contents,2025-12-12 08:00:00+00:00,,,
"Three‐Dimensional Covalent Thiazolo[5,4‐d]thiazole Frameworks with sur‐a Topology for Coupling Photoactivation of Oxygen and Biomass",https://onlinelibrary.wiley.com/doi/10.1002/anie.202513616?af=R,2025-12-12 08:00:00 UTC,Wiley: Angewandte Chemie International Edition: Table of Contents,2025-12-12 08:00:00+00:00,,,
Erratum for the Research Article “Large-scale smart bioreactor with fully integrated wireless multivariate sensors and electronics for long-term in situ monitoring of stem cell culture” by J. Lee et al.,https://www.science.org/doi/abs/10.1126/sciadv.aee0330?af=R,2025-12-12 08:00:00 UTC,AAAS: Science Advances: Table of Contents,2025-12-12 08:00:00+00:00,,,
Lewis Acid Adsorption Promotes CO2 Enrichment for Efficient Formic Acid Electrosynthesis on Reconstructed Bi2O2CO3 in Acidic Media,https://onlinelibrary.wiley.com/doi/10.1002/anie.202512476?af=R,2025-12-12 08:00:00 UTC,Wiley: Angewandte Chemie International Edition: Table of Contents,2025-12-12 08:00:00+00:00,,,
DNA-directed electrochemiluminescence nanosphere with electrocatalysis-enhanced microfluidic arrays for rapid multibacterial detection,https://www.science.org/doi/abs/10.1126/sciadv.ady3070?af=R,2025-12-12 08:00:00 UTC,AAAS: Science Advances: Table of Contents,2025-12-12 08:00:00+00:00,,,
Bridging the climate research divide: A global imperative for equitable resilience,https://www.science.org/doi/abs/10.1126/sciadv.adz0469?af=R,2025-12-12 08:00:00 UTC,AAAS: Science Advances: Table of Contents,2025-12-12 08:00:00+00:00,,,
Liquid crystal–driven interfacial ordering of colloidal microplastics: Advancing microplastic characterization below the macroscale,https://www.science.org/doi/abs/10.1126/sciadv.ady1167?af=R,2025-12-12 08:00:00 UTC,AAAS: Science Advances: Table of Contents,2025-12-12 08:00:00+00:00,,,
Quantum reservoir computing for photonic entanglement witnessing,https://www.science.org/doi/abs/10.1126/sciadv.ady7987?af=R,2025-12-12 08:00:00 UTC,AAAS: Science Advances: Table of Contents,2025-12-12 08:00:00+00:00,,,
Optical and electrical probing of plasmonic metal-molecule interactions,https://www.science.org/doi/abs/10.1126/sciadv.aea0585?af=R,2025-12-12 08:00:00 UTC,AAAS: Science Advances: Table of Contents,2025-12-12 08:00:00+00:00,,,
Molecular effects of indoor tanning,https://www.science.org/doi/abs/10.1126/sciadv.ady4878?af=R,2025-12-12 08:00:00 UTC,AAAS: Science Advances: Table of Contents,2025-12-12 08:00:00+00:00,,,
Non-Laplacian air-gap electrostatics for high-field oil-water nanoemulsion separation,https://www.science.org/doi/abs/10.1126/sciadv.adz6233?af=R,2025-12-12 08:00:00 UTC,AAAS: Science Advances: Table of Contents,2025-12-12 08:00:00+00:00,,,
Caspase-8 expression in CD8+ T cells promotes pathogen restriction in the brain during Toxoplasma gondii infection,https://www.science.org/doi/abs/10.1126/sciadv.adz4468?af=R,2025-12-12 08:00:00 UTC,AAAS: Science Advances: Table of Contents,2025-12-12 08:00:00+00:00,,,
bHLH35 mediates specificity in plant responses to multiple stress conditions,https://www.science.org/doi/abs/10.1126/sciadv.adz3298?af=R,2025-12-12 08:00:00 UTC,AAAS: Science Advances: Table of Contents,2025-12-12 08:00:00+00:00,,,
BE screen reveals METTL3 S2 dephosphorylation sensitizes gastric cancer cells to oxaliplatin by interfering METTL3-eIF3H interaction,https://www.science.org/doi/abs/10.1126/sciadv.ady7259?af=R,2025-12-12 08:00:00 UTC,AAAS: Science Advances: Table of Contents,2025-12-12 08:00:00+00:00,,,
Ultimate tuning of hyperbolic phonon polaritons,https://www.science.org/doi/abs/10.1126/sciadv.adz6278?af=R,2025-12-12 08:00:00 UTC,AAAS: Science Advances: Table of Contents,2025-12-12 08:00:00+00:00,,,
"Cultivation of Methanonezhaarchaeia, the third class of methanogens within the phylum Thermoproteota",https://www.science.org/doi/abs/10.1126/sciadv.aea0936?af=R,2025-12-12 08:00:00 UTC,AAAS: Science Advances: Table of Contents,2025-12-12 08:00:00+00:00,,,
Droplet-based single-cell pairing for high-throughput interaction mapping of antigen-receptor combinations,https://www.science.org/doi/abs/10.1126/sciadv.aeb1515?af=R,2025-12-12 08:00:00 UTC,AAAS: Science Advances: Table of Contents,2025-12-12 08:00:00+00:00,,,
Spectral fingerprint diagnosis: Spatially independent analysis of biomarker patterns in homogeneous systems,https://www.science.org/doi/abs/10.1126/sciadv.aea8943?af=R,2025-12-12 08:00:00 UTC,AAAS: Science Advances: Table of Contents,2025-12-12 08:00:00+00:00,,,
"Chiral sodium complex–catalyzed asymmetric cascade cycloaddition/hydration/1,2-rearrangement",https://www.science.org/doi/abs/10.1126/sciadv.ady4294?af=R,2025-12-12 08:00:00 UTC,AAAS: Science Advances: Table of Contents,2025-12-12 08:00:00+00:00,,,
Total synthesis of zwitterionic PS A2 oligosaccharides from Bacteroides fragilis,https://www.science.org/doi/abs/10.1126/sciadv.aeb4065?af=R,2025-12-12 08:00:00 UTC,AAAS: Science Advances: Table of Contents,2025-12-12 08:00:00+00:00,,,
Asymmetric isopeptide bond steers directional genomic RNA egress from icosahedral virus,https://www.science.org/doi/abs/10.1126/sciadv.ady4104?af=R,2025-12-12 08:00:00 UTC,AAAS: Science Advances: Table of Contents,2025-12-12 08:00:00+00:00,,,
Human alterations to global riverine phosphorus fluxes to the ocean,https://www.science.org/doi/abs/10.1126/sciadv.ady5884?af=R,2025-12-12 08:00:00 UTC,AAAS: Science Advances: Table of Contents,2025-12-12 08:00:00+00:00,,,
Colored HOMFLYPT counts holomorphic curves,https://www.pnas.org/doi/abs/10.1073/pnas.2510118122?mi=eymic2&af=R&access=on&content=articlesChapters&publication=pnas&sortBy=Earliest&target=default,2025-12-12 08:00:00 UTC,Proceedings of the National Academy of Sciences: Keyword search for query,2025-12-12 08:00:00+00:00,,,
Constructing biologically constrained RNNs via Dale’s backpropagation and topologically informed pruning,https://www.science.org/doi/abs/10.1126/sciadv.adw4970?af=R,2025-12-12 08:00:00 UTC,AAAS: Science Advances: Table of Contents,2025-12-12 08:00:00+00:00,,,
"Abstract vs Conclusion: Articulating Purpose, Structure, and Impact",https://pubs.acs.org/doi/10.1021/acsenergylett.5c03842?af=R,2025-12-12 08:00:00 UTC,acs: ACS Energy Letters: Table of Contents,2025-12-12 08:00:00+00:00,,,
Athlete-derived extracellular vesicles protect against spinal cord injury via inhibition of neuronal ferroptosis,https://www.science.org/doi/abs/10.1126/sciadv.adx7695?af=R,2025-12-12 08:00:00 UTC,AAAS: Science Advances: Table of Contents,2025-12-12 08:00:00+00:00,,,
Issue Publication Information,https://pubs.acs.org/doi/10.1021/nzv010i012_2016994?af=R,2025-12-12 08:00:49 UTC,acs: ACS Energy Letters: Table of Contents,2025-12-12 08:00:49+00:00,,,
Issue Editorial Masthead,https://pubs.acs.org/doi/10.1021/nzv010i012_2016995?af=R,2025-12-12 08:00:50 UTC,acs: ACS Energy Letters: Table of Contents,2025-12-12 08:00:50+00:00,,,
[ASAP] Upcycling of Acid Waste Gases Using Asymmetric Atomic-Copper-Anchored Covalent Organic Framework Catalyst,http://dx.doi.org/10.1021/jacs.5c13792,2025-12-12 09:53:58 UTC,Journal of the American Chemical Society: Latest Articles (ACS Publications),2025-12-12 09:53:58+00:00,,,
[ASAP] Coevaporated Formamidinium Tin Triiodide with Suppressed p-Type Self-Doping,http://dx.doi.org/10.1021/acsenergylett.5c03400,2025-12-12 12:05:48 UTC,ACS Energy Letters: Latest Articles (ACS Publications),2025-12-12 12:05:48+00:00,,,
[ASAP] Nickel-Induced Lattice Defects Limit Proton Uptake in Barium Zirconate Electrolytes,http://dx.doi.org/10.1021/jacs.5c13935,2025-12-12 12:28:19 UTC,Journal of the American Chemical Society: Latest Articles (ACS Publications),2025-12-12 12:28:19+00:00,,,
[ASAP] Interlayer-Tailored Alkyl-MXenes for Selective Electrochemical Lithium-Ion Extraction,http://dx.doi.org/10.1021/acsenergylett.5c03009,2025-12-12 12:58:33 UTC,ACS Energy Letters: Latest Articles (ACS Publications),2025-12-12 12:58:33+00:00,,,
[ASAP] Quantification of Mobile Ions in Perovskite Solar Cells with Thermally Activated Ion Current Measurements,http://dx.doi.org/10.1021/acsenergylett.5c02224,2025-12-12 12:59:33 UTC,ACS Energy Letters: Latest Articles (ACS Publications),2025-12-12 12:59:33+00:00,,,
[ASAP] Biomimetic Water-Stable Multicomponent HOFs as Ultrahigh Superprotonic Conductors,http://dx.doi.org/10.1021/acsenergylett.5c02852,2025-12-12 13:09:41 UTC,ACS Energy Letters: Latest Articles (ACS Publications),2025-12-12 13:09:41+00:00,,,
[ASAP] Cerium Oxide Incorporation for Radiation Tolerance and Stability in Perovskite Solar Cells,http://dx.doi.org/10.1021/acsenergylett.5c02116,2025-12-12 13:10:59 UTC,ACS Energy Letters: Latest Articles (ACS Publications),2025-12-12 13:10:59+00:00,,,
[ASAP] Crystallization Pathway Dictates Performance: Unraveling Microstructural Evolution toward Efficient and Stable Inorganic Perovskite Solar Cells,http://dx.doi.org/10.1021/acsenergylett.5c03143,2025-12-12 13:11:29 UTC,ACS Energy Letters: Latest Articles (ACS Publications),2025-12-12 13:11:29+00:00,,,
[ASAP] Layered Alkali-Copper Selenides: Deciphering Thermoelectric Properties and Reaction Pathways for Nanostructuring β-CsCu5Se3,http://dx.doi.org/10.1021/acsenergylett.5c02909,2025-12-12 13:21:43 UTC,ACS Energy Letters: Latest Articles (ACS Publications),2025-12-12 13:21:43+00:00,,,
[ASAP] Modulating Ammonium-Driven Hydrogen Evolution on Silver Electrodes in Amine-CO2 Capture Solutions,http://dx.doi.org/10.1021/acsenergylett.5c03211,2025-12-12 13:23:31 UTC,ACS Energy Letters: Latest Articles (ACS Publications),2025-12-12 13:23:31+00:00,,,
[ASAP] Molecular Design of Oligomers for Codeposited Perovskite Solar Cells: Enabling Synergistic Control of Crystallization and Carrier Dynamics,http://dx.doi.org/10.1021/acsenergylett.5c03201,2025-12-12 13:23:45 UTC,ACS Energy Letters: Latest Articles (ACS Publications),2025-12-12 13:23:45+00:00,,,
[ASAP] Synergistic Light–Heat–Bias Activation for 21%-Efficient CdSeTe Thin-Film Solar Cells,http://dx.doi.org/10.1021/acsenergylett.5c03194,2025-12-12 13:26:33 UTC,ACS Energy Letters: Latest Articles (ACS Publications),2025-12-12 13:26:33+00:00,,,
[ASAP] Leveraging Sodium Storage of Water-Deficient Prussian Blue Analogues by Deep Eutectic Chemistry,http://dx.doi.org/10.1021/acsenergylett.5c03085,2025-12-12 13:26:42 UTC,ACS Energy Letters: Latest Articles (ACS Publications),2025-12-12 13:26:42+00:00,,,
"[ASAP] Structural Aspects, Ionic Conductivity, and Electrochemical Properties of New Bromine-Substituted Alkali-Based Crystalline Phases MTa(Nb)X6–yBry (M = Li, Na, K; X = Cl, F)",http://dx.doi.org/10.1021/acsenergylett.5c02904,2025-12-12 13:47:45 UTC,ACS Energy Letters: Latest Articles (ACS Publications),2025-12-12 13:47:45+00:00,,,
[ASAP] Practical Codoping Strategy for Ni-Rich Cathode Materials,http://dx.doi.org/10.1021/acsenergylett.5c03390,2025-12-12 13:48:02 UTC,ACS Energy Letters: Latest Articles (ACS Publications),2025-12-12 13:48:02+00:00,,,
[ASAP] Solar-Driven CO2-to-CH4 Conversion Enabled by Fe Tetrahedra in Cs3FeCl5,http://dx.doi.org/10.1021/acsenergylett.5c03199,2025-12-12 13:48:13 UTC,ACS Energy Letters: Latest Articles (ACS Publications),2025-12-12 13:48:13+00:00,,,
[ASAP] Perovskite Photovoltaics: Pick FAPbI3 and Stick to It,http://dx.doi.org/10.1021/acsenergylett.5c03275,2025-12-12 13:48:45 UTC,ACS Energy Letters: Latest Articles (ACS Publications),2025-12-12 13:48:45+00:00,,,
[ASAP] In-Situ Construction of a NaF/NaxPOy Heterostructured Interface to Suppress NaF Dissolution in Layered Sodium Cathodes,http://dx.doi.org/10.1021/acsenergylett.5c03395,2025-12-12 14:04:07 UTC,ACS Energy Letters: Latest Articles (ACS Publications),2025-12-12 14:04:07+00:00,,,
[ASAP] Thermodynamically Guided Design of High-Entropy Organic Electrolytes,http://dx.doi.org/10.1021/acsenergylett.5c03151,2025-12-12 14:08:49 UTC,ACS Energy Letters: Latest Articles (ACS Publications),2025-12-12 14:08:49+00:00,,,
[ASAP] Platinum as Co-catalyst in Photocatalysis: Single Atoms vs Nanoparticles,http://dx.doi.org/10.1021/acsenergylett.5c03789,2025-12-12 14:09:43 UTC,ACS Energy Letters: Latest Articles (ACS Publications),2025-12-12 14:09:43+00:00,,,
[ASAP] Phase-Reconstructable MoS2 Heterostructures for High-Performance Sodium-Ion Batteries,http://dx.doi.org/10.1021/acsenergylett.5c03845,2025-12-12 14:09:59 UTC,ACS Energy Letters: Latest Articles (ACS Publications),2025-12-12 14:09:59+00:00,,,
[ASAP] Machine Learning-Assisted Crystal Structure Prediction of Solid-State Electrolytes Reveals Superior Ionic Conductivity in Metastable Edge-Sharing Phases,http://dx.doi.org/10.1021/jacs.5c15665,2025-12-12 14:36:09 UTC,Journal of the American Chemical Society: Latest Articles (ACS Publications),2025-12-12 14:36:09+00:00,,,
[ASAP] Advances and Prospects for Semitransparent Organic Photovoltaics,http://dx.doi.org/10.1021/acsenergylett.5c03166,2025-12-12 14:37:50 UTC,ACS Energy Letters: Latest Articles (ACS Publications),2025-12-12 14:37:50+00:00,,,
[ASAP] Who Will Keep the Vacuum Pumping? The Need to Sustain UHV-Based Surface Science in Electrocatalysis,http://dx.doi.org/10.1021/acsenergylett.5c03630,2025-12-12 14:39:26 UTC,ACS Energy Letters: Latest Articles (ACS Publications),2025-12-12 14:39:26+00:00,,,
[ASAP] Organic Cation Gating Control for Water Management in CO2 Membrane Electrode Assembly Electrolyzers,http://dx.doi.org/10.1021/acsenergylett.5c03644,2025-12-12 14:39:43 UTC,ACS Energy Letters: Latest Articles (ACS Publications),2025-12-12 14:39:43+00:00,,,
[ASAP] Anode-Free Batteries: The Energy Density Prize and the Stability Paradox,http://dx.doi.org/10.1021/acsenergylett.5c03401,2025-12-12 14:42:13 UTC,ACS Energy Letters: Latest Articles (ACS Publications),2025-12-12 14:42:13+00:00,,,
[ASAP] Suppressed Proton Insertion Enhances Zinc-Ion Storage Kinetics and Stability in Hydrated Vanadate,http://dx.doi.org/10.1021/acsenergylett.5c03338,2025-12-12 15:13:06 UTC,ACS Energy Letters: Latest Articles (ACS Publications),2025-12-12 15:13:06+00:00,,,
[ASAP] In situ X-ray Synchrotron Studies Reveal the Nucleation and Topotactic Transformation of Iron Sulfide Nanosheets,http://dx.doi.org/10.1021/jacs.5c15843,2025-12-12 15:20:15 UTC,Journal of the American Chemical Society: Latest Articles (ACS Publications),2025-12-12 15:20:15+00:00,,,
[ASAP] Modulating Crystallization and Suppressing Phase Segregation in Wide-Bandgap Perovskite Absorbers toward Silicon-Based Tandem Solar Cells,http://dx.doi.org/10.1021/acsenergylett.5c03383,2025-12-12 15:22:02 UTC,ACS Energy Letters: Latest Articles (ACS Publications),2025-12-12 15:22:02+00:00,,,
[ASAP] Locking the Morphology: A Photo-Cross-Linking Strategy for Thermally and Mechanically Robust Organic Solar Cells,http://dx.doi.org/10.1021/acsenergylett.5c03405,2025-12-12 15:22:27 UTC,ACS Energy Letters: Latest Articles (ACS Publications),2025-12-12 15:22:27+00:00,,,
[ASAP] High-Density Palladium Single-Atom Catalysts for Photoinduced Tandem Decarbonylation/Carbonylative Reductive Coupling,http://dx.doi.org/10.1021/jacs.5c12630,2025-12-12 15:33:00 UTC,Journal of the American Chemical Society: Latest Articles (ACS Publications),2025-12-12 15:33:00+00:00,,,
[ASAP] Bioactive Artificial Cells as Autonomous Metabolic Actuators Enable Bidirectional Communication with Tumor Cells,http://dx.doi.org/10.1021/jacs.5c14609,2025-12-12 15:34:18 UTC,Journal of the American Chemical Society: Latest Articles (ACS Publications),2025-12-12 15:34:18+00:00,,,
[ASAP] Managing Impurities in Direct Battery Recycling: Advancing Separation and Purification for High-Quality Feedstocks,http://dx.doi.org/10.1021/acsenergylett.5c03378,2025-12-12 15:49:46 UTC,ACS Energy Letters: Latest Articles (ACS Publications),2025-12-12 15:49:46+00:00,,,
