title,link,published,source,pub_date,doi,last_author,last_author_source,abstract,abstract_source
Reply to Godin-Beekmann et al.: Quantitative agreement between the CRE theory and spatiotemporal ozone observations is well founded,https://www.pnas.org/doi/abs/10.1073/pnas.2537183123?mi=eymic2&af=R&access=on&content=articlesChapters&publication=pnas&sortBy=Earliest&target=default,,Proceedings of the National Academy of Sciences: Keyword search for query,2026-04-06 07:00:00+00:00,10.1073/pnas.2537183123,Qing-Bin Lu,,,
Hydraulic stress limits thermal acclimation in trees under chronic drought,https://www.pnas.org/doi/abs/10.1073/pnas.2531865123?mi=eymic2&af=R&access=on&content=articlesChapters&publication=pnas&sortBy=Earliest&target=default,,Proceedings of the National Academy of Sciences: Keyword search for query,2026-04-06 07:00:00+00:00,10.1073/pnas.2531865123,Charlotte Grossiord,,"The capacity of trees to withstand intensifying hot drought events depends on the coordination between hydraulic safety and leaf thermoregulation, yet the limits of this coordination under chronic stress remain poorly understood. Here, we show that 5 y of chronic soil moisture limitation fundamentally constrains the capacity of leaves to maintain adequate thermoregulation. Focusing on two temperate tree species with contrasting water-use strategies, European beech (
                    Fagus sylvatica
                    ) and downy oak (
                    Quercus pubescens
                    ), which were subjected to a 5-y manipulation of soil moisture and air temperature, we tested how acclimation influences leaf thermoregulation, hydraulic safety margins (HSMs), thermal safety margins (TSMs), and leaf scorching. Under sustained heating with ample soil water availability, both species acclimated to maintain stable leaf temperature and positive TSMs despite warmer conditions, demonstrating that thermal acclimation is possible without hydraulic stress. By contrast, chronic soil drought narrowed HSMs and weakened evaporative cooling, reducing leaf thermoregulation capacity. When drought and heat co-occurred, stomatal closure triggered a runaway feedback loop: Impaired water transport led to loss of cooling, causing breaching of critical thermal thresholds. These events coincided with failures of photosystem II and scorching in drought-vulnerable beech, linking drought-induced stomatal limitation directly to thermal injury. Our results reveal that oak and beech can acclimate to warming alone, but not to simultaneous heat and drought, which together drive a hydraulic–thermal cascade exceeding both safety margins. This interaction sets fundamental limits on the resilience of temperate forests to future hot droughts.",crossref
Proteome-wide prediction of interactions between structured domains and peptide motifs reveals functionally coherent subnetworks,https://www.pnas.org/doi/abs/10.1073/pnas.2527957123?mi=eymic2&af=R&access=on&content=articlesChapters&publication=pnas&sortBy=Earliest&target=default,,Proceedings of the National Academy of Sciences: Keyword search for query,2026-04-06 07:00:00+00:00,10.1073/pnas.2527957123,Barry Honig,,"Many protein–protein interactions (PPIs) are mediated by the binding of short linear motifs (SLiMs) to peptide recognition domains (PRDs). Here, we describe PrePPI-SLiM, a proteome-scale computational pipeline that leverages data from the Eukaryotic Linear Motif (ELM) database to predict whether two proteins will form a peptide-mediated complex. The ELM database defines classes of protein–peptide interactions with SLiMs represented by sequence motifs and PRDs represented by Pfam domains. PrePPI-SLiM systematically evaluates all pairwise combinations of proteins within a proteome and identifies PRD–SLiM pairs that occur in the same ELM class. This evidence together with disorder prediction and sequence conservation of the motif are integrated in a naïve Bayes framework to assign a likelihood for complex formation. To obtain potential PDB templates for atomistic models of PrePPI–SLiM interactions, we associate individual PPI predictions with homologous PDB complexes involving the same PRD Pfam domain and SLIM, and obtain PDB templates for 92% of our high-confidence predictions. Moreover, studies with AF3Complex suggest that prior knowledge of the interacting PRD and SLiM, as provided here, is a critical starting point for creating a 3D model of the specific sequences of the PRD and SLiM query proteins. Finally, we demonstrate that clustering of the high-confidence PrePPI-SLiM interactome yields functionally coherent PPI networks that reveal mechanistic insights into cellular processes. The PrePPI webserver provides convenient access to high-confidence PrePPI-SLiM predictions, PDB templates for modeling, and functional networks.",crossref
"Correction for Lazzaroni et al., Wolves respond differently to human cues as they expand into urban landscapes",https://www.pnas.org/doi/abs/10.1073/pnas.2609972123?mi=eymic2&af=R&access=on&content=articlesChapters&publication=pnas&sortBy=Earliest&target=default,,Proceedings of the National Academy of Sciences: Keyword search for query,2026-04-06 07:00:00+00:00,10.1073/pnas.2609972123,,,,
QnAs with Yukiko Yamashita,https://www.pnas.org/doi/abs/10.1073/pnas.2608498123?mi=eymic2&af=R&access=on&content=articlesChapters&publication=pnas&sortBy=Earliest&target=default,,Proceedings of the National Academy of Sciences: Keyword search for query,2026-04-06 07:00:00+00:00,10.1073/pnas.2608498123,Sandeep Ravindran,,,
An insect that cooperates like bacteria,https://www.pnas.org/doi/abs/10.1073/pnas.2605413123?mi=eymic2&af=R&access=on&content=articlesChapters&publication=pnas&sortBy=Earliest&target=default,,Proceedings of the National Academy of Sciences: Keyword search for query,2026-04-06 07:00:00+00:00,10.1073/pnas.2605413123,Ashleigh S. Griffin,,,
Structural innovation and flexibility in plant chemical defenses,https://www.pnas.org/doi/abs/10.1073/pnas.2606250123?mi=eymic2&af=R&access=on&content=articlesChapters&publication=pnas&sortBy=Earliest&target=default,,Proceedings of the National Academy of Sciences: Keyword search for query,2026-04-06 07:00:00+00:00,10.1073/pnas.2606250123,Martin Volf,,,
Isocyanate Chemistry Enables a Stable Electrode‐Electrolyte Interface for Potassium Metal Batteries,https://advanced.onlinelibrary.wiley.com/doi/10.1002/aenm.70912?af=R,,Wiley: Advanced Energy Materials: Table of Contents,2026-04-06 07:40:32+00:00,10.1002/aenm.70912,Lin Guo,,"ABSTRACT
                  
                    Potassium metal batteries (KMBs) have currently been regarded as one of the most promising energy storage devices for achieving high energy density. However, some inevitable challenges including high reactivity of metallic potassium, dendrite growth, and huge volume expansion impose a heavy burden on potassium metal batteries. Herein, an isocyanate molecule – 4‐(trifluoromethoxy)phenyl isocyanate (TPI) is proposed to tailor the electrolyte solvation structure and interfacial chemistry in KMBs for the first time. The as‐obtained electrolyte exhibits enhanced ionic conductivity, excellent electrode wettability and high exchange current density. Due to the energy levels difference, TPI preferentially accepts or donates electrons and undergoes redox reactions faster, thereby reducing the excessive decomposition of solvent molecules. Moreover, its inherent excellent film‐forming property could form a protective layer at the electrode interface, effectively inhibiting the electrolyte decomposition and the adverse reactions caused by potassium metal. When assembled symmetrical batteries, at a current density of 0.5 mA cm
                    −2
                    and 0.5 mAh cm
                    −2
                    , the electrolyte could stably run for more than 1400 h. The PTCDA||K full‐cells could cycle 2000 times with good stability, and the Coulombic efficiency remained at approximately 99.84%. This strategy presents a promising pathway toward achieving performance metrics in KMBs.",crossref
[ASAP] Customizing Ferrocene Units into Atomically Precise Cu11 Clusters for Boosting Oxygen Reduction to H2O2,http://dx.doi.org/10.1021/jacs.5c16073,,Journal of the American Chemical Society: Latest Articles (ACS Publications),2026-04-06 08:21:17+00:00,10.1021/jacs.5c16073,Di Sun,,"Precisely integrating an organometallic compound into atomically defined copper clusters holds great promise for boosting catalytic performance and uncovering detailed structure-activity relationships. Herein, we report the first successful synthesis of atomically precise copper clusters (Cu11-DPPF, DPPF = 1,1-bis(diphenylphosphino)ferrocene) carrying ferrocene units using DPPF and cyclohexanethiol as coligands through a straightforward, scalable, and versatile synthetic strategy, which is also applicable to synthesize its analogous Cu11-DPPM (DPPM = bis(diphenylphosphino)methane) and Cu11-DPPE (DPPE = 1,2-bis(diphenylphosphino)ethane) clusters. All three Cu11 clusters exhibit a similar structural feature like a cloverleaf-like rotational assembly, comprising three fused butterfly-shaped Cu5S7P2 subunits. Among them, Cu11-DPPF exhibits superior catalytic performance in the two-electron oxygen reduction reaction (2e- ORR), achieving H2O2 selectivity exceeding 97.5% within the whole potential range of 0.35 to 0.55 V versus the reversible hydrogen electrode (RHE), fully deserving to be called the optimal 2e- ORR catalyst in the metal cluster community. DFT simulations, in conjunction with multiple characterization techniques such as operando infrared spectroscopy and X-ray absorption fine structure spectroscopy, reveal that the introduction of ferrocene units in Cu11 clusters facilitates favorable electron redistribution, which optimizes the adsorption of OOH* in the rate-determining step, thereby promoting efficient conversion of OOH* to H2O2. The practical efficacy of Cu11-DPPF is further demonstrated in Fenton-like reactions for hydroxyl radical-initiated pollutant degradation via in situ H2O2 generation. This work provides crucial insights into the design of atomically precise ferrocene-functionalized copper cluster hybrid catalysts and deepens our understanding of their structure-activity relationships in 2e- ORR pathways for H2O2 production.",pubmed
[ASAP] Chiral Pyridoxals Enabled Efficient Enantioselective Synthesis of α-Substituted Tryptophan Derivatives,http://dx.doi.org/10.1021/jacs.6c03032,,Journal of the American Chemical Society: Latest Articles (ACS Publications),2026-04-06 09:10:29+00:00,10.1021/jacs.6c03032,Baoguo Zhao,,"Tryptophan derivatives represent privileged molecular architectures in chemical biology and medicinal chemistry. Although extensive efforts have been devoted to their diversification, tryptophan analogues bearing an α-quaternary stereogenic center are highly bioactive yet synthetically challenging subclass. The direct and modular union of an indole-based electrophilic template with an N-unprotected amino acid nucleophile would provide an exceptionally efficient approach to such α-quaternary tryptophan derivatives. Here we report an axially chiral pyridoxal-catalyzed, enantioselective conjugate addition that forges the key C-C bond between indolenyl vinylogous imino electrophiles and N-unprotected α-substituted glycine esters. Under mild conditions, this organocatalytic protocol delivers structurally diverse α-quaternary tryptophan derivatives in up to 94% yield and 99% ee, and exhibits broad tolerance toward indole ring substitution as well as α-alkyl substituted glycinates. This carbonyl catalysis strategy establishes a modular and efficient platform for accessing α-quaternary tryptophan derivatives, underscoring the unique capability of carbonyl catalysis in the synthesis of structurally complex chiral amine compounds.",pubmed
Stimuli‐Responsive Silsesquioxane Nanozymes for Organocatalysis in Water and Prodrug Activation in Cells,https://onlinelibrary.wiley.com/doi/10.1002/anie.8446184?af=R,,Wiley: Angewandte Chemie International Edition: Table of Contents,2026-04-06 09:13:51+00:00,10.1002/anie.8446184,Pierre Picchetti,,"ABSTRACT
                  Synthetic nanozymes have emerged as promising alternatives to natural enzymes for catalytic and therapeutic applications, yet their limited stability, aqueous compatibility, and catalytic scope impede broader utilization. Here, we report a mild, one‐step sol–gel synthesis that yields ultrasmall, water‐stable octa‐amino silsesquioxanes functioning as metal‐free nanozymes. These minimalistic nanostructures exhibit aldolase‐like organocatalytic activity in water and enable dynamic, stimuli‐responsive modulation of catalysis through reversible supramolecular aggregation and disaggregation triggered by specific chemical inputs, thus forming a multifunctional platform for tunable catalysis and biomedical applications. Structural simplicity, stability, and functional versatility together permit tunable, enzyme‐like catalysis in water without auxiliary surfactants or phase‐transfer additives. Furthermore, the nanozymes display high biocompatibility and efficient cellular internalization, enabling their use in living cells, for instance, as intracellular prodrug activators via retro‐aldol activation of a doxorubicin prodrug in human glioblastoma and metastatic melanoma cells, resulting in selective cytotoxicity. This system provides a cost‐effective, sustainable, and scalable platform for water‐compatible, metal‐free organocatalysis that bridges abiotic catalysis and biological function. These findings demonstrate how rationally designed silsesquioxane frameworks can emulate natural enzyme reactivity while integrating adaptive, stimuli‐responsive behavior, broadening the applicability of synthetic nanozymes to catalytic and therapeutic contexts.",crossref
Tailoring the Bulk and Interfacial Environments of Hard Carbons for High‐Rate and Low‐Temperature Sodium‐Ion Batteries,https://advanced.onlinelibrary.wiley.com/doi/10.1002/adma.73018?af=R,,Wiley: Advanced Materials: Table of Contents,2026-04-06 09:14:38+00:00,10.1002/adma.73018,Bo Song,,"ABSTRACT
                  
                    Hard carbons (HCs) are promising anodes for sodium‐ion batteries (SIBs) but suffer from irreversible Na
                    +
                    trapping, inadequate rate capability, and compromised low‐temperature performance, primarily due to microstructural defects and suboptimal surface chemistry. Herein, an in situ‐transformation carbonization strategy is proposed to synthesize surface low‐concentration N, P‐doped hard carbons (NP‐HCs) for high‐rate and low‐temperature SIBs. A heteroatom‐enriched polyphosphazene is conformally coated onto poplar wood precursors, with triethylamine playing a dual‐function role in facilitating polymerization and precursor modification. This strategy endows the NP‐HCs with a tailored interfacial environment for fast Na
                    +
                    desolvation and transport, while establishing a bulk environment featuring abundant closed pores and expanded interlayer spacings. Consequently, NP‐HCs deliver an ultrahigh reversible capacity of 428.8 mAh g
                    −1
                    and outstanding rate capability (272.6 mAh g
                    −1
                    at 10 C). Notably, remarkable low‐temperature performance is achieved, with exceptional rate capability and cycling stability (93.1% capacity retention over 1200 cycles) at ‐20°C, underscoring their robustness under extreme conditions. Operando/ex situ characterizations coupled with computational studies reveal Na‐storage mechanisms and accelerated kinetics, offering critical insights for high‐performance HCs.",crossref
4‐Dimethylaminophenol: A ‘Smaller’‐Molecule PPI Inhibitor Targeting the PSD95 GK Domain Against Ischemic Stroke,https://onlinelibrary.wiley.com/doi/10.1002/anie.4654079?af=R,,Wiley: Angewandte Chemie International Edition: Table of Contents,2026-04-06 09:21:03+00:00,10.1002/anie.4654079,Qin Ouyang,,"ABSTRACT
                  Protein–protein interactions (PPIs) represent challenging yet promising therapeutic targets. This study identifies 4‐dimethylaminophenol, an ultralow molecular weight compound (137 Da) from a fragment‐based library, as a novel PPI inhibitor targeting the Guanylate Kinase‐like (GK) domain of postsynaptic density protein 95 (PSD95). The direct binding of 4‐dimethylaminophenol with PSD95 GK was confirmed by X‐ray crystallography. Crucially, we uncovered a previously unknown PDZ‐independent interaction between the PSD95 GK domain and neuronal nitric oxide synthase (nNOS). 4‐Dimethylaminophenol inhibited this PSD95/nNOS interaction, reducing nitric oxide (NO) overproduction and neuronal excitotoxicity, thus exerted neuroprotective effects in vitro and in vivo. Moreover, structure–activity relationship (SAR) study showed that the phenolic hydroxyl and dimethylamino groups were crucial to the activity, and the introduction of ortho‐halogen substitution could enhance binding affinity. Leveraging its established clinical application as a cyanide antidote, low molecular weight, blood–brain barrier permeability (BBB) and proven neuroprotection, 4‐dimethylaminophenol presents a promising neuroprotective lead for drug discovery targeting ischemic stroke. The study also highlights the potential of the smaller molecules as PPI inhibitors, offering new insights into drug development of small‐molecule PPIs.",crossref
Multiscale Manufacturing of Organic Electronic Materials,https://advanced.onlinelibrary.wiley.com/doi/10.1002/adma.202509949?af=R,,Wiley: Advanced Materials: Table of Contents,2026-04-06 09:26:26+00:00,10.1002/adma.202509949,Dacheng Wei,,"ABSTRACT
                  The application of organic electronics relies on reliable material manufacture. Owing to their multiscale structural characteristics, organic electronic materials face great opportunities and challenges in some unique applications compared with silicon‐based semiconductors. Understanding the relationships among material structure, processing and properties is highly desirable for the multiscale manufacturing of organic functional devices. Recently, researchers have made significant progress in this field, achieving reliable fabrication across multiple scales, from molecular‐scale devices to micro/milli‐scale wearable systems and macroscale organic solar cell modules, to meet the specific requirements of various application scenarios. This review aims to summarize the latest advancements in multiscale manufacturing of organic electronic materials. It introduces multiscale structures and properties of organic semiconductors, with an emphasis on elucidating the structure–property relationship. Subsequently, different technologies for multiscale manufacturing and their advanced applications in organic electronics are discussed. Finally, potential challenges and prospects for the multiscale manufacture of organic electronic materials are proposed. This review could help in choosing appropriate manufacturing technologies to achieve optimal performance of organic electronic devices based on the properties of organic materials.",crossref
Charge‐Tunable Dense Dual‐Atom Nanozymes Reprogram Biothiol Metabolism Through Multi‐Enzyme‐Mimetic Catalysis to Synergistically Induce Ferroptosis and Disulfidptosis,https://onlinelibrary.wiley.com/doi/10.1002/anie.202524634?af=R,,Wiley: Angewandte Chemie International Edition: Table of Contents,2026-04-06 09:26:54+00:00,10.1002/anie.202524634,Hongjie Zhang,,"ABSTRACT
                  Biothiols play a pivotal role in maintaining cellular redox homeostasis, coordinating programmed cell death pathways, and modulating immune responses. Reprogramming biothiol metabolism in tumor cells thus presents a promising strategy for enhancing anti‐tumor immunity. Here, we report the rational design of a densely accessible heteronuclear Fe/Co dual‐atom nanozyme (FeCo DDA), which mimics natural flavoenzymes by coordinating high‐density Fe and Co active centers to regulate biothiol metabolism and induce intracellular disulfide accumulation. The dense heteronuclear diatomic catalytic center (with Fe and Co mass fractions of 10.35% and 11.32%, respectively) optimizes the Bader charge and d‐band center by adjusting electron redistribution, endowing it with excellent mimetic enzymatic activities for catalyzing the oxidation of biothiols to disrupt the homeostasis of tumor cells. Simultaneously, co‐loaded phlorizin inhibits glucose uptake, further driving compensatory cystine accumulation and disrupting glutathione biosynthesis. This dual action synergistically induces ferroptosis‐enhanced disulfidptosis, disrupting redox homeostasis and triggering immunogenic cell death. As a result, FeCo DDA co‐loaded with phlorizin (FeCo DDA/P) not only enhances tumor cell immunogenicity but also reshapes the immunosuppressive tumor microenvironment, thereby potentiating anti‐tumor immune responses. This work highlights a dual‐atom nanozyme strategy to reprogram tumor metabolism and orchestrate multimodal cell death for effective tumor immunotherapy.",crossref
[ASAP] Dynamic Double Carbaporphyrin-Fused Nanographene: Facile Monolayer and Persistent Bilayer Switching,http://dx.doi.org/10.1021/jacs.5c22919,,Journal of the American Chemical Society: Latest Articles (ACS Publications),2026-04-06 09:50:26+00:00,10.1021/jacs.5c22919,Xian-Sheng Ke,,"Manipulating the dynamic processes of nanographenes, from conformational flipping to supramolecular dimerization, is essential for gaining precise control over their properties and functions. In this study, a nanographene with two fused carbaporphyrin units (HBC2P) was synthesized by introducing dipyrromethene units into opposite bay areas of hexa-peri-hexabenzocoronene (HBC). HBC2P has a flexible monolithic skeleton, with a backbone length exceeding 1.8 nm. Its two conformations, referred to as ""boat-shaped"" and ""chair-shaped,"" were individually achieved by selecting a suitable solvent. Notably, HBC2P forms a stable bilayer structure with two ""boat-shaped"" monomers arranged back-to-back in the polar solvents. Moreover, its flexible structure can be fixed by metal coordination, where the hollow ribbon-like nanographene is transformed into a planar metallized nanographene after the insertion of two Cu(III) ions. This metallization modulates the assembly behavior and terminates the dimerization behavior observed in the free-base form. This work provides a unique example of a nanographene that is fully tunable in its monomeric and dimeric forms, forms a stable bilayer in polar solvents, and has an assembly behavior that can be tuned further through metalation. The clarification of the structure-photophysical property relationships of such a dynamic nanographene offers guiding principles for the rational design of molecular bilayer graphenes and related π-conjugated systems with both tailored structures and tailored properties.",pubmed
[ASAP] Roles of Slab-Gliding-Induced Surface Nano-Steps in High-Voltage Instability of LiCoO2,http://dx.doi.org/10.1021/jacs.5c20351,,Journal of the American Chemical Society: Latest Articles (ACS Publications),2026-04-06 10:29:04+00:00,10.1021/jacs.5c20351,Qinghe Zhao,,"Rapid capacity decay caused by lattice oxygen (lattice-O) loss under high-voltage operation remains a critical challenge for layered LiCoO2 (LCO) cathodes. Recently, various surface modification strategies have been explored to suppress lattice-O loss, yet the underlying mechanisms remain controversial. Herein, we identify slab-gliding-induced surface nanosteps on LCO and elucidate their role in driving lattice-O loss. These nanosteps (10-20 nm per step) are induced by local Co-O slab gliding during phase transitions upon deep delithiation, thereby exposing numerous active lattice On- (0 < n < 2) sites on the (003) and (104) planes, where oxygen vacancies (OVs) can form with significantly reduced formation energies. Consequently, this accelerates lattice-O loss and promotes the formation of a surface Li+-blocking layer, ultimately causing a rapid capacity decay. We further demonstrate that even if a rock-salt (RS) phase forms electrochemically in situ (e-RS) on the LCO surface, it fails to suppress the lattice-O loss due to the emergence of surface nanosteps. In contrast, a prefabricated RS layer (p-RS) with enhanced mechanical robustness effectively inhibits the formation of such nanosteps, thereby intrinsically suppressing lattice-O loss during cycling. This work identifies slab-gliding-induced surface nanosteps as a key structural trigger for lattice-O loss and demonstrates that prefabricated RS coatings offer an effective route to stabilize high-voltage LCO cathodes.",pubmed
